2/18/2022,"As a wine writer, you might imagine that I enjoy being handed the wine list at restaurants, but, like many of you, I suspect, I usually groan inwardly. Finding a wine that everyone will enjoy and that goes with everything you’re eating is a tall order, and even if you spot one that you think will do the job, you still have to hope that everyone will be as willing as you are to pay for it. Mind you, it’s often not a bad plan simply to order the cheapest wine on the list in any restaurant that cares about the quality of its wine offering, because it will probably be more than decent. I remember once going to the three Michelin-starred Michel Bras in France to find a local wine listed at just €15 (about £12.50), an object lesson to other restaurants that take themselves far too seriously.  My approach is simple: I almost always order something I don’t recognise or haven’t tried, because that’s one of the best ways of discovering new wines and getting the chance – which you don’t have at tastings – to try them with food. You can mitigate the risk by ordering by the glass, although many restaurants, including The Old Pharmacy in Bruton, Somerset, where I discovered the delicious L’Abrunet Negre in today’s pick, will give you a sip to try. And do get over the idea that sommeliers are out to fleece you: most will be delighted to make a recommendation, and it’s up to you to indicate what style of wine you like and what you can afford. A lot of wines in the more interesting new restaurants these days are natural, so you also need to disabuse yourself of the idea that they’re all funky and weird. A few will be, sure, but most aren’t. As with food, it’s more a question of what your previous experience is. Wines such as the Chilean La Patagua in today’s pick might look unfamiliar because they’re unfiltered, but they are really delicious. Again, ask your server if you’re uncertain. If you haven’t tried natural wine before, just say so, and ask for something that’s not too scary. I really don’t think people have enough conversations about wine in restaurants – maybe because they’re nervous about appearing to lack knowledge – but being in a good restaurant or wine bar is a brilliant way to learn. Finally, look out for older vintages on any list. Supermarkets by and large sell the most recent vintage, but good restaurants and pubs will often pick up odd bottles and bin ends for customers who they know will appreciate them. Be one of them. La Patagua 2021 £9 lola.co.uk, £9.05 Les Caves de Pyrène, 14.5%. Mouthwateringly delicious, slightly hazy semillon from Chile, unusually. A perfect wine bar white. Domaine d’Escausses Gaillac Cuvée des Drilles 2019 £10.90 Joseph Barnes Wines, 13.5%. Dryish, with a bitter cherry twist, this south-western French red is a classic bistro wine that would be as good with charcuterie as with steak frîtes. Frisach L’Abrunet Negre Terra Alta 2020 £14 littlewine.co, £14.40 Uncharted Wines, 13.5%. Joyous, juicy Catalan red, a blend of garnacha and carinena, that would be a great match for tapas. Domaine de la Semellerie Chinon Rosé 2020 £11.99 Virgin Wines, 12.5%. Even at this time of year, you get the odd sunny day that cries out for a glass of rosé, and this light, pretty one from the Loire totally hits the spot.  For more by Fiona Beckett, go to matchingfoodandwine.com",Lifestyle/Food,Everything you wanted to know about wine lists but were afraid to ask,https://www.theguardian.com/food/2022/feb/18/everything-you-wanted-to-know-about-wine-lists-but-were-afraid-to-ask
2/18/2022,"Caroline Flack’s mother has said she cannot properly come to terms with her daughter’s death while questions remain over the Metropolitan police decision to charge the TV star with assault. The police watchdog has instructed Scotland Yard to review a complaint that the Love Island and X Factor presenter was treated differently by the force when she was facing prosecution for assaulting her boyfriend because she was a celebrity.  Christine Flack believes the police decision to press ahead with charging her daughter over the incident – rather than giving her a caution as prosecutors advised initially – contributed to her taking her own life at her home in London on 15 February 2020. “I can’t get her back,” Flack said in an interview with the Guardian. “I just want the police to come out and say: we really shouldn’t have gone back to the Crown Prosecution Service, there wasn’t enough to charge her. I don’t want anything from them other than to say they got it wrong.” Flack, who first complained to the Met a month after Caroline’s death, said she cannot relent in her fight to clear her daughter’s name. “Carrie wasn’t an abuser. I can’t give up because people are still writing that now, two years after her death. It needs someone in authority to come out and say that wasn’t true,” she said. “You just can’t put her to rest properly with all that negativity round her. You think about it every day. I find myself apologising for her, and I shouldn’t.” The TV host was arrested in December 2019 and charged with attacking her boyfriend, Lewis Burton, with a lamp at their home in Islington, north London. She had pleaded not guilty, having previously told police that she accidentally hit Burton with a phone while he slept. She killed herself two months later, days before the start of what her mother later called a “show trial”, since Burton had said he did not support a prosecution. Last March, the Met told Christine Flack it was satisfied the service provided by the officer who made the decision to charge Caroline was acceptable. But in August, after she asked the Independent Office for Police Conduct (IOPC) to review the case, it directed the Met to reinvestigate one element of her complaint: whether the decision was in line with standard practice, “and to establish if there was any difference in the way in which the process had been followed in this case on account of a person’s celebrity”. Flack said she worried that negative coverage by the tabloid press, which had long critically scrutinised her daughter’s love life, and abusive social media posts could have affected the police’s judgment. An inquest into the TV host’s death in 2020 heard that she had self-harmed at the scene of the alleged assault and was taken to hospital for a psychiatric assessment but deemed fit for police interview. “The police could see she tried to commit suicide that night,” her mother said. “She had hurt herself before and as a teenager attempted suicide.” A coroner ruled the presenter had taken her own life because she knew she was facing prosecution and feared the negative publicity the trial would attract. “She couldn’t get over that people might find out that she was actually vulnerable,” Flack added. “She did hide it really well.” Flack said the unanswered questions about her daughter’s prosecution aggravated her grief. “I don’t sleep,” she said. “I don’t want to sound sorry for myself but I can cope with things because I take tablets from the doctor. And I’m frightened to stop taking those because I think it all becomes a bit real then.” She added that she dreaded receiving monthly updates from the Met about the ongoing investigation. “Your stomach goes over,” she said. “Although I want answers, you’re frightened to look because you think well it’s just gonna be: ‘Oh, there was nothing wrong.’” Despite their ongoing trauma, Flack, who lives in Norwich, said her family was able to remember Caroline warmly on the second anniversary of her death on Tuesday. Together with her eldest daughter, Lizzie, her son Paul and Caroline’s twin, Jody, she visited Caroline’s memorial bench in Norfolk. “It was pouring with rain and windy. And Lizzie looked at me and said: ‘Mum, Carrie wouldn’t have come, would she?’ And I said: ‘No, she’d have made some excuse.’ We just laughed.” In a statement confirming the reinvestigation of one element of Christine Flack’s complaint earlier this week, the Met said: “Our thoughts and sympathies remain with Caroline’s family.” In the UK and Ireland, Samaritans can be contacted on 116 123 or email jo@samaritans.org or jo@samaritans.ie. In the US, the National Suicide Prevention Lifeline is 1-800-273-8255. In Australia, the crisis support service Lifeline is 13 11 14. Other international helplines can be found at www.befrienders.org.",Arts/Television & radio,Christine Flack: ‘I just want the police to say they got it wrong’,https://www.theguardian.com/tv-and-radio/2022/feb/18/christine-flack-i-just-want-the-police-to-say-they-got-it-wrong-caroline-flack
2/18/2022,"When Simon Rogan and his family moved to Cumbria in 2002, the Lake District was famed for many reasons but food was not top of the menu. Visitors came in droves for the hills, rather than the haute cuisine. Twenty years later their feted village restaurant, L’Enclume, is at the centre of a “mind-blowing” culinary renaissance that has led some diners to compare Cumbria to international foodie havens such as Paris, San Sebastián and Copenhagen.  The comparisons are not so outlandish: Cumbria now has more Michelin stars than any other UK county, and L’Enclume this week became the first restaurant outside London or Berkshire to win the coveted three stars. Not bad for the land of mint cake and spicy sausage. “This is a cluster in a world-class landscape. It is not just nationally significant but it’s globally significant,” said Thom Hetherington, an industry judge and chief executive of the Northern Restaurant and Bar show in Manchester. L’Enclume, housed in a 13th-century former blacksmith’s in the ancient village of Cartmel, on the southern tip of the Lake District, focuses on seasonal “farm-to-fork” dining, using only produce from Rogan’s nearby 4.8-hectare (12-acre) farm and other local providers. A day after its third Michelin star was announced, the champagne corks have been cleared away and quiet chatter fills the small dining room of oak beams and low ceilings. Guests wait months for a seat in Rogan’s restaurant, where a 10-course lunch menu costs £100. By this weekend, L’Enclume is expected to be fully booked until 2023. “We’re not the only ones who are fully booked – all the restaurants are in the Lake District,” said Rogan, adding that the local hospitality industry had “exploded” since restaurants reopened after the pandemic. This is partly explained, he said, by the region shrugging off hackneyed stereotypes about northern cuisine – bread and dripping, chips and gravy – and becoming a gastronomic counterweight to London. A new breed of visitor has discovered, or rediscovered, the Lakes during lockdown: the young, free-spending millennial. This younger generation of diner has helped shift a “lazy” perception of the north and its grub: “There has been this ‘grim up north, nothing really happens up there’ attitude but Covid has smashed that out of the park,” Rogan said. Cumbria now has one star for every 48,000 people, compared with one for every 98,000 in London. The Dog and Gun inn, a family-run gastropub in the village of Skelton, near Penrith, was the latest to be added to the list this week. Hetherington, a judge in the annual National Restaurant Awards, said the density of world-class restaurants in Cumbria was “mind-blowing” and that northern England was now “starting to punch above its weight” as a culinary destination. “You look at affluent, international, serious foodies travelling all over the world and they want to go to Tokyo or Paris and San Sebastián or Copenhagen. For me, the Lake District is absolutely at that level,” he said. “If you went back 20, 25 years there was certainly some truth in the idea that the food scene in the north of England was significantly lagging behind London,” he added. “I think that has not only levelled up, but it’s almost tipped in the north’s favour now.” Last year’s National Restaurant Awards said four out of five of the UK’s best restaurants were in northern England, while four of the top five gastropubs were in Yorkshire and Lancashire. Rogan, who now has four Michelin stars to his name (another restaurant, Rogan & Co has one star), ascribes the north’s success in part to the ever-growing British appetite for sustainable, locally sourced produce and increasingly “savvy” local farmers, whom he says have “really upped their game” in recent years. Top chefs are also drawn to the region in search of a better quality of life and more affordable property. Two of Rogan’s proteges, Tom Barnes and Paul Burgalières, were lured to work in sleepy Cartmel (population: 4,000) from one of the world’s stellar restaurants, Geranium in Copenhagen. Rogan, who joins the UK’s small pantheon of three-star chefs, who include his former mentor Marco Pierre White, said the accolade was “a dream come true” – but that he was “gutted” his Windermere restaurant, Henrock, had missed out. He is confident, however, that more awards will follow. “There’s other places knocking on the door and sleeping giants that are waking up,” he said. “Every chef or operator wants a piece of it and it’s attracting incredible talent to the county now. I do see a lot more Michelin stars.”",Lifestyle/Food,How L’Enclume’s Michelin win is taking Cumbria to the top of the foodie table,https://www.theguardian.com/food/2022/feb/18/how-lenclumes-michelin-win-is-taking-cumbria-to-the-top-of-the-foodie-table
2/18/2022,"Brandon Brown was not an especially fearsome stock car driver, nor did he figure as the sort to crack open sport’s Pandora’s box entering last October’s Sparks 300 – a race in Nascar’s mid-tier Xfinity series. In most cases a mid-pack qualifying position would not bode well. But at Talladega Speedway, a crash-happy oval circuit where anything can happen, the best drivers are the ones who survive the carnage. And after two multi-car pile ups, Brown assumed a narrow lead with 13 laps to go. A final accident two laps later that took out seven cars sealed his first Xfinity series triumph in 114 tries. With night falling on the Alabama circuit, the 28-year-old Virginia native emerged from his Chevrolet Camaro machine in a daze for the post-race TV interview. As he breathlessly thanked his sponsors and revisited his driving tactics, some in Talladega’s packed crowd began chanting “Fuck Joe Biden” loud and clear enough to come across Brown’s microphone. Desperate to keep the interview going with her producers unable to bleep the background noise, NBC Sports reporter Kelli Stavast tried to Jedi mind trick her viewers. “You can hear the chants from the crowd – Let’s go, Brandon,” she said.  Since then, Let’s Go Brandon has gone from awkward TV moment to harmless meme to conservative dog whistle on par with Maga hats and OK hand gestures – a way of insulting the president without triggering censorship. It adorns lawn signs and bumper stickers. One guy said it directly to Biden last Christmastime as the president and first lady were taking calls into Norad’s Santa tracker from the Eisenhower Executive Office Building. Another guy got kicked off a flight this week for having Let’s Go Brandon writ small on his facemask. As the slogan exacerbates the deepening political divide in the country, Brown has so far struggled in his attempts to ride the median. Brown laughed off the Let’s Go Brandon cheers initially, then went silent when it morphed into something more sinister. Finally, in a December New York Times interview, he expressed a wish to distance himself from the now politically charged slogan, not wanting to cost his family-run team hundreds of thousands in potential sponsorship support. “If they’re going to use my name,” Brown, a Republican, said of his fellow conservatives, “I’d like for it to be productive.” In a subsequent Newsweek op-ed titled My Name Is Brandon, he described himself as a driver “in the passenger seat of my own viral moment,” albeit a squarely middle-class one with a lot of thoughts about inflation affecting prices at the pump. (“I buy more gas than most,” he quipped.) Still, he was quick to assure readers that he wasn’t “going to tell anyone how to vote” or had any “interest in leading some political fight.” But then just before the new year, Brown appeared to quickly abandon those ideals for a two-season, eight-figure sponsorship pact with LGBcoin.io, a cryptocurrency that’s literally short for Let’s Go Brandon. The announcement unveiling Brandon’s red, white and blue repainted car called him “truly America’s driver.” But as with most things crypto, the wealth infusion – a lifeline for a family-run racing operation that came close to closing its doors – disappeared as quickly as it arrived. But instead of a cyber raider or a pyramid scheme it was Nascar president Steve Phelps who pumped the brakes on the deal out of a desire to unseat the sport from any politics on either side of the aisle, lest it turn off the new fans the sport urgently seeks. And then the invisible hand of the crypto market dealt the finishing blow. After achieving a peak liquidity pool value of $6.5m at the start of the year, the coin crashed and burned. It is now worth close to zero. The lost funding puts Brown back in the position of having to cobble together sponsors, an effort that will be obvious in the varying paint schemes and decals that adorn his car this year – beginning with the Saturday race that undercards Sunday’s Daytona 500. And Brown, who starts from the back of the pack yet again, will have his work cut out for himself throughout the season in the hustle for patronage. The Original Larry’s Hard Lemonade, a sponsor on Brown’s Talladega-winning car, dropped him in response to the bitcoin deal. “All money is not good money,” company founder Vic Reynolds cautioned in a farewell statement. Politically motivated sponsorship might seem toxic now, making it easier for Phelps to drop the hammer on Brown, but precedent suggests it’s only a matter of time before they have it both ways. Not only have drivers raced machines with Bush-Cheney and Trump-Pence livery in the recent past, but it wasn’t even two years ago that Bubba Wallace raced a Black Lives Matter car on the way to leading a campaign to banish displays of the confederate flag from the sport – although the organisation didn’t pay him for that exposure. Sponsorship dollars are hard enough to chase down in this economy. If anything, Brown may have unwittingly stumbled upon an untapped market: political zealots. If his efforts to exploit them continue to get struck down, don’t be surprised if this becomes the movement that emerges in response to Wallace’s progressive push on the way to Nascar becoming the next front in the raging culture wars – and here at least those zealots have a point. With everyone from the former president to mom-and-pops cashing in on the Let’s Go Brandon craze, it seems the only one who isn’t making much money off of this is the guy who inspired the whole thing –and arguably deserves to profit most. For now, though, Brown seems content not to push the issue while continuing the hustle for sponsorship. But, really, there’s no telling how soon he could find himself facing back inside a conference room with another would-be supporter with real money and right-wing ideology. At that point he’ll have to decide whether selling out is worth his soul and his sport’s, leaving the lid on Pandora’s box well in the dust. ",Sport/Sport,Let’s Go Brandon: the Nascar driver who became a hero in an unwinnable culture war,https://www.theguardian.com/sport/2022/feb/18/lets-go-brandon-nascar-chant-meme-joe-biden-brandon-brown-driver
2/18/2022,"This fixture means goals, and usually for Jürgen Klopp’s side. There have been 72 scored in 19 Premier League meetings between the teams with Liverpool grabbing 53 of them, including at least four in five of the past nine meetings. Mohamed Salah is one goal shy of becoming the 10th player to score 150 goals for Liverpool in all competitions and the team needs three more to reach 100 for the season. Norwich have scored the fewest away goals in the Premier League this term. Andy Hunter Saturday 3pm  Venue Anfield Last season n/a Referee Mike Dean This season G16 Y53 R1 3.38 cards/game Odds H 1-8 A 28-1 D 19-2 Subs from Kelleher, Adrián, Pitaluga, Gomez, Matip, Tsimikas, Milner, Oxlade-Chamberlain, Jones, Thiago, Elliott, Mané, Minamino, Origi Doubtful None Injured Jota (ankle, unknown) Suspended None Discipline Y31 R1 Form LDWWWW Leading scorer Salah 16 Subs from McGovern, Byram, Tzolis, Williams, Dowell, Gibbs, Rowe, Giannoulis, Zimmermann, Normann, Kabak Doubtful None Injured Sørensen (knee, 25 Feb), Krul (shoulder, Mar), Rupp (hamstring, Mar), Omobamidele (back, unknown), Idah (knee, unknown) Suspended None Discipline Y40 R1 Form LLWWDL Leading scorer Pukki 6",Sport/Football,Liverpool v Norwich: match preview,https://www.theguardian.com/football/2022/feb/18/liverpool-v-norwich-match-preview
2/18/2022,"Mimi Webb is proof that social media really can make a career. After her heartbreak ballads blew up on TikTok during the pandemic, she has risen through the ranks to become something of a breakout star, landing on the BBC Sound of 2022 shortlist. When she makes mention of TikTok tonight, the whole room erupts: it is the reason why so many teens have fallen for her internet-era takes on love and loss.  Webb is a self-confessed fan of Emeli Sandé and Sam Smith, and her blueprint is clear: big radio-friendly ballads peppered with Gen-Z references. Good Without, the weepy viral sensation that she saves until the show’s close, is executed flawlessly, while new song House on Fire ups the tempo with a healthy measure of spice, as she sweetly threatens arson in a fit of lovelorn revenge. It’s the kind of hyperbolic good humour that turns her fans wild: the song has only just been released but they’ve all heard the previews on TikTok and scream the words back into each other’s phones with glee. In between these gems, though, the evening starts to plod. Webb is a slick, professional performer. Her voice, a strong and husky alto-soprano, is one of true star potential, and her mega-watt smile remains undimmed as she paces the stage like it’s a treadmill. But she sticks devoutly to a well-rehearsed formula, trading spontaneous sincerity for an arsenal of cliches. Her shouts of “Hands up!”, “How we doing?” and “Stay hydrated!” are as unimaginative as many of her songs. On Lonely in Love, she demands for the millionth time for the crowd to “Sing with me!”, but the stadium chorus is pitched far too high, well out of the reach of her now-silent audience. It appears to shake her, a brief crack in an otherwise perfect veneer. As an artist who speaks to the most intimate of emotions, Webb clearly has heart. But her lack of vulnerability on stage suggests that she may still be holding her audience at arm’s length – almost as if she was looking at them through a screen.  At O2 Academy, Liverpool, 18 February, then touring.",Arts/Music,Mimi Webb review – algorithmic polish from TikTok’s heartbreak queen,https://www.theguardian.com/music/2022/feb/18/mimi-webb-live-review-leeds-stylus
