5/5/2022,"Ihave started getting feelings for my spoons. I blame Tim Hayward, restaurant critic for the Financial Times, for this. He wrote a brilliant piece last week about his search for the perfect spoon. At first glance this was a bit random, even for me. But before long I was with him all the way in his quest for the spoon of his dreams, a spoon of just the right depth, size, shape, length and other variables. I surveyed my spoon drawer and considered my feelings. I was disappointed to see I have no fewer than 17 wooden spoons. Disappointed because this implies a certain shallowness, as if I’m some kind of spoon lothario, collecting notches on my bedpost, focusing on quantity rather than quality. Stirring without love is just exercise, after all. But sorting through them, I realised I do have a favourite. It’s more of a spatula than a spoon, but it suits me very well. I had always looked out for it without knowing I was doing so and felt a twinge of disappointment if it didn’t come to hand. If ever I lost it for good, I now understood, I would miss it for ever. Could it just be me and the FT’s Tim who feel this way? My editor at BBC Radio 5 live did a good job of disguising her enthusiasm when I suggested a phone-in on the subject of our listeners’ favourite spoons. But she went with it, God bless her. I get significant stick for ruminating on ball-achingly mundane subjects like this and, I’ll be honest, on this occasion my confidence did start to waver. I needed back up, so FT Tim was booked to come on air with me. Just like great news organisations sometimes come together, pooling resources to pull off groundbreaking investigative journalism, here I assembled a mighty trinity of the BBC, the FT and the Guardian. All so I wouldn’t be left to shoulder the blame alone if the listeners balked at this madness. It didn’t start well. The first text in read: “Adrian, you’ve lost it luv, Carol”. Jonathan Agnew, our venerable cricket correspondent, came on to talk about the appointment of Ben Stokes as England captain, but began by asking me: “What’s all this about spoons? I think you need a lie down in a darkened room.” I asked him if he had a favourite spoon. “No,” he said. But it wasn’t long before I knew we were on to a winner. “My husband, Richard, aged 81, has a very favourite spoon,” texted Sue. “Routs about in the cutlery drawer to find it. He acquired it when he worked at the GEC at Witton in Birmingham and went to the Magnet Club works canteen every day for his lunch. So it dates back to around 1960. It has Magnet Club engraved on the handle. Memories are made of items like this.” Peter in Wimbledon, recently divorced, said it was the cutlery he missed most from his marriage. Someone else said they always used their least favourite spoon because it was a gift from their son. Oh yes, this was a rich vein of material we were mining. It all became rather moving. Ross from Streatley had framed a wooden spoon belonging to his nan. “It was her gravy spoon, half worn down over 50 years of use,” he texted. “It brings back so many memories.” Ian said: “I have two dessert spoons that my father had before me that I use every day. I lost my father 35 years ago this week.” A spoon as memento mori. Who knew? Karen in Edinburgh phoned in to tell us she was experiencing what she called spoon grief. A daft notion you may think, but it immediately made perfect sense. Her late mother’s serving spoon was missing, presumed lost. “Every time I go in that drawer, I feel so sad,” she said. “There was so much love in that spoon.”",Opinion/Opinion,I’ve no fewer than 17 wooden spoons. But I have a favourite and I’d miss it for ever if it went missing | Adrian Chiles,https://www.theguardian.com/commentisfree/2022/may/04/ive-no-fewer-than-17-wooden-spoons-but-i-have-a-favourite-and-id-miss-it-for-ever-if-it-went-missing
5/5/2022,"Sicily’s famed cascading limestone cliff may not be the obvious choice for the next takeover bid by the world’s richest man, but one Italian man is hoping for such an eventuality. Part of the island’s Turkish Steps is being readied for sale, with a call to Elon Musk to buy it. Ferdinando Sciabarrà, 72, who was last year officially declared owner of a slice of the cliff’s upper level after a long legal tussle with the local authority in Realmonte, Agrigento, and after years of complaints about the landmark’s upkeep, believes the multibillionaire would know how to look after it much better. The Scala dei Turchi, or Turkish Steps, is one of Italy’s most visited tourist sites and features prominently in the Inspector Montalbano books by the late author Andrea Camilleri. Sciabarrà, who formerly worked for the local chamber of commerce, staked his claim of ownership based on inheritance documents dating back to the 19th century. He was handed back his share of the cliff after being investigated for occupation of state-owned land. He said he was now putting it up for auction after requests to local and regional authorities to introduce measures to better protect the site, or turn it into a nature reserve, were snubbed. “It wasn’t even enough to say: ‘we will gift you the site’,” Sciabarrà told Corriere della Sera. “We got promises, but nothing else. Now, after a year, and with being worried about what looks like being another summer surge of tourists on the Scala, we are putting it up for auction, appealing first to Elon Musk.” The cliff, which is shaped like a huge staircase jutting into the Mediterranean from the coast of southern Sicily, has suffered erosion naturally but also from the huge number of tourists, some of whom have stolen pieces of rock, which consists of soft white limestone. In January, vandals defaced the landmark with red iron oxide powder. The site was temporarily closed and seized by prosecutors in early 2020 after complaints about its poor preservation. Sciabbarà was also investigated for crimes connected with the preservation of the site and ordered to pay a €9,100 (£7,600) fine last summer. “We wanted to donate it to the public administration, which remains ‘deaf’, we were also prevented from entrusting it to an environmental association,” Sciabarrà’s daughter, Angela, told Corriere. “Tourists should be allowed to visit safely with controlled access, and not via easily bypassable fences. Rockfall also needs to be prevented.”",News/World news,Sicilian offers Elon Musk chance to buy a slice of Scala dei Turchi cliff,https://www.theguardian.com/world/2022/may/04/sicilian-offers-elon-musk-chance-to-buy-a-slice-of-scala-dei-turchi-cliff
5/5/2022,"Anti-corruption campaigners and MPs have warned that “the kids of oligarchs” may have used their parents’ money to buy the right to live in the UK after it was revealed that the government granted “golden visas” to 46 people aged 21 or under. The Home Office on Wednesday disclosed that it approved 46 applications for the tier 1 investor visa scheme to those aged 21 or under over the last seven years, following a freedom of information request from Bloomberg. The golden visa scheme – which was scrapped in February over fears that it had been exploited by Russian oligarchs – was designed to attract wealthy people to the UK and required applicants to invest at least £2m. Thousands used it to secure fast-track rights to live and work in Britain, and the scheme was particularly popular with Russian and Chinese families. John Penrose, a Conservative MP who serves as “the prime minister’s anti-corruption champion”, said the revelation raised concerns that golden visas could have been “a loophole for kleptocrats’ children to live gilded lives in London funded by dirty money”. He added: “If golden visas were granted to the brightest and best young entrepreneurs, Britain will have benefited hugely from the jobs, energy and wealth which they will have created. “The answer is for the government to publish its long-promised review of golden visas, so we can see what really happened and when. Sunlight is the best disinfectant, as the saying goes.” It was previously revealed that eight Russian oligarchs on the UK sanctions list over their links to Vladimir Putin were also granted golden visas to live in Britain. The Home Office has declined to name the sanctioned individuals who were given visas, and who Johnson described as having “the blood of the Ukrainian people on their hands”. Dr Susan Hawley, the executive director of Spotlight on Corruption, said the latest revelation of potential abuse of the golden visa scheme was “deeply concerning”. “Due to a loophole in the golden visa regime, there were little to no checks on the source of wealth if the money was gifted to the person applying for the visa,” she said. “This means the kids of oligarchs may have used their parents’ money, possibly obtained through corruption, to secure UK residency, exemplifying yet again how the regime facilitated the flow of dirty money into the UK. “The government urgently needs to publish a report on the national security risks golden visas posed, so that there is a fuller understanding of these risks, and appropriate action is taken.” Launched in 2008, but with its origins in an investor route dating back to 1994, the scheme allowed people with at least £2m in investment funds and a UK bank account to apply for residency rights along with their family. The speed with which applicants were given indefinite leave to remain was hastened by how much money they planned to invest in the UK: £2m took five years, while £10m – a higher option introduced in 2011 – shortened the wait to two years. After the 2018 Salisbury poisonings of Sergei and Yulia Skripal, a former Russian military officer and his daughter, the government launched a review into the investors who were awarded visas from 2008 to 2015. The review has yet to be published. During a “blind faith period” between 2008 and 2015, 97% of investors were subject to scant checks on the legitimacy of their wealth leading to concerns about undesirable people slipping into the country, say critics. According to Spotlight on Corruption, 6,312 golden visas – half the number of all those issued – had been reviewed for “possible national security risks”. Duncan Hames, director of policy at the anti-corruption campaign group Transparency International UK, said: “Media investigations, court cases and the occasional snippet from ministers have shed some light on the pasts of some visa recipients, but we are still largely in the dark about the true extent of abuse of the scheme. “The Home Office should publish its long-overdue review, with individual cases investigated where there are concerns that the applicants made their money through crime or corruption. Only through some genuine openness can we hope enough people will learn from the mistakes of the past.” A Home Office spokesperson said: “We have made it clear we will not tolerate abuse of our immigration system and we closed the tier 1 (investor) route to ensure those who have profited from dirty money cannot gain access to the UK. “The new Economic Crime Act, which received royal assent after an expedited passage through parliament, delivers a package of measures to bring tougher sanctions against those who facilitate illicit finance in the UK and empowers law enforcement to investigate entities who do not comply.”",News/UK news,Children of oligarchs may have used parents’ funds for UK ‘golden visas’,https://www.theguardian.com/uk-news/2022/may/04/children-of-oligarchs-may-have-used-parents-funds-for-uk-golden-visas
5/5/2022,"Contact has been lost with Ukrainian troops staging a last stand inside Mariupol’s Azovstal steelworks, the mayor of the devastated port city has said, as more civilians fled the city on evacuation buses. Vadym Boichenko told Ukrainian television “we have no way of knowing what’s going on, whether they are safe or not” after weeks of brutal bombardment that have reduced much of the city to rubble. It is not known whether any of the civilians trapped in the works, where about 200 people – including 30 children – remain, were among those who got out. The convoy of evacuation buses, organised by the UN and the International Committee of the Red Cross, was heading for the Ukrainian-controlled city of Zaporizhzhia, said the governor of Donetsk province, Pavlo Kyrylenko, but was not expected to arrive on Wednesday. The Ukrainian MP Kira Rudik said 156 people had managed to leave Mariupol and reach the relative safety of Zaporizhzhia, 140 miles (230km) away, on Tuesday after at least 20 failed attempts to evacuate civilians from the Azovstal site. She told Sky News the main goal of aid workers “is to make sure we get out all the children”, adding: “It’s about 30 children who are still there. The most complicated step would be with the wounded soldiers, because Russia is not allowing them to get out.” Russia’s defence minister, Sergei Shoigu, said the remaining Ukrainian forces in the plant were “securely blocked along the entire perimeter”. He claimed repeated proposals to “release civilians and lay down their arms” had been ignored. Ukraine on Wednesday accused Moscow of planning to stage a military parade in Mariupol on 9 May, when Russia traditionally celebrates its victory over the Nazis in the second world war with processions in dozens of cities. “Mariupol will become a centre of ‘celebration’,” Ukraine’s military intelligence said in a statement on social media. “The central streets of the city are urgently being cleaned of debris, bodies and unexploded ordnance.” It said an official from Russia’s presidential administration had already arrived in the city, now almost entirely under Russian control, for a “large-scale propaganda campaign. Russians will be shown stories of locals’ ‘joy’ at meeting the occupiers.” Azovstal evacuees who arrived in Zaporizhzhia were emotional. “We are so thankful for everyone who helped. There was a moment we lost hope, we thought everyone forgot about us,” said Anna Zaitseva, holding her six-month-old baby. Elyna Tsybulchenko, 54, said Russian forces “bombed like every second”. “Everything shook. Dogs barked and children screamed,” she told Agence France-Presse. “The hardest moment was when we were told our bunker would not survive a direct hit.” After failing to capture Kyiv, Moscow has refocused its efforts on gaining full control of Luhansk and Donetsk, which make up the eastern Donbas region, and securing a southern land corridor via Mariupol to occupied Crimea. Ukraine’s defence ministry said Russia was raising the tempo of its offensive and that it had conducted nearly 50 airstrikes on Tuesday. A ministry spokesperson, Oleksandr Motuzyanyk, said artillery bombardments and airstrikes were also continuing on the Azovstal plant. The Kremlin’s official spokesperson, Dmitry Peskov, denied Ukrainian reports that Moscow’s forces were trying to storm the plant. “The order was publicly given by [Vladimir Putin] to cancel the storming,” Peskov said. “There is no storming.” On Wednesday both sides reported Russian strikes on key transport infrastructure around the western city of Lviv, near Poland, and in Transcarpathia, bordering Hungary. There were also fears the conflict could spill over into neighbouring Moldova. The European Council president, Charles Michel, offered the republic the EU’s “full solidarity” and support. “We plan to significantly increase our support to Moldova by providing its armed forces with additional military equipment,” he said during a visit. Russia’s defence ministry said it had disabled six railway stations in eastern Ukraine used to supply Ukrainian forces with western-made weapons; hit 40 Ukrainian military targets including four ammunition and arms depots; and fired two cruise missiles at military targets from a submarine in the Black Sea. Moscow had deployed 22 battalion tactical groups near the eastern Ukrainian town of Izium, apparently in a drive to capture the nearby cities of Kramatorsk and Severodonetsk in Donbas, British military intelligence said. Shoigu said his forces would consider Nato transport units carrying weapons in Ukraine as targets to be destroyed. The alliance has said individual member states are sending military supplies, but not troops. The defence ministry of neighbouring, pro-Russia Belarus has announced military drills, saying they posed no threat, but Ukraine’s border service said it could not exclude the possibility Belarusian forces might join Russia’s assault. “We are ready,” a spokesperson said. Ukraine remains defiant. “Russia struggles to advance and suffers terrible losses,” the foreign minister, Dmytro Kuleba, tweeted. “Thus the desperate missile terror across Ukraine. But we are not afraid and the world should not be afraid either.”",News/World news,Contact lost with Ukrainian troops staging last stand in Mariupol,https://www.theguardian.com/world/2022/may/04/contact-lost-ukraine-troops-staging-last-stand-mariupol
5/5/2022,"There was a moment on Tuesday afternoon when Saúl “Canelo” Álvarez, the comedian, set the tone yet again in Las Vegas. After all the hoopla and noise of his “grand arrival” in this gaudy old desert town, Álvarez smiled and turned quietly to his promoter Eddie Hearn. Álvarez is ready for his latest challenge as he prepares to climb yet another weight division to fight Dmitry Bivol for his WBA world light-heavyweight title on Saturday night. The jaunty Mexican band kept playing in the background and hundreds of cameras stayed fixed on Álvarez. But the best fighter in the world wanted a little laugh at his own expense. Álvarez took a menacing step towards Hearn as if he, rather than Bivol, would be his next opponent after, last September, he became the undisputed world super-middleweight champion. But being the unified champion is not enough. He relinquished his belts so he could move up to face Bivol, the smartest and most technically proficient light-heavyweight in the world. Álvarez, who is only 5ft 8in, stood close to Hearn and, slowly, lifted his head to stare upwards at the Essex promoter who towers over him. The contrast in size told its own amusing story as Álvarez produced a parody of the traditional face-off. Hearn tried to play his part but, as Álvarez maintained his steely gaze, he cracked up. For years Álvarez, who is 31 and has been boxing professionally since he was 15, hid his real self behind an unsmiling facade and the language barrier which prevented anyone outside of Mexico gaining insight into his personality. “He’s unbelievable company, so humble and funny, but when I signed him I told him he needs to start talking English,” Hearn says as he explains the change in Canelo and the droll bromance that has developed between them. The public school-educated promoter from Romford is the son of Barry Hearn, who brought boxing and darts to Britain to the masses in the 1980s and 90s. Álvarez grew up in poverty in Juanacatlán, near Guadalajara, where he sold ice-cream lollies from the age of six and was bullied because he had red hair, freckles and pale skin. They eventually called him “Canelo” because of his cinnamon colouring. Canelo learnt how to fight with an icy conviction which is now at its most obvious as he dominates world boxing. He has lost only once, to Floyd Mayweather Jr in 2013, in 60 fights and Hearn is smitten by his relentless conviction and easy-going character. “He was nervous about switching from Spanish but I said: ‘Mate, your English is perfect. It’s just confidence.’ He started rolling with it and his profile was transformed in America and the UK. People see him as a great character as well as an all-time great of boxing.” A turning point occurred last May, after Álvarez dispatched Billy Joe Saunders with brutal efficiency in Texas in front of a record crowd of 73,126. At the post-fight press conference, Álvarez was called out by Demetrius ‘Boo Boo’ Andrade. In responding to Andrade, a boring if awkward operator between the ropes, Álvarez slipped from mild bemusement to comic profanity. His repeated instruction to Andrade, to “get the fuck outta here”, delivered in a faux-American accent, went viral. Even the angriest people on Twitter realised Canelo was laughing rather than ranting. “He’s the easiest person I’ve ever dealt with in boxing and the pound-for-pound number one,” Hearn says. “Billy Joe threatened to walk away from that fight three days out. The ring was a standard 20 foot by 20 foot and he said: ‘I’m not fighting unless it’s 24 foot.’ We had to get someone to drive from Florida to Texas and build a new ring – it cost us $60,000. But I had to go to Canelo first and tell him.” Hearn grimaces. “I was shitting myself. I sat down with Canelo, looked him in the eye and said: ‘We’ve got a problem. Saunders will not fight unless it’s a 24 x 24 foot ring. He’s saying he’ll go home. I’ve got to be honest with you. I think he might.’ Canelo laughed and went: ‘It’s no problem. Give him the ring.’ I apologised because it gave a massive advantage to Saunders. Canelo said: ‘Eddie, it doesn’t matter. I’ll get him anyway.’ I couldn’t believe it. I’d been trying to pluck up courage to have that conversation and it just rolled off him. Canelo believes no-one can beat him. He seriously believes that if he fought Oleksandr Usyk [who beat Anthony Joshua to become the IBF, WBA and WBO world heavyweight champion] at cruiserweight he would win. At 200 pounds, I wouldn’t back against him.” Álvarez has already won world titles at five different weights – from welterweight to light-heavyweight. He is back at this unnatural weight, at light-heavy against the unbeaten Bivol, and the rest of the week is about to turn deadly serious. “It’s a really tough fight,” Hearn stresses, “because Bivol is fresh and he’s been waiting for this a long time. He’s massive compared to Canelo. He can punch, he’s got great feet. But when you’re as confident as Canelo you just say: ‘No problem.’ He always finds a way. “Canelo comes from poverty in Guadalajara and he’s won more belts and more money than you could imagine. He lives in outrageous luxury and has this great zest for life, for his family and golf and enjoying himself, but his seriousness inside the ring never changes. Imagine sitting in such comfort and then having to spar some 22-year-old kid who’s got nothing and wants to take your head off. Canelo could be having a laugh in the pool, or playing golf, but he still wants to fight and get better. He is a very funny guy but that drive makes him exceptional.”",Sport/Sport,Easygoing Canelo Álvarez gets serious to climb another weight division,https://www.theguardian.com/sport/2022/may/04/easygoing-canelo-alvarez-gets-serious-to-climb-another-weight-division
