2/11/2022,"At one of Italy’s darkest moments in the pandemic, the government introduced a list of draconian rules to halt the outbreak of Covid, including which sports Italians would be allowed to practise. Among the activities the authorities considered safe were a few Italians barely knew. One was padel, a fast-paced racket sport popular in Spain, similar to tennis but with a dash of squash thrown in.  For Italians, it was love at first smash. According to data from the Padel National Observatory, since early 2020, the number of padel courts in Italy has increased fivefold, up to almost 5,000. Padel schools and clubs have tripled, with the game likely to become the most practised sport after football in Italy. “No sport in Italy has ever had such success in such a short time,” says Salvatore Palumbo, 35, the Sicilian under-18 former tennis champion and soon to become a padel instructor. “Italians had to deal with one of the strictest lockdowns in the world. Playing sports was the only relief and a reason to leave the house.” Sports such as football and basketball were effectively banned for months because they were considered contact sports and therefore risky, while gyms and swimming pools were shut down. “At this point, there were few options left, such as tennis and padel,” said Palumbo. “But if the former requires lengthy technical preparation, the latter is much easier to learn and lots of fun. Success was immediate.” Padel was invented in 1969 by a Mexican businessman, Enrique Corcuera, who wanted to build a tennis court at his holiday home in Acapulco. Not having enough space on his property, he decided to make a smaller court and to use the walls that delimited the area as an integral part of the game. Padel is almost always played in doubles. The courts, about 25% smaller than tennis courts, are surrounded almost entirely by walls, part glass and part metal mesh. Unlike tennis, the ball remains playable if, after being hit on the ground, it then hits the walls. By the time Italy began to ease Covid restrictions, padel had taken hold. But, faced with hundreds of thousands of people eager to play, the few hundred courts around Italy were overwhelmed. “At one point, demand far exceeded supply,” says Edoardo Scarlata, 38, a lawyer from Palermo. “In Sicily, there were already dozens of padel players, but [later in] the pandemic, they became thousands. So last year, with a group of friends, we decided we had to seize this opportunity and invest in this sport.” Scarlata is now one of the owners of Padel City, a club with more than seven padel courts in a residential neighbourhood near the centre of Palermo. Today, Palermo has about 100 padel courts – there are only 90 in the United Kingdom. Many of these have supplanted five-a-side football pitches. Padel in Italy is officially recognised as a discipline of tennis and is governed by the Italian Tennis Federation (FIT) which, given the incredible growth of this sport, broadcasts padel matches every day of the year on its TV channel, Super Tennis. “The growth of padel in Italy follows in some way the growth of tennis in the country,” says FIT’s president, Angelo Binaghi. “And it is a blessing the tennis federation is its governing body, otherwise the risk was that padel courts would replace tennis ones, and one sport risking damaging the other.” Matteo De Simone, 44, a padel player and the club manager of Padel City, says the secret of the sport’s strength is that “it is a suitable sport for everyone, of all ages, and this has contributed to making padel not only a sport but a real movement in Italy. Among the players who attend our courts, there are children aged six up to men aged 80. And above all, there are many women.” At the professional level, Italian women outcompete men, said Carlo Ferrara, 50, the founder of the Mr Padel Paddle website and owner of the My Padel F84 club in Rome. “There are no Italians in the top 100 rankings of men in the world, while there are seven Italian women in the female rankings.” Chiara Pappacena, 27, who is 61st in the World Padel Tour ranking, said Italian women have long faced discrimination in the sport. “This is finally changing. I am very proud to see very young girls and women over 60 on the padel courts today.” Padel continues to grow in other European countries, such as Sweden, where its popularity has not gone unnoticed by the online dating site Tinder, which created its very first padel court as a meet-up location on a rooftop in Stockholm. The sport is most popular, however, in Spain, where padel courts have long been a common sight. Nacho Perulero, a spokesperson for the Spanish Pádel Federation, estimates the sport is now played by about 5 million people in Spain. Here, too, the pandemic has served only to fuel an “exponential growth” in padel playing, said Perulero. “It is practically impossible to reserve a court in any big Spanish city these days.” Thick, smooth and perforated paddles that resemble beach tennis rackets are used for padel, which is overwhelmingly played in doubles. The courts are surrounded almost entirely by walls, part glass and part metal mesh. The scoring is the same as in tennis, butthe ball can be played off the walls. When serving, the ball must bounce once on the floor and hit at waist level. Players can reach over the net with an arm or racket when hitting a ball but if the ball hits the net – or the wall or fencing before it hits the floor – it is a foul. After the ball hits the floor, it may hit the wall or fencing once or more before it is played back. Out-of-court plays are authorised, leading to some dramatic flourishes.",News/World news,‘No sport has had such success in so short a time’: padel takes off in Italy ,https://www.theguardian.com/world/2022/feb/11/padel-italy-takes-off-no-sport-such-success-so-short-time
2/11/2022,"The World of StonehengeThe secrets of Britain’s most renowned Neolithic monument should make for a fascinating show. British Museum, London from 17 February to 17 July.  Louise Bourgeois: The Woven ChildThe revered artist seen from a new perspective, stressing her use of textiles. Hayward Gallery, London, until 15 May. Beatrix Potter: Drawn to NatureNature drawings that reveal the scientific side of Peter Rabbit’s creator, as well her original designs for picture books. V&A, London, from 12 February to 25 September. Ai Weiwei: The Liberty of DoubtFake and real antiquities alongside simulacra of everyday objects by the activist and dissident. Kettle’s Yard, Cambridge, from 12 February to 19 June. Ida Applebroog: Right up to Now, 1969-2021A mini-retrospective of this veteran New Yorker’s feminist paintings and cartoons. Hauser and Wirth, Somerset, until 2 May. Louise Bourgeois’s sewn-together body parts, such as The Good Mother, above, dangle from the ceiling, hang out on stands or have sex in vitrines at the Hayward Gallery in London. They were created in the final decades of the artist’s long career and are provocative, scary and marvellous. Read full review of Louise Bourgeois: The Woven Child here. A 5,000-year-old chalk drum is the “most important prehistoric art find in Britain for a century” A rotting London warehouse has been transformed into a cutting-edge “makerspace” The statue of a 13th-century Jewish businesswoman was unveiled in Winchester A South Korean academic is reading North Korean sweet wrappers for clues Damien Hirst is facing plagiarism claim No 16 Female photographers are exploring nudity and the feminine gaze Kurt Schwitters’ unknown portrait sitter was a German spy Sad young women are the latest book cover trend Glasgow’s Burrell Collection is reopening after a six-year refurbishment Life is beautiful in infrared Manchester’s new flue is a towering achievement, inspired by Tudor palaces The Ain Sakhri Lovers, Natufian culture c 9000BC, Ain Sakhri, JordanThis is one of the oldest sculptures of the human figure and may also be the earliest image of gay sex. The two lovers sensually embracing don’t have defined genders, but the fact they both resemble erect penises makes male on male passion a legitimate interpretation - especially in LGBT+ history month. At the very least we might say this ancient marvel of erotic art leaves identities open and possibilities unclosed. It may represent people exploring new ways of life as human society got more complex. Older images of the human form tend to be “Venus” figures that symbolise fertility. The Natufian period was when people were starting to experiment with agriculture and domesticity. In this liberating work of art, sex is depicted not just as a means to reproduce the species, but a form of play – with whomever you love. British Museum, London To follow us on Twitter: @GdnArtandDesign. If you don’t already receive our regular roundup of art and design news via email, please sign up here. If you have any questions or comments about any of our newsletters please email newsletters@theguardian.com",Arts/Art and design,"Cosmic Stonehenge secrets, Ai Weiwei looks back, and gay sex 11,000 years ago – the week in art",https://www.theguardian.com/artanddesign/2022/feb/11/cosmic-stonehenge-british-museum-ai-weiwei-art-weekly
2/11/2022,"Icried the night Michael K Williams joined the over 100,000 Americans who died of an overdose in 2021. When I heard that Williams, the actor best known for his role as Omar, the queer, gun-toting rogue in The Wire, had suffered an accidental overdose in his apartment, I felt a deep sense of dread. The knowledge that another Black man not too dissimilar from myself had passed before his time mingled in my mind with my bitter memory of the moment when I learned that my best friend, Joseph Rodriguez, had overdosed at the age of 19. I am grateful, I suppose, that by the time Joe had died, in 2009, the public narrative around drug users had begun to evolve. Young suburban white kids had started dying, and the country quickly shifted to protect its most prized possessions. Teens were sent to rehab, and drug dealers, like those who allegedly sold Williams his final dose, were rounded up and blamed for what is clearly a broader societal issue.  Last week four men in Brooklyn were charged with having sold fentanyl-laced heroin to Williams and others. This hollow act is part of the problem. The US has long chosen mass incarceration as the solution to substance abuse. Arresting people didn’t prevent Williams’ overdose, and arresting more now won’t prevent future ones. And given Williams’ stance on the war on drugs, it is doubtful he would have endorsed this action.There are many solutions that could have helped keep Williams alive. While it is unlikely that the US will rid itself of many of the underlying drivers of drug addiction – such as violence, systemic racism and the inequalities of capitalism – anytime soon, the country, and the federal government in particular, has long ignored policy reforms that could help address the worst of our current addiction epidemic. The most important reform, decriminalization, has gained steam in some places, like Oregon, but remains far away as a federal reform. Williams was a one-of-a-kind man and artist, but not unique in his struggles with drugs: according to the 2020 National Survey on Drug Use and Health, 14.5% of Americans – roughly 40.3 million people – had a substance use disorder in 2020. A couple hundred of those people die of an overdose every day. This is a long-term trend that continues to explode over time; while over 100,000 Americans died of an overdose last year, the number was roughly 17,000 in 2000. As someone who has been involved with drug policy reform since 2010, roughly a year after my friend died, it is difficult to maintain hope as the bodies pile up, especially as solution after solution is ignored by the federal government. There are an embarrassingly large number of policies that could be backed by the federal government and implemented nationwide to save lives and nudge addicted people towards healing. Rather than concentrating power in the police through criminalization, most of these policies involve treating drug users like human beings worthy of love and care. One of the simplest ways to save lives is to make drug testing kits easily available for drug users. Williams was reportedly poisoned by fentanyl, a synthetic opioid mixed into cocaine and heroin as a means for illicit manufacturers to increase profits. Drug testing kits, like fentanyl test trips, let consumers ensure that they know what they’re putting into their bodies. While these strips are available for free in some places, such as New York City, they are still illegal in many states because they’re considered drug paraphernalia. Another potentially life-saving intervention? Supervised consumption sites. These are locations where people can consume drugs safely, with the support of medical staff that can ensure the purity of what is being used while being on call to intervene in the event of accidental overdoses. These locations can also connect people with treatment services and safer alternative drugs. If this all feels unfamiliar, think of bars as a crude version of these sites: bartenders administer doses to clients and can cut them off if they are too intoxicated. If anyone drinks too much, bartenders can call an ambulance and have them hospitalized. Creating robust supervised consumption sites could save lives, and destigmatizing those sites could save even more. All of these interventions would be made more effective and possible if the federal government took the important leap to decriminalize the possession of small amounts of all drugs. Total decriminalization may seem extreme, but there is evidence that it could save lives, reduce drug use, and prevent more unnecessary incarceration and harassment of those who use drugs, particularly Black Americans. Living in New York City, Williams did have access to some harm reduction resources but, like many drug users, may have felt too much stigma to seek help.Portugal decriminalized all drugs, in small amounts, in 2001. The country has also radically expanded its capacity to treat substance use disorders. According to the US-based Drug Policy Alliance, overdose deaths in Portugal decreased by more than 80% after decriminalization. By contrast, in 2017, “there were more than 72,000 overdose deaths in the US. If the US overdose death rate were on par with Portugal’s, there would have been fewer than 800 overdose deaths that year.” By 2008, three-quarters of those suffering from substance use disorder in Portugal were in treatment. The deaths of Michael K Williams and Joseph Rodriguez were perfectly preventable if we’d wanted them to live. Addiction is inevitable in our present society. Capitalism is a system that necessarily involves the commodification of human beings and the reduction of the individual into a tiny cog that exists to work and create profit. This dehumanization, exacerbated by racism, is probably why there are strong relationships between poverty and addiction, and why Black men are now the people most likely to overdose and die.The reality is that there will be many more deaths like Williams’. I expect to lose more friends; it would be naive to think that I won’t. In recent years both Democrats and Republicans have slowly shifted closer to the kind of drug reforms that could save lives. But for some of the people I love it is too little, too late and, without a comprehensive federal plan that includes decriminalization, we may as well brace ourselves for more tearful phone calls and funerals. Akin Olla is a contributing opinion writer at the Guardian",Opinion/Opinion,Arresting Michael K Williams’ alleged drug dealers won’t solve the US addiction crisis | Akin Olla,https://www.theguardian.com/commentisfree/2022/feb/11/michael-k-williams-overdose-us-addiction-crisis
2/11/2022,"The fact that Love Is Blind was Netflix’s breakout dating show took me by surprise. I thought the real hit would be the trashier Too Hot To Handle, which forbade its contestants from having sex then did everything it could to encourage them to do just that. Instead, it was the series that attempted to prove a seemingly heartwarming theory. It argued that if the digital age of dating apps is superficial and looks-based, perhaps we should allowe two people to fall in love with one another, without either seeing what the other looked like. Now it is back for a second season, returning in exactly the same clothes it was wearing last night. The focus is soft and the music is soaring. Every time something emotional happens, the background music swoops in at top volume, and sings the couples’ feelings, like a toddler trying to articulate itself. “I’m afraid!” goes the music, as someone reveals their vulnerabilities. “I feel it all!” it pounds, as someone tries to work out who it is they prefer, while glugging from a golden goblet. This is a series that is very pleased with its own work, its theory apparently “proven” by the first season, which provided two couples (Lauren and Cameron and Amber and Matthew) with what appear to be genuine happily-ever-after marriages. It is, insists host Nick Lachey, “a proven approach for finding love.”  Well, it is, and also, it isn’t. It is a proved approach to making undeniably gripping television, but it is as cooked-up and massaged as any other reality show. We meet 14 men and women, all claiming to be exasperated by the superficiality of modern dating, all ready to propose to someone they have never laid eyes upon. But first, the “pod” stage, which is speed dating behind frosted glass, with the couples taking more notes than Gogglebox’s Jenny watching an episode of Line of Duty. We don’t see these annotations, which is a shame. One contestant proudly writes the name of another at the very front of his book, which suggests his understanding of true love peaked at primary school. The topics go deep, quickly. The couples talk about tough childhoods, relationship histories, racial stereotypes and assumptions based on class. The men talk about being macho, or not being macho enough; the women have a thinly veiled loathing of their own bodies, and worry that they are too old. It is depressing. But it does seem more brutally frank than most dating shows, if not in what they are actually saying to each other, then in how they are talking about themselves. It soon becomes apparent who the “stars” of this series will be, and what their “storylines” are. Many of the contestants fail to meet their match, and simply fade into the background, and the ones who last tend to be the biggest, loudest, most complex characters. If you ever wondered whether your partner believing in evolution (or not) would be a romantic dealbreaker, then allow this show to put that to the test. Insecurities run rife, as people attempt to put their preconceived notions about what constitutes physical attractiveness to one side. For all of its crowing about finding proof that physical attractiveness is irrelevant, though, it often proves the opposite. It shows that all people are judgmental, to some degree, and it naughtily nudges viewers to feel the same. The most enlightening moments in these early episodes are when the couples finally come face-to-face, running towards each other, or not, from behind Blind Date-style screens. (“I think you’re a beautiful person, inside and out,” says one contestant to another, just before the reveal, which is, surely, jumping the gun.) I strongly believe that you can tell in an instant whether they fancy each other or not, no matter how much they claim to be attracted to “energy”. A holiday in Cancún, Mexico, follows the pods and marriage proposals, so that the new couples can get to know each other better before walking down the aisle. See if you can spot the fearful looks off into the distance the participants have when they think nobody is looking at them. It is all so excruciatingly, unbearably intimate. You see arguments, rows, deeply personal discussions, betrayals, regrets. Entire relationships form and collapse at a staggering rate. The programme-makers throw spanner after spanner into the works. The spectacle is undeniable. It is hard to look away. Netflix is staggering the release of this into a semi-binge, dropping the first five episodes in one instalment, followed by the next four a week later, and the finale a week after that. I will be there until the bitter end. But am I proud of myself for it? I’m not so sure.",Arts/Television & radio,Love Is Blind review – the return of the dating show you can’t take your eyes off,https://www.theguardian.com/tv-and-radio/2022/feb/11/love-is-blind-review-netflix-the-return-of-the-dating-show-you-cant-take-your-eyes-off
