2/2/2022,"Extreme heat in the world’s oceans passed the “point of no return” in 2014 and has become the new normal, according to research. Scientists analysed sea surface temperatures over the last 150 years, which have risen because of global heating. They found that extreme temperatures occurring just 2% of the time a century ago have occurred at least 50% of the time across the global ocean since 2014.  In some hotspots, extreme temperatures occur 90% of the time, severely affecting wildlife. More than 90% of the heat trapped by greenhouse gases is absorbed by the ocean, which plays a critical role in maintaining a stable climate. “By using this measure of extremes, we’ve shown that climate change is not something that is uncertain and may happen in the distant future – it’s something that is a historical fact and has occurred already,” said Kyle Van Houtan, at the Monterey Bay Aquarium, US, and one of the research team. “Extreme climate change is here, it’s in the ocean, and the ocean underpins all life on Earth.” Van Houtan and his colleague Kisei Tanaka are ecologists and began the study because they wanted to assess how heat extremes were related to the loss of kelp forests off the coast of California. “Ecology teaches us that extremes have an outsized impact on ecosystems,” Van Houtan said. “We are trying to understand the dramatic changes that we’ve seen along our coasts and in the ocean, on coral reefs, kelp, white sharks, sea otters, fish, and more.” Other scientists reported in 2019 that the number of heatwaves affecting the planet’s oceans had increased sharply, killing swathes of sea life like “wildfires that take out huge areas of forest”. Van Houtan and Tanaka found no measure of extreme heat existed and so extended their work globally. The study, published in the Plos Climate journal, examined the monthly temperature in each one-degree-by-one-degree part of the ocean and set the highest temperature in the 50-year period as the benchmark for extreme heat. The scientists then examined temperature records from 1920 to 2019, the most recent year available. They found that by 2014, more than 50% of the monthly records across the entire ocean had surpassed the once-in-50–years extreme heat benchmark. The researchers called the year when the percentage passed 50% and did not fall back below it in subsequent years the “point of no return”. By 2019, the proportion of the global ocean suffering extreme heat was 57%. “We expect this to keep on going up,” said Van Houtan. But the extreme heat was particularly severe in some parts of the ocean, with the South Atlantic having passed the point of no return in 1998. “That was 24 years ago – that is astounding,” he said. The proportion of the ocean experiencing extreme heat in some large ecosystems is now 80%-90%, with the five worst affected including areas off the north-east coasts of the US and Canada, off Somalia and Indonesia, and in the Norwegian Sea. “You should care about turtles, seabirds and whales, but even if you don’t, the two most lucrative fisheries in the US, lobster and scallops, are in those exact spots,” said Van Houtan, while 14 fisheries in Alaska have recently been declared federal disasters. The heat content of the top 2,000 metres of the ocean set a new record in 2021, the sixth in a row. Prof John Abraham at the University of St Thomas in Minnesota, one of the team behind the assessment, said ocean heat content was the most relevant to global climate, while surface temperatures were most relevant to weather patterns, as well as many ecosystems. “Oceans are critical to understanding climate change. They cover about 70% of the planet’s surface and absorb more than 90% of global warming heat,” Abraham said. “The new study is helpful because the researchers look at the surface temperatures. It finds there has been a big increase in extreme heat at the ocean’s surface and that the extremes are increasing over time.”",News/Environment,Extreme heat in oceans ‘passed point of no return’ in 2014,https://www.theguardian.com/environment/2022/feb/01/extreme-heat-oceans-passed-point-of-no-return-high-temperatures-wildlife-seas
2/2/2022,"Almost no corals on the planet will escape severe bleaching once global heating reaches 1.5C, according to a new study of the world’s reefs. Reefs in areas currently regarded as cooler refuges will be overwhelmed at 1.5C of heating, and just 0.2% of reefs will escape at least one bleaching outbreak every decade, according to the research.  The team of scientists from the University of Leeds, Texas Tech University and James Cook University used the latest climate model projections to confirm that 1.5C of global heating “will be catastrophic for coral reefs”. Corals bleach when ocean temperatures are too high for too long. Algae that provide corals with much of their food and colour separate from the coral during heat stress. Severe bleaching can kill corals, but they can recover from milder outbreaks if there are several years with no further heatwaves. The world’s oceans are heating due mostly to the burning of fossil fuels. The study comes as the world’s biggest coral reef system, the Great Barrier Reef off Australia’s Queensland coast, is on the verge of another mass coral bleaching event. In the study, the team analysed climate projections across all of the world’s shallow-water coral reefs, which constitute the vast majority of reefs and provide habitat, tourism revenue and coastal protection. About 84% of the world’s corals exist in areas that are expected to bleach less than once a decade and are regarded as “thermal refugia”, the study said. But the analysis suggests at 1.5C of global heating, only 0.2% of the area covered by reefs is in water cool enough to avoid bleaching at least once every five years – a frequency considered too short to allow corals to recover. The only area to escape, the study claims, would be in a region of the east Indian Ocean in an area of natural upwelling of cooler water. Even areas with strong currents that can protect corals from heat, such as those in Panama, Florida and the Lesser Sunda Islands in Indonesia, would be overwhelmed by the heat. Associate Prof Scott Heron, a marine scientist at James Cook University and a co-author of the study, said coral reefs sustained a billion people around the world. He said the study, published in the journal PLOS Climate, showed corals worldwide were at even greater risk from climate change than previously thought. That meant it was crucial that conservation work continued on reefs to give corals a fighting chance of survival, he said. “Until we reach the point where I can’t see a single coral, it isn’t too late. “We have to keep pursuing our best practices to protect coral reefs. Real people rely on these reefs and that is a driver to keep gathering the best knowledge possible.” Adele Dixon, lead author of the study and a PhD student at the University of Leeds, said corals in French Polynesia and southern Indonesia may be exposed to heat stress less frequently, and the study did identify a small number of “hope sites”. “Corals in these locations, such as the eastern Pacific, may be better able to cope with temperature extremes,” she said. But one prominent coral reef expert challenged the findings, and doubted the real world outcomes would be as catastrophic as the research suggests. Sign up to receive an email with the top stories from Guardian Australia every morning Prof Peter Mumby, a reef expert at the University of Queensland studying the effects of climate change on corals, agreed that at 1.5C corals worldwide would be under greater stress than they are today. “But I don’t agree that this research provides evidence that corals are untenable under 1.5C of warming,” he said. Mumby said the levels of heat stress used in the study to identify severe bleaching were arguably too low, and the method was unlikely to capture local conditions that could protect some reefs. Even reefs that are hit by bleaching every five years could include areas of coral that would survive, he said.",News/Environment,"All coral will suffer severe bleaching when global heating hits 1.5C, study finds",https://www.theguardian.com/environment/2022/feb/01/all-coral-will-suffer-severe-bleaching-when-global-heating-hits-15c-study-finds
2/2/2022,"Here’s the thing. You won’t find any sentient being who will tell you anything other than that Boris Johnson was a total disaster during his Commons statement on the Sue Gray report on Monday. Narcissistic, tin-eared, deceitful and graceless would be some of the kinder descriptions of his behaviour. And yet. Little more than an hour later, Big Dog was locked in a committee room in Portcullis House with almost the entire Tory parliamentary party, giving the performance of his life. At least that’s how those backbenchers – surrounded by ministers and party whips – who were present, chose to report it. MPs who had gone into the room as sceptics left an hour later totally charmed. Clearly you had to have been there to fully appreciate his killer reference to himself as Othello. Though hopefully someone later explained to him and Carrie what happened to Desdemona. The Suspect clearly has a lot of work to do before starting on his Shakespeare biography. Like reading some of the plays.  Then it’s uncanny that it always seems to be that way. One way or another, Johnson saves his best efforts for when there is no reliable audience. Just a few tame stooges who are easily bullied. Perhaps it’s stage fright. If only he could reproduce his star quality on the big stage, then we might all appreciate his exceptionalism. His genius. Think how frustrating it must be for Big Dog to realise how few of his best lines reach the general public and that all most people know of him is that he’s a shit liar. Think also how frustrating it must be for The Suspect to have to rely on other halfwits to spread his talent on the news channels. People like Nadine Dorries, who spit and snarl conspiracy theories into any passing microphone, safe in the knowledge she’ll never hold a cabinet post again. People like Jacob Rees-Mogg, who has never knowingly been right about anything. People like Paul Scully, who will be suffering from PTSD for years following his mauling at the hands of Emma Barnett on Newsnight. People like Dominic Raab. Come Tuesday morning, it was the justice secretary and deputy prime minister who had drawn the short straw of trying to explain why The Suspect had done nothing wrong even though Number 10 was the subject of 12 separate police investigations. It didn’t go well. Long before the end of the final interview, Dom’s anger vein was pumping wildly with psychotic rage. It would be at least another three murder day for him. He just had to hope the bodies weren’t recovered from the Thames for some weeks. So what was the prime minister sorry for, Nick Robinson asked on Radio 4’s Today programme. Raab literally didn’t have a clue. Apart from the obvious about being sorry he had been caught. There again, how could he? Even Big Dog doesn’t know why he’s saying sorry and can’t bring himself to even affect sincerity. He still somehow believes he is the innocent victim in this and that somehow all the parties happened to him. All that Dom could manage for a full seven minutes was an increasing tetchy and terse “no comment” as Robinson tried to find one thing that Johnson might conceivably feel sorry for. Raab just shrugged. He supposed the fault might have lain in the structures of No 10. Perhaps if there had been a proper office for the prime minister then someone in the building might have noticed that endless parties with everyone getting pissed was not a good look. But, as it was, there was no way Big Dog could possibly have known any parties had taken place – not that he was admitting there had been parties – because no one had told him he was breaking the rules he had made. As Robinson became more and more frustrated, Dom retreated further and further into his shell. It was all Raab could do to stop himself from referring to Johnson as “The Suspect”. Or “My Client”. Not that you could imagine anyone wanting Dom as their lawyer as his knowledge of the law appears extremely limited. He also claimed that The Suspect couldn’t possibly comment on any of the parties he attended as it might prejudice the ongoing police investigation. It would if Johnson tried to lie about them, I suppose. Then what else would Boris do? Raab ended by saying he hoped the Metropolitan police wouldn’t investigate too thoroughly – why break the habit of a lifetime? – and besides it was possible they turned up nothing in which case there would be no need to publish the full Sue Gray report. After all, who wanted to see pictures of Boris lying face down in a flower bed? Or staff shagging on the children’s swing. And he definitely wasn’t going to repeat the Jimmy Savile conspiracy theory lie, even though he saw no harm in Big Dog having accused Keir Starmer of protecting one of Britain’s most notorious paedophiles, just in case he got taken to court for slander. There was no lower for Raab to get, so the BBC showed him the door. There was no need to open it. He could ooze and seep underneath it. It wasn’t difficult to wonder if all the grown-ups had long since left No 10. A feeling reinforced later in the day when first a spokesperson said Downing Street had no intention of revealing if the prime minister received a fixed penalty notice, only to reverse ferret several hours later when someone realised it would be impossible to keep this a secret. As for Big Dog, he was in Kyiv trying to persuade the world he was doing something other than trying to hang on to his own job. A day trip that ended with a press conference that only confirmed the futility of the jaunt. Both the BBC and PA asked Johnson about the parties and observed if he was a serious player in the efforts to secure peace, he’d have taken Vladimir Putin’s call the day before. The Ukrainian media ignored The Suspect entirely. They knew he was irrelevant and they focused all their questions on President Volodymyr Zelensky. Johnson’s search for meaning remained unrequited.",News/Politics,Boris Johnson charm offensive on Tory MPs was a total success – we are told | John Crace,https://www.theguardian.com/politics/2022/feb/01/boris-johnson-charm-offensive-on-tory-mps-was-a-total-success-we-are-told
2/2/2022,"He is the toast of New York, of London – and of a small village called Llanddewi Rhydderch. Just four months after Josh Wardle invented the wonderfully simple and soothing puzzle Wordle, he is a mega star in the world of games and is a great deal wealthier after the New York Times acquired his creation for a seven figure sum.  But back in his home village in south-east Wales, which has a church, a chapel, a very old yew tree and not much else, Wardle’s family expressed quiet joy at their son’s success, and also, perhaps, a little bemusement. “We’re very proud but it won’t change him at all,” his father, Christopher, a farmer, said. “He’s not interested in the money side of things. He just likes creating. This all got so big so quickly.” His mother, Tessa, said: “I think this [selling the game] was the best way for him to manage things.” Wardle, who left the UK to pursue a career as a software engineer and is now based in Brooklyn, invented the game during a Covid lockdown to entertain his partner, Palak Shah. Wardle shared it with family members and, realising that it may be worthy of a wider release, unleashed it on the world in October. While he had an inkling he was on to something, Wardle has made it clear he could never have imagined it would become so big – especially as he had originally created it for an audience of just one person. In his statement on the sale, Wardle said it had been “incredible” to watch the game bring so much joy to so many. “I feel so grateful for the personal stories some of you have shared with me, from Wordle uniting distant family members, to provoking friendly rivalries, to supporting medical recoveries,” he said. “On the flip side, I’d be lying if I said this hasn’t been overwhelming. After all, I am just one person, and it is important to me that, as Wordle grows, it continues to provide a great experience to everyone.” Wardle is the youngest of three brothers. He lived in Llanddewi Rhydderch when he was a boy and the family farm cattle and sheep. They also have a lively sheepdog called Shep. The village is tranquil, with views of one of Wales’ most popular hills, Sugar Loaf, or Mynydd Pen-y-fâl. It last received publicity for a curious reason when it emerged that the Pacific nation of Kiribati had an honorary consulate there. Wardle attended a local state school King Henry VIII in Abergavenny, before studying media arts at Royal Holloway, University of London. His father said he decided to head to the US to study at the University of Oregon partly because of his love of the sport Ultimate Frisbee. “He liked to plough his own furrow, to use a farming phrase.” After college Wardle began working for Reddit, working on collaborative social experiments. There must be something in the water of Llanddewi Rhydderch. The writer Owen Sheers grew up there while Wardle’s brother, Tim, is a successful documentary maker. On his Twitter feed Tim Wardle described the news of the New York Times buyout as “big news in the Wordlesphere.” He said it had been “fun” to see his brother’s game “blow up”, adding: “Ironically, he decided not to do all the things you’re supposed to do to make a viral hit – like allowing people to play for hours or putting a hyperlink in the sharing function. It works because it’s atypical.” Wordle requires players to guess a five-letter word within six guesses, with grey, yellow and green coloured bricks used to indicate if guessed letters are part of the answer and whether they match the right place in the correct word. Once solved, players are able to share their own results on social media via rows of the same coloured bricks but with the letters removed, so others can see how they did without having the puzzle ruined for them. While the world debated the New York Times sale, at the farm in Llanddewi Rhydderch they were getting on with looking after their animals. “Josh had no idea it would take off like this,” said his father. “I think it’s come as a bit of a shock. He’s a very private kind of person. I don’t think he likes the attention much.” Jonathan Knight, the general manager for games at the New York Times Company, said the firm was “thrilled” to be adding Wordle to its portfolio and confirmed it had “no plans at this time” to change the game’s free-to-play nature, saying Wardle’s creation was “lightning in a bottle”.",News/Media,‘Incredible’: Wordle’s Welsh beginnings to the New York Times ,https://www.theguardian.com/media/2022/feb/01/incredible-wordles-welsh-beginnings-to-the-new-york-times
2/2/2022,"An NHS doctor who was found by a court to have poisoned three people, killing one of them, has been suspended from practising medicine in the UK by the General Medical Council. The Guardian revealed earlier this week that a London court had found that the doctor had poisoned his partner and her parents with thallium, killing her father.  The General Medical Council (GMC), which regulates the UK’s 306,185 doctors, on Tuesday said that it had suspended the medic and is investigating the events that led to the court deciding that he was a killer. “The doctor is suspended from practice pending an investigation into the allegations against him. The doctor was suspended in January 2022”, a GMC spokesperson said. The regulator declined to give any more details. It is thought that it is still assessing whether there are enough grounds to refer the doctor to the Medical Practitioners Tribunal Service, which investigates medics accused of wrongdoing and sanctions those who are found guilty. In the family court last year Mr Justice Williams ruled that the doctor had poisoned the trio, but he forbade either the medic or his ex-partner from being named. The poisoning came before the family court, despite it being a civil rather than criminal court, when in 2018 the doctor began seeking access to the son he had when he was still in a relationship with his ex-partner. Their relationship broke down in October 2012, a month after he – the court later established – put thallium in coffee that she and her parents drank while they were all staying together in Bulgaria, their home country. She and her mother became very ill but survived. Williams found that on the balance of probabilities the doctor had administered the poison, hurried back to the UK with his then partner and their child, and then declined to use his medical knowledge and contacts to get her appropriate care. His ex-partner told the Guardian she was “shocked” that the GMC had taken so long to suspend the doctor, given that he had first been accused of the poisoning in a previous case involving the custody of their child. That hearing, in 2020, also found that he had administered the thallium, a tasteless and odourless poison. However, the doctor appealed that ruling and the court of appeal ruled there must be a rehearing of events surrounding the poisoning, at the end of which Williams said he was satisfied that the man had carried it out. “The GMC was made aware of the outcome of the first trial at the end of April 2020. I was shocked that my ex-partner was allowed to practie medicine since then. “I would have assumed that if the GMC was going to conduct any investigation, then such [an] investigation should have been initiated immediately. I am shocked that things move forward very slowly, bearing in mind that a doctor was found to have killed a man”, she said. Simon Bruce, a specialist family lawyer who represents the woman, said: “The mother was intensely worried that her son’s father was practising as a doctor in England for years. “The General Medical Council has been informed of developments in the case on a periodic basis when this was permitted.” Bruce has acted for the woman – a bookkeeper – since late 2020 in his capacity as the director of a legal clinic run by Dad’s House, a charity based in London. Through the clinic lawyers provide pro bono advice to help people negotiate legal disputes. He added: “The president of the family division gave a speech in October 2021 in which he said that over half of the cases involving children in our family courts involved allegations of violence. “That may well be, but hardly any involve the killing of individuals, as this one did.” Delphine Philip Law, the doctor’s solicitors, declined to comment on the suspension but had earlier said that the doctor vehemently denies the mother’s allegations that he poisoned her or her parents.",News/Law,Doctor found to have poisoned partner and her parents suspended by GMC,https://www.theguardian.com/law/2022/feb/01/doctor-found-to-have-poisoned-wife-and-her-parents-suspended-by-gmc
