12/24/2021," When I say I missed the cinema, specifically I meant I miss seeing musicals on the big screen. While Jon M Chu’s In the Heights was made before the pandemic, his commitment to the supremacy of the production number delivered what our eyes were craving. Naturally, the film opens up the musical’s theatre staging, and it opens with a vast ensemble song of escalating excess, but it’s the 96,000 routine, about a third of the way in, which made the biggest splash and proved the director’s commitment to Technicolor extravagance by way of Busby Berkeley, aqua aerobics and gurning contortionists. Aptly, it’s a song about bragging and wish-fulfilment, in which the cast speculate on how they’d spend a lottery windfall. And for a song about big numbers, the scale is as massive as it ought to be: bikini overkill. It’s a little daft, sure, but so exuberant, you’ll grin all the way through – even at the goofy graffiti effects. Pamela Hutchinson “When did you all become such disappointments?” So asks the elegantly dressed Alberto, one of the elders of the extended Schisa family, as they dine al fresco on a gorgeous Neapolitan afternoon in Paolo Sorrentino’s winsome cine-memoir The Hand of God. Their summit is one of glorious ridicule as they mock the angry grandma who repulsively sucks on a fat lump of cheese while wearing a gaudy fur coat, chuckle as a rotund Aunt gripes “my spleen is acting up”, and roll their eyes at a crooked cousin too stupid to steal anything but watermelons. Explosive laughter comes when the morbidly obese sister brings her new beau, who introduces himself through a robotic electrolarynx. And yet this garishly-shot parade of cinematic invective, peppered with hearty “va fongool!”s, is awash, somehow, in the glow of nostalgic, familial love. To extract warmth from cruelty is a movie-making miracle. Jordan Hoffman About halfway through Edgar Wright’s cautionary tale about the hazards of escapism, the dream of young Eloise – to travel in sleep back to 60s London as bewitching it-girl Sandie – morphs into a nightmare. Though in this dizzying montage, it’s more like a good trip gone bad; Sandie’s yanked out of her bed by her boyfriend turned pimp with a bark of “everyone’s waiting for you”, a cruel inversion of the beckoning Petula Clark lyric sung a few scenes prior, and suddenly she’s at a club bathed in rainbow psychedelia. In time with the Walker Brothers’ cover of Land of 1,000 Dances, she whirls through a series of reluctant dates with oily clients, taking the edge off by getting progressively drunker until she’s cackling at their stock line about how lovely her name is. They don’t really care, assigning her a persona of their choosing, another dark play on the desire to be someone else she expressed before. The lyrics turn into mocking jeers, their exhortations to do the Watusi or Mashed Potato now demands from cruel men for her to dance to their liking. All she can do is get lost in the song. Charles Bramesco In a year of truly weird sex in movies (singing cunnilingus, oral period sex, sex with cars and Jesus figurines), the hottest scene of all may have been one without intercourse. Julie (Renate Reinsve, Cannes’ best actress winner) is flitting through careers and men, waiting for something to happen, as she approaches 30. One evening, walking home through luminous Oslo, she happens upon a wedding party, where she helps herself to too many drinks and chats up a tall, attractive stranger (Herbert Nordrum). What follows is 10 minutes of one of the most disarmingly romantic set pieces this side of Four Weddings and a Funeral and a masterclass in chemistry. With both happy in relationships and loath to cheat, they insist nothing can happen. But in various dim nooks around the party, they engage in a captivatingly sexy game of Is This Cheating?, involving biting, smelling armpits, shotgun smoking and peeing in front of each other (hotter than it sounds). As the sun rises, they say goodbye, positive they didn’t transgress – just as we’re certain it’s the beginning of a transformative romance. Lisa Wong Macabasco Billie Eilish is at Coachella. She’s watching Ariana Grande, minding her own business, when a man in a baseball cap and medical mask approaches her. She recoils, keeping her distance. He holds her gaze, and she offers a shy, stressed wave. He opens his arms for a hug, and after taking a minute to gather herself, she eventually receives the embrace. The man is veteran teen idol Justin Bieber. Caught on camera in RJ Cutter’s masterful fly-on-the-wall rock doc, it’s an extraordinary moment that feels like lightning in a bottle. He strokes her hair as she weeps uncontrollably, face pressed into his chest. “He just stood there and looked at me WITH HIS EYES,” sobs Eilish, reliving the experience in the car on the way home. “You know exactly how it feels to be him in that situation,” replies her brother, Finneas. The film is a snapshot of the planet’s biggest pop star as her fame is cresting; the scene draws a clever parallel with Bieber, the object of her own fandom. Simran Hans At first glance, Hulu’s Plan B could easily be confused with last year’s Unpregnant – both films follow two inseparable best female friends on hijinks-filled road trips for reproductive healthcare denied to them by real-life restrictions. But I knew Plan B, directed by Natalie Morales and written by Prathi Srinivasan and Joshua Levy, was more than a retread of Unpregnant in the film’s first act, when firecracker Lupe (Victoria Moroles) convinces the inexperienced, tightly-wound Sunny (Kuhoo Verma) to host a party as a scheme to court her crush. That plan goes bust, of course, and Sunny instead ends up in a bathroom with Kyle (Mason Cook), a dorky, ultra-Christian classmate. Over the course of four and a half minutes, Plan B captures with cringeworthy precision an under-represented teenage girl experience: first-time sex that is not traumatic or revelatory, but boring – anti-climactic, incidental, very brief, unworthy of the hype. Verma and Cook hit all the humbling notes: impulsive lust, disillusionment (theres’s a Squatty Potty involved), shock, shame. It’s an endearing, searing and hilarious ride, whose stressful consequences for Sunny only casts the increasingly dystopian nightmare of US reproductive rights in starker relief. Adrian Horton You can never anticipate how any movie is going to open, but there was no throat-clearing quite like Barb & Star Go to Vista Del Mar, which starts with a paperboy rolling through a middle American suburb on his bike, slinging deliveries while lip-synching to the 1980 Barbra Streisand-Barry Gibb duet Guilty. Why that song? It’s not connected to the period or the themes of the film that follows, such as they are, but it nonetheless seems like an ideal primer, suggestive of both the culotte-and-casserole souls of Kristen Wiig and Annie Mumolo’s Nebraskan adventurers and the random battiness of the film’s delightfully offbeat sense of humor. Later in the film, when Wiig and Mumolo spend an entire plane ride talking up an imaginary perfect woman named Trish or Jamie Dornan launches into an impromptu beachside song-and-dance numbers, we can’t say we weren’t prepared for odd things to happen. Scott Tobias Few film-makers put together moments that hit on multiple levels like Paul Thomas Anderson. The dude rocks images that can simultaneously move the plot forward, deliver a symbolic punchline and do a number on our emotions. Licorice Pizza’s downhill sequence – peak cinema in 2021 – is just the latest example. That’s when the adult protagonist in Anderson’s 1973 set coming-of-age comedy, Alana (Alana Haim), steers a U-Haul with an empty gas tank in reverse down the Hollywood Hills. It’s a breathtaking stunt that’s also devastating for Alana. She’s a beguiling young woman whose life was stalled working a job to nowhere. And then she found some forward momentum when meeting Gary Valentine (Cooper Hoffman), a 15-year-old googly-eyed go-getter. But the high of their relationship, and all its youthful recklessness, is wearing thin when they hop in that truck and let gravity drag them backwards. Licorice Pizza has a few moments when Alana catches her own reflection and reassesses. Here we see her face in a riveting close-up of the driver’s side mirror, struck with fear and melancholy as the road behind her comes closing in. Radheyan Simonpillai There’s been a strange reticence to much of the writing about Jane Campion’s magnetic Oscar-buzzed comeback. Critics have praised and pored over its themes of masculinity and a loose definition of repression, but most have been too coy to discuss how overwhelmingly, fascinatingly queer the whole film is. The uneasy dynamic between Benedict Cumberbatch’s sad, closeted rancher Phil, whose quick temper and filthy cowboy get-up help to mask his sexuality, and Kodi Smit-McPhee’s delicate, almost otherworldly med student Peter, whose exterior softness hides something far steelier is endlessly intriguing for everything it does and doesn’t say. The moment that burrowed its way under my skin the deepest was the film’s big turning point as Phil watches Peter confidently strut over to examine a bird’s nest despite being ridiculed and called a faggot by the men nearby. It’s when the elder gay decides to suddenly take him under his wing for what purpose we’re not so sure and it seems, in the moment, neither is Phil. Is it some sort of desire? Is it a need to protect? Is it a form of jealousy? Is it perhaps all three? It represents a specific, hard-to-explain confusion that comes with generational queerness and while others might interpret it as a moment of darkness (was it really just a new way to torture Kirsten Dunst’s beleagured mother?), I saw it as something tender. And undeniably queer. Benjamin Lee This was the year an American titan left us: Stephen Sondheim, whose great early hit West Side Story (for which he wrote the lyrics at 27) has now been revived in a new screen version by Steven Spielberg. So it is fitting that Sondheim appeared for a poignant moment, sympathetically played in cameo by Bradley Whitford, in Lin-Manuel Miranda’s tick, tick ... BOOM!: the autobiographical musical by the late Jonathan Larsen, who wrote Rent, detailing his heartbreaking attempts to get an early work produced – a complicated, ambitious, futurist extravaganza called Superbia.Larsen, played by Andrew Garfield, is seen presenting a workshop performance with some musicians and singers and himself narrating and singing at the piano keyboard. Afterwards, two established figures of the musical theatre world take to the stage and offer their advice and criticism. Richard Kind plays a fictional person called Walter Bloom (based, it is suggested, on the composer and lyricist Charles Strouse). The other is Sondheim himself – whose simple presence in the room stuns and awes all the young hopefuls – a rumpled, donnish, bearded figure, modestly retreating behind his shy mannerisms.Bloom is a supercilious, condescending fellow who dismisses the oddities and complexities of Larsen’s work and says that it’ll never work commercially. But then Sondheim speaks and says that these are the things which make him like Larsen’s work – and of course the submissive creep Bloom instantly tries turning around 180 degrees and claiming that he agrees. And what made me love this scene the most is that Sondheim says that the “tunes” are “swell”. This is the way a New Yorker of the old school speaks – there’s casual heft and authenticity in his words. And the simple spectacle of this great figure, taking time out of his day to help people coming up, is very moving. Peter Bradshaw Of all the movies released this year – or in fact this century – this is the one that looked most disastrous on paper. I remember sweating over Sir Gawain and the Green Knight at university: that plus Dev Patel plus the guy who directed Pete’s Dragon and A Ghost Story? You’re having a laugh. But the laugh was on us, and to be honest, pretty much every frame of The Green Knight is a movie moment in itself. If I had to pick one, it’s probably the pivotal moment when the tree-faced warrior gets his head separated from his shoulders, and then creepily, comes back to life, picks his head up and gallops his horse out of the door. Despite the batsqueak of Monty Python and the Holy Grail (“Tis but a scratch!”) this is as stunning as anything else in the film. Andrew Pulver Pablo Larrain’s remarkable, almost fully fictional biopic flirts extensively with camp, as befits a study of an celebrity already exaggeratedly set in the public’s imagination via tabloid culture and kitsch iconography. But that tendency reaches its apotheosis in an exquisitely nightmarish banquet scene, where the combination of still royal decorum and fevered mental illness prove entirely too much for Kristen Stewart’s frail, exhausted Princess Diana to bear. Frantically, the tugs at the chunky string of pearls around her neck – lovelessly gifted by her husband – that may as well a noose. Finally, it comes apart, shallot-sized pearls scattering and bouncing across the dinner table – and bobbing into her pale green soup. Naturally, she scoops them up with a spoon and gets chewing. It’s a dream sequence of nakedly absurd horror, risking immense bad taste in its allusion to Diana’s eating disorder. Yet there’s something strangely powerful, too, about its spectacle of a woman attempting to destroy (to eat, even) her own stifling privilege. Guy Lodge",Arts/Film,Aqua aerobics! Awkward sex! Justin Bieber! The best movie moments of 2021,https://www.theguardian.com/film/2021/dec/24/best-movie-moments-2021-in-the-heights-power-of-the-dog
12/24/2021,"Not so fast. The stuttering form of leaders Fulham and second-placed Bournemouth – neither have won any of their past five matches – has knitted things together towards the summit to tee up an intriguing second half of the season. A four-point blanket covers the top four, with Blackburn nestled in third above West Brom after bouncing back from a freak 7-0 trouncing by Fulham last month (it was only the second time they had lost a league game by more than a single goal since October 2020) by recording six wins in seven games, conceding twice. Among those on the Fulham scoresheet was Aleksandar Mitrovic, who has 25 goals in 27 games for club and country this season and whose league tally of 22 means he has outscored four strugglers in the division: Hull, Peterborough, Barnsley and Derby.  Blackburn, who finished 15th last season, are the surprise package. In the summer they reinvested £400,000 of the £15m they received for talisman Adam Armstrong on a left-back from League One (Tayo Edun), Harvey Elliott and Taylor Harwood-Bellis exited after productive loan spells, a dozen senior players departed and yet they are mounting an unlikely promotion charge. Ben Brereton Díaz, the Stoke-born former England Under-19s striker turned Chile sensation, has provided a stream of goals, and the home-grown midfielders Lewis Travis and John Buckley have also impressed. Brereton Díaz has scored 19 in 23 games since adding his mother’s maiden name to his shirt in August, compared with nine in his previous 80 matches. West Brom are strong defensively but urgently require a bona fide No 9 to kill teams off, with Valérien Ismaël keen on reuniting with Daryl Dike. Bournemouth seemed untouchable for so long, Lloyd Kelly and Gary Cahill forming a peerless partnership, but defensive sloppiness has crept in. Fulham’s lead may have been shredded but budging them off pole position is another thing. They are blessed with midfield options, including the rejuvenated Jean Michaël Seri, the often-overlooked Neeskens Kebano, and Harry Wilson, who tends to enjoy himself at this level. Then there is Mitrovic. Five points separate fifth-placed Queens Park Rangers and Blackpool, who continue to make impressive strides under Neil Critchley, in 13th but the former can point to two games in hand on most rivals as an opportunity to move level with West Brom. Nottingham Forest were bottom with a solitary point when Chris Hughton was sacked in mid-September but a few months on the outlook is distinctly different. Steve Cooper’s side are motoring in the rear-view mirror of sixth-placed Stoke City, who seem to have struck a healthy balance between experience and youthful exuberance – they have not paid a fee for any player over the age of 23 since Michael O’Neill took charge two years ago – with Mario Vrancic and Josh Tymon impressing at either end of the scale. Sheffield United are brimming with confidence after replacing Slavisa Jokanovic with Paul Heckingbottom and look well stocked to push on from mid-table. The majority of the squad that won promotion to the Premier League under Chris Wilder remain – Billy Sharp, Ollie Norwood and John Egan continue to be key pillars – but in Iliman Ndiaye who, like Sorba Thomas at Huddersfield, made big strides at non-league Boreham Wood, they possess a welcome unpredictability. The 21-year-old forward ran from inside his own half on Monday to beat Fulham and earn a fourth straight win. “You’ve not seen the best of him yet,” was Heckingbottom’s verdict. Wilder is now at Middlesbrough and has overseen an impressive upturn, which has restored optimism, though they may need to bolster their forward line to sustain their push. Coventry City have lost momentum in recent weeks but Mark Robins’ side, for whom Callum O’Hare has been particularly instrumental, remain very much in the conversation. Their unlikely ascent towards the top is one of the stories of the season. Millwall and Huddersfield appear too inconsistent to trouble the top six. Weighed down by a 21-point penalty, Derby County’s primary focus is on surviving as a club, never mind in the division. Any hopes of staying up vanished a long time ago but Wayne Rooney continues to pull results out of the bag with a mishmash of a squad. The administrators, Quantuma, remain confident of selling the club in January. Last month supporters clubbed together to pay off the club’s £8,304 debt to St John Ambulance, one of dozens of creditors. Reading are another side nursing a points deduction for breaching financial rules. They have no shortage of pedigree – Andy Carroll, Junior Hoilett, Danny Drinkwater, Scott Dann, Alen Halilovic, Baba Rahman, George Puscas, the list goes on – but a team that began last season so promisingly have shown few signs of taking flight, even if John Swift has been one of the division’s standout performers for a team one place above the drop. Peterborough are leaking goals but are in no way adrift and will hope to drag Cardiff, Hull, who have lost only one of their past seven games, Bristol City and Birmingham into trouble. Second-bottom Barnsley have got nowhere near replicating a memorable last campaign – they have won one of their past 21 matches and are the division’s lowest scorers – but the head coach, Poya Asbaghi, can see green shoots. “I’m sure when we start winning that we can create a machine that goes on and on,” he says.",Sport/Football,Championship at halfway: Blackburn surge and remarkable Forest revival,https://www.theguardian.com/football/football-league-blog/2021/dec/24/championship-at-halfway-blackburn-nottingham-forest-fulham
12/24/2021,,Lifestyle/Life and style,Can you beat Mastermind? It’s Clive Myrie’s Christmas quiz!,https://www.theguardian.com/lifeandstyle/2021/dec/24/can-you-beat-mastermind-its-clive-myrie-christmas-quiz
