3/22/2022,"The Dubai-based owner of P&O Ferries is set to benefit from at least £50m of UK taxpayer support as part of the government’s freeport programme, raising questions over its role in the scheme after the sacking of 800 workers. DP World, the Emirati logistics giant behind P&O, runs the UK’s second and third-biggest shipping terminals at Southampton and London Gateway – locations among the first 12 freeports in the UK to be picked by the government last year as a flagship part of its levelling up agenda. Under the plans, each site will receive £25m of seed capital funding from the public purse to upgrade infrastructure, as part of the scheme championed by the chancellor, Rishi Sunak. Each location also benefits from tax breaks designed to encourage business investment, economic growth and job creation, with an upfront cost to taxpayers’ worth £500m over five years for all 12 freeports. However, trade union leaders and opposition MPs questioned whether DP World should play a role in the programme after the sacking without notice of 800 P&O seafarers last week. Mick Lynch, the general secretary of the RMT trade union, said: “It’s beyond belief that a company which has treated British workers in such a brutal and callous fashion could still be in the frame for a £50m windfall from the British taxpayer. The government should be banning and sanctioning this bunch of corporate oligarchs in the strongest possible fashion until they reinstate the sacked workforce.” Under the freeport programme in Scotland and Wales, operators are required to demonstrate plans for high quality employment and fair work practices – including the payment of the real living wage, as part of measures imposed by the devolved governments. However, the UK government did not pursue similar rules for English freeports, leading to criticisms of the scheme. The government insists UK employment laws apply across the country, including in freeports. “People are horrified with what they’ve seen at P&O,” said Andy McDonald, the Labour MP for Middlesbrough who counts the Teesside freeport within his constituency. “There’s no conditionality about this whatsoever [at freeports]. It guarantees corporate profit. It’s corporate welfare on an industrial scale.” The former shadow employment rights secretary said the government needed to reconsider who it does business with. “All they [freeport operators] want is to extract value out of freeports and it’s not going to make a jot of difference to poverty, health, life expectancy or anything else. They’re going to take the money and run,” he said. As well as the benefits accruing from the freeports, DP World is set for significant UK government support for its African expansion plans. The UK will be the minority partner in a joint venture in three African ports – in Senegal, Egypt and Somaliland – that will be run by DP World, with an initial $320m (£242m) investment – the largest single investment that the UK’s investment arm has ever made. The sovereign wealth fund – known as CDC Group, shortly to be renamed British International Investments or BII – said last October it would be investing up to a further $400m in DP World ports and logistics operations in Africa. BII told the Financial Times last year that it had “a shared vision with DP World … Our investment allows them to stretch their dollar further, to do more”. A spokesperson for BII said the ports were “three of about 170 different businesses in which DP World has an interest. They are entirely separate, both operationally and financially, from the P&O Ferries business.” Last autumn DP World’s chair and chief executive, Sultan Ahmed Bin Sulayem, announced a £300m investment in its London Gateway port at an event marking the commercial launch of the Thames freeport. DP World is also investing £40m at the port of Southampton. With posed photographs alongside the chancellor, Rishi Sunak, and the transport secretary, Grant Shapps, at the Savoy hotel in London, Bin Sulayem said the firm planned to be “at the heart of Britain’s trading future” and that its investment would boost economic growth, jobs and living standards. Sunak said at the time he was “thrilled” with the investment. A government spokesperson said: “The government has been clear that we are appalled by the way P&O have behaved towards their employees and Department for Transport ministers have raised this directly with P&O company chiefs. “We are working urgently to establish the facts of what has happened in this case, and whether P&O or DP World are in breach of any of the requirements on them as partners in the Thames and Solent freeports.” A spokesperson for DP World in the UK said: “Our operation at DP World Southampton will not directly receive any public funds as part of Solent freeport. “The £11m of infrastructure funding, for which we have applied at DP World London Gateway should be seen alongside the £300m we are investing in a new fourth berth at the site, and the further £1bn which has been earmarked for investment in the UK over the next 10 years.”",News/Business,P&O Ferries’ owner to benefit from at least £50m of UK freeport scheme,https://www.theguardian.com/business/2022/mar/21/po-ferries-owner-to-benefit-from-at-least-50m-of-uk-freeport-scheme
3/22/2022,"The UK government has known for many years that if it paid a £400m debt to Iran it was likely to lead to the release of Nazanin Zaghari-Ratcliffe, the former Foreign Office minister Alistair Burt has said in a letter to the foreign affairs select committee. Burt, a Tory MP until 2019, is calling for the committee to launch an inquiry into why the debt was not paid and into who – either in the governments of the UK or the US – resisted making the payment. Zaghari-Ratcliffe, 43, was released last week immediately after the UK paid the debt, and at a press conference on Monday she asked why it had taken five foreign secretaries and six years to secure her release. Burt also said he repeatedly urged the government to pay the £400m, which he said was “not a ransom, but a debt owed”. Burt was Middle East minister between 2017 and 2019, and says even now he is not sure what forces were preventing the debt’s payment. It is the first time a former minister has revealed so much about the clashes within government over the failure to secure Zaghari-Ratcliffe’s release earlier. It is understood Burt has told the committee he is prepared to give evidence in public or private. The £400m debt relates to a 1970s arms deal in which the UK took money from the Shah of Iran but then did not deliver the promised Chieftain tanks after he was deposed by Islamic revolutionaries. In his letter to the committee, Burt is careful to say he could not have known for sure if the payment would have led to the release of Zaghari-Ratcliffe and Anoosheh Ashoori, another dual national. But, he said, he did know from his discussions with senior Iranian ministers that payment represented a chance to open up a new relationship with Iran and “remove an impediment to the relationship and possibly their release”. He said he had reported to the then foreign secretary Boris Johnson (in office from 2016 to 2018) that from his dealings with the then Iranian foreign minister, Abbas Araghchi, he understood that “payment of the debt was fundamental to their release”. Burt also said he knew there were practical difficulties in paying the debt because of US sanctions, but routes were explored including payment in humanitarian aid or through undertakings by the Iranian foreign ministry that the money would not go to the Iranian army. It is understood that Burt at one point formed a view that the defence secretary Gavin Williamson at the time was opposed to the payment and challenged him, leading to a row, but he never received a direct response. Other possible blockages were the US government led by Donald Trump. Burt has also let it be known that he would be happy for his ministerial papers showing his advocacy of paying the debt to be placed on the public record in front of any foreign affairs select committee inquiry. The foreign affairs committee has also been asked to launch an inquiry by Tulip Siddiq, the Labour MP for Hampstead, and the MP representing Richard Ratcliffe, the husband of Zaghari-Ratcliffe. Burt, an experienced and respected figure across the Middle East, is curious to know if the resistance was internal inside the government or came from the Trump administration. In his letter, he writes: “I believe now we need to find out who or what stopped the payments.” Ratcliffe has said he believes a parliamentary inquiry is the best route to finding the truth, as opposed to seeking judicial review. Ministers may be reluctant for an inquiry to take place if it starts to unearth the degree to which UK policy on Iran, and the fate of the dual nationals, was being dictated by pressure from the Trump administration. In a clue to the attitude of the Trump administration to payment of the debt, Mike Pompeo, secretary of state under Trump, last week accused Britain of paying blood money by clearing its debt. ",News/News,Nazanin Zaghari-Ratcliffe: ex-Tory MP urges inquiry into why Iran debt went unpaid ,https://www.theguardian.com/news/2022/mar/21/former-tory-minister-urges-inquiry-into-why-debt-owed-to-iran-went-unpaid
3/22/2022,"In Washington on Monday, the Texas senator Ted Cruz complained that supreme court confirmation hearings have become increasingly angry and confrontational. In Bozeman, Montana the previous day, however, the Republican was filmed becoming angry and confrontational with airport staff and an armed police officer. A short video, appearing to have been shot from behind a check-in desk, was posted to Reddit. It showed the masked senator remonstrating with the two staff members, both women, and the male officer. It was not possible to hear what was said. A caption said: “Ted Cruz accosting airline employees today at BZN after missing his flight. Law enforcement had to be called when he wouldn’t calm down.” An airport official told the Daily Mail the senator missed his check-in window for a flight and became “frustrated” as other options were limited due to spring break traffic. “One of our public safety officers was in the ticket lobby and was asked to assist with a frustrated passenger at the United ticket counter (which is not unusual),” said Scott Humphrey, the Bozeman airport deputy director. “Once travel options were explained to the passenger, he was rebooked and departed Bozeman later that evening. Our [officer] didn’t realise he was dealing with Senator Cruz until after the fact.” Cruz made it to Washington for the opening on Monday of hearings for Ketanji Brown Jackson, Joe Biden’s first supreme court nominee. The senator did not immediately comment about his experience at Bozeman airport. Critics online did. Rick Wilson, a former Republican operative and co-founder of the anti-Trump Lincoln Project, said: “Ted Cruz getting aggro with airline counter folks is so very on-brand. ‘Well, sir, if you don’t like your flight options, we can drive you to the train station.’” Keith Olbermann, a writer and TV host, said: “So Ted Cruz was apparently so out-of-control abusive to airline staff at the airport in Bozeman, Montana, that law enforcement had to get involved. It must’ve been snowing.” That was a reference to events in Texas and Mexico last year, when Cruz left his state during a lethal big freeze to fly out for a family break in Cancun. Amid controversy, Cruz admitted his mistake and flew home. Online, some altered Donald Trump’s old nickname for his rival, Lyin’ Ted, to call the senator Flyin’ Ted instead. Responding to coverage of his Cancun escapade, Cruz said: “Here’s a suggestion. Just don’t be assholes. Just, you know, treat each other as human beings, have to some degree some modicum of respect.”",News/US news,Ted Cruz laments angry supreme court hearings a day after angry airport fracas,https://www.theguardian.com/us-news/2022/mar/21/ted-cruz-supreme-court-hearings-airport
3/22/2022,"A report in The Athletic on Monday adds new details to Urban Meyer’s disastrous and brief time as Jacksonville Jaguars head coach. Meyer’s reign in Jacksonville lasted just 13 games as he became the latest successful college coach to fail in the NFL. According to The Athletic, Meyer told the Jaguars he has researched NFL players extensively as he prepared to step up to the professional game. However, it soon became apparent his knowledge was barely above the level of the most casual of NFL fans. Sources said Meyer was unaware of Pro Bowl players such as Jamal Adams and Deebo Samuel and, most damning, appeared to be unfamiliar with arguably the most talented player in the league, three-time defensive player of the year Aaron Donald. According to one source, Meyer asked: “Who’s this 99 guy on the Rams? I’m hearing he might be a problem for us.” During preseason he insulted a room full of players by saying they would not be able to get a job for “$15 an hour” if he cut them. In another meeting he reduced one player to tears and one member of the Jaguars was so incensed by the incident that he reportedly confronted the coach about it the following day. According to wide receiver DJ Chark, no one at the Jaguars felt safe during Meyer’s tenure. “He feels like threats are what motivates,” Chark told The Athletic. “I know he would come up to us and tell us if the receivers weren’t doing good, he wasn’t going to fire us, he was going to fire our coach. He would usually say that when the coach was around.” A veteran staff member described Meyer’s time in charge as “the most toxic environment I’ve ever been a part of.” Meyer would also reportedly blame his own unpopular coaching decision on his staff rather than taking responsibility himself. In January, Meyer admitted he had failed at the Jaguars. “It was the worst experience I’ve had in my professional lifetime,” Meyer said in an appearance on Don’t @ Me with Dan Dakich. “What really got me, I almost don’t want to say people accept it, I mean, you lose a game, and you just keep ... I would seriously have self-talk. I went through that whole depression thing too, where I’d stare at the ceilings and [think] ‘Are we doing everything possible?’ because I really believed we had a roster that was good enough to win games. I just don’t think we did a great job.” One of Meyer’s most damning decisions came following a Thursday night game at Cincinnati last September. He chose to stay behind with family instead of flying home with his team and then was caught on video the following night behaving inappropriately with a woman at a bar in Columbus, Ohio. Jaguars owner Shad Khan publicly reprimanded Meyer at the time, saying he needed to regain the owner’s trust and respect.",Sport/Sport,"‘Who’s this 99 guy?’: Meyer didn’t recognize NFL stars during Jags reign, says report",https://www.theguardian.com/sport/2022/mar/21/urban-meyer-aaron-donald-jacksonville-jaguars-nfl-football-coach
3/22/2022,"Polly Toynbee suggests that her lucky generation of homeowners with work pensions should be targeted to provide much-needed assistance for those less fortunate (Pensioner poverty is at a new high – so why are older people still voting Tory?, 18 March). As someone who relies on a work pension (and who has never voted Tory), might I point out that I and millions of others pay tax on this pension in the same way as I have done all my adult life. Also, like many people in a similar situation, I use this modest pension to help support adult children who are either forced to rent privately or are required to pay an arm and a leg to get on the property ladder. Unfortunately, Toynbee appears to be falling into the HMRC trap of hitting a captive audience (AKA shooting fish in a barrel) while properly redistributive wealth taxes, windfall taxes and accountable public control of energy and infrastructure remain comfortably bedded in their “too difficult” boxes.Ian FraserNewtown, Powys  Polly Toynbee wonders “how to lever some of the unearned wealth out of my lucky generation of homeowners with old-fashioned work pensions and redistribute it … ” Many better-off pensioners will argue that they worked hard all their lives and contributed to a pension fund, so they are entitled to a comfortable old age. There is probably little to be gained from responding that millions of people, particularly women, also worked hard all their lives in low-wage jobs but had no possibility of a work pension or house purchase. But it’s not necessary to appeal to altruism. It’s in our own interest as we get older to pay a bit more tax if we can afford it, given our increasing reliance on public services. It would take some of the burden off our children and grandchildren and leave more of the tax take for poverty relief. There is no magic money tree, nor is there a magic doctor tree. If we want to grow more doctors, we must invest more in education and health, and better-off pensioners need to chip in.Janet DobsonYork  Have an opinion on anything you’ve read in the Guardian today? Please email us your letter and it will be considered for publication.",News/Society,Taxing questions for wealthy pensioners | Letters,https://www.theguardian.com/society/2022/mar/21/taxing-questions-for-wealthy-pensioners
3/22/2022,"Re your editorial on forgotten wars (17 March), Mercy Corps is one of the many organisations seeing the impact of international neglect on numerous crises. The repercussions of the Ukraine war are already being felt globally in rising food and energy prices. While we’re deploying a major response in Ukraine, we can’t take our foot off the pedal in other countries. We need donors to match their compassion for all those living through war and the impact of climate change. Afghanistan’s economy and social systems are facing collapse, with millions of lives at stake. As drought worsens across the Horn of Africa, 13 million people face hunger in Ethiopia, Kenya and Somalia. In Yemen, 66% of the population – 20 million people – are in urgent need of humanitarian assistance. The decision to slash the aid budget was always going to come at the expense of some of the world’s most marginalised people. The UK must bring its aid budget back in line with 0.7% of gross national income as a matter of urgency.Michael McKeanMercy Corps Europe  Have an opinion on anything you’ve read in the Guardian today? Please email us your letter and it will be considered for publication.",News/Global development,Victims of other humanitarian crises need urgent help too | Letter,https://www.theguardian.com/global-development/2022/mar/21/victims-of-other-humanitarian-crises-need-urgent-help-too
3/22/2022,"I was pleased to read that the US Senate has approved measures so Americans can have more sunlight in the evenings (‘No more switching clocks’: Senate passes act to make daylight saving time permanent, 16 March). This has been discussed on numerous occasions in the UK; indeed a private member’s bill some years ago from the Conservative MP Rebecca Harris failed through lack of time. The benefits of the UK moving forward by an hour are numerous, apart from the considerable advantage to businesses of having the same times as most of western Europe. Longer, lighter evenings will provide more leisure opportunities and a healthier lifestyle as more people are likely to cycle or walk in the evenings. There will be fewer times when children are walking or cycling back home from school in the dark. Furthermore, there are likely to be reductions in household fuel consumption. Such savings will help the economy and our efforts to tackle climate change.Mike ParkerWitney, Oxfordshire  Have an opinion on anything you’ve read in the Guardian today? Please email us your letter and it will be considered for publication.",News/Environment,Springing forward to light up the day  | Letters ,https://www.theguardian.com/environment/2022/mar/21/springing-forward-to-light-up-the-day
3/22/2022,"Last Thursday, I received an official brown envelope with a Swansea return address. Could this possibly be my renewed driving licence that I had requested (as directed) via DVLA Swansea and acknowledged by it on 22 June 2021? It was instead the DVLA registration certificate for a car that I had bought three days earlier, swiftly noting its acquisition and documenting all amendments provided. I cannot understand how two departments of the DVLA could be operating with such different levels of efficiency. This suggests that the agency requires a shake-up in management to ease the problems that motorists have been facing. Might a solution be the issue of a temporary paper document like a registration certificate for a named driver, until a huge effort is made to clear the licence backlog with the intervention of the ministry concerned?Angela MacTavishBognor Regis, West Sussex  Have an opinion on anything you’ve read in the Guardian today? Please email us your letter and it will be considered for publication.",Lifestyle/Money,Driven to despair by disarray at DVLA | Letters ,https://www.theguardian.com/money/2022/mar/21/driven-to-despair-by-disarray-at-dvla
3/22/2022,"How kind of the prime minister to compare me, and the other 48% who voted to remain in the EU, with the murderous regime of Vladimir Putin (Rishi Sunak defends Boris Johnson from fury over remarks on Brexit and Ukraine, 20 March). What a great way to bring the country together and heal our divisions. It is also ironic if you consider that the Ukrainian government is seeking to bolster its freedom by joining the EU, and we can be confident which way Putin would have voted in the Brexit referendum.Don CastleCaterham, Surrey  Boris Johnson is half right: there are comparisons to be made between the conflict in Ukraine and Brexit. Both involve hostile Russian interference in the affairs of a sovereign nation. The difference is that the Ukrainians, unlike the UK government in 2016, are trying to stop it.Mark WalfordLondon  The prime minister is right in one respect: both Brexit and the war in Ukraine are based on politicians’ lies.Jim WaightHertford, Hertfordshire  Have an opinion on anything you’ve read in the Guardian today? Please email us your letter and it will be considered for publication.",News/Politics,Drawing parallels between Brexit and war in Ukraine | Letters,https://www.theguardian.com/politics/2022/mar/21/drawing-parallels-between-brexit-and-war-in-ukraine
3/22/2022,"Many films are too long for bladder comfort (21 March), but help may well be at hand at an independent cinema near you. At our local, The Rex in Elland, West Yorkshire, there’s always an intermission with local ice-cream on sale, as well as tea and coffee. If you are lucky, it may also be an evening when the organist entertains.Caroline ColeHuddersfield, West Yorkshire  Contrary to what Pete Wedderburn says (Yes, your dog can go vegan – but cats are natural born killers, 18 march), cats can go vegan too. In the second world war, our two family cats thrived on a diet of brown bread and Yeastrel.Jeremy GoringSt Leonards-on-Sea, East Sussex  “Always put your complaint in writing” is good advice (How to complain effectively – and get results, 21 March). But emailing is not as easy as suggested. Most corporations only grudgingly reveal their email addresses. They prefer to point customers to FAQs on their website.Bob JonesWorcester  Thank you, Alys Fowler, for reminding us of the importance of the humble weed (16 March). But can people stop using the nickname “sticky willie” for the cleaver? The Cumbrian name for this plant that likes to cling to things is “sweetheart”. A nicer alternative – I should know.Alan CleaverWhitehaven, Cumbria  Congratulations on printing articles that are interesting to my age group – 70-plus – such as Esther Rantzen on digital scams (10 March) and the one about Mary Dickins (A new start after 60, 21 March). How about a regular page for the over-70s?Jane EdmondsBeaconsfield, Buckinghamshire  Have an opinion on anything you’ve read in the Guardian today? Please email us your letter and it will be considered for publication.",Arts/Film,Saved by a screen break at the cinema | Brief letters ,https://www.theguardian.com/film/2022/mar/21/saved-by-a-screen-break-at-the-cinema
