1/21/2022,"In the pandemic’s darkest days, when our horizons were largely limited to the four walls of our house and the very notion of attending a ‘gig’ seemed completely preposterous, something amazing happened. Across the music industry, artists and bands dug out their webcams (or high quality recording equipment), ushering in the age of the livestreamed gig. Some of these performances were strikingly professional – mammoth pyrotechnic happenings beamed from cavernous super-clubs – while others were endearingly homespun, putting the ‘bedroom’ into bedroom pop. But they all shared an admirable desire to put on a show in trying times.  Still, I think I’m finally ready to admit, nearly two years into the ‘age of the live stream gig’, that pretty much all of those performances left me somewhat cold. No shade cast on the performers, who were busting a gut as per. It was simply that, without the thrum of the crowd, the atmosphere frequently felt funereal. It reminded me of the days of Top of the Pops, when a band like U2 couldn’t (or wouldn’t) make it to the studio and would instead play a sterile, audience-less beamed in from LA. It would invariably fall flat, not least when followed by footage of people pogo-ing around to Aqua or someone similarly naff back in the studio. At the same time, I recognise that this is perhaps a churlish position to take. There are plenty of people who can’t make it back to live performances, who are well-served by live streams. There are fans halfway across the world, unlikely to get the chance to see a band live, who are well-served by live streams. There was the music industry itself, which was given a valuable leg-up by live streams at a desperate time. Clearly live streams are a good thing – even if they’re not as good as the real thing. The heartening news, then, is that the return of actual gigs with actual audiences hasn’t killed off the live stream era. Instead, it has enhanced it. Next weekend Jonny Greenwood and Thom Yorke’s new band The Smile play their first ever performances in front of fans (seated and in the round) at a small venue in London. Unsurprisingly it’s a sellout, but Radiohead superfans can at least have the consolation of catching the performances over live stream at home. Or they can go and watch them at a local venue in the UK or the US. This of course is nothing new – globe-straddling, chart-topping artists have been livestreaming performances for a decade or so now. The difference is that, where once the tools of such performances were only available to those at the top of the tree, now they’re accessible to smaller artists too, thanks to canny companies like Hotel Radio, who broadcast gigs from punk, hardcore and metal bands to every corner of the globe. And, in contrast to the old days of getting fleeced by dubious promoters, artists are taking their fair share from these streams thanks to a host of ethical companies. The era of livestreaming has much to offer. I’m all for it – as long as it doesn’t involve me watching someone playing acoustic guitar from a box room. If you want to read the complete version of this newsletter please subscribe to receive The Guide in your inbox every Friday.",Arts/Culture,The Guide #18: livestreamed gigs have changed music – for the better,https://www.theguardian.com/culture/2022/jan/21/livestreamed-gigs-coronavirus
1/21/2022,"Peloton is considering workforce cuts and production changes as investors hammered its share price after a report said it was considering halting the manufacture of its exercise bikes because of a slump in demand. The company’s chief executive, John Foley, said a report by CNBC claiming that it plans to temporarily halt production of its exercise bike and treadmill products was “incomplete, out of context, and not reflective of Peloton’s strategy”.  However, Foley said in the message to Peloton’s 3,200 staff that the company needed to “evaluate” the size of its workforce and indicated that production curbs are on the way as he referred to “resetting” manufacturing. The CNBC report cites internal company documents and Foley said in a blogpost published on Thursday that “we have identified a leaker, and we are moving forward with the appropriate legal action”. He added: “In the past, we’ve said layoffs would be the absolute last lever we would ever hope to pull. However, we now need to evaluate our organisation structure and size of our team, with the utmost care and compassion.” Describing the halting of all production of bikes and treadmills as “false”, Foley then said the company would be “resetting” production levels, acknowledging that there had been a surge in demand for Peloton equipment when Covid lockdowns were introduced at the start of the pandemic. The easing of restrictions around the world, however, has shifted exercise habits back to gyms and outdoor activity. This week the UK prime minister, Boris Johnson, announced the lifting of work from home guidance – a big driver of demand for at-home exercise equipment – in England. “We feel good about right-sizing our production, and, as we evolve to more seasonal demand curves, we are resetting our production levels for sustainable growth,” said Foley. Peloton’s shares fell 24% on Thursday following the CNBC report, which said the company plans to pause bike production from February to March and its Tread treadmill machine for six weeks from next month. CNBC cited a 10 January presentation in which the company said it was facing a “significant reduction” in demand around the world as a result of price sensitivity – its bikes start at £1,350 in the UK – and increased competition. Peloton had said on Thursday that it was taking “significant corrective actions” to improve its profitability and estimated second-quarter revenue to be about $1.14bn (£840m), compared with its previous forecast of $1.1bn to $1.2bn. “During the pandemic, there was too little supply to meet the growing demand. Unfortunately, the company took those cues to bulk up supply just as demand began to falter,” said Simeon Siegel, analyst at BMO Capital Markets. Peloton has been working with consulting firm McKinsey & Co for a review of its cost structure and could cut jobs, CNBC reported earlier this week.",News/Business,Peloton hints at cuts after report on fall in demand for exercise bikes,https://www.theguardian.com/business/2022/jan/21/peloton-hints-at-cuts-after-report-on-fall-in-demand-for-exercise-bikes
1/21/2022,"Norfolk has become the latest area in England to start transferring patients to a hotel in order to free up hospital beds. The Norfolk and Waveney clinical commissioning group (CCG) said the hotel would act as a temporary care facility, after the service declared a critical incident this month due to “sustained and unprecedented pressure”.  The pilot “care hotel” in central Norwich will cater for up to 15 patients on a short-term basis for three months and will be used for patients who are ready to leave hospital but need extra support before going home. It is expected to open in the next few weeks. The accommodation will be run by home care company Abicare, which has similar services in other areas of the country, including three hotels in the south of England. Cath Byford, the chief nurse at Norfolk and Waveney CCG, said the pilot would “provide a short-term safe, home-from-home environment for people to move to from hospital when they are well enough but not quite ready to go home without support”. “This will help to speed up the passage of patients through our local hospitals so that we can make more beds available for those who need them most,” she said. “This is the first time we have tried this new approach in Norfolk and Waveney, although the model has been used successfully in other regions.” Anne-Marie Perry, the chief executive of Abicare, said care hotels “are an excellent example of a proactive short-term solution that can be readily set up as they are needed utilising resources that exist within the community”. She previously said the severe shortage of domiciliary care workers able to look after people in their own homes is one of the factors behind the need for such services. “The hospitals are on their knees and we are being contacted fairly regularly by clinical commission groups,” she said.",News/Society,‘Care hotel’ set up in Norwich to relieve ‘unprecedented’ pressure on hospitals,https://www.theguardian.com/society/2022/jan/21/care-hotel-set-up-in-norwich-to-relieve-unprecedented-pressure-on-hospitals
1/21/2022,"Good morning. Senate minority leader Mitch McConnell has provoked anger after he appeared to imply that African Americans were not Americans in remarks about Black voters.  Speaking to reporters after Republicans once again blocked the Democrats’ voting rights legislation, McConnell said: “The concern is misplaced, because if you look at the statistics, African American voters are voting in just as high a percentage as Americans.” Studies suggest that voting restrictions disproportionately obstruct people of colour. Several Democrats called out the comments, which quickly went viral online, with Democratic Illinois congressman Bobby Rush tweeting: “African Americans ARE Americans. #MitchPlease.” Meanwhile, Malcolm Kenyatta, a Democratic Senate candidate in Pennsylvania, described McConnell’s remarks as a “dogwhistle”. What would the bill have done? Banned partisan gerrymandering, protected election officials from partisan interference, required early voting and same-day registration, and restored the pre-clearance provision central to the Voting Rights Act. It comes amid unprecedented concern over the future of US democracy, with one in three Americans believing Joe Biden was not legitimately elected. The US has accused Russia of recruiting Ukrainian government officials in order to take over the Kyiv government. Imposing sanctions on four – two Ukrainian members of parliament and two former officials – on Thursday, the US accused Russian intelligence of mounting a conspiracy against the government of the Ukrainian president, Volodymyr Zelenskiy. “Russia has directed its intelligence services to recruit current and former Ukrainian government officials to prepare to take over the government of Ukraine and to control Ukraine’s critical infrastructure with an occupying Russian force,” the Treasury statement accompanying the sanctions said. Russian troops have arrived in the town of Yelsk in Belarus and other areas near Ukraine’s border, local media reports, as part of joint military exercises set to begin next month. What has Joe Biden said? The president said: “If any assembled Russian units move across the Ukrainian border, that is an invasion. Let there be no doubt if Putin makes this choice, Russia will pay a heavy price.” What sanctions would be imposed? There is disagreement within Nato, with Germany refusing to send arms to Ukraine. There is also dispute in Europe about whether Russia can be cut off from Swift, the international payments system. Ivanka Trump, the daughter of the former president, has been asked to cooperate with the House select committee investigating the Capitol attack. Trump, who has been asked to appear for a voluntary deposition, is the first member of the former president’s family who has been called upon. Along with her husband, Jared Kushner, she was a senior adviser to her father during his presidency. The development comes after the US supreme court rejected Donald Trump’s request to prevent the release of more than 700 highly sensitive White House documents. What does the panel want to ask her about? The former president’s plan to stop the certification, and his response to the Capitol attack. The questions will be aimed at whether he presided over a criminal conspiracy involving obstructing a congressional proceeding. Meanwhile, the prosecutor for Georgia’s biggest county on Thursday requested a special grand jury with subpoena power to support her investigation into the former president’s attempts to interfere with the state’s election results. Dozens of people are feared dead after an explosion caused by a truck carrying mining explosives colliding with a motorbike in western Ghana. The explosion, which destroyed hundreds of buildings, happened around midday in Apiate, near the mining city of Bogoso. The US singer and actor Meat Loaf, born Marvin Lee Aday, has died aged 74, his agent has confirmed. No cause of death was shared. AirTags – small wireless tracking tools – have been used to stalk individuals, police across the US have said. Apple, which manufactures the devices intended for tracking lost belongings like luggage, has said it will cooperate with police and is “committed to AirTags’ privacy and security”. There were a total of 5,981 unruly passenger reports last year, according to Federal Aviation Administration (FAA) records, 4,290 of which were categorized as “mask-related incidents”. In a dramatic example of how the issue persists in 2022, a maskless “disruptive customer” forced an American Airlines flight en route to London to return to Miami on Wednesday. In 1959, Sonny Rollins was already one of the undisputed giants of the bebop style of jazz at 28. But despite his fame and critical acclaim, Rollins felt a sense of dissatisfaction with his playing, which led him to drop off the radar. Rather than playing to packed rooms of fans, for two years the saxophonist chose instead to tell his “multitude of stories to the sky”, playing on the Williamsburg Bridge for up to 15 hours a day. Now 91, Rollins speaks about the “spiritual” experience on the 60th anniversary of his return to the recording studio. This week’s “You be the judge” has all the hallmarks of a classic family grudge: longstanding resentment; unbalanced levels of effort; sibling rivalry. While older sister, Elsie, buys her Ollie designer shirts and AirPods, he sends her “a cheap supermarket card with the sticker still on” (Elsie’s words). Ollie, who is in a lower paid job, argues she “can’t expect” him to match her. You decide who the guilty party is. First Thing is delivered to thousands of inboxes every weekday. If you’re not already signed up, subscribe now. If you have any questions or comments about any of our newsletters please email newsletters@theguardian.com",News/US news,Mitch McConnell’s comments on Black voters spark outrage | First Thing,https://www.theguardian.com/us-news/2022/jan/21/first-thing-mitch-mcconnell-comments-black-voters-spark-outrage
1/21/2022,"Just before you reach Chimbote, a seaside city 260 miles (420km) north of the Peruvian capital Lima, you can smell it. It’s like the whiff of a fishmonger’s stall on a hot afternoon. For Peruvians, it’s synonymous with a bad pong; “smells like Chimbote” means something stinks. Once that scent was “the smell of money”, according to another popular expression. A natural superabundance of Peruvian anchovy – known locally as anchoveta – off its Pacific coast makes Peru the world’s biggest producer of fishmeal, a condensed powder or cake made from ground dried fish.  The country exported a staggering $1.54bn (£1.13bn) in fishmeal processed into animal feed and pellets in 2019 and $420m of fish oil. A recent Guardian investigation that revealed many fish oil products on western supermarket shelves are rancid has been blamed on the fish oil industry’s vast supply chain – with fish caught in Peru, processed in China and shipped to European and American supermarkets. Chimbote has been the first link in this multimillion-dollar chain since the 1950s. But after many decades, Chimbote residents are reevaluating their role in this industry – one they say is not only harming their health and wellbeing, but is damaging the very ocean itself. About 20cm long when mature, the little anchovy has been a gamechanger not only for the Peruvian economy but also for the global fishmeal industry. Oily and rich in protein, it is said to be the most heavily exploited fish in the world’s history and is preferred for high-quality fishmeal and fish oil. About 4.8m tonnes of anchoveta was caught in 2020, according to Peru’s national fishery society (SNP), which represents the sector. Most of the catch – about 98% – is processed into fishmeal: about 1m tonnes of fishmeal and 171,000 tonnes of fish oil by up to 42 companies operating in Chimbote. Eleven of the largest firms are affiliated with the SNP, which says all is well, not just with the industry but with the health of the fish on which it depends. “There hasn’t been concern about overfishing for more than 30 years, as a result of the fishery management plan, which seeks the sustainability of the ecosystem and the fishing industry,” says Cayetana Aljovín, SNP’s president. She says quotas allow a catch of just 35% of the fish’s adult population, leaving the rest to reproduce. But in Chimbote the picture does not look so rosy. The many factories in the south of town produce constant smell, noise and soot from the chimneys. Residents claim the fishmeal processing plants are making them sick. “The smell is nauseating, the vibrations from the factories break the walls of our homes,” says Lizzety Avila, 58, a community leader in the 15 de Abril neighbourhood, where only a brick wall and a road separate the chimney stacks belching fumes from their self-built brick houses. “Year after year, we’ve been fighting these factories,” she says over the whirring and grinding noise emanating from a nearby plant. “We’ve got people with pulmonary fibrosis, bedridden. We have neighbours who have died of cancer. These factories belong to multimillion-dollar companies and they only think about their profits, not about our quality of life, how we suffer living with this pollution.” In the adjoining Trapezio neighbourhood, baker Liz Estrada, 45, says soot from the plants’ chimneys coats the walls of their homes, the washing and gets into the food. “Many people in the area are dying of cancer. The children are sick. We had a school here, and the parents had to withdraw the children because the pollution was tremendous,” says Estrada. The Guardian could not independently verify claims that the pollution had caused cancer, but residents’ claims that a higher than normal number of children were suffering from allergies, respiratory problems and dermatitis were echoed by paediatrician, Dr Lorenzo Rodriguez, who has run a surgery in the city for 16 years. “In the hotspots, where there is a lot of fishmeal processing in Trapezio and 15 de Abril, in previous years I had suggested [to the parents] that they should move their children,” Rodriguez says. “I said: ‘Your children are becoming more asthmatic, you shouldn’t stay there.’ That’s directly caused by these irresponsible companies who don’t look beyond their wallets. “Sadly, the regulatory bodies, the health ministry and the companies – who should collaborate so that the people see that they are not just merely desperate for money – are not doing their part. The state is not playing an active role … and it’s letting this happen,” he said. The SNP, which represents at least eight of the country’s top fishmeal producers, denies there is a rise in respiratory complaints among children indicating that health ministry figures show Ancash, the region where Chimbote is located, is below the national average for such illnesses. It added that the companies in Chimbote had invested $166m (£122m) in recent years to modernise their factories to reduce emissions and to move them away from residential areas. But the impact of the industry is visible everywhere you look. Once at the heart of a region known as the “Pearl of the Pacific”, Chimbote was a major source for guano, the fertiliser made from seabird excrement which powered Peru’s 19th-century economy. Today, the city’s seafront overlooks the Isla Blanca, stained white by centuries of guano – but the cormorants and pelicans are scarcer, and the bay itself, though full of fishing vessels, is no longer teeming with life. Effluent from the factories has polluted this once-pristine coastline for decades, says Romulo Loayza, a biology professor at the National University of Santa in Nuevo Chimbote. On a boat trip into the bay, Loayza uses a small dredger attached to a rope to scoop up foul-smelling sludge from the seabed. “There is virtually no oxygen in this mud. You can see there’s no life,” he said, squishing the dark brown slime between his fingers. “This is organic waste from the factories.” There are about 54 cubic metres of sludge coating the bay’s bottom – in some parts more than a metre thick, according to a 2003 study by Peru’s marine institute, Imarpe. The SNP says most of the sediment comes from El Niño events that have flooded the river, which feeds into the bay. Dozens of piers to individual factories line the bay. Before 2015, lax regulations allowed untreated waste to flow directly into the water. Now a 10km pipeline pumps it into deeper water, but nothing is being done to dispose of the existing waste. Meanwhile, fishers say that the biggest impact of the fishmeal industry is that it’s sucking up all the fish – leaving none for them. In Coishco, one of many nearby fishing villages, the brightly painted boats are pulled up on the white sand – an idyllic-seeming image, but the result of the fishers being forced to find other work. “What affects us most is the scarcity of the resource,” says Edmundo Aparicio, 67, who grew up in the village and recalls a time when fish was so plentiful it was often given away on the beach. “We used to be able to provide for our families, and most importantly, put food on the table for the ordinary folk. Now the fish is scarce, the price goes up, and what we sell in the market goes to restaurants we can’t afford to eat at,” he says. They are also angry with the big fishmeal companies for not treating them properly, they claim. Fishers in Chimbote formed a union 65 years ago. Today, its secretary general, Macedonio Vásquez, alleges that during the first wave of Covid-19 infections the companies brought fishers to work at sea after just one week’s quarantine in a hotel, in violation of the country’s restrictions at the time. Peru has one of the world’s highest death rates from Covid-19 per capita. “The companies did not take the precautions to protect the fishermen,” says Vásquez. “In the hotels, there were many infections which were not taken care of by the companies. The hospitals were saturated.” “Companions died, many died, but the deaths were not attributed to Covid-19 according to the death certificates.” The SNP denied this stating at the time that “the industry adopted provisions beyond what it was legally required to in order to safeguard the health of its employees”. It added the union was forced to retract its allegations after being threatened with legal action. Even if the industry did start to address the concerns of overfishing, pollution and poor labour management, Chimbote’s fishmeal industry could be hit by another problem. Global heating is raising concern about the long-term sustainability of the Peruvian anchovy. Peruvian scientist Renato Salvateci predicted in Science magazine that anchoveta could disappear from the country’s seas due to warming temperatures caused by the climate crisis. If that happens, Chimbote will be left with nothing more to show for its many decades of exploitation other than a polluted bay, empty fish factories and the white stain of the guano industry.",News/Environment,The smell of money: why locals think Peru’s billion-dollar fishmeal sector stinks,https://www.theguardian.com/environment/2022/jan/21/the-smell-of-money-why-locals-think-perus-billion-dollar-fishmeal-sector-stinks
