1/12/2022,"As the pandemic’s second, gruelling year drew to a close and Covid rates in Rio de Janeiro plunged to levels unseen since it began, the Brazilian city’s health secretary, Daniel Soranz, celebrated a desperately needed respite. “We’ve been through such painful, difficult months … this is now a moment of hope,” the 42-year-old doctor said last November as carioca life regained some semblance of normality, hospitals emptied and the city’s effervescent cultural scene was reborn.  But the new year, and the arrival of the highly contagious Omicron variant, has brought Soranz and many others crashing back down to Earth as coronavirus cases surge across Latin America with consequences that remain unclear. “It’s really tiring,” Soranz admitted this week as infections in his beachside city soared to their highest ever levels and plans for Rio’s rumbustious annual carnival were cast into doubt. “This pandemic has been going on for almost two years. It’s exhausting. But there’s nothing to be done,” Soranz said, noting how 20% of Rio’s health workers – about 5,000 people – had been infected since December. Similar angst is being voiced around South America, which, having witnessed some of the pandemic’s bleakest moments – with bodies dumped in mass graves and patients starved of oxygen in overwhelmed hospitals – had been enjoying a long-awaited moment of optimism after becoming one of the world vaccination champions. Nearly 65% of South Americans have been fully vaccinated, according to the University of Oxford’s Our World in Data project, compared with about 62% in Europe and the US, and less than 10% in Africa. So far Argentina seems to be the South American country worst hit by Omicron. Over the last week it registered over 50% of South America’s daily cases, with just 11% of its population, and had the world’s seventh-highest number of daily cases. Although cases are rising in a straight line from a daily average of about 2,400 a month ago to more than 130,000 now, authorities say they are not unduly worried. Their assumption is that Covid has become an endemic disease and vaccination is the only necessary safeguard. The government is relaxing restrictions even more than last September when restaurants, football matches and entertainment venues reopened after a sharp dip in cases, and the outdoor mask mandate was lifted. “In the evolution of the disease you can see that it is really like chickenpox, the flu or that type of disease. The transition to the endemic will no longer require testing all cases and the role of isolation will change,” the health minister, Carla Vizzotti, told journalists on Tuesday. Health official Sandra Tirado predicted cases could begin to fall in the next two weeks and pointed to Córdoba province where Omicron infections were already coming down. Arnaldo Dubin, an ICU doctor at a private Buenos Aires hospital, said he had deep misgivings about Argentina’s Covid policy and believed mask mandates had to return. “It’s horrifying. You have a very serious Covid situation that is paradoxically simultaneous with a total relaxation of safeguards.” Peru, which has one of the world’s worst per-capita death tolls, is also suffering, with more confirmed infections in the first week of January than during its ferocious second wave in early 2021. Other South American countries including Bolivia, Guyana and Uruguay have also seen infections jump while further north, Omicron appears to be rattling Mexico. On Saturday, a record 30,671 coronavirus cases were registered. On Monday, Mexico’s president, Andrés Manuel López Obrador, announced he had tested positive for the second time in a year and was isolating. “I think it’s the flu,” López Obrador, whose dismissive handling of the pandemic has been criticised, had told a press conference earlier in the day. He appeared without a mask despite admitting feeling hoarse. Brazil, which was already facing a major influenza outbreak, is also under pressure although a statistics blackout apparently caused by a hacking attack on the health ministry is hampering efforts to track the surge. Isaac Schrarstzhaupt, a data scientist who monitors Covid statistics, said Brazil was clearly careening into a new wave, with states such as Rio Grande do Sul and São Paulo seeing a “vertiginous increase” in infections similar to that in Europe. “But [because of the blackout] we don’t know the scale of it and I fear we’ll only understand when hospitals start raising their hands to say: ‘Hey, we’re in trouble over here.’” Schrarstzhaupt warned: “Even if there’s a 95% reduction in severe cases, if we hit one million cases a day like the US, the remaining 5% will still be a very big number.” Rio’s health secretary said there was no doubt Omicron was driving a major Covid outbreak there. It had taken Omicron just 17 days to become Rio’s dominant variant, responsible for more than 98% of cases. Previous variants took more than 45 days to do the same. Soranz voiced apprehension about the coming days and could not confirm February’s carnival would go ahead. However, high vaccination levels seemed to be helping prevent a more dramatic crisis – as appears also to be the case in neighbours such as Peru and Argentina, and European countries such as Portugal. Ninety-six per cent of Rio’s adults have been double jabbed and 32% boosted. Soranz said 13 Covid patients were admitted on Sunday: 11 unvaccinated and two with only one shot. “There’s no way to predict what’s going to happen – but we can see it’s spreading much faster and that this is not being accompanied by severe cases or fatalities,” Soranz said, before adding a word of caution: “This could change.”",News/World news,Omicron dims optimism as South America enters pandemic’s third year,https://www.theguardian.com/world/2022/jan/12/south-america-covid-omicron-brazil-argentina
1/12/2022,"While many expect to see rows of bright flowers and pillowy blossoms at the Chelsea flower show, this year star gardens will also feature such biodiverse elements as fungi and a beaver habitat. Garden designers at the annual Royal Horticulture Society (RHS) show have been asked to consider the environment when making their entries.  Though many of the traditional aspects of the show, including the prize flowers in the Great Pavilion, remain, many gardens focus on nature rather than conventional manicured beauty. For the first time, the gardening power of beavers will be displayed at the show. The Rewilding Britain Landscape garden, by the designers Lulu Urquhart and Adam Hunt, will demonstrate how the rodents tend the landscape and let biodiversity thrive. Beavers became extinct in the UK 400 years ago, and only in recent years have they been reintroduced to parts of the country. Their garden will show naturally rewilded landscape in the south-west of England, with the designers saying they will be “showing the role of beavers as incredible bioengineers within a natural ecosystem.” It will feature a beaver dam, and a pool with a lodge behind, and show off a “riparian meadow” of the sort beavers create when they partially flood a riverbank and attract pollinators and other wildlife. The pair said: “The inspiration for the garden comes from seeing the incredible abundance, diversity and beauty that comes from the presence of beavers, a mammal once lost to the British landscape and now reintroduced.” Favourite trees of beavers, including hazel and field maples, have been chosen for the garden, as well as native wildflowers and plants that encourage and support trees such as hawthorn and alder, which provide winter food for many birds and support dozens of insect species. Rather than flowers, the designer Joe Perkins has decided to show off a range of fungi to highlight the “inseparable connection between plants and fungi within woodland ecosystems”. In between buying new roses and water features for their gardens, attenders will learn about the complex mycelium networks that connect and support woodland life, in the exhibit that will make use of trees including sweet chestnut and Douglas fir. The garden will also include species that are used to warmer climates, to highlight how our planting may have to change as a result of a warming planet. While most at the show, to be held in May in the grounds of the Royal hospital, Chelsea, usually focus on what grows in the soil, the dirt itself is the star of the new Blue Peter garden. The designer, Juliet Sergeant, is hoping to “open the eyes of children and adults to the role of soil in supporting life and its potential to help in our fight against climate change”. The garden will feature a subterranean chamber, which will show a soil animation, and soil-themed art by the children of Salford. It also features a roof-top meadow and barley field with common spotted and southern marsh orchids and a two-tonne tree on the planted roof, showing the wide variety of plants that good healthy soil can sustain. Also at the show is a foraging garden by Howard Miller, for the Alder Hey children’s hospital. The garden features a movable foraging kitchen and is designed to help children engage in nature through foraging, sharing healthy food, play, relaxing together and being in the moment. The garden will heavily feature heather and bilberries. Miller said: “One of my favourite childhood memories is going to pick bilberries with my grandparents, My grandpa Harold had a habit of counting 1,000 bilberries into a bag before he would allow himself to talk to us. My grandma Mary and I would sit and eat the bilberries while he wasn’t looking. “The smell of sitting in among heather and bilberries just transports me to that moment. So the takeaway I would like people to have is to give foraging a try, it’s free, it’s good for the soul and it’s a great excuse to connect with nature and each other.”",Lifestyle/Life and style,Chelsea flower show to feature planet-friendly garden designs,https://www.theguardian.com/lifeandstyle/2022/jan/12/chelsea-flower-show-feature-planet-friendly-garden-designs
1/12/2022,"The US postmaster general, Louis DeJoy, has drawn criticism over changes made to the US Postal Service since Donald Trump appointed him in May 2020, which have included delays in services, cuts and consolidation efforts, along with financial conflicts of interest. These changes have continued into the Biden administration amid calls from unions, some elected officials, and progressive groups to oust DeJoy from his position, especially as in the pandemic, postal votes have become increasingly common and a core part of America’s democratic systems.  In March 2021, the USPS unveiled a 10-year austerity plan to improve the financial sustainability of the postal service, which includes implementing longer delivery windows, cuts to branch hours, consolidation and shutdowns of branches and facilities, and postage rate increases. As well as fears over the efficacy of postal voting, the move has raised concerns over impacts on low-income Americans, rural communities and small businesses that rely on these services. “The 10-year plan is a plan for privatization. It just doesn’t use the ‘p’ word,” said Porter McConnell, co-founder of the Save the Post Office Coalition. “It’s already happening. I think what they’ve discovered is that you can privatize without talking about it.” The 1970 Postal Reorganization Act reorganized the USPS into a businesslike organization designed to rely on self-funding through revenue. A 2006 law mandated the USPS pre-fund health benefits for all retirees 75 years into the future, which has contributed significantly to financial troubles for the agency, which receives no government appropriations, unlike other government agencies. “I think the reorganization of the postal service into something that both has a universal service obligation and has to break even was setting them up to fail,” added McConnell. “I don’t think we should be apologetic about a government service being provided where as a democracy it’s not in our best interest to have people in rural Alaska, for example, not be able to get mail service.” As part of the 10-year plan, 18 mail processing facilities around the US were listed for closure in 2021, with plans to consolidate them into other regional cities. In Cape Girardeau, Missouri, postal workers have held informational pickets to raise public awareness in opposition to the closures and consolidations, citing the impacts on workers and degradation in services as a result. The mail processing facility in Cape Girardeau is expected to shut down and be moved to St Louis next month. Greg Davidson, president of American Postal Workers Union (APWU) Local 4088, explained the union had fought plans to consolidate all mail sorting operations to St Louis since 2011. “All of these consolidations, they weren’t anywhere near as successful as what they would say. I would say they were actually disastrous,” said Davidson. “The mail has slowed down. They reduced the service standards.” An audit by the USPS inspector general in 2018 found that slowing mail delivery in 2016 and 2017 resulted in just 5% of the savings the delays were projected to result in, and Davidson argued the decline in services resulted in lost revenue due to customers having to rely on different services because of the delays and consolidations resulting in mis-sorted mail. Davidson said workers had already erroneously received truckloads of mail sent from the St Louis processing center to Cape Girardeau, resulting in delayed deliveries. He anticipates the issues worsening as 31 jobs are set to be eliminated with the mail processing consolidation. Yet as service declines, prices have risen. In August 2021, the USPS implemented rate hikes of 6.8% for regular, first-class mail, 8.8% for package services, and a three-cent increase for a standard stamp. Starting on 9 January 2022, additional price hikes were implemented for priority mail services as part of the USPS 10-year plan. The price increases have been criticized by union leaders as part of the postal service’s shift toward operating as a business rather than a public service, to the detriment of the public. Kimberly Karol, president of the APWU in Iowa, says the increased reliance on private companies to handle mail parcels has led to delays in deliveries, with mail tracking disappearing for periods of time. “This is the closest that we’ve ever come to actually being privatized,” said Karol. “We do everything we possibly can to make sure people get the mail in the way that they are expecting. The plans and the rules that are being put in place are making that nearly impossible for us to do any more and it’s heartbreaking. I’ve been with the postal service for 30 years. That’s a hard thing for us to come to terms with.” In November, the Biden administration nominated two members to join the Postal Service’s board of governors, which has the authority to remove DeJoy from his position as postmaster general. Biden previously appointed three members to the board, while the remaining four were appointed by Trump. Organizers successfully fought to prevent the Biden administration from reappointing Ron Bloom, a key ally of DeJoy, to the board. Jamie Partridge, a retired letter carrier and organizer with Communities and Postal Workers United in Portland, Oregon, emphasized actions had been taken to push current members of the board to oppose DeJoy and the 10-year plan. Advocates for DeJoy’s removal are adamant removing him is necessary to steer the USPS toward reforms required to strengthen the public agency. “Currently I feel like we have some momentum, with the possibility of gaining the majority that is against DeJoy and the 10-year plan, but there’s no guarantee of that,” Partridge said.",News/Business,The fight to oust Louis DeJoy and his ‘disastrous’ austerity plan,https://www.theguardian.com/business/2022/jan/12/fight-louis-dejoy-austerity-plan
