2/22/2022,"Vladimir Putin’s angry and rambling hour-long potted history of Ukraine’s failings on Monday night, culminating in a commitment to recognise the self-proclaimed republics in Donetsk and Luhansk, left western diplomats scratching their heads and wondering whether they had been made redundant. The Russian president not only said he would recognise Russian-controlled territory in Ukraine, rendering eight years of negotiations over their futurepointless, but he also signalled that Russia could not tolerate an independent Ukraine on its borders. Nato was hardly mentioned. His target at one point seemed to be the Bolsheviks, for relinquishing land to the nationalists.  The lecture was a far cry from a statement from Emmanuel Macron’s office 24 hours earlier saying the French and Russian leaders had “made firm commitments to carry out all useful actions to avoid escalation, reduce risks and preserve peace.” Putin said the self-declared republics needed defending from the threat of “genocide”, and parts of Ukraine must be purged of corruption, cells of extremists and the threat of nuclear weapons being pointed “only in a matter of time” at Moscow. “Ukraine is an inalienable part of our own history, culture and spiritual space,” Putin said. “These are our comrades, those dearest to us – not only colleagues, friends and people who once served together, but also relatives, people bound by blood, by family ties.” Much of what was said was a rehash of an article he wrote last summer, but it has become clear this ideology is now guiding his actions and that he needs to be taken literally and seriously. Following the logic of Putin’s speech, it seems only a matter of time before a full invasion of Ukraine to reunite the two peoples will have to take place. Russia, viewed through this lens, cannot face the risk of assault from Ukrainian territory. The “puppet regime” will have to be removed. Yet even now, at this grimmest point, the west does not want to take the final step of breaking off all diplomatic contact with the Kremlin. Diplomats are looking desperately for chinks of light in the gloom. One uncertainty is quite how far the “Russian peacekeepers” will advance. Will Putin recognise all of Luhansk and Donetsk as independent, or just the territory currently held by the Russia-backed separatists? The former would mean pushing his tanks across the line of contact, drastically increasing the possibility of full-blown conflict. The latter is still a breach of international law, and rips up the Minsk accords, but in a way only formalises the existing Russian presence in the area. This uncertainty accounts for why the west is not yet unleashing the full big bazooka of sanctions. There will be coordinated sanctions in Brussels, London and Washington. They will go after entities and people in the self-proclaimed republics, as well as those close to the Putin regime. But the package is unlikely yet to constitute an imposition of export controls and the drying up of finance for Russia in the London capital markets. The discrepancy constitutes a change of tactics if not strategy. At a briefing on 25 January, state department officials insisted: “The gradualism of the past is out, and this time we’ll start at the top of the escalation ladder and stay there. We’ve made efforts to signal this intention very clearly”. Boris Johnson said in Kyiv last week that as soon as a Russian toecap crossed into Ukraine, sanctions would be triggered. But Putin has not quite gone over the brink, hence the caution. A US intelligence official a week ago had likened the west’s tactics in handling Putin to dealing with a kidnapper holding hostages in a booby-trapped building. The first aim was to keep the kidnapper talking. The hope was that a professional negotiator, or a sympathetic family member, perhaps a member of the Russian army, could talk the highly strung kidnapper round and make him realise that whatever his grievances, this is not going to work out well for him in the long term. Even now, Putin is toying with the matches but not yet blown the whole building up. If anything he has now lost some leverage by taking the pressure off Ukraine to offer concessions and leaving his protector China uneasy at the UN security council. He also weakened the advocates of diplomacy in Europe. Macron will defend his efforts to keep Putin talking, even if it is seen as a heroic failure. But his proposed summit on the future security architecture of Europe – still not rejected by the Kremlin – looks doomed. Putin simply cannot be trusted. That leaves the west focusing on the consequences of a breakdown – sanctions, shoring up Nato’s eastern flank, preparing for refugees and finding ways to help the Ukrainian army to make Putin’s price of victory so high that his domestic popularity nosedives along with the rouble.",News/World news,Putin’s rambling Ukraine speech leaves western diplomats scrambling,https://www.theguardian.com/world/2022/feb/22/putin-russian-president-ukraine-speech-western-diplomats-scrambling
2/22/2022,"Jack Smethurst, who has died aged 89, achieved national fame in Love Thy Neighbour, a television sitcom that ran for a phenomenally successful eight series during the 1970s – but was looked back on as racist and, even for its time, anachronistic. He starred as Eddie Booth, the white, Labour-voting, union-supporting factory worker outraged when Bill Reynolds (played by Rudolph Walker), a Conservative-voting black man, not only gets a job in his workplace but also moves in next door to him. The programme’s creators, Vince Powell and Harry Driver, insisted accusations of bigotry were unwarranted because Bill’s views were presented as ignorance and there was prejudice on both sides. Smethurst also said he took the role on the assurance that Eddie would be seen as the one in the wrong.  Meanwhile, the pair’s wives, Joan Booth (Kate Williams) and Barbie Reynolds (Nina Baden-Semper), got along swimmingly and such was the sitcom’s popularity, with viewing figures sometimes exceeding 20 million over a five-year run (1972-76), that it spawned a 1973 film and a 1975 stage tour. The on-screen, off-screen demarcations were seemingly spelled out when Smethurst and Walker played themselves, laughing and joking as they share a drink together at a TV studio, in the 1974 film Man About the House. Despite the criticisms, Love Thy Neighbour was screened around the world and a new version was made for Australian television in 1979, with just Smethurst going with it in a story line that finds Eddie settling in Australia, treated as the “foreigner” and facing conflict. Other television offers went quiet for a while and Smethurst briefly found a job in a flower shop. He later blamed typecasting. “I don’t think it was the racial content,” he said in a 2016 BBC Radio 4 documentary, Still Loving Thy Neighbour? “I think it’s the fact that your face is so familiar. I think people are a lot more adaptable now.” Smethurst was born in the Collyhurst area of Manchester, the third of five children of Kitty (nee Brown), a department store worker, and Bill Smethurst, a packer in a factory. After the family’s home was destroyed by German bombs during the second world war, Jack was evacuated to Blackpool and the family eventually moved to Blackley, Manchester. From an early age, rather than using his given name, John, he was known as Jack, after his maternal uncle, Jackie Brown, a boxing champion. On leaving St Clare’s school, Blackley, at the age of 14 with no qualifications, Jack delivered groceries, then had a job as an apprentice cutter in a raincoat factory and did seasonal agricultural work in Lincolnshire. During national service with the RAF as a corporal in the cookhouse at Cosford, Shropshire, he spent leave time watching plays at Birmingham repertory theatre. It reinforced in him the desire to perform he had felt after seeing the Carl Rosa opera company at Manchester Opera House in his teens. The RAF and Manchester city council then jointly funded him through drama school training, at the London Academy of Dramatic Arts (1954-56). While in Hornchurch for his first repertory theatre work, Smethurst was heard on BBC radio with the Queen’s Players company, under the director Stuart Burge, in a 1956 production of the George Farquhar play The Recruiting Officer, with Smethurst playing the police constable. He was in at the beginning of the revolution giving a voice to the working classes when he played a collier in Serjeant Musgrave’s Dance, John Arden’s drama about army deserters, at the Royal Court theatre (1959). Then came bit parts in the social-realist “kitchen sink” films Saturday Night and Sunday Morning (1960) and A Kind of Loving (1962). Smethurst followed those with character roles in television plays and popular series, including multiple parts in the police dramas No Hiding Place (five, from 1961 to 1965) and Z Cars (seven, 1962 to 1969). Although he appeared as an army recruit in the film Carry on Sergeant (1958), he was in few TV comedies until the end of the 1960s. He was a regular in the sitcom For the Love of Ada (1970-71) as Leslie Pollitt, son-in-law and neighbour of a widow (Irene Handl) enjoying a relationship with the gravedigger (Wilfred Pickles) who buried her husband. Smethurst also appeared in the 1972 spin-off film. Either side of Love Thy Neighbour, Smethurst had four roles in Coronation Street: Fred Clark, a crooked brewery worker delivering short orders (1961); Percy Bridge, accepting money from Elsie Tanner after he falsely claimed to have saved her grandson’s life (1967); Johnny Webb, Eddie Yeats’s fellow refuse collector who briefly lodged at the Ogdens’ (1980 and 1983); and Stan Wagstaff, an allotment holder alongside Jack Duckworth (2001). Returning to sitcom, Smethurst played the boss of a TV chat-show researcher (Marti Caine) in Hilary (1984-86) and had a cameo in Last of the Summer Wine as Davenport, a lost guidebook writer (1997). Powell also wrote the BBC Radio 2 sitcom A Proper Charlie (1984-85) for Smethurst. He starred as Charlie Garside, a trade unionist who works in a factory but spends most of his time in the pub. In 1957, Smethurst married Julie Nicholls, an actor. She and their four children, Perdita, Merry, Jane and Adam, an actor, survive him.  Jack (John) Smethurst, actor, born 9 April 1932; died 16 February 2022",Arts/Television & radio,Jack Smethurst obituary,https://www.theguardian.com/tv-and-radio/2022/feb/22/jack-smethurst-obituary
2/22/2022,"Welcome to Pushing Buttons, the Guardian’s gaming newsletter. If you’d like to receive it in your inbox every week, just pop your email in below – and check your inbox (and spam) for the confirmation email.  Welcome back to Pushing Buttons! Apologies for the late arrival of today’s newsletter; I was unexpectedly stranded with my family for several days last week because of Storm Eunice. Naturally this was the one time in the past five years that I have travelled without a Nintendo Switch, so I couldn’t even turn this into an opportunity to introduce my five-year-old to Mario Kart, a parenting moment I have been looking forward to since he was born. Sadly the last couple of times I’ve tried to introduce him to games have not gone well. The cute Mario Bros Game and Watch that Nintendo released a while back was thrown across the room in a rage after about 90 seconds (“I HATE JUMPING!!!”), and he disliked Pokémon: Let’s Go Pikachu so much that it will no for ever be known in our house as No No Pikachu. Speaking of Nintendo, it was announced last week that the company is finally shutting the virtual storefronts on its older consoles, 2012’s Wii U and 2011’s 3DS, later this year. Why does this matter? Well – aside from the relatively small number of people who might still want to buy and download games for these consoles, there are plenty of other people who are concerned that many of the 1800-odd games on these digital stores are not available to buy anywhere else. Some of them were made specifically for the consoles in question and never made available on discs or cartridges; others are classic Nintendo games, such as the Zelda: Oracle of Ages/Seasons spin-offs, which are otherwise difficult to get ahold of in their original Game Boy Color forms. There’s still time to download anything you might want from these old digital storefronts before they close for good, sometime after August. But this points towards a problem that is particularly pronounced in this art form: preservation. If you want to legally play, say, a SNES game from 1993, you have to own the original console and an original cartridge, which can be troublesome enough to track down. But games that were only ever released digitally can simply vanish if the company that made or hosted them goes bust, or decides to stop supporting them. This is particularly pronounced on Apple and Google’s smartphone storefronts: games appear and disappear all the time. Most of us have hazy memories of games on old computers or early consoles that seem to have been lost to time. Imagine what that’ll be like for the kids who grew up playing games on an iPad. This matters because large swathes of video game history are in permanent danger of being erased. Organisations like the Video Game History Museum go to huge lengths to track down and preserve copies of games, or in-progress code, or artwork and development materials, but the job is enormous, and few of gaming’s big players seem to care that much about the medium’s history. Companies get acquired and their back catalogues get thrown away. I’m still salty about Bookworm Adventure, a fantastic 2007 adventure-scrabble game that EA inexplicably scrubbed from existence after it bought its developer, PopCap. Inevitably, when there is literally no other way to experience older games, people turn to questionably-legal or straight-up illegal emulation. Copyright laws mean that digitally preserving games in this way is at best extremely complicated – but when companies won’t make the effort to preserve their own history, what are game archivists (or curious retro game fans) supposed to do? At least Nintendo reliably rereleases its classics on its newer consoles every few years. We have to pay for them again every time, though. I’ve lost count of the number of times I must have bought the original Super Mario Bros on all the different Nintendo consoles I’ve owned since 1995 – though I’m comforted by the fact that I’ve definitely spent nowhere near much as the guy who paid $2m for a sealed copy at auction. Full disclosure: I have not played the finished version of Elden Ring, a dark-fantasy collaboration between Dark Souls’ creators at FromSoftware in Japan, and George RR Martin. But I played an in-progress beta version at the tail end of last year, and that was enough to convince me that this game will be a highlight of my year. It’s challenging, unsurprisingly – this studio is well known for its uncompromising approach to game design – but also so intriguing, a crumbling fantasy realm full of brutal creatures to fight and dark secrets to uncover at the ends of overgrown paths. Think Dark Souls meets Zelda: Breath of the Wild and you’re halfway there. It’s out this week, and the reviews will start arriving tomorrow. Available on: PC, Xbox One/Series S/Series X, PlayStation 4/5Approximate playtime: 40+ hours I have always been rather baffled by Gran Turismo, the rather sterile-looking and fastidiously detailed racing game that has been a PlayStation staple since the 90s. So I was enormously charmed to read Mike Channel’s explanation of how eccentric and appealing it is to its fans. GT is “a surprisingly personal, constantly evolving interrogation of the relationship between humans and the metal boxes they careen around in”, he says, a reflection of the mercurial interests of its intriguing creative director Kazunori Yamauchi – who, I learned from this article, is himself an accomplished racing driver who has participated many times in the Nurburgring 24 Hours endurance race. Some Wordle fans are starting to lose faith, suspecting that its new owner the New York Times has made unwelcome changes. I guess all things must pass, but has Wordle’s time really come already? The BBC has investigated the existence of sex games and chatrooms on mega-popular online children’s game Roblox, built by determined rule-breakers. It is of course a law of the internet that people will attempt to make porn out of anything – fellow millennials might remember what went on in the dark corners of similarly sexless 00s chat game Habbo Hotel. Nonetheless, parents should be advised that this stuff does exist on the platform, and that it is extremely difficult to police. ‘The sprites clearly do not look like actual lemmings’: the inside story of an iconic video game The 15 best games on Apple Arcade Total War: Warhammer III review – swords, sorcery and symphonic metal To balance out the enormous open-world games I’ve been recommending for the past couple of weeks, I thought I’d answer this question from reader Lawal Muhammad (hello again!): Given the oft interrupted life of a gamer-parent, which games would you recommend for the time-poor and sleep-deprived? My memories of the first six months or so with each of my babies have been mostly erased by sleep deprivation, but I do remember that video games got me through a lot of long nights. At that stage I could not cope with ANY stress whatsoever, though, so I stuck to games that exerted absolutely no pressure on me. I played about 60 hours of pleasant farming game Stardew Valley in the middle of the night, because its soothing, predictable daily rhythms were a salve for my tired brain, and absolutely nothing stressful or tragic could possibly happen. I played Breath of the Wild, because it was easy to achieve and save little milestones during a 20-minute baby nap. I played Forza Horizon, because it was the closest thing I could get to a holiday. I played a lot on my phone, especially games that could be finished quickly and would be different every time I played them: sci-fi story-generator Faster than Light, the beautiful interactive novella 80 Days.",Arts/Games,Pushing Buttons: why swathes of classic games are at risk of being lost forever,https://www.theguardian.com/games/2022/feb/22/pushing-buttons-retro-games-nintendo
2/22/2022,"The director of public prosecutions for England and Wales has been severely criticised by Vera Baird, the victims’ commissioner, for failing to take responsibility for a record-breaking low in rape convictions. Max Hill, the head of the Crown Prosecution Service, was accused by Baird of overseeing a “catastrophic” period in the organisation’s history. She also claimed there were half as many rapists off the streets since he took charge.  Her comments followed Hill’s interview on BBC Radio 4’s Today programme, when he claimed he was trying to restore lost public confidence over rape cases by changes that include saving cases from being written off by police. ONS figures last month revealed there were 63,136 rape offences in the year to September 2021, while prosecutions were 1.3%. Appearing on the same programme, Baird was asked which organisation should accept the blame for the poor rape conviction rates. She said: “It is the CPS’s fault, almost completely. And I could hear Justin [Webb, the presenter] interviewing Max Hill expecting him to accept some blame, but he didn’t. “Every year since 2010, the CPS prosecuted 3,900-ish cases. Every year since he’s arrived they’ve prosecuted less than 2,000. Convictions were always over 2,200, they got almost to 3,000 – since he arrived, they’ve never been more than 1,500. “I think Max Hill has presided as DPP over the most catastrophic period in the CPS’s history for prosecuting rape,” she said. Baird also claimed Hill had appeared on the programme because he was pre-empting a report by Her Majesty’s Crown Prosecution Service Inspectorate into rape convictions that is expected to be released on Friday. “They are expecting an inspection report on Friday and it seems to me they are trying to pre-empt it because it is likely to be poor. “Certainly the last one said that there was a lack of awareness in the CPS on trauma. They said they approached cases with a view to focus on the weaknesses rather than the strengths. “An increased conviction rate of 60% is not much use if you are prosecuting very few cases. There are half the number of rapists off the streets than there were before Max Hill became DPP,” she said. Hill, who took over as DPP from Alison Saunders in 2018, said earlier on the same programme that he was “deeply frustrated” that so many women who suffer sexual violence, feel a lack of confidence in the entire criminal justice system. “What they are finding over the last year is that by sitting down with police officers at a much earlier stage they can take an investigation that might look as though it is not capable of prosecution, have a conversation about it and convert it into a case that is in court now,” he said. He said that ‘far too few” rape cases were reaching the CPS because of decisions made by the police. “Far too few of the complaints of rape are ever reaching the attention of the CPS. That is where early advice comes in, case progression clinics come in. When the police decide at the conclusion of an investigation that they can’t take any further, we have set up scrutiny panels where we will say ‘bring us a selection of those cases’. “In some, we are able to say ‘have you thought about another angle on the evidence?’” he said. The CPS has published an update on its handling of rape and serious sexual offences that also highlights plans to recruit more specialist rape prosecutors and improve victim support. ",News/Law,CPS head Max Hill severely criticised over record low in rape convictions,https://www.theguardian.com/law/2022/feb/22/cps-head-max-hill-severely-criticised-over-record-low-in-convictions
