4/30/2022,"Every week we wrap up the must-reads from our coverage of the Ukraine war, from news and features to analysis, visual guides and opinion. Analysis by Julian Borger explained how a series of mysterious explosions in Moldova has raised the threat of Russia’s war in Ukraine spilling over into new territory, with unpredictable consequences. Separatist authorities in the Moscow-backed region of Transnistria have blamed the incidents on Ukrainian infiltrators, while the Kyiv government alleged they were false-flag attacks designed to provide a pretext for an infusion of Russian troops, just as similar blasts in the Donbas preceded the 24 February Russian invasion of Ukraine. A Russian move into Transnistria would pose an imminent threat to the sovereignty of Moldova, which, like Ukraine, has shown increasing interest in joining Nato. On Thursday, Moldova’s deputy prime minister, Nicu Popescu, said the attacks represented “a very dangerous new moment in the history of our region”. One of Europe’s poorest countries, Moldova is grappling with a large influx of refugees and the economic fallout of the war, which has stopped nearly 15% of its exports. With the start of this new phase in the war, a layer is being stripped away from the buffer that has thus far kept Nato and Russia from coming into direct, hostile contact, during the cold war and since, Borger writes. And if the ominous explosions in Transnistria are auguries of a new Putin gambit, Moldova could find itself to be the next proving ground where this dangerous new world makes itself felt. Dan Boffey in Brussels, Philip Olterman in Berlin and Rob Davies in London wrote about the consequences for Europe after Russia halted gas supplies to two EU countries and threatened others, in a move condemned by European leaders as blackmail. The move, described by Poland’s prime minister, Mateusz Morawiecki, as a “direct attack” on his country, was justified by the Kremlin as a response to a failure of the two countries to comply with demands for payments to be made in roubles. It has led, however, to a dangerous standoff as Ursula von der Leyen, the president of the European Commission, said any EU country giving in to Russia by paying for gas in roubles would be in breach of the bloc’s sanctions regime, with which the UK and others have acted in lockstep. Craig Erlam, a senior market analyst for the UK and Europe at the foreign exchange company Oanda, said: “This may be a warning sign to others in the hope that they don’t follow suit, but if they do, the standoff could play havoc with energy prices. With the Kremlin putting itself in a position where it must apply the same punishment to all if they don’t comply, Europe may find itself without Russian gas or looking weak.” Hungary has said it is happy to pay in roubles and, according to reports, three of Europe’s biggest gas companies – Germany’s Uniper, Italy’s Eni and Austria’s OMV – are also examining ways to comply with Putin’s decree. In a separate piece of analysis, Rob Davies asks: how worried should Europe be? Isobel Koshiw visited Zaporizhzhia, the only large city in south-east Ukraine under Ukrainian control. It has become a destination for the hundreds of thousands of people who fled Russian occupation, but with 70% of the wider region under Russian military control, there are fears that Moscow’s forces will attempt to take it. As preparations for the arrival of the war get under way, life in the city is surprisingly normal – even busy – for wartime Ukraine. “You can see for yourself people are out, going to work – the city is prepared but it won’t come to that,” said Ivan Ariefiev, the press secretary of the Zaporizhzhia regional military administration, at one of a series of war-related training courses being offered to the city’s teachers and journalists. Attendees, who are then expected to train the wider community, were taught how to load a gun, administer first aid and do a basic medical evaluation.  Fléchettes are rarely used in modern warfare. Small, metal and sharp like a dart, thousands can be stored inside each shell. Once fired, the shell will detonate on a timer, spreading the tiny arrows far and wide. The weapon was used in the first world war – dropped from airplanes to pierce the helmets of enemy infantry. Now, they are being removed from the heads and chests of civilians in Ukraine. Lorenzo Tondo reported on the discovery of the tiny metal arrows in bodies of men and women in mass graves, allegedly killed during the Russian occupation of Bucha, Ukraine. “We found several really thin, nail-like objects in the bodies of men and women and so did others of my colleagues in the region,” Vladyslav Pirovskyi, a Ukrainian forensic doctor, told the Guardian. “It is very hard to find those in the body, they are too thin. The majority of these bodies come from the Bucha-Irpin region.” Russian forces captured Bucha, 30km north-west of Kyiv, after ferocious fighting following Russia’s invasion in February. Towards the end of March, mass graves containing the bodies of hundreds of people who had apparently been massacred came to light. As defence and security editor Dan Sabbagh explains, the west’s war aims are expanding. On Monday, Lloyd Austin, the US defence secretary, said the west’s goal was to “weaken Russia” to the point where it could no longer threaten its neighbours. A day later, the British junior defence minister James Heappey said it would be “completely legitimate” for Ukraine to use western weapons to strike inside Russia. On Wednesday, western officials said they would like to see Ukraine restored to the boundaries existing before 24 February – the start of the Russian invasion – “as a minimum”. With Ukraine unable to achieve that objective on its own, the question will become how much more Britain and other Nato members are prepared to commit. On Wednesday, the British foreign secretary, Liz Truss, appeared very committed, adopting in her speech the most uncompromising of approaches to a final peace settlement: endorsing the measures above but also reparations – a payment to Ukraine for the damage Moscow had inflicted – in an echo of the principles followed by allied forces against Germany in 1919. Discussions on how to define failure in any peace settlement are at an early stage among the cell of diplomats from “the Quad” – the US, UK, France and Germany – discussing the issue. The discussions will evolve as the battlefield evolves. Our visual guide to the invasion is updated regularly and can be found here.",News/World news,Russia-Ukraine war: catch up on this week’s must-read news and analysis,https://www.theguardian.com/world/2022/apr/30/russia-ukraine-war-catch-up-on-this-weeks-must-read-news-and-analysis
4/30/2022,"In a judgment delivered this week, New Zealand’s high court found that elements of the country’s Managed Isolation and Quarantine (MIQ) system, the cornerstone of our world-leading pandemic response, were unlawful. The decision dropped to a good deal of delight. One well-known conservative commentator wrote: “So the courts have found the lockdown was illegal, the vaccine mandate was illegal and MIQ was illegal, so can anyone name a major aspect of the response that hasn’t been found to be illegal?” That response is predictably mischievous – none of those measures were ruled “illegal” – but it typifies the response. Perhaps the best-known of the conservative commentators involved wrote: “Jacinda Ardern has been found by the courts to have abused her powers by illegally preventing New Zealand citizens from leaving & returning home.” That isn’t what the high court found, but accurate reporting is hardly the point. In New Zealand the political right is fighting a relentless battle to rewrite the history of New Zealand’s pandemic success. For almost two years New Zealanders kept the virus from breaching the border. After the first lockdown in March 2020, Covid-19 was eliminated and New Zealanders went about their lives more or less as normal. Public health experts calculate that if we suffered the same rate of Covid-19 deaths as the UK, up to 10,000 people would be dead. That’s not far short of the number of New Zealanders who perished in the second world war. Add to those life-saving efforts the fact that the economy grew 14% in the third quarter of 2020 – the highest rate ever. That same year, the prime minister, Jacinda Ardern, and her Labour party were re-elected in a landslide. Lockdowns are often given the credit for guaranteeing this success. Alert level 4 in March 2020 saw New Zealanders “stop the spread”, to resurrect an old phrase. Covid-19 cases fell to zero in June. Even in the more infectious and deadlier Delta outbreak, a strict lockdown beginning in August 2021 functionally eliminated Delta come the end of summer. But New Zealand’s primary defence was always MIQ. The system of isolation and quarantine for returning New Zealanders and visitors ensured that the virus rarely made it into the community. MIQers would spend two weeks in a hotel as a means of protecting the population. It was a necessary sacrifice and, in the scheme of things, a modest one. MIQ bought time for New Zealand to shelter as vaccines and antivirals were developed. The time it bought means that in the ongoing Omicron outbreak, with more than 90% of eligible adults vaccinated, the virus is proving no more fatal than the seasonal flu. This is something for which to thank MIQ, vaccine scientists, and public health providers (while acknowledging, of course, that even a single death from Omicron or the flu is a tragedy). And yet the political right is determined to rewrite this success. In a recent interview Chris Luxon, the National party leader, called on the government to abandon the traffic light system. Given the events of 2020 and 2021, that’s a bizarre intervention. Why would you take the side of the virus and let it really rip? But Luxon’s intervention highlights the relentless campaign to undermine New Zealand’s success. Not because recent memory of the pandemic is faulty – polls as early as this year reinforced majority support for the government’s response – but because critics of the government and Ardern sense an opportunity for the current and inevitable Omicron outbreak to define every outbreak that was prevented. This opportunity partly centres on criticism of the current spread and the pressure it places on an underfunded health system. The primary node of criticism, though, is the apparent threat to freedom and liberty that the government represents. In March and April countless stories were appearing criticising the red traffic light setting as having destroyed the hospitality sector. The loudest criticisms of MIQ, too, were often made by businesspeople keen to import workers without the need for limited MIQ spaces. Never mind the problem was, and, is the virus, not the efforts to control it. On a proper reading none of these criticisms – whether of MIQ or the traffic light settings – have much to do with freedom and liberty. These are calls for unrestrained commerce, the ability to trade no matter the circumstances. In their analysis, the right to conduct commerce, no matter what, was more important than any public health imperative. The clown convoy that made its way to Wellington – occupying parliament, destroying the grounds and impinging on the rights of Thorndon’s residents – was the sharp end of this “do what I want” attitude. We cannot let these people win. So many lives were saved in 2020 and 2021. The economy thrived. The government’s quick action gave us the time to vaccinate, preparing us for the Omicron outbreak, for which other countries that let the virus rip and mutate were responsible. The high court did find that the lottery aspect of MIQ was unlawful, but it acknowledged that MIQ itself was lawful, and that it was a justified and proportionate policy response in a pandemic. We should not forget that. Morgan Godfery (Te Pahipoto, Sāmoa) is a senior lecturer at the University of Otago and a columnist at Metro",News/World news,The political right is fighting a relentless battle to rewrite New Zealand’s pandemic success | Morgan Godfery,https://www.theguardian.com/world/commentisfree/2022/apr/30/the-political-right-is-fighting-a-relentless-battle-to-rewrite-new-zealands-pandemic-success
4/30/2022,"Clive Palmer’s centrepiece campaign pledge to cap homeowners’ interest rates for five years has been dismissed by economists as “radical”, “crazy” and “utterly irresponsible” even though it will probably appeal to some gullible voters. According to the United Australia party’s website, the mining billionaire’s “economic plan for freedom and prosperity” pledges to set a maximum 3% interest rate for all home loans to head off a looming mass default as lending rates start to rise. Wednesday’s surprisingly large 5.1% consumer price inflation figure has stoked expectations the Reserve Bank will be forced to lift its cash rate target from 0.1% when its board meets on Tuesday. Market home loans rates have been rising for months, with most fixed rates now between 3% and 5% with variable rates above 2%. “If our interest rate for home loans doubles from 2% to 4%, 60% of all mortgages will be in default and if the interest rate goes to between 6% to 8%, as it most surely will, the default rate will be greater than 90%,” Palmer said, citing unnamed “other studies”. Elsewhere on UAP’s website, Palmer blames the $1tn debt racked up by the Liberal and Labor governments as the trigger for the rising interest rates. “The real estate market will then collapse and foreign buyers will flood our real estate market as they will have the money to buy up our properties,” his national policy states. “We have to stop Australians from losing their homes!” Guardian Australia sought comment from the UAP and Craig Kelly, the ex-Liberal MP and now UAP candidate for the NSW seat of Hughes on how the rate cap would work. News Corp tabloids cited Kelly as saying the federal government could implement the plan by selling Treasury bonds at 0.1% to 0.2% and “on-lending that cheap cash to retail banks” who would then keep the mortgage rate under 3%. Anna Bligh, chief executive of the Australian Banking Association, called the plan “magic pudding economics” that would “wreak havoc across banking and financial services sector” if ever implemented, according to the papers. Alan Oster, NAB’s chief economist, said his bank typically avoided comment on such policies. “I don’t know how [Palmer] would implement it other than re-regulating rates, and that would be radically different,” Oster said. “Who knows how they would do that?” Saul Eslake, an independent economist who formerly worked at ANZ Bank, said it was “constitutionally and legally possible” for an Australian government to impose a legislated ceiling on mortgage rates. Up until the late 1980s, such a ceiling existed, at the treasurer’s discretion. However, Eslake said “it would be an utterly irresponsible thing for any government to seek to do”, given the different conditions more than three decades on. Timo Henckel, from the Australian National University’s Research School of Economics, said while he had scant details, the policy “doesn’t sound workable”. One approach could be to intervene to set “severe financial market regulation”. That would “take us back to, say, the 1970s”, and would be at odds with the liberalised capital markets that Australia now operates, he said. The other possibility would be for the central bank to provide a standing facility to pump as much money into financial markets needed to keep interest rates at 3%, Henckel said. Such a move, though, would be a “crazy policy because there’d be so much liquidity sloshing around in the system”, resulting in more inflation. In addition, “it would really only work if they seriously compromised the RBA’s independence … and [would] require massive legal intervention in a way that I’m not even sure they’d be able to do it”, he said. Australia’s banks, meanwhile, rely on international capital markets to source a significant share of their own funds, and would find it harder to raise money in such a distorted system. “They’re never going to be asked to implement it anyway so really it’s just an attention grabber in order get votes,” Henckel said. “It’s not a genuine policy.”",News/Australia news,"Clive Palmer’s campaign pledge to cap home loan rates ‘utterly irresponsible’, experts say",https://www.theguardian.com/australia-news/2022/apr/30/clive-palmers-campaign-pledge-to-cap-home-loan-rates-utterly-irresponsible-experts-say
4/30/2022,"Scott Morrison’s comment last month that “the best way to support people renting a house is to help them buy a house” was seized on by some as a “let them eat cake moment”. The prime minister was responding to a question from Channel Nine’s Today Show about why the federal budget hadn’t done more for renters. The query was unusual because renters typically get far less heed from media and politicians than homeowners, despite them making up about a third – and rising – share of the population. The scant attention is curious given the plight of renters is generally deteriorating nationwide. According to CoreLogic, average rents rose 12.9% in the two years to March, which is seven times the 1.8% increase of the preceding two-year period. The well-publicised outflow of city folk to the regions during Covid is also making it worse for locals. Regional rents have increased a fifth in those two years, or double the pace of the increase in state capitals, CoreLogic data shows. Groups from the Australian Council of Social Service to the Committee for Sydney have led calls to address housing affordability that have produced little substantial policy from the major parties, at least federally. That results fall so far short of needs reveal much about the sort of society we live in and where we’re headed. That is, one with a falling share of people owning their homes in almost all age groups. As one senior member of the NSW government told me recently, housing has gone from an essential “roof over our heads” to a commodity for wealth accumulation and speculation. Federal and state policies had largely served to steer ever more money into the sector, favouring those already in the market. The media, too, seems conflicted. Open up a newspaper, particularly on a Saturday, and readers can ogle glossy property magazines and articles touting celebrities trading trophy homes. Both News Corp and Nine Entertainment, the nation’s dominant media groups, rely after all on the property-spruiking REA Group and Domain, respectively, to shore up revenues. Cost of living issues alone suggest more coverage on rents is warranted. Within the basket of goods and services that the Bureau of Statistics uses to track consumer price increases, rents carry twice the weight of transport fuel. Despite that, they drew far fewer stories than “pain at the bowser” tales that recently panicked the government into halving the fuel excise until after the election. Regional renters, though, have an extra reason to feel neglected. The ABS bases the rental weighting within the CPI on capital cities only, meaning the recent run-up in regional rentals has not been picked up in the inflation figures. The latest data, out on Wednesday, showed rents rising again in all cities, including Melbourne and Sydney which had been hard hit by the absence of foreign students during the Covid lockdowns. A revival of migration will accelerate those rises. Housing issues have been slow to become a focus in the campaign, despite rising expectations the Reserve Bank will soon start lifting interest rates – and keep raising them for the next couple of years – to stem inflation. ASX futures market shows investors predict the RBA's cash rate will be at 2.5% by the end of 2022, whether or not the central bank makes its first move on 3 May. #ausvotes #auspol pic.twitter.com/B2O25E5vm9 As another instance, the Greens’ promise of 1 million more low-cost homes, the most ambitious of the parties in the election, was all but ignored despite the policy making up a large part of Adam Bandt’s National Press Club speech on 13 April. The media instead focused on the Greens leader’s “Google it, mate” slapdown, and pledges to aid dental care and halt coal and gas projects. The omission surprised advisers who remain keen to get the issue back in the spotlight. The policy would not come cheap, decreasing the fiscal balance by $7.5bn and the headline cash balance by $30.8bn over the budget forward estimates period, the Parliamentary Budget Office said. For the ALP, the top task is 30,000 “new social and affordable housing properties” over the first five years. The Coalition, meanwhile, is stressing home ownership, while “incentivising” regional home construction. In a comprehensive study for the Australian Council for Social Service Acoss led by University of New South Wales professor Hal Pawson, the authors examined how governments dealt with Covid from a housing perspective, and what it revealed about their priorities. “Income support did more to absorb the income shock of the pandemic, to a significant extent letting housing policy and, especially, landlords, off the hook,” they said. “Restrictions on evictions and rent increases were lifted just as many regions were seeing a major escalation in rents and tightening availability.” “This strengthens the sense that housing policy objectives around affordability, security and prevention of homelessness are still lower priorities than maintenance of housing asset values, rent revenues and loan serviceability,” they said. Pawson said that while the house price cycle was likely to be near its top, ahead of those RBA rate rises, rents would probably keep rising. Sign up to receive an email with the top stories from Guardian Australia every morning Pawson cites 1996, the year the Howard government took office, as a “break point” when the annual national social housing construction program finished. Since then Australia’s population has swelled 30%, but the stock of social housing has grown only 4% even taking in a burst of spending during the global financial crisis by the Rudd government. “In the last few years, we’ve only barely been building enough to make good the loss from demolition and sales every year,” Pawson said. In the past 10 years, social housing has made up just 1% to 2% of new homes built. By contrast, in the quarter-century after 1945, one in six homes were public housing. “There is a historical precedent for this in Australia, of the state being a substantial source of housing production,” Pawson said. “It’s just we’ve forgotten that we ever did it.”",News/Australia news,"Locked out: housing has become a path to wealth, but renters have been left behind",https://www.theguardian.com/australia-news/2022/apr/30/locked-out-housing-has-become-a-path-to-wealth-but-renters-have-been-left-behind
