1/26/2022,"Gary Shteyngart’s contribution to the burgeoning genre of the lockdown novel is very, very Russian – in the best possible way. The premise is that a group of old friends are to spend a month in the country (well, several months) riding out New York’s pandemic in a little ad hoc colony in the Hudson valley. The cast is a collection of privileged, mournful “lishnii cheloveks” (as the “superfluous men” of 19th-century Russian literature were known) in late middle age, pottering and squabbling in rural exile, wondering what the world is coming to and regretting the past. The host at what comes to be called the “Dacha of Doom” is Sasha Senderovsky, a dishevelled Russian-Jewish-American author who, like Shteyngart, has had considerable success with a series of comic novels about the Russian-Jewish-American experience. Now, though, his career is on the slide and if he can’t get a troubled TV script across the line he faces losing the country estate (well, house with a few bungalows attached) that is his pride and joy. He doesn’t have an actual cherry orchard, but the reader very much gets the drift. Here’s something of a departure – or at least a mellowing – for Shteyngart; the antic international satire of Absurdistan or the science-fictional Super Sad True Love Story is muted, while on his stylistic mixing board the slider marked melancholy has been notched up to 11.  Sasha and his wife Masha and adopted daughter Nat (“Sasha, Masha, Natasha. They didn’t even try, these Russians”) are joined by his college friends Karen, Ed and Vinod. The former are distant cousins of Korean descent, the latter is a down-on-his-luck Gujarati American billed in the dramatis personae as a “former adjunct professor and short-order cook” recovering from lung cancer. Ed is from family wealth, single and – as an extraordinarily detailed and delicious-sounding recipe for veal tonnato indicates – a very good cook. Vinod nurtures a shy, unrequited, lifelong love for Karen. Karen is a wealthy tech-sis, over from the west coast, where she made a fortune with an app called Tröö Emotions that, supposedly, causes people to fall in love. The two wild cards in the group are Dee and a film star known only as The Actor (though, weirdly, we discover very late on that he’s called Joel). Dee is a former writing student of Sasha who has had a hit with a pugnacious essay collection about her poor white upbringing called The Grand Book of Self-Compromise and Surrender. She reveres Joan Didion, uses “y’all” judiciously, and likes to wear cowboy boots and a peasant blouse that “bring out a host of Pavlovian reactions in a wide cross-section of educated East Coast men”. The heroically vain and pretentious Actor – there ostensibly to work on that TV script with Sasha – exerts a power of his own: “Like a small damaged atomic reactor he could generate his own array of ‘feelings’, which he released into the air as background gamma. Everyone at the table except Senderovsky, everyone on the planet, in fact, wanted a dose.” On the first night we find them all on the porch, socially distanced, “seated in their jackets and sweaters at a healthy remove from one another, as if they were organised criminals or dignitaries at the League of Nations”. The effect of the pandemic on writers is drily acknowledged: “Stranded social novelists up and down the river dutifully photographed hard-to-identify flowers and took notes on the appearance of gathering storm fronts and menacing thunderheads. More than one could be found looking up at a slumbering owl or a sunburned meadow beseeching their higher power to help me make something out of all this stillness.” Meanwhile, the dismaying forces of Trumpian America seem to be circling just off stage – white supremacist stickers are posted at the train station, and there are menacing drivebys from pick-up trucks. Soon, Ed and the Actor are both in love with Dee; Masha and Karen are fantasising about the Actor; and K-pop-fan little Nat – who is bright and obsessive – is being semi-adopted by childless Karen. At night, “in accordance with the rules of Russian novels, each thought about another”. One MacGuffin is the manuscript of Vinod’s first novel, which Sasha doesn’t want to admit he’s still hiding in a shoebox in his attic; another is Karen’s app, which is blamed for the Actor chasing Dee. Chekhov’s gun? That would be, I don’t think it’s a spoiler to say, a man with one lung in a Covid epidemic. (The main fault of the book is Vinod’s overlong and slightly repetitious dream/hallucination scenes.) The story is framed by a series of references to Russian literature (near the end, the inhabitants of the colony even stage a production of Uncle Vanya). But this is, being Shteyngart, very far from a solemn tribute to his literary ancestors. Among other things, there’s a pop-cultural parallel as the group become addicted to a Big Brother-style Japanese reality TV show. The real Chekhovianism is the way that Shteyngart’s comic style – the book crackles with good one-liners – is so consistently and to such effect shot through with plangency. Here’s Karen on a country walk: “She stole a great big lungful of a budding forsythia, and then another, a city girl suddenly grateful. Easter would be coming soon, but her mother was still dead.” Or Karen in her bedroom: “There was a piece of paper resting on her side of the bed, the excerpt of a lesson Karen had been teaching Nat, spelling out in Hangul and English the most important of Korean phrases: ‘My head hurts, eyes hurt, mouth hurts, legs hurt, there is too little, there is too much, I don’t like it.’” A deftly equivocal note of sadness towards the end of the book seems to me to capture the tone particularly well: “They sat there between the ferns and the busy bike lane, passing around plates of food, surrounded by faces that looked like their own.” These characters, with their variously thwarted ambitions for love and fame, are wrangling with the realisation that they are ordinary, mortal, vulnerable, just like everyone else. We are all lishnii cheloveks.  Our Country Friends by Gary Shteyngart is published by Allen & Unwin (£16.99). To support the Guardian and Observer, order your copy at guardianbookshop.com. Delivery charges may apply.",Arts/Books,Our Country Friends by Gary Shteyngart review – lockdown tragicomedy,https://www.theguardian.com/books/2022/jan/26/our-country-friends-by-gary-shteyngart-review-lockdown-tragicomedy
1/26/2022,"When word reached W Kamau Bell that Bill Cosby was home from prison, the United Shades of America host could have torn at his trademark salt-and-pepper afro. Bell was in Philadelphia, Cosby’s home town, wrapping up interviews for a documentary project on the legendary comedian when Pennsylvania’s highest court tossed out the 84-year-old’s 2018 aggravated indecent assault conviction. The surprise ruling, which came just two years into a decade-long sentence, didn’t just have Bell reconsidering the premise of his film; it left him wondering whether he even had a film at all. “It felt like we could have this conversation because the arc of Bill Cosby’s life is concluded,” Bell said to the Guardian. “So when he got out, it’s like if the premise is ‘now that Bill Cosby’s in prison, we can have this conversation,’ what does it mean now that he’s out of prison? Can we still have the conversation?”  This twist ending is the jumping-off point for We Need to Talk About Cosby – a four-part Showtime documentary series that premiered at the Sundance Film Festival last week. Cosby supporters are bracing for the worst. Music supervisor Vitaly Shenderovsky, leaning on the neat bass licks of the Living Colour frontman Vernon Reid, certainly does his part to strike an anxious tone. Even though uncomfortable conversations are stock-in-trade for Bell, who directs and narrates each hourlong episode, this project was particularly upsetting for him, too. “I consider myself to be a child of Cosby,” says the 48-year-old. “I cannot remember a time in my life when Bill Cosby wasn’t a part of the wallpaper of Black America. So then to find out what we find out, and what I believe about the assaults … I don’t know. Trying to reconcile that or learn something from that was very important to me.” Cosby was more than America’s Dad™. Until more than 60 women came forward and accused him of sexual impropriety, Cosby was a paragon of Black male virtue: athletic in his heyday, intellectually curious at his core and hilarious throughout – a singular voice in the zeitgeist before an unpolished Hannibal Buress rant struck him down from Olympus. Barry Jenkins, in his underrated indie drama Medicine for Melancholy, theorized that every Black man has a Cosby impersonation; a worn-out cassette tape of Bill Cosby: Himself, the comic’s peerless 1983 special, bespeaks my own feeble attempts. But they’re nowhere near as good as the much more effortless ones by Godfrey, the master impressionist and former studio audience warm-up act for Cosby’s shows. While his perspective provides We Need to Talk About Cosby with timely levity, sex therapist Sonalee Rashatwar girds it with emotional intelligence. The New Yorker’s Jelani Cobb, University of North Carolina sociologist Tressie McMillan Cottom, Cosby alum Doug E Doug, Gloria Allred and others fill in the remaining expert witness slots; tellingly, each begins with a deep sigh before grudgingly going about the task of weighing Cosby’s disparate halves. We Need to Talk About Cosby does well to remind viewers of the man’s resonant impacts as a game-changing standup comedian, blockbuster TV star and pro-Black philanthropist. A large chunk of the first episode is devoted to the story of Calvin Brown, the stuntman who opened a barricaded lane in Hollywood for Black performers when Cosby hired him as his double on the seminal 1965 TV drama I Spy. (Before that, white stuntmen would literally paint themselves black to mirror African American actors.) But then ex-Playmate Victoria Valentino pulls the rug out with another story alleging Cosby emotionally leveraged the death of her six-year-old son to drug and rape her in 1969. What the Showtime docuseries does more effectively than any newspaper or magazine article is sync up the accusations against Cosby with his career arc, making the case for his alleged sexual behavior as a disturbing entitlement that was in many ways typical of Hollywood playboys of his generation. In one Larry King Show clip, the host, a renowned playboy himself, can be seen laughing along to a protracted Cosby aside about Spanish fly; if that doesn’t grab you, consider: it was part of a promotional interview for Cosby’s 1991 autobiography, Childhood. As We Need to Talk About Cosby’s slates for release on Sunday the A&E network has already begun unfurling a 10-part docuseries called Secrets of Playboy that paints Hugh Hefner as the host with the most … drug-aided sexual assault parties in Hollywood. “I think it was bigger than Cosby,” Bell says. “Because if it was just him doing this without any sort of industry scaffolding, he can’t pull this off. When they built Hollywood back in the early days, they didn’t start with the human resources department. It’s a dream factory. And the result of making those dreams is living a hedonistic lifestyle. That’s how you get to hide in plain sight.” At one point in We Need to Talk About Cosby the comedian Chris Spencer speaks for all Cosby sympathizers when he recalls how easy it was for him to dismiss the consistency in the Cosby accusers’ stories because each could just watch the last’s big interview and adjust accordingly. But the docuseries hits back by showing the eerie parallels in the way Cosby’s accusers say they were groomed. Apparently, Cosby’s seductions weren’t limited to lavish trips, promises of showbiz breaks or opportunities to pal around with fellow A-listers; in some instances, he ingratiated himself with family members, making it that much more difficult for accusers’ loved ones to believe America’s Dad had been anything less than a gentleman Huxtable. In others, accusers say Cosby had a knack for blaming his roofie-ing on them and tarrying in their lives until they no longer believed the lie or could felt the urgency to go public with allegations. “We couldn’t even really tell some of these stories,” Bell says. “There’s times when [accusers] don’t hear from him for months or longer, and then suddenly he pops back up. So for someone like yourself or someone like me who’s not studying all these cases and just sort of reading the headlines – even if you think it’s wrong and you believe all the women, you can sort of file it as 60 one-night stands that turned into rape. And that’s bad. But it’s different than when you talk to these women and you find out that this went on over the course of years.” Still: there are some things in We Need to Talk About Cosby that, well, aren’t talked about. It glosses over the funnyman’s upbringing, which was a good deal rougher than his comedy made it seem (as Michael Eric Dyson keenly observed in his thorough Cosby biography). And at points the docuseries strains to capture the demon in his art, as if a room full of guild members didn’t write a massive chunk of his material. Worse, the doc skips quickly past the fact that Cosby was never found criminally responsible for any allegation – an uncomfortable conversation well worth having. Cosby only ended up in prison because of his testimony in a civil case was unsealed. That’s why Pennsylvania’s supreme court ultimately chose to vacate his conviction. Bell cites Ezra Edelman’s Oscar-winning OJ: Made in America and dream hampton’s influential Surviving R Kelly docuseries as inspirations. His film slots somewhere in the middle. It isn’t critical race theory or advocacy journalism, but one lifelong fan’s futile attempt to reckon with the unreckonable – how a childhood hero comes to be remembered as a monster. By the end of We Need to Talk About Cosby, you’re left sighing even more heavily than the experts were at the beginning – as much for what Cosby supposedly did as for the cultural legacy that’s definitely done and dusted. We Need to Talk About Cosby starts on Showtime on 30 January with a UK date to be announced",Arts/Television & radio,‘It was bigger than Cosby’: W Kamau Bell on reckoning with an icon’s fall,https://www.theguardian.com/tv-and-radio/2022/jan/26/we-need-to-talk-about-cosby-docuseries-w-kamau-bell
1/26/2022,"Sue Gray’s report will be closely scrutinised by Conservative MPs awaiting the full facts before deciding whether to act against their beleaguered leader. Here are five things to look out for when it is published:  Boris Johnson has already admitted attending the 20 May 2020 garden drinks, but insisted he believed it was a “work event”. That explanation has been widely ridiculed by opposition MPs, who have pointed out the event was organised by a senior Johnson aide, who encouraged guests to “bring their own booze”, and held in the Downing Street garden. Will Gray lay out fresh evidence that makes Johnson’s claim seem even more implausible? In all of Johnson’s public statement on this, he said he believed “implicitly that this was a work event” – a careful use of words. What will Gray make of this? And will she confirm that there were other occasions on which he went to social gatherings that appear not to have complied with the rules at the time – including the birthday singsong revealed by ITV this week? MPs will be weighing up how starkly her findings conflict with Johnson’s assertion in the House of Commons that “all guidance was followed”. Several cabinet ministers have stressed the seriousness of breaking the ministerial code by misleading parliament – traditionally a resigning matter. Gray is expected to lay out details of a boozy work culture in Downing Street – which even included the purchase of a dedicated wine fridge. There is also focus on two parties held the night before Prince Philip’s funeral, reportedly involving a late-night trip to a local supermarket to fill a suitcase with wine bottles. In the weeks since the first stories emerged of a party in Downing Street, a steady stream of other “gatherings” have emerged, many of them in apparent contravention of the lockdown restrictions at the times. Gray may well have uncovered even more. So exactly how many parties were there? The Conservative chair, Oliver Dowden, suggested recently that the prime minister is the person to overhaul what he called, “the kind of culture that has allowed [the partying] to happen in the first place”. But will the facts laid out by Gray suggest that Johnson himself was an integral part of that culture, and must take some of the blame? The only person who has so far resigned over “partygate” is Allegra Stratton, the prime minister’s former press secretary, who did not attend the Christmas bash she was caught on camera joking about. Martin Reynolds, Johnson’s principal private secretary, who invited more than 100 Downing Street staff to a garden party on 20 May 2020, seems unlikely to escape censure. It was his excruciating email, leaked to ITV News, that led to some Tory MPs deciding to call for Johnson to quit. He wrote: “Hi all, after what has been an incredibly busy period we thought it would be nice to make the most of the lovely weather and have some socially distanced drinks in the No 10 garden this evening. Please join us from 6pm and bring your own booze!” Johnson’s director of communications, Jack Doyle, is also widely expected to be singled out – but it is unclear how much wider Gray has cast her net. Rishi Sunak appears to have attended the birthday gathering for Johnson, though aides have said he was awaiting a meeting, but other ministers have so far largely escaped being implicated. Gray is looking into individual parties at the Department for Education and the Department for Work and Pensions; to what extent will she conclude that the problematic culture spread beyond No 10? Several sources, including Dominic Cummings, have suggested there have been social gatherings in the lavishly redecorated Downing Street flat during the pandemic – on the night of Cummings’ departure from government, for example, when witnesses report music blaring from upstairs. Any evidence Gray has uncovered of these get-togethers, would further undermine the idea that Downing Street’s party culture did not ultimately emanate from Johnson himself.",News/Politics,The Gray report: five key questions it could answer,https://www.theguardian.com/politics/2022/jan/26/the-gray-report-five-key-questions-it-could-answer
1/26/2022,"I am being chased by a debt collection company, BW Legal, for an unpaid energy bill from E.ON despite never having been a customer and having no connection with the property in question. BW Legal required me to prove I had left the address, which was impossible as I never lived there. I sent an energy bill for my actual address, and a screenshot of my electoral roll address history, but have had no reply.AD, Brighton You wrote in response to an Observer report on the same issue. BW Legal represents PRAC Financial, which bought customer debts in the name of “The Occupier” from E.ON. It suggested that malice may be behind my follow-up investigation, and said it appreciated my interest in the matter, but didn’t see any basis for my inquiries. Although it only removed you from its records after my intervention, it justified linking you to the address by pointing out that the evidence you provided showed you lived in the same square – albeit in a different part with a different postcode.  It says it did issue further payment demands after you disputed it, then congratulated itself on its handling of your case, claiming the closure of the account within two weeks shows “how expediently matters were resolved – simply by communicating”. In fact, you received confirmation that your name had been delinked four days after my “communication” and 34 days after you first told BW Legal it had contacted you in error. Debt collectors have no right to require an individual to prove they are not liable for an unpaid bill, according to solicitor Gary Rycroft of Joseph A Jones & Co LLP. “The burden of proof lies with the debt company,” he says. The Information Commissioner’s Office, and the Solicitors Regulation Authority, say they are investigating complaints about BW Legal. The Financial Ombudsman Service at www.financial-ombudsman.org.uk, can consider unresolved complaints about debt collection agencies. Email your.problems@observer.co.uk. Include an address and phone number. Submission and publication are subject to our terms and conditions",Lifestyle/Money,BW Legal is chasing a debt I don’t owe at an address where I’ve never lived,https://www.theguardian.com/money/2022/jan/26/bw-legal-is-chasing-a-debt-i-dont-owe-at-an-address-where-ive-never-lived
