5/5/2022,"PricewaterhouseCoopers has told its accountants and other staff they can finish work early on Fridays over the summer, becoming the latest company to offer flexible work incentives to try to keep employees happy and compete for talent. The accountancy firm has written to its 22,000 UK staff and told them they can knock off at lunchtime on Fridays between 1 June and 31 August, assuming they get their work done. It expects the majority of employees to benefit from this. The move comes after PwC ran a pilot of “summer working hours” in July and August last year, which proved so popular that the policy has been extended by another month this summer. A poll of 6,000 staff showed three-quarters of them felt that the shortened hours “impacted their general wellbeing to a great extent”. More than 90% thought the policy was a good idea, and three-quarters said spending more time with family and friends was the greatest benefit. Kevin Ellis, PwC UK’s chairman, said: “We knew summer working hours would be popular with our people, but the positive impact on wellbeing surpassed expectations. Not everyone could take every Friday, but they benefited from less email traffic when they did and a chance to switch off properly. “We’ve had another exceptionally busy year and as we approach the summer holiday period, we hope our policy gives people more time for themselves, their friends and their families.” Summer working hours are part of “The Deal”, PwC’s approach to hybrid working introduced last spring. It means staff can work from home some of the time and decide their own hours, but are expected to spend two to three days a week in the office or at client sites. In October, the firm introduced flexible bank holidays, allowing people to take up to two bank holidays when it suits them. The company, one of the big four accountancy firms, is competing for talent with its three rivals. Deloitte said in June it would let its 20,000 UK employees decide “when, where and how they work” after the success of remote working during the Covid crisis. In the City, the UK stockbroker FinnCap has pledged to give its employees unlimited holiday to prevent staff burnout, while last spring the global investment bank Citigroup’s new chief executive, Jane Fraser, introduced “Zoom-free Fridays” and an additional holiday. PwC posted a 2% rise in UK revenues to £4.4bn in the year to the end of June, while group profit climbed 25% to £1.2bn. Profit per partner rose by 27% to £868,000.",Lifestyle/Money,PwC offers UK staff shorter Friday work hours for summer,https://www.theguardian.com/money/2022/may/04/pwc-offers-staff-shorter-friday-work-hours-for-summer
5/5/2022,"Their colour is an unmissable shade of fuchsia pink. They walk the streets across the Philippines, posting banners along the way and stopping anyone who will listen. Many are young or first-time voters, and some travel for hours to join campaign teams. For them, next week’s election is a make-or-break moment for their country. “I really want change,” says Mariel Ramirez, 35, a first-time voter who is among those campaigning. The impact of the pandemic on the poorest, and the prospect of the return to office of one of the country’s most controversial families – the Marcoses – drove her to act. “It’s so obvious that a [Marcos] presidency would really just bring the country to its lowest point,” said Ramirez. “They’re a family who just enrich themselves.” There are just days left until more than 67 million Filipinos vote for their next president in a highly contentious election. Ferdinand Marcos Jr, known as “Bongbong” and the son of the former dictator Ferdinand Marcos, is leading in opinion polls – despite his late father’s notorious history of corruption and rights abuses. Leni Robredo and her army of nearly 2 million volunteers, known as Kakampinks (pink allies), are trying to stop Macros Jr. Robredo, a human rights lawyer who has advocated for disadvantaged groups and is the current vice-president, is trailing second in the polls by a significant margin. In an election where online misinformation is rife, her supporters have launched a door-to-door effort that is unusual in its scale. In Sampaloc, a deprived district of Manila, some residents are receptive. Josie Loyola, 70, who sits outside her house in the morning sunshine, smiles as she spots the campaigners passing by. “She is good hearted, she has a lot of accomplishments,” Loyola says of Robredo. But she lowers her voice when she speaks of Marcos Jr: “[He] is really questionable, he has questionable integrity.” She worries about political instability, or a repeat of martial law, which was imposed by Marcos Sr in 1972. Human rights violations were rife during the nine-year period: 3,240 people were killed, while tens of thousands more were tortured and imprisoned, according to Amnesty International. Loyola’s son, who is crouched beside a tub of soapy water, stays focused on scrubbing his motorbike. He is undecided, he says. Not everyone wants to talk. A few doors down, images of a smiling Marcos Jr, holding his hand in a peace sign, are plastered on to a house. It was 36 years ago that the People Power revolution brought an end to Marcoses’ 20-year rule, forcing the family to flee into exile. They fled by helicopter, stashing onboard items totalling $15m (£12m): including gold bars, freshly printed cash and hundreds of pieces of jewellery. It was small change compared with the overall estimates of the family’s ill-gotten wealth. Some suggest as much as $10bn was plundered by the family. Marcos Sr died in1989, but the rest of the family was allowed to return to the Philippines in the 1990s and it has been slowly rebranding itself ever since. “Our democratic transition did not go through a process of transitional justice – unlike other countries that went through political or civil strife,” says Julio Teehankee, professor of political science and international studies at De La Salle University in Manila. Instead, the Marcoses was given a warm reception by the powerful, says Teehankee. “The society elites, the circles, embraced them and treated them as celebrities.” The family began to re-establish their position in politics and cement allegiances. In 2016, Marcos Sr was given a hero’s burial with military honours on the recommendation of President Rodrigo Duterte. Marcos survivors were appalled and warned history was being whitewashed. Duterte’s daughter Sara is Marcos Jr’s running mate. Observers say the failure of the Philippine education system to properly discuss the reality of the Marcos rule has created a gap in public knowledge, especially among younger generations, which the Marcos Jr’s camp has exploited. Online, social media accounts linked to or supportive of the Marcoses down play the dictatorship, seek to justify or even deny past abuses by spreading misinformation. They present the Marcos years as a golden era: a time when the economy was thriving; when infrastructure was developed; and there was peace and order. The human rights abuses and kleptocracy are swept aside. Celica Inductivo, 35, who lives across from Loyola, stands over a simmering pot, preparing lunch for her family, as volunteers pass. She will vote for Marcos Jr, she says. During martial law, if were a decent citizen, you did not have anything to be afraid of, her mother, who was a volunteer for Marcos Sr, told her. Inductivo does not believe his son is corrupt, and admires him for rising above such comments. “Despite the various criticisms against BBM, like [the claim he is a] thief, he doesn’t fight back,” she says, using the now popular abbreviation for Bongbong Marcos. He has been criticised for failing to attend presidential debates, and for dodging awkward media questions, including over his failure to pay a tax bill that, according to local reports, could amount to more than $3.9bn. Marcos Jr, whose slogan is “together we shall rise again”, has stuck to a simple campaign message of unity and rekindling a former greatness. “That’s one of the greatest ironies in this year’s election. The most divisive and polarising political brand in the country’s history has appropriated the message of unity and hope,” says Teehankee. It is perhaps a message that is easier to sell. “Authoritarian nostalgia is very simplistic. If you are quite frustrated and desperate, then it’s easy to believe in this rather than Robredo campaign discourse of Filipinos owning the problems of the country, and helping her find solutions for it,” adds Jean Encinas Franco, an associate professor of political science at the University of the Philippines. Polling released by Pulse Asia suggests 56% of voters would pick Marcos Jr as president, who remains the most popular candidate among all age groups. Yet Franco believes Robredo’s campaign, and the large army of supporters it has attracted, will have a lasting impact on Philippine politics regardless of the election outcome. She points not only to Robredo’s impassioned volunteers, but also to impressive turnouts of voters at her rallies. The atmosphere at such gatherings is festive, youthful and hopeful, Franco adds. “I have never seen these kind of rallies or this kind of support for any kind of politician since I started voting,” she says. “There is now a critical mass of people. Whoever the president will be, he or she will have to contend with this portion of Filipinos who are actively engaged.”For Ramirez, who has taken part in two house-to-house campaigns, and attended three rallies, she believes every possible vote counts. The election could, she says, either steer the Philippines forward, or “pull us further backwards and plunge the country down to a state of hopelessness and massive corruption”. Whatever happens next week, she says she will no longer be silent about politics. “We have so much to lose this time around.”",News/World news,‘Authoritarian nostalgia’: Philippines seems set to return Marcoses to power ,https://www.theguardian.com/world/2022/may/04/authoritarian-nostalgia-philippines-seem-set-return-marcoses-to-power-ferdinand-marcos-jr
5/5/2022,"While the battle over abortion rights rages in the US the issue of access to abortion services is yet to be fully resolved in part of the UK. Two years after abortion was legalised in Northern Ireland girls and women in the region struggle to access services that are patchy to nonexistent. Despite progressive legislation, in practice they still face having to continue a pregnancy against their wishes or travelling to England for abortions or taking unregulated abortion pills, Alyson Kilpatrick, chief commissioner of Northern Ireland Human Rights Commission, said on Wednesday. “In Northern Ireland women and girls are still faced with deplorable options,” she said. Abortion was legalised in Northern Ireland in October 2019, bringing it into line with the rest of the UK, after a Westminster vote led by the Labour MP Stella Creasy. Activists hailed it as a new era. However the region’s power-sharing executive at Stormont failed to fully commission services. A deadline to do so by the end of March this year came and went. “Despite securing decriminalisation and the overturning of our near-total abortion ban, we are still waiting for commissioned services to be established and for this healthcare to be accessible to all who need it,” said Grainne Teggart, Amnesty International’s campaigns manager for Northern Ireland. “We have a postcode lottery for access to abortion provision and the services that are in place remain in a fragile state.” Most people in Northern Ireland supported decriminalisation, according to surveys but political parties have moved cautiously, fearing they could alienate socially conservative supporters. Robin Swann, the Ulster Unionist health minister, declined to commission services, saying such a step required consensus in the five-party power-sharing executive, and the Democratic Unionist party was opposed. On paper, Northern Ireland permits abortion in many circumstances up to 24 weeks – which is more permissive than in other parts of the UK. In some areas abortion pills are available for up to 10 weeks of pregnancy. The region has had more than 2,550 abortions since March 2020, according to the Department of Health. But women in western areas cannot access the pills via the region’s health trust. And women who are more than 10 weeks pregnant still need to travel to England for abortions. The lack of access disproportionately affects rural and working class women, said Connie Egan, an Alliance party candidate for North Down in Thursday’s assembly election, speaking in a personal capacity. “Abortions must be accessible and compliant with international human rights standards. The secretary of state must step in and commission full services.” The Northern Ireland secretary, Brandon Lewis, had set the March deadline for Stormont to commission services. If breached, he promised to take legal steps to override the executive and directly instruct the nation’s health trusts to provide abortion services. “We urge him to act without delay – we cannot wait any longer,” said Teggart. “All remaining barriers to abortion must be removed – a failure to do this without the required urgency would be an act of neglect.” Maeve O’Brien, a doctor and activist with Alliance for Choice in Derry, said the UK government should have intervened months ago when it was obvious the Stormont executive had no intention of commissioning services. “We see this uproar in the States but we’re here on Westminster’s doorstep and are being overlooked. We are dealing with desperate women.” Abortion pills could be bought online for £70 but for people in one of the poorest and most deprived regions in the UK that was prohibitive, said O’Brien. She contrasted the furore over Roe v Wade, the 1973 case that guaranteed the right to abortion in the US, with Northern Ireland. “It’s really jarring having this uproar at the same time as the absolute abandonment of these women.”",News/World news,Abortion services in Northern Ireland almost nonexistent despite legalisation,https://www.theguardian.com/world/2022/may/04/abortion-services-in-northern-ireland-almost-nonexistent-despite-legalisation
5/5/2022,"From buying supermarket value brands to putting on a jumper in cold weather, people with wealth and power have been enthusiastically advising the public on how to cope with the cost of living crisis. Many seem unaware that Britain’s poorest families have no margin to absorb higher costs, and that genuine need has given them first-hand experience of how to make their budgets go further. Recent analysis by the Resolution Foundation showed that household spending has risen most for those on the lowest incomes, which the thinktank said highlighted the need for proper targeted support rather than money-saving tips. Here are some of the most ignorant suggestions that have provoked ire: On Wednesday, George Eustice, the minister overseeing food and farming, suggested that people should buy value ranges in the supermarket, which he patronisingly advised could enable them to “actually contain and manage their household budget”. Labour said it showed how “woefully out of touch” the government was, while commenters on social media were quick to point out that “how wealthy people and poor people save money is very, very different”. With gas and electricity increasing by up to 54% from April, energy companies have been offering their customers unwelcome advice on how to manage their bills. E.ON Next sent branded socks to customers to keep them warm – and subsequently had to apologise. Britain’s third biggest energy supplier, SSE, advised customers to keep their heating bills low by “having a cuddle with your pets”, eating “hearty bowls of porridge”, “doing a few star jumps” and drinking water instead of alcohol, comments it later admitted had “embarrassed” the company. When Boris Johnson was asked on Good Morning Britain what he thought about a 77-year-old woman who has only one meal a day and travels on buses during the day to keep her household bills down, the prime minister replied: “The 24-hour freedom bus pass [allowing free bus travel for over-60s in London] was actually something that I actually introduced.” Observers have pointed out that it was the London boroughs that brought the pass in, while the pensioner, Elsie, said she was “disappointed” with his response. The Bank of England governor, Andrew Bailey, who is paid more than £500,000, suggested that workers shouldn’t ask their employers for pay rises to contain the inflationary pressures confronting the British economy in 2022. The education secretary, Nadhim Zahawi, told LBC that the government’s solution to the cost of living crisis was to “make sure there’s a job available” for people. This prompted the host, Tom Swarbrick, to ask whether “Molly-Mae has taken over the Conservative party”, in reference to the wealthy influencer who suggested that, regardless of socioeconomic background, “if you want something enough you can achieve it and it just depends to what lengths you want to go to”. With many struggling to afford monthly rents that have reached record highs, let alone average house prices that are 6.7 times average earnings, Kirstie Allsopp was derided on social media for suggesting that young people could buy their own homes if they gave up Netflix, easyJet flights, the gym and coffees. With the average deposit for a first-time buyer £59,000, according to Halifax, buyers would have to forgo their subscriptions, trips and coffees for 37 years. The wealthy chief executive of the energy supplier Utilita, Bill Bullen, suggested that people should use less electricity to deal with the cost of living crisis, after last winter drawing on his decades of industry expertise to recommend that people wear a jumper to keep heating bills down.",News/Business,"Quit Netflix, wear a jumper: Britons face barrage of patronising tips on cutting costs",https://www.theguardian.com/business/2022/may/04/quit-netflix-wear-a-jumper-britons-face-barrage-of-patronising-tips-on-cutting-costs
5/5/2022,"The Bosnian footballer and manager Ivica Osim, who has died aged 80, was perhaps most famous for resigning in bitterness as coach of Yugoslavia on the eve of the European Championship finals in 1992, protesting at the Serbian bombardment of his native city, Sarajevo. Declaring that “my country doesn’t deserve to play in the European Championship”, he walked out, never to return. Osim did not at any point regret the decision, and said at the time that “on the scale of human suffering, I cannot reconcile events at home with my position as national manager”. In any case, Yugoslavia were soon expelled from the finals due to their war-torn status, and their place was taken at the last moment by Denmark, who went on to win the tournament. Subsequently Osim travelled the world as a manager, having particular success in Austria, where he won two league titles with Sturm Graz, and in Japan, where he eventually took charge of the national team. Born Ivan, but universally known as Ivica, in Sarajevo, he was the son of Mihail, a railway mechanic, and his wife, Karolina. He began his playing career with his local team, the successful railway club Zeljeznicar, in 1959. He was a tall, elegant and elusive midfielder who was a ruthless dribbler. Within five years of his debut he was showing impressive form for Yugoslavia at the 1964 Olympics in Tokyo and catching the eye of clubs in other countries. Yugoslav Federation rules prohibited players from going abroad until their late 20s, so it was not until 1968 that Osim was able to join the Dutch club Zwolsche Boys. There he played only two league games after sustaining a bad knee injury, and he returned to Zeljeznicar the following season before joining Strasbourg in the French league in 1970. After two years with Strasbourg he signed for Sedan, also in the French league, and played 105 league matches from 1972-5 before a move to Valenciennes. He then switched back to Strasbourg for a final couple of years from 1976-78. For Yugoslavia Osim won 16 caps between 1964 and 1969, and he was in the team that beat the then world champions, England, 1-0 in the semi-finals of the 1968 European Championship in Italy. However, he was injured in that match by a ruthless challenge from Norman Hunter and had to sit on the substitutes’ bench for the final against Italy, which was drawn 1-1, and again in the replay, in which Italy triumphed 2-0. As soon as he retired from playing with Strasbourg, Osim became coach of Zeljeznicar and in due course took them to the Yugoslav championship in 1971-72 and to a semi-final of the Uefa Cup in 1984-85, which they lost 4-3 over two legs to the Hungarian side Videoton. With the national team he had become assistant coach to Ivan Toplak in conjunction with managing Zeljeznicar, and in 1984 he helped Yugoslavia win bronze at the Olympics. In 1986 he left Zeljeznicar to take over from Toplak, and under his command Yugoslavia reached the quarter-finals of the World Cup in Italy in 1990, losing on penalties to Argentina. In 1991 he combined his Yugoslavia role with managing Partizan Belgrade, with whom he won the Yugoslav cup in 1992. He guided Yugoslavia into the 1992 European Championship finals, but then resigned in high dudgeon in May 1992 as his family in Sarajevo faced Serbian bombardment in the Bosnian war. After resigning from the managership of Yugoslavia, soon to disappear as a unified entity, Osim made his way later that year to Greece, where he became manager of the leading Athenian club, Panathinaikos, for two years, twice winning the Greek cup. In 1994 he was on the move again, this time to Austria, taking charge for eight years at Sturm Graz, with whom he twice won the Austrian championship, in 1998 and 1999. He then went to Japan, where, between 2003 and 2006, he managed the JEF United Chiba club, not one of the richer teams but quite successful under Osim despite its modest means. On the back of his achievements there, in 2006 he was appointed manager of the Japanese national team, where he developed a reputation for subjecting his players to angry tirades, occasionally reducing even his interpreter to tears. For all his acerbic outbursts he was hugely popular in Japan, and when a book of his apothegms, Words of Osim, was published, it sold 400,000 copies. In November 2007, while watching a league game, Osim collapsed with a stroke. Not until 10 days later did he regain consciousness in the Juntendo University hospital in Urayasu, asking his wife, Asima, “What was the result?” Too ill to continue in management, he relinquished his role with Japan the following month. Osim is survived by Asima and their three children, Selmir, Amar and Irma.  Ivica Osim (Ivan Osim), footballer and football manager, born 6 May 1941; died 1 May 2022",Sport/Football,Ivica Osim obituary,https://www.theguardian.com/football/2022/may/04/ivica-osim-obituary
5/5/2022,"Jesse Lingard has resolved to leave Manchester United when his contract expires this summer even if Erik ten Hag tries to persuade him to stay. Lingard feels he has not been shown the respect he deserves this season after more than 20 years at United and sources close to the player say his mind is made up irrespective of any overtures from the incoming manager. The 29-year-old was an unused substitute against Brentford on Monday in United’s final home game when Juan Mata, whose deal also ends in June, was given a first Premier League start of the season and Edinson Cavani, who has decided to leave, came off the bench. Lingard thought he had received a promise last summer from Ole Gunnar Solskjær that he would get more first-team chances after ending the previous season with an impressive loan at West Ham. But he barely featured under the Norwegian despite the team’s underwhelming form and has been more out of the team than in under Ralf Rangnick, the interim manager. Lingard was dismayed in January when a proposed loan to Newcastle broke down because of the terms demanded by his boyhood club. There was also interest then from Tottenham and Newcastle and it is understood Lingard would consider a move abroad as he tries to reignite his career and force his way back into the England squad before the World Cup. Lingard’s brother Louie described United as “classless” on Instagram after the Brentford match and wrote of his sibling: “Been there since nine years of age and didn’t even get a send-off!!! Well done bro your family are proud.”",Sport/Football,Jesse Lingard plans to leave Manchester United even if Erik ten Hag wants him,https://www.theguardian.com/football/2022/may/04/jesse-lingard-plans-leave-manchester-united-even-if-erik-ten-hag-wants-him
