2/22/2022,"Putin has recognised the independence of two Russian-controlled territories in east Ukraine. They call themselves the Donetsk and Luhansk People’s Republics. The territories have been armed, financed and politically controlled by Russia since 2014. But until this week, Russia still recognised them as part of Ukraine.  Putin has also sent his military on a “peacekeeping mission” to Ukraine, meaning that Russia will formally occupy sovereign Ukrainian territory for a second time following the 2014 annexation of Crimea. But in this case, Russia has not annexed the territories. A document signed by Putin on Monday also allows him to establish military bases or place missiles in the territories. First, Putin has indicated that he questions Ukraine’s right to statehood, calling modern Ukraine an artificial construct of the Soviet Union. He also sees Russians and Ukrainians as “one people”. Second, he thinks that a western-leaning Ukraine is dangerous for Russia. He has called the possibility of Nato membership for Ukraine a “red line” for the Kremlin. Third, he wants to show that popular revolutions such as the one that took place in Kyiv in 2014 do not succeed in the long run. That helps to prop up his own rule in Russia. The decision marks the end of the Minsk peace deal, a troubled road map out of the conflict that would have left the territories in Ukraine. That deal also contained a ceasefire agreement, which is now also void. More than 14,000 people have died in the fighting that has occurred since 2014. Russia’s military is likely to make a formal entrance into the territories soon. Its troops and military vehicles have secretly taken part in the fighting since 2014, but this deployment will probably be much larger. Moscow will now threaten Ukraine with a broader war if it continues to fight against the “separatists”, telling Kyiv that Russia is now obliged by treaty to defend them from attack. Russia could also justify a further invasion of Ukraine by recognising the territorial claims of the two separatist governments. They include the large city of Mariupol, which is on the other side of the frontlines. If Russia recognises their expanded borders, it may order its troops to begin an offensive against the Ukrainian army. That could be a prelude to a broader conflict. Russia has gathered up to 190,000 troops along the Ukrainian border and is positioned to launch an attack that could threaten the capital, Kyiv, and sweep across much of the country. An offensive of that size has not been seen in Europe since the second world war. Western countries have condemned the threat and are likely to impose sanctions on Moscow this week. But the severity of the punishment will be up for debate. And they have made clear that they will not send combat troops to Ukraine. The US had promised the “mother of all sanctions”, probably targeting Russia’s banking and financial sectors, if Russia invaded Ukraine. But that imagined a blitzkrieg-style ground campaign that could take big cities like Kyiv and Kharkiv. The recognition of the territories and occupation by Russian forces is also an act of aggression but it is not the nightmare scenario. As diplomats met in Brussels on Tuesday, it remained unclear whether Putin’s order to send troops into Ukraine would be the trigger for the massive sanctions the EU has been threatening for weeks. On Tuesday, the German chancellor, Olaf Scholz, stopped the certification process for the Nord Stream 2 gas pipeline in response to Russia’s recognition of the two self-proclaimed republics. First announced in 2015, the $11bn (£8.3bn) pipeline owned by Russia’s state-backed energy giant Gazprom has been built to carry gas from western Siberia to Lubmin in Germany’s north-east, doubling the existing capacity of the Nord Stream 1 pipeline and keeping 26m German homes warm at an affordable price. Europe’s most divisive energy project, Nord Stream 2 bypasses the traditional gas transit nation of Ukraine by running along the bed of the Baltic Sea. It has faced resistance within the European Union, and from the United States as well as Ukraine, on the grounds that it increases Europe’s energy dependence on Russia, denies Ukraine transit fees and makes it more vulnerable to Russian invasion.",News/World news,Is Russia invading Ukraine and what will happen next?,https://www.theguardian.com/world/2022/feb/22/is-russia-invading-ukraine-what-next
2/22/2022,"A row has erupted in cabinet over plans to scrap a ban on the import and sale of fur and foie gras after No 10 was convinced to kill off policies that would outlaw the trade. Lord Goldsmith, the environment minister and the ban’s main proponent, spoke out after his colleagues, including Jacob Rees-Mogg, persuaded the prime minister to ditch the proposals.  In response to those in cabinet who do not agree with the ban, Goldsmith said: “The public are strongly in favour of measures to curb the fur trade and foie gras. “There are some who view the issue as a matter of personal choice, but no one would extend that principle to things like dog-fighting or bear-baiting, so it’s not clear why fur farming or force-feeding geese, which arguably are associated with far greater levels of cruelty, should be any different.” There is hope among ministers who are in favour of the bill that it is not yet completely off the table, though sources say “that is the direction of travel”. The ban was supposed to be part of a raft of measures that would position post-Brexit Britain as a world leader on animal welfare. Sources in the Department for Environment, Food and Rural Affairs (Defra) said the ban had been removed from the animals abroad bill in an attempt to scrap the policy altogether. The production of fur and foie gras products are banned in the UK. The Guardian understands that Rees-Mogg made the intervention as he does not believe banning things to be Conservative in nature. This is a further sign of the struggle for Boris Johnson’s ear being played out by the more libertarian side of the Tory party and the more ecologically minded. Some on the rightof the party believe such bans are against free-trade principles, and that the purchase of such goods should be a matter of choice. Others believe the ban could win over swing voters and show the Conservative party is modern and caring. However, there are even splits on the matter within the European Research Group, often thought of as the hub for the party’s libertarian right wing. A leading member said: “I have made no representations to Boris on this matter. I personally stopped eating foie gras when I learned how it was made.” Yesterday, a number of Conservative MPs said they would demand an explanation from the prime minister, who has previously vowed to use Brexit as an opportunity to take a stand on animal welfare. The ban was mentioned in the government’s action plan for animal welfare and aimed to bring swing voters on side. The 2019 manifesto, which referred to the action plan, also committed to not compromising on animal welfare standards in international trade. A Defra spokesperson said the government was still “fully committed to animal welfare”. The shock decision to remove the ban from the animals abroad bill is likely to upset the prime minister’s wife, Carrie Johnson, who has been vocally supportive of such measures. She has previously: “Anyone who wants to buy fur really is sick. Fur belongs on animals only. Nuts to think some of Britain’s department stores still sell fur.” The decision is thought to have been taken while Carrie Johnson was away at the weekend, as she was seen returning to No 10 with her children and some suitcases on Monday morning.",News/World news,Cabinet row as plan to ban fur and fois gras trade scrapped by PM,https://www.theguardian.com/world/2022/feb/22/cabinet-row-as-plan-to-ban-fur-and-fois-gras-trade-scrapped-by-pm
2/22/2022,"The Fox anchor Neil Cavuto returned to the air on Monday, to say he nearly died from a second bout with the coronavirus and to tell detractors including those who sent death threats over his support for vaccines: “So sorry to disappoint you.”  More than 935,000 Americans have died of Covid-19 in the last two years. The seven-day average daily death rate is just under 2,000 – the vast majority unvaccinated. Fox has strict vaccination requirements for staff. But hosts, prominently including Tucker Carlson, have spread misinformation about vaccines and resistance to Covid-19 public health measures including vaccination mandates. Cavuto is immunocompromised, with multiple sclerosis and having survived heart surgery and cancer. After his first positive Covid test, in October, he implored viewers: “My God, stop the politics. Life is too short to be an ass. Life is way too short to be ignorant of the promise of something that is helping people worldwide. Stop the deaths, stop the suffering, please get vaccinated, please.” Some viewers did not stop the politics. Cavuto revealed that he received disturbing messages, including death threats. On Fox Business on Monday, Cavuto said he had been hospitalised for weeks but Fox had not publicised his condition out of respect for his privacy. His second Covid case, he said, was a “far, far more serious strand” because of his immunocompromised status. He had, he said, been “intensive care for quite a while”. “It was really touch and go,” he said. “Some of you who’ve wanted to put me out of my misery darn near got what you wished for. So sorry to disappoint you.” Cavuto also said: “Let me be clear: doctors say had I not been vaccinated at all, I wouldn’t be here. “This was scary. How scary? I’m talking, ‘Ponderosa suddenly out of the prime rib in the middle of the buffet line scary.’ That’s how scary.” He also dismissed the idea the vaccine caused or contributed to his second Covid bout. “No, the vaccine didn’t cause that,” he said. “That ‘grassy knoll’ theory has come up a lot. Because I’ve had cancer, and right now I have multiple sclerosis, I am among the vulnerable 3% or so of the population that cannot sustain the full benefits of a vaccine.” In October, Cavuto described some of the threats he received for taking and advocating the shot. He also said: “I cannot stress this enough: it’s not about left or right. This is not about who’s conservative or liberal. Last time I checked, everyone regardless of their political persuasion is coming down with this … “Take the political speaking points and toss them for now, I’m begging you. Toss them and think of what’s good not only for yourself but for those around you. “I dare say people who experienced this and see loved ones who have been affected by this or have died from this are not judging the wisdom of mandates. “They’re wishing they got vaccinated, and they didn’t.”",News/Media, Fox anchor survives second Covid case and tells detractors: ‘Sorry to disappoint’,https://www.theguardian.com/media/2022/feb/22/neil-cavuto-fox-news-business-covid-vaccination-death-threats
2/22/2022,"The former backbench Tory MP Sir Richard Shepherd, who has died aged 79, ploughed a sometimes lonely but always widely respected furrow as one of the party’s libertarians, even when he fell foul of ministers’ wishes and the demands of three-line whips. Holding the executive to account was ultimately more important to him than toeing the party line. Independent-minded and eurosceptic, he gave fervent, even emotional, support to the concept of open government and freedom of information during a long career in the Commons. He was never promoted to ministerial office – nor would he probably have wanted to be – but he was, rather to his surprise and embarrassment, knighted in 2013. He stood down as an MP at the 2015 general election, after representing the constituency of Aldridge-Brownhills in the West Midlands for 36 years.  Shepherd was born in Aberdeen, the son of Davida (nee Wallace) and Alfred Shepherd, but educated in London, first at Isleworth grammar school and then at the London School of Economics, where he studied economics, going on afterwards to Johns Hopkins University in Baltimore, Maryland. In 1970 he set up a family grocery business, Shepherd Foods – the first convenience store chain to offer late-night shopping – and as an MP worked in the mornings from a backroom at the firm’s Drury Lane head office, assisted by his sister and secretary. He also founded, in 1972, the family’s more upmarket grocery company, Partridges, in the Sloane Street area of Chelsea, run by his brother, John, which received a royal warrant in 1994. Unlike an increasing number of Tory MPs therefore, he could claim first-hand and continuing business experience. A friend and former assistant to the longstanding Conservative backbench eurosceptic Teddy Taylor, Shepherd contested the Nottingham East constituency in the February 1974 election, but found a more permanent, though not necessarily safer, berth in the suburban Walsall seat of Aldridge-Brownhills, which he won from Labour in 1979 and held through the eight subsequent general elections. The conjunction between West Midlanders and their ascetic, intellectual, southerner MP was not necessarily an obvious one, but his home-owning, small-business-orientated constituents clearly appreciated Shepherd and although his majority slipped to just 2,500 in the Blair landslide of 1997, by 2010 it was 15,256 and he was elected with 59% of the vote. In the Commons, Shepherd was one of the Maastricht rebels of the 1990s, but he was never one of the swivel-eyed tendency of europhobes whom John Major characterised as needing the men with white coats. His was a more fastidious and principled opposition, based on constitutional considerations, concerning the sovereignty of parliament, rather than the ill-concealed xenophobia of some Maastricht rebels. This concern for parliamentary sovereignty led him to his stands against government secrecy, manipulation and dissembling, conveyed by his occasionally almost overwrought interventions as he stood, nearly alone on his side, against ministerial obfuscation. Never was this more pointed than in his defiance of a three-line whip to oppose the government’s handling of the Scott report into the arms to Iraq inquiry in 1996. The lengthy report, three years in the making, exposed ministerial inaccuracies and evasions and outright duplicity in the government’s prosecution of the Matrix Churchill engineering company, which had exported components to Iraq with what it understood to be ministers’ approval. Shepherd was outraged, voting against the government even though the embattled prime minister, Major, had made the issue a vote of confidence. In the event, showing just how brave Shepherd’s stand was, the administration survived with a majority of just one. His concern about individual liberty extended more widely too: he voted against the imposition of control orders on terrorist suspects, against the introduction of identity cards and against giving the authorities the power to detain suspects for lengthy periods without charge. Perhaps his most lasting memorial will be his private members’ bill protecting whistleblowers, which, highly unusually for a non-government measure, was incorporated in statute as part of the Public Interest Disclosure Act 1998. Shepherd exercised his own liberty as a smoker. He was genial and approachable and made friends across the political spectrum – including with Guardian journalists researching and campaigning on similar issues to his own. In 2000 he stood for Speaker of the Commons, coming third – an indication of fellow MPs’ esteem – as the Labour MP Michael Martin was elected thanks to Labour arm-twisting. In his constituency, Shepherd served as president of Walsall Football Club. He is survived by John.  Richard Charles Scrimgeour Shepherd, politician, born 6 December 1942; died 21 February 2022",News/Politics,Sir Richard Shepherd obituary,https://www.theguardian.com/politics/2022/feb/22/sir-richard-shepherd-obituary
2/22/2022,"As a child, there was a thrilling danger about growing up close to the open prison known as HMP North Sea Camp. My friends and I would ride our bikes up to nearby Freiston, Lincolnshire, which is where the prison stood between the town and the marshland coast. We would dare each other to inch closer to the gates, only talking in whispers. When the danger felt too close we would turn and pedal our little legs as fast as possible, never looking back until we were sure we were long from view. This week, an inmate escaped from the category D prison, which has minimal security and allows eligible prisoners to spend most of their day away from the prison. The sex offender Paul Robson, 56, absconded on Sunday 13 February, spending four days on the run before being arrested on Thursday in Skegness. Robson had been given a life sentence in 2000 for attempted rape and indecent sexual assault.  Robson’s escape comes as no surprise to those living in close proximity to the North Sea Camp – who are quite used to prisoners fleeing from the site, given there have been more than 100 reported in the past decade. My best friend recalls numerous occasions when the police have come knocking at the door of her family home to look for escapees. In 2013 the town was aghast after Alan Wilmot, then 49, raped a local woman while on day release. When I was at school in the 1990s, it was common knowledge that prisoners came in during the weekends or holidays to do painting and fixing work. To be fair, the school really needed it, but that about 60% of North Sea Camp’s 400 inmates are sex offenders made their presence in our school feel chilling. A friend who still lives locally tells me that they also worked at her secondary school. “One particular man called Dave had killed his wife with a saucepan after finding her in bed with his best friend,” she says. “We would ask them what they’d done to be inside as inquisitive teens.” I have twin 17-year-old sisters, one of whom attends my old school now, and as we chatted on the phone earlier this week I found myself telling them to do the opposite of what I did when I was younger – to stay at home. “It is really worrying,” one replied, adding they’d been glued to the local police Facebook page for updates. “The prisoners have been painting fences near our house the past couple of weeks, so we could have walked past him before he legged it,” she added. Police warned that Robson should not be approached as he “can cause real harm to anyone he comes across”. It’s more than reasonable, then, to ask why someone like Robson, described by a sentencing judge as a “menace to women and children”, was moved to an open prison in the first place. The answer lies with the Parole Board for England and Wales. The idea of open prisons is to build trust between offenders and the system; inmates are invited to complete their sentences under minimal supervision and aren’t usually locked up in cells. Growing up I was supportive of the idea that inmates could take up employment while on day release, helping them towards successful rehabilitation – which can only help bring to an end the cyclical relationship between prisons, poverty, underemployment, isolation and ultimately re-offending. But for dangerous sex offenders like Robson and Wilmot, was their move to open prison really appropriate? In 2015, Wilmot – who was first convicted of raping four women and committing a string of robberies – was given four additional life sentences and 15 years without a chance of parole for the crimes committed while on day release from North Sea Camp. The judge, who heard that Wilmot had received a warning for his deteriorating behaviour, said he was “very concerned as to how anybody could ever have thought it was safe to release him”. The Ministry of Justice overhauled the process for allowing prisoners out on day release as a result, and commissioned an independent investigation looking at strengthening the system. The MoJ revealed in 2020 that, since 2015, an estimated 631 inmates have absconded from institutions like North Sea Camp across the UK – in England there are 13 open prisons for men and two for women. In 2016 convicted murderer Darren Jackson, 51, sparked a nationwide manhunt after fleeing HMP Sudbury in Derbyshire, after being moved there despite a documented history of attempted breakouts. He was sentenced to life in 1986 for killing 29-year-old mother-of-three Gill Ellis as she walked home in Burnley, Lancashire. Eighteen men who escaped in this time period were convicted rapists, seven were convicted of manslaughter and four caused death by dangerous driving. While absconding rates have fallen over the years, families of victims like Ellis are perplexed by decisions that quite obviously leave the public unsafe. A report promised by summer 2021 from justice minister Lucy Frazer QC, looking to review the parole system in England in the face of calls for reform, has yet to materialise. Labour’s shadow justice secretary Steve Reed wrote to the lord chancellor, Dominic Raab, this week to seek assurances over public safety after this latest blunder by the Parole Board. But more than assurances, we need reform. Usually, overturning decisions deemed dangerous, especially to women, like the subsequently overturned release of John Worboys in 2017 for example, come down to the efforts of public protest. Victims of these offenders are rarely told when their attackers are given day release or, in Worboys’ case, released on licence. My sisters are now the ones living near to that Frieston border that me and my friends used to cross on our bikes, and speak in the same hushed voices about the close danger they too can sense. Robson may have been caught again, but while the system remains inadequate, there are still a whole host of other dangerous offenders putting another generation at risk. As it ever was, that peripheral fear – a chill, just off in the distance – remains. Zoe Beaty is a freelance writer",Opinion/Opinion,I grew up near an open prison. The number of escapes now is really alarming | Zoe Beaty,https://www.theguardian.com/commentisfree/2022/feb/22/open-prison-escapes-sex-offender-paul-robson-criminals
2/22/2022,"Germany has stopped the certification process for the controversial Nord Stream 2 gas pipeline in reaction to Russia’s recognition of the self-proclaimed republics in Luhansk and Donetsk in east Ukraine, chancellor Olaf Scholz has announced. Germany’s energy minister, Robert Habeck, on Tuesday morning instructed the withdrawal of an assessment required to authorise the pipeline between Russia and Germany.  “This may sound technical, but it is the necessary administrative step without which the pipeline cannot be certified,” Scholz said at a press conference in Berlin at midday. “Without this certification Nord Stream 2 cannot go into operation”. Scholz said he has commissioned a new assessment into Germany’s energy security in the light of geopolitical developments in east Ukraine. The German leader described Putin’s recognition of the Russian-controlled territories as a “grave breach” of international law that broke with decades of agreements between Russia and the west. “The situation today is fundamentally different,” he said. First announced in 2015, the $11bn (£8.3bn) pipeline owned by Russia’s state-backed energy giant Gazprom has been built to carry gas from western Siberia to Lubmin in Germany’s north-east, doubling the existing capacity of the Nord Stream 1 pipeline and keeping 26m German homes warm at an affordable price. The construction of the pipeline was completed last September and its operator says it is already filled with gas and ready to go into use, pending permission from German authorities. Social Democrat Scholz, who was sworn in as German chancellor last December, has skirted around the Nord Stream 2 debate in the first weeks of his tenure, with his spokespeople initially sticking to the line that the pipeline was a purely commercial project. As tensions heightened on Ukraine’s border with Russia, Scholz said that “all options are on the table” when it came to sanctions against a possible incursion, but still refrained from naming Nord Stream – until now.",News/World news,Germany halts Nord Stream 2 approval over Russian recognition of Ukraine ‘republics’,https://www.theguardian.com/world/2022/feb/22/germany-halts-nord-stream-2-approval-over-russian-recognition-of-ukraine-republics
