2/18/2022,"Dozens of schools in Philadelphia are suffering from lead contamination in their water lines, an environmental report has found, potentially exposing tens of thousands of students to toxins proven to cause learning and behavioral issues as well as health problems including damage to internal organs.  The Philadelphia school board disputes the findings of the study by PennPirg (Pennsylvania public interest research group), insisting that systems are in place to prevent students and staff drinking contaminated water, and that any outlet found with lead in excess of acceptable limits is immediately shut down. But the study’s authors say that the data it has reviewed so far is “just the tip of the iceberg” of the problem across the school district of almost 200,000 students, and is calling for the replacement of every drinking fountain with water bottle filling stations, and filtration systems to be installed in kitchens and other facilities where water is used for consumption. “Philadelphia’s children deserve safe drinking water, especially at the schools where they go each day to learn and play. As this data shows, it is critical that Philadelphia decision-makers take immediate action to get the lead out,” the study says. PennPirg reviewed data reported by the school district under a 2017 law that requires lead testing on every campus at least every five years, and for the results to be made publicly available. But the group said that by the start of this month, four years into the cycle, only 29% of the district’s 323 schools had posted information online, covering drinking fountains, kitchen faucets, hydration stations and sinks in classrooms and bathrooms. From a review of that data, the study found, 61% of the 1,932 outlets tested showed lead contamination greater than one part per billion, and that of the 65 schools for which data was available, 98% had at least one outlet with contamination in excess of that level. One outlet at the Tanner G Duckrey public school, a pre-K to 8th grade campus in north Philadelphia, showed levels of lead at 8,768ppb. The long-running dirty water crisis in Flint, Michigan, brought new scrutiny of levels of water contamination nationwide, and Joe Biden’s administration has promised to make the issue a priority, announcing ambitious plans in December to replace 100% of lead pipes in homes across the country. “The science on lead is settled – there is no safe level of exposure and it is time to remove this risk to support thriving people and vibrant communities,” the environmental protection agency (EPA) administrator Michael S Regan said in a statement at the time. But critics noted there was no plan to reduce the existing “acceptable” level of lead in water from a Donald Trump-era rule of 15ppb, and that no timeline was announced for the pipe replacement. Additionally, they feared that economically deprived areas and those with high populations of racial minorities would be overlooked. “Children, especially those in the pre-K to seven-year-old age range, and particularly children of color and those from low-wealth communities, are among those most vulnerable to environmental toxins and exposures of all kinds,’” said Jerry Roseman, director of environmental science and occupational safety and health for the Philadelphia federation of teachers. “Substandard conditions in many school spaces continue to exist and to present health risks to students, as well as staff; ensuring that adequate, accessible and lead-free drinking water is readily available to all students and other school occupants is an absolute bottom line requirement for every school in Philadelphia.” In a statement to ABC News, the Philadelphia school district said the study was “not an accurate reflection of the water quality that students and staff in our district are accessing each and every day. “In the event that a water outlet tests at or above 10ppb, the city of Philadelphia’s required threshold for school drinking water, the outlet is immediately shut down. “The district closes these outlets, both because it is required under city and EPA regulations, and to prevent students or staff from using or ingesting contaminated water.”",News/US news,"Water in dozens of Philadelphia schools contaminated with lead, report finds",https://www.theguardian.com/us-news/2022/feb/18/philadelphia-schools-lead-water-dozens
2/18/2022,"It is the TV drama that has divided its viewers. Hailed by some as a brutally accurate depiction of the realities of working in an NHS maternity unit, This Is Going to Hurt has been denounced by others as misogynistic and insulting to women giving birth. Now the actor who plays an exhausted and stressed female junior doctor in the show has rejected criticism of the BBC series set on an NHS obstetrics and gynaecology ward.  Ambika Mod – who plays the part of Shruti, considered by some viewers as the drama’s most compelling character – said she had received “many lovely messages from people saying you’ve portrayed the NHS so accurately – that’s really rewarding because it’s what we set out to do”. The seven-part drama is based on the bestselling memoir by Adam Kay, who spent six years as an NHS doctor, regularly taking life-and-death decisions while exhausted by 97-hour working weeks. Billed by the BBC as “comedy-drama”, it graphically depicts caesarean sections, placentas, body fluids and chaos in the hospital’s “brats and twats” department. The lead male doctor is played by Ben Whishaw. Mod said she was aware of claims that the series depicted birth as traumatic and women as disempowered and dysfunctional, but “we were as respectful towards women as we possibly could be”. Shruti was a “complex female character” and the production team had included many women, she said. Mod researched the role by talking to junior doctors to find out how the job affects them “socially, emotionally, mentally”. A lot of viewers had been grateful that the drama “showed childbirth as it actually is – because it is brutal, it is messy, and it is gory. And that’s not something we’ve seen on television before,” she said. “It’s important we engage with reality. The NHS is one of the greatest things about this country, and we need to protect it.” Some viewers have said the drama relegates female patients to “slabs of meat” who play no part in decisions about delivering their babies or receiving treatment. Milli Hill, founder of the Positive Birth Movement, said Kay’s book was “blatantly disrespectful towards women. It sums up the misogyny that’s baked into maternity care – the idea that any woman who thinks she can control labour or plan for labour is an idiot, basically.” Hill, who had only watched the first episode of the series when she spoke to the Guardian, said it had been “really triggering” for some viewers. “What women are objecting to, from the messages people are sending me, is women’s trauma being played for laughs,” she said. Hill said that the drama was “all about [Kay], how hard it is for him. You’re not seeing anything of the women’s stories, you just see them as body parts in the background. It shouldn’t be him who’s the hero at the centre of the story, it should be the women who get to tell their version of events.” She added: “There is no excuse for a woman to be traumatised by childbirth. And yet the more it’s beamed into our living rooms like that, the more it becomes a vicious circle. I’ve had loads of pregnant women getting in touch with me, saying is that what it’s going to be like? They’re absolutely terrified.” Some pregnant women said on social media that they had been advised by their midwives not to watch the series. Community midwife Rachael Dewey tweeted that the show “demeans women’s experiences/bodies and has dramatised attitudes we’re trying to move away from in midwifery/obs and gynaecology. Calling obs and gynae ‘Brats and twats’ – just sums it up really … It’s not representative of respectful maternity care and how birthing women should be portrayed.” But Juliet Pearce, director of nursing midwifery at the Isle of Wight NHS trust, said the show was “hilarious and heartbreaking” and a “reminder of the human emotions behind every tired, scared and fallible healthcare professional”. Jess Phillips, the Labour MP for Birmingham Yardley and an advocate for women’s rights, said she loved Kay’s book, which she had read on the recommendation of a midwife friend, and had begun watching the TV series. Kay “shows the strain doctors are under, and a system that’s creaking and cracking”, she said. Her own experience of giving birth in an NHS hospital had negatives “but I also felt completely supported by the amazing staff”. In a statement, Edward Morris, president of the Royal College of Obstetricians and Gynaecologists, said the drama “exposes the harsh realities that healthcare professionals can face when they work in the field of obstetrics and gynaecology in the NHS”. He added: “The show also explores what happens when birth complications arise, or when things go wrong which can be very upsetting to watch … The traumatic scenes of the programme can be difficult for women and their families as it shows experiences of pregnant women who have had poor birth outcomes. “We want to reassure women that the NHS is still one of the safest places to give birth in the world.”",Lifestyle/Life and style,‘Childbirth as it really is’: This Is Going to Hurt actor defends series accused of misogyny,https://www.theguardian.com/lifeandstyle/2022/feb/18/it-is-brutal-this-is-going-to-hurt-actor-defends-series-accused-of-misogyny
2/18/2022,"The first and last word on this RSC production has to be on its dazzling design. Set in a high-concept Messina inspired by Afrofuturism and sci-fi, it comes with a wardrobe and stage set that will have any audience member’s eyes on stalks. There are gold fountains, silver frocks and stupendous white afros. Each costume and set change outdoes the one before it. It is what you might expect if Baz Luhrmann adapted Much Ado About Nothing into a lavish theatrical romcom.  A space-age backdrop gives the impression that we are aboard the Starship Enterprise, the cast like inhabitants of a newly discovered faraway planet. There are twists of Black Panther too along with The Lion King and Nasa-inspired 1970s designs of Pierre Cardin. The director is Roy Alexander Weise but this is not so much his production as that of the costume designer, Melissa Simon-Hartman, and the set designer, Jemima Robinson. On looks alone this would get the full five stars, but the show as a whole skitters too much on its shimmering surfaces. The central gender switch works well: Don Pedro is now Pedra (Ann Ogbomo), a princess who woos Hero (Taya Ming) on behalf of Claudio (Mohammed Mansaray) and then flirts with Beatrice (Akiya Henry). The suggestion is that in this universe there are no gendered preferences in romance and marriage. But the pace and performances seem out of kilter; it begins on a high-octane note with Pedra, Claudio and Benedick swooping from the ceiling on ropes wearing coloured capes and looking like futuristic superheroes – high energy with a great dollop of kitsch. A shimmering set-piece is built around the masquerade ball. “Good evening, Messina. Are you having a good time tonight?” croons a singer clad head to foot in gold. The music, composed by Mobo award-nominated Femi Temowo, takes us from Afrobeat to soul and reggae. It is all super-cool but begins to take on the look and feel of a pop video or an advert for high-end vodka. Several performances lack depth and subtlety, with lines declaimed rather than felt. At over three hours, it begins to plod. There is not enough shock and psychic violence in Claudio’s public shaming of Hero when he wrongly accuses her of pre-marital sex, and Hero’s surprise reappearance at the end, having been proclaimed dead, does not bring the emotional uplift that it should. A Christmas panto energy begins to creep into the second half, too, with cartoonish overacting between a gender-reversed Dogberry (Karen Henthorn) and her motley crew. Michael Balogun withdrew from the role of Benedick last week and his understudy, Luke Wilson, is one of the strongest forces in this cast (Balogun’s own breakthrough performance came in Death of England: Delroy as an understudy after Giles Terera pulled out). Wilson brings mischief and likability to his part, opposite Henry’s flamboyant and minxish Beatrice. They are good sparring partners in their witty skirmishes but lack romantic energy. So do Hero and Claudio, which keeps us at arm’s length from the emotional drama of this play and all its near-tragic moments. What stays in the mind is the breathtaking aesthetics. Simon-Hartman and Robinson deserve an Olivier, and every other accolade going. Royal Shakespeare theatre, Stratford-upon-Avon, until 12 March.",Arts/Stage,Much Ado About Nothing review – a lavish vision of space-age Shakespeare,https://www.theguardian.com/stage/2022/feb/18/much-ado-about-nothing-review-stratford-upon-avon
2/18/2022,"I wish I could have a better relationship with my grandmother. She has been recognised as a difficult person, a liar and highly critical for as long as I remember. She pits family members against each other, picks fights, says what she wants. If we act offended, she gets defensive and tries to make us believe we misunderstood. She has lived a difficult life; my grandfather was always cheating on her, and left her with no money. She built her own life from scratch, gave my aunt money after her divorce, and welcomed me in her house after I was kicked out of my own. I try to act grateful, but the best I can do is help her financially, as spending time with her kills me inside, and can leave me enraged to a point that’s unhealthy.  We all more or less avoid her. I visit once a week. She’s in her early 80s, smart and in good health, doesn’t require any assistance, but her memory isn’t the best. She has started socialising with women in her neighbourhood, but still finds fault in every little thing her new “friends” do. I know this isn’t the life she wanted. I’d like to have a loving relationship where we’d see each other more often, but what I really want is for her to be different. What can I do? As you say, unfortunately you can’t turn her into the magical grandmother you want. If she is like this now, I wonder what she was really like when she was younger. I often think how unfair it is that we compare “difficult” older members of the family with younger members. It’s not a level playing field. That said, your grandmother sounds very trying and does have to own her current behaviour. What stops you being like the rest of the family and avoiding her? I went to psychotherapist Arabella Russell, who said sometimes members of the family “hold” all the bad behaviour for the others – ie, as long as we are complaining about “grumpy Aunt Mary or Uncle John”, we can avoid looking at other aspects, such as our own part in things. I’d heard about this being done to children, but have to admit I never thought about it happening in the other direction. Russell and I both wondered why you feel you have to fix it. “It seems as if you can’t quite pull away from [the situation],” said Russell. She reminded me that “every criticism is an unmet need”. I paused on that for a while. Russell added: “Your grandmother has felt abandoned her whole life and finds others’ happiness very hard. You seem to understand that, but how much of this is your own pain and the fear of where you may end up?” Do you see anything of yourself in her? “You can only change the way you are around your grandmother,” said Russell, “but I wondered if there’s a critical voice in you thinking, ‘If I get on better with her, will I get on better with the more difficult [or, I would say, needy] parts of me?’” We both noted your mother “kicked you out” when you were young. That must have been hard. Maybe you felt abandoned, too. I wonder if that part of your life might be worth exploring. Look at what you can practically do with regard to your grandmother: a change to your visits, which may lessen the impact? Visiting more frequently, but for less time, may help. Could you do something together that doesn’t involve talking? Ultimately, however, if this continues to hurt you to the point it “kills you inside”, you need to ask yourself: why am I doing this?  Every week Annalisa Barbieri addresses a family-related problem sent in by a reader. If you would like advice from Annalisa on a family matter, please send your problem to ask.annalisa@theguardian.com. Annalisa regrets she cannot enter into personal correspondence. Submissions are subject to our terms and conditions.  Conversations With Annalisa Barbieri, a new podcast series, is available here.  Comments on this piece are premoderated to ensure the discussion remains on the topics raised by the article. Please be aware that there may be a short delay in comments appearing on the site.",Lifestyle/Life and style,"I want to have a better relationship with my gran, but her behaviour enrages me | Ask Annalisa Barbieri",https://www.theguardian.com/lifeandstyle/2022/feb/18/i-want-a-better-relationship-with-my-gran-but-her-behaviour-enrages-me-ask-annalisa-barbieri
2/18/2022,"‘The Premier League is known as the top league in the world so it’s definitely going to be a lot tougher,” Michael Olise said in his first interview as a Crystal Palace player. “But nothing I’m not ready for, so …” Seven months on, the versatile forward whose dazzling array of skills briefly graced the academies of Arsenal, Chelsea and Manchester City has shown he is back where he belongs. Olise’s return of two goals and three assists from the 314 Premier League minutes he had played for Palace by the start of January meant that with a goal contribution every 63 minutes, the 20-year-old was the division’s most productive player.  His instant success at Selhurst Park has come as no surprise to Sean Conlon, who first met him when Olise was playing for his local side Hayes in west London at the age of seven. “He’s always been someone who scores goals because his control is so good and he is thinking so many steps ahead of everyone else,” Conlon says. “Michael also has so much variety in his technique that allows him to see the picture and means he is able to make the decision on what is the most appropriate finish.” Conlon had just left Chelsea as a coach and was working as a scout for QPR but was so impressed that he recommended Olise to his former employers. “Michael was also training with Arsenal at the time because before you move into the under-nines, you’re allowed to train with multiple teams,” he says. “But he probably lived closer to Chelsea and they obviously have a great academy so he ended up signing for them.” While at Chelsea Olise also received individual training from Conlon’s company We Make Footballers, which specialises in developing players between the ages of three and 12, and turned out for his grassroots team. “I’ve always said that from the age of nine Michael has been the best player for his age in the country,” Conlon says. “He’s always been very graceful and elegant in the way that he moves. But it was when he went into the academy setup at Chelsea that his technique began to shine and all of his ability on the ball started coming through. And then as he has got older his football IQ developed so he answered almost every question that was asked of him.” Although Olise always appeared destined for success, his departure from Chelsea at 14 – described as “a mutual decision” by Conlon – was a reminder that there are never guarantees in football. Having spent a few weeks travelling to Manchester to train with City, he went six months without a club. “Sometimes people don’t think about it being hard for players who are supremely talented because that can also come with its own difficulties,” Conlon says. “It’s not been a perfect journey for Michael but I think that has benefited him. Coming out of Chelsea at that age has given him that resilience and desire to succeed.” Before joining Reading, where he made close to 70 Championship appearances and was crowned EFL Young Player of the Season last year, Olise played in several showcase games that Conlon had arranged. “We had all the scouts from clubs in London watching and everyone was just in disbelief about how good Michael was,” he says. “I videoed those games and I need to get them off the hard drive … I’ve taken one of them to the shop because I was like: ‘Oh my God, there’s gold on these!’” Patrick Vieira has carefully managed Olise’s integration into the Palace first team, having seen off interest from City and others to sign him for £8m in the summer after activating the release clause. “He’s making huge progress from when he arrived to six months after – I think he’s a different player,” Vieira said last week. Olise has made only five Premier League starts but cemented his status as a fans’ favourite with a goal and an assist at their local rivals Millwall in a heated FA Cup third-round tie during which he taunted home supporters after being struck by a bottle as he prepared to take a corner. “I remember when Michael came down to play for my seven-a-side team at Alperton goals,” Conlon says. “It was full of semi-pro players who were so aggressive. Michael came and, at the age of 14, he was the best player. And because of his character, everyone liked him and respected him. He might be a little bit quiet but he’s humble and very polite. I’ve heard some of his teammates referring to him as the rock star. He has got something very unique about his persona.” Judging by the cool celebration after another brilliant goal against Hartlepool in the Cup fourth round, Olise has found his swagger in south London. Conlon also coached Liverpool’s Harvey Elliott and Olise’s younger brother Richard – a promising right-back who has been a regular for Chelsea Under-18s this season – and recently introduced a scholarship named after the Olise brothers that provides two young players from Hayes with free coaching sessions. “When he signed for Palace I spoke to his dad and they were just so grateful for the situation,” he says. Olise’s father is from Nigeria and his mother’s heritage means that Olise is eligible to play for France and Algeria as well as England. His only international appearances have been for France at the 2019 Toulon under-age tournament and Conlon is intrigued to see which country Olise ends up representing. “I would imagine that there could be quite a few options for him in the end. Michael takes his football very seriously and knows where he wants to get to.”",Sport/Football,Michael Olise: from Chelsea exit to sparkling form at Crystal Palace,https://www.theguardian.com/football/2022/feb/18/michael-olise-crystal-palace-chelsea-reading
