4/30/2022," We misnamed one of the contestants in Interior Design Masters With Alan Carr; he is called Banjo, not Bingo (Television, 16 April, What’s On, p4).  A recipe for roast chicken with green rice and ancho butter accidentally omitted 200ml white wine from the ingredients list (9 April, Feast, p8).  The Kinder mass trespass, which established the principle of open access land, took place on 24 April, not 25 April 1932 as we said in an article about its 90th anniversary (Swimmers plan mass trespass at Kinder reservoir, 23 April, p15).  Other recently amended articles include: External blood oxygenation saved hundreds of Covid-19 sufferers – study How would a UK windfall tax on oil and gas profits work? Higher levels of PFAS exposure may increase chance of Covid, studies say ‘I was consumed with anger’: Brian Jackson, Gil Scott-Heron’s brilliant, badly wronged partner ‘It’s my idea of hell!’: the intense new play set aboard a cargo ship Everton’s confused strategy has infected both their men’s and women’s teams Ban for former Paralympian whose charity paid £1m to family companies Editorial complaints and correction requests can be sent to: guardian.readers@theguardian.com. You can also write to: Readers’ editor, Kings Place, 90 York Way, London N1 9GU, or leave a voicemail on +44 (0) 20 3353 4736.",News/News,Corrections and clarifications,https://www.theguardian.com/news/2022/apr/29/corrections-and-clarifications
4/30/2022,"The prime minister, Scott Morrison, is pretending to shop. “Where’s my basket?” he asks, sparking a flurry among advisers to source a shopping basket. A trolley? (Nope, Morrison signals with his eyes.) A branded hessian bag? “Perfect. Let’s go!” “So where’s your turmeric coming from? “Ah Bundaberg. Great.“I prefer using fresh turmeric when I cook.” “I like to cook. That and swimming. It keeps me sane.” Morrison tells Dom at Doblo’s Farmers Market he plans to cook a “veggie curry for the girls” back in Sydney on Saturday night. He adds fresh galangal to the bag. “Can’t have too many of these,” he says of Tasmanian shallots, grabbing a few handfuls. “Where’s the garlic from?” Peru. That gets left on the pile. Onions? Plenty of those at home. “Ah, taro”! He says, as if greeting an old friend. Okra jumps in. Baby eggplants – like the ones “Jen and the girls” grew in Canberra. A pomegranate. A cauliflower. Watching the prime minister winding through the cool rooms, making small talk with owner Dom Doblo, filling his bag with fruit and veg, it’s possible just for a moment to suspend disbelief, imagine for a second that what we are witnessing is real life. But of course, the swarm of cameras, boom mics and reporters that shadow the prime minister’s every move exposes the charade. Morrison is aware of every angle, every interpretation of his campaign event. He curates images and conversations for the consumption of the media pack precisely. He is the star actor, while imagining being the spectator. He is the director of his own show. Despite the best efforts of the cammos, staffers assiduously guide Morrison away from a large statue of a gorilla sitting in a nest of bananas, protecting him from any monkey puns on the evening news. “So this is what you invested with the instant asset write off?” he asks Dom, already knowing the answer, which was included earlier in the campaign brief to reporters. “Well it’s a big fridge. It’s a very big fridge,” Morrison says. “You’d have people just coming here to walk through it in summer – it’s either here or go to the pool!” It’s strange, after two years of pandemic politics, to be reminded of Morrison back in his natural habitat, pressing the flesh with voters, making small talk. Morrison is softer in this embodiment, he smiles and jokes easily. He knows this is his strength as a politician. There are none of the awkward pauses that used to plague Malcolm Turnbull when he attempted to mingle with middle Australia. None of the peculiar Abbott-isms that came before that. No risk of onion-eating here. This is the Morrison machine at its best. Super normal. It’s oddly captivating, the layers of artifice. Will he really cook that okra? I wonder. Pound fresh turmeric for a veggie curry on Saturday night? The bill comes to $52.14. He takes out his credit card and pays. Jumps in a white SUV, and speeds off. This make-believe takes place in the seat of Capricornia, held by the Coalition on a 12.4% margin by Michelle Landry, the incumbent since 2013. The Coalition is feeling comfortable about Queensland. After substantial swings against Labor in 2019, the buffers in the seats north of Brisbane are difficult for Anthony Albanese to overcome at this election. Morrison began the day in Townsville, in the seat of Herbert, held by the nuggety Phil Thompson on an 8.4% margin. When Kevin ‘07 swept John Howard out of office, the seat of Herbert swung 6% towards Labor. Barring any last minute Albomentum, Herbert is not in play. The tour of Doblo’s market is the third campaign stop of the day. “Relentless”, is how one tv journalist who has been captive on the Coalition campaign bus for the past two and a half weeks describes it. “But great pictures”. Most days are the same. A picture opportunity in the morning. A press conference late morning. A change of location and a third stop – usually a manufacturing plant where the hard hats and high vis come out. Guardian Australia jumps on the campaign trail in Townsville, where Morrison has landed after spending Anzac day in Darwin. It is week three of the six-week campaign. The Labor leader Anthony Albanese is in isolation in Sydney with Covid. A ding on the “Scomobile” Whatsapp group advises that the first event on the campaign trail is a visit to the Jean-Pierre wholesale artisan bakery. Morrison rolls croissants, gently sandwiches bright ruby macaron shells together, making small talk with pastry chefs, clapping his hands like a football coach. “That’s how you do it!” At a press conference at the TEi steel fabrication plant, the prime minister stands up to talk about a $60m grant program for business energy efficiency and to announce a hydrogen hub for Townsville. But the prime minister is on the defensive. His first task is to try and tidy up an unwelcome split over the Coalition’s net zero goal after the LNP’s candidate for Flynn, Colin Boyce, suggested there was wriggle room in the commitment. “What he [Boyce] was referring to was our pathway to it and as technologies change and improve, then, of course, we’re going to get there and we’re going to get there by the best method possible.” “It is the government’s absolute policy.” Morrison is also on the back foot over national security, with the government under pressure over whether it has dropped the ball to allow a security pact between China and Solomon Islands to be signed. But Morrison has an answer to everything. On a question on rebuilding trust with Emmanuel Macron, he pivots to the Chinese in the Pacific. Asked question on his remarks that public Icac hearings are a “kangaroo court”, he steers to his rote reply on the integrity commission. The invisible question time folder is always at his fingertips. Morrison has been in cabinet for almost a decade. In 2009, he became opposition spokesperson on immigration – the most challenging portfolio at the time as the country dealt with boat arrivals, and arguably the issue that won them government in 2013. Since that time, he has faced the daily assault of media questioning. He makes no secret of his disdain for most of the press gallery in Canberra, apart from a few friendlies, and feels no need to answer questions he doesn’t like. In the frenzy of campaign press conferences it is even more difficult to pin Morrison down. Only once during this campaign – when the press focus was on the government’s broken promise to establish an integrity commission – has Morrison faced sustained pressure. In The Game, Sean Kelly’s portrait of Scott Morrison, he notes that “one of the truly remarkable facts about Scott Morrison is how few gaffes there have been in his career.” “He makes mistakes, says things that are obviously false, even lies, but rarely does he say something that makes you think that you are suddenly, briefly, getting a glimpse of something you were not meant to see.” Morrison’s campaign has so far been largely mistake-free, even if full of political mistruths and lies. Take the “sneaky carbon tax” which gets a run when Morrison stands up in Rockhampton after having cups of tea with a group of seniors, referring to the safeguard mechanism that the Coalition itself introduced in 2013. Morrison has no compunction. “You have got to scrap to win,” he privately tells colleagues. Despite the national polls pointing to a comfortable Labor win at next month’s election, Morrison displays not a skerrick of self-doubt about the task ahead. He has been in this position before, having told colleagues that he can once again take them on an unlikely path to victory. Bill Shorten at the last election said the Coalition had a “goat track” to win, compared to its freeway. It is even truer this time round, with the government starting behind on 75 seats. It needs 76 for a majority. Sign up to receive an email with the top stories from Guardian Australia every morning “I know what the path is and I’ll be following it,” Morrison told MPs in February. “And once again I’m asking you to follow me in going down that path and staying focused on that and only that.” “Do that and we win - it’s that simple.” While the Coalition dares to dream of a second miracle victory under Morrison, the task at this election is far more difficult than in 2019, when the prime minister was being introduced to voters for the first time. This time, Morrison is a known quantity. He has baggage to carry up the track. Across the country, Labor is hammering his record and character, a task made easy by the free character assessments of Morrison offered up by everyone from the then NSW premier to the French president. Labor’s negative campaign has been brought forward, convinced that converting parked votes its way is best achieved by galvanising public anger towards Morrison. But despite the effectiveness of Labor’s message, Coalition strategists insist there is still a path to victory. The logic goes like this: People have already factored in their anger against Morrison, so why haven’t they yet converted their vote to Labor? If they haven’t made up their mind yet, then the parked protest vote is soft. It is in this gap that the Coalition senses opportunity, hammering home the choice between the known and the unknown. “This election is a choice,” Morrison says on repeat. “Between a government that you do know and a Labor opposition that you don’t.” Party strategists also question whether the negative campaign against Morrison has run out of juice. How much lower can Labor’s attack drag the Coalition vote, with it already languishing in the mid 30s? Can community anger be whipped back to where it was at its hottest? Are the baseball bats out for Morrison? In parts of the country, yes. But in the parts that matter? That remains to be seen. “We can win this,” one senior figure says. “It’s not easy, but it’s possible”. The campaign so far has been framed around the Coalition’s traditional core strengths of the economy and national security, but on both of these issues, Morrison has been on the backfoot. In Cairns, at a local shipyard on the banks of Chinaman Creek, Morrison is campaigning with the MP for Leichhardt, former crocodile farmer, Warren Entsch. Morrison is fielding questions on spiking inflation, which has just come in at a 20-year high, undermining the Coalition’s message on strong economic management. But the prime minister seems to relish the opportunity. “Well, look, I’ve been around politics a little while and I’ve also been around the economy a long while,” Morrison starts, before turning to his lines on the risk of a change to Labor. Morrison has two tasks in this campaign. Remind people of his experience. Paint Albanese as a risk. He will do this relentlessly, every day until polling day. This is Entsch’s ninth election. He has contested and won every election in the seat since 1996 - apart from in 2007, when Labor won the seat in his absence. “This is the hardest one to read of all of them,” he tells Guardian Australia. “And that is because of social media, and the hangover from Trump with all the fake news nonsense.” He says he doesn’t sense that baseball bats are out for the government, and insists the reception for Morrison has been positive. But Entsch concedes it will be “tough”. “There is a lot of single issue stuff and a lot of angry people,” Entsch says. There are 11 parties on the Leichhardt ballot paper, and Entsch says they will all drag down his primary vote and likely preference against him. Across the nation, a similar story is heard, with the unprecedented support for independents and other parties the biggest unknown at the coming poll. Compared to previous elections, Entsch says this is the first that he has detected the strong influence of social media on voters. He has had campaign posters defaced with “corruption” graffiti for the first time, had locals yell at him in shopping centres about the “new world order”, and has had countless conversations about fake news. “They think mainstream politicians are corrupt, they think mainstream media is corrupt and they get all their information from the deep, dark abyss of social media. “When I say to them you need to balance out your opinions, look at some reputable news, they come back to me and say ‘social media is my truth’.” Entsch says the election feels a bit like the GST election of 1998, or the Gillard-Abbott contest of 2010 when Australia ended up with a Labor minority government, but hopes as the election draws closer the economic choice will become starker. “You can never know 100%, but I think we are in with a chance.” For Morrison, he is confident that all the ingredients are there for a victory. But will it come together? Or will it remain a figment of imagination, a fantasy left behind on the campaign trail.",News/Australia news,‘The director of his own show’: the PM mingles with middle Australia,https://www.theguardian.com/australia-news/2022/apr/30/the-director-of-his-own-show-the-pm-mingles-with-middle-australia
4/30/2022,"For tragedy to really tear your heart out, it has to feel preventable. What if Juliet’s messenger had arrived on time? What if Othello had trusted his wife? What if Caesar had just stayed home that day and caught up on the latest papyrus? Watching the brisk, mordant Broadway revival of Macbeth, which stars a muscled, de-Bonded Daniel Craig, you might entertain another what-if: what if medieval Scotland had maximally effective therapy? Sam Gold’s production performed on a seemingly bare stage, designed by Christine Jones and lit, thrillingly – in shocking blues, reds and greens – by Jane Cox. It begins with a precis of attitudes toward early modern witchcraft, delivered, drolly, by Michael Patrick Thornton. An incantation follows. A cast member (Danny Wolohan, later to endure worse) is hung upside down in an inverted cross while other members stir a bubbling pot with suspiciously red contents. Is that smell garlic? Or something more sinister? Still, this swift, savvy Macbeth never winds its charm too tightly; only rarely does it feel unearthly. Instead, Craig’s burly Macbeth, clad handsomely in Suttirat Larlab’s modern dress costumes, is every inch a man of action and a soldier, even in a silky bathrobe, entirely convincing in motion, less persuasive when zipping through Macbeth’s equivocations. If he is in blood stepped in so far, it doesn’t seem to bother him. Any decent castle has maid service. Instead, this Macbeth inhabits a one-man culture of toxic masculinity, prisoner to his vaulting ambition, unable to accept any personal weakness or to enjoy his golden opinions when there is more still to achieve. Infirm of purpose? Please. If this Macbeth could use some time supine on an analyst’s couch, he and Lady Macbeth (a dynamic Ruth Negga) could also use some couples counseling. Negga’s Lady Macbeth is an enabler and an abettor (codependent much?), asking to be unsexed so that she can achieve the masculine ruthlessness that her husband so clearly values. The characters who display more sympathy and fellow feeling – Paul Lazar’s bluff Duncan, Amber Gray’s crystalline Banquo – don’t tend to last long here. The one exception is Grantham Coleman’s upstanding Macduff, who resists the urging of Malcom (Asia Kate Dillon) to man up. “Dispute it like a man,” Malcolm insists. Instead, Macduff insists on making space for his grief and his weakness. “I shall do so,” he says. “But I must also feel it as a man. I cannot but remember such things were, that were most precious to me.” But in contrast to most productions, Macduff’s victory feels less than assured. There’s pleasure to be found here and a dark, macabre wit. The potion that begins the second half has some ghastly ingredients. Poor Wolohan. Gold’s direction is focused and specific, in contrast to his labored King Lear. But there’s something unexamined and underscrutinized in this version. This Macbeth, a man of action, doesn’t change much from the first scene to the last. (His Iago, in Gold’s Othello, had more depth and variety.) Negga’s Lady M transforms, though this happens almost as soon as we meet her. And after the first half, the play mostly shunts her offstage. (Well, to the back of the stage, characters here rarely disappear. Especially dead ones.) There is shock – short, sharp – and surprises and some playful, inventive staging, but little that feels truly risky or dangerous. The conflicts are external, not internal. “It feels good,” Thornton teases in that opening speech, “to cast a little spell”. Yet, despite the charms and potions, there’s not so much magic here.",Arts/Stage,Macbeth review – Daniel Craig and Ruth Negga soar but there’s magic missing,https://www.theguardian.com/stage/2022/apr/29/macbeth-review-daniel-craig-ruth-negga
4/30/2022,"When the Australian election was finally called, I was not in Perth, where I live. Instead, I was sitting in a cafe with a friend in Johannesburg, talking about politics. I was finally home after a hard border closure that saw Western Australia shut itself off from the world for 697 days. I was disappointed not to be there, because during election season Australians throw off their normal aversion to talking about politics. It was one of the first things I noticed about Australia when I moved here. There is a profound reticence on the part of many people to sharing political opinions. In conversation after conversation, Australians are happy to talk about their disdain for politicians, but few are prepared to say what they think about matters they deem to be political – and certainly many people shrink from talking about party political views. Indeed, whether you like him or not, it is this reticence Scott Morrison is speaking to when he references “quiet Australians”. He is alluding to that part of the Australian political identity that values keeping your head down and your politics close to your chest. Those who talk openly about their political views are not “true blue Aussies”. The outspoken are “woke” outsiders, people who go against the grain of the silent majority. In this view of the world, keeping your politics to yourself is a bonus; a sign of authentic Australian-ness. In South Africa of course, the opposite is true. Here, politics is discussed at the drop of a hat. And yes, South Africa’s politicians are among the most corrupt and broken people in the world, but ordinary citizens continue to be deeply engaged in political debate. Politics is stitched into the fabric of everyday life. Every day I have been back in Johannesburg, I have driven past a young man, who begs on a particular corner. Most days, he holds a cup for coins and a sign that reads: “PUTIN MONEY, I PROMISE TO SHARE WITH UKRAINE”. The pun is both hilarious and sad. Thirty years after the end of apartheid, it is a testament to a politically audacious strain in the South African personality; an insistence that everyone has a right to voice their opinion. It speaks also, to South African’s willingness to discuss hard topics without flinching. I had forgotten how much I admire this about the country, and how absent this trait is in quotidian Australian life. It may seem counterintuitive – after all rich countries are supposed to teach poor countries how to behave – but as Australia races towards a generation-defining election, the continent at the edge of the world would do well to consider a few lessons from one of the most vibrant democracies on the planet. South Africans are outspoken about their views, and are committed to robust and often deeply uncomfortable conversations. The result is that people are often far more capable of expressing themselves in political terms than they are in Australia. There is a fearlessness about daily conversations in South Africa that has helped me to think more deeply – and with greater urgency – about politics. For example, a week after arriving, I found myself deep in conversation with a friend who was criticising the leadership of the country’s president, Cyril Ramaphosa. He argued that Ramaphosa is timid and suggested that he has failed to “grasp his historical mandate”. The notion of a “historical mandate” was both delightful and intriguing; precisely the kind of grandiose phrase South Africans bandy about in daily life. I pushed him to explain further and he did. He contended that after a disastrous decade of corruption and mismanagement under Jacob Zuma, Ramaphosa had won the election by carrying the expectations of a weary nation on his shoulders. His task was to rebuild the ANC after nine years of neglect and malfeasance. Instead, my friend argued, the president had squandered the opportunity, in large part because he didn’t understand that he had a mission that was about the times in which he was living, rather than being about any particular ambitions he may have had for himself. It’s an argument that has a lot of merit. Mandela had a historical mission, which was to unite a divided nation. There is now widespread recognition in the country that while Mandela was a special man, he also managed the transition to democracy by navigating the political externalities of the times – the end of communism, the effectiveness of sanctions and the success of domestic pressure on the apartheid regime – and rising to the occasion. The Australian context may be different, but the country faces a similarly significant leadership crisis. The country’s leaders must also rise to the occasion after a wasted decade. Under the Coalition, Australia has been left behind on every defining issue of the millennium – from climate change to race relations to refugee rights and workers’ rights. The increasingly rightwing policies of the Liberal Party have facilitated a politics that is both small-minded and mean-spirited. As a result, Australia finds itself in the unenviable position of having plenty of wealth and no vision. In the coming years, the country faces more bushfires and floods, more drought and extreme weather events, and yet in playgrounds and sports fields around the country, in the next few weeks, people will nod and smile at one another and avoid the kinds of robust conversations that are necessary in momentous times. This will not do: if everyday Aussies can learn anything from South Africa it is that they dare not be silent. They must care more about their futures than they do about maintaining an appearance of political propriety. Scott Morrison is no Mandela, nor is Anthony Albanese, but the stakes of this election are incredibly high. Whoever wins at the polls be entrusted with a historical mandate they dare not betray.",Opinion/Opinion,"Australia, we need to talk about politics: history beckons at this election, and keeping your head down just won’t do",https://www.theguardian.com/commentisfree/2022/apr/30/australia-we-need-to-talk-about-politics-history-beckons-at-this-election-and-keeping-your-head-down-just-wont-do
