1/16/2022,"The BBC licence fee will be abolished in 2027 and the broadcaster’s funding will be frozen for the next two years, the government has said, in an announcement that will force the broadcaster to close services and make further redundancies. The culture secretary, Nadine Dorries, will announce that the cost of an annual licence, required to watch live television and access iPlayer services, will remain at £159 until 2024 before rising slightly for the following three years.  She also said this would be the end of the current licence fee funding model for the BBC, raising doubts about the long-term future of the public broadcaster under a Conservative government. Dorries said: “This licence fee announcement will be the last. The days of the elderly being threatened with prison sentences and bailiffs knocking on doors are over. Time now to discuss and debate new ways of funding, supporting and selling great British content.” The announcement was briefed to the media as part of a range of measures designed to shore up public support for Boris Johnson after he faced calls to resign as prime minister. The BBC will have to negotiate with the government over an entirely new funding model when the final licence fee funding deal expires in 2027 – raising the prospect of a subscription service or part-privatisation. The Mail on Sunday quoted an ally of Dorries as saying: “There will be a lot of anguished noises about how it will hit popular programmes, but they can learn to cut waste like any other business. This will be the last BBC licence fee negotiation ever. Work will start next week on a mid-term review to replace the charter with a new funding formula. “It’s over for the BBC as they know it.” The source added that “the days of state-run TV are over” and praised the growth of US-run companies such as Netflix and YouTube. Although the BBC will continue to receive £3.2bn a year in licence fee income, the costs of making its programmes are increasing rapidly due to rising inflation and competition from the likes of Netflix. As a result, the corporation will have to make hundreds of millions of pounds in spending cuts in order to balance its books. The BBC has already made substantial cuts behind the scenes, meaning the next round of cuts are likely to hit on-air services. As a result the public should prepare for the BBC to provide less high-end drama and sports coverage, pad schedules with cheaper programmes, and potentially close some channels or services altogether. This could in turn erode support for the BBC if the public no longer feel they are receiving value-for-money from the licence fee. The licence fee deal will cover a five- year period to 2027, with the cost to the public likely to increase in the final three years – although this increase could also be at a below-inflation rate, meaning further cuts to BBC output could be required. Dorries’ allies said there would be no further licence fee deal under a Johnson government and they would look to find a new funding model for the corporation. Calls for the BBC to become a paid-for subscription service have always been undermined by the widespread popularity of broadcast radio and Freeview television services, which cannot be put behind a paywall. The BBC has already been preparing for the end of the licence fee, with proposals including a universal levy on broadband subscriptions or funding the broadcaster with a grant from general taxation – although this could undermine its editorial independence and leave it even more at the whim of government funding. Negotiations over the amount the BBC can charge for the licence fee having been ongoing for some time, with a final deal delayed by Dorries’ appointment in the autumn. The government has placed substantial pressure on the corporation’s news output, claiming it is biased against the government, at the same time as negotiating over the corporation’s financial future. The BBC has faced repeated deep real-terms spending cuts since the start of the Tory/LibDem coalition government in 2010, with the Conservatives forcing the BBC to pay for free licences for the over-75s – then blaming the BBC when they took the benefit away. A BBC source said of the licence fee proposals: “There has been similar speculation before. There are very good reasons for investing in what the BBC can do for the British public, and the creative industries and the UK around the world. Anything less than inflation would put unacceptable pressure on the BBC finances after years of cuts.”",News/Media,BBC licence fee to be abolished in 2027 and funding frozen,https://www.theguardian.com/media/2022/jan/16/bbc-licence-fee-to-be-abolished-in-2027-and-funding-frozen
1/16/2022,"Twenty years ago an architectural bomb went off in Hackney, east London. It was a small and charming bomb, with no reported casualties, in a colour somewhere between baby blue and sky blue, with curious shapes – old Dutch gables inspired by a postcard of Amsterdam, the outline of a tree, a child’s idea of a house – cut into its boarded exterior. But it performed an act then outrageous in architectural circles, of reviving postmodernism, the decorative style tainted by its association with the bloated office buildings and shopping malls of 1980s corporate excess. The Blue House, as it is called, helped to bring some fame though not much fortune to its architects, Fashion Architecture Taste, or FAT, until they announced their breakup in 2013. It didn’t, though, greatly alter the trajectory of architecture. It didn’t launch a revolution of what you might call postpostmodernism. Its big idea was that architecture could be like pop art, that it could combine artistic sophistication with a direct appeal to everyday culture, that it could riff on themes from notable architects of the past while offering imagery that a child might get. So the gable and tree shapes came with a layered and complex interior that owes something to Adolf Loos and John Soane. The world somehow wasn’t ready for this.  In the past few years, however, there has been a gradual exploration of the waters that FAT boldly entered when the century was young. Postpostpostmodernism, perhaps. One manifestation is the Red House, a new home in Dorset for an art dealer, his accountant husband and their young daughter. It is designed by David Kohn, the architect who, with the artist Fiona Banner, created a temporary one-room, boat-shaped hotel perched on the Queen Elizabeth Hall in London. Red House is a long, two-storey oblong with a big, oversailing slate roof. It has high chimneys, curving bays and openings in the shapes of circles and semi-circles. The windows and door of an end elevation recall the eyes and mouth of a face. Complementary colours zing off each other: a vibrant green for the metalwork and timber, and red brick walls. It plainly announces, almost cartoonishly, that it is a house. At the same time it offers clues and diversions for the architecturally learned. It has a clear debt to the Arts and Crafts houses of around 1900, built for enlightened patrons in such places as the Lake District, the Malvern hills or what is now the London green belt. It is particularly reminiscent of CFA Voysey, the leading exponent of that style. It also has a bit of the mid-century Philadelphian Louis Kahn, a romantic devotee of massive masonry, and something of James Stirling, the British architect who from the 1950s until his death in 1992 delighted in clashing powerful forms and colours. Inside, on the first floor, there’s a vaulted corridor inspired by the Villa Necchi Campiglio in Milan, whose exquisite 1930s interiors made a memorable setting for the Tilda Swinton-starring film I Am Love. The house is composed, as in a piece of music, with complexity and difference playing off an overall structure. Inside, there’s an axis running down the centre of the house, leading you towards the views of garden and landscape beyond, around which contrasting spaces are arrayed: a semi-circular dining space, a bright kitchen, a study alcove opening off the first-floor landing, a master bedroom in which the concave curve of the inside of a bay meets the triangular shape of the underside of the roof, to subtle and tent-like effect. A stair with rococo curves connects the two floors. Ample storage spaces, which help to keep the interiors uncluttered and orderly, punctuate the plan. Rooms are high or low, expansive or constricted, with light coming from different angles and views offered in multiple directions. The scale is a little surprising: passages and doors, partly out of a wish to make the house wheelchair accessible, are higher and wider than normal. At the same time the interior is finished with calm and consistent practicality – white-painted concrete block walls and wood block floors – which brings overall coherence to the variety of shapes and spaces. On the outside, bricks are laid horizontally, as is conventional, but sometimes vertically. There’s a logic to this that may be lost to the casual observer, which is that the vertical bricks denote the location of more functional spaces, such as bathrooms and store rooms, that serve the main living spaces. There’s also a slight overhang in the brickwork at first-floor level. Again, it’s a nicety that many won’t notice, but even though this and the brick patterns add to the cost, Kohn’s clients were happy to pay for it. The house is (among other things) a work of art, is their view, and its architect should be trusted to do it his way. Both the Blue House and the Red House play with your expectations of scale, surface and appearance. What looks flat might be substantial, and vice versa. In both, the outside tells you something about the inside, but not precisely. The Blue House, which included a studio as well as a home, has both the gridded windows of a workplace and domestic pitched-roof shapes, but they don’t correspond to the locations of these uses within. The Red House is the politer of the two, where the multiple elements are more assimilated with one another. The Blue House takes greater pleasure in its incongruities, to which another layer has now been added. It was originally built for Sean Griffiths, one of FAT’s founders, and his then-partner, the landscape architect Lynn Kinnear. The two no longer live together, but Griffiths has designed for Kinnear an internal makeover and an extension at the top of the house that includes a contemplative study opening on to a roof garden. The new work is completely different from the original, but it has the same spirit. Here, new materials and colours are added to what was already a rich palette – pebbledash walls, a profiled metal roof, pink, yellow, green. The rooftop structure adds another house shape to those already present, plus a somewhat brutalist projecting window. “A beach house on the roof”, Kinnear calls it, and the interior is a surprisingly serene escape, with views of London chimneys and towers. “What the rest would have been like if I’d been a good architect back then” is how Griffiths describes it. Kohn doesn’t see himself as a disciple of FAT, exactly, but he shares some of their interests and appreciates their “huge generosity”. He says that they “did a brilliant job of expanding architecture, of trying to prise open what’s fair game. It was a project for recovering a lot of lost fun.” Perhaps now, at last, the architectural world is ready to hear their messages.",Arts/Art and design,"Red House, Dorset: the shape of post-post-postmodernism?",https://www.theguardian.com/artanddesign/2022/jan/16/red-house-dorset-the-shape-of-post-post-postmodernism
1/16/2022,"No one knows what awaited Kim Woo-joo when he arrived back in North Korea, just over a year after he had fled the world’s most oppressive regime for a life of freedom in the South. Earlier this month, the 29-year-old former gymnast approached the border separating the two Koreas, scaled a tall barbed-wire fence and walked the 2.5 miles across the heavily armed demilitarised zone (DMZ), dodging landmines but not security cameras, which captured his escape no fewer than five times.  His decision to cross the DMZ back to the North from the South was the latest chapter in an extraordinary series of journeys. In November 2020, Kim had made the same journey in the opposite direction, fleeing his homeland but shunning the route preferred by almost all defectors across the North’s border with China. Having denied that he was a spy, embarrassed officials in Seoul were forced to acknowledge that Kim had grown so disillusioned with life in South Korea that he was willing to face harassment and possible incarceration in the North by returning there. His daring flight prompted uncomfortable questions about the treatment of political and economic refugees from the North, for whom life in the democratic, capitalist South sometimes falls far short of expectations. At about 20%, the unemployment rate among defectors is six times higher than the average for South Koreans, according to the Database Centre for North Korean Human Rights. Although their average monthly income reached a record high in 2019, it still lags far behind that of South Koreans, the unification ministry said. Last year, 1,582 defectors received financial help in addition to a welfare package they receive when they resettle in the South, while 47% said they were experiencing mental anguish, the ministry said. They may well have included Kim, a night-time office cleaner who did not appear to have any friends and never spoke to his neighbours, one of whom told reporters that he had dutifully left a mattress and other possessions out for collection before he fled. “If you worked in industry or for the government in North Korea, you can’t come to South Korea and expect to do an equivalent job,” says Sokeel Park, South Korea country director of Liberty in North Korea, which helps defectors. “You have to take a hit to your relative status, and that can have an effect on mental health, particularly for North Korean men.” New arrivals spend three months being debriefed to ensure they are not spies, followed by a similar period at Hanawon (house of unity), a settlement support centre where they are given counselling and coached in the practicalities of South Korean life. They are eligible for government subsidies of 20m won (£12,260) to find a home or a place at university, followed by monthly payments of 320,000 won for five years. What is lacking, says Park, is the sense of community that the North – for all its disadvantages – had given them, particularly among people from rural areas who struggle to cope with the anonymity of life in a megalopolis like Seoul. While defectors struggle financially and experience discrimination in education, housing and employment, it doesn’t necessarily follow that their thoughts will turn to redefection, says Park. “It is always a shock when a defector goes back to North Korea, even to other defectors,” he says. Double defections inevitably attract headlines, but they are relatively rare. Of the 33,800 North Koreans who have defected to the South, just 30 have returned to the North. “When you think of how many people are involved, human nature means it is inevitable that some people will have second thoughts,” Park says. “It would be very strange if none of those 30,000 defectors had gone back.” Joo Il-yong was 13 when he left North Korea with his mother and sister, less than a year after his father had arrived in Seoul, where he saved money to enable the rest of his family to escape. Joo, who graduated from Korea University in Seoul and will begin graduate studies there this spring, is a defector success story, but says he understands why a small number of other North Koreans end up back in the country they were once so desperate to leave. “One of the biggest obstacles is the systemic difference between the two countries,” says Joo, who arrived in the South in 2009 after his father decided he wanted his children to live in a country where they would have “opportunities and a future”. The perceived benefits of life in a rich, free society can quickly become a burden, Joo adds. “In North Korea we didn’t have to plan our lives – the state did that for us. But in the South, we have to take responsibility for our own lives. I know from my own experience that resettling in South Korea is a challenge, but it is nowhere near as difficult as living in North Korea.” Some North Koreans return after sustained emotional blackmail from left-behind relatives, under pressure from North Korea’s secret police. “In some cases, it is simply because they miss their families back in North Korea so much,” Joo says. “But I don’t see the challenges of life here as harsh or unfair. In fact, they have made me happier, because they motivate me to work and study even harder.”",News/World news,‘Second thoughts’: what makes North Korean defectors want to go back?,https://www.theguardian.com/world/2022/jan/16/second-thoughts-what-makes-north-korean-defectors-want-to-go-back
