3/22/2022,"Hitting children is wrong. The Labour first minister of Wales, Mark Drakeford, called Monday a “historic day” for Welsh children. He is deservedly proud of his government’s achievement in introducing a ban on smacking, which follows a similar decision in Scotland. The spotlight should now turn to England and Northern Ireland, where the “reasonable chastisement” defence to the charge of assaulting a child remains in place. That it exists at all is due to long legal precedent, including a notorious case in 1860 when a teenage boy was flogged to death at school in London. His teacher was convicted of manslaughter but the judge decreed that “reasonable” beatings should be allowed. Ever since, efforts to change the law have foundered on objections to the state’s interference in family life, and the lingering notion that parents should have the right to administer corporal punishments, even after they were banned in schools in 1987. A growing international consensus, guided by the UN convention on the rights of the child, makes it clear that they should not. Article 19 states that governments must protect children from all forms of violence. Sweden was the first state to do so in 1979. Many others have done so since. Doctors say violence makes children more aggressive and raises the risk of mental health issues. But in the UK, the Children Act of 2004 reaffirmed a parent’s right to smack or allow others to smack on their behalf. Scottish politicians overthrew this in 2019, followed by the Welsh. In Wales it was decided to take longer over introducing the new law, in order that a £2m public information campaign could happen first. Research suggests that this approach was sensible, with public opinion divided over whether the ban is a good idea. While a survey last year found that 47% believe smacking children isn’t necessary, 34% think it sometimes is. As with any new law, much will depend on enforcement. Police and social workers must be alert to the possibility of malicious reports, for example where family members are in dispute. Parents who were smacked themselves are more likely to smack their children. So care must be taken not to stigmatise families whose parenting style may be viewed by some as rough or unenlightened. The claim by the Welsh Conservatives that the law amounts to “new-age dogma” is ridiculous. Non-violent family life is a rational, humane objective; children should not be inducted by adults into a way of relating to others that involves physical threats, slaps or punches. But the state must support people as they adjust to a law which aims to change their behaviour. Research has shown that, mostly, when parents strike children it is because they have lost control. Wales’s new law, and similar laws elsewhere, will not stop people from losing their tempers. What it does is to give children the same protection, in the event that they are assaulted, as other people. This should not be regarded as a utopian scheme. To grant adults a licence to physically hurt children is to take a risk with their safety and wellbeing. The NSPCC supports the withdrawal of the “reasonable punishment” defence in England and Northern Ireland, as does Sir Keir Starmer. The Northern Ireland children’s commissioner, Koulla Yiasouma, believes that Stormont should change the law. Her English counterpart, Dame Rachel de Souza, should join the campaign. The UK doesn’t need this archaic cop-out clause any more.",Opinion/Opinion,The Guardian view on smacking bans: Wales has done the right thing | Editorial,https://www.theguardian.com/commentisfree/2022/mar/21/the-guardian-view-on-smacking-bans-wales-has-done-the-right-thing
3/22/2022,"My colleague and friend Peter Padfield, who has died aged 89, was a freelance author who made an outstanding contribution to the history of the sea, as a seaman, historian and analyst, across five decades. Born in Kolkata, India, Peter came from an army family. His father, William Padfield, was a captain in the Royal Engineers attached to the Indian army, and his mother, Annice (nee Abbott), was the daughter of the colonel of engineers in Bombay (now Mumbai). William died when Peter was seven, and Peter returned to England with his mother and younger brother, attending Northcliffe House prep school in Sussex, which was evacuated to Cornwall during the second world war. Later, he was educated at Christ’s hospital in West Sussex, and the Thames Nautical Training College, HMS Worcester. Peter then served as a navigating officer in P&O liners, before joining the crew of the replica 17th-century Mayflower, recreating the pilgrim fathers’ voyage, described in his first and last books, The Sea Is a Magic Carpet (1959) and Mayflower II Diary (2019). Peter met Jane Yarwood, whom he married in 1960, in London, where he worked in nautical journalism until the international success of The Titanic and the Californian (1965) encouraged him to become a full-time writer. The number of books Peter wrote, and the range of subject matter, demonstrates a wide and inclusive engagement with Britain, the sea and, in the case of his Nazi studies, the need to understand what lay on the other side of the hill in the second world war. His work was distinguished by a zest for challenging comfortable orthodoxies, whether it be about the Titanic disaster, or the politics and personality of the last leader of Nazi Germany, Grand Admiral Karl Dönitz. Peter highlighted Dönitz’s early and profound attachment to Nazi ideology, at a time when many were reimagining the war criminal as a hero. The Maritime Trilogy, Peter’s three-volume study of British maritime identity, inspired other scholars, myself included, to reconsider the connections between the state, maritime enterprise and sea power, making a critical contribution to 21st-century debates about Britishness, attracting high-profile commentary and awards. My favourite among his books is Broke and the Shannon of 1968, an elegant study of a great seaman and his defining battle, a work that continues to shape our understanding of the long-forgotten Anglo-American war of 1812. Peter was a scholar-seaman of the highest standing, an author who followed his own path and made a massive contribution to that most British of subjects, maritime history. Jane died in 2018 and Peter’s brother, Tim, died in 2020. Peter is survived by his children, Deborah, Guy and Fiona, and grandchildren, Max and Megan.",Arts/Books,Peter Padfield obituary,https://www.theguardian.com/books/2022/mar/21/peter-padfield-obituary
3/22/2022,"The Rugby Football Union has been accused of dishonesty after claiming that England have made progress under Eddie Jones during the Six Nations. Jones, contracted until the end of the 2023 World Cup, has come under increasing pressure after England finished with just two victories in the Six Nations with several former players calling for him to be sacked. The RFU, however, issued a statement on Sunday insisting he has the union’s “full support”, going on to claim that it was “encouraged by the solid progress” made by England and that “strong positive steps forward” had been taken. England, however, also finished with two wins 12 months ago and in scoring eight tries across the entire tournament they managed four fewer than last year. As was the case then, the RFU will hold a debrief into England’s campaign and while there are performance-related break clauses in Jones’s contract, there seems no prospect of the union’s chief executive, Bill Sweeney, invoking them. Addressing the statement, attributed to an RFU spokesperson, the former England and British & Irish Lions wing and Guardian columnist Ugo Monye said on the BBC ‘s Rugby Union Daily podcast: “If you are going to make a statement on behalf of the RFU, I want to know who is saying it. “I think everyone wants to know who is saying it. Who, in the eyes of the RFU, thinks that signified progress and that they are happy with how things are at the moment?. My first thought was, in fact I had to read it again, I thought, ‘this is class banter’. Genuinely. Fundamentally, it’s just dishonest. There isn’t progress. Two out of five last year was an underperformance, hence why we had to have this deep-dive review, which questioned absolutely everything.” The former Wales and Lions captain Sam Warburton, speaking on the same podcast, said the RFU was attempting to deflect attention from Jones’s future but questioned why it pointed to an “encouraging” campaign given the obvious anger among supporters. “I think that Eddie has sat down with England and they’ve gone behind closed doors: ‘You’re going to be our guy until the World Cup, whatever happens, we’re not going to change our coach now. We’re going to do this so everyone gets off your back.’ I don’t think it’s true. It’s not honest, what they’ve said. Apart from Italy, none of the other five nations in the Six Nations would see two wins as progress. Don’t lie to us. “It’s to try and get the press off Eddie’s back, so there are no questions of ‘should Eddie go?’ Everyone knows Eddie’s staying. Just say: ‘We know there are going to be questions about Eddie’s future. Eddie is going to be our coach until the next World Cup.’ If they said that, I think people would accept it. But what they’ve said ... it’s blatantly not progress. If you’re Italy, it’s progress. If you’re England, it’s definitely not progress. It’s just a lie.” The RFU, which declined to comment on the criticism, has said the playing squad’s feedback will be taken into account as part of its debrief but, publicly at least, they have come out in support of Jones. The hooker Jamie George said: “I think he’s absolutely the right man for the job. He’s been absolutely brilliant to all of the players so far and we’ve all got every confidence we can turn this around. “The pressure shouldn’t solely lie on Eddie. The players have to take some responsibility on the back of a disappointing campaign. Eddie has got the full backing of the squad.”",Sport/Sport,RFU’s rosy view of England under Eddie Jones decried as ‘dishonest’ ,https://www.theguardian.com/sport/2022/mar/21/rfu-england-eddie-jones-six-nations
3/22/2022,"A 14-year-old girl has died after a crash involving a van while riding an e-scooter in east London. The teenager died of her injuries at the scene, according to the Metropolitan Police. London ambulance service paramedics had tried to treat her following the collision in Green Street, Newham. Officers were called out to reports of the crash at around 1.35pm on Monday and the Met has since launched an investigation. A spokesperson said: “The Met is investigating the incident and the van driver is with police, but he has not been arrested.” Road closures were in place around the scene throughout Monday afternoon. The Met is urging any witnesses to the crash or anyone else with information to contact them on 101. Earlier this year a 74-year-old man died after his e-scooter collided with two parked cars, while in July 2021 a three-year-old girl sustained “life-changing” injuries after being hit by an e-scooter.",News/UK news,14-year-old girl dies after crash with van while riding e-scooter in London,https://www.theguardian.com/uk-news/2022/mar/21/14-year-old-girl-dies-after-crash-with-van-while-riding-e-scooter-in-london
3/22/2022,"The Indianapolis Colts have acquired former NFL MVP Matt Ryan from the Atlanta Falcons, according to multiple reports. The Colts, who were looking for a new starting quarterback after trading Carson Wentz to the Washington Commanders, sent a third-round pick to the Falcons in exchange for the 36-year-old. Trade!! The #Falcons are in agreement on a trade of QB Matt Ryan to the #Colts, per @MikeGarafolo, @TomPelissero and me. ATL gets a 3rd back.Fallout from the Deshaun Watson situation, with Ryan starting over in Indy. Ryan gets a contract adjustment with more guaranteed money. Speculation that Ryan would leave the Falcons had risen in recent days after the team actively pursued Deshaun Watson, who eventually joined the Cleveland Browns. The Falcons drafted Ryan with the No 3 overall pick in the 2008 draft and he has played his entire professional career in Atlanta. He was named league MVP for the 2016 season, when he led the Falcons to the Super Bowl where they infamously lost to the New England Patriots despite at one point holding a 28-3 lead. Ryan had reportedly wanted to remain in Atlanta, even though head coach Arthur Smith had refused to say whether the team intended to stick with their veteran quarterback. “There’s not many guys like Matt that can operate the level he does,” Smith said at the end of last season. “The leadership, the real leadership that goes on behind the scenes. The way he prepares. He’s the same guy every day. That’s a huge compliment to him.” The Colts’ move opens up fresh questions about the future of Baker Mayfield, who is almost certainly on his way out of the Browns after they acquired Watson. Mayfield had reportedly favored Indianapolis as his next team after Cleveland but that possibility has disappeared with the Colts’ move for Ryan. Matt Ryan’s trade will incur a dead cap hit of $40.525M for the Falcons, the largest dead cap hit in NFL history by nearly $7M. According to the NFL Network’s Mike Garafolo Atlanta intend to pursue Marcus Mariota to replace Ryan. Atlanta will also take a $40.5m dead cap hit from the trade, the largest in NFL history.",Sport/Sport,Indianapolis Colts reportedly acquire former NFL MVP Matt Ryan from Falcons,https://www.theguardian.com/sport/2022/mar/21/indianapolis-colts-reportedly-acquire-former-nfl-mvp-matt-ryan-from-falcons
3/22/2022,"The US’s top financial watchdog proposed on Monday that publicly traded companies report information on their greenhouse-gas emissions and even those of their suppliers and consumers in one of the Biden administration’s most sweeping environmental actions to date. The new Securities and Exchange Commission (SEC) rules faces staunch opposition from some politicians and members of the business community and will be open to public comment for at least two months before final rules are released. “I am pleased to support today’s proposal because, if adopted, it would provide investors with consistent, comparable and decision-useful information for making their investment decisions, and it would provide consistent and clear reporting obligations for issuers,” said the SEC chair, Gary Gensler. The proposal, which has been in the works for over a year, would force companies to make public the extent of their carbon footprint. While some companies including Apple and Microsoft now publish detailed analyses of their emissions, others have been reluctant to improve disclosure. Under the proposal publicly traded companies would have to report greenhouse-gas emissions and obtain independent certification of their estimates. Some companies would also be required to report emissions from both their supply chains and consumers, known as Scope 3 emissions. Republicans and some industry groups have already begun lobbying against the new requirements, which they argue would increase costs and go beyond the SEC’s mandate. In a speech last year Gensler said the rules would introduce consistency to company reporting at a time when investors were increasingly concerned about the impact of climate on businesses. “Today, investors increasingly want to understand the climate risks of the companies whose stock they own or might buy. Large and small investors, representing literally tens of trillions of dollars, are looking for this information to determine whether to invest, sell, or make a voting decision one way or another. Investors are looking for consistent, comparable, and decision-useful disclosures so they can put their money in companies that fit their needs,” he said.",News/Business,US watchdog plans to make companies reveal greenhouse-gas emissions,https://www.theguardian.com/business/2022/mar/21/sec-greenhouse-gas-emissions-carbon-proposal
3/22/2022,"Do you feel lucky? That was the subliminal message of Alexander Novak when Russia’s deputy prime minister channeled his inner Clint Eastwood to warn the west of the consequences of extending its sanctions to his country’s oil. No question, there was a hint of both bravado and desperation as Novak said it was possible – although not likely – that the cost of crude could hit $300 (£227) a barrel. The measures imposed since the invasion of Ukraine are starting to bite. Even so, just like the cop Eastwood plays in Dirty Harry, Novak knows what a lot of politicians across western Europe are thinking: abandoning Russia as a source of energy supply is far from costless. Starting with the obvious, rising prices for oil and gas threaten to intensify cost of living crises across the west. It is a basic rule of economics that if the supply of something is reduced the price will go up until such point as the cost become prohibitive. At that point, there is a drop in demand that forces down prices, which is why each peak in oil prices has been followed by a slump. It seems unlikely – given differing views among member states – that the EU is ready yet to broaden its sanctions to include oil and gas. But unless the war ends soon energy prices will remain high, eating deep into profits and consumer spending power. A second problem is how to make up for the loss of Russian energy while at the same time meeting net zero commitments. In the medium and long term, the answer is obvious: western nations need to accelerate the transition out of fossil fuels and into renewables and the invasion of Ukraine will give added momentum to that trend. In the short term, though, governments keen to keep the lights on and to keep transport systems running will seek to replace Russian fossil fuels with fossil fuels from other parts of the world. That makes sense, because energy shortages would cause a serious recession in the west, and in the past economic downturns have led to a waning of interest in green issues. That hasn’t happened so far but there is a real risk that it might. Clearly, this is a messy compromise. More progress should have been made sooner on the green energy transition but it wasn’t. It would have been helpful had politicians yoked together recovery from the pandemic and net zero plans in a more meaningful way, but they didn’t. Given how things stand it may be a case of two steps forward, one step back. Kwasi Kwarteng says the government is angry and disappointed by the decision of P&O Ferries to sack 800 staff and replace them with cheap contract labour. Not to be outdone in the condemnation stakes, Rishi Sunak calls the company’s behaviour appalling, awful and wrong. This is bluster. Kwarteng’s business department knew what P&O planned 24 hours before the news was announced. The chancellor is happy enough for P&O’s parent company, the Dubai-based DP World, to continue investing in the freeports so dear to his heart. In his letter to P&O, Kwarteng stressed that the company could face an unlimited fine for failing to go through the proper consultation process. In other words, it is all right to replace British workers and replace them with cheap foreign labour provided you warn them first. The reality is that ministers have been caught with their trousers down. Having promised but failed to deliver an employment bill, the P&O case shows exactly why tougher protection for workers is needed. The cost of a barrel of Brent crude oil hit $138 two weeks ago. Since then, it briefly dipped below $100 a barrel and is currently trading at $114 a barrel – about $25 a barrel below its recent peak. Motorists would struggle to find any evidence of lower crude prices. As the AA points out, wholesale petrol prices were down 12p a litre on the 8 March peak but the retail price at the pump was 9p dearer. Funny how markets work in such an asymmetric way. Anybody would think the retailers were taking their customers for a ride.",News/Business,Finding fossil fuel alternative to Russian oil and gas makes short-term sense,https://www.theguardian.com/business/nils-pratley-on-finance/2022/mar/21/finding-fossil-fuel-alternative-to-russian-oil-and-gas-makes-short-term-sense
3/22/2022,"A 96-year-old man who survived a string of Nazi concentration camps including Buchenwald and Bergen-Belsen has been killed by an explosion during the Russian assault on the Ukrainian city of Kharkiv, a spokesperson for the Buchenwald concentration camp memorial foundation has confirmed. “We are shocked to confirm the violent death of Boris Romanchenko, whose niece informed us on Monday morning that he died last Friday after a bomb or rocket hit the multistorey building where he lived in Kharkiv and his apartment was burned out,” a spokesperson told the Guardian. According to regional emergency services, more than 500 people have been killed in Kharkiv since Russia launched its invasion of Ukraine on 24 February. Born in 1926 to a farming family in the village of Bondari outside the city of Sumy in north-eastern Ukraine, Romanchenko was taken as a prisoner of war after the German Nazi regime launched Operation Barbarossa against the Soviet Union in 1941. “The war had completely surprised us, I wasn’t able to flee,” he recalled in an interview in April 2004. In 1942, he was deported to Dortmund, in Germany’s industrial Ruhr valley, to work as forced labourer in a mine. After attempting to escape, he was seized just as he was about to board an east-bound train and was then deported to Buchenwald concentration camp in January 1943. Romanchenko was later moved to Peenemünde on the Baltic Sea island of Usedom, where he was made to work on the V2 rocket programme, as well as Mittelbau-Dora and Bergen-Belsen concentration camps. Romanchenko said he was liberated from Bergen-Belsen by British and American allied forces on 14 April 1945 just before he and other survivors were due to be killed by being fed poisoned food. He was enlisted to the Soviet army for five years after the end of the war. Afterwards, he began to play an active part in institutions that commemorate the Holocaust, acting for several years as vice-president for Ukraine on the international committee at the Buchenwald-Doramemorial foundation. He attended several commemorative events at the camp’s former site and had been invited to attend an event marking the Buchenwald liberation this year. In 2015, he read out the “Oath of Buchenwald”, a survivors’ pledge dating back to the camp’s liberation, in Russian. “Our goal is to build a new world of peace and freedom,” he read.",News/World news,"Russian attack on Kharkiv kills Holocaust survivor, 96",https://www.theguardian.com/world/2022/mar/21/russian-attack-on-kharkiv-kills-holocaust-survivor-96
