2/14/2022,"Are we all doomed to live in Charlie Brooker’s techno-dystopia? In Metalhead, an episode from season four of his famed Netflix show Black Mirror, a woman navigates an austere post-apocalyptic landscape while running for her life from a murderous robot dog. What makes the mechanized beast in the show particularly frightening is the lethal combination of the single-mindedness of a computer program with the extreme ferocity of an angry, feral dog. But it’s just TV, right? Not exactly. The military, technological, security and political classes in this country appear united in their desire to make robot dogs part of our future, and we should all be worried.  The latest example came on 1 February, when the Department of Homeland Security (DHS) issued a press release titled “Robot Dogs Take Another Step Towards Deployment at the Border”. DHS dressed up their statement with the kind of adorable language made to warm the hearts of dog lovers everywhere. “The Science and Technology Directorate (S&T) is offering US Customs and Border Protection (CBP) a helping hand (or ‘paw’),” read the release. Isn’t that cute? A picture of the “four-legged ground drone” accompanied the release, and the “Automated Ground Surveillance Vehicle”, as it’s called, looked remarkably (and scarily) similar to the monstrous quadrupeds seen in the Black Mirror episode. But let’s not judge based on appearance. The real issue is that we keep rushing to militarized and technological solutions to what ultimately are human and political questions, creating more problems along the way. These particular robot dogs are made by Ghost Robotics, which claims that its 100lb machine was “bred” to scale “all types of natural terrain including sand, rocks and hills, as well as human-built environments, like stairs”. Each robot dog is outfitted with a bevy of sensors and able to transmit real-time video and information feeds. The devices are not yet in operation on the US-Mexico border, but a testing and evaluation program is under way in El Paso, Texas. To listen to DHS, it all sounds so utterly charming and so very next-gen – until you realize that what we’re talking about is the further encroachment of government surveillance on our daily lives. As the Electronic Frontier Foundation notes, “people who live along the border are some of the most heavily surveilled people in the United States. A massive amalgamation of federal, state and local law enforcement and national security agencies are flying drones, putting up cameras and just generally attempting to negate civil liberties – capturing the general goings-on of people who live and work in proximity to the border.” Then there’s the question of lethal force. These specific ground drones may not be armed, but Ghost Robotics is already infamous for the combination of robot dog and robot rifle. In 2021, small arms manufacturer Sword International (must these companies choose such dystopian names?) outfitted a robot dog from Ghost Robotics with a custom-made weapon, called a “special purpose unmanned rifle” or Spur. This darling invention was unveiled at the annual conference of the Association of the United States Army. Incidentally, US policy not only does not “prohibit the development or employment” of killer robots (officially known as “lethal autonomous weapon systems,” or Laws) but also opposes any international preemptive ban. Meanwhile, as the Congressional Research Service notes, Israel has already exported what many consider a lethal autonomous weapon system to Chile, China, India, South Korea and Turkey. We’re fast running out of time for robust international dialogue on this issue. Domestically, the short history of the use of the robot dogs in our cities is also troubling. The Honolulu police department used about $150,000 of pandemic funding to buy their robot dog, which they then used to scan the eyes and take the temperatures of unhoused people to check for symptoms of Covid. The practice raised the alarms of advocates who said the practice was fundamentally dehumanizing. Needless to say, no housed person was treated that way. And after public outcry in 2021, the New York police department returned its $94,200 robot dog, Digidog. That robot was deployed to a home invasion in the Bronx and to a tense situation in a public housing building in Manhattan, attracting the angry notice of New Yorkers. Once again, many Black and brown New Yorkers felt over-policed, over-surveilled and under-resourced. “You can’t give me a living wage, you can’t raise a minimum wage, you can’t give me affordable housing; I’m working hard and I can’t get paid leave, I can’t get affordable childcare,” said Representative Jamaal Bowman in a video he posted to Twitter. “Instead we got money, taxpayer money, going to robot dogs?” Bowman is hardly alone. Alexandria Ocasio-Cortez criticized both the NYPD’s robot dog in 2021 and the recent news of robot dogs at the border. “It’s shameful how both parties fight tooth + nail to defend their ability to pump endless public money into militarization,” she recently tweeted. “From tanks in police depts to corrupt military contracts, funding this violence is bipartisan + non-controversial, yet healthcare + housing isn’t. It’s BS.” She’s right, of course, as is Bowman. Where exactly are our priorities? The Biden administration has a chance to stop this program in its tracks before the border becomes even more of a militarized, technological dystopia. We’re so easily mesmerized by the massive capabilities of technology, but the fact is that techno-military solutions to human problems too often create more problems than they solve. Just ask the unhoused populations in Honolulu, the urban poor in New York, and – if the program’s not cancelled – asylum seekers on the border. These are the people whose daily realities are increasingly being militarized by this technology. And because they are vulnerable and without political clout, they’re the ones closest to living in a Black Mirror episode. Meanwhile, the rest of us are sold a hi-tech bill of goods that unites everything that Americans love – technology, dogs and guns – and told to believe it’s all for the best. Look, I love my tech and all it can do as much as the next person, but when our embrace of technology reduces rather than enhances our dignity, then we have a problem. Humans deserve better. And frankly, so do dogs – even robot ones. Moustafa Bayoumi is the author of the award-winning books How Does It Feel To Be a Problem?: Being Young and Arab in America and This Muslim American Life: Dispatches from the War on Terror. He is a professor of English at Brooklyn College, City University of New York",Opinion/Opinion,The US government is deploying robot dogs to the Mexican border. Seriously? | Moustafa Bayoumi,https://www.theguardian.com/commentisfree/2022/feb/14/us-government-deploying-robot-dogs-to-mexico-border
2/14/2022,"Good morning. Europe is closer to war than at any point over the past 70 years, a UK government minister has warned, as Russian troops amass on the borders of Ukraine and western leaders warn that an invasion could take place early this week.  The armed forces minister James Heappey told the BBC Radio 4 Today programme he feared “we are closer than we’ve been on this continent” to war “for 70 years”. Western leaders are mounting a final effort to negotiate diplomatic solutions after US intelligence said an attack could be imminent. The German chancellor, Olaf Scholz, will travel to Kyiv for talks with Ukrainian officials and British prime minister Boris Johnson said he would hold further talks with world leaders to bring Russia “back from the brink” of war. Is Joe Biden involved in the last minute negotiations? Yes but yesterday, the Ukrainian president, Volodymyr Zelensky, urged Joe Biden to visit Kyiv “in the coming days” in a show of moral support. However, the White House has made no mention of the invitation so it’s unclear if Biden intends to go. Is time running out to find a diplomatic solution to the crisis? US intelligence over the weekend claimed that Russia had accelerated plans for an invasion and could move troops across the border as soon as Wednesday, before the end of the Winter Olympics on 20 February. The key Ambassador Bridge trade link between Canada and the US has reopened after police cleared the last Covid restriction protesters, ending a six-day blockade. Police moved in to clear and arrest the remaining protesters on the border bridge yesterday, trying to end one of the main demonstrations that have broken out across Canada against Covid-19 vaccine mandates and other restrictions to bring the pandemic under control. After issuing warnings, police said arrests would be made and vehicles towed just after dawn near the bridge linking Detroit and the city of Windsor, Ontario. By Sunday afternoon, most protesters had gone and vehicles that were blocking the way had been removed, and the bridge reopened just before midnight on Sunday. What about the protests in Ottawa? Small-scale protests there swelled to what police said were 4,000 demonstrators. The city has seen that on past weekends, and loud music played as people milled about downtown where anti-vaccine demonstrators have been encamped since late January. Kamila Valieva, the 15-year-old Russian skater who charmed these Winter Olympics before her positive drugs test sent shockwaves across the world, has sensationally been cleared to compete in the individual event due to the “exceptional circumstances” of her case. The court of arbitration for sport, which delivered its verdict yesterday, said that banning Valieva while her doping case was ongoing “would cause her irreparable harm”. The three-person panel also ruled that the World Anti-Doping Code was unclear when it came to suspended “protected persons” under 16 years of age and said that a 44-day delay in reporting Valieva’s positive test for the banned angina drug trimetazidine had affected her ability to mount a defence. “The panel considered that preventing the athlete from competing at the Olympic Games would cause her irreparable harm in these circumstances,” Matthieu Reeb, secretary general for the court of arbitration for sport, told the world’s press. Does everyone agree with the decision? No. Sarah Hirshland, the president of the US Olympic and Paralympic Committee said she was “disappointed” by the decision. “This appears to be another chapter in the systemic and pervasive disregard for clean sport by Russia,” she added. Six years after the Los Angeles Rams returned to California – after a 20-year sojourn in St Louis – the Rams are Super Bowl champions for the second time in their history. They have been accused of trading away their future to build a team of superstars, but their fans are unlikely to care now. And here Sam Wolfson reviews the half-time show by Dr Dre, Snoop Dogg, Eminem, Kendrick Lamar and Mary J Blige. Hong Kong’s leader, Carrie Lam, has said an “onslaught” of Covid-19 infections has dealt a heavy blow and overwhelmed capacity as daily cases surge to record highs. Daily infections have multiplied by a factor of 13 over the past two weeks, with authorities scrambling to control the deepening outbreak. Donald Trump has endorsed rightwing Republican candidates who support his baseless claims of a stolen election for key posts in Michigan, raising the prospect of a Trumpist take over of how the key battleground state might run its elections. Some players of the viral word game Wordle have complained that it has become harder since it was bought by the New York Times late last month. The New York Times has denied any changes have been made to Wordle since the acquisition. “Nothing has changed about the game play,” they said. After that initial attraction, what keeps a couple together? And as we change and grow over the years, how do we make sure we move in the same direction? Six relationship experts on how to keep that loving feeling. Philippa Perry suggests remembering your partner is not responsible for your happiness, you are. “I don’t recommend entering a relationship believing love will conquer your personal demons and, then, when it doesn’t, blaming your partner for you not feeling happier.” Dogs are not the only pets vulnerable to heatstroke, and experts are saying that people should be aware of the risk to smaller animals such as guinea pigs and rabbits, especially as global temperatures rise. Researchers say their findings highlight the need for better public awareness of heatstroke and the risk to all animals, and that cases will continue to rise with warmer weather because of the climate emergency. The mountain lion known as P22 has become something of a celebrity in the city of Los Angeles. The big cat resides in Griffith Park, a 4,000-acre park tucked in the Hollywood hills, and has inspired murals, songs and even an exhibit about his life. Beth Pratt, California director for the National Wildlife Federation, has a tattoo of P22 and dubbed him the “Brad Pitt of mountain lions” – attractive, enigmatic and unlucky in love. He has plenty of deer to eat, no male competitors in his territory, but also no hope of finding a mate. First Thing is delivered to thousands of inboxes every weekday. If you’re not already signed up, subscribe now. If you have any questions or comments about any of our newsletters please email newsletters@theguardian.com",News/US news,First Thing: Europe ‘closer to war’ than at any point in 70 years,https://www.theguardian.com/us-news/2022/feb/14/first-thing-europe-closer-to-war-than-at-any-point-in-70-years
2/14/2022,"Police are hunting for a “dangerous sex offender” who escaped from prison and presents a particular danger to women and children. Paul Robson, who is serving a life sentence for attempted rape and indecent assault, absconded from an open prison in Lincolnshire on Sunday.  Robson was jailed at Oxford crown court in 2000 after he entered a woman’s home through a cat flap before tying her up, putting a pillowcase over her head and brutally assaulting her while holding a knife to her throat. Lincolnshire police urged people not to approach the 56-year-old, saying he “can cause real harm to anyone he comes across”, adding he could have travelled abroad. DCS Andy Cox said: “He could be anywhere in the country, and we are really keen to hear from the public with potential sightings so we can take this man off our streets. “Robson is a dangerous sex offender and while he presents a particular danger to women and young children, I believe he can cause real harm to anyone he comes across. Since reports of his escape came to light, we have deployed additional resources to apprehend Robson.” After his conviction, the sentencing judge described Robson as a “menace to females”. He had been released from prison only three weeks before the attack and was on licence. He was reported missing from HMP North Sea Camp in Boston at about 7am on Sunday, Lincolnshire police said He is described as a white male with a bald head and a long goatee beard and is of slim build. “We are still working tirelessly to locate Paul Robson and are still working through numerous lines of inquiry,” Cox said. “If you see Robson, please do not approach him, and do not try to apprehend him yourself. Call 999 immediately. We are really grateful for all the shares so far and rest assured we will continue our efforts to find and arrest him.” Police have urged anyone with information or confirmed sightings of Robson to call 999.",News/UK news,Lincolnshire police hunt for escaped ‘dangerous sex offender’,https://www.theguardian.com/uk-news/2022/feb/14/lincolnshire-police-hunt-for-escaped-dangerous-sex-offender
2/14/2022,"Two sorts of rain today. One is bouncing off the brown terrace tiles, and giving them a clean, at least. The other is of polenta, raining down into a pan of boiling water. I’d planned a downpour of instant polenta, but then it went dark and the sky opened, so standing by a warm cooker, stirring and listening to the radio, was suddenly a good idea. Also, I’m convinced that the option of instant – be that polenta, custard, chocolate pudding, coffee or tan – makes the long version more appealing, because it is a choice. In Elena Previde Massara’s Il Grande Libro della Polenta, there is a line illustration in which Italy’s lower half is a familiar boot, but then midway up becomes a cob of maize that mimics the shape of the country and reveals the kernels, ready to be dried and ground into polenta. A half-corn Italy, though, only began in the 16th century, when maize was introduced to Europe from Mesoamerica, where it is thought to have been celebrated, harvested, ground and eaten as early as 10,000 years ago. The word polenta is ancient, deriving from the Latin polĕnta, which means something made of pollen, or “fine flour”, and cooked into a mush, or puls as it was known in ancient Rome, and made from barley, farro, chickpeas or chestnuts.  Previde explains that there is some debate and document-waving by both the Friulani and Bergamaschi over who first cultivated maize and ground it into puls/polenta. What is certain is that it became a sustenance food, surrounded by ritual, folklore and wonderful recipes. Traditionalists insist that polenta requires slow cooking, ideally in a copper pan, with constant stirring for at least an hour and up to three, and sometimes even four. The science behind this is starch gelatinisation, the process by which, thanks to heat, water and stirring, the tightly bound starch molecules within each grain loosen and swell, becoming digestible, and giving off a starchy gel that brings everything together. It is also during long cooking that flavour is developed. Harold McGee is right that cooks can develop just as much flavour with less labour by partly covering a pot of just-thickened polenta, putting it into a low oven (130C/250F/gas ½), which heats the bottom and sides in a controlled, even way, and stirring only occasionally. And then there is instant polenta, made with polenta that has been pre-cooked, usually with steam, dried and ground to a fine powder. This process means its absorption is completely different from proper polenta, and it cooks in a fraction of the time. I think instant polenta is best when it is left to set, then cut into slices and brought back to life in a frying pan. And long-cooked polenta is wonderful, especially when you learn that you don’t need to stand still and stir constantly. Two sorts of rain, and two ways to serve the polenta. One is simply more grated parmesan or cubed fontina, the other is a mound of green, which I crave at the moment – broccoletti, cavolo nero or sprouting broccoli (let’s say 500g), trimmed accordingly, boiled in well-salted boiling water until tender, then tossed in gently warmed olive oil, a clove of minced garlic and a good pinch of red chilli flakes. And, for pudding, I suggest instant chocolate pudding. Prep 10 minCook 50 min (or about 15 min if using instant polenta)Serves 4 Salt300g polenta (or instant polenta)500g broccoletti, cavolo nero or sprouting broccoli, trimmed accordinglyOlive oil1 garlic clove, peeled and mincedRed chilli flakes, to taste1 big slice of butter4 tbsp grated parmesan In a medium saucepan or deep saute pan, ideally copper or with a heavy base, heat 1.1 litres water until boiling, add salt, stir and reduce to a lively simmer. Slowly “rain” the polenta into the pan, whisking as you do, to prevent clumps. Once the polenta is incorporated, swap the whisk for a wooden spoon and stir. If you are using instant polenta, follow the packet instructions; otherwise, cook, stirring very regularly, for 45 minutes, or until the polenta is thick (but not stiff; if that is the case, add more hot water), pulling away from the sides of the pan and cooked through. Meanwhile, immerse the broccoletti, cavolo nero or sprouting broccoli in well salted boiling water, cook for five or so minutes, until tender, then drain. In a frying pan, gently warm some olive oil and add the garlic and chilli flakes. Once fragrant, add the broccoli and a pinch of salt, and turn in the oil. Stir the butter and half the parmesan into the polenta, turn it out on to a large dish, and top with the greens and remaining parmesan. Serve immediately. UK readers: click to buy these ingredients from Ocado",Lifestyle/Food,"Rachel Roddy’s recipe for polenta with butter, parmesan and greens | A kitchen in Rome",https://www.theguardian.com/food/2022/feb/14/rachel-roddy-recipe-polenta-butter-parmesan-greens
