3/28/2022,"Scotland’s police force and its prosecution authority have refused to give 12 police officers immunity from criminal charges in an inquiry into the death in custody of Sheku Bayoh. Police Scotland’s deputy chief constable, Fiona Taylor, has told the judge chairing a public inquiry into Bayoh’s death in Kirkcaldy in May 2015 that officers are under a legal and professional duty to tell the truth, regardless of the risks of self-incrimination. Lord Bracadale, the inquiry chair, had urged Police Scotland and the Crown Office to provide undertakings officers would not be prosecuted for any evidence they gave his inquiry, to ensure they gave “full, frank and uninhibited” testimony. The officers involved, some of whom have since left the police, have consistently denied any wrongdoing and have not been prosecuted or disciplined over any aspect of Bayoh’s arrest. In a letter to Bracadale released on Monday, Taylor said it would undermine public confidence and threaten the force’s commitment to root out racist or discriminatory views if any such undertaking were given. “[Giving] full and frank testimony is the basic expectation we have of one another as police officers and the very least the public demands of us as their servants,” she said. “It is not transactional and should never be conditional. “The chief constable has made it clear that racism or discrimination of any kind is deplorable and completely unacceptable; it should have no place in society and it has no place in policing.” Ruth Charteris QC, the solicitor general, also rejected Bracadale’s request. “Prosecutors must consider all cases on their individual facts and circumstances and act in the public interest,” Charteris told Bracadale. “I have considered all the information available to me, and I am not currently satisfied that it is in the public interest to grant the undertakings.” Charteris added that the Crown Office might consider immunity in a specific instance if there was a clear risk that failing to do so would prevent Bracadale from fulfilling the inquiry’s terms of reference. But she added: “The crown has reserved its right to prosecute in all matters related to this case.” Due to start in May, the public inquiry was set up by the then Scottish justice secretary, Humza Yousaf, in 2019 after intense public pressure and an outcry from Bayoh’s family over the Crown Office’s decision not to prosecute the officers involved or Police Scotland. Bayoh, who was married and had two sons, died after being challenged by several police officers responding to allegations a black man had been seen in an agitated state carrying a bladed weapon. He was hit with batons, CS spray and pepper spray, and restrained on the pavement with wrist and leg ties. No bladed weapon was found and there were accusations Bayoh had taken drugs that morning, which could have contributed to his death. The inquiry’s terms of reference include an instruction to establish the cause of death and whether it was avoidable; whether police restraint training was at fault; whether the police’s actions “were affected by his actual or perceived race”; and events in the aftermath of his death, including securing evidence. The Scottish Police Federation, which represents many of the officers giving evidence, has been asked for a response.",News/UK news,Sheku Bayoh: officers refused immunity for inquiry into death in custody,https://www.theguardian.com/uk-news/2022/mar/28/sheku-bayoh-officers-refused-immunity-for-inquiry-into-death-in-custody
3/28/2022,"John Craven, presenter My involvement in Newsround came through two lucky breaks. In 1971, I was a reporter on BBC Points West in Bristol. One afternoon, I strolled into the studio and was told auditions were under way for Search, a new current affairs programme aimed at children. “Can I have a go?” I asked and, with less than five minutes to prepare, amazingly got the job. A year later, Edward Barnes, then deputy head of BBC Children’s TV, had a six-minute gap to fill on Tuesdays and Thursdays at 5pm. Much to the disquiet of some of his colleagues, he decided to fill it with news for children. Barnes persuaded Derrick Amoore, the BBC News editor, to give him all the facilities he needed free of charge and hand over complete editorial control – something that would never happen today. Jonathan Dimbleby was originally asked to front it, but he had just jumped ship to ITV. So my second lucky break came when I was invited to step in – and Newsround was born. Newsround’s task was to explain serious events in a simple way, keeping our audience posted on all the interesting, exciting things happening worldwide. We called it Newsround because lots of children had newspaper rounds. My name was added to make it seem more personal. I dressed casually which – as a suitless BBC newsreader – raised some eyebrows. I didn’t sit behind a desk because we didn’t want to make it seem like a classroom. BBC correspondents such as Martin Bell, John Humphrys and Michael Buerk sent in special reports. We also recruited our own reporters, starting with wonderful Lucy Mathen. We wanted Newsround to have authority and the format still holds 50 years on. Although I left Newsround after 17 years, and have been on Countryfile for nearly twice as along, I still feel enormously proud of my baby. Newsround’s success proves that children are interested in the world around them, especially if it’s explained in ways they can grasp. This is even more important now, when there is so much dangerously false information on social media. Middle-aged people still stop me in the street and say: “Thank you for being a voice of my childhood and getting me interested in the news.” Newsround is still fulfilling that role for their children or grandchildren. Lucy Mathen, presenter I was working on a local newspaper called the Surrey Mirror, discovering that I was utterly suited to journalism: unafraid to knock on doors, able to write up juicy court cases and interrogate officials about local injustices. All for £18 a week. I met Newsround creator Edward Barnes at a friend’s 21st birthday party and spoke endlessly about the stories I’d been working on, from the IRA bombings in Caterham to a scoop interview I’d managed to get with Richard Burton. A few days later, I received a call from Newsround. They were looking for a full-time reporter: was I interested? Before I knew it, I was out with a BBC camera crew, reporting on stories, very much in at the deep end. We found the right language and visuals to report even the most difficult stories, without patronising our audience. It turned out this was what many adult viewers wanted, too. Some of my greatest fans were pub landlords, who made sure that they tuned in at 5pm before opening up. My four-year presence on Newsround in the 1970s was important for another reason – I was the first female British Asian reporter on a nationwide news programme. John and I also co-presented Newsround Extra and a series on Africa. I went on to report and present other TV programmes, then I retrained as a doctor and now run a charity tackling blindness in India. I am most remembered for Newsround, though, which has led to some surreal moments. On my first night on call as a junior doctor, I was struggling to take a blood sample in the early hours of the morning, but noticed that the patient kept looking at my NHS badge, which said: “Dr L Mathen.” I thought: “Is she going to report me for incompetence?” Then she asked: “Does the L stand for Lucy? Are you really Lucy Mathen who used to be on John Craven’s Newsround?” Newsround is on CBBC and BBC iPlayer daily. The programme celebrates its 50th anniversary on 4 April with a special film. ",Arts/Culture,‘Some of our greatest fans were pub landlords’ – how we made John Craven’s Newsround,https://www.theguardian.com/culture/2022/mar/28/how-we-made-john-craven-newsround-pub-landlords
3/28/2022,"It was meant to be over by now, but the pandemic does not appear to be following the script. Covid has swept through schools once again in the past few weeks, with teachers going off sick again and desks emptying fast. The new extra-infectious variant of Omicron comes at just the wrong time for children who have already missed out on so much over the past two years and in England now face Sats, GCSEs or A-levels this spring. A report from the Commons education select committee, whose Tory chair Robert Halfon has doggedly worried away at this issue for two years, recently concluded that school closures in England had been “nothing short of a national disaster for children and young people”, with pupils in the most deprived areas up to eight months behind in some subjects and the government’s “catch-up” national tutoring programme (NTP) failing to deliver in precisely the places that need it most. Schools have reported tutoring companies cancelling lessons at the last minute, or sending tutors with no knowledge of the subject they’re supposed to be teaching; frustrated headteachers told the committee they could have spent the money better themselves. All this makes getting children back even to where they were pre-Covid a challenge, never mind taking great leaps forward. Yet this week the education secretary, Nadhim Zahawi, published an ambitious white paper confirming new higher targets in reading, writing and maths for primary schoolchildren in England plus improved GCSE results by 2030. He is right to be ambitious for children. But vague talk of a “parent pledge” that children who are falling behind will be helped – what does anyone think teachers were trying to do before now, exactly? – falls some way short of convincingly explaining how precisely they’re intending to work miracles: new figures released this week show that by autumn 2021 the average primary pupil was still 1.9 months behind in maths (although that’s a distinct improvement on the 2.8 months behind they were in summer). At a time when waiting lists for children’s mental health services are going through the roof (which means emotional and behavioural difficulties spilling over in class) and a cost of living crisis is plunging more families into desperate circumstances, something just doesn’t add up. Zahawi is far more sure-footed than his predecessor, Gavin Williamson, with a brisk track record of delivering as vaccines minister. He’s likely to get more of a grip on the catch-up programme and has hinted at giving schools more freedom to make arrangements that work for them. But he’s having to try to do it on the cheap, which rules out any genuinely big ideas. Kevan Collins, the government’s chosen catch-up “tsar”, resigned last year after his proposals were rejected as too expensive, and the more limited programme ministers eventually announced was tendered out last year to a surprisingly low bid from the Dutch private company Randstad, with predictably poor results (the select committee heard that the Randstad programme was a “bureaucratic nightmare” and that its online tuition hub was “dysfunctional”). Conjuring up trained teachers from thin air to help children who have missed out on months of proper lessons was never going to be easy. But as things stand the scenario everyone in education feared – that lockdown would unravel years of hard work to close the gap between rich and poor children – now risks becoming reality, with dismal consequences for children’s life chances. Home schooling was tough on everyone, but middle-class parents were better positioned to cope with it and could afford private help later if things did go awry. For their less fortunate classmates, the NTP should have been a lifeline but, as of last spring, had failed to reach over a third of its target schools in the north-east of England, and in Yorkshire and Humber, the two regions where children’s learning loss is deepest. So much for levelling up. The children’s commissioner for England, Rachel de Souza, a former headteacher, has meanwhile been warning of the number of so-called “ghost children” who have seemingly disappeared from the radar during the pandemic. In the summer of 2020, with debate raging over whether schools could safely open in the autumn, I spoke to the head of an inner-city secondary whose big worry was that after months at home some teenagers would just drop out and never return to education. At the other end of the age spectrum, fewer families are taking up the offer of free nursery places for two-year-olds from disadvantaged backgrounds, places which help prepare them for school; children’s centres report families who have barely seen a professional face-to-face since their toddlers were born and have simply lost the habit of engaging with officialdom. Keeping schools open to all through the first lockdown, with neither vaccine nor immunity to an unknown new virus, sadly wasn’t a viable prospect: even if Boris Johnson had tried it, schools would simply have had to shut anyway as teachers went down sick. By limiting the spread of infection, school closures probably saved the lives of parents and grandparents. But now we should be focusing all our energies on making up for what children have missed. They don’t have to become a “lost generation”, for ever scarred. But it is infuriating that so many chances to turn things around have already been wasted: if we don’t act decisively then we will be living with the social, academic and economic consequences of having let these young people down for years to come. Gaby Hinsliff is a Guardian columnist",Opinion/Opinion,We are trying to save a ‘lost generation’ of children. That can’t be done on the cheap | Gaby Hinsliff,https://www.theguardian.com/commentisfree/2022/mar/28/save-lost-generation-children-covid-school-closures-england
3/28/2022,"The always-compelling German actor Nina Hoss (best known for Barbara and Phoenix, her collaborations with director Christian Petzold) stars as a neurotic, conflicted violin teacher and mother in this sticky, stop-start drama set in the exacting, pressurised realm of classical music. Those who know this world are aware that it’s an arena where fierce discipline and innate talent is required to succeed and secure coveted spots at, first, highly competitive schools and then, for adults, in ensembles and orchestras. Not all music teachers are Mr Holland’s Opus-style nurturers for sure, but films such as this one as well as Michael Haneke’s The Piano Teacher and, to an extent, the jazz-angled Whiplash, love to dwell on characters whose minds are contorted into all kinds of perverse, emotionally mangled shapes by their devotion to excellence. Hoss’s Anna is a less outre version of this tortured-or-torturing music teacher meme, a woman whose backstory and psychology gets filled in somewhat ploddingly by writers Daphne Charizani and Ina Weisse. (Weisse, an actor herself, also directs.) The only child of a forbidding and cruel father, Anna has developed an almost-morbid fear of failure that hobbled her career as a violinist, which would explain why she’s become a teacher. Now married to a schlubby-sexy French instrument-maker (played by Simon Abkarian), Anna pushes her son Jonas (Serafin Mishiev) to play the violin as well, even though the poor kid would clearly prefer to help dad in the workshop or play ice hockey instead. (God forbid any of the kids in this world might play video games or listen to rock music.) When Anna volunteers to coach the adolescent Alexander (real-life prodigy Ilja Monti) to help him get into Berlin’s top conservatory, she becomes obsessed with shaping his talent, pushing him relentlessly in a way that not only upsets her family but threatens to break Alexander’s spirit. In light of the strange, brutal ending that’s more foreshadowed than it seems, it’s hard to work out where Weisse wants to land on issues around the best way to coax talent, especially in fields such as music where you have to put in a relentless amount of hours to achieve the highest results. We’re clearly meant to infer Anna is a few horsehairs short of the full bow given her weird other relationships in the film – like the strangely cold/erotic interactions with both her husband and a handsome cellist co-worker (Jens Albinus) who invites her to join his string quintet, and that’s not a sexual euphemism. It’s not even clear if Anna and the latter are actually having an affair or whether they just like to make out furtively in hallways. (“Touch my breast. Now the other one,” she commands him before abruptly storming off after a fraught experience.) Thankfully, there’s no bodily self-mutilation, although sudden presto violence forms part of the story.  The Audition is released on 1 April in cinemas.",Arts/Film,The Audition review – Nina Hoss is compelling in brutal classical music drama,https://www.theguardian.com/film/2022/mar/28/the-audition-review-nina-hoss-is-compelling-in-brutal-classical-music-drama
3/28/2022,"Novaya Gazeta, one of Russia’s last remaining independent news outlets, has said it will cease operations until the end of the war in Ukraine after it received a second warning from the state censor for allegedly violating the country’s “foreign agent” law. The warning came a day after its editor-in-chief, Dmitry Muratov, spoke with the Ukrainian president, Volodymyr Zelenskiy, in a group interview with Russian journalists that was quickly banned by the state media watchdog, Roskomnadzor. Novaya Gazeta is one of the country’s most important independent publications. A number of its journalists have been killed since the 1990s in retaliation for their reporting, including on the war in Chechnya. The Roskomnadzor warning to Novaya Gazeta was allegedly prompted by the newspaper’s failure to identify a “foreign agent” in an unspecified publication. But it appeared to be an act of retaliation for the newspaper’s decision to report on the war and Muratov’s participation in the interview with Zelenskiy. In an effort to avoid being shut down, the newspaper announced its surprise decision to halt publications until the end of Russia’s “special operation”, the Kremlin’s official term for the invasion. “We have received another warning from Roskomnadzor,” Novaya Gazeta’s editorial board wrote in statement. “Following this, we will suspend the publication of the newspaper online and in print until the end of the ‘special operation on the territory of Ukraine’.” The editorial board noted that the newspaper could have its licence revoked because it had received two warnings from Roskomnadzor. It received the first warning last week. Muratov, who received the Nobel peace prize in 2021 for his efforts to support journalistic freedoms in Russia, had decided to continue publishing Novaya Gazeta while obeying a Roskomnadzor directive that forbids journalists from describing the conflict as a “war” or “invasion”. While other outlets such as Echo of Moscow and TV Rain were banned from Russia, Novaya Gazeta had continued reporting on the war and on the impact of sanctions on Russia’s economy. It is one of the only Russian news outlets to have a correspondent in Ukraine filing dispatches about the impact of the war on Ukrainians. “I want to express absolutely my solidarity with Novaya Gazeta, its journalists and its editor-in-chief,” wrote Alexey Venediktov, the former editor of Echo of Moscow. “I hope that you will soon return to your readers, and therefore to me.”",News/World news,Russian news outlet Novaya Gazeta to close until end of Ukraine war,https://www.theguardian.com/world/2022/mar/28/russian-news-outlet-novaya-gazeta-to-close-until-end-of-ukraine-war
3/28/2022,"Fuel poverty campaigners have written to Britain’s energy regulator urging it to take action to reduce electricity standing charges, which it says are discriminatory. When the energy price cap rises on Friday, most households will face an increase of at least 80% in the standing charges they pay for electricity, with much of the extra cost a result of the failure of 30 suppliers during 2020. The standing charge is applied daily, and is charged regardless of how much energy the customer uses. In a letter to Ofgem, Fuel Poverty Action said the poorest consumers were “paying for negligent policymaking”, and that the “injustice of the standing charge must urgently be addressed”. Customers of these suppliers have been switched to new providers and their balances have been guaranteed; the cost of doing this has been added to all bills. Analysts’ estimates of how much each household will pay as a result vary, but Fuel Poverty Action said that typically, £68 of the £75 increase in standing charges would be because of supplier failure. Vulnerable customers on prepayment meters or those who pay their bills by cheque or cash rather than direct debit pay the highest standing charges, and are the least likely to have switched provider in the past. The Fuel Poverty Action co-director, Ruth London, said: “Why have Ofgem decided to make the poorest customers pay for their bad decisions and for bad practice in the industry? This huge injustice must be urgently reversed.”She added: “Prepayment meters are another way that people with the least resources – and often with the leakiest, most poorly insulated homes – are forced to pay the highest price for fuel. “These meters are often imposed without consent, cost more than direct debit, and have the effect of cutting people off supply. As prices increase, it is absolutely urgent to end such upside down policies. Details of average standing charges published by Ofgem show that, from 1 April, direct debit customers will typically pay 45p a day to their electricity provider, up from 25p a day now, and 27p a day for gas, up from 26p now. Those increases add £76.65 a year to an average bill. For prepayment customers, electricity standing charges will rise to an average of 50p a day, and gas 37p. For cash and cheque customers electricity standing charges will be 51p a day and gas 32p. Beneath these headline averages are regional differences. For direct debit customers in London, electricity standing charges are rising to 31p on Friday, while in the south-west of England they will increase to 49p. An Ofgem spokesperson said: “Our top priority is to protect consumers including making sure bill payers pay a fair price. We know this is a challenging time. Customers struggling to pay for energy may be eligible for extra help such as debt repayment plans, emergency credit for prepayment metered customers, priority support and schemes like the winter fuel payment or warm home discount rebate. “We are strengthening the retail market through effective stress testing of suppliers, which will reduce the cost of companies leaving the market as far as possible.” Fuel Poverty Action is campaigning for a new pricing structure which it calls Energy for All, which gives all households energy to cover their basic requirements for free, with the cost covered by a windfall tax. A petition calling on the government to adopt this policy has attracted more than 300,000 signatures.",Lifestyle/Money,"Cut ‘unjust’ electricity standing charges, UK regulator urged",https://www.theguardian.com/money/2022/mar/28/electricity-standing-charges-uk-energy-suppliers
