3/11/2022,"Wolves ended their run of three successive defeats with a comfortable win over Watford, just as they had done in September, on a night when they equalled their biggest Premier League win to consolidate their place among the chasing pack. Rúben Neves’s sumptuous chip five minutes from time allowed Wolves to match their 4-0 win over Blackpool in 2011 on a night that Ben Foster will probably want to forget as Watford’s good run on the road came to an abrupt halt. The former West Bromwich Albion goalkeeper, who celebrated Watford’s FA Cup semi-final win over these opponents three years ago with a tweet that spelled Wolves with the digits ‘1’ and ‘5’ in memory of the Baggies’ 5-1 win at Molineux in Mick McCarthy’s final game here, was badgered all evening and gave away the ball for Daniel Podence to make it 3-0 in the 21st minute. Only 22 goals had been scored in Premier League matches at Molineux before this one-sided affair which cements Watford’s place in the middle of the bottom three, three points behind 17th place and with three more games played. Raúl Jiménez opened the scoring before Cucho Hernández put past his own keeper but the goal of the night came when Neves, having taken one touch to steady himself on receiving Chiquinho’s header back, advanced into the penalty area as if he was going to blast his shot only to dink it over Foster’s head into the top corner. Watford’s record as defensive misers on the road since Roy Hodgson took over was in tatters inside the first quarter of the game as Wolves refound their attacking swagger. Three goals in an eight-minute burst seemed to have wrapped the game up. Jiménez, recalled to the starting lineup after missing the last two defeats, opened the scoring with a neat right-foot trap and left-foot finish after Hwang Hee-chan burst on to Podence’s touch into the left side of the penalty area to cross short and low to his strike partner. Wolves looked much more dynamic with the Mexican back down the middle and Jonny and Rayan Aït-Nouri advancing down the flanks at every opportunity. When Jonny cut back inside down the right wing and crossed left-footed to his wing-back on the other flank, Aït-Nouri’s pullback was diverted into his own goal by Hernández. Watford had been seeking to equal their top-flight club record of three consecutive clean sheets away from home but their defensive confidence was clearly shattered. Foster, in particular, was getting brickbats from the home fans and when the goalkeeper, under pressure from Jiménez following a bobbling backpass, shanked his attempted clearance, Podence calmly collected the ball 25 yards out and lobbed it into the empty net. The recalled Josh King was promptly sent clear by Moussa Sissoko four minutes later but cleared the crossbar by some distance with his shot from the edge of the penalty area. As the game entered an understandable lull, Bruno Lage, the Wolves manager, turned to the stands, raising his arms and then holding up three fingers, exhorting the crowd to help keep up the intensity. Perhaps the Molineux faithful were in shock; this was the first time since April 2019 that they had led 3-0 at half-time. Watford’s sense of woe was exacerbated as they lost Kiko Femenía and King to injuries, forcing Hodgson to use up two substitutes before the start of the second half, with Christian Kabasele coming on at right-back and Samuel Kalu up front. The second half turned into something of a pantomime. Lage was quicker to respond to the South Bank’s calls for a wave than Foster who sent another miskick to Podence, this time 60 yards out. The Wolves’ No 10 still went for the lob from the centre circle, Foster back-pedalling in time to take the catch. Wolves took the opportunity to introduce younger legs as Pedro Neto, fresh from signing a new five-year contract on his 22nd birthday on Wednesday, and Fábio Silva came on. Neto rose high to head Jonny’s cross goalwards, but Foster saved, then Silva was unlucky to nick Aït-Nouri’s left-wing cross wide of the far post. But Wolves, surely, had done enough.",Sport/Football,Raúl Jiménez leads Wolves’ rout of sloppy Watford,https://www.theguardian.com/football/2022/mar/10/wolves-watford-premier-league-match-report
3/11/2022,"Rangers have taken a big step towards their first European quarter-final for 16 years. James Tavernier and Alfredo Morelos struck in a hurly-burly first half before Leon Balogun headed into the net at the start of the second to give the Scottish champions a plump cushion to take with them for next week’s second leg in Belgrade. Two weeks after one of the most glorious European results in Rangers’ history, Giovanni van Bronckhorst sent out the same XI that finished the victorious tie against Borussia Dortmund but he had them aligned in a different formation, with a back four rather than a 3-5-2. Red Star started brightly but the 50,000 excited souls in Ibrox rejoiced when Rangers’ first proper attack yielded a penalty, Ryan Kent skittering into the box and falling over Slavoljub Srnic’s trailing leg. Tavernier curled an unstoppable spot-kick into the top corner. Aleksandar Katai thought he had equalised almost immediately but, for the second time in a frenetic start, his effort was ruled out for offside. Red Star barely had a chance to curse their poor timing before Rangers inflicted further pain. Ryan Jack received a short corner at the edge of the box before crossing towards the far post; a defensive header sent it bouncing towards Morelos, who dispatched a sweetly controlled shot into the net from eight yards. Jack’s fortunes then turned for the worse in a breathless contest, as he was penalised for a foul in his own box. But Katai’s luck did not change: Allan McGregor clawed away his penalty with a brilliant one-handed save. The visitors were slick and muscular but Rangers nearly made it 3-0 before the break, Glen Kamara firing over the bar after superb work by Jack and Calvin Bassey. Five minutes into the second half, Rangers broke through again, Balogun leapt to head an outswinging corner by Tavernier beyond the goalkeeper from 10 yards. Connor Goldson nearly made it 4-0 from another corner but Aleksandar Dragovic cleared off the line. Red Star remained dangerous. McGregor was finally beaten in the 73rd minute but Guélor Kanga’s ferocious shot from 25 yards clattered the bar.",Sport/Football,Leon Balogun caps rampant Rangers’ first-leg triumph over Red Star Belgrade,https://www.theguardian.com/football/2022/mar/10/rangers-red-star-belgrade-europa-league-match-report
3/11/2022,"My Brilliant Friend (Sky Atlantic) is the most beautiful drama on television, and, considering how consistently excellent it has been, it remains sorely underrated. This third season adapts the third of Elena Ferrante’s Neapolitan novels, Those Who Leave and Those Who Stay, and, for those who luxuriated in its first two seasons, it remains as gorgeous and seductive as ever. Lifelong friends and rivals Lila and Elena, or Lenù, are now in their 20s, and their lives have moved away from the poor Naples neighbourhood where they grew up together. The first episode is about Lenù, the one who left, and her rise to fame as a successful writer of what is rumoured to be a racy novel. Success brings her a new life among professors and student activists, where opinions are discussed over expensive dinners and there is no obligation for her to marry her fiance, Pietro, a non-believer, in a church. She has been educated out of her class and traditions, but family ties remain, and much of the first episode concerns how difficult this is for her. At home in Naples, she is called “superior” and told she has ideas above her station. Every single scene between Lenù and her mother is a mesmerising battle between cruelty and love. In Milan, she must watch on as young academic men are lauded for their brilliance. Lenù is trying to prove that she is a new person, at the same time as trying to work out what it is she wants to say, now that she has a voice with which to say it. My Brilliant Friend effortlessly balances impossible questions about love, family, shame and duty, and it does so with impeccable style. This series is set in the early 70s and it really is a good-looking drama, cinematic in its ambitions, again taking its visual cues from a particular period of film history (this season’s director, Daniele Luchetti, has said he was inspired by John Cassavetes and 70s US cinema). Even a short scene of Lenù in a bookshop looks stunning, as does Lila walking across a factory floor, surrounded by strung-up animal carcasses. It is clever to keep Lila out of the first episode, because it makes it more powerful when she comes back into the story in the second. Lila is the one who stayed, in Naples at least, though she remains estranged from her family, and works in a meat factory to support herself and her young son. Lila’s brilliance remains fierce, though her situation is arduous, and she is picked up as a symbol of working-class women and their struggle by the communists in her orbit. Some of the boys from the old neighbourhood are now fascists. Political struggle is everywhere, and the heat of it is rising. It is both a curious and strangely effective choice to continue with the actors who played Lila and Lenù as teenagers, even as they age into a more adult world and different lives. Gaia Girace (Lila) and Margherita Mazzucco (Lenù), who have been remarkable so far, are 18 and 19, and they look it. While they are dressed up to appear just a little older, with makeup and wigs, their obvious youth gives the effect of young women adrift in the world, and sometimes they look like children playing at adulthood. It shouldn’t work as well as it does, but it does – adding to the notion that they are searching for something, even if they don’t quite know what it is yet. This is television at its best and it weaves a spell unlike anything I have seen in a very long time. It demands concentration but rewards it generously. For those who have yet to experience the pleasure of My Brilliant Friend, I would suggest not jumping in here, as both personal and political histories weigh heavily on the characters and their relationships. Go back to the beginning, and take it all in.",Arts/Television & radio,My Brilliant Friend review – this gorgeous drama is television at its best ,https://www.theguardian.com/tv-and-radio/2022/mar/10/my-brilliant-friend-review-this-gorgeous-drama-is-television-at-its-best
3/11/2022,"Perhaps it was inevitable given how the half-time playlist gleefully segued between Dirty Cash (Money Talks), Price Tag and Can’t Buy Me Love that a divine second-half intervention from Newcastle’s marquee January signing, Bruno Guimarães, would earn a sixth win in seven matches and extend Eddie Howe’s unbeaten streak to nine Premier League games. Chris Wood, another mid-season recruit, scored his first goal for the club to cancel out Southampton’s first-half opener before Guimarães’s touch of class sealed a victory that lifts Newcastle 10 points above the relegation zone and within four of the top half. It was hard to begrudge the sold-out away end enjoying the moment, even if some of the songs felt delightfully far-fetched. For Ralph Hasenhüttl, whose Southampton side have lost successive games for the first time since November, defeat would have only rammed home his frustration. Hasenhüttl had aired a few gripes – or what could be perceived as sour grapes – about Newcastle being able to name a “completely different team” compared to the one Southampton would have faced at the end of December and argued new signings should have been ineligible for this rearranged game, the original fixture postponed owing to Covid and injuries. Four of Newcastle’s January recruits started here, including Guimarães, who had been drip-fed minutes off the bench since his £40m arrival from Lyon. He replaced the injured Joelinton in their three-man midfield and a fifth, Kieran Trippier, again travelled to the game with the squad despite being on crutches after fracturing a foot. Allan Saint-Maximin missed the game through illness. Newcastle’s travelling 3,300-strong support enjoyed Dan Burn’s early challenge on Armando Broja, but it was Southampton who shaded the opening stages. Martin Dubravka did well to claw the ball from Broja after the on-loan Chelsea striker latched on to a fine Oriol Romeu pass and Broja later skewed wide after Romeu edged out Jonjo Shelvey on halfway. But the hosts’ pressure told when they opened the scoring through Stuart Armstrong after 25 minutes, though the ball took an age to drop into the net. Mohamed Elyounoussi diverted Kyle Walker-Peters’s cross back across goal and Armstrong nodded in, via Burn, who tried in vain to clear. Southampton’s lead proved short-lived. Shelvey played a laser pass into the box for Wood and the striker easily eluded Mohammed Salisu to power a header into the bottom corner beyond Fraser Forster, the goalkeeper who started his career with Newcastle. Joe Willock could have headed Newcastle in front before the interval but failed to hit the target after meeting Guimarães’s cross. Southampton came much closer to regaining the lead, Adams blasting against the crossbar after the leftovers of Armstrong’s attempted shot fell to him inside the box. Newcastle’s players emerged for the second half to the backdrop of Money, Money, Money and Guimarães, who had a low-key opening 45 minutes, soon displayed the kind of skill that convinced Amanda Staveley and Jamie Reuben, among the Newcastle contingent watching in the directors’ box, to sign him. Jacob Murphy had a fierce shot diverted wide and, from the subsequent corner, Burn knocked the ball down into the six-yard box. Guimarães, with his back to goal, effortlessly flicked the ball in with his right boot to spark delirium among the travelling supporters. The smell of a smoke bomb filled the St Mary’s air and Guimarães, who later departed to a standing ovation from the away fans, soaked up the adulation, pointing to the name on the back of his shirt. But Newcastle were not finished there and went for the jugular, Salisu blocking a powerful shot by the former Southampton defender Matt Targett. Southampton fell flat but Dubravka had to be alert to divert a troubling Tino Livramento cross that swirled goalwards and, with a minute of normal time to play, the Newcastle goalkeeper managed to push a dangerous Salisu header away. There were a hairy couple of moments for Newcastle in six added minutes but the visitors held on.",Sport/Football,Bruno Guimarães downs Southampton as Newcastle surge continues,https://www.theguardian.com/football/2022/mar/10/southampton-newcastle-premier-league-match-report
3/11/2022," If nothing else, this one will make for some stunning photographs. The deep blue of France against the bright scarlet of Wales, the Friday night lights of Cardiff offering a richness to the images. That is about as much optimism as can be confidently projected from a Welsh point of view as a French side set on a grand slam meet a squad seemingly held together by chewing gum and gumption. “They’re the real deal,” said the Wales captain and fly-half, Dan Biggar, on the eve of the match. “We realise that this French team is different to the previous French teams that we’ve played over the years. The size of the pack, the in-form players that they’ve got, the coaching setup and who they’ve brought in.” Much of the attention has rightly focused on Antoine Dupont, World Rugby’s reigning player of the year and the fulcrum at No 9 between a blistering backline and a set of forwards that might be the most dominant in the game at present. “It’s pretty obvious he’s the best player in the world,” Biggar said of Dupont. “He has a huge influence on any game he plays. His partnership with [Romain] Ntamack has flourished over the past 18 months. They’re in seriously good form.” This will be the half-back pairing’s 12th Six Nations game together. According to the statistician Russ Petty they are only three away from Morgan Parra and François Trinh-Duc. But at 25 and 22 respectively, Dupont and Ntamack are on the brink of what could be a dynastic union. That they are mostly playing front-foot ball has several explanations. For a side famed for their expansive running and offload game, France kick a lot. They have made almost 800 more metres from the boot than any other team in the competition and therefore rarely play in their own half. They pin the opposition back three in their own territory and invite counterattacks from distance. They then commit to the breakdown like zealots, jackalling with ferocious intent until they either win a penalty or turn the ball over. Then there’s their monstrous pack. “Look at the way they dismantled Scotland,” Biggar said of France’s 36-17 win in Edinburgh. “A lot of it was due to big carries, getting on top of the ball or being on top defensively and scoring points from that. It’s about making sure we’re physically ready and then we’ve got to make sure we take our opportunities because they’ll probably be few and far between. France aren’t going to give us anything on a plate. We have to earn what we get.” France have not stumbled upon their extra heft overnight, it has been building. At the 2018 Under-20 World Championship final, France bulldozed England to win 33-25. An indomitable scrum and a clinical lineout proved the difference in Béziers. Ntamack played that day, but more crucially so did Julien Marchand and Cameron Woki who will both start in France’s tight five on Friday with Jean-Baptiste Gros offering support from the bench. Biggar, though, did offer one other source of hope. He cited the 2013 game in Paris. Not much was expected of Wales having just lost eight games in a row. But a scrappy 16-6 win kickstarted their campaign, which would end in triumph five weeks later. “We’re quietly confident,” said Biggar, who has been productive against France, scoring three tries from 11 games, winning seven of them. “We’re happy for Dupont and Ntamack and Shaun [Edwards, France’s defence coach who had previously fulfilled the role with Wales] to take all the headlines. We’re just trying to make sure we focus on ourselves.”",Sport/Sport,Wales’s Dan Biggar braced for stern Six Nations test from ‘real deal’ France,https://www.theguardian.com/sport/2022/mar/10/six-nations-france-team-are-the-real-deal-says-wales-captain-dan-biggar
3/11/2022,"Eddie Jones cannot even pop out to a cafe without being told his side must raise their game considerably to beat Ireland. When his local barista, as allegedly happened this week, starts expressing doubts about England finishing the Six Nations with a flourish, it is small wonder Jones is labelling Ireland as “red-hot favourites” before Saturday’s showdown at Twickenham. Even allowing for a whiff of artistic licence, Jones’s account of the conversation will certainly raise a wry smile across the Irish Sea. “The girl says: ‘That Irish team must be good. All their ex-players think they’re going to win and all the ex-England players think they’re going to win. They must be pretty good. How you feeling?’ I said: ‘Just give me the coffee please.’” Boom boom. If England wish to avoid their 2022 championship campaign ending bitterly they will need to wake up and smell whatever it takes to elevate them to the next level. The good news is that the match-day squad to face Ireland includes all the players who have been slightly doubtful this week, with the influential Tom Curry having passed his return-to-play protocols. Kyle Sinckler has also been named in the starting lineup despite a back problem while Alex Dombrandt is on the bench having convinced the management he has recovered fully from a touch of Covid. If Jones did not sound 100% confident about Sinckler – “We think he is going to be right” – he was in no doubt about the key areas and vital personnel if England are to gain revenge for their 32-18 defeat in Dublin 12 months ago. With Sam Simmonds at No 8 and Joe Marchant at No 13 there are just four starting survivors from that encounter, and Jones wants his reshuffled side to concentrate on shutting down Ireland’s strengths. “Whenever you play Ireland the breakdown is a significant part of the game,” stressed Jones. “They pride themselves on that area, but we are a very physical team and they haven’t played against a side as physical as us for a long time. If you look at their record, they haven’t played against South Africa since 2017. We played against South Africa last year and did well in those physical stakes so we intend to really take it to them.” With Marchant preferred to Elliot Daly for his aerial prowess and slightly more direct approach, England are also hoping the long-awaited return of Joe Launchbury to a match-day squad will help stiffen their maul late in the second half and further inconvenience a settled, cohesive Irish side. “We have one intention in this game and that’s to go after Ireland,” said Jones, reaching for a now-familiar metaphor. “We are going to chase them hard down the street. Everywhere they go, we’re going to be in their faces and we’re going to take time and space away from them. Do we enjoy that challenge? Yes.” It is also worth mentioning that, for all Ireland’s strengths and impressive record of 10 wins in their previous 11 Tests, England have won their last three home games against each of Australia, South Africa and Wales. Jones remains adamant that a spectacular attacking display is brewing and will soon materialise. “It’s like a wave coming in. You can see it coming in and all of a sudden it crashes and all this power comes out of it. That’s what we’ll be like. England F Steward, M Malins, J Marchant, H Slade, J Nowell, M Smith, H Randall; E Genge, J George, K Sinckler, M Itoje, C Ewels, C Lawes (capt), T Curry, S Simmonds. Replacements: J Blamire, J Marler, W Stuart, J Launchbury, A Dombrandt, B Youngs, G Ford, E Daly. Ireland H Keenan, A Conway, G Ringrose, B Aki, J Lowe, J Sexton (c), J Gibson-Park; C Healy, D Sheehan, T Furlong, T Beirne, J Ryan, P O'Mahony, J Van Der Flier, C Doris. Replacements: R Herring, D Kilcoyne, F Bealham, I Henderson, J Conan, C Murray, J Carbery, R Henshaw. Twickenham, Saturday 4.45pm (GMT). Referee: Mathieu Reynal “We’re not far away. We’re one pass, one accurate kick, one good support line away from being very good. I’ve got a picture in my head and it’s a very good picture. But we’re a work in progress. No progression is a linear progression. If it was a linear progression everyone would do it and it’d be easy. It’s not. There’s ups and downs and you’ve got to ride that.” A clearly motivated Maro Itoje has even started channelling the Book of Job – “Our future will be brighter than our past” – before a weekend when the Rugby Football Union will fly the national flag of Ukraine at Twickenham between those of England and Ireland. The fact, though, that Jones has stopped watching the morning news to avoid becoming distracted is another clear indication that England are treating this game with the utmost seriousness.",Sport/Sport,"England will ‘get in Ireland’s faces’ in Six Nations, promises Eddie Jones",https://www.theguardian.com/sport/2022/mar/10/england-will-get-in-irelands-faces-in-six-nations-promises-eddie-jones
