2/2/2022,"Hannah Lowe, a former London teacher, has won the £30,000 Costa book of the year for The Kids, a book of sonnets drawing on her experiences teaching in an inner-city sixth form. After what judges called “a long and passionate discussion”, Lowe’s poetry collection beat the bookies’ favourite, Claire Fuller’s novel Unsettled Ground, to the Costa award for the year’s “most enjoyable” book. The prize pits the winners of five categories – first novel, novel, biography, poetry and children’s book – against each other, with Lowe also emerging ahead of Caleb Azumah Nelson’s debut novel Open Water, John Preston’s biography of Robert Maxwell, Fall, and Manjeet Mann’s young adult verse novel The Crossing.  Judges said The Kids was “a book to fall in love with”. “It’s joyous, it’s warm and it’s completely universal,” said chair of judges, the BBC News journalist and broadcaster Reeta Chakrabarti. “It’s crafted and skilful but also accessible. Words from the judges were ‘insightful’, ‘empathetic’, ‘generous’, ‘funny’, ‘compassionate’, ‘uplifting’.” Chakrabarti said it took judges “several hours” to come to their decision. “It was a vigorous debate, it was passionate, people felt really strongly. But the centre of gravity in the room was with the winner,” she said. “We were looking for the most enjoyable book, the most accessible book, the book that you would most want to pass on to other people. And the winner was, for all of us, fresh and immediate, it spoke very directly to everybody. It has a universality to it – in a simple way, because everybody’s been to school.” Some people, Chakrabarti, said “find poetry a little bit intimidating. They think, ‘Gosh, I’m not necessarily going to get on with it.’” But Lowe’s collection “is so direct that actually you feel that you’re being talked to by somebody. And it spans so much, in a very concentrated way. So it’s about everything, it’s about love and grief. It’s about the present and the past. It’s about teaching and being taught. Motherhood, parents, singledom – there’s so much in it. And it’s very witty and very funny at times as well, and in that sense really uplifting.” Lowe’s sonnets move from the decade she spent teaching in a London sixth form in the 2000s, to her own coming of age in the 1980s and 1990s. A collection of fictionalised portraits of the students she taught, it also sees Lowe write about her son, growing up in London today. “Boredom hangs like a low cloud in the classroom. / Each page we read is a step up a mountain / in gluey boots,” Lowe writes, in The Art of Teaching II. “Even the clock-face is pained / and yes, I’m sure now, ticking slower. If gloom / has a sound, it’s the voice of Lerow reading / Frankenstein aloud.” In Try, Try, Try Again, Lowe writes about failing exams, and of how “you rip the notice // open, your keen heart pumping, and find a D / or damn, an E”. In Sonnet for the A Level English Literature and Language Poetry Syllabus, she explores “all summer term reading poems – / down in the mud / of words, wanting / the kids to hear what I heard – / breaking the poems apart, slapping / their parts to the board – ”. The poet, who is also a lecturer at Brunel University, London, was interviewed by current students at City and Islington College, where she previously taught, after winning the poetry award last month. “I began sketching these poems about five years ago after I’d left the sixth form and had a period of reflection where I started to think about what I’d learnt in my time as a teacher, not least from the students I was teaching,” she told them. “I realised I’d learnt so much from the young people that I taught about personal things, and public and political issues to do with feelings of belonging, a sense of Britishness or not, social class and gender; and I started to think about how they had impacted my own sense of identity.” According to the Costa poetry judges, who selected it as winner of that award, The Kids “buzzes with life while re-energising the sonnet that Shakespeare would recognise”. Lowe, who was born in Ilford to an English mother and Jamaican-Chinese father, was shortlisted for the Forward prizes for her first collection, Chick, in 2013. The Kids, her third, was also shortlisted for the 2021 TS Eliot prize for poetry. It marks the second win in five years for publisher Bloodaxe Books, which also took the top Costa prize in 2017 for Helen Dunmore’s posthumous collection Inside the Wave. The book of the year award has been won 13 times by a novel, five times by a first novel, eight times by a biography, nine times by a collection of poetry and twice by a children’s book, with last year’s prize going to Monique Roffey’s novel The Mermaid of Black Conch.",Arts/Books,‘Uplifting’ book of sonnets by Hannah Lowe wins Costa book of the year,https://www.theguardian.com/books/2022/feb/01/uplifting-book-of-sonnets-by-hannah-lowe-wins-costa-book-of-the-year
2/2/2022,"Two ancient warrior helmets, metal fragments believed to have come from weapons, and the remains of a temple have been discovered at Velia, an archaeological site in southern Italy that was once a powerful Greek colony. Experts believe the helmets, which were found in good condition, and metal fragments date to the sixth-century BC Battle of Alalia, when a Greek force of Phocaean ships clinched victory over the Etruscans and their Carthaginian allies in a naval battle off the coast of Corsica. One of the helmets is thought to have been taken from the enemies.  The excavations at Velia, which is near Paestum, the vast archaeological park of ancient Greek ruins in the southern Campania region, also yielded the remains of walls of a temple and vases with the Greek inscription “sacred”. The relics were discovered on what would have been the acropolis, or upper part, of the ancient Greek city. Massimo Osanna, the director general of Italian museums, said the site probably contained artefacts of offerings made to Athena, the ancient Greek goddess of wisdom, after the Battle of Alalia. After the battle, the Greek colonists set sail for southern Italy, where they bought a piece of land and founded Velia. Velia formed part of Magna Graecia, which referred to the southern Italian coastal areas colonised by the Greeks. Velia was the birthplace of the distinguished Greek philosopher, Parmenides. Osanna, who previously directed Pompeii archaeological park, said the discoveries “shed fresh light on the history of the powerful Greek colony”, while Dario Franceschini, the culture minister, said the finds highlighted the importance of “continuing to invest in research”. Franceschini last week named Tiziana D’Angelo the new director of Paestum and Velia archaeological park. Aged 28, D’Angelo is among the youngest directors of a leading Italian cultural site. She takes over the role from Gabriel Zuchtriegel, who now manages Pompeii.",News/World news,Archaeologists uncover ancient helmets and temple ruins in southern Italy,https://www.theguardian.com/world/2022/feb/01/archaeologists-uncover-ancient-helmets-and-temple-ruins-in-southern-italy
2/2/2022,"“Those in and around the Kremlin will have nowhere to hide,” the foreign secretary, Liz Truss, told the Commons on Monday, promising new legislation to impose sanctions on those with links to the Russian government should it invade Ukraine. It would be applicable to any company (and its owners) with ties to the Russian state and of economic significance to it – extending well beyond the existing sanctions regime, which covers only those linked to the destabilisation of Ukraine. The Kremlin says that it does not want war, but with more than 100,000 troops near the borders of Ukraine, and more arriving in Belarus, fear is growing of a major land offensive or – as Kyiv suspects – longer-term destabilisation and a continuing hybrid assault using cyber-attacks, sabotage and other means. While diplomacy continues, there is no sign of progress. Vladimir Putin says that Russia’s proposals have been ignored. The US succeeded in forcing a UN security council debate, with Moscow responding by warning that Ukraine may “destroy itself” if it undermines existing peace agreements. On Tuesday, Boris Johnson flew to Kyiv to show support, Monday’s attempt to play international statesman having been hobbled when he had to cancel a phone call with the Russian president to address MPs about the Sue Gray report. Standing next to the Ukrainian president, Volodymyr Zelenskiy, he warned that a Russian invasion would be a disaster.  These matters could hardly be more serious. Yet Ms Truss’s ringing declaration that the UK would get tough on Russian money earned laughter from MPs. “Londongrad” is notorious as a destination and conduit for the assets of the super-rich around Mr Putin, to the frustration of the US and others. The Center for American Progress warned last week that “uprooting Kremlin-linked oligarchs will be a challenge, given the close ties between Russian money and the United Kingdom’s ruling Conservative party, the press, and its real estate and financial industry”. Writing in the Guardian, the Scottish first minister, Nicola Sturgeon, warned that government inaction on Russian wealth had contributed to Mr Putin’s sense of impunity. Even after the Salisbury poisoning, when the rhetoric sharpened, little changed in reality. There is increasing anger, including among Conservatives, that there is still no sign of the economic crime bill, which would include long-promised measures such as reform of Companies House, a register of properties held by overseas citizens and a public register of beneficial ownership in the British overseas territories. All these are necessary and desirable, and not only with regard to Russia. Legislation, however, is not enough. Unexplained wealth orders have proved much harder to use than had been hoped. It is unclear how widely or well new anti-corruption regulations will be used when there seems to be so little interest in a clean-up at senior political levels. Still less is it clear that targeting Russian money will help protect Ukraine. The optimistic take is that it at least gives those around Mr Putin an incentive to encourage moderation. But London is not the only destination for Russian cash, however convenient and attractive, and Mr Putin is unlikely to feel bound by the priorities of oligarchs who have prospered richly from his reign. The real reason to crack down on tainted money from Moscow and elsewhere is because it is the right thing to do – and should have been done long ago.",Opinion/Opinion,The Guardian view on Russia: cracking down on tainted money | Editorial,https://www.theguardian.com/commentisfree/2022/feb/01/the-guardian-view-on-russia-cracking-down-on-tainted-money
2/2/2022,"Is the longest-running political dynasty on Europe’s far right finally running out of road? After her defeat by Emmanuel Macron in the presidential run-off of 2017, Marine Le Pen decided to double down on attempts to detoxify the Front National (FN) movement founded by her father, Jean-Marie, in 1972. The party’s name was changed to the more innocuous-sounding Rassemblement National (National Rally) and its hostility to the European Union and the euro was toned down. During the current election campaign, Ms Le Pen has focused on blue-collar issues and economic nationalism. Having tempered the xenophobic rhetoric and culture-warrior persona, last month she said that she had “definitively broken with provocations” that were “the sins of our political family”. It is generally accepted that this strategy – and this election campaign – represent Ms Le Pen’s last throw of the dice. So far, her numbers are not coming up. In a disastrous beginning to the year, she has endured a number of high-profile defections to the camp of her more extreme rival on the far right, Éric Zemmour. Most damagingly of all, her charismatic niece Marion Maréchal, a former FN MP, last week signalled both her sympathy for Mr Zemmour’s old-school approach and her desire to return to the political stage after a five-year break. Ms Maréchal is far more socially conservative than her aunt, whom she has reportedly not spoken to for some time. In an extraordinary television interview, Ms Le Pen seemed on the point of tears as she described her intervention as “brutal” and “violent”.  As the Libération newspaper put it, referencing the most famous family soap opera of them all, welcome to “Dallas on the extreme right”. Internal bust-ups in the extended Le Pen family have traditionally been of gothic intensity. In 2015, Ms Le Pen was accused of political parricide when she suspended her father from the party that he founded over antisemitic remarks, and stripped him of its honorary presidency. They have since made up. But this bout of family warfare may have more far-reaching consequences. It seems increasingly likely that the curveball candidacy of Mr Zemmour – a pundit provocateur – has as its primary aim the political demise of the Le Pen dynasty. This, he calculates, might allow a unified right to emerge at the election after this one, ending a split going back to the emergence of the FN as a force in the 1980s. Combining extreme social conservatism and Islamophobia with free-market economics, this rebranded movement would be free of toxic association with the Le Pens and – the logic goes – more appealing to the traditionalist right. Ms Maréchal, who has dropped Le Pen from her name, clearly sees the potential; if successful, such a project could break the cordon sanitaire that has kept the far right at bay for 40 years. In a three-way battle on the right to finish second to Mr Macron in April’s first round, Ms Le Pen is more or less tied in the polls with Valérie Pécresse, the centre-right candidate for Les Républicains. Mr Zemmour is a little further behind. But as this week’s drama has illustrated, his ability to damage and drain momentum from Ms Le Pen may be growing. In the context of polls that suggest a country drifting steadily to the right, potentially terminal trouble for the Le Pens is of course welcome. But what comes next may be more extreme and still more insidious in its reach.",Opinion/Opinion,The Guardian view on the Le Pen family firm: reaching the end of the line? | Editorial,https://www.theguardian.com/commentisfree/2022/feb/01/the-guardian-view-on-the-le-pen-family-firm-reaching-the-end-of-the-line
2/2/2022,"A Russian invasion of Ukraine would end in a humanitarian, political and military disaster for Russia and the world, Boris Johnson has warned as he stood alongside the Ukrainian president, Volodymyr Zelenskiy, in Kyiv, saying the UK would be judged by the level of help it gave to Ukraine. On a flying visit to the Ukrainian capital, he denied the US and the UK were exaggerating the scale of the Russian threat, saying they were not trying to “big up” the intelligence. “The grim reality was that Russian troops were massing on Ukraine’s border. This is a clear and present danger,” he said, adding: “the troop concentration was perhaps the biggest demonstration of hostility to Ukraine in our lifetime”, warning it dwarfed the Russian forces mounted before the invasion in 2014.  He said by holding a gun to the head of the Ukrainian people the Russian president was trying to get the west to dismantle the new security architecture set up after the fall of the Berlin Wall. He said the UK was trying to bring the west together, saying this crisis is about something bigger than Ukraine. “He [Putin] is trying to redraw the security map of Europe and to impose a new Yalta, new zones of influence. It would not just be Ukraine that was brought back into the Russian zone of influence. It would be Georgia and Moldova and other countries. This is absolutely critical this moment.” The press conference came after Vladimir Putin, speaking in Moscow, accused the United States of ignoring Russia’s security proposals in his first public comments on the growing crisis over Ukraine since December. A phone call between Boris Johnson and Vladimir Putin that the prime minister was forced to cancel on Monday has been rescheduled for Wednesday, after the Kremlin rejected a request to hold it on Tuesday. The Monday call was cancelled so Johnson could make a statement to MPs in parliament about Downing Street parties during lockdown. Johnson was dogged by questions at the press conference about whether his domestic political crisis over the parties was making it impossible for him to focus on the Russian crisis. He insisted he was fully focused and said he would be talking to Vladimir Putin on Wednesday. His scheduled call with Putin had to be cancelled on Monday as he was forced instead to endure two hours answering questions about the allegations of parties in Downing Street in breach of Covid regulations laid out in the report written by the civil servant Sue Gray. At one point during the press conference he was forced to say that he would publish everything he can of the final version of Gray report. He did not say he would publish everything Gray gives to him. The Ukrainian president largely protected Johnson by refusing to repeat claims that the west was creating panic by hyping an imminent Russian invasion, and instead warned of a great war. Zelenskiy said there were 35,000 to 50,000 Russian troops in Crimea, 35,000 in occupied Donbas, and 100,000 on his country’s international border with Russia. “I’m looking forward to Russia withdrawing its army from our borders. We don’t need words. Just make that one step,” Zelenskiy said, adding Russians didn’t want to die in a war with Ukraine.   Russia  Army: 280,000, including 2,840 tanks and 6,920 fighting vehicles; 150 Iskander ballistic missiles; 4,684+ artillery; 1,520 surface-to-air batteries.  Navy (just the Black Sea fleet): 6 submarines; 6 warships; 35 patrol ships.  Air force: 1,160 combat planes, 394 attack helicopters, 714 air defence systems. Ukraine Army: 145,000, including 858 tanks and 1,184 fighting vehicles; 90 Tochka ballistic missiles; 1,818 artillery; 75+ surface-to-air batteries.  Navy: 1 warship, 12 patrol and coastal ships.  Air force: 125 combat planes, 35 attack helicopters; 6 medium TB2 drones; 322 air defence systems.  Source: International Institute of Strategic Studies He urged the west to slap sanctions on Russia now, and not only after the invasion had started. Johnson had said the sanctions would come into force as soon as the first Russian toecap crossed into Ukrainian territory. “It’s vital that in Moscow, they understand that there will be automaticity in the way that we apply these sanctions, so that the minute there is a further incursion into sovereign Ukrainian territory then those sanctions will apply,” Johnson said. “We’re bringing forward the new legislation [that] will enable us to pinpoint … strategic commercial interests of Russia in a very direct way, as well as individual Russian commercial interests.” He added: “There are 200,000 men and women under arms in Ukraine, they will put up a very, very fierce and bloody resistance. I think that parents, mothers in Russia should reflect on that fact.”. In an attempt to put himself at the centre of events he listed the world leaders to whom he has spoken in recent days adding “the people of Ukraine have the inalienable right to choose how they are governed and which organisations they aspire to join”. But he stressed a step back from the brink is still possible, adding that he is ready to engage in dialogue.",News/World news,"Russian invasion of Ukraine would be a disaster, says Boris Johnson in Kyiv",https://www.theguardian.com/world/2022/feb/01/russian-invasion-of-ukraine-would-be-a-disaster-says-boris-johnson-in-kyiv
2/2/2022,"Lynton Crosby, the Australian campaign guru, will “be around” to give strategic advice to the prime minister without being given a formal job in No 10, according to Tory sources. Boris Johnson buoyed Tory MPs on Monday night by revealing he had rehired the strategist, who helped with the party’s election campaigns in 2015 and 2017. MPs and aides claim they already detect the hand of the “Wizard of Oz” in No 10’s fightback against the partygate scandal.  However, Crosby, who is currently in Australia, will not be taking on an official job that could clash with his business interests and may not spend that much time “physically in the building”, according to sources. Instead, he will be on hand to give more guidance to the prime minister on the reshaping of his operation in No 10 and strategic priorities. Those who know Crosby well say he has made clear that he is an expert on campaigns, not someone who can run a government, but one of his often repeated phrases about political leaders thinking ahead to an election is that you “can’t fatten a pig on market day”. Although many Tories believe Johnson will not still be leader at the next election, MPs say the prime minister himself has not accepted his ejection from office to be a likely option. “Lynton already speaks to him anyway. He has always been his unofficial sounding board. He’s the person he turns to and that conversation has been going on all along,” according to one person who has worked closely with Crosby. Relations between the two men cooled after Crosby helped with Johnson’s leadership campaign in 2019, partly fuelled by tensions over the role of the prime minister’s now-wife Carrie Johnson. But he has come back into the prime minister’s sphere of influence in the last year. One Tory strategist said there was also still hope among the right of the party that Johnson could give a formal chief of staff or parliamentary liaison job to one of Crosby’s strategists, David Canzini, who was involved in the hard Brexit campaigns of Theresa May’s premiership. However, this has been consistently denied by those in No 10. They also said the stream of coordinated announcements over the last few days bore the hallmarks of Crosby and his allies, particularly Johnson’s attempts to bind himself to his rivals for the leadership, Rishi Sunak and Liz Truss, with a joint op ed and planned trip to Ukraine respectively. As Sue Gray’s report into the partygate scandal dropped on Monday, Johnson had already lined up competing policy statements with his commitment to continuing with the national insurance rise on Sunday, a visit to Ukraine to showcase his international credentials on Tuesday and his long-awaited levelling up white paper on Wednesday. Downing Street sources claimed these were all in the offing for some time and any timing alongside the Gray report was coincidental. Crosby is also renowned for the “dead cat” strategy, where politicians try to change the national conversation from one scandal to another eye-catching talking point, however negative. Although the strategist is not expected to begin his work with No 10 for some weeks, Johnson appeared to have adopted such a distraction tactic in the Commons on Monday, as he made a false claim that Keir Starmer, the Labour leader, failed to prosecute paedophile Jimmy Savile while director of public prosecutions. This then took up air time on Tuesday, even though the prime minister was being heavily criticised from some on his own side over the comments. Alongside Johnson’s effort to renew his focus on policy, he is expected to shake up his team in the days and weeks ahead. Following the Gray report he announced that he would create a new “office of the prime minister” to make No 10 more of an official government department with clearer oversight and accountability. But there are reservations among some of his critics and even some in cabinet that this could actually centralise power for the prime minister. There is also scepticism about his idea of creating backbench “policy boards” to allow Tory MPs to feel heard and that they are contributing. It is understood Graham Brady, the 1922 chair, has a role in putting forward names to chair these boards, but one Tory MP said it was a “tired idea” that many prime ministers reach for when trying to appease their backbenchers. Another senior Conservative MP who believes Johnson should go but has not yet put in a letter said changes to staffing and advice would not help when the prime minister himself is the problem. “What happens when more about the Jennifer Arcuri stuff comes out? What happens when more about the PPE scandal comes out? There will always be another problem.”",News/Politics,‘Wizard of Oz’: Tory MPs cheered by hopes of Lynton Crosby’s return,https://www.theguardian.com/politics/2022/feb/01/tory-mps-cheered-by-hopes-of-lynton-crosby-return
