2/11/2022,"Cattle from a small south-east Michigan farm that sold beef to schools and at farmers’ markets in the state have been found to contain dangerous levels of PFAS, so-called “forever chemicals” that can pose a serious risk to human health. The news comes after consumer groups in 2019 warned that using PFAS-laden sewage sludge as fertilizer would contaminate dairy, beef, crops and other food products. However, at the time a Michigan agricultural regulator publicly assured the state’s dairy farmers her agency wouldn’t test milk for the toxic chemicals as they didn’t want to inflict economic pain on the $15bn industry, she said.  Now just over two years later, consumer groups say their fears may have come true. Michigan discovered the contamination because it tests sewage sludge for PFAS more than any other state, but officials have downplayed the incident as “isolated” and for now won’t conduct further testing on livestock, dairy or crops. “It’s not enough – we need a lot more monitoring of our agriculture to make sure we’re keeping toxic chemicals out of our food supply,” said Christy McGillivray, executive director of Sierra Club of Michigan. Sludge isn’t the only route PFAS takes into the nation’s food. It’s also found in pesticides, rain, packaging and water used on crops, and testing is increasingly finding the chemicals in vegetables, seafood, meat, dairy and processed foods. Consumer groups say regulators are failing to keep the dangerous compounds out of food, a problem highlighted by the Michigan contamination. PFAS, or per- and polyfluoroalkyl substances, are a class of over 9,000 compounds that are used to make products heat, water and stain resistant. They are dubbed “forever chemicals” because they don’t naturally break down, and they are so effective that they are used in thousands of products across dozens of industries. The chemicals are also linked to a range of serious health problems like cancer, liver disease, kidney issues, high cholesterol, birth defects and decreased immunity. Still, the US Department of Agriculture has largely been absent from the PFAS discussion while the US Food And Drug Administration hasn’t yet established health limits for food. The agency only conducts limited annual testing and recently adjusted its methodology so it will only catch what consumer groups say are extremely high contamination levels, and ignore relatively low to moderate levels that can still pose a health risk. In 2019, the FDA initially found 182 food samples to be contaminated with PFAS, but, after changing its methodology part way through the study, that figure dropped to 78, drawing accusations that it was intentionally covering up contamination. “Imagine using a radar gun to detect speeding in cars, but then manipulating the radar so that it only detects speeding in cars going over 100mph,” wrote Brian Ronholm, a former deputy under secretary of food safety at the US Department of Agriculture, in Consumer Reports after the FDA announced the change. Meanwhile, the FDA allows short-chain PFAS to be used in food packaging despite a growing body of evidence that the chemicals bioaccumulate, leach into food and are toxic at very low levels. Though health limits for PFAS in water have been dropping in recent years, the FDA seems to be allowing relatively high levels in food, and the agency “hasn’t really explained why they don’t have any concerns”, said Maricel Maffini, an independent food safety scientist who has petitioned the FDA to restrict PFAS in food packaging. “There’s a health risk in water at very, very small levels of exposure, so why would food be different?” she asked. “The FDA could be doing a lot more.” Meanwhile, sewage sludge is regulated by the Environmental Protection Agency (EPA), which allows the substance to be spread even as it investigates potential health risks. Wastewater treatment plants clean sewer system water, and sludge is the process’s semi-solid byproduct. It’s expensive to dispose of, and about 60% of it is now lightly treated and sold or given away as “biosolid” fertilizer because it’s high in plant nutrients. Consumer groups note sludge can also contain any of 90,000 manmade chemicals discharged into sewers, and the Sierra Club has characterized it as “the most pollutant-rich manmade substance on Earth”. In a scathing 2018 report the EPA office of inspector general wrote that the EPA couldn’t properly regulate biosolids because “it lacked the data or risk assessment tools needed to make a determination on the safety of 352 pollutants” that the office found in sludge samples. PFAS is the chemical in sludge getting the most attention, and Michigan’s biosolid program, run by the department of environment, Great Lakes and energy (EGLE), requires wastewater treatment plants to monitor for one type of PFAS. The agency has also identified dozens of PFAS polluters and required them to stop discharging the chemicals, and prohibits highly contaminated sludge from being spread. But questions remain about whether that’s enough to keep PFAS out of the food supply. Instead of implementing a wide-scale program to test livestock, crops and dairy for the chemicals, state agencies identified 13 farm fields considered most at risk for high levels of PFAS contamination, then checked nearby soil, surface water and groundwater for the compounds. State officials say the beef incident is isolated because the farm received some of the state’s most contaminated sludge, and because of its allegedly unique farming practices – the cows were fed on contaminated crops grown on the farm. But consumer groups say the limited testing process leaves huge blind spots, and is guided by arbitrary health risk standards. All biosolids contain PFAS, and EGLE considers sludge with less than 150 parts per billion (ppb) of PFAS to be safe to spread on farmland. But no one knows if sludge with less than 150 ppb of PFAS is safe to use. A spokesperson said the agency is waiting on the EPA to develop health risk standards, and called EGLE’s biosolids program “a good interim step”. Moreover, state regulators only have the authority to regulate PFAS in sludge, but thousands more types of PFAS exist, evidence suggests the entire chemical class poses health risks, and PFAS levels in sludge are likely much higher when other compounds are included. The state also relies on industry to self report and must get farmers’ permission to test cows. Already some farmers with high levels of the chemical in soil and water around their fields won’t let EGLE test cows. McGillivray said Sierra Club Michigan is calling on the state to prohibit the use of biosolids as a fertilizer, establish health risk standards, compensate farmers who are impacted, and hold chemical companies and polluters accountable. Ultimately, the incident is more evidence that PFAS need to be banned, she added. “The companies that make them have not had to show that they are safe, and instead the public has to show that harm has been caused, and that leads to rolling public health crises like this one with PFAS,” McGillivray said.",News/Environment,Michigan beef found to contain dangerous levels of ‘forever chemicals’,https://www.theguardian.com/environment/2022/feb/11/michigan-beef-dangerous-levels-forever-chemicals
2/11/2022,"To date, more than 48 million people in the UK (that’s 84% of over 12s) have now received their first and second Covid-19 vaccination doses, with more than 37 million receiving their “booster” or third dose too. The latest data from the UK Health Security Agency shows shortly after getting a booster, you are 85% less likely to end up in hospital than if you are unvaccinated. According to the Office for National Statistics, more than nine in 10 adults in the UK currently have coronavirus antibodies, either due to a past Covid infection or thanks to receiving the vaccine. But some still remain hesitant to receive their vaccination, citing reasons such as fear of potential side-effects and concerns over the speed of the vaccine’s creation, as well as practical barriers such as physical and mental health conditions making appointments difficult. Merchandising administrator and dancer, Camila Lopez-Pulido, 26, from London, fell into the vaccine hesitant camp, initially unsure about taking up the vaccine. “There were a number of reasons I was hesitant about getting vaccinated, but I think primarily it was the uncertainty of the whole situation,” she says. “To create a vaccine in such a short amount of time and to know so little about it – that was worrying to me. I was unsure, thinking: ‘How do I know this isn’t going to affect me in a year, or five years’ time?’ I felt we didn’t know enough about the vaccines and that worried me if I’m honest.”  Uncertainty over the right thing to do meant Lopez-Pulido held off booking her vaccination appointment. “I’d been receiving NHS text messages asking me to book my vaccine since July 2021, but I kept putting it off,” she says. The situation proved stressful, made worse by conflicting views within her friendship group, a situation many others will be familiar with. “There was definitely a split where some friends believed one thing and others believed differently. It was really difficult,” she says. “I think it’s hard to have an open conversation around vaccines without people assuming you think the virus ‘doesn’t exist’ or you’re disregarding the severity of the situation, which I’m absolutely not. I suppose I was just curious because I figured there’s no going back once you’ve had it.” It wasn’t until September [2021], ahead of a holiday to Greece, that she booked her first vaccine appointment. “I figured I’d eventually have to do it and there was no point putting it off any longer,” she says. “I also reasoned that I’m an occasional drinker and social smoker and I’ve had plenty of other vaccinations before, including when pregnant. If I’m honest, I didn’t do my research back then or really know what was being done to my body at that point, so why was I assuming the worst now, why not take the vaccine? It seemed silly,” she says. An awareness for those around her also played a part in her decision. “I’m pretty convinced that before I got vaccinated, I had already contracted Covid-19 so I’m very lucky to be healthy. My family and I weren’t affected by the pandemic health wise like many other families have been, thankfully. So while I felt relieved to be getting vaccinated, it wasn’t necessarily in terms of my own health – more in terms of people like my mother, because she’s older so could have underlying health issues.” Much to Lopez-Pulido’s relief, the vaccination itself was simple, without side-effects or complications. “The vaccine didn’t affect me in terms of my health – so far, everything has been pretty normal and I haven’t felt any different or experienced symptoms really. Even straight after the injection, I had a sore arm and that was it. I didn’t get a bad cold or a temperature at all, so I guess that was my biggest relief.” There was another major benefit too, she says. “I have two children: Kiara, aged seven, and Jacob, who is four years old, and I’d planned to take them to Disneyland Paris pretty much their entire lives. When we went as a family in November, the fact I was vaccinated made it so much easier. It was very much like ‘take out your NHS passes and your vaccination certificates’ everywhere we went. I was so incredibly relieved, thinking: ‘Gosh, imagine if I wasn’t vaccinated – we wouldn’t be able to have done this.’ I definitely felt much more at ease knowing I could live my life again, really.” My son Max was born in July 2021 and throughout my pregnancy, I was pretty anxious and uncertain over whether or not to get vaccinated. Months of deliberation meant I waited until May [2021], two months before Max was born via C-section, to have my first dose. I was able to squeeze in the second dose a few weeks before giving birth, getting my booster in December after he was born. Throughout my pregnancy, I felt conflicted about the vaccination because it felt like there was a lack of information available about the vaccine’s safety during pregnancy. I was also aware that being pregnant and having an autoimmune condition could make me more susceptible to serious illness or other complications if I were to contract Covid-19. It meant I spent a lot of time researching studies, as well as speaking to my hospital consultant, midwife and GP, asking for advice around what to do. Unfortunately, I found nobody wanted to give specific recommendations. As a first-time mum, you’re especially nervous, which meant all the uncertainty around the vaccine definitely added to the fear and paranoia. There were so many horror stories that it was difficult to know what to believe, or what to choose. My partner was supportive and said he was behind me, whatever I chose to do. I think the turning point for me came after speaking to my GP, who was seven months pregnant herself. She explained that she’d gotten the vaccine because she was seeing patients regularly and felt it was the best decision, so that really reassured me. Because Max was due to be born by C-section, I also knew that could make me more prone to infection, so that was another reason to get the vaccine. Looking back, I’m really relieved I got vaccinated when I did. I’ve since heard of friends of friends who contracted Covid-19 while having their baby in hospital and it sounds incredibly stressful being isolated at such a vulnerable time. I knew getting the virus would add another huge layer of stress, whereas I actually felt quite relaxed going into hospital to have Max, without the worry of contracting it or potentially passing it on to someone else. Even the thought of having a cold when pregnant or with a newborn was awful – the reality of catching Covid-19 would have been really hideous. I think, ultimately, the risk of catching the virus while pregnant – and being in intensive care or having a premature labour – outweighed any potential vaccine consequences that might realistically never have even come to light. I suppose it was measuring up the theoretical consequences with a genuine, real risk. Thankfully, Max was born with no complications either – and I’m pleased to say, very happy and healthy indeed. Pregnant women who get symptomatic Covid-19 infection are up to three times more likely to give birth to their baby prematurely. More than 96% of pregnant women admitted to hospital with Covid-19 symptoms between May and October 2021 were unvaccinated. Around one in five women who are hospitalised with the virus need to deliver preterm to help them recover. Get your booster in England now by visiting nhs.uk/covidvaccination. If you’re in Scotland, visit nhsinform.scot/covid-19-vaccine, for Wales, visit gov.wales/get-your-covid-19-vaccination and for Northern Ireland, visit covid-19.hscni.net/get-vaccinated This advertiser content was paid for by the UK government. All together (“Get boosted now”) is a government-backed initiative tasked with informing the UK about the Covid-19 pandemic. For more information, visit gov.uk/coronavirus",All together,‘It’s not just my own health’: why the vaccine-hesitant are changing their minds,https://www.theguardian.com/all-in-all-together/2022/feb/11/its-not-just-my-own-health-why-the-vaccine-hesitant-are-changing-their-minds
2/11/2022,"That the props department had to source a giant birthday cake, a pink flamingo inflatable swimming ring and several luminous green hula hoops for this production should tell you everything you need to know about the reverence in which the source material is held. Director Anthony Lau, using a celebrated 1992 adaptation by Helen Edmundson, shows almost no respect for the milieu of Tolstoy’s epic masterpiece, and in thumbing his nose at the weighty reputation of the Russian’s magnum opus activates the story to create a production that is thrilling and utterly compelling.  It is all built around an absorbing performance from Adelle Leoncé as the eponymous heroine. She goes through the wringer over the course of the three-hour piece, leaving everything on the stage. Around her, Lau makes some seriously bold choices. The costumes and staging are Baz Luhrmann-esque; indeed one scene that descends from Russian aristocratic ball to all-out disco could slip into any of the films in the Australian director’s red curtain trilogy. Edmundson’s smartly economical storytelling has Anna and Konstantin Levin, played here by the highly watchable Dougie McMeekin, asking each other “‘where are you now?”. Standing on an empty stage Anna can tell him “I’m on a train heading for Moscow” or “I’m in an Italian town in an old, shabby palazzo” and so she is and with her we go. Lau takes Edmundson’s economy and adds buckets full of irreverence. A day at the races becomes seriously racy as Anna gives into her animal urges with lover Count Vrosnky in a highly erotic seduction scene. A visit to Princess Betsy and one of her infamous parties is a hilariously postmodern, shot-drinking, bacchanalian affair. Leoncé’s Anna is a woman apart in several ways, the acting around her all nods and winks and slightly outside the action while she is entirely immersed in it. The angels of death who occasionally stalk the stage, looking like steampunk slaughtermen, lend an air of menace to a production that sees design and direction in perfect symbiosis. This is a spectacle in every sense. The purists? Let them eat giant birthday cake. At the Crucible, Sheffield, until 26 February.",Arts/Stage,Anna Karenina review – Tolstoy meets Baz Luhrmann in a magnificent spectacle,https://www.theguardian.com/stage/2022/feb/11/anna-karenina-review-tolstoy-meets-baz-luhrmann-in-a-magnificent-spectacle
2/11/2022,"The stability of the Indo-Pacific will also be in danger if Russia is allowed to threaten Ukraine with impunity, the US secretary of state has warned during a visit to Australia. Antony Blinken said on Friday there were “very troubling signs of Russian escalation”, adding: “We’re in a window when an invasion could begin at any time – and to be clear, that includes during the Olympics.”  He said the US would continue to draw down its embassy in Kyiv and reiterated calls for any American citizens who remain in Ukraine to leave immediately, following Joe Biden’s comment that “things could go crazy quickly”. After joining with his Australian, Indian and Japanese counterparts for a meeting of the Quad in Melbourne, Blinken made the case that allowing Russia to further invade Ukraine would have far wider consequences and could embolden other countries, such as China, to pursue military aggression. Russia, he said, was challenging the principles that “one country can’t simply change the borders of another by force” or “dictate to another its choices, its policies, with whom it will associate”. “If we allow those principles to be challenged with impunity, even if it’s half the world away in Europe, that will have an impact here as well – others are watching,” Blinken told reporters. “Others are looking to all of us to see how we respond. So that’s why it’s so important that we have this solidarity: that we do everything possible, through diplomacy, to try to avert a conflict and prevent aggression – but equally, to be resolute if Russia renews its aggression.” Russia has accused the west of ignoring its requests for security guarantees, including an assurance that Ukraine never join Nato. Blinken was in Melbourne for a meeting with foreign ministers of the Quad, an increasingly active diplomatic grouping that is viewed warily by China, which sees it as an effort to contain its influence. The meeting comes a week after China’s Xi Jinping and Vladimir Putin of Russia signed a joint statement calling on the west to “abandon the ideologised approaches of the cold war”, as the two leaders showcased their warming relationship in Beijing at the start of the Winter Olympics. This so-called “no limits” agreement was one of the developments discussed at Friday’s meeting of the Quad foreign ministers. The Australian foreign minister, Marise Payne, said Russia and China’s agreement was “concerning because it doesn’t represent a global order that squares with those ambitions for freedom and openness and sovereignty and the protection of territorial integrity”. Speaking at a joint news conference with her Quad counterparts, Payne said rules and norms were “under pressure, in particular from authoritarian regimes”. “Australia, in our actions, works to support a world order that favours freedom – where rules, not power and coercion, resolve disputes,” she said. Payne reiterated Australia’s “strong support for Ukraine sovereignty and territorial integrity” and signalled Australia was ready to join an international sanctions package targeted at Russia. Australia, she said, would “continue to support our allies and partners to deter this sort of aggression and to raise the costs of this kind of behaviour”. Japan’s foreign minister, Yoshimasa Hayashi, said his country would continue to collaborate with the international community and “take appropriate responses”. Friday’s meeting was productive, said India’s minister of external affairs, Dr S. Jaishankar. He said the Quad had a positive agenda, including on vaccine distribution. He said the Quad stood “for something, not against somebody”. The joint statement issued by the Quad foreign ministers did not directly name China, but stressed “the importance of adherence to international law” to meet “challenges to the maritime rules-based order, including in the South and East China Seas” – where China is engaged in territorial disputes. Clearly alluding to China, the statement also said the Quad countries “oppose coercive economic policies and practices that run counter to this system and will work collectively to foster global economic resilience against such actions”. The Quad would support neighbours in the Indo-Pacific region to “build resilience and counter disinformation”, it said. It would also assist countries in the region “to address the growing threat of ransomware, by strengthening capacity building to ensure resilient cyber security and to counter cybercrime”. A year after the military coup in Myanmar, the foreign ministers said they were “gravely” concerned about the crisis in the south-east Asian country. They called for “an end to violence, the release of all those arbitrarily detained, including foreigners, and unhindered humanitarian access”. The group also condemned North Korea for its “destabilising ballistic missile launches in violation of UN Security Council resolutions”. Earlier, the Australian prime minister, Scott Morrison, met with the visiting foreign ministers and said he appreciated their support as Australia weathered “coercion and pressure” from China. “We live in a very fragile, fragmented and contested world, and that is no more accentuated than here in our Indo-Pacific,” Morrison told the earlier meeting. Blinken said a confrontation with China was not inevitable, but “we share concerns that in recent years China has been acting more aggressively, a whole lot more aggressively in the region, and, indeed, potentially beyond”.",News/World news,"Russian aggression towards Ukraine could jeopardise Indo-Pacific stability, says US after Quad meeting",https://www.theguardian.com/world/2022/feb/11/russian-aggression-towards-ukraine-could-jeopardise-indo-pacific-stability-says-us-after-quad-meeting
