1/21/2022,"More than a dozen aid organisations have called for humanitarian exemptions to heavy sanctions imposed on Mali after the military leadership postponed planned February elections. The EU has announced support for the sanctions imposed earlier this month by the Economic Community of West African States (Ecowas), which include closing borders and a trade embargo.  But this week, 13 international groups working in Mali warned of devastating consequences for the population, a third of whom rely on aid. Humanitarian access is hindered by the Malian interim authorities’ decision to reciprocate border closures with Ecowas member states, except Guinea. Thousands of people demonstrated against the sanctions last week in the capital Bamako, carrying placards saying “down with Ecowas” and “down with France”. The country is in the grip of the worst food insecurity in 10 years. A joint letter signed by the NGOs, including the International Rescue Committee (IRC), Care and the Norwegian Refugee Council, said: “To continue their work effectively, humanitarian actors must have unfettered access for the transportation of life-saving goods including food and medicine, as well as guarantees that they can transfer funds into the country without violating the sanctions.” Mali’s current insecurity dates back to early 2012 when northern separatists rebelled against the government. Islamist militants that initially allied with the separatists, including Ansar Dine, al-Qaeda in the Islamic Maghreb (AQIM), and the Movement for Unity and Jihad in West Africa, ultimately hijacked the rebellion. France, the former colonial ruler, made a military intervention in 2013 on the government’s side against the militants. The UN has also deployed an estimated 18,000 peacekeeping staff, in what was called its most dangerous mission. The Malian military, led by Col Assimi Goïta, has conducted two coups in two years and reneged on promises to hold new elections. The junta’s most recent power grab, in May 2021, was the fifth coup since Mali’s independence in 1960 and it has been unwilling to commit to transition to civilian rule, despite international pressures. Postponement of elections has been blamed on Islamist insecurity, an impasse that has deepened with the arrival of private military contractors belonging to the Russian mercenary firm Wagner Group. European states have condemned Wagner’s presence, concerned it will enable the military to hold on to power. EU foreign policy chief Josep Borrell said this month that EU sanctions on Mali were in part in response to the involvement of Russian contractors. France is withdrawing troops, but 14 other EU members, led by Sweden, had established a taskforce to replace them in a three-year mandate. As tensions intensified over the Wagner Group, Sweden said last week that it had decided to withdraw its troops. France, which holds the rotating EU presidency, has been vociferous in its support of sanctions but Russia and China have blocked the UN security council’s move to follow suit. Ecowas has frozen financial aid and Malian assets at the Central Bank of West African States. Elena Vicario, director for the Norwegian Refugee Council in Mali, said: “Malians are already bearing the brunt of the humanitarian catastrophe, punctuated by horrifying attacks against civilians. Sanctions must not hold us back from delivering essential assistance in a country where drought, rising insecurity, and the economic impacts of Covid-19 are already pushing millions of Malians over the edge.” Franck Vannetelle, the IRC’s country director in Mali, echoed Vicario, saying: “Despite more than a third of the country’s population being dependent on humanitarian aid, organisations working in Mali already face severe access constraints. It’s imperative that the international community keeps responding to people’s urgent needs, and that any new sanctions have concrete humanitarian exemptions. These must be monitored and implemented, or the most vulnerable people in Mali will pay the price.”",News/Global development,"Vulnerable Malians could ‘pay the price’ of heavy sanctions, warn aid groups",https://www.theguardian.com/global-development/2022/jan/21/vulnerable-malians-could-pay-the-price-of-heavy-sanctions-warn-aid-groups
1/21/2022,"Is a Great Easing under way? Superficially, it seems not. In New York, everyone is still masked. Teachers send kids home with Covid test kits at the slightest symptom and advise them to stay away until they have two negative results in the bag. In Chicago, the schools shut down for a week then reopened, while Eric Adams, the mayor of New York, freaked everyone out last Friday by making ominous noises about potential school shutdowns in the city.  At the same time, the numbers are nose-diving. This week, daily reported cases in New York were 49% lower than two weeks ago. At the weekend we went to a party for a kid turning seven. It was modest in scope: as well as the birthday girl, just three other kids and their parents, all vaccinated including the children. It wasn’t in a freezing park. We weren’t muffled in masks. It was in an apartment, with pizza, cake, wine and chat of a kind most of us have had with only the closest family and friends for two years. I used to dread kids’ parties, but all week I looked forward to it like a golden-ticketed event. It didn’t disappoint. The party started at 2pm and at 7pm we were still there, sitting on sofas, talking to one another while the kids played with no need for our input. It was an odd thing, to derive such pleasure from something that used to be a chore, while being reminded of the thrill of new people. By the end of the evening, the adults were so high on the novelty of interacting in comfort, we decided to do it all over again in a few weekends’ time. We lost our heads and wondered if, during the forthcoming week-long winter break, we might save ourselves hundreds in camp fees and rotate to each take the kids for a day. We stopped short of devising plans to sell our apartments and embark on a commune, but for a hot second, standing outside the apartment building afterwards, it seemed as if Covid had given birth to a brave new world, beckoning us over the horizon. How is Donald Trump not in jail? This is the kind of thought that I’ve enjoyed not having for a year and that resurfaced on Tuesday night after watching Four Hours at the Capitol, the very good HBO documentary about the 6 January insurrection. This week the net closed a little tighter on Trump as the congressional inquiry into last year’s attack on the Capitol requested testimony from Ivanka Trump. Meanwhile, the supreme court turned down Trump’s request to block a release to the committee of White House records. In this context, the documentary was mindblowing. Like a lot of people, when Trump supporters stormed the Capitol and attacked police last year, I avoided absorbing too much of the footage for reasons of self-preservation. I couldn’t take any more of him or his people, or what they were doing to American democracy. To see it clearly now, for the first time, was a shock. One forgets how blatantly Trump fomented the trouble, urging his supporters to march on the Capitol, then refusing to call them off when they breached the boundaries. To hear the then president address people who had just broken into Congress in the gentlest, most encouraging terms – “you had an election that was stolen, but you have to go home now,” followed by “we love you, you’re very special, go home” – was staggering. More shocking was the passivity of the police. One felt for them, massively outnumbered and with Trump failing to call out the national guard. Watching the documentary, however, it was impossible to imagine rioters who weren’t white and rightwing being greeted with a failure to draw their weapons. The privilege of white male rioters shouting “you work for us” at the cops, and the tones in which some of the police replied – “is there any chance I could get you guys to leave the Senate wing?” says one officer – are extraordinary. At the time, there was much discussion about whether the Trump supporters were a well-organised force or a bunch of easily led jokers. A photographer for the New York Times who followed them into the Capitol that day said it best: “There are some people here who are fucking around and playing dress-up, and there are some people here who are not fucking around.” When the mob itself is the weapon, it takes both types for an insurrection. Clinging to the vapours of my January self-improvement drive, I cook a massive tray of brussels sprouts, to the dismay of other residents on my hallway. Something has happened to sprouts since I was a kid. It’s not only improved cooking methods, although there is that. My mother, who hated the English for, among other things, overcooking their vegetables, never overcooked a sprout in her life, but she did boil them and god they tasted bad. Metallic, with a bitter aftertaste. Obviously, I roast mine. Anyway, it’s not changing palates or faulty memory, either. If you look into it, seed companies in the Netherlands in the 1990s investigated what gave sprouts that bitter taste and invested in new seed varieties with lower amounts of glucosinolates. Now these babies are the types most often sold in supermarkets and if cooked right they’re absurdly delicious: crisp, nutty, sweet. “Here,” I say to a passing child, “try one, it tastes like candy.” (She ignores me.) The failure of American Vogue’s Twitter feed to respond in a timely fashion to the death of André Leon Talley, style icon and former Vogue editor, struck many on the platform as a deliberate slight. Leon Talley, who fell out with Anna Wintour towards the end of his tenure at the magazine and spent the last years of his life talking bitterly and with justification about racism at Vogue, died on Tuesday at the age of 73, a fact it took his former employers until the next day to acknowledge. Talley was, in lots of ways, the antithesis to the Condé Nast fashion plate: loud, voluble, expansive, and for all his history of difficulty with food, able to enjoy a large lunch. He took up space in a crowd otherwise committed to an instinctive shrinking inwards and away from joy. My kids are off school with suspected Covid, again. As we wait for the second test result, 24 hours after the first (negative), I fight off flashbacks to the home-schooling months of 2020. I’m not good at hiding my impatience, or dismay. “Do what you like, but I’m not entertaining or educating you,” I say, and retreat to my room to do a Wordle. They repair to their iPads for a solid day of Roblox and Henry Danger. After the last year and a half, it’s a miracle either of them can read.",News/UK news,Digested week: a children’s party in New York felt like a golden-ticketed event,https://www.theguardian.com/uk-news/2022/jan/21/digested-week-childrens-party-new-york-golden-ticketed-event-covid
1/21/2022,"Can Eddie Howe choreograph Newcastle’s second win of the season before their flight to Saudi Arabia for a warm weather training camp on the Red Sea coast near Jeddah on Sunday? It will not be easy, particularly as Marcelo Bielsa knows victory would go a long way towards helping banish Leeds’ own, albeit latterly receding, relegation fears. A key sub-plot could involve a duel between Raphinha and Newcastle’s underrated left-back Paul Dummett who impressed against Watford last Saturday, following his return from a long-term injury. Louise Taylor Saturday 3pm  Venue Elland Road Last season Leeds 5 Newcastle 2 Referee Chris Kavanagh This season G9 Y38 R2 4.44 cards/game Odds H Evens A 3-1 D 5-2 Subs from Klaesson, Bate, Gelhardt, Roberts, Rodrigo, McKinstry, Jenkins, Moore, Kenneh, Gray Doubtful Gelhardt (ankle) Injured Shackleton (calf, Feb), Forshaw (thigh, Feb), Cresswell (shoulder, three weeks), Cooper (hamstring, Mar), Phillips (hamstring, Mar), Firpo (hamstring, unknown), Bamford (ankle/foot, unknown) Suspended None Discipline Y54 R1 Form DLLLWW Leading scorer Raphinha 8 Subs from Darlow, Lewis, Manquillo, Clark, Gayle, Willock, Hendrick, Almirón, Murphy, Krafth, Ritchie Doubtful Ritchie (knee), Clark (illness) Injured Fernández (thigh, Feb), Hayden (knee, April), Wilson (Calf, Mar) Suspended None Discipline Y51 R2 Form WLLLDD Leading scorer Wilson 6",Sport/Football,Leeds v Newcastle: match preview,https://www.theguardian.com/football/2022/jan/21/leeds-newcastle-match-preview-premier-league
1/21/2022,"Thomas Tuchel seemed to have all the right answers a year ago. In fact, the only time he was unsure about how to respond was when Chelsea approached him about replacing Frank Lampard. After all, Tuchel had just experienced a bitter split with Paris Saint-Germain and the thought of going to Chelsea did not immediately appear to be the wisest move. Questions had to be answered. What if Tuchel found life at Stamford Bridge just as draining as at PSG? Would he ever want to work at a top club again? Or would he decide that he no longer needed to handle star egos and demanding executives?  As discussions with Chelsea progressed, though, Tuchel came round to the idea. The powerful director Marina Granovskaia did not listen when the German asked whether she really wanted to fire a club legend. Lampard was gone and Tuchel, who had built a rapport with the club’s technical and performance adviser, Petr Cech, was in. The pressure was on. Chelsea had slipped to ninth and the dressing room was an unhappy place. Tuchel focused on restoring harmony, introduced greater tactical nous and, although Chelsea limped into fourth place and lost the FA Cup final to Leicester, the season ended on a high when Manchester City were defeated in the Champions League final. By then Tuchel could do no wrong. He outsmarted Pep Guardiola in Porto and, having signed on an initial 18-month deal, triggered a clause stating that he would receive another two years if he won the Champions League or Premier League. Tuchel, who met Roman Abramovich the morning after beating City, was content. He had embraced the culture at Chelsea, who left him to focus on coaching, and he could trust Granovskaia and Cech not to interfere. Managing upwards was not a problem for Tuchel, who had learned from clashing with his bosses at PSG and Borussia Dortmund, and it seemed that Chelsea were ready to challenge City’s domestic supremacy. Now, though, the notion of Chelsea overtaking City feels improbable. The European champions lie 12 points behind Guardiola’s side and Tuchel was downbeat during his side’s 1-1 draw with Brighton last Wednesday. It is hard not to wonder whether this is the start of a gradual decline. Chelsea have won four of their past 13 league games before hosting Tottenham on Sunday and although the squad is behind Tuchel, problems have cropped up. There is no sign of Antonio Rüdiger, César Azpilicueta and Andreas Christensen extending before their deals run out this summer and Romelu Lukaku’s £97.5m move from Internazionale has not worked out. Hailed as the final piece in the jigsaw, Lukaku mostly looks out of place. The Belgian’s body language was poor against Brighton – his argument with the increasingly unsettled Hakim Ziyech at half-time was revealing – and his controversial interview with Sky Italia remains a source of tension. It felt pointed when Tuchel criticised Lukaku after Chelsea’s defeat by City last weekend. Yet was it a risk? Player power has been a recurring theme during the Abramovich era and Tuchel must know that it would be easier for the club to side with their record signing. Yet it would be absurd to ponder parting with Tuchel. He has made mistakes – he could have rotated more, his approach in both games against City was too passive and he has not got the best out of Lukaku – but they are not terminal. Covid absentees, a draining fixture list and injuries have played a part. N’Golo Kanté has struggled to stay fit and it is not making excuses to point out that Chelsea are not the same without Ben Chilwell and Reece James, their first-choice wing-backs. Part of this is self-inflicted. Last summer Tuchel wanted a right-sided defender, but Chelsea could not agree a fee with Sevilla for Jules Koundé. Now the 32-year-old Azpilicueta is filling in for the hamstrung James at right wing-back when there could have been an opening for Tariq Lamptey or Tino Livramento, two gifted academy products. It is a worrying trend. Livramento has flourished at Southampton and Lamptey has been a revelation at Brighton, but neither youngster saw a pathway at Chelsea. The feeling is that the squad still contains too many players whose time has gone. For instance, it is no surprise that Alonso has not been as dynamic as Chilwell on the left. The 31-year-old has never been quick. He should have been moved on a while ago and yet, with Lyon reluctant to release Emerson Palmieri from his loan, the only alternative to the Spaniard is Kenedy after his return from Flamengo. Is Kenedy, who has not played for Chelsea since 2018, the solution? Clearly not, yet he is not the only player whose presence raises an eyebrow. Why, for example, is Ross Barkley still around? Is Saúl Ñíguez, who has struggled since joining on loan from Atlético Madrid, more use in midfield than Billy Gilmour or Conor Gallagher? There has to be more regeneration. This squad has been put together by six permanent managers: Roberto Di Matteo, José Mourinho, Antonio Conte, Maurizio Sarri, Frank Lampard and Tuchel. There is no clear playing identity and although a ruthless streak has brought Chelsea plenty of trophies, that approach is beginning to look outdated when City ensure that everything runs smoothly under Guardiola and Liverpool are built in Jürgen Klopp’s image. Chelsea, who have not challenged for the title for five years, need a rethink. This season they have won the Super Cup and could win the Club World Cup and Carabao Cup next month, but that is not enough. The hierarchy must look inward and ask whether they would have given Klopp five years to win a title, or allowed Guardiola to keep building after winning nothing in his first season in England. The difference is stark. City are not significantly richer than Chelsea, but their operation is calmer. They prepared for Guardiola’s arrival, have a clear style and know how to win titles. By contrast Tuchel arrived mid-season and is playing catch-up with Klopp and Guardiola. Admittedly Tuchel’s squad is hugely expensive. He has Lukaku, Christian Pulisic, Ziyech, Callum Hudson-Odoi, Timo Werner, Mason Mount and Kai Havertz in attack, but Chelsea remain blunt. The front players have not improved under Tuchel. This time last year, though, Lampard was talking about how Chelsea no longer had “goal or assist machines” such as Diego Costa and Eden Hazard. The attack feels thrown together. Lampard said that Chelsea were not ready to win the league and not much has changed. It should give Chelsea pause for thought. Cech and Granovskaia worked with Tuchel when Lukaku stepped out of line, but more is required. By repeatedly letting underperforming players off the hook and adhering to a cycle of hiring and firing, Chelsea have become a cup team. It is too volatile and, while there will always be enough talent for a clever coach to make an instant impact, Tuchel’s one-year anniversary next Wednesday should prompt Chelsea to consider why they are behind City. It is not about money, it is about culture, and Chelsea need to let Tuchel create a new one if they want to win the league.",Sport/Football,A year of Thomas Tuchel: Chelsea remain a cup club in need of new culture,https://www.theguardian.com/football/2022/jan/21/a-year-of-thomas-tuchel-chelsea-remain-a-cup-club-in-need-of-new-culture
1/21/2022,"The boss of BrewDog has been accused of trying to intimidate former staff who are due to appear in a critical documentary that will shine a light on the beer brand’s workplace culture. The self-styled “punk” brewery, which is targeting an eventual £2bn stock market float, apologised last year after current and former employees signed an open letter alleging a “culture of fear” in which workers were bullied and “treated like objects”.  Some of the allegations will be revisited in a BBC documentary, Disclosure: The Truth About BrewDog, due to air on Monday evening. But in fresh posts on BrewDog’s “Equity for Punks” forum, the company’s chief executive, James Watt, appeared to attempt to warn sources who gave evidence to the BBC that their identities could be exposed. In the forum, which is seen by investors and some staff, he said: “All of this is very, very likely to end up in court.” He said the BBC “will likely have told sources that their identity will remain anonymous”. But he said anonymity “can never be guaranteed” and a court could order the BBC to name former staff who contributed to the programme. “If anyone is in any way concerned by this, it is not too late to withdraw your consent,” he said. A spokesperson for the Unite trade union criticised Watt’s comments. “Any attempt to intimidate current and former workers taking a stand on systemic mistreatment will not be tolerated,” said Bryan Simpson, an industrial organiser for Unite Hospitality. “We will represent all Unite members fully against efforts by a multimillionaire to silence them.” Watt said: “We … know false information has been given to the BBC, which if broadcast would be highly defamatory. BrewDog fully supports transparency and investigative journalism. However, it must also protect itself from defamatory allegations and will not hesitate to do so.” Last year 61 former workers signed an open letter under the banner “Punks with Purpose”. They alleged that the Scottish brewer’s dizzyingly rapid growth had involved cutting corners on health and safety, espousing values it did not live by, and creating a “toxic” culture that left to staff suffering from mental illness. The company, whose meteoric rise has attracted admiration as well as criticism for its sometimes controversial PR stunts, has since apologised and performed a review of its workplace culture. Watt has repeatedly promised to learn from the experience, while also casting doubt on the integrity of some of the complainants. Disclosure: The Truth About BrewDog is on BBC One Scotland on Monday 24 January at 7pm and will also be on iPlayer.",News/Business,BrewDog boss accused of trying to intimate ex-staff over TV exposé,https://www.theguardian.com/business/2022/jan/21/brewdog-boss-accused-of-trying-to-intimidate-ex-staff-over-tv-expose
