1/21/2022,"Nanoplastic pollution has been detected in polar regions for the first time, indicating that the tiny particles are now pervasive around the world. The nanoparticles are smaller and more toxic than microplastics, which have already been found across the globe, but the impact of both on people’s health is unknown.  Analysis of a core from Greenland’s ice cap showed that nanoplastic contamination has been polluting the remote region for at least 50 years. The researchers were also surprised to find that a quarter of the particles were from vehicle tyres. Nanoparticles are very light and are thought to be blown to Greenland on winds from cities in North America and Asia. The nanoplastics found in sea ice in McMurdo Sound in Antarctica are likely to have been transported by ocean currents to the remote continent. Plastics are part of the cocktail of chemical pollution that pervades the planet, which has passed the safe limit for humanity, scientists reported on Tuesday. Plastic pollution has been found from the summit of Mount Everest to the depths of the oceans. People are known to inadvertently eat and breathe microplastics and another recent study found that the particles cause damage to human cells. Dušan Materić, at Utrecht University in the Netherlands and who led the new research, said: “We detected nanoplastics in the far corners of Earth, both south and north polar regions. Nanoplastics are very toxicologically active compared to, for instance, microplastics, and that’s why this is very important.” The Greenland ice core was 14 metres deep, representing layers of snowfall dating back to 1965. “The surprise for me was not that we detected nanoplastics there, but that we detected it all the way down the core,” said Materić. “So although nanoplastics are considered as a novel pollutant, it has actually been there for decades.” Microplastics had been found in Arctic ice before, but Materić’s team had to develop new detection methods to analyse the much smaller nanoparticles. Previous work had also suggested that dust worn from tyres was likely to be a major source of ocean microplastics and the new research provides real-world evidence. The new study, published in the journal Environmental Research, found 13 nanograms of nanoplastics per millilitre of melted ice in Greenland but four times more in the Antarctic ice. This is probably because the process of forming sea ice concentrates the particles. In Greenland, half the nanoplastics were polyethylene (PE), used in single-use plastic bags and packaging. A quarter were tyre particles and a fifth were polyethylene terephthalate (PET), which is used in drinks bottles and clothing. Half the nanoplastics in the Antarctic ice were PE as well, but polypropylene was the next most common, used for food containers and pipes. No tyre particles were found in Antarctica, which is more distant from populated areas. The researchers took samples only from the centres of the ice cores to avoid contamination, and tested their system with control samples of pure water. Previous studies have found plastic nanoparticles in rivers in the UK, seawater from the North Atlantic and lakes in Siberia, and snow in the Austrian alps. “But we assume the hotspots are continents where people live,” said Materić. The researchers wrote: “Nanoplastics have shown various adverse effects on organisms. Human exposure to nanoplastics can result in cytotoxicity [and] inflammation.” “The most important thing as a researcher is to accurately measure [the pollution] and then assess the situation,” Materić said. “We are in a very early stage to draw conclusions. But it seems that everywhere we have analysed, it is a very big problem. How big? We don’t know yet.” Research is starting to be carried out on the impact of plastic pollution on health and Dr Fay Couceiro is leading a new microplastics group at the University of Portsmouth, UK. One of its first projects is with Portsmouth hospitals university NHS trust and will investigate the presence of microplastics in the lungs of patients with chronic obstructive pulmonary disease (COPD) and asthma. The research will investigate whether recently carpeted or vaccumed rooms, which can have a high number of fibres in the air, trigger the patients’ conditions. “Aside from the environmental damage caused by plastics, there is growing concern about what inhaling and ingesting microplastics is doing to our bodies,” said Couceiro. Her recent research suggested people may be breathing 2,000–7,000 microplastics per day in their homes. Prof Anoop Jivan Chauhan, a respiratory specialist at Portsmouth hospitals university NHS trust, said: “This data is really quite shocking. Potentially we each inhale or swallow up to 1.8m microplastics every year and once in the body, it’s hard to imagine they’re not doing irreversible damage.”",News/Environment,Nanoplastic pollution found at both of Earth’s poles for first time,https://www.theguardian.com/environment/2022/jan/21/nanoplastic-pollution-found-at-both-of-earths-poles-for-first-time
1/21/2022,"1 cop shops C<OPS>HOPS  5 shadow SH<AD>OW 9 tillages AGES by TILL 10 inside IN + SIDE 12 ghostbuster G<HOST/BUST>ER(many) 15 relic softwaRE LICence (hidden) 17 partnered PART/(a)N(g)E(r)/RED 19 easel EASE/L(arge) 20 penultimate PE + UNTIL/TEAM (anag) 24 sponge PONG in S(auc)E 25 cineaste CAN SEE IT (anag) 26 shower S<H(ot)>OWER 27 egotists EG/0/SIT(rev)/(velve)T/(cushion)S 1 categorise CATE(r) + ORGIES (anag) 2 pillow lace L(ine)/ACE under PILLOW 3 heart HE + ART 4 presumptions P(rince) + RESUMPTIONS 6 hindrance RA<N(oon)>CE after HIND 7 drip D<R(iver)>IP 8 weed WEE/D(uke) 11 storytelling S(ucceeded)/TORY/TELLING 13 trespasses TRES(s)/PASSES 14 adulterers READ RESULT (anag) 16,18 champagne socialist LAST CASINO GAME CHIP (anag) 21 ident 1/DENT 22 uses US/(king-siz)E/(cigarette)S 23 Soho S(trippers)/0/HO &Lit ",Lifestyle/Crosswords,"Annotated solutions for Prize 28,655",https://www.theguardian.com/crosswords/2022/jan/21/annotated-solutions-for-prize-28655
1/21/2022," The Memory Monster by Yishai Sarid, translated by Yardenne Greenspan (Serpent’s Tail, £12.99)“This is where the illusion we call humankind was erased,” a guide to Holocaust sites tells the visitors on his tour. He is so steeped in its history that he has become corrupted by the horror, increasingly unable to see good in the world (humans are “worms with aspirations”) and even applying its grim lessons (“it’s all about power, power, power”) to his son’s problems at school. Sarid boldly highlights the risks of “harnessing [ourselves] to the memory chariot” and of how remembrance can calcify our views, in this complex, rewarding story of a man brought low by good intentions. Love in the Big City by Sang Young Park, translated by Anton Hur (Tilted Axis, £9.99)It’s a mark of the generous spirit of the South Korean author’s English-language debut that it made me laugh on the first page. The novel’s loosely autobiographical account of a young gay man losing and finding his way in a conservative society isn’t always so funny, but even bad news is delivered with a spark. “Your mother has cancer! In the uterus! Hallelujah.” Despite the loss of friends, lovers and parents, “the only three things floating around my brain were iced Americano, Kylie Minogue and sex”. Kylie’s name later becomes a euphemism for something darker, and the modulation of tone casts out any initial fear that the novel might just skate across the surface. Land of Snow and Ashes by Petra Rautiainen, translated by David Hackston (Pushkin, £12.99)In 1944 Finland reversed its second world war allegiance to the Nazis following a treaty with Russia. This debut novel is set in part during that shaky period, narrated by a soldier working in a Nazi camp in the northern town of Inari, “at the edge of the earth”. His diary alternates with the story of photographer Inkeri after the war, ostensibly reporting on the loss of the local Sámi culture, but really looking for her husband who went missing in the war. In the 1944 sections, we find out what happened to him. Rautiainen’s prose is occasionally clunky as it makes points about cultural domination (“Photography was about power – a form of manipulation”), but the book reveals so much more about a war we thought we knew that it feels like a potted epic. The Child Who by Jeanne Benameur, translated by Bill Johnston (Les Fugitives, £8.99)A woman has disappeared: the central character in this elliptical novella is no longer there. Her son wanders through the neighbourhood in rural France, imagining a dog for company, singing to scare off loneliness. His father and grandmother are also affected by the silence that has taken the woman’s place. Rather than a plot, the book is driven by reflections on the love between parent and child and between husband and wife. And then there’s a first-person narrator who talks to the child directly: “I’d like to say to you that the world is immense and lovely, that there’s a path for you too.” It adds a sweet overtone to the sadness of this curious and pleasing story. Tropic of Violence by Nathacha Appanah, translated by Geoffrey Strachan (MacLehose, £8.99)This brilliantly vivid novel explores lives and afterlives on the island of Mayotte, a French territory in the Indian Ocean. Central to the story is Moïse, a “wild boy” of 15 abandoned by his mother, adopted by nurse Marie, and then alone again when Marie dies. Mayotte is a “sweet, beautiful country” but Moïse is stuck in its run-down “dump” known locally as Gaza. He falls in with a criminal gang, before killing its leader – and all this in the first 20 pages. The pace is kept lively by multiple narrators, some of whom are dead, but as Moïse – still a child, who all along just wants “someone to fix me a bowl of cereal” – discovers, death is not the end.",Arts/Books,The best recent translated fiction – review roundup,https://www.theguardian.com/books/2022/jan/21/the-best-recent-translated-fiction-review-roundup
1/21/2022,"Imoved into my present apartment seven years ago, and my six crates of papers moved with me – directly from one closet, where they had squatted undisturbed for five years, to another, where the same fate awaited. For almost two decades, these things have followed me around, and I’ve never had the slightest inclination to go through them. Then last week, in a fit of January decluttering fervour, I decided to reclaim my closet. Everything came out into the living room, where it seemed to me an achievable aim to aggregate these six crates down into a single container. I could probably do it in an hour, I thought. Four days later and here I still am: surrounded by papers, trying to weigh the value of a letter from my mother’s then 17-year-old brother to her in 1967, and whether I should keep receipts from my tax return in 1998.  How do people do this? Decide what to keep and what to junk? I come from a long line of hoarders. But, even so, the situation I confront with these six crates is ridiculous. Birthday cards from people I haven’t spoken to in years. Random newspaper cuttings clipped for me by my mother: Helene Hanff’s obituary; a review of a play about Van Gogh from 2002 that has been sitting unread in my closet for 20 years. Cuttings I kept myself, for “historical reasons”: the front page of the Independent when Diana died; bizarrely, Louise Woodward on the cover of the Mirror (the headline was “Stitched Up”). From May 1997, “Blair’s Britain is born.” All pointless, yet poignant with age. The further down I go, the weirder it gets. A receipt for fertility drugs for $1,776 – which I kept out of sheer incredulity, having rocked up at the cash desk of the pharmacist in 2014 thinking I’d be on the hook for no more than $29.99. Down, down I go. My mother’s record-keeping was meticulous and, from this historical distance, exhausting. In one folder, my school reports going back to nursery. (As a three-year-old in 1979, I can inform you, I was “making good progress but inclined to be rather tense” – nothing changes.) It gets worse. At the bottom of the third crate, job references from my mother’s employer for a bookkeeping position she held for a year at the South African Mining Journal, in 1956. (She was, I read, “an intelligent, cheerful and satisfactory worker”.) Everyone in this last exchange is dead. There are a few treasures. Photocopies of letters written to Iris Birtwistle by her old friend Muriel Spark – which Iris, I now recall, gave to me 20 years ago to spite Spark’s biographer. From 7 August 1950 – in Spark’s long, looping hand: “August Bank Holiday and all it implies finds us both somewhat weary, having no garden & park…” A silver dollar from 1865, which I discover, thanks to the internet, is worth $30, $3,000 or nothing at all. Some share certificates leave me excited, before I remember I sold the associated shares six years ago. Ah, shit. And then, towards the bottom of the third crate, the honking great memorial candle given to me by Amersham crematorium after my mother’s funeral in 2003. I’ve been lugging it between addresses ever since. Even at the time, I remember thinking, what am I supposed to do with this? Put it in the window? It’s enormous and has her name on it. I call my children out from their room. “Look,” I say. “This is your dead granny’s memorial candle. We can’t throw it away, so we’ll light it.”“Why would you want to throw it away?” says a child, boggling.“Because it’s ugly.”“That’s rude.” We light it. Seven-year-olds regard the past differently: as more mythical and simultaneously more porous. Candle lit, one daughter chats to it, fetching her most precious items to hold up and show to her dead granny. A sister regards her critically. “Why are you talking to her? It’s not like she turned into a candle.” A letter from the IRS from 10 years ago letting me off a huge penalty; definite keep. An untitled poem, given to me by a friend, by Tahar Djaout (“Silence is death / If you speak, you die / If you are silent, you die / So speak, and die”): keep. Ticket stub from the Empire State Building from 1999: bin. I am so servile that anything looking vaguely official goes into the “keep” pile, which means the Insight Into Industry “certificate of achievement”, issued by my high school for the momentous achievement of going on a year 11 trip to Aylesbury sewage works, will be my children’s to treasure in perpetuity. Ugh, the letters. So many letters. From my mother’s seven siblings, none of whom, at the time of her death, she had seen for more than 25 years, feverishly keeping up appearances until the end. “Won’t you visit? We’d love to see you.” “Maybe next year; won’t you please consider it?” On and on it goes. Five crates are returned to the closet. After four days, I’ve managed to whittle things down by only a single container. And I am one step closer towards my dream of owning a shredder. Emma Brockes is a Guardian columnist",Opinion/Opinion,"Twelve years to sort six boxes. To bin, or not to bin - that is the question | Emma Brockes",https://www.theguardian.com/commentisfree/2022/jan/21/12-years-six-boxes-papers-bin-declutter
1/21/2022,"All pub grub is not built the same. Some is sublime, worth booking ahead for and travelling miles to get to; some is the reheated or deep-fried contents of various freezer bags and flung at plates. My job – and it is a real job – is to decipher what goes in which category. Take the Victoria at Oxshott in Surrey, for example: newly refurbished and reopened, and with Fat Duck alumni at the helm, which feels instinctively like the sort of place you should force your partner to change into trousers for.  Charles and I frequently lock horns whenever we set off somewhere like this, which claims to be a pub but in fact serves “pan-fried” stone bass with keta caviar and smoked confit duck with pistachio. “But it’s a pub,” he’ll say, casting a hand over his designer track pants. “No,” I’ll reply. “They do wagyu bavette and rib-eye with bordelaise sauce. It’s trousers, proper trousers.” And off he’ll trudge back to the wardrobe in the manner of a man forced to complete the London marathon in a 140lb vintage deep-sea diving suit.That isn’t to say the Victoria specifies any sort of official dress code; rather that some places just exude a certain level of genteel correctness. The dining room is rather dreamily staged, like an olde English inn with the light blueprint of a pricy West End brasserie, all cosily furnished, with burgundy panelling, low beams and an open fire. Chef director Matt Larcombe was once head chef at The Crown at Bray, and met manager Simon King when both worked for Heston Blumenthal. There’s a bar area for locals and an extensive regular wine list that starts with house white, a grenache blanc, at £25, as well as a “rare wine menu” from which, if you’re really making a night of it, you can blow £9,750 on a bottle of 1997 Screaming Eagle cabernet sauvignon from the Napa Valley. See? I told you it’s a proper trousers type of place. I’ve knocked booze on the head for the time being, leading to a life of shrubs, kombuchas and seltzers, so they made me a “Light and Firey” with Lyre’s alcohol-free cane spirit and ginger (think dark’n’stormy, but without the morning-after clouds). We sat close to the blazing log fire as two thickly beer-battered oysters were brought to our table, perched back in their shells along with a puddle of pale green, seaweed-infused mayonnaise. If you’re someone who thinks they can’t face oysters, deep-frying the slimy blighters really does help, I assure you. Beautifully presented pickled cucumbers arrive with a mildly seasoned homemade gentleman’s relish, after which we share a plate of sweet, almost al dente salt-baked beetroot that’s even prettier than the cucumbers. Food doesn’t need to be a beauty contest, but it takes real skill to take a dowdy beetroot, then peel it, smoke it, pickle it, salt-bake it, top it with curd and scatter it with hazelnuts, and end up with something that wouldn’t look out of place on an afternoon tea cake-stand at the Ritz. There’s a fish and chips main course option at £19, as well as that Trenchmore Farm bavette at the same price, feasibly to stop the locals from rioting, but then prices hurtle upwards rather dramatically, and at a rate that might leave anyone picking up the family’s dinner bill in need of a lie-down in a darkened room afterwards. Beef wellington wrapped in light, crisp-yet-moist puff pastry with a rich, herby duxelles inner casing, for instance, came at a memorable £45 a slice. Chips, of the triple-cooked, stubby genre, were a fiver on top. Now, it must be said that this was almost certainly the finest beef wellington I will eat in this lifetime, filled with a chunk of rare beef similar in texture to chocolate truffle, but it’s rare that I leave a restaurant wondering if we should perhaps have saved a few pennies by going for the whole turbot with red wine and kale to share at £85. I know all too well, however, that restaurants – sorry, I of course mean pubs – such as this are astonishingly expensive to keep afloat. At least four different smart, cheery front-of-house staff served our table, and the desserts are made by the sort of imaginative patisserie wizard who takes the concept of the Snickers bar and reimagines it as a large square of soft, sweet, nutty mousse with chunks of aerated chocolate and an oozing, caramel centre. This is a very, very good pudding, and I doubt I’ll eat many finer things this year. We also tried a banoffee pie at £9, too, but it paled into insignificance in comparison. The Victoria at Oxshott is a very decent, semi-formal destination restaurant hiding in plain sight inside a village pub near Leatherhead. I’m certain the £40 Sunday lunch here would be an outstanding experience, particularly for a special occasion. No jacket required, but if you ask me … well, I’m still insisting on trousers.  The Victoria High Street, Oxshott, Surrey, 01372 238308. Open Weds-Sun, lunch noon-2.30pm (3pm Fri & Sat; 4pm Sun), dinner 6-9pm (last orders; 10pm Fri & Sat). From about £50 a head for three courses, plus drinks and service",Lifestyle/Food,"The Victoria, Oxshott, Surrey: ‘A proper trousers sort of place’ – restaurant review | Grace Dent on restaurants",https://www.theguardian.com/food/2022/jan/21/the-victoria-oxshott-surrey-restaurant-review-grace-dent
1/21/2022,"Eddie Howe again declined to address Saudi Arabia’s dismal human rights record as he confirmed he would take his struggling Newcastle squad to the Gulf kingdom after Saturday’s game at Leeds. Saudi-owned Newcastle are due to fly to Jeddah on Sunday for a week-long warm-weather training camp on the Red Sea coast, where thermometers reached 30C on Friday. Although Howe revealed they were likely to play a friendly he refused to say whether he would meet Mohammed bin Salman, the de facto ruler. “I don’t know any of those details at the moment,” he said.  The political temperature has been raised significantly by human rights issues and the Saudi regime’s alleged involvement in the murder of the journalist Jamal Khashoggi in Istanbul in 2018 but Howe maintained he was concentrating purely on football and Newcastle’s attempt “to survive in the Premier League”. Newcastle’s manager, whose side sit second bottom after winning only one game, said: “It’s a football decision. We’re doing it for the benefit of the players in our fight to stay in the division and that’s my only thought. The facilities and everything around the trip are going to be first class and the players will be very well looked after. “There will be no distraction from my side. It’s about the training and making sure the players are focused on our next game [against Everton on 8 February]. We’re just doing it in a different environment to bring the players closer together. We’ll try to do some good work and come back as a united squad. “Going away is vitally important. A lot of the Covid protocols you have around the training ground [in England] are encouraging isolation, quite rightly to protect everybody. But it doesn’t help you foster the team spirit and the togetherness that we’re going to need in the battle to stay in the division. It’s important to encourage that unity so going away together is a great idea.” Saudi’s Public Investment Fund holds an 80% in Newcastle and Amnesty International is concerned about the trip. “It could turn into another PR opportunity for the Saudi authorities who are trying to sportswash their appalling human rights record,” a spokesperson said. Howe, meanwhile, conceded he had experienced a frustrating week in the transfer market as he endeavours to reinforce his squad, with moves for the Sevilla centre-half Diego Carlos and the Manchester United forward Jesse Lingard faltering. “We are desperately trying to improve the squad,” he said. “But it has been a fruitless search this week.”",Sport/Football,Eddie Howe says Newcastle making Saudi trip ‘for benefit of the players’,https://www.theguardian.com/football/2022/jan/21/eddie-howe-says-newcastle-making-saudi-trip-for-benefit-of-the-players
