3/28/2022,"Meet the face of the war for millions of Ukrainians hunkering down in their homes. Marichka Padalko, 46, is among a small coterie of TV news anchors with a platform to guide the country through the daily and nightly war developments while teasing out psychological advice from studio experts and offering practical tips on everything from shelter etiquette to surviving a chemical weapons attack. She became central to people’s lives when, two days after Vladimir Putin announced his “special military operation”, the four main channels on Ukrainian television decided to work together to create one 24/7 “marathon” news show. With journalists and technicians – particularly those with young families – fleeing the shelling, leaving channels understaffed, and given the risk of a studio being hit by a Russian bomb, the peacetime professional rivals combined their efforts to guarantee the news would stay on air. The result is that Padalko, a host on 1+1, which was one of Ukraine’s biggest channels in peacetime, and a further 11 anchors who appear during any given 24-hour period, have a captive audience. “It is something like if BBC, ITV, Channel 4 and Channel 5 [came together]. Technically we’re not united. I mean, we are all in different locations, but all channels now have their own slot, six hours a day. Sometimes we are in the morning, sometimes at night,” she said. For the viewers, she said, the broadcasting teams were “somehow a symbol of normality or some connection to their previous life where they used to see us and we were part of the routine of their life”. If they are not live on air, anchors and their reporting teams wait in reserve ready to broadcast from a back-up studio in a secret location, where Padalko is based, in case an air raid siren goes off or a bomb hits those reading the news in the capital, Kyiv, or elsewhere. Ukraine’s president, Volodymyr Zelenskiy, last week signed a decree to make the arrangement obligatory, citing the need to avoid Russian misinformation. To the upset of some media magnates, with perhaps their own political interests to protect, the decree also mandated that smaller channels also use the content in place of their normal news slots. Some have suggested that the News United initiative stifles freedom of speech. Padalko, who along with her co-host, Yegor Gordeev, 32, was the first and only news anchor on air in the period immediately after Putin launched his war by sending missiles into Kyiv and elsewhere, disagrees. “Nobody’s sending us any instructions,” she said. “The only instructions I think we had at the very beginning is just to be more supportive for the audience who are going through difficult times.” The only stipulation from Zelenskiy’s government is that they are mindful of the danger of rumour and misinformation, she says, and that they offer news for those watching from their front rooms, kitchens and beds. “We have guests who can give practical advice, or volunteers who can talk about evacuations, or people who deal with chemical weapons dangers, advising people whether they should buy something to protect themselves from any possible chemical weapon attack,” she says. “We do have psychologists at least once a week, advising [viewers] that they do not feel guilty that they left their home towns or not to hate people who left, or not to watch the news 24-hours a day. That it’s OK to relax sometimes and not to think about the war because some people, if they don’t feel sad or don’t cry, they feel guilty that somebody is now suffering.” Lighter subjects touched upon by the combined news show have included ways to relax – including by having sex – the changing nature of stand-up comedy in wartime, and the proliferation of new songs telling the Russians to “fuck off”. A famous Ukrainian poet, Serhiy Zhadan, was also filmed reading his poems to people sheltering in a bunker. She was advised that the role of the anchor was important as viewers would find reassurance in seeing a “real person that they’ve known for years talking about this and their reaction to this and how they behave themselves,” she said. “Especially being a morning presenter, people write to me that they remember me in their morning routine, getting up, coffee, TV, getting the kids to school. First, they want to see the news and, second, a person they know talk about this news and the third thing is to know what to do.” Padalko, who with her colleagues has also been given advice by a psychologist on how to cope, said journalists who did not usually anchor shows had been drafted in. “Some top anchors are gone because they are women and they had to – and I understand – to take care of the kids and to take them away,” she said. “Mostly, at least in Ukraine, we have more women anchors than men … they had to make a choice – will they stay, or go to take care of the children? – especially if they are single mothers.” Padalko had her own dilemma. Her husband, Yegor Sobolev, 45, a former Ukrainian MP, joined the army on the first day of the war. With schools closed, she was faced with working and caring alone for her three children, Mykhailo, 15, Maria, 13 and Katia, 11. “I was saying that my job is not less important than your desire to go into the army. We had a lot of fights. The day before the war, he said: ‘I think we should already take our kids to western Ukraine.’ And I said: ‘No, I have a morning shift tomorrow and a morning shift on Friday and I can go after Friday,’ because my next week was going to be open. And he said: ‘No, I’m taking the kids.’” Today, Padalko, whose husband is fighting on the northern outskirts of Kyiv, says she is relieved. Her children are in a hotel with their grandparents in the west of the country. She visits them once a week. “I’m very lucky for the decision my husband took on that day. I did my best to work as long as I could, not to be thinking about where my kids are. In this sense, I was lucky, unlike many female journalists who had to care for their children.” Padalko added: “I love my job. I have a huge response from people on social media who are writing that they are happy to see us, that they feel united because we didn’t go away from Ukraine.”",News/World news,‘I love my job’: life as a Ukrainian TV news anchor and mother,https://www.theguardian.com/world/2022/mar/28/i-love-my-job-life-as-a-ukrainian-tv-news-anchor-and-mother
3/28/2022,"P&O Ferries has “one last opportunity” to U-turn on the sacking of 800 crew and must lift this week’s deadline for the employees to sign redundancy and non-disclosure agreements, the government has warned. The transport secretary, Grant Shapps, wrote to the firm’s chief executive, Peter Hebblethwaite, on Monday spelling out his intention to legislate, informing him that P&O Ferries would be “left with little choice but to reverse your decision in any case”. He warned Hebblethwaite that his position as chief executive and a director “has become untenable”. In the letter, which Shapps posted on Twitter, he also outlined plans to bring in a package of measures to “block the outcome that P&O Ferries has pursued, including paying less than the minimum wage”. It came as the Commons transport and business committees wrote a joint letter to Shapps demanding Hebblethwaite be struck off as a company director as “not a fit and proper person” after he “flaunted his contempt for the law” at last week’s hearings into the mass sackings on 17 March across P&O Ferries’ UK fleet. Hebblethwaite admitted the firm broke the law by dismissing the workers without consultation, amid plans to bring in cheaper agency crew at below minimum wages, saying: “There’s absolutely no doubt we were required to consult with the unions. We chose not to do that.” The MPs also urged the government to impose the “unlimited fine” it has threatened if it decides P&O Ferries has broken laws that require it to notify the relevant authorities of impending layoffs. Documents published by the committees show that P&O Ferries’ Jersey office sent Insolvency Service forms on 17 March – the day of the sackings rather than at the required 30-45 days’ notice – to the relevant flag state authorities of the ships in Bermuda, Cyprus and the Bahamas. The forms spell out the legal duty to give notice, but also state: “If it is not reasonably practicable for you to comply with the minimum notification periods you must make every effort do so as far as you are able. You must give reasons why you could not provide the information on time.” The P&O Ferries local agency director wrote on the form that no notice was given because: “To minimise disruption to the vital services we run on major sea routes, it was essential for the business to carry out the restructure as quickly and efficiently as possible.” Unions were meeting with the two other large ferry operators from UK ports, DFDS and Stena Line, and government officials on Monday to discuss the crisis and alternative provision of services. The RMT general secretary, Mick Lynch, said: “The sacked workers have to be reinstated and we need regulation and legislation to secure UK-based seafarers’ jobs and agreed contracts of employment.” P&O sailings from Dover to Calais have been cancelled up to this Thursday and those between Larne in Northern Ireland and Cairnryan in Scotland remain suspended. The Hull-Rotterdam service was cancelled but Liverpool-Dublin sailings were going ahead on Monday.",News/Business,"P&O Ferries has last chance to rehire sacked staff, says Grant Shapps",https://www.theguardian.com/business/2022/mar/28/po-ferries-rehire-sacked-staff-grant-shapps
3/28/2022,"On 2 March, as the number of Ukrainian refugees fleeing Russia’s brutal invasion reached 1 million, the United Nations security council called an emergency session of the general assembly. There, 193 nations reviewed a resolution on Russia’s “aggression against Ukraine” and voted overwhelmingly to approve it: 141 votes in favor, 35 abstentions and just five votes against. Even some of Russia’s closest allies on the continent – Serbia, for example, or Hungary – voted to condemn the invasion. “The message of the general assembly is loud and clear,” said the UN secretary general, António Guterres. What exactly is that message? In recent days, many commentators have pointed to a global map of the UN resolution to demonstrate the unity of the west and the world in taking on the Putin government. But to make sense of the geopolitical consequences of the Russian invasion, we must look beyond the diplomatic theater of the general assembly to examine how these nations are actually engaged with the war in this phase of rapid escalation. And to do that, we should start with a very different map of the world – a map of global participation in the sanctions set against Russia by the United States and its allies. The contrast between these maps could not be more striking. The US, the UK, Canada, South Korea, Switzerland, Japan, Australia, New Zealand, Taiwan, Singapore, the EU: beyond this fortified coalition, very few nations have chosen to take part in the economic warfare set against the Putin government. On the contrary, many of the world’s largest nations – including China, India, Brazil, Bangladesh, Pakistan, Indonesia and even Nato ally Turkey – have refused to join in. “We will not blindly follow the steps taken by another country,” said Indonesia’s foreign ministry representative at a recent press conference. Latin America has been equally steadfast in its commitment to neutrality. “We do not consider that [this war] concerns us,” said the Mexican president, Andrés Manuel López Obrador. “We are not going to take any sort of economic reprisal because we want to have good relations with all governments.” Argentina may have voted to condemn Russia’s actions at the UN, but its foreign minister, Santiago Cafiero, was adamant about his country’s non-participation in the new sanctions push: “Argentina does not consider that they are a mechanism to generate peace and harmony, or generate a frank dialogue table that serves to save lives.” The Latin American position has been echoed in Africa. “For five centuries, we have been pawns in the hands of the warring European states, bent on looting Africa of its human and natural sources,” says Pierre Sané, president of the Imagine Africa Institute and former secretary-general of Amnesty International. Sané tells me that the Ukrainian embassy in Senegal has been recruiting “volunteer” mercenaries from countries like Senegal and Ivory Coast to fight in the war. “Should this war in Ukraine escalate, we say and we say it loud: do not bring it to our shores.” Amid the Russian army’s brutal advance into Ukraine, a slew of letters, articles and Twitter commentary has addressed the “western left” for its apparent unwillingness to take on the Putin government. The invasion of Ukraine has been described as a “test” to root out the “pseudo-leftists” who fail to respond with force and conviction to support the west in its effort to isolate, undermine and eventually topple Putin in defense of the Ukrainian cause. But the map of sanctions suggests that the true rift is not between left and right, nor even between east and west. On the contrary, the map reveals a rift between north and south, between the nations that we call developed and those we call developing. And by revealing this tectonic shift, the map can tell us something important about geopolitics in the coming age of multipolarity. The rapid rise of China and the US reaction it has provoked have prompted many commentators to predict a coming cold war. Few expected Vladimir Putin to kick it off so suddenly. “Putin’s invasion of Ukraine has ended Americans’ 30-year holiday from history,” writes the former CIA director Robert Gates for the Washington Post. The immediate eviction of Russian representatives and Russian culture from the institutions of the west suggest the long slumber of the cold war may indeed be over: “Putin’s war has provided the cold shower needed to awaken democratic governments to the reality of a new world.” The good news for Gates is that the Biden administration has already found its cold war footing. Its flagship Summit for Democracy strives to unite “the nations of the free world” – a remarkable homage to the era of anti-Soviet mobilization – while isolating autocracies like Russia and China. That is, with the usual exceptions: Saudi Arabia’s oil, for example, grants the nation a free pass to the “free world”, as made evident by the recent delegation dispatched by the Biden administration to secure the kingdom’s support to keep the oil flowing through the war effort in Ukraine. In the age of unipolarity – in the long 30-year holiday that followed the collapse of the Soviet Union – the nations of the world were given a rather simple choice: side with the United States, or stand alone. Some nations sought to band together in collective acts of resistance to this hegemonic power. But the consequences were all but inevitable: invasions, coups and extensive sanctions to isolate their economies from the world at large. As new powers generate new poles, however, the options available to US neighbor nations are no longer restricted to compliance and resistance. A third option emerges: neutrality. “Neutrality does not mean indifference,” says Pierre Sané. “Neutrality means continuously calling for the respect of international laws; neutrality means that our hearts still go to the victims of military invasions and arbitrary sanctions never imposed on Nato countries.” Back in the first cold war, neutrality had a name: non-alignment. As the United States clashed with China and the Soviet Union in the skies above Korea, Jawaharlal Nehru and Josip Broz Tito refused to take a side. “The people of Yugoslavia cannot accept the postulate that humanity today has only one choice – a choice between a domination of one or the other bloc,” Yugoslavia’s minister of foreign affairs, Edvard Kardelj, told the UN in 1950. “We believe that there exists another road.” The Non-Aligned Movement was born five years later, uniting more than 100 nations around the world around principles of non-interference and peaceful coexistence. Today, nations around the world are called again to take sides – between Russia and the west, and very soon between the west and China. But as the map of sanctions attests, the cross-pressure between these great powers may once again spark a movement for non-alignment, demanding a more universal application of international law against demands for unilateral exception. There will no doubt be consequences for this neutral position. Non-aligned nations in the first cold war were frequently victim to aggression, invasion and economic embargo. The same risks to neutrality are visible today. Lithuania recently canceled a shipment of Covid vaccines to Bangladesh for its refusal to condemn Russia at the United Nations. The US, for its part, has already passed the Countering America’s Adversaries Through Sanctions Act (Caatsa), giving license to punish countries with sanctions for trading with the other side. But as great powers prepare for a new century of war, the call for non-alignment will only grow louder. Our task is to understand that call now as Tito and Nehru understood it then: not as “neutralism” or “passivity, as is sometimes alleged”. As they wrote in a joint declaration in 1954: “It represents the positive, active and constructive policy that, as its goal, has collective peace as the foundation of collective security.”  This article was amended on 28 March 2022 to clarify that the embassy Pierre Sané referred to as recruiting “volunteer” mercenaries from countries like Senegal and Ivory Coast, was the Ukrainian embassy in Senegal. David Adler is a political economist and general coordinator of the Progressive International",Opinion/Opinion,The west v Russia: why the global south isn’t taking sides | David Adler,https://www.theguardian.com/commentisfree/2022/mar/10/russia-ukraine-west-global-south-sanctions-war
3/28/2022,"Britain’s economy is expected to suffer a growth slowdown amid the biggest single shock from energy prices since the 1970s, the governor of the Bank of England has warned. Andrew Bailey said there were signs of slowing demand from consumers and businesses as they come under heavy pressure from the cost of living squeeze, with soaring prices for gas, electricity and other goods and services. “The shock from energy prices this year will be larger than any single year in the 1970s,” he said at an event held by the Bruegel thinktank in Brussels on Monday. “The caveat is that the 1970s had a succession of years and we very much hope that would not be the case now. But as a single year, this is a very, very big shock.” Threadneedle Street said earlier this month that inflation could reach 8% this spring after a sharp rise in household gas and electricity bills due on Friday. With inflation already surging before Russia’s invasion of Ukraine, it said global energy prices being pushed higher by the war could drive UK inflation close to 10% later this year. The central bank has responded by raising interest rates, which now stand at 0.75% after a 0.25 point increase at its March policy meeting, as it put concerns over high inflation ahead of the impact on economic growth to stop the current bout of rising prices from becoming more persistent in future. The Bank has a target to steer inflation close to 2%. Bailey suggested on Monday that the cost of living squeeze was likely to hit the UK’s economic growth rate as households and companies tighten their belts due to the increase in the price of energy and other goods and services. “We expect it to cause growth and demand to slow. We’re beginning to see the evidence of that in both consumer and business surveys,” he said, suggesting that weaker rates of growth could lead to a cooling of inflation without the need for significant interest rate hikes from the central bank. “We expect that this pressure on demand will weigh down on domestically generated inflation. For that reason we do expect inflation to return to target, two years or so out from now.” The Office for Budget Responsibility, the government’s economic forecaster, last week downgraded its 2022 growth forecasts from 6% to 3.8% while warning that the highest rate of inflation in four decades would hit consumer demand. Analysts expect the Bank of England’s monetary policy committee to raise interest rates to 1% when it next meets in early May. While financial markets point to its key interest rate rising to 2% by the end of the year, some economists have suggested a weaker growth outlook would reduce the need for such a sharp rise in borrowing costs. Bailey said there were “risks to the outlook for inflation from both sides,” with a high degree of uncertainty facing the UK economy. “We’ve got a pandemic followed by a European war, in any scale that is a very difficult position to be in for policy.”",News/Business,Bank of England expects UK energy shock on the scale of the 1970s,https://www.theguardian.com/business/2022/mar/28/bank-of-england-expects-uk-energy-shock-on-the-scale-of-the-1970s
3/28/2022,"After Great Pain … After great pain, a formal feeling comes –The Nerves sit ceremonious, like Tombs –The stiff Heart questions ‘was it He, that bore,’And ‘Yesterday, or Centuries before’? The Feet, mechanical, go round –A Wooden wayOf Ground, or Air, or Ought –Regardless grown,A Quartz contentment, like a stone – This is the Hour of Lead –Remembered, if outlived,As Freezing persons, recollect the Snow –First – Chill – then Stupor – then the letting go – Emily Dickinson begins her poem by demonstrating rhythmically the “formal feeling” that succeeds “great pain”. The pain isn’t specified, and could be physical, but there are strong suggestions that it’s the response to death, the pain of mourning. This pain’s aftermath is a physically embodied numbness, almost an absence of response, almost a living death. In that extraordinary second-line simile, “[t]he Nerves sit ceremonious, like Tombs-” it’s impossible to resist the image of the nerves themselves being enlarged into tomb-like objects. They are death’s presence in the body, and the first sight of the stoniness and heaviness which dominate the imagery. But we can also think of mourners who “sit ceremonious” at a funeral, and who may talk, as the “stiff Heart” talks, about “He that bore”. “He” is clearly Christ (the one that bore our sins in Christian phraseology). The words would be murmured by mourners in prayer at a funeral service. But it’s significant that it’s phrased as a question “was it He, that bore” and that the phrase breaks off without an object. It’s possible that the “He” could also represent a soldier burdened with a backpack. The poem written in 1862, when the American civil war was intensifying. The final question asking if the event was “Yesterday, or Centuries before” suggests a current resonance, and almost makes Christ and the soldier interchangeable. Continuing the analogy with the mourner’s state of mind in stanza two, the tired marcher moves woodenly, and the feet are nailed to the wood of the cross. The “wooden way” is further dramatised, with an image of walking the air (as in violent death and/or psychological dissociation) and the compulsion of duty (“Ought”). There is also, of course, an echo of “aught” (meaning “anything at all”) in this brilliantly coined noun. This stanza, although it begins and ends with the iambic pentameter of the first, is disrupted by shorter lines of two, three and two beats respectively. There are five lines altogether, and only the last two rhyme. In the last stanza, formality is almost restored, as a new analogy replaces “the hour of lead” – the process of being frozen to the point of unconsciousness. But there’s a simultaneous movement towards consolation in the thought that the frozen stasis can be “outlived” and might be transformed, by a “letting go” that isn’t that of death but the recovery of life. Dickinson’s powerful images of lead and coldness recall those of a letter she wrote to Samuel Bowles in 1862, concerning the death of her brother Austin’s friend, Frazer Stearns, in the battle of New Bern. “Austin is chilled – by Frazer’s murder – He says – his Brain keeps saying over ‘Frazer is killed’ – ‘Frazer is killed,’ just as Father told it – to Him. Two or three words of lead – that dropped so deep, they keep weighing –”. It seems that the poem’s finely deployed psychological observations may have begun with an experience which brought the civil war very close to home.",Arts/Books,Poem of the week: After Great Pain … by Emily Dickinson,https://www.theguardian.com/books/2022/mar/28/poem-of-the-week-after-great-pain-by-emily-dickinson
