4/30/2022,"Who is behind the consortium? The group’s move came when the 86-year-old Swiss billionaire Hansjörg Wyss went public with his interest in buying Chelsea from Roman Abramovich. Wyss said he was working with other investors and it soon transpired that the figure fronting the bid was Todd Boehly, an American who part-owns the LA Dodgers baseball team. Boehly, who co-founded Eldridge Industries, is worth an estimated $4.5bn and his interest in Chelsea has not come out of nowhere: he had a bid rejected by Abramovich in 2019. Nothing has been left to chance this time and Boehly has been chosen as the preferred bidder for Chelsea despite a late bid from Sir Jim Ratcliffe. Investors include Jonathan Goldstein, a British businessman who is the CEO of Cain International and a Tottenham fan, and Boehly’s fellow Dodgers owner Mark Walter. There is also backing from the US investment firm Clearlake Capital. Daniel Finkelstein, a Tory peer and Times columnist, and Barbara Charone, a celebrity publicist, will become non-executive directors if the deal goes through. The consortium has received advice from Robey Warshaw, where the former chancellor George Osborne works. It is anticipated that Boehly would be the most influential figure in the running of Chelsea, with Wyss more in the background. Boehly has a long history of working with Goldstein, a lawyer who has been a major player in the property world, and with Walter. What has Boehly done at the Dodgers? It seemed that Stan Kroenke was going to buy the Dodgers for £900m 10 years ago, only for Boehly’s group to stun the Arsenal owner by bidding £1.3bn for the franchise. It was a huge statement of intent and Boehly, who studied at the London School of Economics and is a part-owner of the Los Angeles Sparks women’s basketball team, has since shown plenty of ambition. There has been steady investment in the Dodgers and they claimed the World Series in 2020, which suggests that Boehly would be focused on winning at Chelsea. Are there any potential hitches? The emergence of interest from Ratcliffe throws up the possibility of a late U-turn by Abramovich. No other bidders remain in the running. None of the investors in the Boehly consortium have stakes in rival football clubs and there are no political controversies attached to the bid. Will the approach be different from Abramovich’s? Do not expect Boehly’s group to protect Chelsea’s position by giving them £1.5bn in loans. There is likely to be a desire to make the club self-sufficient and the days of spending £200m on signings in one summer could be over, although that does not necessarily mean that Chelsea will no longer be able to challenge for major honours. They have become one of the biggest brands in the world and could arguably do with a different approach off the pitch. A ruthless culture of hiring and firing managers has been the norm under Abramovich, but the new hierarchy should be looking to build around Thomas Tuchel and give him more control over recruitment. This could be good for the German. Tuchel has enjoyed working with the influential director, Marina Granovskaia, and the technical and performance adviser, Petr Cech, who should stay, but change in the boardroom could make him even more powerful. Are there plans to renovate Stamford Bridge? This will be key to boosting Chelsea’s finances. Stamford Bridge has a 42,000 capacity and is smaller than Arsenal’s, Tottenham’s and West Ham’s grounds. A stand-by-stand renovation is one possible solution. Moving would be fraught with difficulties because the freehold is held by the non-profit plc, Chelsea Pitch Owners (CPO). Will there be supporter engagement? All bidders have had to engage in dialogue with the CPO and the Chelsea Supporters’ Trust, but it remains to be seen if there will be a golden share for fans. What issues need to be resolved? The new owners will need to provide Tuchel with funds to the plug the gaps in his defence. Antonio Rüdiger has decided to join Real Madrid on a free and Barcelona are expected to sign Andreas Christensen when the Denmark centre-back’s contract expires at the end of the season. Barça also retain an interest in César Azpilicueta, who could be allowed to leave despite Chelsea triggering an automatic one-year extension in their captain’s deal. The upheaval could leave Tuchel with Thiago Silva, Malang Sarr and Trevoh Chalobah as his only senior centre-backs. Levi Colwill could step up after a fine loan spell at Huddersfield but more experience is required. Are there problems in other positions? The owners will need to get to work quickly. They must start negotiations with Mason Mount, whose deal runs out in two years, and consider whether alterations are required in midfield. Decisions will need to be made over N’Golo Kanté and Jorginho, with both midfielders out of contract next year. Is now the time to sell one of them given that Conor Gallagher is returning from his loan at Crystal Palace? As for the attack, Chelsea must also decide whether to cut their losses on Romelu Lukaku. The striker has not settled since his £97.5m move from Internazionale last summer and does not appear to suit Tuchel’s style. Will they be active in the transfer market? Chelsea will need to replace Christensen and Rüdiger, and are likely to revive their interest in Sevilla’s Jules Koundé. Leicester’s Wesley Fofana and RB Leipzig’s Josko Gvardiol are also being monitored, and Atlético Madrid’s José Giménez has been targeted in the past. There is an opportunity to freshen up the squad. West Ham’s Declan Rice remains a target in midfield, though Monaco’s Aurélien Tchouaméni would be easier to buy. Similarly the Lille forward Jonathan David could be more affordable than Benfica’s Darwin Núñez, although incomings in attack could depend on sales. There are doubts over Lukaku, Christian Pulisic, Timo Werner and Hakim Ziyech.",Sport/Football,Who are Chelsea’s prospective new owners and what issues do they face?,https://www.theguardian.com/football/2022/apr/29/who-are-chelsea-prospective-new-owners-boehly-and-what-issues-do-they-face-abramovich
4/30/2022,"The number of children in the UK suffering from severe hepatitis has risen to 145 as concerns mount about the mysterious surge in cases. The UK Health Security Agency (UKHSA) announced an increase of 34 cases but said most children have recovered and no children have died. There has been no increase from the 10 children who have required a liver transplant, reported on Monday. Scientists believe there could be a link to adenovirus infection, which has been detected in the majority of cases, but are continuing to investigate the cause. Hepatitis is not a common side-effect from adenovirus, which typically causes cold-like symptoms and nausea, so scientists are investigating whether a co-infection, including with Covid-19, or non-infectious causes such as food poisoning, drug or metal exposure, could be playing a role. “We are also exploring whether increased susceptibility due to reduced exposure during the Covid pandemic could be playing a role, or if there has been a change in the genome of the adenovirus,” UKHSA said in a statement. Dr Meera Chand, the agency’s director of clinical and emerging infections, said: “We know that this may be a concerning time for parents of young children. The likelihood of your child developing hepatitis is extremely low. However, we continue to remind parents to be alert to the signs of hepatitis – particularly jaundice, which is easiest to spot as a yellow tinge in the whites of the eyes – and contact your doctor if you are concerned.” Prof Deirdre Kelly, a paediatric hepatologist at Birmingham Women’s and Children’s NHS trust and part of a group working with UKHSA to investigate the cases, said that the surge seemed likely to be related to the pandemic and that the group had found a medical report from 1924 describing an increase in child hepatitis after the 1918 influenza pandemic. “They also had a surge in hepatitis, which is fascinating,” Kelly said. She added that the far higher numbers of cases seen in the UK compared with Europe was likely to be due to a better reporting system. The UK has centralised liver treatment centres, meaning that milder cases could be picked up quickly. Chand advised parents to ensure that children follow normal hygiene measures including thorough handwashing. “As always, children experiencing symptoms such as vomiting and diarrhoea should stay at home and not return to school or nursery until 48 hours after the symptoms have stopped,” she said.",News/Society,Number of UK children suffering from hepatitis rises to 145 ,https://www.theguardian.com/society/2022/apr/29/number-of-uk-children-suffering-from-hepatitis-rises-to-145
4/30/2022,"Donald Trump has been mocked for fearing protesters would throw “dangerous” fruit at him, with late-night talkshow host Trevor Noah calling it “one of the most crazy defenses I’ve ever heard”. The revelation came during the former president’s testimony to attorneys representing a group of protesters suing over their violent removal from a Trump campaign rally in 2015. According to the transcript of the deposition, when asked about his statement to the crowd that “If you see someone getting ready to throw a tomato, just knock the crap out of them, would you,” Trump replied: “It’s very dangerous stuff. You can get killed with those things. “We were threatened,” the president added. “They were going to throw fruit. We were threatened. We had a threat. Trump also said: “I wanted to have people be ready because we were put on alert that they were going to do fruit.” “What do you mean ‘do fruit’?” said Late Night host Seth Meyers on Thursday’s episode. “What do you mean you were put on alert? There’s an alert system for fruit? It’s like the homeland security threat level? Red’s tomato, yellow is for banana and green is for avocado. “You know what they say,” Meyers added, “if you get hit with an avocado, you’re toast.” Trump claimed in the deposition that he became aware of the threat of being beaned by a tomato because the Secret Service warned him: “We were told. I thought Secret Service was involved in that, actually. And you get hit with fruit, it’s very violent stuff. Tomato, when they start doing that stuff, it’s very dangerous. There was an alert out that day.” Perhaps aware of the potentially serious consequences of admitting he had intended security staff or other rally attendees to commit violence, Trump insisted his “knock the crap out them, would you” comment was a joke. “It was said sort of in jest. But maybe, you know, a little truth to it. I wanted to have people be ready because we were put on alert that they were going to do fruit. And some fruit is a lot worse than … tomatoes are bad by the way. But it’s very dangerous … they were going to hit very hard.” The videotaped deposition took place in New York’s Bronx county in October 2021. Noah, on his show, simply read the transcript aloud, because “no comedy writer is going to come up with something funnier than Trump’s deposition”.",News/US news,Trump mocked for fearing protesters would throw ‘dangerous’ fruit at him,https://www.theguardian.com/us-news/2022/apr/29/trump-dangerous-fruit-tomato-jokes
4/30/2022,"After days of speculation following Emma Raducanu around the grounds of the Caja Mágica, this time about the merits of her unusual perspective on coaching in light of her decision to part ways with her coach Torben Beltz after five months, the 19-year-old’s clay-court education resumed with an excellent win on her Madrid Open debut. Having trailed 2-5 in the opening set then twice standing set point down, Raducanu showcased her adaptability and mental fortitude as she methodically turned the match on its head, eventually registering a convincing 7-6 (3), 6-0 win over Tereza Martincova to reach the second round. The match-up was a second meeting between the pair this month, with Raducanu pulling off a gritty win against Martincova in her first professional match on clay at the Billie Jean King Cup. But while the faster conditions at altitude in Madrid are preferential for Raducanu, they also suited Martincova. The Czech served extremely well, imposed consistent pressure on Raducanu with her forehand and she was extremely clean for most of the opening set. But not all of it. As in Prague, Raducanu produced her best tennis when she most needed it. This time, she completely changed her approach under pressure. Not only did she begin to load up her shots with more top-spin, adding margin into her game, moving further behind the baseline and eliciting errors from Martincova with her consistency, she also embraced the clay with her offensive game. Having started the match attacking inside the baseline, looking to change directions down the line, essentially playing as if on a hard court, Raducanu began to work the points with width and angle, slowly dragging Martincova off the court. In the attritional rallies that followed, Raducanu’s greater athleticism was so often the difference late in the exchanges. Across the net, all opposition quickly crumbled. After saving the set points, levelling the opening set at 5-5 and then harnessing her momentum into an excellent tie-break, Raducanu ran with the match, winning 11 of the last 12 games to seal victory.Such a thoughtful performance was an apt demonstration of why Raducanu is so confident in her ability to read and understand the game, and why she does not think she needs a prominent coach to guide her at all times. It was also a glimpse into how she might adapt her game to find consistent success on clay in the future as her experience grows on the surface. Raducanu will next face Marta Kostyuk of Ukraine, a fellow 19-year-old she grew up playing against as a junior. “All throughout juniors she was always the favourite when we played. She was considered much better,” said Raducanu. “Yeah, it’s a funny one. When we played last year she played very good, but also I wasn’t very well that day. So it’ll be an interesting match-up.” Meanwhile, Naomi Osaka returned to clay with a promising victory as she recovered from a break down to comfortably defeat Anastasia Potapova 6-3, 6-1. In the men’s event, which begins on Sunday, Andy Murray has been dealt a fascinating first-round draw against former US Open champion Dominic Thiem. While Murray is a surprise wildcard entrant in Madrid after initially planning to skip the entire clay court season, Thiem is returning to tennis after a disastrous year stemming from a serious wrist injury then numerous setbacks. He is yet to win a match after three tournaments back.",Sport/Sport,Emma Raducanu enjoys straight-sets win over Tereza Martincova,https://www.theguardian.com/sport/2022/apr/29/emma-raducanu-enjoys-straight-sets-win-over-tereza-martincova
4/30/2022,"A senior Conservative MP is under investigation for watching pornography in the House of Commons after furious female colleagues forced government whips to act. Neil Parish, the MP for Tiverton and Honiton, had the whip suspended after becoming the fourth MP from his party since the last election to face claims of impropriety. Parish revealed he had referred himself to the standards commissioner on Friday afternoon after senior Tory women expressed outrage at the party for failing to act on complaints made earlier this week despite being aware of his identity. In a statement, the 65-year-old MP said he would be “cooperating fully with any investigation”. He later told reporters that he may have accidentally opened a pornographic video in the Commons and said he will quit as an MP if found guilty. The Tory whips had refused to suspend the party whip for more than 48 hours after a female minister and parliamentary aide identified Parish on Tuesday night as the MP they allegedly saw watching pornography in the chamber. The whips suggested the female MPs should instead make complaints to the parliamentary watchdog, the Independent Complaints and Grievance Service (ICGS), which is now also investigating. Sue Parish, the MP’s wife, told the Times the accusations were “all very embarrassing”, adding: “My breath was taken away, frankly. “People shouldn’t be looking at pornography. He would never just sit there with people looking. He would never just do that knowing [people were looking]. These ladies were quite right to be as [upset] as they were. Describing her husband as a “normal … lovely person”, she added: “If you were mad with every man who looked at pornography, you would not have many wives in the world. “It’s degrading. It’s demeaning. But on the other hand it takes two to tango. There must be women posing for all this. When asked what the accusations could mean for her husband’s career, she replied: “I’ve got no idea. It depends on what Chris Heaton-Harris [the Tory chief whip] says, I suppose. I don’t think it’s going to carry on, is it? It’s so stupid. He’s such a good MP. He’s such a good person.” Labour accused the Tory whips of trying to “cover up” for Parish before they ultimately took the decision to withdraw the whip on Friday. If found to have brought the Commons into disrepute, Parish could be sanctioned and ultimately face the possibility of a recall petition, potentially triggering a byelection, if suspended from parliament for more than 10 days. He could also face similar penalties through the ICGS, which can look at cases of sexual harassment. The House of Commons would need to authorise the most severe sanctions of suspension or expulsion. With dismay among female MPs about the scale of sexism and misogyny in parliament, Boris Johnson is now facing calls from women within his party to take their concerns more seriously. One Conservative peer described a “toxic mix of stress, and booze and testosterone and power” that was difficult to tackle. It comes less than a week after the whips said they would take steps to identify which anonymous Tory MP was responsible for accusing Angela Rayner, the deputy Labour leader, of crossing and uncrossing her legs in parliament in order to distract him. The story in the Mail on Sunday prompted widespread anger. One Tory MP and former cabinet minister said she thought Parish should have been “suspended with immediate effect” and referred to the standards system by the whips, adding that she had personally urged them to do so. Another Conservative MP described the reaction of the whips as “useless” and said their inadequate response was typical of their failure to take women in the party seriously. They also said a culture of failing to tackle misogyny had “come from the top” and was ultimately the responsibility of the prime minister. Harriet Harman told the BBC Radio 4 PM programme that Parish should stand down as an MP. “This marks a new low for the House of Commons,” the senior Labour MP said. “If this is what he has done, he should stand down from parliament right away. It is not right for him to go through the investigation processes if that is what he has done. Clearly he is not fit to be in parliament. He should accept that and not drag the processes out.” Johnson had responded to the alleged porn-watching by saying it was “obviously unacceptable for anybody to be doing that kind of thing in the workplace”. A spokesperson for the chief whip, Chris Heaton-Harris, said Parish was reporting himself to the parliamentary authorities. “Mr Parish has been suspended from the Conservative whip pending the outcome of that investigation,” the spokesperson said. The standards commissioner, Kathryn Stone, can investigate whether MPs have complied with the House of Commons code of conduct. Paragraph 15 of the code says MPs must “conduct themselves in a manner which will tend to maintain and strengthen the public’s trust and confidence in the integrity of parliament and never undertake any action which would bring the House of Commons, or its members generally, into disrepute”. Parish has held the safe Conservative seat of Tiverton and Honiton, in Devon, since 2010, winning it with a huge majority of 24,239 in 2019. He is the chair of the environment, food and rural affairs select committee and is known at Westminster as a champion for animals and farming, quizzing ministers in recent Commons appearances about fertiliser prices and greyhound racing. Thangam Debbonaire, Labour’s shadow Leader of the House of Commons, said: “The Conservatives knew for days about the disgusting behaviour of one of their MPs and tried to cover it up. From the Owen Paterson scandal to their failure to act against their paedophile MP Imran Ahmad Khan, this is a government rotting from the head down. Britain deserves better.” Before Parish’s name emerged, several Conservative MPs, including Nickie Aiken and Simon Hoare, had called on the unnamed MP accused of watching pornography to resign rather than risk others being wrongly named. Anne Jenkin, the peer and co-founder of the Women2Win group trying to get more Tory women into politics, said she thought women would not be put off by incidents of sexual misconduct but it would “makes them angry and angry is good in this space because it’s more likely for women to say, well I’ve got to go into politics to get rid of this stuff”. She added: “It’s a toxic mix of stress, and booze and testosterone and power that makes it so difficult. And I don’t know what the solution is because you can’t do anything about testosterone and you can’t do much about the stress of it, and the power is inevitable. You can do something about the booze. “I mind about values and I think there’s a lot of Conservatives who are extremely embarrassed by what is going on.” Parish gave an interview to GB News this week in which he was asked about allegations of a then-unidentified Tory MP watching pornography in the Commons. 'You are going to get people that step over the line.'Neil Parish, who has had the whip removed following accusations he watched pornography in the Commons, spoke to Darren McCaffrey earlier this week and denied there was a cultural problem in Parliament. pic.twitter.com/bHHQedHpdo “I think the whips’ office will do a thorough investigation and we will wait and see that result and from that, then the decision will have to be made what action will be taken,” he said. Pressed on whether there was a problem with the culture at Westminster, Parish said: “We’ve got some 650 members of parliament in what is a very intense area. You are going to get people who step over the line.” He added: “It does have to be dealt with and dealt with seriously.” The allegations emerged when female Conservative MPs calling themselves the 2022 group gathered in Westminster to share experiences of misogyny and sexism.",News/Politics,Tory MP Neil Parish faces investigation over claims of watching pornography in Commons,https://www.theguardian.com/politics/2022/apr/29/tory-mp-neil-parish-faces-investigation-over-claims-of-watching-pornography-in-commons
