4/2/2022,"What were you hoping for?Somebody who doesn’t take themselves too seriously but is still ambitious, like-minded and up for a laugh. First impressions?Very sweet – he took my coat straight away and brought me a little bracelet to remember the evening by. What did you talk about?Salsa dancing. Ryan’s life goals. Skydiving. Foals. Dream jobs. Duolingo. Morning people v night owls. And at one point he asked if I had hairy armpits. Any awkward moments?I chowed down on my plate of olives and almonds while he devoured a big old steak. Good table manners?Yes, definitely – the more wine we drank, the more Spanish he spoke. Best thing about Ryan?He is definitely a yes person and seemed super confident. Would you introduce him to your friends?Probably. I imagine we have quite different friends but he was very entertaining. Describe Ryan in three words?Confident, honest, funny. Blind date is Saturday’s dating column: every week, two strangers are paired up for dinner and drinks, and then spill the beans to us, answering a set of questions. This runs, with a photograph we take of each dater before the date, in Saturday magazine (in the UK) and online at theguardian.com every Saturday. It’s been running since 2009 – you can read all about how we put it together here.What questions will I be asked?We ask about age, location, occupation, hobbies, interests and the type of person you are looking to meet. If you do not think these questions cover everything you would like to know, tell us what’s on your mind. Can I choose who I match with?No, it’s a blind date! But we do ask you a bit about your interests, preferences, etc – the more you tell us, the better the match is likely to be. Can I pick the photograph?No, but don't worry: we'll choose the nicest ones. What personal details will appear?Your first name, job and age. How should I answer?Honestly but respectfully. Be mindful of how it will read to your date, and that Blind date reaches a large audience, in print and online. Will I see the other person’s answers?No. We may edit yours and theirs for a range of reasons, including length, and we may ask you for more details. Will you find me The One?We’ll try! Marriage! Babies! Can I do it in my home town?Only if it’s in the UK. Many of our applicants live in London, but we would love to hear from people living elsewhere. How to applyEmail blind.date@theguardian.com What do you think he made of you?I’m not too sure … We laughed a lot, which is always good. Did you go on somewhere?No, we went our separate ways. I was still pretty hungry after the date so scooted off to grab a meal deal. And … did you kiss?No. If you could change one thing about the evening what would it be?A few extra veggie options and maybe a bit of organised fun. Marks out of 10?7 – it was an evening well spent but I didn’t feel any romantic vibes. Would you meet again?As friends, for sure. I’d quite like a free salsa lesson. What were you hoping for?A relaxed evening with good food and good company. First impressions?Abi was friendly and smiled a lot. I liked how she’d done her hair. What did you talk about?Her work in graphic design. Travel stories. Indie music. How she’d learn how to skydive if she won the lottery. Any awkward moments?We were both nervous at first, but then the conversation flowed easily. I wanted a kiss at the end but it wasn’t to be. Good table manners?Yes, especially considering we chose the herbiest dishes possible. Best thing about Abigail?Her self-confidence; she’s happy travelling solo and takes pride in her graphic design work. Would you introduce her to your friends?She’s really social, so I would. Describe Abigail in three words?Open-minded, easy-going, walk-lover. What do you think she made of you?I’d like to think she felt comfortable and found me fun and talkative. Did you go on somewhere?No, I had to shoot off home, sadly. And … did you kiss?Only on the cheek. If you could change one thing about the evening what would it be?To have stayed out a little later, but I had to catch a train. Marks out of 10?It was my first-ever blind date and I would rate it 10/10. Would you meet again?We both said we’d be up for meeting as friends and we’ve exchanged details.",Lifestyle/Life and style,Blind date: ‘At one point he asked if I had hairy armpits’,https://www.theguardian.com/lifeandstyle/2022/apr/02/blind-date-abigail-ryan
4/2/2022,"There are certain words I cannot bring myself to say out loud. Sometimes this is because of my accent – as an American I’ve never found a satisfactory way to pronounce “Torquay”, and I’ve stopped trying. If I had a story to tell you about something that happened there, I would probably just transplant the whole anecdote to another coastal town. Sometimes it’s just plain distaste – like with goujon – and sometimes it’s harder to explain. For the most part, it’s not a problem until it’s a problem. “We’ve got to do something about the thing,” I say, looking out the kitchen window one Friday afternoon. “The back end is leaning badly.” “I have no idea what you’re talking about,” my wife says. “The structure,” I say. “What structure?” she says. “In the garden,” I say. “The wisteria-supporting structure.” “The pergola?” she says. “It’s become detached at the back,” I say, “I think it might collapse.” “Just say pergola,” she says. “I’m afraid that won’t be possible,” I say. “But something must be done.” On Saturday morning I stand on the bench at the back of the garden to take a closer look. The structure was put up four years ago, by a man who did it quickly, without fuss or assistance of any kind, for a reasonable price. At the time I admired the upright solidity of the thing, but up close I can see that the rear has been bolted to an old wooden batten previously fixed along the top of the high brick wall – support for some unremembered arbour or trellis. That batten had rotted away, pulling off its bolts under the weight of the growing vines, leaving the right rear corner of the structure hanging. “I can do nothing,” I say, back inside. “It’s going to fall down.” “What is?” my wife says. “I don’t have the skills, or the tools,” I say. “Is this about the pergola?” she says. “But I’ll tell you what,” I say. “Whoever does fix it will have to dismantle it and start again.” “Can you just acknowledge that we’re talking about the pergola?” she says. “And that means cutting down the wisteria first,” I say. “Don’t touch that wisteria,” my wife says. “It took five years to flower.” “It’s out of my hands,” I say. But I can’t let go. I spend the afternoon watching YouTube videos of competent men installing similar structures in their own gardens, but they all start from scratch, doing everything right, with amazing cordless tools. At night I dream about it, trying to puzzle out a solution. I hatch a plan involving scaffolding planks and the jack from the car, but every time I run the model in my head it leads to catastrophic injury. After that I lie awake until the sky begins to pale. It reminds me of a long, distressing night I spent in a hotel in, let’s say, Paignton. On Sunday morning I make an announcement. “I think I can fix it,” I say. “Fix what?” my wife says. “First I need to buy some L-shaped braces,” I say. “Oh my God, is this about…” “These super-strong steel braces that I dreamed existed,” I say. “Possibly available from B&Q.” “How are you going to ask for what you want,” my wife says, “if you can’t say pergola?” “The point is, I can fix the braces directly to the wall, and let them take the weight.” “Of the pergola,” she says. “I’ll need to take some measurements,” I say. I drag a folding ladder to the end of the garden and climb up into the framework, wisteria tentacles whipping my face. The right rear corner of the structure is now a foot lower than the left. With both shoulders braced against adjacent roof struts, I climb to the top of the ladder – the paint shelf – and straighten my legs. With me as its support, the whole structure rises; but it’s still a good six inches short of level when I’m at full stretch. The ladder creaks alarmingly, and I have a vision of the kind of death that makes the local paper: Man Killed by Pergola. It sounds like a disease. “We’re back to square one,” I say, stepping into the kitchen. “Or a bit before square one, because I’ve made it slightly worse.” “Just leave it until the wisteria has flowered one more time,” my wife says. “Do nothing for four to six weeks?” I say. “I can handle that.”",Lifestyle/Life and style,"Tim Dowling: you say ‘pergola’, I’ll say ‘wisteria-clad garden structure’",https://www.theguardian.com/lifeandstyle/2022/apr/02/tim-dowling-you-say-pergola-ill-say-wisteria-clad-garden-structure
4/2/2022,"The Dominican Republic – not to be confused with the much smaller Caribbean island of Dominica – forms the eastern two-thirds of the island of Hispaniola, which it shares with Haiti. It is the most mountainous of all the Caribbean islands, with the highest peak, Pico Duarte, reaching an altitude of 3,098 metres (almost 10,200ft). Like other islands in the region, the climate is tropical: warm throughout the year. There are two distinct seasons: hot and muggy from May to October, and cooler and more pleasant from December to March; with April and November lying somewhere in between. Rain, too, falls mainly in the spring and summer months, averaging between 640mm and 2260mm (25 to 90 inches) a year, depending on the location. Along the northern coast, which is exposed to the northerly trade winds, winters can also be fairly wet. However, because the rain falls mainly in intense bursts and thunderstorms, the climate is generally very sunny throughout, with between six and eight hours of daily sunshine throughout the year; slightly more in the south of the island. Up in the mountains, however, temperatures can drop to as low as single figures, especially in winter; when wind chill from the trade winds can make it feel even colder. On the coasts, sea temperatures are mostly warm all year round.",News/News,Weatherwatch: the varying climate of the Dominican Republic,https://www.theguardian.com/news/2022/apr/02/weatherwatch-varying-climate-of-dominican-republic
4/2/2022,"The war in Ukraine has come with an ever-present threat of cyber catastrophe, as experts and US military officials remain on high alert for potential hacks. And while the big one has yet to come, the battle online continues to escalate. UK intelligence officers warned on Thursday that Russia is increasingly seeking out cyber targets as its ground military campaign in Ukraine stalls. Additional reports on Wednesday revealed Russian hackers recently attempted to penetrate the networks of Nato and the militaries of some eastern European countries. These developments showed that “things are heating up” on the cyber front, said Theresa Payton, cybersecurity expert and former White House chief information officer. “We should prepare for the worst and operate at our best,” she said. Still, Payton noted, Russia had been very slow to deploy cyber tactics in the war to date. There could be a number of reasons for this, she said: Putin might not feel the need to use cyber-attacks in his strategy at this juncture in the war, or he might want to avoid additional retaliation promised by the US in the case of a cyberwar. Putin might also be “playing a long game” and having his cyber operatives infiltrate various adversaries and gain footholds, then wait until he decides to launch a cyber-attack. “It is possible that digital attacks are under way and not fully understood in the fog of a ground war,” Payton said. Although Russia has been slow to carry out major attacks, it has been targeting Ukraine in other ways. On 24 February, more than 10,000 modems of the satellite broadband provider Viasat were knocked offline in a hack that US officials have attributed to Russia. Although that attack sabotaged hardware across Ukraine and is continuing, it was more likely Russia would focus its resources on cyber reconnaissance missions than forceful attacks, said Glenn S Gerstell, former general counsel of the National Security Agency and Central Security Service. “We know Russia is quite sophisticated in cyber surveillance and in spying on their adversaries, and we can assume they would want to find out about sanctions and other intel,” he said. The US announced additional sanctions against Russia, including on its technology sector, this week. The White House said on Thursday that the US had evidence that the war against Ukraine had been “a strategic disaster” for Russia and would only worsen as sanctions increased. Gerstell said it was difficult to foresee what kind of offensive Russia would launch because its strategy throughout this conflict had been unpredictable. But Putin’s response might change as the situation on the ground does, he added. “As they begin to lose, Putin may stray from what we think of as rational calculations of risk and reward,” Gerstell said. “If his rule is threatened, all bets are off on what thresholds he may cross in terms of cyber response.” Reuters contributed to this report",News/World news,"Russia’s slow cyberwar in Ukraine begins to escalate, experts say",https://www.theguardian.com/world/2022/apr/01/russia-ukraine-cyberwar
4/2/2022,"‘My grandma would always say the spoon has to stand up straight [in a borsch] – it has to be full of vegetables,” says the Ukrainian cook and food writer Olia Hercules in a video we made together of her plant-based borsch. She adds that, while borsch is a soup, it’s also a hearty meal in itself that gets better with time, so she advises making a big batch and enjoying the leftovers over the following days. What strikes me about borsch is that, beyond the beetroot, the other ingredients are pretty flexible, making it a great fridge-raid recipe to use up all kinds of vegetables. Add potatoes and/or any beans, other root veg such as parsnips, turnip or swede, and greens in the form of beetroot leaves or any cabbage or kale – I use both red and green cabbage in today’s recipe, which is in support of the #CookforUkraine initiative. Like the famous Italian ribollita, this vibrant Ukrainian soup is hugely adaptable and can use up all sorts of seasonal odds and ends. To prevent waste, don’t peel any of the veg, and include the cabbage cores and kale stems, both of which can be grated or cut into fine matchsticks along with the beetroot. Olia’s book Summer Kitchens: Recipes and Reminiscences from Every Corner of Ukraine features a borsch with duck and smoked pears, but my recipe is plant-based; if you want, make a thrifty meat version by using a rich duck or chicken stock made with carcasses saved from the butcher’s bin (they often come with scraps of meat on them, so pick this off and add to the soup, too. Serves 6 2 small beetroots (with the leaves, if available)3 tbsp red-wine vinegar, or other vinegar200g peeled onion and/or leek1 carrot1 tbsp olive oil1 x 400g tin chopped tomatoes, or 400g fresh tomatoes, chopped1 litre vegetable stock, or water, or chicken or duck stock300g potatoes and/or other root vegetables (parsnips, turnips, swede) and/or beans of any kind400g greens (white cabbage, kale, beetroot leaves, etc), sliced2 garlic cloves, peeled and finely choppedSalt and black pepperSoured cream and dill, to serve Cut the beetroots into fine matchsticks, then with the vinegar. Roughly dice the onion and grate the carrot, then saute in the oil in a large saucepan until they start to caramelise. Stir in the beetroot and its vinegar (save a few beetroot sticks to garnish), the tomatoes and stock, and add the root veg and beans – I used diced potatoes and haricots. Bring to a boil, simmer for five minutes, then add the greens. Return to the boil and simmer for five minutes more, until the greens and roots are tender. To finish, stir in the garlic, season and serve topped with soured cream, dill and the reserved colourful beetroot sticks.",Lifestyle/Food,How to turn leftover veg into a nourishing soup – recipe | Waste not,https://www.theguardian.com/food/2022/apr/02/how-to-turn-leftover-veg-into-nourishing-soup-recipe-fridge-raid-borsch-zero-waste-cooking
