4/7/2022,"The world, we are told, is in a state of chaotic and unprecedented flux. Technology is changing our lives at a frightening rate. All across the globe, societies are fracturing and falling apart. The destruction of the planet is accelerating before our eyes. Every passing week seems to bring new ruptures, new shocks, new disfigurements. But Luka Modric is still running the midfield for Real Madrid, so, you know, that. And not just Modric: as white shirts insouciantly knocked the ball around the Stamford Bridge lawn in the closing minutes, it was like peering through a telescope into a perfectly preserved phantasm of the past. Toni Kroos had already gone off, but Casemiro was still there, snapping and scurrying like a man looking for a lost wedding ring. So was Dani Carvajal. So was Nacho Fernández. Even Gareth Bale had treated us to a rare foray from the bench, boosting his daily step count if little else. And then, of course, there was Karim Benzema: jersey still moist from the rain, features still etched with a pure, restless desire. Carlo Ancelotti finally took him off in the 86th minute, but the Madrid fans were still singing his name half an hour later. Benzema came over to greet them, and while his teammates disappeared down the tunnel Benzema lingered a little longer, savouring the moment, perhaps hoping to eke it out forever. The gilded lineage, the familiar faces and rhythms, the comfort of continuity: this is the gift of Madrid, but also its curse. After all, they arrived in London with points to prove. It is a very Madrid sickness to be 12 points clear in La Liga and still basically grumbling about everything, but since the turn of the year – and certainly in recent weeks – not all has been well. Against Barcelona in the Clásico, they looked limp and leaden, a team that had run out of ideas and puff. Modric and Kroos were overrun in midfield. Madrid lost 4-0. And when you look at this squad, what strikes you above all is the encrusted decadence, the sense of extravagant waste. Their bench here was full of players you forgot existed: Mariano, Bale, Dani Ceballos. Isco is still there. Eden Hazard and Luka Jovic are still there. Marcelo is still there. Madrid don’t need Kylian Mbappé. They need an HR department. By rights, then, Ancelotti’s side should be in a kind of spiralling decline, the sort of slow crisis that takes a decade to fix. But of course, they’re not. Part of the reason is that their footballers are still extremely good. Modric was brilliant here: teasing and controlling and manoeuvring the midfield despite looking increasingly like a 70-year-old Jimmy Bullard. Again, Modric shouldn’t really be doing this. He’s a month older than Wayne Rooney. Jorginho cleaned him out after his very first touch. Antonio Rüdiger ran past him as if he wasn’t there. And briefly it felt as if Chelsea, with their superior fitness, their superior organisation, their Premier League speed and intensity, might just run Madrid off the park. And yes, Real’s midfield is not quite as nimble as it used to be. They rarely push into the final third. They do not show for the ball from Thibaut Courtois. And so their utility is strictly delineated. If a centre-half gets into trouble, or the front three have messed up the press, Modric and Kroos are not coming to save you. But as Madrid came into the game, probing the spaces behind Chelsea’s wing-backs, we were reminded that speed is not simply a physical attribute. It was Kroos who played the forward pass that led to Benzema’s opening goal: a symphony of perfectly-pitched high-grade attacking talent, the sort of goal Paris Saint-Germain still occasionally score when they’re not scowling at each other. Next it was Modric to turn provider, another headed miracle from the brass neck of Benzema. By which point, of course, there was no longer any doubt as to the identity of tonight’s star attraction. Consider: Benzema spent the prime years of his career as a sort of human sacrifice, running the channels and occupying defenders so Cristiano Ronaldo could be the man. He watched his country win a World Cup on television because of a six-year international exile. At 34, with 16 years of top-class football in his legs, it would be entirely reasonable for him to be winding down his career, perhaps with a well-paid sinecure in China or the United States, and thereafter a comfortable life of cryptocurrency partnerships and Uefa draws. And yet all along there was an impatience to him, a fire that never went out, an urge to sharpen the edges of his game, push his limits. Édouard Mendy will be blamed for Madrid’s third goal but we should acknowledge the pure hunger from Benzema to hunt down a lost cause, the same hunger that took him from the banlieues chaudes of Lyon to the pinnacle of the game, to never stop chasing, to never stop dreaming. None of which obscures the very real and pressing questions Madrid face over the next six to 18 months. This squad does need renewal. It does need a vision. Ultimately it probably needs a new coach. A valid criticism of Madrid is its continued reliance on these ageing stars, a refusal to accept that things change and nothing lasts forever. But on nights like this, you realise why it remains such a seductive fantasy.",Sport/Football,Real Madrid and Karim Benzema offer the comfort of continuity | Jonathan Liew,https://www.theguardian.com/football/blog/2022/apr/06/real-madrid-and-karim-benzema-offer-the-comfort-of-continuity
4/7/2022,"Manchester City will mark the 10th anniversary of their first Premier League triumph by unveiling a statue of Sergio Agüero, the club’s record goalscorer whose last-minute strike claimed the 2011-12 title. Agüero was in his first season at City when his finish on 93 minutes and 20 seconds beat Queens Park Rangers 3-2 and edged out Manchester United for the championship on goal difference. The statue, made by the sculptor Andy Scott, will be presented at the Etihad Stadium on 13 May – the same date as the QPR win – to mark what was City’s first domestic crown in 44 years. The former Argentina forward, who left City in the summer and has now retired, will attend alongside former teammates and fans can attend – by ballot – a celebration at the nearby Mayfield Depot. Agüero’s statue will join those of Vincent Kompany and David Silva, two of the other key players in the club’s current era of glittering success under the ownership of Sheikh Mansour.",Sport/Football,Manchester City to unveil statue of Sergio Agüero on anniversary of title,https://www.theguardian.com/football/2022/apr/06/manchester-city-to-unveil-statue-of-sergio-aguero-on-anniversary-of-title
4/7/2022,"Britain’s employers are being forced to shoulder a £9bn tax rise after the government pushed ahead with raising national insurance on Wednesday despite stiff opposition. Company bosses said the 1.25-percentage-point rise in national insurance contributions (NICs), which is paid by workers and their employers, would add to already severe pressure from runaway inflation and soaring business costs this year linked to Covid, Brexit and Russia’s war in Ukraine. “[The] national insurance rise piles another cost pressure on top of firms at a time when they can ill afford to bear it,” said Shevaun Haviland, the director general of the British Chambers of Commerce. “Members are telling us that energy bills are soaring while the price of raw materials are reaching levels many have never encountered before. This comes alongside vastly increased shipping costs and a squeezed labour market.” According to Treasury figures released in response to a parliamentary question from Labour, the portion paid by employers is to raise £8.8bn for the exchequer in the current financial year. The brunt of the rise will be borne by key sectors including manufacturing, which is facing extra taxes worth £900m. Employers in the health and social care sector will be taxed £1bn extra, while those in the wholesale and retail trade will face a similar increase and the construction industry will be landed with a bill worth £400m. Jonathan Reynolds, the shadow business secretary, said the figures showed the government was not on the side of employers. “The Conservatives’ decision to hike taxes during a cost of living crisis will make things even harder for businesses and families,” he said. Reynolds said Labour would instead have launched a one-off windfall tax on profits made by oil and gas producers amid the surge in energy prices, which would be used to help small firms with tax cuts and support for energy intensive industries such as ceramics. With inflation at the highest rate since at least the early 1990s, the government has faced heavy criticism from across the political spectrum for pushing ahead with the manifesto-busting NICs rise Designed to raise billions of pounds to fund health and social care, the move has prompted questions about the timing, amid Britain’s worsening cost of living crisis, with critics arguing that other options could have been pursued to raise the money. Defending the plan on Wednesday, Boris Johnson said he had “absolutely no problem” with the increase because it was “unquestionably the right thing for our country” as the health service faced growing demand and grappled with a backlog built up during the pandemic. However, employers groups said it would inflict pain for businesses struggling to recover from the Covid shock to the economy. Martin McTague, the national chair of the Federation of Small Businesses, said it was a “jobs tax hike” that would hurt workers and employers. “The small business tax burden is now at its greatest since the 1950s – a development which couldn’t have come at a worse time, with spiralling energy costs, input cost inflation, supply chain disruption and Covid-related staff absence all taking their toll,” he said. Research from the manufacturers’ trade group Make UK shows as many as 60% of industrial firms believe the rise will have a moderate or significant impact on their recruitment plans, while almost three-quarters say it will add to inflationary pressures that will be passed on to consumers. “The NICs increase is just one of many significant costs facing UK manufacturers and there will be a big question as to whether the UK is a competitive place to do business right now,” a spokesperson for the group said. The Treasury said it was supporting workers and businesses with rising costs, including a tax cut worth £1,000 for half a million small firms by increasing the employment allowance – a tax break on wage bills – starting from Wednesday. The chancellor, Rishi Sunak, used his spring statement last month to offset some of the impact of rising inflation, including an increase in the threshold at which workers begin to pay national insurance from £9,880 to £12,570 that comes into effect from July. On top of a package of energy support including a council tax rebate and loan scheme announced in February, Sunak announced a 5p cut to fuel duty rates, a £500m increase in a household support fund and pledged a 1p cut in the basic rate of income tax in two years’ time. However, only £1 in every £3 of the measures announced by the chancellor will go to the poorest half of people in Britain, according to the Resolution Foundation. The Institute for Fiscal Studies estimates the national insurance rise will rake in about £17.2bn in total for the exchequer from workers and employers, far more than the £6.3bn cut for workers benefiting from the threshold change. A government spokesperson said it was supporting employers and workers. “No government can control the global factors pushing up prices, but we will act where we can to support businesses,” they added.",News/Politics,National insurance rise forces UK employers to shoulder £9bn tax burden,https://www.theguardian.com/politics/2022/apr/06/national-insurance-rise-uk-employers-tax
4/7/2022,"Government industrial strategies are often derided as attempts to pick winners. The UK’s Conservative government has taken a different approach with its new energy strategy. In terms of dealing with the energy bill and climate crises, it’s picking losers. It is crystal clear that transforming the energy efficiency of the nation’s draughty homes should be the No 1 priority. After all, the cheapest, cleanest energy is the energy you no longer use and nothing can be installed faster than insulation. There are huge opportunities – for example, just 40% of UK homes have sufficient loft insulation. But there is nothing new in the strategy beyond an advice website. Former Tory energy minister Charles Hendry calls this a “major misjudgment” that will “force large numbers of very vulnerable people to be cold next winter when they need not be”. The next priority should be renewable electricity, now six times cheaper than that from gas-fired power stations. There are 649 wind and solar projects that already have planning permission. These would save more gas than the UK imports from Russia. But the strategy promises nothing to cut the planning regulations that David Cameron used to strangle onshore wind development and large-scale solar farms. The vast majority of people, including Tory voters, back more wind power in their areas, polling consistently shows. But your future energy bills now will be even higher than they need to be because ministers are worried a tiny minority of people can’t cope with looking at turbines. There is a boost to offshore wind, a genuine British success story, but it is unavoidably more expensive than onshore wind. The “big bet” Boris Johnson has chosen to take is on nuclear power. Business secretary Kwasi Kwarteng said this week that “there is a world where we have six or seven sites in the UK” by 2050. That world is never-never land. Nuclear power is the only major energy technology that has increased in cost in the last decade and routinely suffers from massive time and budget overruns. Even Kwarteng acknowledges that France’s large nuclear fleet “cost a fortune”. The gamble Johnson is making, with taxpayers’ money, is that nuclear power is a more reliable wager to secure clean future power than renewables and fast-developing energy storage technologies. It’s a long shot. Renewables and storage will develop much faster and get much cheaper due to the rapid learning that comes with small-scale technologies, unlike colossal projects like nuclear. The Intergovernmental Panel on Climate Change’s (IPCC) report on Monday, produced by scientists from across the globe and signed off by 195 governments, mentions renewables, wind, solar and efficiency 67 times in its summary. It cites nuclear once (in brackets), as an example of a technology with high upfront costs. The UK energy strategy also backs more drilling for oil and gas in the North Sea – which flies in the face of its own net-zero climate targets. Furthermore, the dwindling reserves that remain cannot lower the price of commodities, which is set by a global market. Don’t just take that from me; Kwarteng, energy minister Greg Hands and COP26 president Alok Sharma all agree. On Monday, after the IPCC report, the UN secretary general, António Guterres, said: “The truly dangerous radicals are the countries that are increasing the production of fossil fuels. Investing in new fossil fuel infrastructure is moral and economic madness.” That is the UK he is now talking about. The only good news is that shale gas has been sidelined, with a review of safety a sop to the small group of noisy frackheads on the Tory back benches. Another of Johnson’s “big bets” is on hydrogen, apparently in the hope that it can be used to heat a third of UK homes as an alternative to fossil gas by 2050. That is folly, not least as heat pumps will be much cheaper and less polluting. Using fossil fuels could produce lots of hydrogen, but also cement our dependence on oil and gas, while belching out CO2. Green hydrogen – produced from renewables – will be very expensive for years, and the limited supply should be reserved for sectors that are really hard to decarbonise. Why has the government got this so wrong? It’s partly short-term politics. An “ally” of the chancellor, Rishi Sunak, is reported to have defended the refusal to fund more energy efficiency by saying: “We have to be scrutinising every extra penny of taxpayer money that is proposed for spending because ultimately we want to do the Conservative thing and cut taxes for people.” That is, just before the next election. It is also partly the adherence to the dogma that the only solution to problems is “our treasured free-market economy”, as Kwarteng described it on Tuesday. That is despite the warning in 2011 from the government’s own climate adviser that “leaving [energy efficiency] to the market has never worked anywhere in the world”. He was right. The first of two big failed efficiency schemes saw loft insulations plunge by 93%. Most depressingly, the energy strategy’s failings seem also partly due to Johnson’s penchant for big, shiny projects, rather than the hard graft of thousands of smaller ones. But the six or seven nuclear power plants he dreams of are likely to follow the same fate as his island airport, garden bridge, and tunnel to Northern Ireland. Helen Clarkson, at the business-focused Climate Group, said: “We have tools and technologies already available which can radically reduce our energy needs and our carbon emissions now. Energy efficiency measures can deliver immediately in cutting people’s fuel bills and get us on the path to net zero in the longer term. There’s a huge opportunity for a win-win here which the government is passing up.”",News/Environment,‘Major misjudgment’: how the Tories got their energy strategy so wrong,https://www.theguardian.com/environment/2022/apr/06/major-misjudgement-how-the-tories-got-their-energy-strategy-so-wrong
