12/22/2021,アルゼンチンで１０、１１月に開かれたパラグライダーの世界大会に、日東精工（京都府綾部市）の社員、岩﨑拓夫さん（３８）＝京都府福知山市駒場新…,スポーツ,パラグライダーの世界大会に出場、日東精工社員が実感したこと,https://www.kyoto-np.co.jp/articles/-/697953
12/22/2021,京都府亀岡市に移住してきた２組の男女４人が、旭町にある耕作放棄地をさまざまな人が気軽に交流できる広場に生まれ変わらせた。荒れ果てた敷地を整…,文化・ライフ,耕作放棄地を交流広場に再生　京都・亀岡移住の4人「ふらっと寄れる場に」,https://www.kyoto-np.co.jp/articles/-/697764
12/22/2021,日本新薬（京都市南区）が、社会人野球の硬式野球部員らによる運動教室を京都府宇治市槙島町の槙島ひいらぎこども園で開いた。子どもたちは部員から…,社会,「バッティング楽しい」こども園で社会人野球の部員らによる教室,https://www.kyoto-np.co.jp/articles/-/697657
12/22/2021,「建設中の高速道路の高架下を遊び場に」「コロナでも楽しいイベントを」―。京都府城陽市寺田の西城陽中の生徒たちが、市職員らを学校に招き、大人…,社会,「高速道路高架下を遊び場に」中学生が提言、京都・城陽のまちづくりは?　,https://www.kyoto-np.co.jp/articles/-/697647
12/22/2021,柔軟剤や農薬といった、生活にあふれる微量の化学物質に反応し、頭痛やめまい、倦怠（けんたい）感といった症状に襲われる「化学物質過敏症」に苦し…,特集/取材ノートから,化学物質過敏症に対応した教室、両親や学校の思いの結晶,https://www.kyoto-np.co.jp/articles/-/697491
12/22/2021,京都府長岡京市で次世代リーダーの育成に取り組むボランティア団体「どんぐり会」が、小中校生を対象に「冬の研修会」を開いた。市内を探索しながら…,社会,写真の風景を探しながら目的地へ　小中学生がチームで協力　京都・長岡京,https://www.kyoto-np.co.jp/articles/-/697139
12/22/2021,１９９２年度に山城が準優勝した後、京都勢は１７年間で初戦敗退が１１度と苦戦の時期が続いた。京都の復権を全国に示したのは、２０１０年度の第８…,スポーツ,個性派の久御山、新鋭校の京都橘　京都の復権示す,https://www.kyoto-np.co.jp/articles/-/696777
