04/17/2022,茶道裏千家淡交会青年部の「ナショナルコンファレンス２０２２」が１６日、京都市左京区の国立京都国際会館で始まった。オンライン併用の初のハイブ…,文化・ライフ,デジタル時代の茶道見つめ　裏千家淡交会青年部、コンファレンス開幕,https://www.kyoto-np.co.jp/articles/-/773716
04/17/2022,日本で鉄道が開業した１８７２年当時から使われていた「腕木（うでぎ）式信号機」について学ぶセミナーが１６日、京都市下京区の京都鉄道博物館であ…,文化・ライフ,「腕木式信号機」人力操作を体験　鉄道開業時から使用、京都鉄博でセミナー,https://www.kyoto-np.co.jp/articles/-/773678
04/17/2022,都人に変身して古代の長岡宮に思いをはせてはいかが－。京都府向日市寺戸町の市文化資料館を拠点に活動する「古代衣装製作ボランティア」のメンバー…,文化・ライフ,古代衣装まとい長岡宮に思いはせ　京都・向日で着用体験受け付け,https://www.kyoto-np.co.jp/articles/-/773676
04/17/2022,２５日で発生から１７年になる尼崎ＪＲ脱線事故で負傷し、その後自死した息子の名誉のため闘い続けた岸本早苗さん（７７）＝兵庫県宝塚市＝が昨秋亡…,社会,尼崎脱線事故後に息子自死、闘った母逝く　天橋立沖、家族思い出の海に散骨,https://www.kyoto-np.co.jp/articles/-/773166
04/17/2022,旧３町の合併時から懸案の一つだった京都府与謝野町の庁舎再編は二転三転し、１０年以上たった今も進んでいない。財源不足や住民合意の難しさが課題になっており、１０日の町長選で３選を果たした山添藤真町長は「今後４年間で庁舎再編に動きだすことは想定していない」と話す。一方で、将来のまちの姿を考えるため昨年始まった住民会議では、３庁舎の一本化を望む声が高まっている。行方はどうなるのだろう。  　与謝野町は２００６年の合併後、旧３町の庁舎をそのまま活用している。岩滝に本庁舎を置き、議会や教育・福祉関係の部署は加悦庁舎、戸籍や上下水道部門は野田川北庁舎に入る。本庁舎から加悦庁舎までは約９キロ離れており、車で,文化・ライフ,3町合併16年、庁舎再編進まず　京都・与謝野、財源不足や住民合意難しく,https://www.kyoto-np.co.jp/articles/-/772940
04/17/2022,機械修復を趣味とする男性が、ちょうど１００年前に製造され動かなくなっていた米国製の農業用石油発動機を修復した。本体とシリンダーヘッドの間の…,社会,燃料タンクは酒瓶、100年前の発動機「動いた」　京都の79歳男性が修復,https://www.kyoto-np.co.jp/articles/-/772003
04/17/2022,枯れ草焼きが原因とみられる火災が起きた空き家（中央）。約１５０平方メートルが全焼した（４月８日、京都府綾部市広瀬町）京都府北部で３月以降、枯れ草焼きやたき火を原因とする火災が相次いでいる。空気が乾燥した日が続き、風にあおられて建物や山林に燃え移るケースも出ており、各消防本部は注意を呼びかけている。福知山市では今年に入り、１６件の火災が発生。３月以降でも８件と多発しており、このうち７件が枯れ草焼きやたき火に起因する火災だった。農繁期を前に田畑や庭先で枯れ草を燃やすケースが増えており、半数以上が強風注意報や乾燥注意報の発令時だった。綾部市でも３月下旬以降で４件発生。うち２件が枯れ草焼きが原因とみられ、今月８日には空き家に燃え移って全焼する火災が起きた。舞鶴市でも年明け以降で４件と多く、過去１０年の平均発生件数（年２・３件）を既に上回った。出火場所はいずれも田畑で、４日には同市志高で野焼きの火が風で広がり休耕地約２０アールを焼いた。各消防本部は「春は空気が乾燥し、火災が発生しやすい。強風や乾燥時にはたき火を控えて」と話している。,社会,強風や乾燥、たき火は控えて　火災続発で消防呼び掛け,https://www.kyoto-np.co.jp/articles/-/771969
04/17/2022,京都府長岡京市と京都三菱自動車販売（京都市南区）、三菱自動車が災害時に電気自動車を活用する協定を結んだ。停電が発生した場合、両社が長岡京市…,社会,京都・長岡京市、災害時にEV車活用で協定結ぶ　1台で一般家庭12日分,https://www.kyoto-np.co.jp/articles/-/771420
