02/18/2022,１８日朝、京都市左京区大原の里は,文化・ライフ,モノトーンの世界,https://www.kyoto-np.co.jp/articles/-/734791
02/18/2022,今年で開店２５周年を迎えるジェイアール京都伊勢丹（京都市下京区）が２月２３日～３月７日、「ジェイアール京都伊勢丹　開店25周年記念　春のお…,文化・ライフ,ジェイアール京都伊勢丹「春のおいしい北海道展」　2月23日～3月7日,https://www.kyoto-np.co.jp/articles/-/734778
02/18/2022,政治資金はろ過器を通ったものでなければならない。ろ過をよくしてあれば、問題が起こっても政治家本人には及ばない－。そう言い放ったのは、後に首…,社会,コラム凡語：マネーロンダリング,https://www.kyoto-np.co.jp/articles/-/734760
02/18/2022,Ｊ１京都サンガＦＣは１９日午後２時から、サンガスタジアム京セラで浦和との開幕戦に臨む。ホームでの初戦は３年ぶり。１７日のオンライン取材で、…,特集/京都サンガ応援特集,サンガ曺監督「興味引くため序章をしっかり」　19日開幕・浦和戦「熱く」,https://www.kyoto-np.co.jp/articles/-/734106
02/18/2022,京都府内最大のソバ産地である丹波３市町で、効率的にソバを栽培する方法の実証実験が進んでいる。京都府南丹広域振興局が昨年から京丹波農業公社と…,文化・ライフ,ドローンでソバの種まき、栽培効率化へ　京都・丹波３市町で進む実証実験,https://www.kyoto-np.co.jp/articles/-/733119
02/18/2022,京都市右京区の北桑田高の森林リサーチ科の３年生６人が作った木製のテーブルとベンチ３組が、左京区の叡山電鉄貴船口駅の待合室とホームに設置され…,社会,高校生が駅のベンチ制作「木のぬくもり感じて」　叡電・貴船口駅に設置,https://www.kyoto-np.co.jp/articles/-/732834
