01/14/2022,強い冬型の気圧配置となった１４日、京都市で７センチの積雪を観測するなど、府内全域で大雪となった。各地の１４日午前８時の積雪は、北部山間部で…,社会,宮津市上世屋で85センチ、綾部市五泉町79センチ　京都府内の積雪一覧,https://www.kyoto-np.co.jp/articles/-/711309
01/14/2022,雪が降り積もった福知山駅前（１３日午前７時５分、京都府福知山市駅前町）一部路線を除いてＪＲが始発から運休となり、人もまばらな福知山駅前（１４日午前７時１０分、京都府福知山市駅前町）ＪＲ西日本福知山支社は、大雪のため１４日始発から運転を取りやめている山陰線胡麻―福知山間と舞鶴線全線について、同日午前９時ごろに再開できる見通しと発表した。山陰線福知山―和田山間は午前１０時ごろまで取りやめるとしている。,社会,【大雪】ＪＲ山陰線の運行再開へ　胡麻―福知山間と舞鶴線全線は午前９時ごろ,https://www.kyoto-np.co.jp/articles/-/711304
01/14/2022,【資料写真】京都縦貫道京都府道路公社は１４日午前７時半ごろ、京都縦貫自動車道の京丹波みずほインターチェンジ（ＩＣ）－京丹波わちＩＣ間の下り線（宮津方面行き）を通行止めにした。トンネル内で故障したトラックのけん引作業が必要になったため。復旧時期は未定という。,社会,京都縦貫道で通行止め　京丹波みずほＩＣ－京丹波わちＩＣ間の下り線,https://www.kyoto-np.co.jp/articles/-/711303
01/14/2022,ＪＲ西日本ＪＲ西日本によると、１４日午前６時頃、ＪＲ琵琶湖線（東海道線）の草津駅（滋賀県草津市）で信号トラブルが発生し、約５０分後に復旧した。この影響で、午前７時３５分現在、琵琶湖線の野洲－京都間、京都線の京都－大阪間の京都・大阪方面行きの列車に最大約５０分の遅れが発生した。影響が出たのは特急「はるか３号」など下りの計１３本。１万３０００人に影響が出た。同社は線路の分岐器に石が挟まっていたのが原因とみている。,社会,JR琵琶湖線の草津駅で信号トラブル、分岐器に石　「はるか」など13本に遅れ,https://www.kyoto-np.co.jp/articles/-/711299
01/14/2022,大雪となった１４日朝、京都市内も本格的な雪となり、午前７時に７センチの積雪を観測した。市内を流れる鴨川も一面の銀世界となった。　気象台によ…,社会,京都・鴨川も一面の銀世界、「船形」も風雪にかすむ　京都市内は本格的な雪,https://www.kyoto-np.co.jp/articles/-/711296
01/14/2022,真っ白な雪に朱の鳥居が映える上賀茂神社（１月１４日午前７時、京都市北区）大雪となった１４日朝、京都市内では午前７時に７センチの積雪を観測し、本格的な雪となった。洛北地域では、世界遺産の上賀茂神社などが雪化粧した。気象台によると、午前７時の京都府内各地の積雪は南丹市美山町２５センチ、舞鶴市２３センチ、京都市中京区７センチ。午前７時までの最低気温は京都市中京区で氷点下１度で、午前７時現在でも氷点下０・７度の寒さとなっている。洛北地域にある上賀茂神社では、１０センチほどの雪が積もった。真っ白な雪景色に朱の鳥居が映える参道を、犬の散歩をする人たちが寒そうに歩いていた。,社会,京都・上賀茂神社周辺は10センチ積雪　京都市中心部7センチ、氷点下１度,https://www.kyoto-np.co.jp/articles/-/711295
