03/21/2022,舞鶴衛生隊診療所の看板を除幕する関係者ら（舞鶴市泉源寺）自衛隊員や家族の診療を担う京都府舞鶴市泉源寺の自衛隊舞鶴病院が廃止され、１７日から舞鶴衛生隊診療所に移行した。人口減少社会の中での業務効率化などが理由で、病床数は５０床から１９床に減った。同病院は１９５４年に海上自衛隊舞鶴地区病院として開設され、８８年に陸海空自衛隊の共同機関として改称された。潜水病を治療する高気圧酸素治療装置などを備えるが、神奈川県の横須賀病院の機能強化で大湊、佐世保の病院とともに廃止となった。舞鶴衛生隊は約９０人体制でスタートし、診療所には医官約１０人が勤務する。この日、記念式典が行われ、看板の除幕式の後、衛生隊司令の庄野聡１等海佐は「今以上に有事・災害医療対応を確立し、隊員のかかりつけ医の機能を強化。自衛隊医療にまい進する」と式辞を述べた。,社会,自衛隊病院を廃止、衛生隊診療所に移行　病床数大幅減、京都・舞鶴,https://www.kyoto-np.co.jp/articles/-/752263
03/21/2022,新型コロナウイルスの京都・滋賀の感染状況や相談窓口、予防対策などを随時更新します。,社会,新型コロナウイルスの感染状況と生活情報,https://www.kyoto-np.co.jp/articles/-/230287
03/21/2022,京都を含む１８都道府県に適用中だった新型コロナウイルス対策のまん延防止等重点措置が、期限の２１日をもって解除される。　解除に伴い、京都府は…,医療・コロナ,京都府のまん延防止措置が21日で解除　時短終了も感染対策呼び掛け,https://www.kyoto-np.co.jp/articles/-/755070
03/21/2022,京都府と京都市が３月１４～２０日に発表した新型コロナウイルスの新規感染者は、６３７１人で前週比１４５８人（１８・６％）減、死者は６１人で同…,医療・コロナ,京都府内の感染者数は減少傾向も死者は増加　3日連続で10人死亡も,https://www.kyoto-np.co.jp/articles/-/755059
03/21/2022,京都府庁京都府と京都市は２１日、新たに４１９人の新型コロナウイルス感染を確認し、７人が死亡したと明らかにした。新規感染者の内訳は、府発表分が２０８人、市発表分は２１１人。死者は府発表分が４人、市発表分が３人だった。詳細は日夜に公表される。,医療・コロナ,京都で新たに419人感染、7人死亡　新型コロナ、21日速報,https://www.kyoto-np.co.jp/articles/-/755044
03/21/2022,京都市右京区内の小中学生でつくる右京ジュニア消防団がデザインした林野火災防止啓発看板が、同区の仁和寺北側にある御室八十八カ所霊場の一番札所…,文化・ライフ,動物が泣いちゃうよ　山火事に注意　小中学生デザインの啓発看板、京都・霊山寺前に,https://www.kyoto-np.co.jp/articles/-/754996
03/21/2022,地方鉄道の経営が厳しさを増し、運行本数を削減する動きが加速している。ＪＲ各社が今月のダイヤ改正で実施した削減規模は、民営化以降で最大となった。ＪＲ西日本が在来線で運行を取りやめたり運転区間を短縮したりした本数は５３０本で、昨年１０月改正時の約４倍だ。人口減少などで減る傾向にあった乗客数が、新型コロナウイルス禍による外出控えや在宅勤務の普及で一段と落ち込んだのが響いている。減便は通勤通学や外出の利便性を低下させ、まちづくりや生活の質にも影響する。コロナ収束後も完全には利用客が回復しないとみられる中、運行の縮小が「地域の足」の切り捨てにつながらないよう、自治体や住民を交えて対応策を検討する必要がある。今回の改正で京都や滋賀では昼間時間帯の削減が目立った。東海道線の米原－草津間の新快速や山陰線の亀岡－園部間、片町線の同志社前－木津間などの普通・快速がそれぞれ１時間あたり２本から１本にされた。関西６府県などでつくる関西広域連合は「住民の生活基盤を揺るがしかねない」と危機感を表し、コロナ後は減便を元に戻すよう要望した。だが、見通しは厳しいようだ。ＪＲ西は大都市部の路線や新幹線で稼いだ収益でローカル線の赤字をカバーしてきたやり方が成り立ちにくくなってきたと強調。不採算路線に関し「今考えなければ地域の輸送自体が廃れてしまう。新幹線や都市圏のサービスに影響を与えかねない」とする。ローカル線維持については、１日１キロ当たりの平均乗客数を示す指標「輸送密度」があり、かつては４千人未満がバス転換の目安の一つとされていた。国土交通省によると、２０２０年度はＪＲ６社で総営業距離の５７％に上り、コロナ禍前の１９年度から１６ポイント増えた。ＪＲ西は管内でさらに深刻な「２千人以下」の路線の収支を４月に開示する方針で、京都を通る路線では関西線や小浜線が含まれる。経営努力だけで乗り切るのが難しいのは確かだ。国交省が先月、ローカル鉄道の再構築を議論する有識者検討会をスタートさせたのも危機感の表れといえる。ＪＲ、私鉄も含めた鉄道の利用促進策やバスへの転換などに向けた政策の在り方を７月にまとめる。検討会では、富山市が富山駅を発着するＪＲ高山線での増便や駅新設で利用を促した社会実験が紹介された。その成果を踏まえ、同線は本数と利用客の増加を実現した。沿線自治体との協議を重ね、バス路線への転換なども試算した上で、公有民営化方式による存続が決まった近江鉄道（滋賀県）の例もある。鉄道を維持していくため、自治体の関与の仕方によっては住民の負担増の議論も出てこよう。将来を見据え、鉄道事業者と沿線自治体が地域の公共交通の在り方を具体的に描いていくことが必要だ。,社会,社説：鉄道の危機　「地域の足」守り切れるか,https://www.kyoto-np.co.jp/articles/-/754947
03/21/2022,中高生が和装の文化に親しむ「中高生限定！きもの着付け＆トークイベント」が２０日、京都市下京区の京都経済センターで開かれた。参加者は着付けに…,社会,和装文化に親しんで　中高生が着付けにチャレンジ「浴衣より難しい」,https://www.kyoto-np.co.jp/articles/-/754907
03/21/2022,年に１回「春分の日」にだけ運行する京都バス（京都市右京区）の路線のうち、京都市右京区太秦や左京区大原などを走る６路線が、１９日のダイヤ改正…,経済,ついに運行終了か…「春分の日」にだけ京都を走る「幻のバス路線」が廃止された理由,https://www.kyoto-np.co.jp/articles/-/754902
03/21/2022,ネットでの学習を中心とした通信制高校のＮ高（本校・沖縄県）とＳ高（同・茨城県）が、全国で生徒数が計２万人を超える人気を集めている。京都市内にもキャンパスがあり、政治家の講演を聴けるなどユニークな取り組みを展開している。Ｎ高の奥平博一校長に学校運営の狙いをオンラインで聞いた。  　－なぜＮ高を作ったのか。  　「通信制高の社会的評価が低いと感じていた。そこで制度は通信制だが…,文化・ライフ,「ネットの高校」Ｎ高、Ｓ高　生徒数2万人超、人気を集める理由を校長に聞く　,https://www.kyoto-np.co.jp/articles/-/754588
03/21/2022,ロシアの侵攻を受けるウクライナ国民を励まそうと、京都市下京区の京都駅ビルで２０日、音楽家や愛好家らが集い、ウクライナ国歌を合唱した。両国の…,社会,京都駅にウクライナ国歌響く、音楽家ら合唱　ウクライナ・ロシア両国の人も,https://www.kyoto-np.co.jp/articles/-/754744
03/21/2022,京都市伏見区の藤森神社で２０日、防災を学ぶ催しが開かれた。東日本大震災などの被災地で活動した警察官や消防隊員らが、当時の体験談を交えて備え…,社会,「近所の関係は防災に有効」「ガソリンは満タンに」　震災救援の警官ら語る,https://www.kyoto-np.co.jp/articles/-/754621
03/21/2022,京都府乙訓地域や京都市の水害対策として京都府が進めてきた「いろは呑龍トンネル」がまもなく全線稼働する。四半世紀に及んだ事業は、地域にどんな変化をもたらすのかを探った。　  　京都府向日市のＪＲ,社会,JR向日町・阪急洛西口、新たな街に安心感　でも「警戒を怠ってはダメ」,https://www.kyoto-np.co.jp/articles/-/753160
03/21/2022,ＮＨＫ連続テレビ小説「カムカムエヴリバディ」の舞台のモデルや撮影地になった東映太秦映画村（京都市右京区）。ドラマゆかりの小道具を集めた入場…,文化・ライフ,朝ドラ「条映映画村」が太秦にお目見え　モモケンポスターや「大月」チラシも,https://www.kyoto-np.co.jp/articles/-/749904
03/21/2022,＜西京極のスタンドは暑さと寒さの修行の場＞。２０１４年刊の「京都サンガＦ．Ｃ．あるある」に載る２４０あるエピソードの一つだ▼当時のサッカー…,スポーツ,コラム凡語：サンガのまちから,https://www.kyoto-np.co.jp/articles/-/754940
03/21/2022,バスケットボールＢリーグ１部は２０日、滋賀県草津市のＹＭＩＴアリーナなどで１１試合を行った。　「京滋ダービー」は京都ハンナリーズが７９―５…,スポーツ,ダービーマッチは京都ハンナリーズが連勝　滋賀レイクスターズは10連敗,https://www.kyoto-np.co.jp/articles/-/754925
03/21/2022,梅花祭で執り行われた献茶の儀（南丹市園部町・生身天満宮）梅の花をめでた菅原道真をしのぶ「梅花祭」が２０日、京都府南丹市園部町の生身天満宮であった。梅の香りが漂う境内で、参拝者らが無病息災や世界平和を祈った。今年で２２回目。境内には紅白の梅約１００本が植えられている。同社絵馬堂には雅楽演奏の伸びやかな音色が流れ、神事が厳かに行われた。市内外から参拝に訪れた約２０人がロシアによるウクライナ侵攻や東北地方で発生した地震の犠牲者に黙とうをささげた。例年は茶席を設けて参拝者に茶を振る舞うが、新型コロナウイルス対策のため取りやめた。代わりに武部由貴子禰宜（ねぎ）（５４）と巫女（みこ）が茶を供える「献茶の儀」が執り行われた。武部禰宜は「戦争など暗いニュースが続くが、春を告げる梅をめでて少しでも明るい気持ちになっていただきたい」と話した。,社会,梅の香りほのか、平和へ祈り　京都・南丹の生身天満宮で「梅花祭」,https://www.kyoto-np.co.jp/articles/-/754708
03/21/2022,＜京都＞ 【速度】中京署＝,社会,22日の主な交通取り締まり,https://www.kyoto-np.co.jp/articles/-/752844
03/21/2022,舞鶴市役所京都府舞鶴市は２０日、市が実施している新型コロナウイルスワクチンの３回目接種で、２回目から６カ月以上経過していない人に、誤って接種をしたと発表した。接種履歴が記載されている接種券の確認が不十分だったという。市によると、１９日に集団接種の予約でキャンセルがあり、会場の運営スタッフの１０代女性に接種したが、国が定める「２回目接種から６カ月以上経過」の条件は口頭のみで確認。接種後のデータ整理中、条件より８日早かったことが分かった。１９日時点で女性の体調に異常はないという。,特集/新型コロナウイルス,コロナワクチン誤って接種　2回目から6カ月経過していない人に　京都・舞鶴,https://www.kyoto-np.co.jp/articles/-/754761
03/21/2022,京都府の和束町と宇治田原町を結び、府道宇治木屋線のバイパスとなる「犬打峠トンネル（仮称）」の着工を祝う会が２０日、和束町白栖で開かれた。約１３０人が出席し、,社会,京都府道バイパス「犬打峠トンネル」着工　新名神へのアクセス向上に期待,https://www.kyoto-np.co.jp/articles/-/754632
03/21/2022,昼と夜の長さがほぼ同じとなる「春分」。今年は３月21日です。ヨーロッパなどでは、春分をもって春の始まりとなるよう。花だよりが待たれます。,特集/THE KYOTO,二十四節気 花飾り春分想い惑う花だより,https://www.kyoto-np.co.jp/articles/-/748192
03/21/2022,京都市が打ち出した保育士給与の補助制度見直しを巡り、補助金が削減される民間保育園から悲鳴が上がっている。試算額が各園に提示されてから新制度の移行まで１カ月足らず。「あまりに拙速すぎる」,社会,京都市の保育士給与補助見直し「乱暴すぎる」　保育サービス後退に懸念も,https://www.kyoto-np.co.jp/articles/-/751872
03/21/2022,京都府八幡市の美濃山・欽明台地区を通る山手幹線の交通渋滞解消へ、住民が活動に力を入れている。渋滞は立地する大型量販店が主な原因とみられ、店のオープン以降、長年の課題だ。生活への影響だけでなくバス運行にも支障を来すなど深刻化する中、住民らは店や府に直接要望を行い、効果的な対策を早急に講じるよう求めている。  　「土日は車で出かけないようにしている」「抜け道に住宅街を通る車で歩行者に危険が及ぶ」－。,経済,京都・八幡の大型店周辺で渋滞が慢性化　バス運行にも支障「対策は必須だ」,https://www.kyoto-np.co.jp/articles/-/752658
03/21/2022,◆3月22日（火）ＢＳ４Ｋ　午後0時30分～1時00分パン旅。京都の旅・４日間　「嵯峨・嵐山　ニュースタイルで味わう京食材」　※2022年…,文化・ライフ,京都テレビ案内 3月22日　ザ・ヒューマン「 “異彩” が変える」,https://www.kyoto-np.co.jp/articles/-/753533
03/21/2022,「桜が咲いているのは、川のそばが多いじゃないですか。その様子は、すごく風情があります」と語るのは、店主の澤井美穂さん。桜の塩漬けの隣には、…,特集/一日一パン,抹茶さくらもち＜petit Bonheur（プティ ボヌール）＞,https://www.kyoto-np.co.jp/articles/-/752256
03/21/2022,京都府と京都市は２０日、新型コロナウイルスに感染していた８人が死亡し、１０歳未満から９０歳以上の男女７６１人が新たに感染したと発表した。府…,特集/新型コロナウイルス,コロナ感染の8人が死亡　新規感染は761人　新型コロナ・京都、20日夜発表,https://www.kyoto-np.co.jp/articles/-/754777
03/21/2022,文化とは、何か。誰のためのもので、どこに向かうのか。国際日本文化研究センター（日文研）教授の山田奨治さんが、著作権との関係から文化を捉え直す著作を刊行するとともに、高齢化や人口減少が進む「縮小社会」における文化を考える共同研究に取り組んでいる。共同研究の内容は、京都国際マンガミュージアム（京都市中京区）で展示されている。   　著作権法は「文化の発展に寄与すること」を目的に掲げる。この言葉にさかのぼり、ユーザーの人権の観点から著作権や文化の考えを鍛え直すのが山田さんの野心作「著作権は文化を発展させるのか」（人文書院）だ。「文化（カルチャー）とはもともと、耕す（カルティベイト）の意味がある。人々の心を耕すこと。なのに、,文化・ライフ,著作権の考え鍛え直す「ユーザーの人権」とは　日文研の山田教授に聞く,https://www.kyoto-np.co.jp/articles/-/750702
03/21/2022,京都府南丹市八木町のＪＲ八木駅に１９日、西口が開設され、駅の東西を結ぶ自由通路や西口駅前広場の利用も始まった。駅西側の住民や観光客らの使い…,社会,京都・南丹のJR八木駅に西口駅前広場　人気の山城にアクセス向上,https://www.kyoto-np.co.jp/articles/-/754266
03/21/2022,高齢化が進む中、紙おむつのごみ量が増加の一途をたどっている。環境省は、２０３０年度に一般廃棄物の７％近くを使用済みおむつが占めると推計し、環境保護や焼却処理コスト低減の観点から、ごみ減量を呼びかける。京都市では増加傾向を注視している状況だが、一部自治体では分別回収やリサイクルの動きも出始めた。（森静香）  　環境省によると、子ども・大人用の使用済み紙おむつは全国で年間およそ２００万トン（１５年度）が焼却処分されており、家庭や事業所から出る一般廃棄物に占める割合は,社会,京都市で紙おむつごみ「無視できない量」　高齢化で増加、ごみ焼却に影響も,https://www.kyoto-np.co.jp/articles/-/752700
03/21/2022,科学と宗教が融合するとどうなるのか。こんなちょっと危険な香りが漂う魅惑的な問いと向き合っている仏教学者がいる。仏典を機械学習した仏教対話ＡＩ（人工知能）「ブッダボット」の開発など、伝統知と科学技術の融合に取り組む京都大こころの未来研究センターの熊谷誠慈准教授だ。仏教の新しい形を模索する俊英はいったいどのような未来を思い描いているのか。「頭の中」をのぞいてみた。  　－ブッダボットなど旧来の宗教観を刷新する技術を開発しています。そもそも宗教学に関心を持ったのはなぜですか。  　「私は実家が浄土真宗の寺でして、現在は住職を務めています。父が亡くなったため２０歳ごろから檀家（だんか）さんに法話を行うようになったのですが、私の若さもあって満足に話すことができませんでした。このままではだめだということで、大学で仏教学を修めようと思ったんです」  　－大学で学んだことは役立ちましたか。  　「むしろ仏教学がいかに現代人の役に立たないかを痛感しました。仏教学の知識を披露しても、,文化・ライフ,AIで「スーパー説法マシン」開発　京都大学の俊英が語る宗教と科学の融合,https://www.kyoto-np.co.jp/articles/-/750452
03/21/2022,京都市左京区大原の勝林院の本尊に納められた胎内仏「阿弥陀如来坐像」を紹介する展示会が、下京区の京都産業大むすびわざ館で開かれている。終えた…,文化・ライフ,京都・大原の勝林院に伝わる「胎内仏」公開　平安時代後期の作例,https://www.kyoto-np.co.jp/articles/-/738362
03/21/2022,京都府庁京都府と京都市は２０日、新たに７６１人の新型コロナウイルス感染を確認し、８人が死亡したと明らかにした。新規感染者の内訳は、府発表分が２９９人、市発表分は４６２人。死者は府発表分が４人、市発表分が４人だった。詳細は２０日夜に公表される。,医療・コロナ,京都で新たに761人の感染確認、8人死亡　新型コロナ、20日夕速報,https://www.kyoto-np.co.jp/articles/-/754694
03/21/2022,世界経済の急ブレーキとなる恐れと背中合わせといえる。米国の中央銀行に当たる米連邦準備制度理事会（ＦＲＢ）が、ゼロ金利政策を解除し、政策金利を０・２５％引き上げることを決めた。新型コロナウイルス禍への危機対応で導入した異例の大規模緩和措置を２年で終了し、金融政策の正常化を加速させることになる。米国内の歴史的なインフレの抑制を迫られての転換だが、金融引き締めは過度に景気を冷やすリスクを伴う。利上げが米国へのマネー流入を加速させ、新興国からの急激な資金流出などで世界経済の減速や金融市場の混乱が広がる懸念もある。日本も景気後退と輸入品の値上がりに同時に直面しかねない。その影響を注視していかねばならない。ＦＲＢの利上げ決定は、記録的な物価高騰を止めることを最優先した判断といえよう。米国の２月の消費者物価指数は前年同月比７・９％増に上った。第２次石油危機後の１９８２年以来、４０年ぶりという高インフレが暮らしを直撃し、国民の批判が強まっていた。今回の物価上昇は、コロナ禍からの経済再開に伴う需要の急拡大に製品や部材、働き手の供給が追い付かずに広がった。拍車を掛けたのがロシアのウクライナ侵攻だ。ロシア産原油や両国の穀物など世界的な輸出品の供給不安から、幅広いコスト上昇の圧力となっている背景があるだろう。ＦＲＢは、今回を含め今年中に７回の利上げを見込み、インフレ加速の要因ともなった金融の引き締めを急ぐ構えだ。パウエル議長は、雇用情勢の堅調さなどから「米経済は強い」と対応力を強調した。ただ、急な利上げは投資や消費を抑制し、景気後退にまで及ぶ恐れを排除できない。ウクライナ情勢のさらなる影響拡大や、世界経済の動向も見極めながら、利上げのピッチを含めて慎重にかじ取りしていく必要があるだろう。ＦＲＢの利上げは、マイナス金利を含む大規模金融緩和を続ける日本にも影響が大きい。日米の金利差の拡大がより鮮明となり、外国為替市場で円安が進行している。米利上げ決定後には１ドル＝１１９円台と約６年１カ月ぶりの水準まで下落した。供給面の課題による原油、穀物などの価格上昇に加え、円安の進行がさらに輸入物価を押し上げる懸念が強まっている。企業収益や家計への重いしわ寄せになりかねない。物価の上昇と景気停滞が同時に起きる「スタグフレーション」発生を危惧する専門家の指摘もある。だが、日銀の黒田東彦総裁は、原油高騰などを受けた「悪い物価上昇」に懸念を示しつつも、インフレ対応の政策転換には動かないとした。ＦＲＢや欧州中央銀行（ＥＣＢ）も金融引き締めを急ぐのに対し、なお大規模緩和の支えが必要という日本の姿勢の違いは大きい。その格差が円安と物価上昇を助長するジレンマをどう克服するかが問われよう。,経済,社説：米利上げと日本　景気失速のリスク警戒を,https://www.kyoto-np.co.jp/articles/-/754584
03/21/2022,長崎日大－近江　力投する近江の先発・山田（甲子園）第９４回選抜高校野球大会は２０日、兵庫県西宮市の甲子園球場で１回戦を行った。第２試合では、開幕直前に繰り上げで出場が決まった近江（滋賀）が延長十三回タイブレークの末６－２で長崎日大を破った。近江・多賀章仁監督は「出場辞退した京都国際の分まで思い切りやろうと試合前に言っていた。いい試合ができて心から良かったと思っている。京都国際のエースの森下君とうちの山田は仲が良い。山田は森下君の無念の思いを胸に持ち、気持ちのこもった熱投だった。途中で代えられない投球だった。本人も最後まで自分が投げるという気持ちでやっていた」と語った。,スポーツ,「京都国際・森下君の無念を胸に熱投」　近江のエース山田を監督たたえる,https://www.kyoto-np.co.jp/articles/-/754644
