11/11/2021,Ｊ２京都サンガＦＣは１０日、東城陽グラウンドで約１時間半練習を行い、縦へのスピードを意識した攻撃のトレーニングに取り組んだ。この日は抽選で招待されたファンクラブのサポーター３０人が曺監督が就任して初めて見学し、指揮官の指導や激しい球際の攻防を目の当たりにした。  　前節、磐田との首位攻防戦で惜敗したサンガ。,スポーツ,サンガが縦へのスピード意識した攻撃トレーニング　サポーターも見学,https://www.kyoto-np.co.jp/articles/-/673949
11/11/2021,秋の深まりとともに京都府乙訓地域でも紅葉が色づき始めた。本番はこれからだが、市街の各所で赤や黄の色の競演が目にまぶしい。紅葉の名所で知られ…,観光,長岡京・光明寺で色づくモミジ　楊谷寺も紅葉バージョンの花手水,https://www.kyoto-np.co.jp/articles/-/673560
11/11/2021,滋賀県彦根市出身で京都大に進み、４０年近く学生野球に携わってきた宝馨氏が１０日、日本高野連の新たな会長に選出された。京都市出身の八田英二会長に続き、京都関係者へのバトンタッチとなる。オンラインで会見した宝氏は「選手の夢を実現すべく甲子園大会が続くように尽力したい」と引き締まった表情で語った。  　京大の学生時代は投手。その後は監督や部長としてチームを支え、,スポーツ,高野連会長に宝氏「健康管理の課題を早急に検討」　新たな改革に意欲,https://www.kyoto-np.co.jp/articles/-/673982
11/11/2021,京都市議会が、市職員の「働き方改革」の視点を踏まえ、議会の審議日程などを見直す。全ての常任委員会で一般質問を事前通告制にするほか、質疑時間…,社会,京都市職員の非効率な働き方の一因　市議会が運営ルール大幅見直し,https://www.kyoto-np.co.jp/articles/-/673967
11/11/2021,秋の京都をいけばなで彩る「旧七夕会池坊全国華道展」（華道家元池坊総務所など主催）が１０日、京都市中京区烏丸通六角上ルの池坊会館と家元道場な…,文化・ライフ,秋の京都彩る「全国華道展」始まる　没後1400年の聖徳太子テーマ,https://www.kyoto-np.co.jp/articles/-/673851
11/11/2021,京都府民の府内旅行代金を割り引き、新型コロナウイルス禍で落ち込む観光業を支援する府のキャンペーン「きょうと魅力再発見旅プロジェクト」が、好調な滑り出しを見せている。予約開始から約２週間で約７万５千件に上り、特に冬の味覚のカニが楽しめる府北部などが人気を集めている。ただ、,経済,京都府民向けの旅行割引が申し込み好調　人気は府北部、その一方で…,https://www.kyoto-np.co.jp/articles/-/673811
