03/11/2022,人間の尊厳と平等を求めて部落差別と闘った全国水平社の創立１００周年に合わせ、京都市内の人権資料展示施設２カ所で、差別撤廃に取り組んだ京都の…,文化・ライフ,「京都で決起した精神知って」全国水平社創立100周年　活動家の生涯たどる,https://www.kyoto-np.co.jp/articles/-/747974
03/11/2022,京都地裁特定抗争指定暴力団神戸山口組系組員らが関与した特殊詐欺事件の被害者６人が１１日、同組の井上邦雄組長にも使用者責任があるとして、組長ら３人に計約６４５万円の損害賠償を求め、京都地裁に提訴した。原告は、京都市や宇治市などに住むいずれも８０代の女性。被告の３人は、井上組長のほか、神戸山口組傘下組織の組員で特殊詐欺グループの指示役だった男ら。訴状によると、被害者６人は２０１９年９～１２月、家電量販店員や警察官を装った詐欺グループから「キャッシュカードが不正利用されている」と言われ、それぞれ５０万～１００万円をだまし取られた。指示役の男は詐欺罪などで起訴され、一審は懲役５年の実刑判決を受けた。暴力団対策法は、組員が暴力団の威力を利用し財産を奪うなどすれば、組織のトップらも賠償責任を負うと規定。捜査機関の取り調べの中で、詐欺グループの一人が「（指示を）断ると家族に危害が及ぶ恐れがあった」と供述しており、指示役が組員の立場を示して犯行を継続させたと主張している。原告代理人の和田敦史弁護士は「泣き寝入りせず、提訴することが新たな被害の抑止につながる」としている。代理人によると、特殊詐欺事件を巡って暴力団組長の使用者責任を問うた訴訟は全国で１５件目で、京都では初めてという。,社会,神戸山口組の組長に損害賠償求め、京都地裁に提訴　特殊詐欺の被害者6人,https://www.kyoto-np.co.jp/articles/-/747907
03/11/2022,【資料写真】気象庁３月１１日午後６時１４分の地震の震度分布（気象庁HPより）気象庁によると、１１日午後６時１４分ごろ、兵庫県で最大震度２を観測する地震があった。震源は兵庫県南東部で、震源の深さは約１０キロ。地震の規模はマグニチュード３・４と推定される。大阪管区気象台によると、１１日午後５時５９分ごろに発生した地震の余震とみられるという。津波の心配はない。   　各地の震度は次の通り。   　震度２　兵庫県朝来市   　震度１　京都府福知山市、綾部市、京丹波町、兵庫県豊岡市、丹波篠山市、養父市、丹波市、多可町、福井県高浜町,社会,兵庫・朝来で震度2、京都・福知山や綾部で震度1　15分前の地震の余震か,https://www.kyoto-np.co.jp/articles/-/747958
03/11/2022,気象庁３月１１日午後５時５９分の地震の震度分布図（気象庁HPより）11日午後5時59分ごろ、京都府や兵庫県で最大震度３を観測する地震があった。気象庁によると、震源は兵庫県南東部で、地震の規模を示すマグニチュードは4・2、震源の深さはごく浅い。津波の心配はないという。各地の震度は次の通り。【震度３】   京都府　福知山市   兵庫県　三田市、丹波篠山市、丹波市、朝来市【震度２】   京都府　綾部市、南丹市、京丹波町   兵庫県　養父市、多可町   大阪府　大阪市都島区、大阪市東成区、大阪市生野区、大阪市北区、豊中市、高槻市、寝屋川市、能勢町【震度１】   京都府　京都市中京区、京都市右京区、京都市西京区、舞鶴市、亀岡市、向日市、長岡京市、八幡市、木津川市、大山崎町、久御山町、井手町、精華町、与謝野町   兵庫県　神戸市兵庫区、神戸市長田区、神戸市北区、姫路市、西宮市、豊岡市、加古川市、西脇市、宝塚市、三木市、川西市、小野市、加西市、加東市、猪名川町、神河町   大阪府　大阪市福島区、大阪市此花区、大阪市大正区、大阪市西淀川区、大阪市東淀川区、大阪市旭区、大阪市城東区、大阪市阿倍野区、大阪市東住吉区、大阪市西成区、大阪市淀川区、大阪市鶴見区、大阪市住之江区、大阪市平野区、大阪市中央区、堺市堺区、堺市中区、堺市西区、池田市、吹田市、泉大津市、守口市、枚方市、八尾市、富田林市、松原市、大東市、箕面市、羽曳野市、門真市、摂津市、藤井寺市、東大阪市、四条畷市、交野市、島本町、豊能町、太子町、河南町、千早赤阪村   福井県　高浜町、おおい町   奈良県　奈良市、大和高田市、大和郡山市、天理市、御所市、生駒市、香芝市、葛城市、山添村、三郷町、斑鳩町、高取町、広陵町   岡山県　和気町,社会,京都や兵庫で震度３　津波心配なし,https://www.kyoto-np.co.jp/articles/-/747941
03/11/2022,京都市教育委員会は１１日、新型コロナウイルスの感染拡大を受けて１月１８日から原則中止していた市立中学校での部活動について、今月１６日から条…,文化・ライフ,京都市立の中学校、部活動条件付き再開へ　16日から　春季大会控え,https://www.kyoto-np.co.jp/articles/-/747906
03/11/2022,東日本大震災の発生から１１年を迎えた１１日、京都市内では追悼行事や被災者の思いを発信する催しが開かれた。参加者らは、東北の地に思いをはせ、…,文化・ライフ,悲しみから笑顔の連鎖へ　京都・嵐山で追悼行事　「ＧＲｅｅｅｅＮ」ＨＩＤＥさんの言葉も,https://www.kyoto-np.co.jp/articles/-/747673
03/11/2022,日本三景・天橋立が位置する京都府宮津市文珠で、良質な景観づくりのために無電柱化工事が始まっている。全国から多くの観光客が訪れる地で、長年、…,社会,天橋立の景観すっきり　無電柱化工事始まる　京都・宮津「まちの品格と情緒復活」,https://www.kyoto-np.co.jp/articles/-/746996
