02/10/2022,Ｊ１京都サンガＦＣは９日、東城陽グラウンドで約１時間半の練習を行った。ピッチ全体で連動性を生むため、ボールがないサイドの選手の位置取りや、…,スポーツ,京都サンガ、攻撃の鍵は「シャトルの動き」　開幕戦に向け練習,https://www.kyoto-np.co.jp/articles/-/729075
02/10/2022,宇治市が９日に発表した２０２２年度一般会計当初予算案は、同年度からスタートする第６次総合計画の施策を重点的に盛り込んだ内容となった。一方、…,観光,水道料金14％値上げ　京都・宇治市22年度予算案　宇治茶の輸出支援も　,https://www.kyoto-np.co.jp/articles/-/729047
02/10/2022,京都市は１０日、一般会計９２０３億６５００万円と１１特別会計、４公営企業会計を合わせた総額１兆７９６９億６４００万円の２０２２年度当初予算…,観光,京都市予算案9203億円　22年度一般会計、行財政改革反映も過去2番目,https://www.kyoto-np.co.jp/articles/-/728990
02/10/2022,京都府宇治市は９日、一般会計６６８億３千万円、４特別会計と２事業会計を合わせた総額１２２９億９３００万円の２０２２年度当初予算案を発表した…,社会,京都・宇治市予算案668億円　22年度一般会計、脱炭素を促進,https://www.kyoto-np.co.jp/articles/-/728701
02/10/2022,ミッキーマウスやドナルドダックといったディズニーの人気キャラクターをデザインした伝統工芸品の展示会が、京都市左京区のみやこめっせ内の京都伝…,文化・ライフ,ディズニー×伝統工芸　ミッキーや白雪姫…京うちわや清水焼に　京都・左京で展示,https://www.kyoto-np.co.jp/articles/-/728167
02/10/2022,京都を拠点にするダンスカンパニー「モノクローム・サーカス」が、１１～１３日、京都市南区の小劇場ＴＨＥＡＴＲＥ　Ｅ９　ＫＹＯＴＯでダンス公演…,社会,コロナ禍や震災題材の公演　京都の「モノクローム・サーカス」が映す「今」とは,https://www.kyoto-np.co.jp/articles/-/728056
