12/30/2021,野中一秀氏来年４月２９日に任期満了を迎える京都府南丹市長選に、元市議の野中一秀氏（５４）が立候補する意向を固めたことが２８日、分かった。無所属での出馬を検討している。南丹市長選で立候補が明らかになったのは初めて。京都新聞社の取材に、野中氏は「行政機能の中心を担う園部町が牽引（けんいん）しながら、他の３町も特性を生かし、『心輝く豊かな南丹』をつくる」と語った。農林水産業の販路拡大などによる税収増、福祉行政の縦割り排除による家庭支援の充実などに取り組むという。立命館大卒。２０１４年の市議選で初当選し、１期務めた。１８年市長選に出馬し、西村良平氏（６８）に敗れた。元自民党幹事長の故野中広務氏と、旧園部町長の野中一二三氏はおじ。会社役員。南丹市園部町小桜町。西村氏は現時点で態度を明らかにしていない。,社会,京都・南丹市長選、元市議の野中氏が出馬へ　来年４月投開票,https://www.kyoto-np.co.jp/articles/-/701865
12/30/2021,来年１月１６日に京都市で行われる皇后杯第４０回全国都道府県対抗女子駅伝（日本陸連主催、京都新聞、ＮＨＫ共催、村田機械協賛）で、京都チームは、東京五輪１万メートル代表の安藤友香ら実力ある実業団勢と成長著しい中高生がそろった。感染対策のため、例年行う年末合宿の代わりに宿泊を伴わない練習会をスタートさせ、渡部博子監督は,スポーツ,【全国女子駅伝】京都チームは「隙ない編成」　実力派の実業団勢と中高生で,https://www.kyoto-np.co.jp/articles/-/702390
12/30/2021,来年１月１６日に京都市で行われる皇后杯第４０回全国都道府県対抗女子駅伝（日本陸連主催、京都新聞、ＮＨＫ共催、村田機械協賛）の選手エントリー…,スポーツ,全国女子駅伝の47チーム顔ぶれ決まる　田中希実ら五輪代表が出身地から,https://www.kyoto-np.co.jp/articles/-/702341
12/30/2021,吉崎篤子氏任期満了に伴う京都府綾部市長選（１月２３日投開票）で、新日本婦人の会綾部支部長の吉崎篤子氏（７２）が２８日、無所属で立候補する意向を表明した。綾部市長選では、現職の山崎善也氏（６３）が４選に向けて立候補を表明しており、２人の争いとなる見通し。共産党や労働組合、市民団体で構成する「みんなでつくる綾部民主市政の会」が吉崎氏に立候補を要請し、２８日、綾部市内で記者会見を開いて発表した。吉崎氏は、新型コロナウイルスのＰＣＲ検査を市が実施するよう要望してきた活動を踏まえ、「（市民の声を）市政に反映するチャンスが巡ってきた。何よりも命、暮らしを大切にする市政をつくりたい」と訴えた。吉崎氏は山形県米沢市出身。京都府の農業改良普及センター職員などを経て現職。綾部市岡町在住。,社会,京都・綾部市長選　吉崎氏が立候補表明、２人の争いに,https://www.kyoto-np.co.jp/articles/-/701843
12/30/2021,不妊治療を巡っては、ニーズの高まりに加え、金銭的負担が大きいことから、行政の補助制度を利用する人が多い。京都府内の申請件数は、２０１８年度８１７７件、１９年度７９４４件、２０年度９００８件に上る。  　府は国制度に,社会,京都府が不妊治療で独自の経済支援　ニーズ拡大で申請件数も増加,https://www.kyoto-np.co.jp/articles/-/701835
12/30/2021,７月、福岡県で保育園の園バスに男児が取り残され、熱中症でなくなる事故が起きた。京都市内の保育園などに安全対策を尋ねると、運転手以外の職員を同乗させたり、法令で装備義務のないシートベルトを自主的に取り付けたりしていた。市保育園連盟は「事故は園の社会的責任も大きい」とし、独自の安全マニュアル策定に向け、実態調査に乗り出した。＝１０月３日掲載  　私自身、２人の子を園バスで幼稚園に通わせている。保育関係者が子どもの安全に心を砕いていると分かり、胸をなで下ろした。だが、,社会,保育園バスで相次いだ事故、京都での安全対策はどうなった？,https://www.kyoto-np.co.jp/articles/-/701921
12/30/2021,子育て支援に積極的な京都府内の企業に対するアンケートで、不妊治療を受けている従業員数を把握している企業が２割程度にとどまることが２８日、分…,経済,京都企業は不妊治療受けている社員どれほど把握？　相談しやすい環境が課題,https://www.kyoto-np.co.jp/articles/-/701854
12/30/2021,京都サンガＦＣは２９日、来季Ｊ２に降格する徳島のＧＫ上福元直人（３２）と、Ｊ２群馬のＧＫ松原修平（２９）をそれぞれ完全移籍で獲得したと発表…,スポーツ,京都サンガ、GK上福元とGK松原を獲得と発表　２人のコメントも,https://www.kyoto-np.co.jp/articles/-/702317
12/30/2021,新型コロナウイルスの流行が繰り返される中、ワクチン接種ができなかったり控えたりする人へのハラスメントが問題になっている。接種を暗に強要する…,医療・コロナ,京都でも「ワクチンハラスメント」が問題に　接種を強要する風潮に警鐘,https://www.kyoto-np.co.jp/articles/-/702042
12/30/2021,新型コロナウイルスの変異株「オミクロン株」の濃厚接触者で、京都府が指定する宿泊療養施設に入所していた男性から、行政の対応に関する疑問の声が京都新聞社の双方向型報道「読者に応える」に寄せられた。男性は「入所の説明や施設の環境に課題がある」と訴え、今後の入所者のために改善を求めている。  　男性は２０代の大学院生で留学先の米国から今月６日に帰国。空港近くのホテルで３日間、隔離期間を過ごした後、車で実家のある京都市に戻った。自宅にいた男性のもとに１０日夜、京都市保健所から「搭乗者にオミクロン株の陽性者がいた」と連絡が入った。  　男性は、水際対策の一環として飛行機の同乗者全員を濃厚接触者とする国の基準を受け入れ、,医療・コロナ,オミクロン濃厚接触者が京都府の対応に疑問　「納得いく説明と入所環境を」,https://www.kyoto-np.co.jp/articles/-/702338
12/30/2021,今宮の市　１月１～３日午前１０時～午後４時、京都市北区紫野今宮町の今宮神社。陶器・植木・タオル・帽子など。小雨決行。榊さん０９０（７６２９…,文化・ライフ,フリーマーケット「今宮の市」「平安楽市」,https://www.kyoto-np.co.jp/articles/-/702451
12/30/2021,◆12月31日（金）ＢＳ１　午前6時30分～7時19分大相撲どすこい研　「初日に潜む魔物の正体は？」　※2021年9月初回放送横綱大関の鬼…,文化・ライフ,京都テレビ案内 12月31日　ゆく年くる年,https://www.kyoto-np.co.jp/articles/-/701057
12/30/2021,"カレーパンの進化がめざましい。一日一パンでは、今年もたくさんのカレーパンを取り上げたが、その中でも特に特徴的なカレーパンを取り上げたい。インパクトのある表面なのは「ザクザク系」だろうか。角ばったクルトンをまとった姿は力強い。大地がパキパキとひび割れたかのようなタイプや、香草パン粉が香るものなどもあり、どれも個性的だ。フランスパン生地がキューブ状になったものや、円柱型のおやきのような形のものなど、パッと見ではカレーパンと分からないぐらい斬新なものも紹介した。人気のカレーパンだけに、それぞれのお店が個性を出そうとさまざまな進化をとげている。食べる側としては、選択肢が増えてとてもうれしい。<strong><u><a href=""https://www.kyoto-np.co.jp/articles/-/544015"">【4月11日】ザックザクカレーパン＜小麦の奴隷大津店＞</a></u></strong><strong><u><a href=""https://www.kyoto-np.co.jp/articles/-/629723"">【9月9日】ゴールデンカレーパン＜パンドブルー京都太秦店＞</a></u></strong><strong><u><a href=""https://www.kyoto-np.co.jp/articles/-/462575"">【1月10日】ダッチカレーパン＜Boulangerie Alpine（ブーランジェリーアルピーヌ）＞</a></u></strong><strong><u><a href=""https://www.kyoto-np.co.jp/articles/-/500599"">【2月16日】香草パン粉のカレーパン＜mina_mina （ミナミナ）＞</a></u></strong><strong><u><a href=""https://www.kyoto-np.co.jp/articles/-/531590"">【3月23日】比叡の山椒香るカレーパン＜An deux（アンドゥー）＞</a></u></strong><strong><a href=""https://www.kyoto-np.co.jp/articles/-/624940"">【9月2日】カレーパン＜アカネBAKERY（ベーカリー）＞</a></strong><strong><u><a href=""https://www.kyoto-np.co.jp/articles/-/573009"">【6月3日】チーズカレーパン（トリプル）＜PIE &amp; SANDWICH OHSHIMA（パイ アンド サンドウィッチ オオシマ）＞</a></u></strong>※新型コロナウイルス感染拡大の影響で、営業時間やイートインなどが変更になることがあります。各店舗にご確認ください。☆パンの消費量で全国的に上位の京都市内には数多くのパン屋が存在し、市民に愛される食べ物として定着しています。「一日一パン」は、京都市を中心に、京都や滋賀のパン屋をめぐり、毎日ひとつのパンを取り上げ、写真と記事で魅力を紹介する、「ライトプラン」以上の有料会員向け記事です。12月19日から1月1日までは、【ウェブ版特別企画】として、無料でお読みいただけます。",特集/一日一パン,「特徴的なカレーパン」編集部が選ぶ2021注目のパン【ウェブ版特別企画】,https://www.kyoto-np.co.jp/articles/-/698162
12/30/2021,リーガロイヤルホテル京都（京都市下京区）は１２月２１日から、宿泊者限定で「東映太秦映画村」（右京区）の入村券を特別料金で販売している。通常…,経済,リーガロイヤル京都と東映太秦映画村コラボ　割安入村券をホテルで事前販売,https://www.kyoto-np.co.jp/articles/-/697895
12/30/2021,【資料写真】京都府警宇治警察署京都府久御山町２８日午後９時ごろ、京都府久御山町市田の府道で、道路を横断中だった京都府宇治市の男子高校生（１６）が、東向きに走っていた車と衝突した。高校生は足などを強く打ち、重傷を負った。車はそのまま走り去った。京都府警宇治署がひき逃げ事件として捜査している。,社会,車がひき逃げ、高校生が重傷　京都・久御山,https://www.kyoto-np.co.jp/articles/-/702419
12/30/2021,【資料写真】京都大学京都大情報環境機構はホームページ（ＨＰ）で、スーパーコンピューターに保存していた約３４００万ファイルのデータが消失したと２９日までに発表した。スーパーコンピューターの納入業者によるバックアッププログラムの機能改修中に、作業ミスがあったとしている。京都大情報環境機構ＨＰに掲載された情報によると、消失したファイルは、１４～１６日に誤って削除したという。一部は復元不可能としている。ＨＰに掲載された業者からの報告書には「弊社１００％の責任」との記載がある。京都大情報環境機構は「再発防止に向け運用管理の改善に取り組む」としている。,社会,京都大のスパコンデータ、3400万ファイル消失　納入業者の作業ミス,https://www.kyoto-np.co.jp/articles/-/702353
12/30/2021,京都サンガＦＣは２９日、ＦＷ野田隆之介（３３）がＪ２琉球に完全移籍すると発表した。　福岡県出身。日本経済大から鳥栖に入団し、名古屋、湘南を…,スポーツ,京都サンガ、FW野田がJ２琉球へ完全移籍　コメントも,https://www.kyoto-np.co.jp/articles/-/702364
12/30/2021,帰省のため新幹線に乗り込む家族連れら（12月29日午前9時、京都市下京区・ＪＲ京都駅）年末年始をふるさとなどで過ごす人たちの帰省ラッシュが２９日、本格的に始まった。京都市下京区の京都駅でも、多くの家族連れらが目的地に出発。新型コロナウイルス感染拡大で帰省の自粛が目立った昨年末から一転、今年は例年並みの乗車率がみられた。一方、新変異株「オミクロン株」が京滋など各地で確認される中、里帰りを心配する声も聞かれた。ＪＲ東海によると、昨年末は２０～４０％に落ち込んだ東海道新幹線の自由席乗車率は、この日、一部の列車で１００％を超えた。最大は、朝の東京発博多行き「のぞみ」で１４０％となった。JR東海関西広報室は「新型コロナの影響で利用が抑えられていた昨年と比べ、今年は高い数値になっている」という。山陽新幹線も、新大阪発鹿児島中央行きの「さくら」で１００％となるなど、客足の回復がみられた。午前９時すぎのＪＲ京都駅の新幹線下りホームでは、土産袋やスーツケースを持った人たちが列をつくった。妻の実家がある山口県下関市に家族３人で向かうという滋賀県大津市の男性（３３）は「１年半ほど帰れておらず、孫の顔を見せようと帰省を決めた。ただ、オミクロン株が出始めて迷った部分もあり、心配な面もある」と複雑な表情。宮崎県に帰省する大学１年の男性（１９）は「コロナは少し心配だが、ワクチンも接種し、県が実施する帰省者対象のＰＣＲ検査も陰性だったので帰ることにした」と話した。,医療・コロナ,「１年半ぶり」「オミクロン株心配」　帰省ラッシュ本格化、京都,https://www.kyoto-np.co.jp/articles/-/702340
12/30/2021,京都サンガＦＣは２９日、ＧＫ清水圭介（３３）がＪ１Ｃ大阪に完全移籍すると発表した。  　清水は「２０１５シーズンからサンガに加入し、Ｊ１に昇格することを目標に掲げて７年間がむしゃらに突き進んできました。Ｊ１昇格の瞬間にピッチに立てたこと、その喜びをサポーターの皆さんと分かち合えたことが,スポーツ,京都サンガ、ＧＫ清水移籍を発表　GK福島も期限移籍満了、コメントも,https://www.kyoto-np.co.jp/articles/-/702363
12/30/2021,来季Ｊ１の京都サンガＦＣは２９日、ともに今季サンガに加入したＭＦ松田天馬（２６）とＭＦ武田将平（２７）と来季の契約を更新したと発表した。　…,スポーツ,京都サンガ、MF松田とMF武田の契約更新　コメントも,https://www.kyoto-np.co.jp/articles/-/702314
12/30/2021,京都市内などの古都のまちなかにある古社１６社を年頭に参拝し、１年間の御利益や無病息災などを授かる新春恒例の「京都十六社朱印めぐり」が２０２…,経済,「京都十六社朱印めぐり」 １年の御利益を祈願　ほんまもんの都も探訪,https://www.kyoto-np.co.jp/articles/-/701639
12/30/2021,京都地方気象台京都地方気象台は29日夕、大雪に関する気象情報を発表し、31日から1月1日にかけて、京都府北部を中心に大雪になる恐れがあると呼び掛けた。京都市街地など府南部でも積雪の可能性があり、交通障害などに注意が必要だという。気象台によると、雪のピークは31日の日中とみられる。雪雲が発達した場合は、北部を中心に警報級の大雪の恐れがある。また、府北部では30日から31日に西の風が強まり、最大瞬間風速は陸上30メートル、海上35メートルと予想される。沿岸部に、暴風雪警報や波浪警報を発表する可能性もあるという。予想される降雪量は、いずれも多いところで次の通り   【30日午後６時～31日午後６時】   北部山地、南丹・京丹波、京都・亀岡の山地　30～50センチ   北部平地　20～40センチ   京都・亀岡の平地、山城中部・山城南部　１～５センチ,社会,京都、31日と1月1日は大雪恐れ　京都市街も積雪の可能性、北部は暴風雪も,https://www.kyoto-np.co.jp/articles/-/702315
12/30/2021,新型コロナウイルス禍２年目となった２０２１年がまもなく終わる。社寺では祭礼・法要・関連行事が変更や中止、縮小を余儀なくされた中でも、多くの人たちが信仰や伝統を受け継いでいくためにさまざまな工夫を凝らした。過ぎゆく年に思いをめぐらせ、新たな年がよりよくなるように念じながら、大みそかの鐘の響きに耳をすまして手を合わせたい。（各社寺の予定は状況変化に応じて変更される可能性があります）,文化・ライフ,京都　主な寺院の「除夜の鐘」実施状況の一覧,https://www.kyoto-np.co.jp/articles/-/702285
12/30/2021,京都市上京区の夫妻が、家庭ごみ減量を進めようと、コーヒーかすの再利用プロジェクト「ｍａｍｅ－ｅｃｏ」（マメエコ）を始めた。コーヒーかすを肥料に使う亀岡市の農家と出会い、かすの引き取り先ができたことを機に回収の輪が広がり、１カ月に１トン超を集めるほどになった。＝８月３１日掲載  　「ｍａｍｅ－ｅｃｏ」（マメエコ）を展開するブルーム・ゲーリーさん（５５）と順子さん（４６）夫妻の自宅には、プロジェクトのロゴ入りＴシャツや手刺しゅうのかばんなどが大切に片付けられていた。「応援してくれる人たちの手作りです」。取材後の出来事を笑顔で語り始めた。,社会,京都市で広がるコーヒーかす回収活動　肥料に再利用、口コミで取り組み拡大,https://www.kyoto-np.co.jp/articles/-/698191
12/30/2021,流通ルートに乗らない野菜や果物を加工品にして救済したい―京都府舞鶴市安岡町の主婦内藤尚子さん（３８）が、規格外の万願寺とうがらしなど、府北部の食材を使った瓶詰め商品を製造販売している。内藤さんは「もったいないを、おいしいに変えたい」と話す。  　内藤さんは２０１６年に群馬県からＵターン。,社会,規格外の万願寺はカレー、ブドウはコンポートに　主婦が開発した瓶詰め商品,https://www.kyoto-np.co.jp/articles/-/701545
12/30/2021,新年に地域安全を願う２５畳の大だこが京都府警右京署（京都市右京区）の玄関に飾られている。地元の男性が３０年以上、作り続ける風物詩で、２０１…,社会,京都の警察署で25畳の大だこ披露　製作打ち切りにストップかけた住民の声,https://www.kyoto-np.co.jp/articles/-/701292
12/30/2021,年明けから、食品の値上げがさらに家計を直撃しそうだ。パンや菓子、加工品などのメーカーや外食チェーンなどが、来年１月以降、相次いで商品を値上げする。山崎製パンは、パン２４７品の出荷価格を平均７・３％引き上げる。日本ハムはハムやソーセージ、キッコーマンはしょうゆを、それぞれ２月に値上げする。ミスタードーナツも３月に引き上げる。身の回りの幅広い値上げによって買い控えが広がり、消費回復の足かせになる恐れがある。新型コロナウイルス禍から持ち直しの動きがみられる景気が腰折れしないか懸念される。値上げの要因は、原材料価格の上昇や円安だ。コロナ禍で世界的に落ち込んだ経済活動が米国や中国を中心に再開し、需要が急速に伸びたことで小麦や大豆、牛肉などの価格が上昇している。特に原油は、包装資材や光熱費などの幅広いコストアップにつながっている。船で物資を運ぶ際のコンテナが足りず、海運価格の上昇や輸送の停滞も一因だ。加えて、インフレを抑制するため金融引き締め方針を打ち出した米国と、大規模緩和を続ける日本の金融政策の違いで円安傾向にあることが、輸入される原材料価格をさらに押し上げている。１１月の全国消費者物価指数は、前年同月比０・５％上昇し、昨年２月以来１年９カ月ぶりの大きな上げ幅となった。日銀は２％の物価上昇を目指しているが、黒田東彦総裁は「物価上昇を通じて家計所得に及ぼすマイナス影響が強まっている可能性がある」と指摘する。問題は、物価上昇が賃金の伸びを伴っていないことだ。厚生労働省の毎月勤労統計調査によると、２０２０年の名目賃金は２年連続で減少した。足元でも、物価変動を加味した実質賃金は減少を続けている。その中で値上げすれば売り上げが落ち込む恐れがあるが、企業の価格抑制努力は限界に達しているとみられる。企業は原材料などのコスト上昇分を商品や製品に上乗せすることに理解が得られるよう、消費者や取引先などに丁寧に説明する必要があるだろう。企業間取引において、中小企業にコスト増がしわ寄せされれば、賃上げの余裕がなくなりかねない。政府は、中小企業が原材料価格などの上昇を販売価格に適切に転嫁できるよう、下請法の運用強化を盛り込んだ対策パッケージを策定した。転嫁拒否が疑われる業種を選び、重点的に立ち入り調査を実施し、専門調査官を増やして年間１万社以上の中小企業を聴取するとしている。岸田文雄首相は、経済界に３％程度の賃上げを要請している。２２年度の与党税制改正大綱では、給与を引き上げた企業への優遇策を設け、来年度予算案にも看護師や介護士などの賃金引き上げを盛り込んだ。消費拡大につながる所得環境への目配りがいっそう求められる。,経済,社説：食品の値上げ　景気回復へ水差さないか,https://www.kyoto-np.co.jp/articles/-/702190
12/30/2021,２０２１年も残すところあとわずか。前年に引き続き、今年も新型コロナ感染症に左右された１年でした。一方で五輪やパラリンピックが東京で開かれ、…,社会,甲子園、高名な学者死去…　京都の10大ニュース、7～10位は,https://www.kyoto-np.co.jp/articles/-/701894
12/30/2021,梅小路エリア（京都市下京区）の企業や団体でつくる「京都・梅小路みんながつながるプロジェクト」が、地域の魅力を発掘するフォトコンテストを開催…,社会,京都駅西部エリアの魅力伝える写真募集　地域の風景や町並みなど,https://www.kyoto-np.co.jp/articles/-/701358
12/30/2021,京都市内では豊臣秀吉の初期伏見城（指月（しげつ）城）や「枕草子」「源氏物語」の舞台になった内裏後宮などの重要な遺構が見つかった。市内を除く府内でも初めての発見が相次いだ。  　指月城（伏見区）では石垣基礎が見つかった。地面を掘り込んだ上、基底石を据えて根固めし、さらに埋め直すという、丁寧な地盤改良を施していた。最初期の,文化・ライフ,京都で今年見つかった貴重な発掘成果　初期伏見城に「源氏物語」の舞台も,https://www.kyoto-np.co.jp/articles/-/698374
12/30/2021,京都府庁京都府と京都市は29日夕、新たに３６人が新型コロナウイルスに感染したと速報した。京都府内の新規感染者が30人を超えたのは、今年10月6日の30人以来、約２か月半ぶり。府内の感染者は3万6155人になった。京都市発表分が18人、京都府発表分が18人。年齢や性別などは、京都府と京都市が夜に公表する。,医療・コロナ,京都で新たに36人感染、２カ月半ぶり30人超　新型コロナ、29日夕速報,https://www.kyoto-np.co.jp/articles/-/702267
