12/24/2021,【資料写真】JR西日本本社ＪＲ西日本福知山支社は２４日、大雪の予報のため２６日始発から２７日にかけて以下の区間で列車の運転取りやめや遅れが発生する可能性があるとした。   　対象の区間は以下の通り。山陰線の園部（京都府南丹市）－東浜（鳥取県岩美町）   　舞鶴線の綾部（京都府綾部市）－東舞鶴（京都府舞鶴市）   　ＪＲ宝塚線・福知山線の新三田（兵庫県三田市）－福知山（京都府福知山市）   　播但線の姫路（兵庫県姫路市）－和田山（兵庫県朝来市）,社会,大雪のため山陰線や舞鶴線、福知山線で運転見合わせの可能性　26、27日,https://www.kyoto-np.co.jp/articles/-/699825
12/24/2021,京都サンガＦＣは２４日、今季Ｊ１札幌から期限付き移籍で加入していたＤＦ白井康介（２７）がサンガに完全移籍すると発表した。今季は３２試合に出…,スポーツ,京都サンガのDF白井、完全移籍に,https://www.kyoto-np.co.jp/articles/-/699813
12/24/2021,新型コロナウイルスの変異株「オミクロン株」の市中感染がきのう、京都府内でも確認された。厚生労働省は、現時点で全国に面的に広がるとは考えていないとする。だが、専門家らは感染が急拡大する可能性を指摘している。年末年始の集まりや帰省が多い時期でもあり、十分な対策と警戒態勢をとりたい。感染したのは府内在住の２０代女性で海外渡航歴はなく、感染経路は不明だ。コロナワクチンの２回目接種を終えていたという。前日には大阪府でも市中感染が確認されており、２人の感染者もワクチンを２回接種済みだった。オミクロン株は変異によって感染力が強くなり、ワクチンが効きにくくなるとも指摘されている。国内ではこれ以外に空港などの検疫で感染が確認された人が、２２日時点で計１６０人に上った。政府の感染症対策分科会の尾身茂会長は記者会見で「（国内の）複数の地点で既に感染が始まっている」との見方を示した。岸田文雄首相は濃厚接触者にも宿泊施設での待機を求めるなど、封じ込め策の強化を打ち出している。大規模流行を招かないよう、あらゆる事態を想定して先手を打っていくべきだ。心配なのは医療提供体制だ。病床について、政府は計約３万７千人が入院できる計画をつくっている。今夏の感染「第５波」のピーク時より３割増やした。第５波では自宅療養中に容体が悪化した例が相次いだことから、陽性判明の当日か翌日に連絡を取り、診療を受けられるようにするという。宿泊療養施設も今夏の１・４倍の６万６千室に増やす。ただ、これらの対応はデルタ株の拡大を前提にしており、感染のスピードが速いオミクロン株に対応できるかどうかは未知数だ。感染状況を踏まえ、適切に追加策を打っていかねばならない。コロナ感染は秋以降、下火になり、店舗営業などの制限は緩和された。政府は現時点で行動制限の強化は考えていないとしている。オミクロン株の市中感染を受け、京都府は「１テーブルは４人まで」など飲食店利用時の対策を再び府民に呼び掛けるという。ただ、府は、府民向け旅行割引の適用エリアを隣接府県にも拡大すると発表したばかりだ。警戒を促す一方で旅行を勧めるような施策は、整合性を問われる。感染防止のため優先すべきは何か。科学的根拠に基づく、十分な説明が欠かせない。,医療・コロナ,社説：京都で市中感染　拡大抑止へ先手を打て,https://www.kyoto-np.co.jp/articles/-/699585
12/24/2021,京都府庁京都市と京都府は２４日、新たに１３人の新型コロナウイルス感染者を確認したと明らかにした。府発表分は５人、京都市発表分は８人。新規感染者が10人以上になったのは３日連続。府内の感染者は計3万6073人になった。,医療・コロナ,京都で新たに13人感染確認　新型コロナ、24日速報,https://www.kyoto-np.co.jp/articles/-/699810
12/24/2021,幼稚園から高校卒業まで埼玉県深谷市で育った。以前は「ふかやってどこ？」と聞かれ、「県北で日本一暑い熊谷のとなり」などと説明していたが、最近…,特集/プレミアムコラム,武州・上州ことばと養蚕　齋藤玲子,https://www.kyoto-np.co.jp/articles/-/699809
12/24/2021,わいせつ行為やセクハラで懲戒処分や訓告を受ける公立小中高校などの教員が後を絶たない。文部科学省の調査によると、２０２０年度は２００人で、前年度より７３人減ったものの、８年連続の２００人台となった。特に、児童や生徒が「性暴力・性犯罪」の被害者となったケースが半数近くを占めたのは深刻だ。被害が発覚するのは「氷山の一角」と指摘する専門家もいる。子どもに対して有利な立場を利用した行為は許されない。来年４月には同意の有無にかかわらず、わいせつ行為を禁じる「教員による児童生徒性暴力防止法」が施行される。被害を未然に防ぐため、より実効性のある方策を講じなくてはならない。性暴力などで処分を受けた教員のうち、京都と滋賀では計５人が免職や停職などになった。文科省は性暴力を把握した場合は刑事告発を求めていたが、犯罪に当たらないとして告発しなかったり、被害者らが望まず見送ったりしたケースが全国で計６９件あったとしている。また、子どもが被害者の場合は懲戒免職が原則だが、一部は停職にとどまっていた。行為や被害を過小評価したり、対外的に大ごとになるのを避けようとしたりしたためではないのか。学校や教育委員会が事案をきちんと調査し、厳正な対応を徹底する必要がある。児童生徒への性暴力の予防策では、大半の教委が会員制交流サイト（ＳＮＳ）を使った私的なやりとりの禁止を明確化し、教職員向けの研修を実施していた。一方、相談窓口の設置と周知を行っている教委は約７６％、児童や教職員らのアンケートを実施しているのは約３８％にとどまった。生徒に指導や相談対応を行う際は複数教員が関わり、多くの目が届くようにするのも有効だろう。新法では、わいせつ行為で懲戒免職となった教員の再取得などを制限できるようになった。復職を望んだ場合、複数の医師による意見書や診断書などを提出させ、医療や福祉などの専門家らによる審査会が原則全会一致で認めることを条件とする方向だ。「職業選択の自由」への配慮とはいえ、被害者や保護者らが納得し、安心できる基準や判断が求められる。わいせつ行為をする教員は全体のごく一部だ。それでも性暴力は子どもに深い傷を負わせると改めて認識し、対策を強化したい。,社会,社説：教員の性暴力　法施行踏まえ防止策を,https://www.kyoto-np.co.jp/articles/-/699584
