01/26/2022,映画音楽に本格的に取り組むために年末から仕事場に閉じ籠（こ）もり、何日も家をあけることが増えてきた。春で２歳になる息子は、お気に入りの絵本…,特集/プレミアムコラム,音楽の生まれるところ　原摩利彦,https://www.kyoto-np.co.jp/articles/-/718971
01/26/2022,艶がある黄色い花を咲かせた,文化・ライフ,作り物のような,https://www.kyoto-np.co.jp/articles/-/718979
01/26/2022,京都市役所京都市は26日夕、新たに京都市内で1462人が新型コロナウイルスに感染したことを確認したと発表した。京都市発表分だけで１千人を超えるのは初めて。26日午後3時半現在、京都府全体の新規感染者数は発表されておらず、過去最多だった25日の1622人を超える可能性がある。,医療・コロナ,京都市の新規感染者、1400人超　26日夕速報、市発表分としては過去最多,https://www.kyoto-np.co.jp/articles/-/718973
01/26/2022,京都府亀岡市出身で立命館大創設者の中川小十郎の業績をたたえる顕彰碑が、ＪＲ亀岡駅北側に整備中の公園へ設置されることが決まった。ＮＰＯ法人「…,社会,立命館の創設者・中川小十郎の顕彰碑を設置へ　京都・亀岡駅の近く,https://www.kyoto-np.co.jp/articles/-/718508
01/26/2022,京都府福知山市三和町川合地域の住民らが、閉校した地元の旧川合小をキャンプ場や住民らの交流の場として活用するプロジェクトを進めている。「地域…,社会,京都・福知山の廃校再生に住民奔走　キャンプ場や交流施設に,https://www.kyoto-np.co.jp/articles/-/718417
01/26/2022,京都府宇治市は、２０２０年７月で廃止した平盛ふれあいセンターと、同年８月に移転した大久保青少年センターが一体であった大久保町平盛の市有地約…,社会,京都・宇治市が市有地1500平方m売却へ　地元は公園要望も条件付けず,https://www.kyoto-np.co.jp/articles/-/718296
