03/23/2022,出足の速いプレスを続けていたサンガが、足が止まった一瞬を狙われた。　後半２３分、ＦＣ東京のＤＦ木本がサンガＤＦの背後にロングパスを送り、Ｆ…,特集/京都サンガ応援特集,サンガ、足止まった一瞬狙われる　ロングボール、敵FWマークせず,https://www.kyoto-np.co.jp/articles/-/755826
03/23/2022,急性骨髄性白血病を患い、京都大大学院生だった２０２１年６月に２３歳で亡くなった京都市左京区出身の山口雄也さんが２２日、在学していた同大学院…,社会,「がんになって良かった」死去の京大院生を表彰　献血などSNS積極発信で,https://www.kyoto-np.co.jp/articles/-/755600
03/23/2022,サンガスタジアム京セラと京都・亀岡保津川公園を生かして町を盛り上げる企画や催しを報告する市民ら（亀岡市追分町・同スタジアム）京都府亀岡市のサンガスタジアム京セラ（追分町）と近くの保津川右岸に広がる京都・亀岡保津川公園を活用して、市民らがまちを盛り上げる企画やイベントを行う「シンボルプロジェクト」の報告会が２１日、同スタジアムであった。建設中の２０１８年度から活動してきた３団体が、取り組みの成果や苦労を語った。     　市の「第４次亀岡市総合計画～夢ビジョン～後期基本計画」の一つで、３団体が市と協働で取り組んだ。当初は２０年度までの予定だったが、新型コロナウイルスの影響で１年延長した。「タートルＸ」は、「スポーツを通じてみんなを笑顔に」をテーマに、自分たちで競技を考える運動会を開いた。前日に参加者から出た約２００のアイデアから、かごを背負ってボールをキャッチするものなど４種目が生まれた。「まちを紫に染める」を目標に掲げた「Ｔｅａｍ　Ｄｏ　ｉｔ！！！」は、スタジアム建設中に工事関係者に向けて掲げた横断幕や、紫芋を使ったスイーツを開発したことを紹介。「奏」は音楽とクラフトビールを楽しめるイベントの様子などを報告した。３団体からは、コロナで大規模な催しができなかったほか、「市外の参加者が少なかった」「住民とつながるきっかけ作りが難しい」といった課題が報告された。報告会の様子は後日、動画投稿サイト「ユーチューブ」の亀岡市のチャンネルで配信する予定。,スポーツ,「考える運動会」「まちを紫」サンガスタジアムでどう地域盛り上げる　住民報告,https://www.kyoto-np.co.jp/articles/-/755716
03/23/2022,京都市内の地価は新型コロナウイルス禍の収束を折り込み、早くも回復基調が鮮明になった。国土交通省が２２日発表した今年１月１日時点の公示地価。コロナ感染の長期化で観光産業が大打撃を受ける中、土地需要の主役は宿泊施設からマンションに交代し、市中心部の地価を押し上げた。  　「コロナ禍で不動産市場はマンション『１強』の状態になった。,経済,京都市内の不動産市場は「マンション1強」　地価押し上げも「高嶺の花」に,https://www.kyoto-np.co.jp/articles/-/755713
03/23/2022,京都市は２２日、市体育館（右京区）のネーミングライツ（命名権）について、取得希望者の募集を始めた。以前の通称は「ハンナリーズアリーナ」だっ…,社会,京都市体育館、新たな名前は？　命名権希望者募集、以前は「ハンナリーズ」,https://www.kyoto-np.co.jp/articles/-/755605
03/23/2022,今回の事態について、歴史家の山室信一さん（元京都大人文科学研究所教授）は「かつて日本が歩んだ歴史、世界が歩んだ歴史と重なる」と語ります。私…,社会,ロシアによる侵略であるのは明白　歴史家・山室信一さんに聞く,https://www.kyoto-np.co.jp/articles/-/755446
