03/06/2022,京都府大山崎町の天王山にある井戸跡を、住民グループ「大山崎ふるさとガイドの会」と、竹林ボランティアのメンバーらが８年ぶりに整備した。山中で…,観光,「天下分け目」京都の天王山にある謎の井戸跡　住民グループが8年ぶり整備,https://www.kyoto-np.co.jp/articles/-/744377
03/06/2022,身分違いの恋を描いた演目が並んだ。坂東巳（み）之助や中村壱（かず）太郎ら平成生まれの役者がそろう南座の「三月花形歌舞伎」（１３日まで）。純愛が悲劇を生む『番町皿屋敷（ばんちょうさらやしき）』、昔話のように楽しい『芋掘長者（いもほりちょうじゃ）』はともに大正時代初演。同じ大正でも「対照」の２演目をダブルキャストで上演する。,文化・ライフ,身分違いの恋描く対照的な2演目　京都・南座、ダブルキャストの花形歌舞伎,https://www.kyoto-np.co.jp/articles/-/743904
03/06/2022,跳び回る動きが特徴のスポーツ「パルクール」を使った京都府京田辺市の広報動画が、府と府広報協議会が自治体を対象に選定する京都広報賞で映像部門…,社会,京都・京田辺市の広報動画「パルクール」が知事賞　学生・市民と共同制作,https://www.kyoto-np.co.jp/articles/-/740159
03/06/2022,亀岡運動公園野球場（京都府亀岡市曽我部町）の改修が終わり、竣工（しゅんこう）式がこのほど開かれた。１９７７年の完成以来となる大幅リニューア…,スポーツ,亀岡運動公園野球場、リニューアル　観客席にベンチ、土入れ替え・京都亀岡,https://www.kyoto-np.co.jp/articles/-/739511
03/06/2022,歌舞伎女形の第一人者、坂東玉三郎（７１）＝人間国宝＝が５月、３年ぶりに京都府京丹後市で舞踊公演を開く。丹後ちりめん（丹ちり）の産地で２０１６年から毎年続けてきたが、コロナ禍で２０年以降は開けずにいた。今年は丹ちりを用いた舞台衣装を「口上」で披露。古代の丹後国風土記（たんごのくにふどき）にも記された羽衣伝説ゆかりの「羽衣」と祝儀曲「老松（おいまつ）」という舞踊２題を演じる。コロナ禍の厳しい中、久々の地方公演となるが、「幕が開いたら最大のものをお見せするのが私の志」と誓う。＝敬称略  　「京丹後のちりめんと、私たちの仕事は、切っても切れない間柄。そこに興味深く引か…,文化・ライフ,坂東玉三郎、丹後ちりめんの産地で舞う　5月、3年ぶりに京都・京丹後公演,https://www.kyoto-np.co.jp/articles/-/737376
03/06/2022,坂東玉三郎は今年８月、京都・南座での主演公演で、怪談ものの傑作「東海道四谷怪談」のお岩役を演じることが決まった。東京・歌舞伎座で昨年９月、…,文化・ライフ,坂東玉三郎、8月に「東海道四谷怪談」のお岩　京都・南座,https://www.kyoto-np.co.jp/articles/-/737375
