04/13/2022,国会議員に月額１００万円が支給される「文書通信交通滞在費」を日割り支給に見直す改正法案が、あすの衆院で可決される見通しだ。日割り支給に変えるのは当然だが、問題なのは名称を「調査研究広報滞在費」に変更し、使い道を事実上拡大することだ。多額の歳費（給与）などを受けながら、さらに上乗せされる支給だ。しかも、使途の公開や未使用分の国庫返納が改正法案になく、何に使ったか不透明である。共産を除く与野党５党が名称変更を含めて合意し、１５日に参院で成立をめざすとしている。改正とは名ばかりだ。議員活動に必要な費用について根本的な議論に欠け、議員に都合の良い、いわばお手盛り法案ではないか。文通費は、歳費とは別に電話代や郵便代、交通費、東京での滞在費などに支給される。しかし、議員活動の実態に合っておらず、これまでから飲食費への流用など議員のポケットマネーになっているとの指摘が絶えない。今回の変更で国政に関する調査研究や広報、滞在などに支給目的が広がる。この中に国民との交流も含まれており、会食や冠婚葬祭などにも使われるかもしれない。こうしてみると、見直しと言いながら、これまで続けられてきた不透明な使途の追認ではないのか。そうした疑問が拭えない。２４日に投開票される参院石川選挙区補欠選挙で当選した議員への支給に間に合わせる狙いがあるという。だが、もう一つの焦点だった透明化には一切進んでいない。日本維新の会は、使途公開と未使用分の国庫返納を主張してきたが、与野党で議論を続ける方向が確認できたとして改正に応じたという。きのうの６党協議で、今国会中に結論を得るとの認識を共有したというが、自民党内には消極的な議員が少なくない。使途公開などに加え、支給目的の内容や制限への覚悟を示さなければ国民の納得は得られまい。国会議員の活動には、政党交付金や立法事務費、歳費、ボーナス、新幹線パス・航空券などが支給されている。文通費は昨年１０月末の衆院選で当選した新人議員が１日の議員身分なのに１カ月分が支給されたと明らかにしたことで、批判が高まった。与野党は見直しに積極的な姿勢を見せたが、結局は「喉元を過ぎれば」の類いではないのか。支給の元になるのは税金だ。議員の財布に目を向ける必要がある。,社会,社説：文通費見直し　これでは改正と言えぬ,https://www.kyoto-np.co.jp/articles/-/771453
04/13/2022,太陽活動が原因で起こる太陽地球間の現象のことを、宇宙天気という。宇宙天気は太陽風（太陽から噴き出すガスの流れ）や放射線を地球にもたらし、様…,特集/プレミアムコラム,宇宙天気予報　柴田一成,https://www.kyoto-np.co.jp/articles/-/771579
04/13/2022,京都府立高で、５カ年計画で実施されているトイレの洋式化事業が本年度でいったん完了する。家庭での洋式トイレの普及や清潔さを求める生徒たちの声…,社会,中3の学校選びにも影響するトイレの洋式化　京都府立高の現状とは,https://www.kyoto-np.co.jp/articles/-/771522
04/13/2022,６月中旬からハンガリーのブダペストで行われる水泳世界選手権の競泳に、京滋ゆかりの女子３選手が臨む。東京五輪個人メドレー２冠の大橋悠依（イト…,スポーツ,「心から喜べる泳ぎを」東京五輪2冠の大橋悠依が目指す新境地　競泳世界選手権に挑む,https://www.kyoto-np.co.jp/articles/-/771501
04/13/2022,南丹市長選で、現職の西村良平氏が再選を果たした。保守系市議らの支援を受け、前回も立候補した新人を抑えた。保守分裂による激しい争いになったが、投票率は前回をわずかに上回る６１・２９％と振るわなかった。争点になったのは、行財政改革の在り方などだ。だが、互いの批判が目立ち、政策論議が深まったとはいえない。落選した新人の選対本部幹部が公選法違反容疑で逮捕されたのも残念だ。対立を解消し、住民の声をよく聞き、町政を巡る課題に地道に取り組んでいく姿勢が求められる。園部、八木、日吉、美山の旧４町の合併で市制が施行されてから１６年になる。この間、財政健全化が大きな課題とされてきた。西村氏は財政負担になっていた道の駅「スプリングスひよし」の運営を市出資の第三セクターから民間企業に委ね、ケーブルテレビ事業の民間移管を決めた。市の借金に当たる一般会計の市債残高は２４５億円で、１７年度比１６億円減らした。こうした行革の実績が一定評価されたといえる。ただ、旧美山診療所の市直営化に伴う機能縮小を巡って住民の反発を招いた。今後も美山文化ホールや、閉校した小学校を生かした地域活性化センターの一部の廃止が視野に入っている。活動拠点がなくなることで「地域がばらばらになる」と不安の声も出ている。住民の思いを踏まえた丁寧な取り組みが欠かせない。移住、定住者を迎える施策も重要だ。人口は合併前の約３万６千人が現在は３万１千人を割る。新型コロナウイルスの影響で地方への関心が高まり、２０年度の移住者は過去最高の１３２人に上った。さらに人を呼び込むには、子育てなど暮らしやすいまちづくりに力を注いでいく必要がある。長い間企業の進出がなかった工業団地「京都新光悦村」にはここ数年、新規立地や工場増設などが進んでいる。市外からの通勤者が多く、市民の雇用につなげる具体策が求められる。観光では明るい材料もある。昨年末、国連世界観光機関の「ベスト・ツーリズム・ビレッジ」に同市美山町が選ばれた。市内は自然に恵まれ、観光資源は豊富だ。移住者や観光客増に向けアピールしたい。市内がルートに想定される北陸新幹線の延伸計画では、工事で出る残土の処分方法や生態系への影響などが不安視されている。地元の懸念に応え、理解を得られる対応に努めてほしい。,社会,社説：南丹市長再選　住民の声生かす市政に,https://www.kyoto-np.co.jp/articles/-/771452
04/13/2022,京都サンガの曺監督Ｊ１京都サンガＦＣは１３日、曺貴裁監督が新型コロナウイルスの陽性判定を受けたと発表した。１３日午後６時半からサンガスタジアム京セラで行われるＹＢＣルヴァン・カップの札幌戦は、杉山弘一コーチが指揮を執る。クラブによると、１１日に鼻水の症状が出たためＰＣＲ検査を受けたところ、陰性判定だった。１２日も鼻水と３７・３度の発熱があり、自宅待機していた。１３日には症状が改善していたが、再度ＰＣＲ検査を行ったところ、陽性が判明した。Ｊリーグ独自基準による濃厚接触疑い者は、クラブ内にいないという。,社会,J1京都サンガの曺監督がコロナ陽性　13日夜のルヴァン杯はコーチが指揮,https://www.kyoto-np.co.jp/articles/-/771599
