12/31/2021,JR西日本ＪＲ西日本によると、３１日午前６時現在、北陸線の米原－近江塩津間、琵琶湖線（東海道線）の野洲－米原間、湖西線の京都－近江塩津間は昼ごろまで本数を減らして運転している。一部特急の取りやめもあり、山陰方面に走る「スーパーはくと号」、北近畿方面の「まいづる号」、山陰方面の「はまかぜ号」で計３５本の運転を休止している。,社会,【31日午前6時時点】JR西が琵琶湖線や北陸線で本数減らして運転　特急で運休多数,https://www.kyoto-np.co.jp/articles/-/702846
12/31/2021,近畿地方整備局中日本高速道路（ネクスコ中日本）と近畿地方整備局は３１日、大雪の影響で通行止めになる可能性があるとしていた舞鶴若狭自動車道や北陸自動車道、滋賀・福井県境の国道８号と国道１６１号の一部について、同日午前６時段階では、通行止めを実施する可能性が低くなったと発表した。いずれも、積雪の影響が小さいと判断したため。今後も降雪が続く可能性はあり、不要不急の外出は控えてほしいとしている。,社会,【31日午前6時時点】舞鶴若狭道や北陸道の通行止め可能性低く,https://www.kyoto-np.co.jp/articles/-/702845
12/31/2021,皇后杯第４０回全国都道府県対抗女子駅伝のエントリーが２９日までに締め切られ、４７チームの選手が決まった。今夏の東京五輪代表、２０２４年パリ五輪を目指す日本女子中長距離のトップ選手や、飛躍を目指すジュニア世代のランナーが都大路に集う。  【エントリーした主な選手】  北海道　石川　　蘭（小樽西陵中）　全国中学校体育大会８００メートル優勝 青　森　福士加代子（ワコール）…,特集/全国女子駅伝,全国女子駅伝、エントリーした主な選手,https://www.kyoto-np.co.jp/articles/-/702345
12/31/2021,全日本大学女子選抜駅伝は３０日、静岡県富士宮市の富士山本宮浅間大社前から富士市の富士総合運動公園陸上競技場までの７区間４３・４キロで行われ…,スポーツ,立命大は4位、名城大がV4　全日本大学女子選抜駅伝,https://www.kyoto-np.co.jp/articles/-/702646
12/31/2021,皇后杯第４０回全国都道府県対抗女子駅伝のエントリーが２９日までに締め切られ、４７チームの選手が決まった。今夏の東京五輪代表、２０２４年パリ五輪を目指す日本女子中長距離のトップ選手や、飛躍を目指すジュニア世代のランナーが都大路に集う。  　東京五輪代表は５人。田中希実（同大４年）は…,特集/全国女子駅伝,五輪ランナー都大路へ　田中希実、広中璃梨佳、一山麻緒、安藤友香らエントリー,https://www.kyoto-np.co.jp/articles/-/702343
12/31/2021,京都府宮津・与謝地域の養護教諭や助産師らでつくる「京都北部性教育サークル」が今年、発足３０年を迎えた。子どもだけでなく大人にも正しい性の知…,文化・ライフ,性教育の大切さ訴え30年　京都府北部の養護教諭らでつくるサークルの狙い,https://www.kyoto-np.co.jp/articles/-/702163
12/31/2021,京都先端科学大付属高（京都市右京区）の１年生６人が、ペットボトルのラベルなどの廃材で蛇口の形のオブジェを制作し、北海道で開かれたリサイクル…,社会,蛇口オブジェがリサイクルアート展準グランプリ　作品に込めた高校生の思い,https://www.kyoto-np.co.jp/articles/-/702148
12/31/2021,京都府城陽市を拠点に活動する「京都城陽サッカークラブ（ＳＣ）」が発足５０年を迎えた。京都で初めて少年の全国大会で優勝、海外へも数多く遠征す…,文化・ライフ,発足50年、地域に根付くサッカークラブ「社会性学ぶ場」　京都・城陽,https://www.kyoto-np.co.jp/articles/-/700563
