02/25/2022,京都府は２４日、新型コロナウイルスの感染対策に計約１２７億円を追加する本年度一般会計補正予算案を発表した。流行「第６波」が高止まりし、まん…,社会,京都府、新型コロナ対策に127億円の追加予算案　PCR検査支援など,https://www.kyoto-np.co.jp/articles/-/738608
02/25/2022,京都府南丹市美山町芦生で起きた府道の崩落で、通行不能になった現場を回避する仮道の開通時期が、当初予定の２５日から、３月中旬ごろにずれ込む見…,社会,京都・美山芦生の道路崩落、仮道開通に遅れ　大雪影響、３月中旬ごろか,https://www.kyoto-np.co.jp/articles/-/738226
02/25/2022,展示会場で、多様な素材の部品を板に貼り付けた作品の上を歩く光島さん（京都市北区・アトリエみつしま）視覚障害者が制作した美術作品を鑑賞する「かたち・かんじる・モザイク展」が、京都市北区の北大路大宮通近くのギャラリー「アトリエみつしま」で開かれている。足や手で触れて感触や形状を楽しめるユニークな作品が展示されている。   　京都市を拠点に活動する「視覚に障害のある人とつくるアートプロジェクト実行委員会」が初めて開催した。     　会場には、アトリエみつしまで活動する当事者の光島貴之さん（６８）の立体作品約３０点が並ぶ。木製の板に金属部品やタイル、スポンジなどを貼り付けられている。来場者は作品の上を歩くことで、独特な形状や硬軟、イメージなどを体感することができる。     　このほか、京都府立盲学校の生徒とモザイク作家が多様なタイルで装飾した、高さ３メートルほどの小屋も展示している。無料。３月１８日まで。午後０時～６時。月曜休館。,社会,足や手で触れてアート感じて　京都で視覚障害者制作の美術展,https://www.kyoto-np.co.jp/articles/-/735515
02/25/2022,こどもみらい館（京都市中京区）は、遊び場「こども元気ランド」の利用について、３月２３日から平日も事前予約制に変更する。新型コロナウイルスの…,主要,京都・こどもみらい館の遊び場「こども元気ランド」　平日も事前予約制に,https://www.kyoto-np.co.jp/articles/-/737382
02/25/2022,京都府福知山市は、一般会計４３２億円、１１特別会計と３企業会計を合わせた総額９２４億７１００万円の２０２２年度当初予算案を２４日開会の市議…,社会,京都・福知山市の当初予算案、924億7100万円　市営住宅建て替えなど,https://www.kyoto-np.co.jp/articles/-/738494
02/25/2022,福知山市の２０２２年度当初予算案は、高齢化やデジタル化が進む将来を想定して策定する「まちづくり構想」に基づき、幅広い年代が生涯にわたって学べる環境整備に重点を置いた。拠点となる地域公民館の大規模改修の費用などを盛り込み、一般会計は前年より３１億円増の４３２億円と合併後最大規模となった。  　地域公民館は多くが築約４０年で老朽化し、,社会,【解説】高齢化やデジタル化を見据え、環境整備に重点　京都・福知山市の当初予算案,https://www.kyoto-np.co.jp/articles/-/738206
02/25/2022,京都府教育委員会は２４日の府議会予算特別委員会で、府立大（京都市左京区）の付属高の開設を検討していることを明らかにした。既存の府立高を付属…,文化・ライフ,京都府立大、付属高の開設検討　既存の府立高を付属化へ,https://www.kyoto-np.co.jp/articles/-/738434
