03/29/2022,製粉最大手の日清製粉グループ本社は29日、滝原賢二・常務執行役員（56）が社長に昇格する人事を固めた。6月の株主総会を経て就任する。社長交代は約5年ぶり。見目信樹社長（61）は特別顧問に退く。滝原氏は原料調達や経営企画の経験が長く、オーストラリア製粉大手の買収などを主導し...,サービス・食品,日清製粉グループ本社社長に滝原氏,https://www.nikkei.com/article/DGXZQOUC28A9B0Y2A320C2000000/
03/29/2022,29日朝方の国内商品先物市場で、原油は3日続落して取引を始めた。取引量が多い8月物は1キロリットル7万1990円と前日の清算値に比べ3230円安い水準で寄り付いた。前日のニューヨーク市場で原油先物が下落し、国内原油の売りにも波及した。中国で新型コロナウイルスの感染が拡大し、上海市では28日から事実上のロックダウン（都市封鎖）が始まった。人やモノの移動減少に伴い石油需要が減るとの思惑から原油は売られ...,商品概況,商品9時30分　原油が3日続落、中国で需要減の思惑　金も安い,https://www.nikkei.com/article/DGXZASQ7IAB01_Z20C22A3000000/
03/29/2022,29日前場寄り付きの東京株式市場で日経平均株価は反発して始まった。前日に比べ160円程度高い2万8100円台前半で推移している。上げ幅は一時200円を超えた。米原油先物相場の下落などを材料に28日の米市場で主要3指数が上昇。米株高に加え、外為市場での円安・ドル高基調が追い風となり、主力株に買いが先行している。29日は3月期末の配当権利付き最終売買日にあたる。配当再投資に絡む国内機関投資家の株価指数先物への期待も相場を支えている。日経平均の上昇率が東証株価指数（TOPIX）より大きい。東エレクやファストリ、ソフトバンクグループといった日経平均への寄与度の大きい銘柄の上げが目立つ。JPX日経インデックス400とTOPIXも上昇している。ダイキン、リクルート、ファナック、アドテストが高い。一方、塩野義、電通グループ、資生堂、丸井Gが安い。〔日経QUICKニュース（NQN）〕,国内株概況,東証寄り付き　反発、一時200円高　配当再投資の買い期待,https://www.nikkei.com/article/DGXZASS0ISS11_Z20C22A3000000/
03/29/2022,29日前場寄り付きの東京株式市場で日経平均株価は反発して始まった。前日に比べ160円程度高い2万8100円台前半で推移している。上げ幅は一時200円を超えた。米原油先物相場の下落などを材料に28日の米市場で主要3指数が上昇。米株高に加え、外為市場での円安・ドル高基調が追い風となり、主力株に買いが先行している。29日は3月期末の配当権利付き最終売買日にあたる。配当再投資に絡む国内機関投資家の株価指数先物への期待も相場を支えている。日経平均の上昇率が東証株価指数（TOPIX）より大きい。東エレクやファストリ、ソフトバンクグループといった日経平均への寄与度の大きい銘柄の上げが目立つ。JPX日経インデックス400とTOPIXも上昇している。ダイキン、リクルート、ファナック、アドテストが高い。一方、塩野義、電通グループ、資生堂、丸井Gが安い。〔日経QUICKニュース（NQN）〕,マーケット,日経平均反発、上げ幅一時200円超,https://www.nikkei.com/article/DGXZQOUB00003_Z20C22A3000000/
03/29/2022,総務省が29日発表した2月の完全失業率（季節調整値）は、前月から0.1ポイント下がり2.7%となった。低下は2カ月ぶり。厚生労働省が同日公表した2月の有効求人倍率（同）は前月比0.01ポイント上昇の1.21倍だった。まん延防止等重点措置などで働くのを控える動きもあって就業者数は減っており、雇用情勢の改善は鈍い。新型コロナウイルス禍が長引き、求職もせず労働市場から退出する人が増えている。非労働力人...,新型コロナ,失業率2月2.7%、2カ月ぶり低下　就業控えも目立つ,https://www.nikkei.com/article/DGXZQOUA270EU0X20C22A3000000/
03/29/2022,【テンピ（米アリゾナ州）=共同】米大リーグは28日、各地でオープン戦が行われ、エンゼルスの大谷はアリゾナ州テンピでのアスレチックス戦に「1番・指名打者」で出場し、一回に右前打を放って3打数1安打だった。試合は7-2で勝った。ブルージェイズとマイナー契約の加藤はブレーブス戦に「8番・三塁」で出場し、1打数無安打。チームは4-5で敗れた。レッズの秋山は「9番・左翼」でカブス戦に出場。ともに27日に登板したパドレスのダルビッシュ、ブルージェイズの菊池は軽めのメニューで調整。カブスの鈴木はオープン戦に出場せず、フリー打撃などを行った。,スポーツ,大谷、1番で1安打　大リーグOP戦,https://www.nikkei.com/article/DGXZQOKC290RM0Z20C22A3000000/
03/29/2022,29日の東京株式市場で日経平均株価は反発して始まった。始値は前日比229円高の2万8173円43銭だった。米原油先物相場の下落などを手がかりに28日の米株式相場が上昇した流れを引き継いでいる。外為市場での円安・ドル高基調も支えだ。半導体関連や輸出株の一角が買われている。〔日経QUICKニュース（NQN）〕,国内株概況,日経平均、反発して始まる　米株高・円安基調が支え,https://www.nikkei.com/article/DGXZASFL29H8M_Z20C22A3000000/
