05/12/2022,福井空港（福井県坂井市）から東京ディズニーランド（TDL）などを結ぶとしていたヘリコプター便が当面運航できない状況にあることが12日、福井県などへの取材で分かった。運航を担うとされるセレスティアル航空（東京・中央）は予約があり次第1日から就航すると発表していたが、11日時点で一度も運航していない。県の担当者は「しっかりと法的な手続きを取った上で運航するよう求めている」と話した。国土交通省東京航空局によると、11日時点でセレスティアル航空から運航に必要な航空法上の許可申請はない。通常なら申請から許可まで3カ月程度かかるという。セレスティアル航空は11日、同社のウェブサイトで16日から会員登録を始め、7月ごろから予約を受け付ける予定だと発表した。福井県の担当者は「あくまで民間事業で、県として詳細な事業計画書などを確認する立場にない。補助金などのやりとりも一切ない」と説明。法的な許可が得られていないことは以前から把握していたとし「許可をとるよう再三求めていた。福井空港の活用は歓迎するが、実際の運航については国交省と連携して慎重に確認する」とした。福井空港発のヘリ便を巡っては、福井県主催で4月27日に開催された「福井空港小型航空機利活用推進大会」で、セレスティアル航空の浜津昌泰社長が福井県の杉本達治知事や県内市町の首長らの前で運航計画を発表。浜津社長は県内市町の首長や県議らが参加する「福井の空を語る会」の顧問を務めており、TDLのほか、ユニバーサル・スタジオ・ジャパン（USJ）や福井県立恐竜博物館（福井県勝山市）にも運航するとしていた。,福井,福井空港発ヘリ便、運航見通したたず,https://www.nikkei.com/article/DGXZQOCC1162E0R10C22A5000000/
05/12/2022,富山銀行が12日に発表した2022年3月期の連結決算は、純利益が前の期比40%減の3億3300万円だった。原燃料高や円安・ドル高による顧客の業績悪化懸念から、一般貸倒引当金を10億円積み増した。単体の経常収益は9%減の70億円。有価証券関係収益が減った。本業のもうけを示す単体のコア業務純益は11%増の12億円と堅調だったが、与信費用がかさんだため純利益は減った。23年3月期の連結純利益は前期比2.3倍の7億5000万円になりそうだと発表した。顧客のニーズに応じたスタートアップとのビジネスマッチングなどを通じて収益を確保する。,地域金融,富山銀行の22年3月期、純利益40%減　与信費用かさむ,https://www.nikkei.com/article/DGXZQOCC128YV0S2A510C2000000/
05/12/2022,北海道大学水産科学研究院と北海道漁業協同組合連合会（北海道ぎょれん）は、赤潮被害や人手不足に悩む水産業の課題解決に乗り出す。北大の函館キャンパスで16日、連携協定を結ぶ。陸上養殖や養殖の効率化、漁・加工作業の省人化といった分野で研究を進める。北大と北海道ぎょれんが包括連携協定を結ぶ背景には、漁獲高の低迷や担い手不足が続く厳しい現状がある。北海道がまとめた「北海道水産現勢」によると、2020年...,大学,北海道大学と道ぎょれん、養殖・漁の省人化で共同研究,https://www.nikkei.com/article/DGXZQOFC115NO0R10C22A5000000/
05/12/2022,トナミホールディングスが12日発表した2022年3月期の連結決算は、純利益が前の期比10%増の51億円だった。ここ数年進めている各地の運送会社のM&A（合併・買収）が寄与したほか、外部委託していた輸送を内製化するといったコスト削減の効果も出た。売上高は微増の1353億円だが、会計基準の変更がなければ1400億円を上回ったという。企業の物流業務を受託する3PL（サード・パーティー・ロジスティクス）事業が堅調に推移した。高岡通運（富山県高岡市）などの買収も貢献した。営業利益は14%増の73億円。23年3月期の売上高は前期比7%増の1450億円、純利益は10%増の56億円を見込む。新型コロナウイルス禍で縮小した荷動きの回復が進むと予想している。燃料費は上昇するが、運賃の値上げも実施して収益を確保する。,石川,トナミHDの22年3月期、純利益10%増　買収が寄与,https://www.nikkei.com/article/DGXZQOCC128V90S2A510C2000000/
05/12/2022,北海道大学の小林快次教授らの研究グループは、北海道北部の中川町内にある約8300万年前の地層から見つかっていた恐竜の化石について、大きな爪を持つ「テリジノサウルス」の仲間の新種だと分かったと発表した。化石は2000年に見つかっていた。テリジノサウルスは1メートル近い大きな爪を持ち、全長は最大10メートルに達していたとされる恐竜。アジア地域で多くの種類が生まれたという。日本で見つかったテリジノサウルスの仲間は3例目。研究グループは発見した新種を「日本の海岸にすむテリジノサウルス」という意味の「パラリテリジノサウルス・ジャポニクス」と命名した。テリジノサウルスから進化した種類。爪の構造上力が弱く、熊手のように近くの枝をたぐり寄せて葉っぱを食べていたと考えられている。,大学,北海道・中川で発見の恐竜化石、新種と判明,https://www.nikkei.com/article/DGXZQOFC12AO50S2A510C2000000/
05/12/2022,札幌市は中心部の大通公園を再整備する。公園を南北に貫く市道の一部を廃止し、つなげる案が浮上。市は2022年度に始める交通量や市民の意向調査を通じ、整備方針を固める。街路樹を増やし緑化を進めるほか、カフェなど収益施設を置いて採算性の改善も検討。8月に市政100年を迎える街の魅力を高める。23年度に一部道路を閉鎖する実験も検討している。大通公園を南北に貫く11本の道路のうち、札幌駅前通と石山通とい...,生活,札幌の顔・大通公園に拡張案、市道の一部廃止検討,https://www.nikkei.com/article/DGXZQOFC105HL0Q2A510C2000000/
05/12/2022,帝国データバンク札幌支店がまとめた4月の道内景気動向調査によると、北海道の景気動向指数（DI）は37.9と前月から1.4ポイント上昇した。改善は4カ月ぶり。新型コロナウイルスの緊急事態宣言に準じる「まん延防止等重点措置」が解除となり、旅館・ホテルや飲食店を含むサービス業が持ち直した。4月中下旬に道内1100社を対象に調査し、558社から回答を得た。回答率は50.7%。業種別では「その他」を除く9業種のうち、不動産やサービスなど6業種で前月を上回った。3カ月後を示す景気DIは41.4と0.6ポイント改善した。改善傾向は続いているものの、景気の好不況の判断の分かれ目となる50を下回る状況が続く見通し。同支店は「ロシアによるウクライナ侵攻、為替変動などの懸念材料に対する警戒感が強まっている。先行き不透明な状況が続く可能性は高い」としている。,北海道,北海道内の景況感4カ月ぶり改善、帝国データ調査,https://www.nikkei.com/article/DGXZQOFC123IS0S2A510C2000000/
05/12/2022,茶専門店を展開するルピシア（北海道ニセコ町）は、自社で生産する北海道産茶葉を10倍近くに増やす。月末に町内にある自社の茶畑で新たに6000本の木を植樹する。寒冷な北海道で茶を育てるのは難しい。栽培本数を大幅に増やして希少な茶葉として2023年にも売り出す。植樹する品種は寒さに強い「さやまかおり」で、静岡県の農家から譲り受けた。ルピシアが販売する茶葉は50グラムあたり安い商品で600円程度。高い商品では2000円を超える。希少性の高い北海道産茶葉の生産を通じ、付加価値のある商品のラインアップを充実させる。茶は温暖な気候に適した作物のため従来は東北地方が北限とされてきた。農林水産省によると、20年時点で北海道の茶葉生産量はゼロ。ルピシアは21年に「新雪谷（ニセコ）茶園」を開いて700本を植えていた。同社は15年からニセコで茶の越冬方法を研究している。,サービス・食品,ルピシアの北海道産茶23年にも発売、ニセコで6千本植樹,https://www.nikkei.com/article/DGXZQOFC125TA0S2A510C2000000/
05/12/2022,三菱重工業が12日発表した2022年3月期の連結純利益（国際会計基準）は前の期比2.8倍の1135億円だった。国産旅客機「三菱スペースジェット（MSJ）」の事業化凍結で開発費用が減った影響が大きい。期末配当を従来予想から10円上乗せする。配当は年100円（前の期は75円）となる。売上高にあたる売上収益は4%増の3兆8602億円だった。熱効率に優れた「ガスタービン・コンバインドサイクル（GTCC...,業績ニュース,三菱重工、22年3月期純利益2.8倍　MSJ凍結で開発費減,https://www.nikkei.com/article/DGXZQOUC11B6S0R10C22A5000000/
05/12/2022,山梨県警は12日、同県道志村の山中で発見された子どもとみられる頭部の骨を詳しく鑑定した結果、行方不明になっている千葉県成田市の小倉美咲さん（9）の母、とも子さん（39）と、広く親族関係にある人物として矛盾はないと明らかにした。山梨県警は美咲さんの可能性があるとする一方で「断定はできない」と説明した。県警は、骨の状況からこの人物は既に死亡していると判断。他にも見つかった人骨の鑑定を進める。県警によると、頭の骨からは個人を特定するDNA型は検出できなかったが、さらにミトコンドリアDNA型で鑑定。とも子さんと広く親族関係にある人物として矛盾がないとする結果が出た。美咲さんは2019年、母親や友人家族らと訪れたキャンプ場で行方不明となった。今回鑑定した骨は今年4月、キャンプ場から約600メートル東付近で発見された。〔共同〕,社会・調査,人骨は不明女児の可能性　「母と親族関係矛盾なし」県警,https://www.nikkei.com/article/DGXZQOUE12AB00S2A510C2000000/
05/12/2022,レッドブル・ジャパン（東京・渋谷）は22日、札幌市内の大倉山ジャンプ競技場でスキージャンプのラージヒルを利用したレースを開く。400メートル走を最大傾斜37度の斜面で競技する。レースは個人と4人組のリレー戦の2種目。個人戦は男女あわせて800人が参加し、リレーは90チームが出場する見通し。同レースはオーストリアで2011年に初めて開いた。現在世界10カ国以上で開催する。日本では17年以降、20年を除いて毎年開いている。,北海道,レッドブル、大倉山ジャンプ場で400メートル走大会,https://www.nikkei.com/article/DGXZQOFC128C20S2A510C2000000/
05/12/2022,ロシアによるウクライナ侵攻の影響が製薬業界にも広がってきた。第一三共がロシアで医薬品の販売を中止したほか、検査に使う試薬の供給を見合わせる企業も出始めた。医薬品は人道の観点から経済制裁の対象外だが、物流や代金の決済などに支障が出ている。生命の維持にも関わる血液関連の製品などが含まれており、同様の動きが広がれば同国全体の医療に影響が出る可能性もある。販売を取りやめたのは血液を固まりにくくする「リ...,ヘルスケア,第一三共、ロシアで医薬品販売中止　輸送や決済困難で,https://www.nikkei.com/article/DGXZQOUC28AEU0Y2A420C2000000/
05/12/2022,ロッテの佐々木朗希投手が13日、今季4勝目を懸けて京セラドーム大阪で行われるオリックス戦に先発する。12日はチームの楽天戦に同行して楽天生命パーク宮城で調整し、ランニングなどで汗を流した。オリックス戦では今季2戦2勝で防御率1.29。4月10日に本拠地のZOZOマリンスタジアムで完全試合を達成し、同24日は敵地で5回6安打2失点とやや苦しみながらも、今季3勝目を挙げた。12日は取材対応がなかったが、9日の練習の際には「（京セラドーム大阪のマウンドは）一回経験しているので、うまく調整したい。長い回を投げないといけないと思っている」と意気込んでいた。〔共同〕,スポーツ,佐々木朗希、13日に先発　4勝目懸けオリックス戦,https://www.nikkei.com/article/DGXZQOKC12BA70S2A510C2000000/
05/12/2022,北海道・知床半島沖の観光船「KAZU　Ⅰ（カズワン）」沈没事故で、総務省北海道総合通信局の職員2人が12日午後、斜里町にある運航会社「知床遊覧船」の事務所で、無線の運用状況を調査した。同社の事務員から、船と事務所の定点連絡にアマチュア無線を使っていたとの説明を受けた。電波法に違反したアマ無線の業務使用が常態化していた疑いがあるとして、今後さらに詳しく調べる。調査後、職員2人は報道陣の取材に応じ、無線の免許証が事務所内で見つからず、機器が誰のどのような免許に基づいて使われていたか確認できなかったと説明した。また破損して発信や受信に支障が出ていた屋根のアンテナはアマ無線用だったとみられることも判明。今回の調査に桂田精一社長（58）は同席しておらず、一連の経緯について今後確認を求めるとしている。調査は電波法に基づく立ち入りではなく、任意で11日から斜里町・ウトロ地区の同業他社も含めて実施された。4月23日の事故当日、カズワンからのアマチュア無線による救助要請に気づいてやりとりした別の観光船会社の事務所では無免許の状態で機器が設置されていた。免許の有効期限が切れていたという。〔共同〕,事件・司法,アマ無線、定点連絡に使用　電波法違反疑い、常態化か,https://www.nikkei.com/article/DGXZQOUE127TO0S2A510C2000000/
05/12/2022,【ムンバイ=花田亮輔】外貨不足で経済が混乱するスリランカで、市民らの退陣要求に直面するゴタバヤ・ラジャパクサ大統領が延命を模索している。同国や隣国インドのメディアは12日、野党の統一国民党（UNP）総裁で元首相のウィクラマシンハ氏が同日、新首相に就く見通しだと伝えた。同氏は親インド派だ。インドはスリランカへの影響力を中国と競っており、親中派のラジャパクサ政権の動揺をみて、先手を打った可能性がある。ウィクラマシンハ氏は、スリランカの対中傾斜を修正したシリセナ前大統領時代に首相を務めた。ゴタバヤ氏は辞任要求を拒否している。11日の演説で「国民の信頼できる首相と閣僚を週内に任命する」と話していた。同氏は挙国一致内閣の樹立を念頭に「すべての党首と協力し、政治的安定をもたらすために努力する」と表明した。憲法改正による大統領権限縮小にも言及した。スリランカでは世界規模での新型コロナウイルスの感染拡大で、主な外貨獲得の手段だった観光業が低迷。外貨準備が急減し、輸入が停滞して燃料、食料などの生活必需品が供給不足で値上がりした。ロシアのウクライナ侵攻が燃料、食料の国際価格を一段と引き上げ、スリランカ国内に波及し、最大都市コロンボなどでは生活苦を訴える市民がゴタバヤ氏の辞任を求める抗議デモを続けている。ゴタバヤ政権は治安維持に向けた規制を強めている。10日には市民の略奪や破壊行為に対し、発砲による抑止を治安部隊に命じた。4月はゴタバヤ氏の弟のバシル・ラジャパクサ財務相ら大半の閣僚が一斉に辞任。それでも抗議デモは収まらず、9日には兄のマヒンダ・ラジャパクサ氏が首相辞任を表明した。同日には全土に外出禁止令が出されたが、デモは継続されている。マヒンダ氏が逃れたと報じられた海軍基地の周辺にも、抗議の市民らが集まった。,南西ア・オセアニア,スリランカ政権、延命模索　「元首相が返り咲き」と報道,https://www.nikkei.com/article/DGXZQOGM125AN0S2A510C2000000/
05/12/2022,北海道は12日、新たに3176人の新型コロナウイルス感染を確認したと発表した。前の週の同じ曜日（5日、1854人）を上回った。3000人を超えるのは2日連続。11日時点の病床使用率は19.6%、重症者向けは2.9%。また北海道は患者1人の死亡を公表した。新規感染者数の内訳は北海道...,新型コロナ,北海道、新型コロナ新たに3176人感染,https://www.nikkei.com/article/DGXZQOFC127P60S2A510C2000000/
05/12/2022,大塚ホールディングス（HD）傘下の大鵬薬品工業（東京・千代田）は12日、米バイオ製薬カリナンオンコロジーと抗がん剤の開発のために設立した共同出資会社カリナンパールの全株式を取得すると発表した。従来は大鵬薬品の子会社などが20%を保有していたが、残りを買い取り完全子会社化する。大鵬薬品はカリナンオンコロジーに契約一時金2億7500万ドル（約350億円）を支払うほか、抗がん剤の開発の進捗に応じた報酬を最大で1億3000万ドル（約167億円）支払う。契約一時金は2022年4~6月期に計上する。大鵬薬品は19年、自社で創製した抗がん剤「TAS6417（開発コード）」の開発を進めるため、カリナンオンコロジーが90%、大鵬薬品子会社が10%を出資してカリナンパールを設立した。日本以外の地域で同薬剤を開発・販売する権利を移し、現在は肺がん治療の飲み薬として初期段階の臨床試験（治験）を進めている。このほど大鵬薬品が権利を買い戻すことになった。米国では、TAS6417をカリナンオンコロジーと共同で開発・販売する契約も結んだ。米国における同剤の治験費用や発売後の利益は両社で折半する。,ヘルスケア,大鵬薬品、抗がん剤開発で米バイオ製薬子会社を買収,https://www.nikkei.com/article/DGXZQOUC127DI0S2A510C2000000/
05/12/2022,三鬼商事札幌支店が12日発表した4月の札幌ビジネス地区のオフィス空室率は2.42%と、3月（2.21%）から0.21ポイント上がった。4カ月ぶりに上昇した。企業の大型オフィスの解約が増えた一方、成約が限られたことが影響した。併せて公表した札幌ビジネス地区のオフィス1坪（3.3平方メートル）当たりの4月の平均賃料は3月に比べ7円高い9579円だった。札幌市内の他地区でも空室率が上昇した。,北海道,札幌の4月オフィス空室率2.42%、4カ月ぶりに上昇,https://www.nikkei.com/article/DGXZQOFC126XS0S2A510C2000000/
05/12/2022,【北京=川手伊織】中国人民銀行（中央銀行）の陳雨露副総裁は12日の記者会見で「市場の貸出金利をさらに引き下げて、企業などの資金調達コストを減らし、資金需要を刺激する」と述べた。政策金利の引き下げを示唆したとの受け止めが広がり、12日の上海市場で人民元は対ドルで1ドル=6.79元で取引を終え、2020年9月以来の安値を付けた。人民銀は最優遇貸出金利（LPR、ローンプライムレート）を事実上の政策金利と位置づけている。1年物は優良企業の貸出金利の参考となり、5年物は住宅ローンなど中長期資金を融資する際の目安となる。毎月20日前後に公表する。5月に利下げすれば4カ月ぶりとなる。中国経済は新型コロナウイルスの感染を徹底して抑え込もうとする政府の「ゼロコロナ規制」で失速している。物流の混乱で生産が止まり、消費が落ち込んだ。民間予測では、4～6月の実質国内総生産（GDP）が前期比で減少するとの見方も出ている。人民銀は4月、市中銀行から強制的に預かるお金の比率を示す「預金準備率」を引き下げた。技術革新を支援する低利の借換制度もつくった。利下げも含めた積極的な金融緩和で、銀行融資を伸ばして設備投資や住宅投資を押し上げたい狙いだ。共産党中央財経委員会弁公室の韓文秀副主任は同じ記者会見で「中国の財政政策や金融政策は十分な余地と多様なツールがあり、必要に応じて打ち出していく」と語った。,グローバルマーケット,中国人民銀、利下げ示唆　「貸出金利さらに下げ」,https://www.nikkei.com/article/DGXZQOGM127UZ0S2A510C2000000/
05/12/2022,大相撲夏場所5日目（12日・両国国技館）休場明けの横綱照ノ富士は北勝富士をきめ倒しで退け、2日目から4連勝。先場所初優勝の関脇若隆景は小結豊昇龍の送り出しに屈し、早くも3敗目を喫した。大関陣は貴景勝が阿武咲を押し倒し、白星を先行させた。御嶽海は玉鷲に押し出されて3敗目。正代は遠藤に寄り切られ、元気なく4敗目となった。小結大栄翔は関脇阿炎を押し出して4勝目。阿炎は3勝2敗。5戦全勝は平幕の碧山、一山本の2人だけとなった。〔共同〕,スポーツ,照ノ富士4連勝、2大関敗れる　夏場所5日目,https://www.nikkei.com/article/DGXZQOKC12BKF0S2A510C2000000/
05/12/2022,りそなホールディングス（HD）が12日発表した2022年3月期の連結決算は純利益が前の期比12%減の1099億円だった。米国の金利上昇で債券の売却損が膨らんだほか、一部大口先の貸し倒れに備える与信費用が響いた。23年3月期の純利益は一転して36%増の1500億円となる見通し。債券の売却損を576億円計上し、保有している外国債券は22年3月末時点で330億円の含み損となった。南昌宏社長は「想定より早く金利上昇が進んでいる。今期以降の柔軟性をあげるための判断だ」と説明した。,金融機関,りそな12%減益、22年3月期　債券の売却損576億円計上,https://www.nikkei.com/article/DGXZQOUB092PM0Z00C22A5000000/
05/12/2022,佐賀銀行が12日発表した2022年3月期連結決算は、純利益が前の期比65%増の40億円だった。有価証券の利息配当金や事業承継など法人向けのサービス収入が増え、売上高にあたる経常収益が7%増の438億円と4期ぶりの増収になったことが寄与した。同行が重視している、預貸金利益や役務利益から経費を引いた「対顧客利益」は26億円で、前の期比12億円増えた。坂井秀明頭取は「19年度からの中期計画で30億円の対顧客利益を目指してきた。未達ではあるが、大きくV字回復したと認めてもらえるのでは」と話した。23年3月期は経常収益が前期比2%減の430億円、純利益も2%減の40億円を見込む。,地域金融,佐賀銀行、純利益6割増　法人向けサービスなど好調,https://www.nikkei.com/article/DGXZQOJC128L60S2A510C2000000/
05/12/2022,新電力のナンワエナジー（鹿児島市）は家庭向けなど低圧電気供給サービスを6月30日で終了すると発表した。工場向けなど特別高圧・高圧分野の電気供給は4月末に終了しており、6月末で電力小売事業を終了することになる。顧客向けに、6月10日までに他の電力会社への切り替えの申し込みを促す案内を発送しているという。同社は供給停止の背景について、新型コロナウイルス禍からの経済回復で原油や液化天然ガス（LNG）が不足し燃料価格が高騰、ロシアのウクライナ侵攻の影響もあって今後も価格が下がる見通しが立たないため、と説明している。ナンワエナジーは2013年4月から電力小売事業を開始。離島を除く九州7県で電力を供給しており、低圧分野の契約者数は約1万7千件となっている。,環境エネ・素材,新電力のナンワエナジー、電力小売り撤退へ　鹿児島地盤,https://www.nikkei.com/article/DGXZQOJC124P70S2A510C2000000/
