01/01/2022,新型コロナウイルスとの闘いは3年目に突入する。先進国を中心にワクチン接種は広がり、飲み薬の承認も進む。各国は2021年11月に見つかった新たな...,新型コロナ,withコロナ　感染封じ総力〈岐路2022〉,https://www.nikkei.com/article/DGXZQOUC243NK0U1A121C2000000/
01/01/2022,新型コロナウイルスの感染拡大はテレワークやジョブ型雇用など働き方の多様化を推し進めた。労働人口が減り、国際競争力が低下する日本において、生産性の向上やイノベーションをもたらすことができるのか。新しい働き方に挑むニューワーカーを追う。【関連記事】総合商社双日の子会社、双日プロフェッショナルシェア（東京・千代田）の村山宏さん（41）は毎週金曜日、2時間半電車に揺られ、群馬県安中市にある金型加工の東邦工業を訪れる。工...,働き方改革,第2のキャリア35歳から　双日社員、副業で自立,https://www.nikkei.com/article/DGXZQOUC209T30Q1A221C2000000/
01/01/2022,1990年代半ば以降に生まれたZ世代が、消費のあり方を変えようとしている。日経MJはZ世代の中の16～26歳約5000人にアンケート調査を実施し、いま何を考え、社会や企業に何を求めているかを聞いた。調査から見えてきたのは、デジタルの生活を楽しみながら、等身大で自分らしくありたい気持ち。社会に役立つ買い物など、Z世代が未来の消費を生み出す。（調査の詳細を1月1日付日経MJに）...,日経MJ,Z世代が消費を変える　「買い物で社会貢献」3割,https://www.nikkei.com/article/DGXZQOUC14APU0U1A211C2000000/
01/01/2022,主要企業の経営者20人に2022年の株式市場の見通しを聞いたところ、日経平均株価の高値を「3万2000円以上」と予想する回答が19人にのぼった。新型コロナウイルスワクチンの進展で世界経済の回復が鮮明になり、企業業績の拡大を見込む。半導体などの電気機器や環境関連企業への期待が高い。安値は2万7000円前後との見方が多かった。日経平均の高値予想は平均で3万2850円となった。ワクチン接種の浸透やコロ...,株式,日経平均高値、「3万2000円以上」予想が大勢,https://www.nikkei.com/article/DGXZQOUC10D6A0Q1A211C2000000/
01/01/2022,2021年はエネルギー価格の上昇に悩まされた。年明けの電力需給逼迫と卸電力市場の価格高騰、急激な経済回復による原油価格の高止まりと輸入国の日本には厳しい状況だった。一方で脱炭素社会の実現に向け、具体的な戦略を求められ、企業は対策に忙殺された。22年のエネルギー業界はどの方向に進むのか。業界担当記者らが展望を占った。電力卸価格、入札の仕組みが問題デスク　電気、ガス、石油と21年はエネルギー価格が...,日経産業新聞,2022年も燃料価格上昇続く　エネルギー記者座談会,https://www.nikkei.com/article/DGXZQOUC095B40Z01C21A2000000/
01/01/2022,今夏の参院選は岸田文雄首相にとって事実上、初めて政権運営の実績が評価される場となる。新型コロナウイルスの感...,政治,参院選、勝てば長期政権へ道〈岐路2022〉,https://www.nikkei.com/article/DGXZQOUA24D8W0U1A121C2000000/
01/01/2022,岸田文雄政権は安倍政権などが用いた官邸主導の政策決定を軌道修正する。首相官邸を意思決定の中枢に据えながらも、霞が関や与党の意見に重きを置くボトムアップ型を重視する。役所や自治体との機動的な対応が求められる新型コロナウイルス行政が最大の関門となる。2021年12月26日、首相公邸。首相は秘書官らに「報告が来ていない」といら立ちをみせた。発端は大学入試の新型コロナ対応を巡り24日に文部科学省が出した...,政治,岸田流、試される政策決定　ボトムアップも活用,https://www.nikkei.com/article/DGXZQOUA246F60U1A221C2000000/
01/01/2022,主要企業の経営者20人に2022年度の景気見通しを聞いたところ、実質国内総生産（GDP）の前年度比伸び率は平均3.0%だった。政府は3.2%を見込むが、新型コロナウイルスの新たな変異型「オミクロン型」の感染拡大をはじめ、様々なリスク要因を背景に、なお緩やかな回復にとどまるとの見方が目立っている。新型コロナについてはワクチン接種が進み、新規感染者数は足元で落ち着きを保つ。...,経済,リスク点在、回復緩やか　経営者が占う22年度の景気,https://www.nikkei.com/article/DGXZQOUA161RF0W1A211C2000000/
01/01/2022,世界的に頻発する異常気象に、長引く新型コロナウイルスの感染状況。気がつけば、2年前と比べて暮らしは一変した。どう受け止め、見通せばよいか。建築家の安藤忠雄さんと霊長類学者の山極寿一さんが語り合った。対談の後編をお届けする。安藤　ところで、最近多くの若い人たち、命のあるものとの対話が苦手のようです。私の事務所では、若いスタッフに、設計だけでなく、植栽の管理や生き物の世話など、「これも勉強だ」とやらせているのですが、時折びっくりするような反応をする子がいますね。土が汚いとか、臭いも嫌いみたい。若い世代との感覚のズレを強く感じます。山極　命のあるもの、扱いにくいからね。私のようにアフリカのジャングルでゴリラを調査すると...,カバーストーリー,新春対談　安藤忠雄vs山極寿一「グローバルな直感力を」,https://www.nikkei.com/article/DGXZQOIH266WN0W1A121C2000000/
01/01/2022,安藤　今年は1997年に京都議定書が採択されて25年。温暖化問題に対する世界の第一歩になる取り組みだったわけですが、去年ノーベル物理学賞を取られた真鍋淑郎さんはその30年以上...,カバーストーリー,新春対談　安藤忠雄vs山極寿一「地球人の気概取り戻せ」,https://www.nikkei.com/article/DGXZQOIH265GB0W1A121C2000000/
01/01/2022,2022年の米国政治はバイデン大統領への審判となる11月に控える連邦議会の中間選挙を軸に展開される。上院の...,トランプ前政権,米中間選挙、バイデン氏背水〈岐路2022〉,https://www.nikkei.com/article/DGXZQOGN234Q70T21C21A1000000/
01/01/2022,中国共産党は2022年秋、5年に一度の党大会を開く。習近平（シー・ジンピン）総書記（国家主席）は異例の3期目入りを視野に入れる。習氏が次の5年に向けて重視するのが、スローガンとして掲げてきた「共同富裕（共に豊かになる）」の具体化だ。目玉の1つとして不動産税の試験導入を目指すが、行き過ぎた格差是正の動きは経済の下押し要因になるリスクもはらむ。党大会では、習氏を新たに支える次期指導部が決まる。李克強（リー・クォーチャン）首相は交代の公算が大きい。習氏の側近である上海市トップの李強・上海市共産党委員会書記と広東省トップの李希・広東省党委員会書記、汪洋（ワン・ヤン）全国政治協商会議主席が次期首相候補として取り沙汰されている。1978年に始まった改革開放政策をテコに、中国は世界第2位の経済大国に成長した。2020年までに名目国内総生産（GDP）は276倍、貿易総額は220倍に拡大した。その陰で格差問題が深刻になった。新たな指導部の経済政策は、社会主義の色彩が強まりそうだ。クレディ・スイスによると中国富裕層の上位1%による富の占有率は00年に20.9%だったが、15年に31.5%まで高まった。20年は30.6%になったが、過去20年間の上昇幅は日米欧やインド、ロシア、ブラジルよりも大きい。習指導部が発足した12年時点で2.9倍の開きがあった都市と農村の1人当たり可処分所得の差は2.6倍に縮まった。一方で、都市の住民の間では開きが目立つ。世帯ごとの1人当たり可処分所得をみると、上位20%の世帯の平均は20年、下位20%の平均の6.2倍だった。12年は5.0倍だった。習指導部はこれまでに小康社会（ややゆとりのある社会）と脱貧困の達成を宣言した。国内の所得格差を縮める共同富裕の推進に重点を置く。関心を集めるのが、日本の固定資産税にあたる不動産税の試験導入だ。国有である土地の使用権と建物にかかる所有税を指す。大都市で年収の数十倍もするマンションは都市内格差の象徴で、所有税を設けて投機を防ぎ、中古市場に売り出す物件を増やして価格を抑える狙いがある。中国の家計資産の6割は住宅だ。複数物件を所有する人の2軒目以降が課税対象となりそうだ。試験期間は5年。習指導部はモデル都市での実験を踏まえ、全国展開を視野に入れる。ただ、障害は多い。試験都市の候補には広東省深圳市などが挙がるが、北京市は外れる公算が大きい。党高官やその親族が所有する物件が多く、政治的な反発が強いためだとされる。政府の不動産金融への規制強化などでマンション市場が冷え込んだことも逆風だ。不動産開発投資は21年9月から前年同月比で減少が続く。主要70都市の新築マンション価格も単純平均でみると、21年9月に6年5カ月ぶりの下落に転じた。地元政府が不動産会社や銀行を集めた会議などでは、新税導入の先送りを求める声もあがる。コストの増加が不動産の購買意欲を一段とそぎかねない、との懸念が関係者の頭をよぎる。税制を通じた格差是正策は不動産税だけではない。習氏は21年8月の党中央財経委員会で、税制改革による分配の拡充に言及した。配当や資産譲渡益など資本所得への徴税を強化するとした。ぜいたく品や嗜好品に課す消費税の対象も広げる。この会議の後に、IT（情報技術）企業の創業者らがこぞって寄付を申し出たが、高所得者や成功を納めた企業からの寄付は税制優遇を通じて促す方針だ。習指導部が分配を重視する背景には、成長率の鈍化もある。中国人民銀行（中央銀行）の試算では、21年に5.7%の潜在成長率は22年に5.5%となり、25年には5.1%まで下がる。中国経済の成熟で機械の導入など資本投資による成長の押し上げ効果が小さくなるとともに、長年の産児制限による働き手の減少が成長の足かせになる。高齢化は大きな問題だ。20年の国勢調査によると、男性の法定退職年齢である60歳以上の人口は10年から5割近く増えた。22年からは大量退職が本格化する。多数の餓死者を出した大躍進政策後に生まれたベビーブーム世代の男性が60歳に達するからだ。サラリーマンや自営業者が加入する公的年金は14年から年金支給が保険料収入を上回っている。社会保障制度の見直しを含め、急速な少子高齢化への対応は喫緊の課題だ。中国政府は、25年までの5カ年計画の主要課題に法定退職年齢の引き上げを盛り込んだ。定年延長で働き手を増やし、年金の支給開始年齢も先に延ばす方針だ。外交面では、米国との覇権争いは今後も続きそうだ。1月1日に発効した東アジアの地域的な包括的経済連携（RCEP）をテコに、地域経済への影響力拡大を狙う。21年9月に加盟申請した環太平洋経済連携協定（TPP）も早期の交渉入りを目指す。ただ、国有企業の優遇や政府調達における内外企業の差別、データ統制の強化はTPP加盟国が問題視する。習氏は同年11月のアジア太平洋経済協力会議（APEC）関連会合で「法に基づき国内外の企業に同等の待遇を与える」と強調した。TPPの要求を意識したとみられ、今後は具体的な制度設計で実効性をどう示すかが問われている。（北京=川手伊織、羽田野主）習近平（シー・ジンピン）国家主席にとって2022年は正念場の一年となりそうだ。習氏はこれまでの1期目、2期目は権力基盤固めに注力してきた。21年11月の第19期中央委員会第6回全体会議（6中全会）を終え権力を強固なものにし、ようやく取り組みたい政策課題に力を振り向けられるようになるはずだ。内政の課題は山積している。高騰する不動産価格の抑制、広がり続ける教育機会の格差是正など、これまでの政権が残した課題に取り組む方向性は評価できる。中国では市場経済導入後、経済格差の拡大が社会階層の固定化につながってしまったからだ。しかし、習氏の掲げる「共同富裕」のスローガンは貧富の格差解消と「健全な社会」の構築の両方を目指すものだ。党が考えるマッチョな青少年の育成など「正しい恋愛観」や「正しい思想」を植え付ける政策は若者が強く反発している。また、不動産価格の急落で混乱を発生させてもいけない。住宅や教育の社会問題の改革推進は急務だが、市場経済の現実を無視した強権的な手法ではいびつな結果を生むことになるだろう。内政の改革推進には非常に慎重なかじ取りが求められる。もし失敗すれば、体制を揺るがす震源地にもなりかねず、習氏は当面国内の政策課題に注力せざるを得ない。外交も内政の課題にリンクした優先順位で進められる。60年までに二酸化炭素（CO2）の排出を実質ゼロにする「カーボンニュートラル」の実現は、途上国への温暖化対策支援の「グリーン一帯一路」と連動している。同様に、中国のデジタル技術を輸出する「デジタル一帯一路」も進むだろう。中国は環太平洋経済連携協定（TPP）加盟に向けて、さまざまな理由をつけてルール適用の例外を求める可能性がある。日本をはじめとする加盟国は、ルールをゆがめることなく、交渉するスタンスを取ることが重要だ。あおやま・るみ　慶大大学院博士課程修了（法学）。米スタンフォード大学客員研究員、ジョージワシントン大学客員研究員などを経て2018年から早稲田大学現代中国研究所所長。専門は国際関係論、現代中国外交。,米中衝突,習政権、もろ刃の「共同富裕」〈岐路2022〉,https://www.nikkei.com/article/DGXZQOGM249G60U1A121C2000000/
01/01/2022,東京都の小池百合子知事は日本経済新聞のインタビューで「2022年度予算はデジタルとグリーンの分野で未来への投資を進めていく」方針を表明した。新型コロナウイルス感染拡大で打撃を受けた都内経済の再生を進めつつ、東京五輪・パラリンピック後の成長力を高める狙いだ。小池氏への一問一答は以下の通り。――22年度予算の編成作業が大詰めを迎えています。どの分野に重点配分する方針ですか。「新型コロナウイルスは我...,東京,「22年度はデジタル・グリーン投資」　小池都知事に聞く,https://www.nikkei.com/article/DGXZQOCC288L50Y1A221C2000000/
01/01/2022,新型コロナウイルス感染拡大の第6波も懸念される中で迎えた2022年。北関東の自治体や金融機関のトップには危機対応へのかじ取りに加え、コロナ後を見据えた次の一手も求められる。群馬県の山本一太知事は、昨年導入したワクチンのデジタル接種証などの成果を踏まえつつ、同県のデジタル化を全国トップレベルまで引き上げる目標を掲げた。危機対応にあたりながら、トップセールスによる企業誘致などの取り組みを本格化する1年...,地域総合,群馬・山本知事「企業へのトップセールス本格化」,https://www.nikkei.com/article/DGXZQOCC260Z10W1A221C2000000/
01/01/2022,新型コロナウイルス禍で神奈川県内の多くの企業が苦境に立たされる中、横浜銀行は2021年も取引先企業の支援を続けた。金融機関の経営環境は厳しさを増し、国内各地で引き続き地銀の合従連衡が進んでいる。コロナ後をにらんだ銀行経営や、地銀再編の流れにどう対処していくのか、大矢恭好頭取に聞いた。――コロナ禍2年目の21年は、どのようなことに重点を置きましたか。「資金繰り支援を第一に進めたが、21年は資金需...,神奈川,横浜銀行・大矢頭取「コロナ後は課題解決力が問われる」,https://www.nikkei.com/article/DGXZQOCC24APG0U1A221C2000000/
01/01/2022,低金利や少子高齢化に、新型コロナウイルス禍が重なり、地銀を取り巻く事業環境は厳しさを増す。全国の地銀では存続に向けて再編も加速している。こうした状況下で、八十二銀行の松下正樹頭取は金融以外の分野でも顧客とのつながりを「強固にする」と強調。家事代行の紹介など銀行が多面的に顧客と接点をもち、金融・非金融分野を組み合わせて収益を生み出していく考えを示した。――長野県の現在の経済情勢や2022年の見通しについて教...,地域金融,八十二銀行の松下氏「金融以外も顧客とつながり強固に」,https://www.nikkei.com/article/DGXZQOCC2370X0T21C21A2000000/
01/01/2022,東京の交通が変わろうとしている。利便性向上へ新たな鉄道路線の整備構想が実現に向けて動き出した一方、鉄道網の隙間を補うように自転車など近距離モビリティーのシェアリングサービスが日常に浸透してきた。新型コロナウイルス流行などで生活スタイルが様変わりするなか、約1600万人が行き交う首都の交通の行方を展望する。「つくば市から始まって羽田空港まで流れていく。日本の将来を描ける国家的な路線が整備できる」。...,東京,動き出した東京の鉄道新路線構想　「臨海」に成長託す,https://www.nikkei.com/article/DGXZQOCC1391I0T11C21A2000000/
01/01/2022,【NQNロンドン】31日のロンドン外国為替市場で、英ポンドは対ドルで3日続伸した。英国時間16時時点では、前日の同時点と比べて0.0050ドルのポンド高・ドル安の1ポンド=1.3540～50ドルと11月中旬以来、約1カ月半ぶりのポンド高水準となった。午後にかけて、年末を控えた持ち高調整のポンド買い・ドル売りが強まった。ユーロは対ドルで反発した。0.0040ドルのユーロ高・ドル安の1ユーロ=1.1370～80ドルだった。ユーロも午後に上げ幅を広げた。円の対ユーロ相場は下落した。50銭円安・ユーロ高の1ユーロ=130円90銭～131円ちょうどだった。円の対ドル相場は横ばいだった。前日の16時時点と同じ水準の1ドル=115円10～20銭だった。,為替概況,ロンドン外為31日　ポンド続伸　ユーロは反発,https://www.nikkei.com/article/DGXZASH2IILM3_R31C21A2000000/
01/01/2022,【NQNロンドン】31日のロンドン株式市場で、FTSE100種総合株価指数は続落した。前日の終値に比べ18.47ポイント（0.25%）安の7384.54で引けた。構成銘柄の6割超が下落した。終値べースでは昨年の年末に比べて14%上昇した。年末で短縮取引だった。市場参加者は少なく、取引は薄かった。29日に約1年10カ月ぶりの高値（終値べース）を付けたこともあり、利益確定の売りが出やすかった。鉱業株や公益株が売りに押された。個別では小売りのキングフィッシャーが安かった。投資会社のメルローズ・インダストリーズや金相場高で関連のフレスニージョは上げた。,ロンドン株式相場,ロンドン株31日　続落　鉱業株などに利益確定の売り,https://www.nikkei.com/article/DGXZASB7IIAA6_R31C21A2000000/
01/01/2022,【シリコンバレー=白石武志】米運輸省高速道路交通安全局（NHTSA）は12月30日、電気自動車（EV）大手の米テスラが小型車「モデル3」と高級セダン「モデルS」のトランク開閉に関連する不具合に対処するため計47万台超をリコール（回収・無償修理）すると発表した。同社が一度に実施するリコールとしては過去最大で、2020年の年間世界販売台数に匹敵する規模となる。同31日には中国の当局も同じ2車種で計約20万台のリコールをテスラが届け出たと発表した。【関連記事】米国でのリコール対象台数の内訳は17～20年式のモデル3が35万6309台、14～21年式のモデルSが11万9009台。NHTSAは不具合に関連する衝突や負傷、死亡事故をテスラは認識していないと説明している。理由は車種によって異なる。モデル3については後方トランクの開閉によってケーブルが損傷し、運転席のディスプレーに後方カメラの画像が表示されない可能性がある。モデルSでは前方トランクの掛けがねに不具合があり、走行中にフードが警告なしに開いて運転手の視界を妨げ、衝突の危険性を高めるおそれがある。中国の国家市場監督管理総局も31日、同じモデル3とモデルSについて、テスラが計約20万台のリコールを届け出たと発表した。中国で生産されたモデル3の約14万4000台に加え、輸入したモデル3とモデルSが約5万5000台にのぼる。,北米,テスラ、中国で20万台リコール　米でも47万台超,https://www.nikkei.com/article/DGXZQOGN3049T0Q1A231C2000000/
01/01/2022,2022年は米中が対立を深める中で、アジア各国や欧州のスタンスがさらに問われることになる。秋の米中間選挙や中国共産党大会も国際政治の変動要因だ。外交当局者の注目を集める世界各地の実力者たちの動きから国際政治の流れを占う。欧州は1年前には「蜜月」が目立った対中姿勢を「対抗」へと転換させた。欧州連合（EU）の欧州議会は人権問題を巡って中国との制裁合戦を繰り広げ、20年末にEUと中国が大筋合意した投資...,北米,「蜜月」から「対抗」へ　反中に傾く欧州、3人の実力者　,https://www.nikkei.com/article/DGXZQOGR23EMA0T21C21A2000000/
01/01/2022,新型コロナウイルス禍で拡大したテレワークは柔軟な働き方をもたらした一方、顔が見えにくいやりとりは従業員に孤独感をもたらした。働き方に詳しい千葉商科大の常見陽平准教授は「放牧」型のマネジメントへの転換が、新たな職場の一体感のカギになると説く。――チャットやビデオ会議のやりとり中心ではドライになりがちで、人間関係がうまく築きにくくなったという声が聞かれます。「特に社会人2年目は緊急事態宣言下で入社...,Re:Connect,「上司は部下の『放牧』を」常見陽平・千葉商科大准教授,https://www.nikkei.com/article/DGXZQOUE233F50T21C21A2000000/
01/01/2022,ほぼ2年に及ぶ新型コロナウイルス禍は学校や会社、地域で対面を避ける行動様式を定着させた。人と人との関わりが薄れていく中、新しい形でつながりを取り戻そうという動きも広がっている。まずは狭い空間に机を並べ「密」の典型とされた職場の変化をみてみよう――。社会人2年目のシステムエンジニア、菅弘志さん（24）が勤務するウェブサービス開発「マーズフラッグ」（東京・中央）は2021年7月、インターネット上の「...,Re:Connect,上司も部下も「アバター出社」　仮想職場で一体感,https://www.nikkei.com/article/DGXZQOUE1474W0U1A211C2000000/
