02/24/2022,2月中旬の英国のハーフ・ターム（学期中にある1週間の休み）を利用してアルプスのスキー場を訪れた何千人もの英国人スキーヤーらは、何かが足りないと感じたことだろう。レッスンを受けることができるスキーやスノーボードの英国人指導員の数が今年は非常に少なくなっている。英国の欧州連合（E U）離脱（ブレグジット）以来、英国人指導員がアルプス地方で働くことが困難になっている。英国とE Uが2020年末に新たに...,FT,[FT]英スキー指導員、アルプスでのレッスンが困難に,https://www.nikkei.com/article/DGXZQOCB241CU0U2A220C2000000/
02/24/2022,ロシア軍は24日、ウクライナの軍事施設へのロケット攻撃を開始した。ロシア国営メディアなどが伝えた。ロシア軍の黒海艦隊がウクライナ南部のアゾフ海などから上陸作戦をしかけているとの報道もある。【関連記事】ロイター通信は、ウクライナ政府関係者の話として、キエフなどにある司令拠点がミサイル攻撃を受けたと伝えた。,ウクライナ情勢,ロシア軍、ウクライナへの攻撃開始,https://www.nikkei.com/article/DGXZQOCB244080U2A220C2000000/
02/24/2022,ロシアメディアは24日、ロシア軍がウクライナ南部からも同国への軍事侵攻を始めたと報じた。ウクライナのクレバ外相は同日、複数の都市が攻撃の標的になっているとして、「（ロシア軍が）全面的な攻撃を開始した」と述べた。【関連記事】,ウクライナ情勢,ロシア軍、ウクライナ南部にも侵攻　「全面攻撃開始」,https://www.nikkei.com/article/DGXZQOCB244AD0U2A220C2000000/
02/24/2022,コーセー子会社のコーセーコスメポート（東京・中央）は紫外線から肌を守るUVカット機能を備えるマスクを3月1日に発売する。日焼けやシミの原因となる紫外線を94%カットし、ウイルスを含む飛沫や花粉にも対応する。新型コロナウイルス下でマスクの着用が習慣になるなか、肌ケアにも対応したアイテムとして需要を見込む。商品名は「サンカット　UVカットマスク　クール（プリーツタイプ）」。UVカット加工を施した不織布を使用した。ウイルスや花粉などの微細な粒子をブロックする高密度のフィルターを2枚使用し、風邪予防としての機能も高めた。顔周りを広くカバーできるように大きめのサイズにした。マスクの内側はひんやりとした感触のする不織布を使っており、夏場などの暑い時期でも使いやすい。1パック5枚入りで参考小売価格は657円。全国のドラッグストアなどで取り扱う。,サービス・食品,コーセーコスメポート、紫外線から肌を守るマスク,https://www.nikkei.com/article/DGXZQOUC107PK0Q2A210C2000000/
02/24/2022,岸田文雄首相は24日、ロシアのプーチン大統領がウクライナ東部で特別軍事作戦を実施すると発表したことを受け、首相官邸で記者団に語った。やりとりの全文は以下の通り。――プーチン氏がテレビ演説でウクライナ東部の国民を保護するため特別軍事作戦を実施すると明らかにした。受け止めは。「プーチン氏の発言など様々な報道がある。まずは情報の収集、事態の把握に全力で取り組む。いずれにせよ情勢は緊迫しているので、主要7カ国（G7）をはじめとする国際社会と連携しながら取り組んでいきたい」――ウクライナ政府は民間機の飛行を制限する。邦人退避で新たな対策をとるか。自衛隊機の派遣は。「まずは情報収集、事態の把握に努めている。そのなかで邦人の安全確保は大変重要な課題だ。何が適切なのか状況をしっかり把握した上で的確に対応していきたいと思う。今現在はその段階だ」,ウクライナ情勢,ロシア軍事作戦開始　岸田首相の発言全文,https://www.nikkei.com/article/DGXZQOUA2446U0U2A220C2000000/
02/24/2022,24日後場寄り付きの東京株式市場で日経平均株価は一段安。前営業日比550円程度安い2万5900円近辺で推移している。取引時間中に2万6000円を下回るのは2020年11月以来。日本時間24日昼ごろにロシアのプーチン大統領がウクライナ東部で特別軍事作戦を行うことを決めたと伝わり、運用リスクを回避したい投資家の売りが膨らんでいる。下げ幅は一時600円を超えた。日経平均株価を対象としたオプション価格から算出する日経平均ボラティリティー・インデックス（VI）は節目の30を一時上回った。取引時間中に30を上回るのは1月27日以来。前引け後の東証の立会外で、国内外の大口投資家が複数の銘柄をまとめて売買する「バスケット取引」は約95億円成立した。12時45分現在の東証1部の売買代金は概算で1兆8979億円、売買高は8億1021万株だった。フジクラや古河電が売られている。ファナックやスクリン、ソフトバンクグループ（SBG）も安い。INPEXや住友鉱は逆行高。〔日経QUICKニュース（NQN）〕,国内株概況,東証後場寄り　2万6000円下回る　ロシアの軍事作戦決定の一報受け,https://www.nikkei.com/article/DGXZASS0ISS14_U2A220C2000000/
02/24/2022,岸田文雄首相は24日、ロシアのプーチン大統領がウクライナ東部で特別軍事作戦を実施すると発表したことを受け「情報の収集、事態の把握に全力で取り組む」と述べた。「主要7カ国（G7）をはじめとする国際社会と連携する」と強調した。首相官邸で記者団に語った。現地の情勢について「緊迫している」と言及した。21日時点でウクライナにいるおよそ120人の邦人に関し「安全確保は重要な課題だ」と指摘した。「何が適切なのか状況をしっかり把握したうえで的確に対応していきたい」と話した。首相は24日午前の参院予算委員会で「事態の改善に向け、日本の国益を考えて対応を打ち出す」と表明し、G7と足並みをそろえて追加制裁を検討する意向を示した。,ウクライナ情勢,首相「国際社会と連携して対応」　ロシア軍事作戦巡り,https://www.nikkei.com/article/DGXZQOUA243Q90U2A220C2000000/
