05/01/2022,大阪府は1日、新型コロナウイルスの新たな感染者を2253人確認したと発表した。感染者数は前週同曜日（2732人）と比べ、479人減った。新たに80代の女性2人の死亡が判明し、府内の累計死者数は4948人になった。1日時点の重症者は前日から変わらず25人で、重い持病などを抱える軽症・中等症患者らを含め重症病床（619床）の実質の使用率は6.1%となった。軽症・中等症病床には777人が入院しており、軽症・中等症病床（3345床）の使用率は23.2%となった。病床には、確保数を超えて実際に運用しているものも含んでいる。府が設置した臨時医療施設「大阪コロナ大規模医療・療養センター」での療養者は16人だった。新規感染者のうち、感染者と同居して症状があり、PCR検査を受けずに医師の診断で陽性と判断された濃厚接触者は145人だった。自宅療養者は2万435人。公費によるPCR検査などを6855件実施した。,新型コロナ,大阪府、1日の新規感染2253人　新型コロナ,https://www.nikkei.com/article/DGXZQOUF011TY0R00C22A5000000/
05/01/2022,立憲民主党の泉健太、国民民主党の玉木雄一郎両代表は1日、大阪市で開かれたメーデー大会の会場で立ち話をした。昨年11月の泉氏の代表就任後、公の場での両氏の会談はない。玉木氏は夏の参院選比例代表を巡り、連合が支援する組織内候補計9人の当選に向け「互いに頑張ろう」と呼びかけた。立民から5人、国民から4人が立候補する予定。〔共同〕,政治,立民、国民代表が「立ち話」　メーデー会場で,https://www.nikkei.com/article/DGXZQODE011ZF0R00C22A5000000/
05/01/2022,バレーボールの全日本男女選抜大会第2日は1日、大阪市の丸善インテックアリーナ大阪で各組4チームが総当たりする1次リーグが行われ、女子でD組の東海大がVリーグ1部の埼玉上尾を2-0で破り、2連勝で準々決勝進出を決めた。男子はD組でVリーグ1部の東レが順大を、堺は鎮西高（熊本）を2-0で下した。ともに2連勝で8強入り。C組ではパナソニックが早大に2-0で快勝し2連勝とした。〔共同〕,スポーツ,女子は東海大、男子は東レなど8強　全日本選抜バレー,https://www.nikkei.com/article/DGXZQOKC011VG0R00C22A5000000/
05/01/2022,林芳正外相は1日、訪問先のモンゴルでバトツェツェグ外相とおよそ1時間半会談した。ロシアによるウクライナ侵攻を巡り、林氏は「国際社会の連帯が強く求められている」と訴えた。モンゴルは経済的に依存するロシアとの関係が深い。3月の国連総会での対ロ非難決議も棄権した。林氏は「ウクライナ侵略はアジアを含む国際秩序の根幹を揺るがす深刻な事態だ」と指摘し、対ロ連携に理解を求めた。バトツェツェグ氏は会談でウクライナ情勢に関し、即時に停戦し緊迫した状況を緩和するのが重要だとの立場を説明した。会談では北朝鮮情勢も意見交換し、日本とモンゴルが核・ミサイル問題や拉致問題への対応で協力していくことを確かめた。林氏は会談後、オンライン形式による記者会見で「今後もモンゴルと緊密に連携をとりたい」と話した。,政治,外相、対ロシア「国際社会と連帯を」　モンゴルに促す,https://www.nikkei.com/article/DGXZQOUA0117P0R00C22A5000000/
05/01/2022,【ソウル=甲原潤之介】韓国の尹錫悦（ユン・ソクヨル）次期大統領は1日、大統領府の国家安保室長に高麗大の金聖翰（キム・ソンハン）教授を起用すると発表した。米国の外交安全保障政策に精通した人材で、尹氏の外交ブレーンとして知られる。金氏は国際政治の専門家で、米国の大学院で政治学の博士号を取得した。李明博（イ・ミョンバク）政権の2012年に第2外務次官に就任した。尹氏の小学校の同級生で、大統領選では尹氏の外交安保政策を立案した。核・ミサイル開発を活発にする北朝鮮への対応で、米国との同盟強化に取り組むとみられる。日韓関係の改善にも前向きな発言をしている。尹氏は米国に依存せず「自主国防」を掲げた文在寅（ムン・ジェイン）政権の路線を転換し、米韓同盟を強化するための人選を進める。外相候補の朴振（パク・ジン）氏や国防相候補の李鐘燮（イ・ジョンソプ）氏とあわせ米国通を政権中枢に並べた。国家安全保障会議（NSC）を仕切る国家安保室第1次長には金泰孝（キム・テヒョ）元大統領府対外戦略企画官を充てる。李明博政権の外交政策を主導した人物で、尹政権で再び要職に就く。,北朝鮮,韓国新政権、安保室長に米国通起用　対北朝鮮で同盟強化,https://www.nikkei.com/article/DGXZQOGM0116L0R00C22A5000000/
05/01/2022,競馬の第165回天皇賞・春（GⅠ・芝3200㍍）は1日、阪神競馬場で18頭が出走して行われ、昨年の菊花賞馬で2番人気のタイトルホルダー（横山和生騎手）が3分16秒2で逃げ切り圧勝。7馬身差の2着に1番人気のディープボンドが入った。タイトルホルダーは父ドゥラメン...,スポーツ,天皇賞、タイトルホルダー圧勝　横山親子3代で盾制覇,https://www.nikkei.com/article/DGXZQODH0113V0R00C22A5000000/
05/01/2022,東京都は1日、新型コロナウイルスの感染者が新たに3161人確認されたと発表した。直近1週間平均の新規感染者は約4238人で、前週（約5467人）の77.5%だった。累計感染者数は144万1805人となった。都内の重症者は前日より2人減り9人だった。新たに6人の死亡を確認し、累計の死者数は4334人となっている。新規感染者を年代別に見ると、30代（616人）が最も多く、20代（566人）、40代（519人）が続いた。65歳以上の高齢者は195人だった。ワクチンの接種状況別では2回接種済みが1494人、未接種は787人だった。,新型コロナ,東京都、新たに3161人感染　7日平均で前週の77.5%,https://www.nikkei.com/article/DGXZQOCC0119Q0R00C22A5000000/
