12/02/2021,松野博一官房長官は2日の記者会見で、女子テニス協会（WTA）が中国国内での大会開催を見合わせたことにについて「多数の関係者が懸念の声を上げたのを受けたものと認識している」と語った。松野氏は「政府として一刻も早くこうした懸念が払拭されることを強く望んでおり、関連の状況を注視していく」と述べた。中国の彭帥選手が中国共産党の元幹部から性的被害を受けたと告白した後、消息不明となっていた。WTAは中国に公正な調査を求める声明を出し適切な結果が出なければ中国からの撤退も示唆していた。,政治,中国での大会見合わせ　官房長官「懸念の声受けた」,https://www.nikkei.com/article/DGXZQOUA02B5N0S1A201C2000000/
12/02/2021,パナソニックは2日、スポーツ施設向けの照明・音響設備の販売事業の売上高を2025年度に21年度比3割増の90億円程度に引き上げると発表した。学校の球場や練習場向けに発光ダイオード（LED）投光器の売り込みを強化する。プロスポーツ向けには設備導入後もエンターテインメント演出を提案するなど、リカーリング（継続課金）型モデルへの転換も進める。パナソニックによると国内大学でLEDを導入した屋外スポーツ施設は1割程度で「（学生などの）アマチュアスポーツは開拓余地が大きい」（スポーツビジネス推進部の宮本勝文部長）としている。消費電力の少なさや光の拡散が少ない点などを訴え、受注を増やす。また同日、パナソニックの照明器具が国際バスケットボール連盟（FIBA）の認証を受けたと発表した。今後、FIBA主催大会では同社の照明器具が使われ、「Bリーグ」などの大会でも使用が推奨されるという。,関西,パナソニック、スポーツ施設の照明・音響　4年で3割増に,https://www.nikkei.com/article/DGXZQOUF024E50S1A201C2000000/
12/02/2021,長野県は新型コロナウイルスのワクチンを2回接種していない人で、県内に帰省を予定している人を対象に、PCR検査キットを無料で配布する。県は対象者は可能な限り検査を受けて、陰性を確認した上で帰省するよう呼びかけている。6日から24日まで、ウェブサイトから検査の申し込みを受け付ける。申し込むと2～3日後を目安に検査キットが届き、検体を採取して返送する。検体が到着してから24時間以内に、申込時に登録したメールアドレスに検査結果が通知される。,新型コロナ,長野県、年末年始の帰省者に無料PCR検査,https://www.nikkei.com/article/DGXZQOCC021JR0S1A201C2000000/
12/02/2021,シャツ製造のフレックスジャパン（長野県千曲市）は、クーデター発生に伴い停止していたミャンマーの主力工場での生産を再開した。従業員数の減少により、当面の生産能力は従来比で2割ほど減る見通し。今後はベトナムやインドネシアでの生産を強化し、不足分を補う方針だ。フレックスの工場はヤンゴン東部にあり、日本国内で販売する量販品のシャツを中心に、年間160万枚程度を生産してきた。ミャンマー国内での生産量は同社...,長野,長野のフレックス、主力のミャンマー工場の生産再開,https://www.nikkei.com/article/DGXZQOCC307D60Q1A131C2000000/
12/02/2021,群馬銀行と第四北越フィナンシャルグループ傘下の第四北越銀行は2日、地域経済の活性化、店舗の共同利用やグループ会社機能の相互活用などで協力すると発表した。両行の顧客基盤を活用し、収益力向上やコスト削減を進める。人口減や超低金利の長期化など経営環境の変化に対応する狙い。両行頭取が連携協定「群馬・第四北越アライアンス」を結び、東京都内で同日記者会見した。地盤とする群馬・新潟両県の観光・物産振興や、地域活性化などの分野で協力する。双方の顧客...,金融機関,群馬銀行と第四北越銀行が提携　観光振興や店舗共同利用,https://www.nikkei.com/article/DGXZQOCC025Y80S1A201C2000000/
12/02/2021,ヤクルトの青木宣親外野手が2日、東京都内で契約更改交渉し、3年契約の2年目となる来季は現状維持の年俸3億3千万円でサインした。今季、プロ18年目で初めて日本一になった。優勝が決まった日本シリーズ第6戦で試合終了を待たずに目を潤ませ「まさか涙を流すとは思わなかったが、うれしかった」と余韻に浸った。今季は開幕直後に新型コロナウイルス感染者の濃厚接触者として離脱を強いられた影響もあり、打率2割5分8厘、9本塁打と昨季に比べて大きく成績を落とした。40歳で迎える来季に向け「特に前半は物足りなかった。もっといい成績を出したいし、また日本一になりたい」と気持ちを新たにした。小川泰弘投手は1億6千万円プラス出来高払い、石山泰稚投手は1億5千万円プラス出来高払いの現状維持でサイン。ともに来季が4年契約の2年目となる。（金額は推定）〔共同〕,スポーツ,ヤクルト青木「また日本一に」　現状維持3.3億円で更改,https://www.nikkei.com/article/DGXZQOKC02CB70S1A201C2000000/
12/02/2021,検査向け医薬品製造の大村興業（静岡県沼津市）は、女性特有の健康課題を技術で解決する「フェムテック」事業に参入する。約1億8000万円をかけて同社の原工場（同市）にクリーンルームを増設し、2022年春以降女性向けヘルスケア製品の製造に乗り出す。大村興業はインフルエンザ検査キットの受託製造が主力だが、コロナ禍以降国内でのインフルエンザの感染者が減少し「市場は10分の1以下になったといわれる」（大村智紀社長）。感染症の流行状況によらず需要のあるフェムテック分野へ参入し、売り上げの回復を目指す。将来的には卵子凍結・保存キットの製造も手掛ける計画だ。同社は1986年設立で、沼津市内に3工場を有する。感染症の検査キットのほか、化粧品や医療機器、遺伝子研究用の試薬を製造する。静岡県が県東部に企業を集め医療産業を振興する「ファルマバレープロジェクト」に参加する。,静岡,静岡の大村興業、フェムテック参入へクリーンルーム新設,https://www.nikkei.com/article/DGXZQOCC0233R0S1A201C2000000/
12/02/2021,新型コロナウイルスの新たな変異型「オミクロン型」の感染拡大が懸念されるなか、いまだ感染後の後遺症に悩む人が少なくない。研究機関の調査で、半年たっても症状が続く患者が4人に1人いることが判明し、国内で数十万人規模に及ぶ可能性がある。国は診療に関する手引を公表したものの、症状のメカニズムなどに不明な部分が多い。働く世代への影響を抑えるためにも、支援拡充が急がれる。国立国際医療研究センターは2020年...,新型コロナ,コロナ後遺症、数十万人規模か　働く世代への支援不可欠,https://www.nikkei.com/article/DGXZQOUE0937Z0Z01C21A1000000/
12/02/2021,新型コロナウイルス感染症にかかってから半年後でも、多くの人に認知機能の低下がみられることが米国の研究で明らかになった。入院患者の3人に1人は物事を覚えたり、思い出すことが難しかった。多くは働き盛りの世代で、入院した患者ではより頻度が高い。治療法は確立されておらず、詳細な調査が求められている。米マウントサイナイ医科大学の研究チームは、新型コロナに感染したことのある740人を対象に認知機能の低下を調...,新型コロナ,コロナ後遺症、入院患者3人に1人が記憶障害　米研究,https://www.nikkei.com/article/DGXZQOUC157UU0V11C21A1000000/
12/02/2021,衣料品の原料である綿花が国際市場で急速に品薄になっている。最大輸出国である米国で収穫が遅れた一方、中国を中心に引き合いが強いためだ。取引所の在庫も過去10年の最低水準まで落ち込み、ほぼ払底した状態だ。需給の逼迫を背景に相場も高値圏で推移し、紡績メーカーなど買い手の負担が増している。「前代未聞の低水準だ」。綿花を取引する商社などで構成する日本綿花協会（大阪市）の大下信雄代表理事は、米インターコンチ...,商品ニュース,綿花が足りない　米国の収穫遅れ、相場高で衣料に打撃,https://www.nikkei.com/article/DGXZQOUB226DK0S1A121C2000000/
12/02/2021,米国の社債市場で警戒感がじわり増している。金融環境の悪化を知らせる「炭鉱のカナリア」と呼ばれる低格付け債の価格は年初来安値を更新し、国債に対する利回り差（スプレッド）も拡大する。米低格付け債は過去の変異ウイルスの感染拡大局面や中国景気の減速下でも底堅く推移してきた。足元の変調は何を示しているのだろうか。「ついに動き出したか」。南アフリカや欧州で新型コロナウイルスのオミクロン型が確認された11月末...,ポジション,米社債に「カナリアの警鐘」　低格付け敬遠、利上げ意識,https://www.nikkei.com/article/DGXZQOUB023JH0S1A201C2000000/
12/02/2021,政府は赤字の中小企業が従業員の賃金を上げられるよう支援する。中小向けの補助金に賃上げする赤字企業を対象とした特別枠を設け、設備投資額の3分の2を補助するなど手厚く支援する。政府は賃上げした企業の法人税を減税する優遇税制を拡大する方針だが、法人税を納めていない赤字企業には減税の効果が及ばない。日本の雇用の7割を抱える中小の多くは赤字経営に陥っているとされる。赤字が常態化した企業の賃上げを国費で支...,税・予算,賃上げで補助金増、赤字の中小に　設備投資の3分の2,https://www.nikkei.com/article/DGXZQOUA027Y00S1A201C2000000/
12/02/2021,セイカ食品（鹿児島市）はボンタンアメや兵六餅といった菓子の製造・卸を手掛ける老舗企業。特に練乳かき氷にミカンや小豆をトッピングした「南国白くま」シリーズは、南九州を中心によく知られる。2017年に鹿児島市内から移転、稼働した日置工場（鹿児島県日置市）は同社のアイス製造を一手に引き受ける、最新鋭の設備を入れた生産拠点だ。工場はJR伊集院駅から車で7分の場所にある。1957年にアイスクリームの製造販...,鹿児島,セイカ食品日置工場　2段階冷凍でアイスの硬さ絶妙,https://www.nikkei.com/article/DGXZQOJC292DL0Z21C21A1000000/
12/02/2021,浜松市は11、12日の両日、音をテーマにした体験型イベント「サウンドデザインフェスティバル」を市内で開く。最新技術を使った楽器をはじめ、普段とは少し違った視点で音を楽しめる作品などを展示する。ワークショップも開く。市と市文化振興財団などでつくる実行委員会が主催する。楽器メーカーのヤマハ、河合楽器製作所、ローランドは新しい技術やデザインをとり入れたピアノを展示する。このほか演奏に合わせて頭を振るロボットや、貧乏ゆすりをすると音が鳴る装置などを体験できる。身近な物で楽器を作るワークショップなども開く。「音の持つ可能性を感じられる企画にした」（浜松市）。誰もが音づくりを楽しめる場の創出や距離を超えた音の楽しみ方なども追求した。アクトシティ浜松が主な会場となり、市楽器博物館などでも一部の企画を行う。,静岡,浜松市で音がテーマの体験型イベント　11、12日開催へ,https://www.nikkei.com/article/DGXZQOCC02ABZ0S1A201C2000000/
12/02/2021,ヤマハ発動機は、産業用ロボット製品「ロボニティシリーズ」で、細い棒が往復して部品の押し付けや位置決めなどに使う「ロッドタイプ」などの9機種を2日以降順次売り出す。ロッドタイプは剛性を高めて棒がまっすぐ進むようにした。台座に部品を載せて搬送することなどに使う「スライダタイプ」は、高さを抑えた薄型モデルも品ぞろえに加える。モーターがついていないロッドタイプの希望小売価格は6万8640円から。9機種合計で今後1年間に600台の販売をめざす。,中部,ヤマハ発動機、産業用ロボ製品　部品位置決め用など,https://www.nikkei.com/article/DGXZQOCC025C20S1A201C2000000/
12/02/2021,静岡経済研究所（静岡市）が発表した静岡県内企業の冬のボーナス予想によると、従業員1人あたりの支給見込み額は、前年同期比0.3%増の37万7900円となった。新型コロナウイルス感染拡大で落ち込んだ前年推計からほぼ横ばいとなり、コロナ禍前の水準にはとどかない見込み。規模別にみると従業員30人以上の企業が0.4%増の44万2200円、29人以下は0.3%減の26万8000円だった。2020年に比べ雇用状態が改善したほか企業収益は回復傾向にある。一方で原材料価格の高騰などの影響を受け、22年3月期通期の業績予想を下方修正する企業も目立っているという。調査はボーナス額と相関性の高い有効求人倍率や鉱工業生産指数などの統計指標を基に算出した。支給対象者は約122万5000人と微増。県内の支給総額は4631億円と予想している。,静岡,静岡県内企業の冬ボーナス、ほぼ横ばい　民間予想,https://www.nikkei.com/article/DGXZQOCC0124Q0R01C21A2000000/
12/02/2021,公正取引委員会は2日、葬儀仲介サイト「小さなお葬式」を運営するユニクエスト（大阪市）が葬儀社との間で競合他社との取引を制限する不当な契約を結んでいたとして、独占禁止法違反（不公正な取引方法）の疑いで立ち入り検査していたと発表した。同社は自主的な改善措置を取ったといい、公取委は独禁法違反の疑いが解消されたと判断、審査を終了した。サイトを通じて葬儀社と利用者を仲介する同社は2018年、葬儀社が競合サイトと取引しないことを条件にした特約加盟店制度を導入。特約加盟店は一般加盟店より5～10%高い手数料を受け取れる半面、競合サイトに情報を掲載できなくなる。21年9月時点で加盟店1099社の約2割が特約だった。公取委によると、ユニクエストは約20社あるネット葬儀社の最大手で、約4割のシェアを持つとみられる。公取委は特約制度が葬儀社と競合サイトの取引機会を減少させ、公正な競争を阻害する恐れがあるとして、6月にユニクエストを独禁法違反の疑いで立ち入り検査した。同社が9月末で特約制度を廃止するなど、自主的な改善措置を取っていることが確認できたとして、公取委は審査を終了した。公取委は近年、ネット上で取引の場を提供する「デジタルプラットフォーマー」の動向を注視しており、今回の審査もその一環。公取委の担当者は「プラットフォーマーによる取引制限は業者間だけでなく一般消費者にも影響する。今後も違反行為に厳正に対処していく」としている。,社会・調査,葬儀仲介サイトが不当契約　公取委、自主改善で審査終了,https://www.nikkei.com/article/DGXZQOUE0250U0S1A201C2000000/
12/02/2021,造船最大手の今治造船は洋上風力発電所で生み出した電力を「電気運搬船」で輸送する構想を掲げるスタートアップ、パワーエックス（東京・港）と資本提携を結んだ。同社が発行する新株予約権を引き受け、約10億円を出資する。2025年までに初号船を完成し、試験運航を共同で実施していく。3日発表する。両社は22年1月から電気運搬船の設計を始め、22年中にも建造に着手する。初号船ではコンテナ船の構造設計を応用し、...,カーボンゼロ,今治造船が電気運搬船　新興パワーエックスと資本提携,https://www.nikkei.com/article/DGXZQOUC307130Q1A131C2000000/
12/02/2021,茨城県産のメロンの販売が米国本土で始まった。米国が害虫の侵入を警戒して規制していた本土向けの日本産メロンの輸入について、11月8日に解禁したことで茨城県などが準備を進めていた。国産メロンの米国本土への輸出は全国で初めて。JA常総ひかり（茨城県下妻市）がアールスメロンを30玉輸出した。ロサンゼルスにあるパン・パシフィック・インターナショナルホールディングスが運営する日系量販店で販売した。価格は1個約23ドル（約2600円）と現地のものより高額だったが、26日に発売し4日間で完売したという。県内ではメロン収穫が一段落しており、次の輸出は2022年の4月以降になる見通しだ。茨城県は農産物の輸出促進に力を入れる。北米は所得水準が高いため、梨やメロンなどの果物については有力市場と見ている。甘さや網目の美しさを訴求して販路を広げる考えだ。,サービス・食品,茨城県産メロン、米本土に輸出　国産で初めて,https://www.nikkei.com/article/DGXZQOCC021NI0S1A201C2000000/
12/02/2021,【バンコク=岸本まりみ、北京=多部田俊輔】東南アジアの小国ラオスで3日、中国の「一帯一路」構想下で建設が進んでいた高速鉄道が開通する。近代化が遅れていたラオスにとって初の本格的な鉄道で、市民は歓迎ムードに沸く。総工費が国の国内総生産（GDP）の3割強に上る同国最大級の事業が完成し、中国のラオスに対する影響力は強まる。2日にはラオスの首都に新たに建設されたビエンチャン駅で開通式が開かれた。オレンジ...,中国・台湾,ラオスで「一帯一路」鉄道開通　総額6780億円は中国依存,https://www.nikkei.com/article/DGXZQOGS244KP0U1A121C2000000/
12/02/2021,中谷元首相補佐官は2日、都内で開いたシンポジウムに出席し、アフガニスタンの邦人退避に関し「情報収集をしっかりやらなければならないという教訓を残した」と述べた。「自衛隊機の派遣の検討を迅速にするようしっかりと議論が必要ではないか」と話した。政府は8月にアフガンから邦人や現地協力者を退避させるため自衛隊機を派遣した。初動が遅れたとの批判があがった。自衛隊の派遣の準備や判断のため政府の情報収集の能力を高める必要があると訴えた。閣議決定が必要な手続きは簡略化し防衛省の判断で周辺の空港まで予備的な派遣ができるようにすべきだとも提唱した。アフガンを巡ってはイスラム主義組織タリバンが首都カブールを掌握し治安の悪化が続く。中谷氏は「日本政府は日本人だけを対象にするのではなく幅広く人道的な救援をしなければならない」と強調した。他国から外国人の輸送の依頼があれば対応できるよう検討すべきだと語った。「米軍の要請で現地の人を米軍のために運んだことは日米関係の信頼性にとってよかった」と力説した。,政治,邦人退避の自衛隊派遣、迅速化の議論を　中谷補佐官,https://www.nikkei.com/article/DGXZQOUA0128C0R01C21A2000000/
12/02/2021,全国知事会の平井伸治会長（鳥取県知事）は2日、新型コロナウイルス対策を巡り日本医師会の中川俊男会長とオンライン協議し、ワクチンの3回目接種前倒しも必要との認識で一致した。早期のワクチン供給やスケジュールの明示なども連携して国に働きかけていくことも確認した。平井氏は「ある程度（3回目接種時期の）前倒しも必要だ。（新たな変異ウイルスの）オミクロン型と立ち向かえる体制づくりを急ぎたい」と強調。中川氏も「接種体制が整った自治体から前倒しで接種することも必要だ」と応じた。政府は2回目からの接種間隔を「原則8カ月」としているが、例外的に認める「6カ月」の対象範囲の拡大を検討している。平井氏は「（政府は）例外運用の考え方をできるだけ早く示してほしい」とも指摘した。協議には国民運動本部の村井嘉浩本部長（宮城県知事）や日本医師会の今村聡副会長らも参加。知事会は今年9月に国民運動本部を新設し、医師会や経済団体など各種団体との連携強化を図っている。,地域総合,3回目接種前倒しも必要　知事会・医師会長が一致,https://www.nikkei.com/article/DGXZQOCC024X10S1A201C2000000/
12/02/2021,さまざまな著作物を二次利用しやすくする仕組みを検討している文化審議会の小委員会は2日、音楽や映像など分野にかかわらず、利用者からの申請や相談を一元的に受け付ける窓口組織を創設するとした中間報告をまとめた。著作権者が不明な場合でも、利用に向け一元窓口が対応する。著作権は日本音楽著作権協会（JASRAC）など各分野の団体が委託を受けてまとめて管理したり、団体に委託しない個人が自分で管理したりしている。二次利用には、各団体や個人に申請する必要がある。窓口は、著作権者や管理団体が明確なら利用者を取り次ぐ。一般人がインターネットで公開した映像作品や音楽なども対象とする。各分野の著作権情報を網羅したデータベースを新たに構築し、著作権者が不明な際や連絡が取れなかった際は窓口が探索。許諾に関する著作権者の意思を確認する。判明しなければ「新しい権利処理の仕組み」で利用可能にする。具体的には、利用者が使用料相当額を窓口に納めることで認める案などが想定されている。現行でも著作権者がどうしても見つからなかった場合、文化庁長官の裁定で利用できるようにする制度があり、この手続きを窓口が代行する案もある。新しい仕組みを適用する基準など今後さらに議論を進め、文化庁など関係省庁が来年度中に具体化を図る。〔共同〕,社会・調査,著作物利用、一元窓口で　権利者不明でも対応,https://www.nikkei.com/article/DGXZQOUE02BLN0S1A201C2000000/
12/02/2021,ふくおかフィナンシャルグループ（FG）の一般財団法人「ふくおかフィナンシャルグループ企業育成財団」（キューテック）は中小企業や大学の技術シーズに対する助成金について、2021年度の交付先13件を発表した。助成金額は1件あたり最大500万円で、総額は6000万円。安全なゲノム編集技術やAI（人工知能）を活用した生産計画の最適化技術などを助成先に選んだ。キューテックは中小ベンチャーの研究開発支援などを目的に1985年に設立し、18年度からは大学発技術なども助成の対象にした。今年度から事業計画や資金調達など事業化に必要なノウハウを、教育プログラムとして提供する。安全なゲノム編集技術の確立に取り組む九州大学の川又理樹助教は「助成金で事業化に向けて安心して研究に取り組める」と話した。需要予測が難しい品目の生産計画システム開発に取り組むRegnio(リグニオ、福岡市)の中野雅俊代表取締役CTO（最高技術責任者）は「資金を糧に早期の製品化を目指したい」とした。,地域金融,ふくおかFGのキューテック、ゲノム編集技術などに助成,https://www.nikkei.com/article/DGXZQOJC3080A0Q1A131C2000000/
