03/25/2022,25日のJPX日経インデックス400は9日続伸した。終値は前日比13.70ポイント（0.08%）高の1万7893.73だった。1月17日以来約2カ月ぶりの高値。9日続伸は2021年3月9～19日以来となる。前日の米株式市場で主要株価指数が上昇したことや、3月期末の配当取りなどを意識した買いが優勢だった。ただ、利益確定売りも増え上げ幅は限定的だった。第一三共や任天堂が上げた。キーエンスやKDDIは下げた。〔日経QUICKニュース（NQN）〕,国内株概況,JPX日経400大引け　9日続伸、13.70ポイント高の1万7893.73,https://www.nikkei.com/article/DGXZASFL25I68_V20C22A3000000/
03/25/2022,ノルウェーのエネルギー調査会社、ライスタッド・エナジーで石油市場調査チームの責任者を務めるビヨナル・トンハウゲン氏が日本経済新聞のオンラインインタビューに応じた。ロシア制裁で「原油価格は年内に1バレル180ドルもあり得る」との見解を示した。供給不足の解消は2023年以降になる見込みで、年内は原油価格が高値圏で推移する可能性が高いという。ライスタッドは欧州を代表するエネルギー産業の専門家集団で、世...,環境エネ・素材,「原油価格、ロシア制裁で年内180ドルも」,https://www.nikkei.com/article/DGXZQOUC23CSB0T20C22A3000000/
03/25/2022,外国人向けの家賃保証を手掛けるグローバルトラストネットワークス（GTN、東京・豊島）は在留外国人の人材データベース事業を始める。日本に住む外国人の日本語能力や経歴をまとめて人材募集中の企業に公開する。月額1万円から利用できるようにして採用企業の負担を軽減し、外国人の採用活性化につなげる考え。「外国人人材バンク」を始める。同社の家賃保証サービスの利用者など1000人がすでに登録している。日本語能力...,ネット・IT,GTN、在留外国人の人材データベース,https://www.nikkei.com/article/DGXZQOUC047PC0U2A300C2000000/
03/25/2022,自民、公明両党は25日、今国会での提出を目指す議員立法の「こども基本法案」の要綱案に合意した。公明党が求めた調査・勧告機能を持つ第三者機関の設置は明記しなかった。付則に法施...,政治,自公、こども基本法案の要綱案合意,https://www.nikkei.com/article/DGXZQOUA255XH0V20C22A3000000/
03/25/2022,25日の東京株式市場で日経平均株価は9日続伸し、前日比39円45銭（0.14%）高の2万8149円84銭で終えた。1月18日以来およそ2カ月ぶりの高値。9日続伸は2019年9月3～17日以来の連騰記録となる。前日の米株式市場で主要株価指数が上昇したことや外国為替市場での円安基調などを背景に、東京市場でも買いが優勢だった。朝方には上げ幅が200円を超える場面があった。24日、主要半導体株で構成するフィラデルフィア半導体株指数が5%上昇したことから半導体関連株などが買われ指数を押し上げた。業種別東証株価指数（TOPIX）では海運業や医薬品などが上昇した。後場には利益確定売りとアジア株安などから一時160円安となったが、その後は戻した。りそなアセットマネジメントの戸田浩司シニア・ファンド・マネージャーは「ほぼ年初の水準まで戻しただけで特に割高感があるわけではない。ウクライナ情勢を受けた過度な警戒感は後退しており、押し目を買いたい投資家は少なくない」とみていた。JPX日経インデックス400は9日続伸し、終値は前日比13.70ポイント（0.08%）高の1万7893.73だった。9日続伸は21年3月9～19日以来。東証株価指数（TOPIX）は9営業日ぶりに小幅反落し、0.09ポイント（0.00%）安の1981.47で終えた。東証1部の売買代金は概算で3兆581億円。売買高は11億8685万株で、およそ1カ月ぶりの低水準だった。東証1部の値上がり銘柄数は1007、値下がりは1068、変わらずは106だった。東エレク、塩野義、第一三共、TDK、ファナック、日東電が高い。一方、ソフトバンクグループ、KDDI、ダイキン、キーエンスは売られた。〔日経QUICKニュース（NQN）〕,国内株概況,東証大引け　9日続伸し39円高、2カ月ぶり高値　米株高など追い風,https://www.nikkei.com/article/DGXZASS0ISS16_V20C22A3000000/
03/25/2022,【NQN香港=須永太一朗】25日の韓国株式市場で総合株価指数（KOSPI）は小幅に反発した。終値は前日比0.32ポイント（0.01%）高の2729.98だった。前日の米株高を受けて投資家心理が上向き、韓国市場でも買いが入った。個人投資家の買いが目立った。もっとも指数の上げ幅は限られ、取引時間中は小安く推移する場面もあった。北朝鮮による新型の大陸...,アジア株概況,韓国株25日　反発、米株高が支え　北朝鮮の新型ミサイル発射は重荷,https://www.nikkei.com/article/DGXZASB2IDE22_V20C22A3000000/
03/25/2022,メキシコのロペスオブラドール大統領は25日、メキシコ銀行（中央銀行）による正式な発表より数時間前に利上げの決定がなされたことを明かし、同国の金融セクターに動揺を与えたことを受け陳謝した。ロペスオブラドール氏は24日午前の記者会見で、5人の委員で構成する中銀の金融政策決定会合で政策金利を0.5%引き上げて6.5%にすることを決定したと発言した。機先を制するようなこの発言は、中銀の独立性に疑問を投げ...,FT,[FT]メキシコ大統領、中銀より先に利上げ公表　後に陳謝,https://www.nikkei.com/article/DGXZQOCB254JP0V20C22A3000000/
03/25/2022,岸田文雄首相は25日午後、政府専用機で羽田空港に着陸し、訪問先のブリュッセルから帰国した。ウクライナに侵攻したロシアへの経済制裁などを協議した主要7カ国（G7）の首脳会議に出席した。バイデン米大統領と立ち話をしたほか、ジョンソン英首相らと個別に会談した。,G7首脳会議,首相が帰国、G7首脳会議出席終え,https://www.nikkei.com/article/DGXZQOUA256W20V20C22A3000000/
03/25/2022,松野博一官房長官は25日の記者会見でサッカー日本代表がワールドカップ（W杯）カタール大会出場を決めたことに関し「明るいニュースで心から敬意を表したい」と祝意を示した。「本戦でもさらに上を目指して活躍されることを期待したい」と語った。松野氏は「特に最終予選の序盤では苦しい戦いも続き、チーム、選手たちにとって相当なプレッシャーだったと思う」と指摘した。「コロナ禍で感染防止にも配慮しつつ戦い続けた。見事7大会連続の本戦出場を決めた」と評価した。,政治,サッカーW杯出場決定に祝意　官房長官,https://www.nikkei.com/article/DGXZQOUA252670V20C22A3000000/
03/25/2022,横浜ゴムは25日、農機用タイヤなどを手掛けるスウェーデンのトレルボルグ・ホイール・システムズを買収すると発表した。買収額は約2700億円。乗用車向けタイヤは中国や韓国勢との競争が激化するなか、農機用など産業分野を強化する。横浜ゴムはタイヤ国内3位。,環境エネ・素材,横浜ゴム、スウェーデンの農機タイヤを買収　2700億円,https://www.nikkei.com/article/DGXZQOUC256C40V20C22A3000000/
03/25/2022,25日の新興企業向け株式市場で、東証マザーズ指数は3営業日ぶりに小幅に反落した。終値は前日比1.57ポイント（0.21%）安い761.18だった。上昇基調が続いてきたため、主力銘柄を中心に利益確定売りが優勢となった。前日の米株高を背景に朝方は上昇する場面もあった。下値では主力銘柄の一角に買いも入り、午後は底堅く推移した。GWやエッジテクノ、JTOWERが下げた。一方、リボミックやフロンテオは上昇した。メルカリは下げる場面もあったが、上昇して取引を終えた。日経ジャスダック平均株価は小幅に9日続伸。終値は10円75銭（0.29%）高い3658円93銭だった。主力銘柄の一角に見直し買いが続いた。ジャスダック市場の売買代金は概算で361億円、売買高は4953万株だった。ウエストHDやマクドナルド、東洋合成が買われた。半面、フェローテクやセプテニHD、3DMは下げた。〔日経QUICKニュース（NQN）〕,国内株概況,新興株25日　マザーズは3日ぶり小反落　ジャスダックは9日続伸,https://www.nikkei.com/article/DGXZASS0ISST2_V20C22A3000000/
03/25/2022,【台北=中村裕】台湾の立法院（国会）は25日の本会議で、選挙権の年齢を現行の20歳以上から18歳以上に引き下げる憲法修正案を採決し、賛成多数で可決した。台湾のトップを決める2024年の次期総統選をにらみ、若年層からの支持が多い与党・民主進歩党（民進党）が主導し、法案を提出した。台湾の有権者は現在、全人口2330万人の8割強に当たる約1930万人。今後、住民投票を経て、憲法が正式に修正されれば、40万人強が新たに選挙権を有することになる。若年層からの支持者が多い民進党は以前から、有権者の年齢の引き下げに積極的だった。敵対する国民党が反対し長年、実現しなかった。ただ国民党は最近、支持率の低下から抜け出せず、これ以上の反対はさらに、若者の反発を買うなどの判断から今回、党議拘束をかけて賛成側に回った。台湾の憲法修正には、まず立法院において立法委員（定数113）の4分の3以上の出席が必要。かつ4分の3以上の賛成が必要となる。さらに半年間の公告後、3カ月以内に実施する住民投票で有権者の過半数が賛成すれば、憲法が修正される仕組みだ。住民投票は11月予定の統一地方選挙に合わせて実施される見込み。蔡英文（ツァイ・インウェン）総統率いる民進党は、選挙権の引き下げを早期に実現し、24年1月の総統選や立法院選（議会選）に弾みを付けたい狙いだ。,中国・台湾,台湾、選挙権18歳以上に引き下げへ　次期総統選にらむ,https://www.nikkei.com/article/DGXZQOGM253XR0V20C22A3000000/
03/25/2022,東京電力ホールディングスが原子力部門の本社機能を、現在の東京都から新潟県柏崎市に移すことが25日、わかった。柏崎刈羽原子力発電所（同県）でテロ対策の不備が相次いだことを受けた措置で、4月以降に段階的に人員を移す。本社機能を現場に近づけて組織の風通しを良くし、安全管理体制の改善などにつなげる。同社は2021年9月にテロ対策不備の再発防止策を公表した際、原子力部門の本社機能を新潟県内に移転することを検討していると...,環境エネ・素材,東電、原子力部門の本社機能を新潟県柏崎市に移転へ,https://www.nikkei.com/article/DGXZQOUC2544R0V20C22A3000000/
03/25/2022,選抜高校野球大会第7日は25日、甲子園球場で2回戦が行われ、近江（滋賀）と金光大阪が準々決勝に進んだ。近江は聖光学院（福島）に7-2で快勝した。山田が5安打に抑えて2失点完投し、19年ぶりの8強。近江は新型コロナウイルス禍で辞退した京都国際に代わり、繰り上がりで出場。代替出場校の8強は第64回大会（1992年）の育英（兵庫）以来、4校目。金光大阪は木更津総合（千葉）にタイブレークの末、延長十三回、4-3で逆転サヨナラ勝ち。2点を追う十三回に内野ゴロと押し出し四球で追い付くと、押し出し死球で決勝点を奪った。第3試合は、高知と国学院久我山（東京）が対戦。〔共同〕,スポーツ,金光大阪8強、木更津総合に逆転サヨナラ　選抜高校野球,https://www.nikkei.com/article/DGXZQOKC255YX0V20C22A3000000/
03/25/2022,北海道函館市の北隣、七飯町で2021年に誕生した日本酒「郷宝（ごっほう）」の酒かすを使った食品が広がっている。ケーキや塩辛の味が深まり、日本航空は化粧品に採用した。蔵元の箱館醸蔵（七飯町）は各社に無料で提供し、酒米栽培から食までを含む地域の輪を生み出しつつある。土産物など食品を企画・販売するたかせ（七飯町）は1日、郷宝の酒かすを使った「大人の松前漬　ねばいかす」を発売した。定番商品のイカ塩辛に酒かすを加...,SDGs,「郷宝」の酒かす、菓子など味深く　日航はリップに採用,https://www.nikkei.com/article/DGXZQOFC230SY0T21C21A1000000/
03/25/2022,25日の東京株式市場で日経平均株価は9日続伸し、前日比39円45銭（0.14%）高の2万8149円84銭で終えた。前日の米株式市場で主要株価指数が上昇したことや外国為替市場での円安進行などを背景とした買いが優勢だった。ただ、短期的な過熱感が強まっていることから利益確定売りが増え下げに転じる場面もあった。東証1部の売買代金は概算で3兆581億円（速報ベース）だった。〔日経QUICKニュース（NQN）〕,国内株概況,日経平均大引け　9日続伸、39円高の2万8149円,https://www.nikkei.com/article/DGXZAS3LTSEC1_V20C22A3000000/
03/25/2022,25日の東京株式市場で日経平均が9営業日続伸した。10営業日続伸した2019年9月3日～17日以来2年半ぶりの連騰記録となった。ウクライナ情勢の膠着が続いており、一段の状況悪化を懸念していた投資家の慎重姿勢がいったん和らいでいる。年度末に向けて配当の再投...,株式,日経平均、9営業日続伸　19年9月以来2年半ぶり,https://www.nikkei.com/article/DGXZQOUB255730V20C22A3000000/
