02/17/2022,JTBは観光地の食べ歩きによるごみのポイ捨て問題を解決するための実証実験を、埼玉県川越市と京都市で始めた。ごみを観光地で処分したい観光客にキャッシュレス決済システムを使って任意の金額を支払ってもらい、集めたお金をごみ箱の設置や維持・管理などのごみ処理関連費用に充当。ポイ捨てがない観光地を観光客と商店街などが協力して持続できるかどうかを検証する。新たな取り組みは「Go!ME（ゴーミー）」と名付け、...,環境エネ・素材,JTB、観光地のごみ問題解決へ実証　埼玉・川越などで,https://www.nikkei.com/article/DGXZQOCC09C0L0Z00C22A2000000/
02/17/2022,三菱ケミカルやトヨタ自動車、東京大学などは、太陽光と二酸化炭素（CO2）を使って化学原料を作る新技術「人工光合成」の大規模実証実験を2030年に実施する。まず水素製造コストで石油由来の方法と同程度に下げる。同技術は石油に頼らず化学原料を作ることができ、脱炭素技術の切り札といわれる。産官学で研究開発を加速し、40年までの実用化を目指す。光合成は植物が太陽光を使って水とCO2から有機物を作る。人工光合成はこの光...,自動車・機械,人工光合成、30年に大規模実証　三菱ケミカルやトヨタ,https://www.nikkei.com/article/DGXZQOUC1733J0X10C22A2000000/
02/17/2022,【フランクフルト=深尾幸生】欧州自動車工業会（ACEA）が17日に発表した1月の欧州主要18カ国の新車販売台数（乗用車）は、前年同月比3%減の73万8452台だった。マイナスは7カ月連続だが、2桁%の減少が続いていたこれまでと比べ、改善の兆しも見えてきた。最大市場のドイツが8%増の18万台、英国は28%増の11万台だった。一方、フランスは19%減、イタリアは20%減だった。半導体不足の影響は徐々に緩和されているものの、車両供給が滞る状況が続く。メーカーグループ別では、首位の独フォルクスワーゲン（VW）が販売台数を3%減らした。シェアは24.6%と横ばい。2位は欧州ステランティスで販売台数は12%減、シェアは20.1%（1.1ポイント下落）だった。3位は韓国の現代自動車で台数が34%増えた。シェアは2.7ポイント増の9.7%と21年の好調を維持した。日本勢はトヨタ自動車が14%増で、シェアは7.6%と1.1ポイント上げた。日産自動車の販売台数は19%減、マツダは28%増、ホンダは55%増だった。1月のマルタを除く欧州連合（EU）26カ国の販売台数は6%減の68万2596台だった。ACEAは22年通年のEUの乗用車の新車販売が21年比で8%増えると見込んでいる。,ヨーロッパ,欧州新車販売、1月3%減　7カ月連続マイナス,https://www.nikkei.com/article/DGXZQOGR1770Y0X10C22A2000000/
02/17/2022,新潟県は17日、国連教育科学文化機関（ユネスコ）の諮問機関である国際記念物遺跡会議（イコモス）の「佐渡島の金山」の現地調査支援業務について公募型プロポーザルの募集を始めた。申込書提出期限は3月10日正午まで。業務委託先を1者選ぶ。見積もり限度額は...,新潟,新潟県、イコモス調査支援業務の提案公募　佐渡金山巡り,https://www.nikkei.com/article/DGXZQOCC173Z00X10C22A2000000/
02/17/2022,政府は22日に松江市で開く「竹島の日」の記念式典に小寺裕雄内閣府政務官を派遣する。閣僚の派遣は見送る。政務官の派遣は2013年から10年連続となる。島根県は05年に2月22日を「竹島の日」とする条例を制定し、06年から毎年式典を開いている。,岸田政権,「竹島の日」式典に政務官出席　閣僚は見送り,https://www.nikkei.com/article/DGXZQOUA179CD0X10C22A2000000/
02/17/2022,新潟県内と東京都内で居酒屋を展開する、よね蔵（新潟県三条市）は食肉専門店「あんず　お肉の工場直売所」を新潟市内に17日出店した。新型コロナウイルス禍が長期化するなか、精肉小売業へ参入して収益源を多角化する。20日まで開店記念の肉福袋などを用意する。アトム（福岡市）が福岡県や首都圏などで展開する「あんず　お肉の工場直売所」のフランチャイズ（FC）店で、初の新潟県出店となる新潟河渡店（新潟市）を開業した。アトムの加工工場で生産した精肉を店頭販売するほか、肉を使った弁当や総菜も販売する。営業時間は午前10時から午後7時まで。FC店の強みを生かし、宮崎牛や上州豚などの上質な品種を取り扱い、他の精肉店との違いを打ち出す。よね蔵の山田美江子社長は「福岡や大阪、東京など大都市圏以外では手に入りにくい上質なホルモンなどをそろえた」と話す。この日は県内大手企業の首脳らも視察に訪れた。,サービス・食品,居酒屋のよね蔵、食肉専門店「あんず」を新潟県初出店,https://www.nikkei.com/article/DGXZQOCC177EH0X10C22A2000000/
02/17/2022,17日朝のロンドン株式市場で、FTSE100種総合株価指数は続落して始まった。英国時間8時時点では、前日に比べて7.00ポイント（0.09%）安の7596.78だった。ウクライナ情勢を巡る地政学リスクが改めて意識されたことで、投資家心理が悪化している。ドイツ株式指数（DAX）とフランスのCAC40はいずれも横ばい圏で推移している。〔日経QUICKニュース（NQN）〕,ロンドン株式相場,ロンドン株、続落で始まる　ウクライナ情勢への警戒で,https://www.nikkei.com/article/DGXZASB2IILB2_X10C22A2000000/
02/17/2022,◇鹿島道路吉田　英信氏（よしだ・ひでのぶ）80年（昭55年）京大院修了、鹿島入社。17年執行役員、19年常務執行役員。兵庫県出身。66歳（4月1日就任。吉弘英光社長は鹿島常務執行役員に）,,鹿島道路社長に吉田氏,https://www.nikkei.com/article/DGXZQODZ00025_X10C22A2000000/
02/17/2022,ソフトバンクグループ（SBG）とソフトバンクは17日、3回目の新型コロナウイルスワクチンの職域接種を始めたと発表した。まずSBG本社（東京・港）で実施し、9都道府県10会場に広げる。グループの従業員や家族、取引先の従業員など11万人規模を対象にする。SBGは3回目の職域接種を2月下旬に開始予定だったが、政府の前倒し要請に応じた。接種対象は当初の9万人規模から増やした。政府が1日100万回のワクチン接種目標を掲げていることを踏まえ、1日で最大1000回接種できるようにする。堀内詔子ワクチン相は17日午後、SBG本社を訪れ、孫正義会長兼社長と職域接種の様子を視察した。孫会長は「ワクチン接種でできる抗体は3〜4カ月で減ってしまう。希望する人がいつでもワクチンを接種できる環境をつくることが、日本の出口戦略にとって重要」と述べ、3回目接種の意義を訴えた。,新型コロナ,ソフトバンクグループが3回目の職域接種　11万人に拡大,https://www.nikkei.com/article/DGXZQOUC179C80X10C22A2000000/
02/17/2022,政府は17日にまとめた2月の月例経済報告で、景気判断を「持ち直しの動きが続いているものの、一部に弱さがみられる」に引き下げた。引き下げは緊急事態宣言を発令していた2021年9月以来、5カ月ぶりだ。新型コロナウイルスの変異型「オミクロン型」の感染が広がり、個人消費の低迷を反映した。オミクロン型の感染拡大を受け、政府は東京や大阪を含む36都道府県に「まん延防止等重点措置」を適用。飲食店で営業時間の短縮が広がり、国内総生産（GDP）の半分以上を占める個人消費が冷え込んだ。個人消費の判断を1月の「持ち直している」から「持ち直しに足踏みがられる」に引き下げた。重点措置の影響で外出の自粛が広がり、商業施設や娯楽施設への人出の減少が1月後半から鮮明になっている。住宅建設も「弱含んでいる」と指摘した。21年12月の新設住宅着工戸数は年率換算の季節調整値で83.8万戸と前月比で1.5%減った。戸建て向けの土地が不足し、着工件数は弱含む。一方で、設備投資は「持ち直しの動きがみられる」と上方修正した。企業が業務のデジタル化を進め、ソフトウエア投資が増加傾向にある。先行きに関して「企業収益の改善などを背景に持ち直し傾向が続くと期待される」と分析した。原材料価格の高騰により国内の企業物価は「緩やかに上昇している」と説明した。内閣府は景気の先行きに関して、新型コロナの感染状況や供給制約、原材料価格の動向などの下振れリスクに「十分注意する必要がある」と指摘した。新型コロナ対策を巡っては感染リスクが高い学校や保育所、高齢者施設の対策を強化し、ワクチンの3回目接種を加速させる方針を示した。水際対策は「緩和に向けた検討を進めていく」と言及した。,経済,景気「一部に弱さ」、2月月例報告　5カ月ぶり下方修正,https://www.nikkei.com/article/DGXZQOUA1737M0X10C22A2000000/
02/17/2022,17日早朝の欧州国債市場でドイツの長期金利の指標となる10年債の利回りは小幅に低下（価格は上昇）している。英国時間7時30分時点は前日の18時時点より0.01%ほど低い0.26%台前半で推移している。ウクライナ情勢へ...,債券・短期概況,欧州国債早朝、ドイツ長期金利、小幅に低下　0.26%台前半,https://www.nikkei.com/article/DGXZASFL17I27_X10C22A2000000/
02/17/2022,岩手銀行といわぎん事業創造キャピタル、日本政策金融公庫盛岡支店は、新型コロナウイルス禍で需要減に悩む農業生産者ら向けにオンラインセミナーを21日に開く。北海道石狩市とJAいしかり、農産物の産直サイト運営業者が連携して需要開拓に取り組む事例を紹介するとともに、意見交換の場も設ける。セミナーでは、産直サイトを運営するポケットマルシェ（岩手県花巻市）の担当者が「ポケマルで、1次産業・食からはじめる関係人口づくり」をテーマに講演。その後、石狩市やJAいしかりの担当者を交えて消費者との接点づくりなどについて議論するとともに、オンラインで参加している視聴者と意見交換する。生産者やJA職員のほか、自治体職員がセミナーの対象。参加費は無料で定員100人。いわぎん事業創造キャピタルに事前に申し込む。,地域金融,岩手銀行など、コロナ禍に悩む農家ら向けセミナー,https://www.nikkei.com/article/DGXZQOCC1761I0X10C22A2000000/
02/17/2022,17日の東京外国為替市場で円相場は反発した。17時時点は1ドル=115円27～28銭と、前日の同時点に比べ37銭の円高・ドル安だった。16日に発表された1月の米連邦公開市場委員会（FOMC）の議事要旨が既に市場で織り込み済みの内容が大半で、新たな材料に乏しいと受け止められた。米長期金利が一時低下するなど落ち着いた動きをみせ、日米金利差の縮小から円買い・ドル売りが進んだ。午後にはロシアの国営通信社が「親ロシア派武装勢力が実効支配する地域で、ウクライナ軍が砲弾と手りゅう弾を発射した」との報道が流れた。ウクライナ情勢を巡る警戒感が高まり、相対的に「低リスク通貨」とされる円に買いが入った。その後は「ウクライナ政府軍は（東部親ロシア勢力から）攻撃を受けたが反撃していない」との報道もあり、円買いの勢いが弱まった。9～17時の円の高値は115円12銭近辺、安値は115円53銭近辺で、値幅は41銭程度だった。円は対ユーロでも反発した。17時時点は1ユーロ=131円17～19銭と、前日の17時時点に比べ37銭安の円高・ユーロ安だった。ユーロは対ドルで続伸した。17時時点は1ユーロ=1.1379～80ドルと、同0.0004ドルのユーロ高・ドル安だった。〔日経QUICKニュース（NQN）〕,為替概況,外為17時　円、反発　115円台前半　ウクライナ情勢を警戒,https://www.nikkei.com/article/DGXZASS0IMF06_X10C22A2000000/
02/17/2022,「ジャッジがどこを見ていたのか説明を聞くべきだと思う」。金メダル獲得から一夜が明けた記者会見で、採点に一石を投じたスノーボード男子ハーフパイプの平野歩夢（TOKIOインカラミ）の言葉が心に刺さった。「作品」でものをいう職人気質で、普段はあれこれ持論を語らない人だけに、一言一言が重く響いた。トリプルコーク1440（斜め軸の縦3回転、横4回転）を入れたルーティン（技の構成）を決めた決勝2回目で不可解...,スポーツ,平野歩夢の訴え　かっこよさにも明確な尺度を,https://www.nikkei.com/article/DGXZQODH168880W2A210C2000000/
02/17/2022,【北京=鱸正人】北京冬季五輪第14日の17日、カーリング女子の日本（ロコ・ソラーレ）は1次リーグ最終戦でスイスと対戦し、4-8で敗れたが、他チームの勝敗が絡んで18日の準決勝に進出した...,北京五輪,カーリング女子日本、4強入り　メダルかけスイスと再戦,https://www.nikkei.com/article/DGXZQODH178FY0X10C22A2000000/
02/17/2022,【シンガポール=谷繭子】東南アジア諸国連合（ASEAN）に対する日本の影響力への評価が低下している。シンガポールのシンクタンク、ISEASユソフ・イシャク研究所の調査によると、ASEANへの経済的影響力が最も高い国・地域について「日本」と答えた人が全体の2.6%と、前年の4.1%から下落した。政治・戦略的影響力でも1.4%と、同3.5%から下がった。同調査はISEASが2019年から毎年発表している。今回はASEAN10カ国の政治家や研究者、企業家、メディア関係者など1677人に地政学問題について聞いた。「信頼できる国」のランキングでは日本が21年同様、首位だった。ただ日本を選んだ人の割合は54.2%と、前年より14ポイント下落。ISEASのジョアン・リン氏は日本の影響力が低下した背景として「米中対立で、東南アジアの人の意識で両国の重要度が高まった」と説明した。経済的影響力では「中国が最大」との回答が前年比0.8ポイント増の76.7%と圧倒的。次点は米国の9.8%で、同3.2ポイント増えた。政治・戦略的影響力でもトップは中国で、同4.6ポイント増の54.4%。2番目の米国は29.7%で、同1.2ポイント増えた。米国の東南アジアへの関与が「増えた」との回答は45.8%と、前年より24.8ポイント低下した。21年にはバイデン政権に代わり、東南アジアではトランプ前政権よりも同地域を重視する姿勢に転換するとの期待が高まった。ただ現段階では「特に経済面の成果につながっていない」（リン氏）ことが低下の要因とみられる。,東南アジア,日本のASEANへの影響力、政・経で評価下がる,https://www.nikkei.com/article/DGXZQOGM16EAY0W2A210C2000000/
02/17/2022,【NQN香港=川上宗馬】17日の香港株式相場は続伸した。ハンセン指数の終値は前日比73.87ポイント（0.29%）高の2万4792.77だった。16日に公表された1月の米連邦公開市場委員会（FOMC）議事要旨を受け、米金融引き締め加速に対する過度な警戒感が和らいだ。もっとも香港域内の新型コロナウイルスの感染拡大が投資家心理の重荷となり、指数の上値を抑えた。ウクライナ情勢を巡る警戒感からアジア時間...,アジア株概況,香港株大引け　続伸、米金融引き締めへの懸念後退　コロナ感染が重荷,https://www.nikkei.com/article/DGXZASS0IHK03_X10C22A2000000/
02/17/2022,JR東海は17日、静岡支社（静岡市）に新たに副支社長を3月1日付で配置すると発表した。工事が膠着するリニア中央新幹線への理解促進に向けて、新たに配置する担当課長とともに地域での対話を増やす。金子慎社長は17日の記者会見で「昨年末の有識者会議の中間報告で地域の皆様と双方向のコミュニケーションをはかりながら、様々な懸念を払拭していくことが重要とされた。（静岡県が懸念する）水資源については工事の開始前から完了した後も息の長い対応が必要だ」と述べた。副支社長らの具体的な業務内容について金子氏は「地域の中に入って柔軟に対応していく」と話した。2021年12月に発表した国の有識者会議の中間報告では、大井川の中下流域の水量変化について工事で発生する水をすべて川に戻すことで「河川流量は維持される」と結論づけた。,サービス・食品,JR東海、静岡支社に副支社長配置　リニア理解求める,https://www.nikkei.com/article/DGXZQOFD178RI0X10C22A2000000/
02/17/2022,【イスタンブール=木寺もも子】トルコがインフレに伴う家計負担の軽減に乗り出している。食料品の付加価値税を引き下げたほか、小売業者にさらなる値下げを促す。急激な物価上昇から国内ではデモが起きており、政府はインフレの長期化に危機感を募らせる。ただ対策として一般的な利上げには否定的で、効果は見通せない「少なくとも14%の値下げが行われると期待している」。エルドアン大統領は16日の演説で食料品価格についてこう述べた。政府は対策として14日に主要な食料品の付加価値税を8%から1%に下げた。その後、当局は大手スーパーに立ち入り、値札をみて価格が引き下がったかどうかをチェックしている。政府はこれとは別に、小売業者にさらに7%の値下げを要求している。トルコメディアが報じたエルドアン氏の発言によると、ネバーティ財務相が大手小売りチェーンのトップに電話をかけるなどして「圧力をかけている」という。このほか、欲しい商品を最安値で扱う店舗を検索できるスマートフォン用アプリを政府自ら開発し、近く導入する計画。一部世帯では電気代の軽減も検討している。矢継ぎ早に対策を打ち出す背景には、1月の消費者物価指数（CPI）上昇率が前年同月比で49%に上る急激なインフレへの懸念がある。電気料金は1月に前月までの約2倍に跳ね上がり、ガソリン価格は21年12月初めと比べて約6割高くなった。国民は不満を募らせる。最大都市イスタンブールでは13日、女性ら数十人が鍋を片手に抗議デモ行った。複数のネット系宅配サービス大手の配達員らは1月末以降、賃上げを求めて断続的にデモを繰り広げている。いずれも小規模だが、長期化すれば国内の不安定要因になりかねない。一方で、エルドアン氏は利上げには否定的だ。それどころか、インフレ抑制には利下げが必要だと、定説とは逆の主張を繰り返す。中央銀行は21年9～12月に主要政策金利の1週間物レポ金利を計5%引き下げ、年14%とした。このため通貨リラが急落し、インフレが加速したが、利上げの可能性はなおきっぱりと否定する。利上げ以外でのインフレ対策に、どこまで効果があるかは不透明な面もある。卸売物価指数（PPI）上昇率は94%にも及んでおり、小売業者からは「好きで値上げしているわけではない」との声が漏れる。,中東・アフリカ,トルコ、インフレ長期化に危機感　家計負担軽減急ぐ,https://www.nikkei.com/article/DGXZQOGR16BBA0W2A210C2000000/
02/17/2022,日本ハムのドラフト1位ルーキー達（奈良・天理高）が新庄監督に投球練習を見てもらった。17日に沖縄県名護市で予定されたDeNAとの2軍の練習試合が雨で中止となり、ブルペンで変化球を交えて57球を投げた。新庄監督が背後から見守ったことに気づかないほど集中し「『ナイスボール』と言われて『え？』と思って見たら、いた」と照れ笑いした。受けた捕手の石川亮にカーブを高く評価されたという。「上沢さんに教えてもらったカーブが感覚的に合っていた」。新型コロナウイルス感染から復帰した上沢と伊藤が同じ2軍で調整しており「去年10勝以上の投手が間近で練習している。自分から吸収したい」と積極的に教えを請い、習得に励んでいる。恵まれた環境を生かし着実にプロとして成長している。「一日ずつやるべきことをやっていけたら」と気を引き締めた。〔共同〕,スポーツ,新庄監督、2軍を視察　ドラ1達が投球披露,https://www.nikkei.com/article/DGXZQOKC178SE0X10C22A2000000/
02/17/2022,Jリーグは18日に明治安田J1の川崎―FC東京（午後7時・川崎市等々力陸上競技場）で30年目のシーズンが開幕する。川崎は2007～09年の鹿島に続く史上2度目のリーグ3連覇を目指し、FC東京はアルベル新監督の下で強敵に挑む。17日は両チームとも非公開で調整した。アルベル監督はオンライン取材で「われわれのスタイルを貫くと同時に勝負にもこだわる」と気合十分に話し、川崎の鬼木監督は16日に「開幕戦は大きなウエートを占める。強い気持ちで挑みたい」と意気込みを示した。18チームで争う今季は下位2チームがJ2へ降格し、16位はプレーオフに回る。ワールドカップ（W杯）カタール大会（11月21日開幕）のため例年より約1カ月早い11月5日に最終節を迎える。19日に名古屋―神戸、横浜M-C大阪、京都―浦和など8試合を実施。J2は19日、J3は3月12日に始まる。〔共同〕,スポーツ,J1、川崎で18日開幕　30年目のシーズン,https://www.nikkei.com/article/DGXZQOKC178OI0X10C22A2000000/
02/17/2022,山形県は21日、国の事業復活支援金の申請をサポートする窓口を開設する。平日の9～17時に村山、最上、置賜、庄内の各総合支庁で受け付け、毎週火・金曜日は行政書士も同席する。申請に必要なID取得からオンライン申請まで一貫して支援する。同支援金は新型コロナ...,東北,山形県、事業復活支援金の申請サポート窓口開設,https://www.nikkei.com/article/DGXZQOCC1749X0X10C22A2000000/
02/17/2022,大阪府は17日、新型コロナウイルスの新たな感染者を1万3912人確認したと発表した。新たに54人の死亡が判明した。,社会・調査,大阪府、17日の新規感染1万3912人　54人死亡,https://www.nikkei.com/article/DGXZQOUF178ZM0X10C22A2000000/
