03/23/2022,【NQNニューヨーク=古江敦子】22日のニューヨーク外国為替市場で円相場は大幅に3日続落し、前日比1円30銭の円安・ドル高となる1ドル=120円75～85銭で取引を終えた。米連邦準備理事会（FRB）の利上げ加速と、それに伴う日米金利差の拡大を織り込む円売り・ドル買いが強まった。パウエルFRB議長が前日、物価安定に向けて0.25%を上回る利上げの可能性に言及し、通常の倍の0.5%の利上げを見込む円売り・ドル買いが続いた。米長期金利が一時前日比0.10%高い2.39%と2019年5月以来の高水準をつけ、一段の円売りにつながった。ニューヨーク市場の円の安値は120円90銭、高値は120円39銭だった。欧州市場では一時121円03銭と2016年2月以来ほぼ6年ぶりの円安水準を付けていた。円は対ユーロで反落し、前日比1円65銭の円安・ユーロ高となる1ユーロ=133円20～30銭で取引を終えた。一時は133円32銭と21年10月以来の円安・ユーロ高水準を付けた。ドルに対する円売りが、円の対ユーロ相場に波及した。ユーロは対ドルで3営業日ぶりに反発し、前日比0.0015ドル高い1ユーロ=1.1025～35ドルで終えた。欧米株式相場が上昇し、リスク選好のユーロ買い・ドル売りが優勢となった。ただ、米長期金利の上昇で欧米金利差の拡大を見込むユーロ売りも出て、上値は重かった。この日の高値は1.1045ドル、安値は1.1000ドルだった。,為替概況,NY円、続落　1ドル=120円75～85銭　米利上げ加速を見込み円売り,https://www.nikkei.com/article/DGXZASM7IAA05_T20C22A3000000/
03/23/2022,【シカゴ支局】22日の日経平均先物は続伸した。6月物は前日比390円高の2万7450円で引け、22日の大取終値を380円上回った。22日の米株式市場で長期金利の上昇を手がかりに金融銘柄が買われたほか、ハイテク株も上げ、日経平均先物に買いが波及した。円安進行も支援材料だった。,国内株概況,シカゴ日本株先物概況・22日,https://www.nikkei.com/article/DGXZASH2ICE01_T20C22A3000000/
03/23/2022,【NQNニューヨーク=古江敦子】日本時間23日早朝の大阪取引所の夜間取引で日経平均先物は上昇した...,国内株概況,日経平均先物、夜間取引で上昇　370円高の2万7440円で終了,https://www.nikkei.com/article/DGXZASFL23H0D_T20C22A3000000/
03/23/2022,【ワシントン=長沼亜紀】国際通貨基金（IMF）のゲオルギエバ専務理事は22日、ロシアによるウクライナ侵攻で世界経済の成長が鈍化するとの見通しを示した。2022年の実質成長率は「プラス圏にとどまるものの、（1月予測の）4.4%から一段と鈍くなる」と述べた。米メディア主催のオンラインイベントで発言した。世界経済は新型コロナウイルス危機からの回復途上にあり、供給制約の緩和などでインフレ圧力が低下しようとしていた矢先に「真逆のことが起きた」と指摘。ウクライナ侵攻はコロナ危機からの回復が早かった米国などに比べ、危機から抜け出ていない新興国にとって極めて打撃が大きいと述べた。世界の中央銀行は金融引き締めに向かっている。債務負担の重い新興国は成長鈍化とインフレ悪化に金融引き締めが加わり、景気後退が懸念されるとした。同席したIMFのゴピナート筆頭副専務理事は、各国によるロシアへの経済制裁を「十分正当化できるものだ」と支持した。その上で「ロシア経済に深刻な影響をもたらす」との見方を示した。ゴピナート氏は、ロシア中銀の資産凍結といった経済制裁が基軸通貨としてのドルにもたらす影響について「差し迫った（ドルの）崩壊ということはありえない」と強調。ただ、すでに起きているグローバルな決済システムの断片化が戦争によってさらに進むとし、特定の準備通貨の保有額を再考する国もでてくるだろうと指摘した。ロシアが制裁回避の手段として暗号資産（仮想通貨）を利用する可能性について「現時点で明確に全容をつかんでいないが監視している」と述べた。,北米,ウクライナ侵攻で「世界経済の成長鈍化」　IMF専務理事,https://www.nikkei.com/article/DGXZQOGN22DBD0S2A320C2000000/
03/23/2022,【パリ=白石透冴】ウクライナ軍は22日、首都キエフから西に約65キロメートルの地点にある地方都市マカリフをロシア軍から奪回したと発表した。ロシア軍は同都市などを拠点にキエフを包囲する考えとみられるが、補給などが計画通りに進んでいない可能性がある。一方、ゼレンスキー大統領は同日公開したビデオ動画で南部の港湾都市マリウポリが「灰になってしまった」と説明し、民間施設を攻撃するロシア軍を非難した。ネット上ではウクライナ軍兵士がマカリフとみられる地域の建物で同国国旗を掲げる様子が出回っている。ただ現地ではまだロシア軍による砲撃が続いており、完全にウクライナ軍が掌握したわけではないとみられる。【関連記事】マリウポリでは包囲するロシア軍が2週間以上に渡って砲撃を続けており、食料や医薬品の不足が深刻になっている。ロシア側は降伏を受け入れるよう求めたが、ウクライナ側は拒否したという。ゼレンスキー氏は国民に「できることは全てやって、国を守り、人々を守ってほしい」と語り、抗戦を呼びかけた。ベレシチューク副首相の22日の説明によると、同都市には待避を希望する住民が約10万人取り残されている。砲撃だけではなく、市街戦も続いているとの情報がある。戦局が膠着する中、ロシアによる大量破壊兵器の使用への警戒感もくすぶる。ロイター通信がタス通信の情報として報じたところによると、ロシアのペスコフ大統領報道官は22日、ロシアの存続が脅かされた場合には核兵器を使うと語った。一方、米国防総省高官は22日、ロシア軍はウクライナへの侵攻開始から兵力を1割以上失ったとの分析結果を示した。国連難民高等弁務官事務所（UNHCR）の統計では、ロシア軍による侵攻でウクライナを離れた難民は21日時点で355万人となった。約6割に当たる211万人がポーランドに渡り、ルーマニアに54万人、モルドバに36万人などとなっている。侵攻が長引けば大幅に増える恐れがある。ロイター通信によると、ウクライナ政府は22日、2022年の同国内の耕作面積が700万ヘクタールになるとの見通しを明らかにした。侵攻前は1500万ヘクタールを予定していたという。ロシアの侵攻で生産や輸出が滞るとの見方から、小麦などの価格上昇につながっている。エジプトがパンの小売価格を一部統制するなど、既に世界に波紋が広がっている。仏エネルギー大手トタルエナジーズは22日、ロシアからの原油や原油関連製品の購入を22年末までにやめると発表した。従来は新規投資を停止するとだけ表明していたが、批判の高まりなどを受けて踏み込んだ。ロシア国内の複数のエネルギー関連企業に出資しているが「現状ではロシア国外の買い手を見つけられない」などとして売却する考えは否定した。,ウクライナ侵攻,ウクライナ「キエフ西部を奪回」　難民は355万人超に,https://www.nikkei.com/article/DGXZQOGR22DGG0S2A320C2000000/
03/23/2022,【ニューヨーク=清水石珠実】米新興ネットメディア「バズフィード」の報道部門、バズフィード・ニュースのマーク・ シューフス編集長が同社を退社することが22日に分かった。編集部員を中心に大幅な人員削減も実施する。赤字傾向が続いていた報道部門の財務体質の改善が狙いだが、競争力の低下につながる懸念もある。シューフス氏と同時に、編集幹部2人も退社する。シューフス氏は退社を発表する社員向けの電子メールのなかで「バズフィード・ニュースは黒字化を目指し、人員削減をする必要がある」と述べたという。別の新興ネットメディア「アクシオス」によると、バズフィードは編集部員約100人の約3分の1を対象に、早期退職を募集している。バズフィードの広報担当者は、最終的な削減数は、「現在、編集部門の労働組合と交渉中」とした。米経済局CNBCは22日、一部の投資家がジョナ・ペレッティ最高経営責任者（CEO）に対して、報道部門の閉鎖を求めていると報じた。年間1000万ドルの赤字（約12億円の赤字）で、ネット広告や通販事業の重荷になっているためという。バズフィードは2021年12月、特別買収目的会社（SPAC）との合併を通じて上場している。バズフィード・ニュースは昨年、優れた報道におくるピュリツァー賞を初めて受賞した。衛星写真や3D（3次元）モデルなどを駆使して中国のウイグル族の人権問題をとりあげていた。,北米,米バズフィード、ニュース部門トップ退任　人員削減も,https://www.nikkei.com/article/DGXZQOGN22DC50S2A320C2000000/
03/23/2022,【NQNニューヨーク=戸部実華】22日の米株式市場でダウ工業株30種平均は反発し、前日比254ドル47セント（0.7%）高の3万4807ドル46セントで終えた。利上げ加速の観測から米長期金利が上昇し、金融株の追い風になった。前日夕に市場予想を上回る決算を発表したスポーツ用品のナイキが買われ、他の消費関連銘柄にも買いが波及した。長期金利は一時前日比0.10%高い2.39%と、2019年5月以来の高水準を付けた。米連邦準備理事会（FRB）のパウエル議長が前日、通常の倍の0.5%の利上げの可能性を示唆し、インフレ抑制へ金融引き締めを積極的に進めるとの見方が強まった。金利が上昇すれば利ざや改善が見込める金融株が買われ、JPモルガン・チェースは2%高で終えた。決算で売上高や1株利益が市場予想を上回ったナイキは2%上げた。ナイキの決算を受け「高インフレが続く環境でも個人消費は堅調」（ボケ・キャピタル・パートナーズのキム・フォレスト氏）との見方が出た。クレジットカードのアメリカン・エキスプレスや映画・娯楽のウォルト・ディズニーなど、他の消費関連株も買われた。小型機「737MAX」の増産が好感された航空機のボーイングは3%高で終えた。長期金利上昇でも高PER（株価収益率）銘柄への買いは衰えず、顧客情報管理のセールスフォース・ドットコムやスマートフォンのアップルが高い。半面、米原油先物相場が反落し、石油のシェブロンが安い。資源相場に連動しやすい建機のキャタピラーも下げた。ハイテク株比率が高いナスダック総合株価指数も反発し、前日比270.357ポイント（2.0%）高の1万4108.817で終えた。検索サイトのアルファベットやネット通販のアマゾン・ドット・コムが高い。電気自動車のテスラは8%高となった。,,NYダウ反発254ドル高　金融株や消費関連株に買い,https://www.nikkei.com/article/DGXZQOGN00001_T20C22A3000000/
