04/16/2022,【ロンドン=共同】北欧フィンランドのトゥップライネン欧州問題相は15日、英スカイニューズ・テレビに出演し、ロシアによるウクライナ侵攻は「われわれ全てに対する警鐘だ」と強調し、フィンランドの北大西洋条約機構（NATO）加盟申請の可能性は「高い」と明言した。ロシアによる核兵器を含めた軍備強化の警告には反発した。ロシアと約1300キロの国境を接するフィンランドではウクライナ侵攻後、NATO加盟支持の世論が急拡大した。マリン首相は13日、加盟に意欲を表明し「数週間以内」に申請の是非を決める方針を明らかにした。トゥップライネン氏の発言はさらに踏み込んだ形。隣国スウェーデンも加盟に前向きで、ロシア前大統領のメドベージェフ安全保障会議副議長は両国が加盟すれば国境防衛の強化が必要と警告。バルト海周辺の「非核化はあり得ない」と核配備の可能性も示唆した。フィンランドとスウェーデンでは、申請後から正式加盟の間にロシアの攻撃を受けるとの懸念がある。トゥップライネン氏は申請の正式決定はまだだとした上で、NATOによる可能な限り迅速な手続きが必要だとの考えを示した。この北欧2カ国は伝統的に軍事的中立を維持してきたが、最近の世論調査ではNATO加盟支持が過半数を占めた。トゥップライネン氏は「状況は変わった。プーチン大統領のロシアはもう信用できない」と語った。【関連記事】,ヨーロッパ,フィンランドのNATO加盟申請「可能性高い」欧州問題相,https://www.nikkei.com/article/DGXZQOCB160M30W2A410C2000000/
04/16/2022,【アーリントン=共同】米大リーグ、エンゼルスの大谷翔平（27）が15日、敵地アーリントンで行われたレンジャーズ戦に「1番・指名打者」で出場し、一回に初球を捉えて今季1号ソロ本塁打を放った。シーズン開始から8試合目での初本塁打はメジャー5年目で最も遅く、待望の一発が生まれた。昨季は日本選手のシーズン最多記録となる46本塁打をマーク。今季のオープン戦では3本塁打を放ったが、開幕から1番で出場を続ける打撃は調子がいまひとつ上がっていなかった。,スポーツ,大谷翔平、今季1号の先頭打者本塁打　8戦目で待望の一発,https://www.nikkei.com/article/DGXZQOKC160N20W2A410C2000000/
04/16/2022,サッカーのポルトガル1部リーグで15日、サンタクララの田川亨介はアウェーのアロウカ戦に先発し、0-1の後半27分に同点ゴールを決めた。2試合連続の今季3点目。同28分に退き、試合は1-1で引き分けた。チームメートの守田英正は後半21分からプレーした。〔共同〕,スポーツ,田川亨介、2試合連続ゴール　ポルトガル1部,https://www.nikkei.com/article/DGXZQOKC160G20W2A410C2000000/
04/16/2022,ラグビーのフランス1部リーグ、クレルモンの関係者は15日、右肩を負傷した松島幸太朗が検査を受け、全治6～8週間の見込みであることを明らかにした。手術は不要とみられている。松島は、10日に行われたレスター（イングランド）との欧州チャンピオンズカップの決勝トーナメント1回戦第1戦で激しいタックルを受けてしばらく動けず、前半途中で退いていた。〔共同〕,スポーツ,松島幸太朗、右肩負傷で全治6～8週間　ラグビー仏1部,https://www.nikkei.com/article/DGXZQOKC160FT0W2A410C2000000/
04/16/2022,サッカーのアジア・チャンピオンズリーグ（ACL）は15日、マレーシアのジョホールバルなどで東地区の1次リーグが始まり、初優勝を狙うI組の川崎は蔚山（韓国）と1-1で引き分けた。3度目制覇を目指すF組の浦和はライオン・シティー（シンガポール）に4-1で快勝した。川崎は試合終了間際、車屋の得点で追い付いた。浦和は前半にユンカーが先制し、江坂らが加点した。F組のもう1試合は大邱（韓国）が山東（中国）に7-0で大勝。日本勢は横浜Mが16日、神戸は19日に初戦を戦う。東地区の1次リーグは5組に分かれて争われる。各組1位と2位のうち成績上位3チームが決勝トーナメントに進む。〔共同〕,スポーツ,浦和が4得点で快勝　サッカーACL、川崎は引き分け,https://www.nikkei.com/article/DGXZQOKC15EIH0V10C22A4000000/
04/16/2022,【NQNニューヨーク=川上純平】15日のニューヨーク外国為替市場で円相場は3日続落し、前日比65銭円安・ドル高の1ドル=126円50～60銭で取引を終えた。米連邦準備理事会（FRB）が積極的に金融引き締めを続けるとの見方が根強い一方、日銀は金利を低位に抑える政策運営を続けるとみられている。日米中銀の金融政策の方向性の違いを意識する円売り・ドル買いが続いた。15日の東京市場で円は一時126円70銭近辺まで下落し、2002年5月以来の安値を付けた。ニューヨーク市場では円売り・ドル買いの流れが続いた一方、利益確定の円買い・ドル売りも入った。15日はイースター（復活祭）の祝日で市場参加者が限られ、薄商いだった。円の安値は126円56銭、高値は126円31銭だった。円は対ユーロで反落し、前日比20銭円安・ユーロ高の1ユーロ=136円55～65銭で取引を終えた。ユーロは対ドルで続落し、前日比0.0020ドルユーロ安・ドル高の1ユーロ=1.0805～15ドルで取引を終えた。欧州中央銀行（ECB）が金融政策の正常化を急がないとの見方からユーロ売りが引き続き優勢となった。ユーロの安値は1.0803ドル、高値は1.0819ドルだった。,為替概況,NY円、続落　1ドル=126円50～60銭　日米中銀の政策の差を意識,https://www.nikkei.com/article/DGXZASM7IAA05_W2A410C2000000/
04/16/2022,【パリ=白石透冴】ロシアが侵攻するウクライナから逃れた人が15日、500万人を超えた。東部・南部を中心に住まいを追われる人が後を絶たない。ロシアは同日、南東部の要衝マリウポリの製鉄所を制圧したと主張し、首都キーウ（キエフ）近郊への攻撃を再開した。戦闘は激しさを増している。【関連記事】国連難民高等弁務官事務所（UNHCR）の集計によると、同日までに約480万人が難民としてウクライナを逃れた。避難先はポーランド、ルーマニアなどが多い。仏AFP通信によると、これとは別に国際移住機関（IOM）は外国人約21万5千人が同国から逃れたと明らかにしている。多数の難民を生んでいるのが、ロシア軍が包囲しているマリウポリだ。ロシア国防省はウクライナ軍が抵抗を続けていた同市のイリイチ製鉄所を制圧したと主張した。製鉄所はウクライナ軍などが拠点として使っていた。マリウポリは陥落間近との見方もあるが、もう1つの製鉄所などでは依然ウクライナ軍が立てこもるなどして戦っているようだ。ウクライナ国防省は15日、ロシア軍による包囲を破るための作戦が続いていると明らかにした。初めてロシア軍が長距離爆撃機を使ってマリウポリを攻撃してきたとも発表した。兵数や装備で劣るウクライナ軍が戦闘を続けられる理由の1つに、米国など欧米諸国による武器の供与がある。ロシアはいらだっているとみられ、米ワシントン・ポストは15日、供与を続ければ「予測できない結果」をもたらすとしてロシア政府が米国政府に警告したと報じた。ロシア軍がミサイル攻撃を再開したキーウ近郊では、市民への甚大な被害が明らかになっている。AP通信は15日、地元警察の情報としてキーウ近郊で900人以上の遺体が見つかったと報じた。ほとんどの遺体に銃弾を受けた傷があり、ロシア軍に処刑された疑いがある。うちブチャでは手を後ろに縛られるなどして殺された遺体が多数見つかった。欧州連合（EU）とロシアの外交的な緊張はさらに高まっている。ロシア外務省は15日、EUの駐ロシア代表部の職員18人を追放したと明らかにした。EUが4月上旬にロシア職員19人をEU本部があるベルギーから追放したことの報復措置とみられる。,ヨーロッパ,ウクライナ脱出500万人超　ロシア、キーウ近郊に再攻撃,https://www.nikkei.com/article/DGXZQOGR15EXW0V10C22A4000000/
