11/19/2021,政府は19日の臨時閣議で、財政支出が過去最大の55.7兆円となる経済対策を決めた。岸田文雄首相は日本経済新聞などのインタビューで、赤字国債発行も含めて財源を確保すると説明した。未来の成長を呼び込む「賢い支出」とは言いがたい項目が目立ち、目標とする「成長と分配の好循環」につなげられるかは見通せない。民間資金も入れた事業規模は78.9兆円と経済対策としては過去2番目に膨らんだ。内訳をみると、分配を重...,新型コロナ,経済対策、見えぬ「賢い支出」　最大の55兆円,https://www.nikkei.com/article/DGXZQOUA18B0B0Y1A111C2000000/
11/19/2021,政府が19日閣議決定した経済対策は国費ベースで43.7兆円に膨らみ、赤字国債の追加発行が避けられない。中長期的な経済成長につながる戦略投資に乏しい内容で、低成長と債務拡大の悪循環から抜け出せない恐れもある。賢い支出の追求がおろそかになればツケは将来世代にのしかかる。国費のうち補正予算は一般会計ベースで31.6兆円ある。補正以外の部分は2020年度予算からの繰越金や22年度当初予算に積む新型コロナ...,新型コロナ,経済対策、赤字国債増発でも低成長の悪循環に懸念,https://www.nikkei.com/article/DGXZQOUA198SJ0Z11C21A1000000/
11/19/2021,一度は相手に軍配が上がりながらも取り直しで命拾いした正代だが、結果的に恥の上塗りとなってしまった。三役経験もある実力者・隆の勝が相手とはいえ、平幕に2度続けて圧倒されては大関の名が泣くというものだ。最初の相撲は立ち合いから圧力を受けて真っすぐ後退。「さばこうという感覚が少しあったのかな。前に踏み込めていなかった」。その反省に立って馬力をぶつけるかと思いきや、取り直しの一番も「どうやっていこうかと...,スポーツ,苦悩の正代、馬力そぐ「迷い」　ご当所大関が早くも3敗,https://www.nikkei.com/article/DGXZQODH19AF80Z11C21A1000000/
11/19/2021,新型コロナウイルスの飲み薬タイプの治療薬を調達する動きが先進国で加速している。米メルクや米ファイザーが開発した治療薬を巡り、米国や英国、日本などが薬の承認前にもかかわらず必要量を押さえにかかる。アフリカなどの低所得国は出遅れる。ワクチンの供給格差を繰り返さないためにも、公平な分配に向けた国際的な議論を本格化する時だ。10日、後藤茂之厚生労働相はメルクが開発中の飲み薬タイプの治療薬「モルヌピラビル...,新型コロナ,コロナ薬確保に国際格差　米英日、承認前に囲い込み,https://www.nikkei.com/article/DGXZQOUC11F3R0R11C21A1000000/
11/19/2021,外食大手が郊外への出店に軸足を置く。レインズインターナショナルは焼肉の「牛角」で郊外向けの新業態で出店を進める。ラーメン店「日高屋」を運営するハイデイ日高は2022年2月期の新規出店のうち郊外の比率が過去最高になる見込み。新型コロナウイルス禍で都市部の需要が鈍いなか、家族連れ需要が見込める郊外店に軸足を置く動きが広がる。レインズインターナショナルは10月に展開する牛角で2つの新業態を立ち上げた。1つは国道沿...,小売り・外食,外食大手が郊外に軸足　牛角は新業態、都市部の需要鈍く,https://www.nikkei.com/article/DGXZQOUC29BES0Z21C21A0000000/
11/19/2021,立憲民主党の代表選が19日、告示された。逢坂誠二、小川淳也、泉健太、西村智奈美の4氏が立候補を届け出た。30日の投開票に向け、党勢の回復に向けた具体策や共産党との選挙協力のあり方を巡り論戦する。立民は先の衆院選で共産党などと小選挙区の7割で候補者を一本化した。比例票がふるわず、公示前に比べ議席数を減らす敗北となった。枝野幸男氏が責任を取って代表を辞任した。代表選は2020年の結党以来初めて党員らが参加する「フルスペック」型で実施する。得票はポイントに換算して競う。国会議員140人に1人2ポイント、国政選挙の公認候補予定者6人に1人1ポイントの計286ポイントを振り分ける。地方議員1200人程度と10万人超の党員・協力党員にはそれぞれ143ポイントを付与し、票数に基づいて各候補に割り振る。計572ポイントの過半数を得た候補がいなければ国会議員と候補予定者、都道府県連代議員による決選投票となる。決選投票は国会議員のポイントの割合が85%程度になる。都道府県連の代表者が残りの15%程度を持つ。2位以下の候補による連合など、陣営間の駆け引きも選挙結果を左右する。,政治,立民代表選、4氏の争い　30日投開票,https://www.nikkei.com/article/DGXZQOUA194LN0Z11C21A1000000/
11/19/2021,防衛省は19日、中国海軍の測量艦が17～18日にかけて鹿児島県周辺の海域を航行するのを確認したと発表した。「領海を航行したものと判断している」との見方を示した。海上自衛隊が警戒監視にあたった。防衛省によると、測量艦は鹿児島県・屋久島付近の接続水域から領海に向けて西進した。その後、同県・口永良部島付近の接続水域を西に向かって航行した。,政治,中国軍の測量艦「領海航行と判断」　防衛省,https://www.nikkei.com/article/DGXZQOUA19CX10Z11C21A1000000/
11/19/2021,厚生労働省は19日、新型コロナウイルス感染拡大に伴う雇用調整助成金の特例措置について、2022年1月から段階的に縮小すると発表した。1人あたり1万3500円とする日額上限を1～2月は1万1千円...,新型コロナ,雇調金特例、上限1万1000円に下げ　2022年1月,https://www.nikkei.com/article/DGXZQOUA19B5N0Z11C21A1000000/
11/19/2021,米大リーグでエンゼルスの大谷翔平がア・リーグ最優秀選手（MVP）に選ばれたことに、福岡国際センターで大相撲九州場所を開催中の角界からも19日には称賛の声が相次いだ。米大リーグの球場を実際に訪れたこともある日本相撲協会の八角理事長（元横綱北勝海）は「夢がある。野球のことは何も言えないけど、頑張ってほしい」と述べた。朝稽古後に米大リーグのテレビ中継を見ることもあるという。大谷と同学年の阿炎は「野球選手として素晴らしい方。同い年と思えないぐらいすごい」と驚いた様子。同じく27歳の隆の勝は「海外で活躍しているスーパースター。自分もいいところをまねして頑張りたい」と刺激を受け、大栄翔は「自分ももっと頑張らないといけない。体をフルに生かしてホームランを打っていることは自分も学べる面がある」と興味を抱いていた。〔共同〕,スポーツ,大谷MVPに角界も称賛　八角理事長「夢がある」,https://www.nikkei.com/article/DGXZQOKC19D0M0Z11C21A1000000/
