12/20/2021,太陽の異常活動「太陽フレア」をめぐって、総務省は企業や行政向けに新たに警報を発令する検討に入った。2022年度中の導入をめざす。世界で停電や通信障害など基幹インフラへの影響が出ているほか、自動運転車やドローンといった新しい技術への悪影響も指摘される。米欧や中国、ロシアなどが対策に乗り出しており、体制の整備を急ぐ。太陽フレアは、太陽の表面の異常爆発で発生した放射線などが地球に届く現象を指し、停電や...,経済,太陽フレアで警報、自動運転・ドローン事故防止　総務省,https://www.nikkei.com/article/DGXZQOUA145NE0U1A211C2000000/
12/20/2021,キリンホールディングス（HD）がミャンマーにおける国軍系企業との合弁解消で苦闘している。国軍系企業に持ち分を手放してもらうようシンガポールで国際仲裁に打って出たが、前途は険しい。国軍系企業は現地の裁判で先行している。国際仲裁は従来の事業リスクの回避策としては有効だったが、「人権」「環境」といった新たなリスクに対応するため、企業は意識改革や事前調査を強める必要がある。,渋谷 高弘,キリンのミャンマー合弁暗雲　従来型のリスク管理に限界　　,https://www.nikkei.com/article/DGXZQOGH083EO0Y1A201C2000000/
12/20/2021,日本経済新聞社は「日経アジアアワード」の第1回の受賞者を、シンガポールの食品テック企業「シオック・ミーツ」に決定した。日経アジアアワードは2021年に創設し、1996年から毎年表彰してきた「日経アジア賞」を衣替えした。アジア諸国・地域で始まり、自由で豊かな経済社会の実現を後押しする活動の担い手を表彰する。ビジネスや調査研究、技術開発、社会・芸術活動などの分野を対象に、国内外の推薦（他薦のみ）から、新規性や革新性に富む「アジア発のイノベーション」を選ぶ。副賞は500万円。シオック・ミーツはエビやカニなど甲殻類の培養肉開発を手掛けている。食糧問題や環境問題といった世界規模の課題をビジネスで解決することを目指している。2020年9月には東洋製缶グループホールディングスから出資を得た。甲殻類の培養肉開発を手掛けるシンガポールの食品テック企業、シオック・ミーツはシンガポール科学技術研究庁（ASTAR）で同僚だったサンディヤ・シュリラム氏（36）、リン・カーイー氏（34）の2人が2018年8月に創業した。少量の細胞から代替肉を生産できる培養は海洋資源を傷つけることなく、人口増加による食料需要の拡大に対応できる大きな可能性を秘めている。シンガポール西部ジュロン・ウエストの工業地区。食品テックのスタートアップを支援する施設に、小型の2リットルから最大200リットルまで幾つもの最新のバイオリアクター（生物反応槽）が並ぶ一角がある。白衣に身を包んだ若い研究者が培養肉の商品化に向けて、甲殻類の細胞の増殖に最適な条件を探る作業を繰り返す。11月22日に開業したばかりのシオック・ミーツの小型工場で連日、見られる光景だ。シオック・ミーツは18年8月、サンディヤ・シュリラム氏とリン・カーイー氏の2人の女性の幹細胞研究者が立ち上げた。当初は誰からも支援を得られず、離島のセントジョンズ島にある大学の海洋研究施設を利用するため、毎朝フェリーで通った。投資家にメールや直接の面談で資金協力を依頼した回数は5000回にも達した。苦難の日々から3年余り。「来年には商業生産用の工場を建設し、23年半ばには培養肉の販売を始める。おおむね計画通りだ」。最高経営責任者（CEO）のシュリラム氏は今、自信に満ちている。日米欧韓など世界各地の投資家から調達した資金は3000万ドル（約34億円）に上る。シオック・ミーツが手掛けるのは甲殻類の培養肉の開発だ。エビなどの細胞を取り出し、アミノ酸やたんぱく質などの栄養素が入った液体の中で4～6週間培養し、ミンチ状の肉を作り出す。高度な生物学の知識が必須であるほか、生物反応槽など高額の設備も必要となるために、参入する企業は多くない。特に甲殻類の培養に挑むスタートアップ企業は世界でも数えるほどだ。シオック・ミーツはそんな最先端分野で、エビやカニ、ロブスターの培養肉の開発にいち早く成功したフロントランナーだ。甲殻類を対象に選んだのは、アジアの置かれた環境と密接に結び付いている。エビはアジア料理に欠かせない食材だが、エビの養殖場を作るために、大量のマングローブ林が伐採されている。天然エビ漁では意図せず網にかかった別の魚介類は廃棄されるため、大量の水産資源が無駄になる。一方、人口の増加や所得の向上に伴い、アジアの食品消費額は19年の4兆ドルから、30年には8兆4000億ドルに倍増する見通しだ。「地球環境問題を抱えた水産業を技術の力で変革することは喫緊の課題だった」（シュリラム氏）。シンガポールのグレース・フー持続可能性・環境相も「シオック・ミーツの技術は多くの土地や水を使わず、二酸化炭素（CO2）も排出しないで培養肉を作り出す革新的な手法だ」と期待を寄せる。代替肉や代替魚介類の開発は、大豆やこんにゃくなど植物由来の原料を使う企業が商品化では先行している。培養よりも技術的に簡単なためで、米インポッシブル・フーズなどが代表格だ。ただ、シオック・ミーツは培養技術の方が、実際の肉や魚介類に限りなく近い味や栄養素が再現できる可能性が高いとして、将来的な市場拡大が期待できるとみている。試作の段階は超えた今、残る大きな課題は生産コストの引き下げだ。培養エビでは創業当初の1キログラム当たり1万ドルから、800～1000ドルまでコストは下がっている。とはいえ、天然のエビと遜色のない価格で販売するには少なくとも1キログラム当たり50ドルまでコストを下げる必要がある。シオック・ミーツは高コストの要因である培養用の栄養素の改良と、生産効率化によって22年半ばまでに50ドルを達成する計画を打ち出している。数千リットル級の大型の生物反応槽を備えた工場を造り、政府から販売の認可も得たうえで、23年半ばに飲食店に培養エビを供給するのが目標だ。培養エビを使ったギョーザやシューマイなどの冷凍食品もスーパーなどで販売する。23年時点の生産量は年間5～6トンと少量にとどまる見通しだが、シュリラム氏は「甲殻類だけでなく、肉や魚も含めた培養産業で世界のリーダーになる」と壮大な将来構想を掲げている。8月には牛肉や豚肉などの培養肉を開発するシンガポールのガイア・フーズを買収し、早速布石を打った。独自の培養技術の製造ライセンスを提携する企業に供与し、東南アジアや東アジアの各国に販売地域を広げることも視野に入れる。20年12月に12人だった社員数は、この1年間で32人に増えた。最先端の知識を持つ研究者を世界から募った結果、社員の3割は欧州やインド、中国など海外からの採用組で、6割が女性だ。「技術の力で世界中の人々に健康な食品を届け、飢餓や栄養失調をなくしたい」。2人の創業者の掲げたビジョンは多様性に富んだ仲間とともに、一歩一歩実現に向かっている。（シンガポール=中野貴司）最高経営責任者（CEO）のサンディヤ・シュリラム氏はインド出身で、生物工学を修了後、より高い研究水準を求めてシンガポールの南洋工科大学の博士課程に進んだ。米国の大学で博士号を取得したリン・カーイー氏（最高技術責任者=CTO）と出会ったのは、2人の就職先のシンガポール科学技術研究庁（ASTAR）だった。ともに幹細胞の専門家の理系の女性（リケジョ）だが、リーダー型のシュリラム氏が経営全般を、学究肌であるリン氏が研究開発の責任者と明確に役割を分担している。2018年の創業以来、必ず1週間に1時間は2人で話し合う時間を確保し、経営や開発の軸がぶれないよう努めてきた。プライベートでも家族ぐるみの付き合いを続ける仲だ。菜食主義者の家庭で育ったシュリラム氏は、友人に勧められて時に肉や魚を口にすることはあったものの、動物を殺傷しているとの思いが拭えず罪悪感に駆られてきた。「自分で作った培養肉なら、どうやって作られたかが分かるから安心して食べられる」。リン氏も最近は菜食が中心の「フレキシタリアン」に転向しつつあるという。2021年に創設した「日経アジアアワード」の記念すべき初代の受賞者が決定した。「アジア発のイノベーション」の担い手に光を当てることは、世界規模の様々な課題をこれから解決していこうとするアジア地域の老若男女や様々な団体を励まし、勇気づける、意義のある取り組みだと考えている。決定に至る過程で、日本を含めたアジア各国の有識者らがオンラインで集まり「アドバイザリーボード（諮問委員会）ミーティング」で検討した。「イノベーションとは何か」といった熱い議論が交わされ、アジアの将来を開く活動について多方面から検討を重ねた。アジアの価値観を反映したイノベーティブな活動の担い手として、アジアの多様な視点から選び抜かれたのが今回の受賞者、シンガポールのシオック・ミーツである。エビやカニといった、アジアの人々にとってなじみのある甲殻類に特化して培養肉を作っている。高い評価を集めたのは、同社の技術や商品が食糧問題の解決を目指すことにとどまらない。事業を通じ、天然漁が抱える乱獲問題や別種の海産物の破棄問題、養殖場の建設による環境破壊といった、既存の食材調達方法が地球環境に及ぼす負の影響に対して、水産品の培養肉の商業化という一つの解を示している点こそ、イノベーションと呼ぶに値するであろう。インド出身の最高経営責任者（CEO）は母国とシンガポールで学位を取得し、シンガポール出身の同僚女性と共同でシオック・ミーツを起業した。同社の成り立ちもまた、「アジアの多様な価値観を反映し、自由で豊かな経済社会の実現を目指す」という日経アジアアワードの理念にかなったものである。今年、立ち上がったばかりの日経アジアアワードに対し、国内外の様々な団体や有識者のみなさまから多数のご推薦をいただいた。ご協力に心から感謝を申し上げつつ、引き続き、発展に向けた支援をお願いしたい。,アジアBiz,「日経アジアアワード」に培養エビのシオック・ミーツ,https://www.nikkei.com/article/DGXZQOCB1463G0U1A211C2000000/
12/20/2021,レアメタルの使用量削減を目指し、電池メーカーや自動車メーカーが次世代電池の開発を急いでいる。パナソニックはコバルトを使わない高容量電池の実用化にメドをつけ、車載電池世界大手の中国・寧徳時代新能源科技（CATL）は調達しやすいナトリウムを使う電池に力を入れる。「ナトリウムイオン電池としては現時点で世界最高水準だ」。CATLの研究開発部門幹部は7月末に開いた発表会で強調した。ナ...,日経ヴェリタスセレクト,次世代電池、パナやCATL競う　リサイクルも,https://www.nikkei.com/article/DGXZQOUF072680X01C21A2000000/
12/20/2021,医療用医薬品の売上高で世界3位のスイス・ノバルティスの市場評価が下がっている。「世界一高額な薬」など技術的に難易度の高い治療薬の開発に力を注ぐ一方、研究開発の投資回収効率は世界大手から見劣りする。10月には傘下の後発薬事業について売却を含む見直しを表明した。先進的な開発を収益拡大につなげるには一段の資本効率改善も必要だ。スイス市場に上場するノバルティスの株価は16日時点で2019年末から14%安...,記者の目,「世界一高い薬」売るノバルティス、高まらぬ開発効率,https://www.nikkei.com/article/DGXZQOUC138PQ0T11C21A2000000/
12/20/2021,高齢化や人手不足が深刻な四国で、課題解決に挑むスタートアップが生まれている。身近に課題があるからこそ始まったサービスは、同じ悩みを抱える他地域にも広がる可能性をもつ。連載企画「四国の売り方」第6部では、1次産業の再興、過疎地における移動手段の確保に向けて、研究開発を進め、テクノロジーを駆使する企業を取り上げる。「Rのつかない月に牡蠣（かき）を食べるな」と欧米のことわざにあるように、夏場の牡蠣は味が落ちるとされる。マガキは産卵に伴って身が痩せてしまうからだ。一部地域のものを除き国内産は流通しなくなる。質の高いものを通年で出荷できないか。そんな漁業関係者の期待に、うみの（徳島県美波町）は「三倍体」マガキの稚貝で応えようとしている。三倍体マガキはほとんど産卵しないため筋肉量が維持され、夏場でも出荷できる。うみのから稚貝の提供を受けた一水産（はじめすいさん、徳島県阿南市）では「阿波はじめ牡蠣」としてブランド化し、2020年に初出荷した。売りは身の大きさと筋肉質な貝柱だ。うみのの稚貝を使い、三重県では「伊勢志摩プレミアムオイスター」が販売されている。徳島生まれの稚貝から、大きさも味わいも異なる地域ブランドが日本各地で誕生している。うみのは2010年の設立。拠点はもともと1986年に田崎真珠（現TASAKI）の研究所として開所した。二枚貝の種苗生産に長年取り組んでおり、法人化した後、事業の一つとして始めたのが三倍体マガキの開発だった。高確率で三倍体マガキの稚貝を生産できる技術をもつ。中村智治社長は「理論上100%三倍体になるので品質が保証できる。殻付きで中が見えなくても安心してもらえる」と話す。三倍体マガキの養殖には水産庁の認可が必要で、同社によると、認可されている全国20地域のうち15地域の申請をうみのが支援し、稚貝を提供する予定だ。各地域で三倍体マガキの導入が進む背景には、全国的な漁獲量の減少がある。農林水産省によると、日本の漁業・養殖業生産量は1984年の1281万トンをピークに減少し、2019年には419万トンまで落ち込んだ。水産業従事者が生計を立てるのが難しくなり、安定した出荷が見込める養殖を始めるケースも多い。小豆島の池田漁業協同組合（香川県小豆島町）も、うみのから三倍体マガキの稚貝提供を受け、22年4月に養殖を始める。近辺の漁獲量は減少傾向にあり、のりの養殖は瀬戸内海の浄化に伴う栄養不足で生産量が減っている。組合員の収入を増やすため、目を付けたのが三倍体マガキだった。初年度は1万個を育て秋ごろの収穫を計画する。まずは漁協が取り組み、生産・販売が安定しそうであれば組合員にも促していく。養殖のノウハウはないため手探りだが「新しいことに取り組まなければ組合員を支えられなくなっている」（中野郁夫参事）。島を訪れた観光客が土地ならではの食事を楽しめる場所が少ないとの問題意識もあり、牡蠣を提供できる飲食店の設置を検討中だ。うみのは稚貝提供に加え、収穫した牡蠣を買い取る契約をあらかじめ結んでおくことで、生産者の販売リスクを軽減する仕組みの導入を構想している。その上で各地域から集めた牡蠣の「食べ比べセット」などを企画する。「稚貝提供者だからこそ各地の情報が入り、地域をつなげることもできる」（中村社長）2021年3月期の売上高は1億2000万円だった。現在は年間1000万稚貝を出荷しており、今後5年で2億個まで増やしたい考えだ。（桜木浩己）,スタートアップ,夏も「旬」のブランド牡蠣　徳島・うみの、稚貝を全国へ,https://www.nikkei.com/article/DGXZQOCC0677K0W1A201C2000000/
12/20/2021,【ブリュッセル=竹内康雄、ロンドン=佐竹実】新型コロナウイルスの新変異型「オミクロン型」が欧米で猛威を振るっている。感染者の急増でオランダは19日からロックダウン（都市封鎖）を決めた。英国では新規のオミクロン感染者が1万人を超え、ドイツは英国からの旅行者の受け入れ停止を決めた。重症者や死者の数は落ち着いているが、各国とも医療体制の逼迫を懸念し、規制強化に動いている。オランダのルッテ首相は18日、新型コロナの感染拡大の阻止に向けて厳しい制限措置を導入すると発表した。スーパーなどを除いた店舗、レストランや学校の閉鎖などが含まれ、事実上のロックダウンとなる。閉鎖されるのは、レストランやバーのほか、映画館や美術館、スポーツジム。クリスマスを除き、自宅に招けるゲストの数も2人に制限する。措置は19日以降に適用され、学校は1月9日まで、そのほかは同14日まで続く。ルッテ氏は記者会見で「第5波に対応するために避けられない措置だ」と説明した。英保健安全局は19日、オミクロン型を新たに1万2133人確認したと発表した。1万人超えは2日連続。累計では3万7101人で、コロナの新規感染者全体は9万人規模の日が続いている。英スカイニュースは政府内に行動規制を強化する案もあると報じた。首都ロンドンのカーン市長は18日、「重大事態」を宣言した。行政や警察など公的機関の態勢強化を求めるもので、1月の流行時にも宣言した。英国でのオミクロン型急増を受け、ドイツは18日、英国からの旅行者の受け入れを停止すると発表した。フランスも英国からの旅行やビジネスでの渡航を禁止している。ロイター通信が現地報道として伝えた内容によると、イタリアのドラギ首相は23日にも屋外でのマスク着用義務やスタジアムなどの入場時に陰性証明の提示を求める新たな行動規制を発表する可能性がある。行動規制はクリスマスや年末年始の消費、人の移動を抑制する。経済再開の重荷となることは避けられない。オミクロン型は世界89カ国で確認されている。欧州各国が神経をとがらせるのは、オミクロン型は重症化率が低いとの指摘もある一方で感染拡大ペースが速く、医療体制が逼迫する恐れがあるためだ。世界保健機関（WHO）は18日、オミクロン型の感染が「1.5～3日で倍増している」との見方を示した。入院患者が増え「多くの医療機関が対応できなくなることがあり得る」と警告した。英メディアによると、カーン市長は「新規入院が増えているだけでなく、医療スタッフの欠員がかなり増えていることから重大事態の宣言を決めた」と話した。ロイター通信によると、オランダでは専門家がアムステルダム市内の足元の感染者の14%がオミクロン型とみている。保健当局はクリスマスから年始にかけて感染の中心がオミクロン型になるとみる。各国ともワクチン接種率の底上げを急ぐ。フランスではレストランや長距離鉄道利用時などに、ワクチン接種証明が必要となる新法の制定をカステックス首相が17日、示唆した。事実上の義務化で、600万人近くいる未接種者に強く接種を促した。オランダ政府は1月上旬までに18歳以上のすべての対象者に連絡してブースター接種の予約を促す。米国ではロックダウンなどの厳格な措置は取られていないが、イベントの自粛が相次いでいる。米プロフットボールNFLは17日、新型コロナの米国内の感染者の急増を受け、週末の3試合を週明けに延期すると発表した。北米プロアイスホッケーNHLも同様に複数の試合の延期を発表した。米ニューヨークでは劇場街ブロードウェーで休演が増えている。米NBCテレビによると、バイデン米大統領は21日に演説し、オミクロン型への新たな対策を打ち出す。ワクチン未接種者に対して「冬がどういうものになるか厳しく警告する」見込みだという。,ヨーロッパ,オミクロンが欧米で猛威　オランダが都市封鎖、休暇直撃,https://www.nikkei.com/article/DGXZQOCB191VY0Z11C21A2000000/
