04/19/2022,国際物流大手のドイツポストDHLグループは今秋から、日本の物流拠点で再生可能エネルギー発電設備の導入や再エネ電力の利用を始める。都内の中核拠点の屋上に太陽光発電パネルを設置して、施設で使う電力の2割をまかなう。取引先を含めた供給網全体で脱炭素が求められている動きに対応する。日本法人であるDHLジャパン（東京・品川）が運営する「東京ディストリビューションセンター」（東京・江東）に、再エネ発電シス...,SDGs,DHL、物流拠点に太陽光発電　供給網の脱炭素化推進,https://www.nikkei.com/article/DGXZQOUC131QI0T10C22A4000000/
04/19/2022,自民党の茂木敏充幹事長は18日の党役員会で、文書通信交通滞在費（文通費）を巡り「いまだに歳費返納の手続きをとっていない党がある」と批判した。自民党は所属議員から回収して同日付で日本赤十字社のウクライナ人道危機救援金に全額寄付したと説明した。茂木氏は「文通費の問題に真剣に取り組むと言うなら、まず問題の発端となった10月分を返金してほしい」と語った。文通費は月額100万円。2021年10月31日の衆院選で当選した新人議員も1日の在職で10月分が満額支給された。日割り支給に改める改正関連法が15日の参院本会議で共産党を除く与野党の賛成多数で可決、成立した。自民党は新人議員から100万円全額を回収した。茂木氏は「前職は今回の法改正で求められていないが、日割りで55万円を返納してもらった」と説明した。改正関連法の成立を受けて全額寄付したという。法改正で名称は文通費から「調査研究広報滞在費」に改めた。使途の公開や未使用分の国庫返納の是非は決まっておらず、与野党で引き続き協議する。,政治,自民、21年10月の文通費を寄付　ウクライナ救援金,https://www.nikkei.com/article/DGXZQOUA18AS70Y2A410C2000000/
04/19/2022,【NQNニューヨーク=古江敦子】18日の米株式市場でダウ工業株30種平均はもみ合いで始まり、午前10時現在は前営業日の14日に比べ79セント高の3万4452ドル02セントで推移している。石油株など原油高の恩恵を受けやすい銘柄に買いが先行し、長期金利上昇を受けて銀行株も高い。半面、ハイテク株や消費関連株の一角が売られ、相場の重荷になっている。米原油先物は18日朝、一時1バレル108ドル台半ばと3週間ぶりの高値を付けた。石油のシェブロンが買われ、資源高が業績の追い風になる建機のキャタピラーも高い。米長期金利が18日深夜に一時2.88%と2018年12月以来3年4カ月ぶりの高水準をつけ、利ざや拡大の思惑からゴールドマン・サックスなど金融株が買われている。半面、原油高が消費を冷やすとの見方から消費関連株は売りが優勢。スポーツ用品のナイキ、映画・娯楽のウォルト・ディズニーが安い。長期金利上昇で相対的な割高感が意識されやすいハイテク株の一角も売られ、スマートフォンのアップルが下げている。ハイテク株が多いナスダック総合株価指数は小幅続落で始まった。,北米,NYダウもみ合いで始まる　石油株と銀行株には買い,https://www.nikkei.com/article/DGXZQOGN00030_Y2A410C2000000/
04/19/2022,女子ゴルフの18日付世界ランキングが発表され、16日閉幕のロッテ選手権で2位に入った渋野日向子は6つ順位を上げて31位となった。畑岡奈紗は12位、笹生優花は13位にそれぞれ後退した。古江彩佳は22位、西郷真央は24位、稲見萌寧は25位。1位の高真栄（韓国）、2位のネリー・コルダ（米国）、3位のリディア・コ（ニュージーランド）は変わらなかった。〔共同〕,スポーツ,渋野6つ上げ31位、畑岡12位　女子ゴルフ世界ランキング,https://www.nikkei.com/article/DGXZQOKC18C6N0Y2A410C2000000/
04/19/2022,形骸化した就職活動のルールの見直しが動き出す。政府はインターンシップで得た学生の情報を採用選考に使うのを容認する方向で経済界や大学と調整に入る。職務を明確にしたジョブ型雇用などの拡大をにらみ、企業が専門性のある学生を確保しやすくする。グローバルな人材獲得競争の激化を踏まえ、内向きの発想からの転換にかじを切る。経団連の十倉雅和会長は18日の記者会見で「学生が大学で素養を身につけることに注意を払う...,大学,就活、形骸化ルール見直し　インターン情報を採用に活用,https://www.nikkei.com/article/DGXZQOUA185EN0Y2A410C2000000/
04/19/2022,2021年12月24日のクリスマスイブ。東京・紀尾井町の高層ビル内にあるデジタル庁では、間仕切りのない全面フリーアドレスの執務フロアがざわついていた。職員のパソコンには局長級幹部全員の連名の「謝罪メール」が戦略・組織グループ長の冨安泰一郎から送られた。「新しい霞が関文化をつくるはずが苦労をかけてしまった」。組織体制の混乱を謝罪する内容だった。デジタル庁は旧来型の縦割り組織をやめ、プロジェクト...,ルポ迫真,「会議に出たくない」　デジタル庁、民間出身職員が反発,https://www.nikkei.com/article/DGXZQOUA119T20R10C22A4000000/
04/19/2022,厚生労働省の専門部会は18日、米ノババックス社が開発した新型コロナウイルスワクチンの薬事承認を了承した。国内では米ファイザー製、米モデルナ製、英アストラゼネカ製に続いて4例目となる。武田薬品工業が国内生産する。多様なワクチンを無駄にせず、どう使い分けるか日本の戦略も問われる。後藤茂之厚労相が19日にも正式に承認する。厚労省の別の専門分科会の了承を経たうえで実際に打てるようになる。対象は18歳以...,経済,コロナワクチン、4例目承認へ　問われる活用策,https://www.nikkei.com/article/DGXZQOUA184O70Y2A410C2000000/
