12/31/2021,監査法人トーマツは2022年1月から、不正会計の兆候を検知するシステムを本格導入する。過去の不適切会計のデータなどを人工知能（AI）で分析し、監査先の子会社や勘定科目単位で不正の兆候を効率的に把握する。新型コロナウイルス禍による業績不振を背景に会計不正への警戒感は強い。早期に不正を防ぎ、監査の質を高めていく。今回新たに導入するシステムは、05年以降に発表された有価証券報告書や訂正報告書の財務諸表...,ネット・IT,トーマツ、不正検知システム開発　22年1月から本格導入,https://www.nikkei.com/article/DGXZQOUC22CBV0S1A221C2000000/
12/31/2021,【NQNロンドン】30日のロンドン外国為替市場で、英ポンドは対ドルで小幅に続伸した。英国時間16時時点では、前日の同時点と比べて0.0010ドルのポンド高・ドル安の1ポンド=1.3490～3500ドルだった。朝方はポンド売りが優勢だった。午後にかけて、年末を控えた持ち高調整のポンド買いが優勢となり、一時は1.3521ドル付近と11月中旬以来、約1カ月半ぶりのポンド高・ドル安水準を付けた。ユーロは対ドルで小幅に反落した。0.0010ドルのユーロ安・ドル高の1ユーロ=1.1330～40ドルだった。午後に発表された米新規失業保険申請件数（週間）の減少を受けて、ドル買い・ユーロ売りが強まる場面があった。円の対ドル相場は続落し、20銭円安・ドル高の1ドル=115円10～20銭だった。円の対ユーロ相場は横ばいだった。前日の16時時点と同じ水準となる1ユーロ=130円40～50銭だった。,為替概況,ロンドン外為30日　ポンド小幅続伸　ユーロは小反落,https://www.nikkei.com/article/DGXZASH2IILM3_Q1A231C2000000/
12/31/2021,【ニューヨーク=時事】米製薬大手ジョンソン・エンド・ジョンソン（J&J）は30日、同社製新型コロナウイルスワクチンの追加接種によって、コロナによる入院リスクが85%減ったとする研究結果を発表した。変異株「オミクロン株」への感染が大半を占める南アフリカで、医療従事者を対象に11月中旬から12月中旬にかけて追加接種の効果を調べた。1回で接種が完了するJ&J製ワクチンを6～9カ月後に追加投与したところ、コロナによる入院リスクが85%減ったという。米ファイザーなど他のワクチンメーカーも、追加接種によってオミクロン株への高い感染予防効果が期待できるとする実験結果を公表している。またJ&Jによれば、ファイザー製ワクチンを接種した人にJ&J製ワクチンを追加投与したところ、感染を防ぐ「中和抗体」のレベルが41倍に増えたことが米医療機関による研究で示された。ファイザー製を追加接種した場合は17倍にとどまったという。,新型コロナ,追加接種で入院リスク85%減　J&J製コロナワクチン,https://www.nikkei.com/article/DGXZQOGN3047Z0Q1A231C2000000/
12/31/2021,【ワシントン=長沼亜紀】米労働省が30日発表した失業保険統計（季節調整済み）によると、19～25日の週間の新規失業保険申請件数は19万8000件で、前月の改定値から8000件減った。3週ぶりの減少で、約52年ぶりの低水準となった12月上旬の水準（18万8000件）に近づいた。ダウ・ジョーンズまとめの市場予測（20万5000件程度）を下回った。足元で新型コロナウイルス感染が再び急増しており、経済への影響が出始めているが、今ところ解雇増加にはつながっていないことを示した。総受給者数は12～18日の週は171万6000人で前週の改定値から14万人減った。3週連続の減少で、コロナ感染が本格化した2020年3月以来の低水準となった。,北米,米失業保険申請、19万8000件　3週ぶり減少,https://www.nikkei.com/article/DGXZQOGN304440Q1A231C2000000/
12/31/2021,半導体メーカーのヌヴォトンテクノロジージャパン（京都府長岡京市）は電気自動車（EV）など電動車の車載電池の充放電を監視するICの量産を始めた。過剰な充放電を防ぐ精度を従来品と比べ2倍近く向上させて電池のキャパを増し、電動車の航続距離の延伸につなげる。各国の自動車メーカーに納入をめざす考えだ。同社は台湾の半導体メーカー、新唐科技（ヌヴォトンテクノロジー）がパナソニックの半導体子会社を買収して発足した。パナソニ...,日経産業新聞,半導体のヌヴォトン、EV電池の監視IC　精度2倍に,https://www.nikkei.com/article/DGXZQOUF07B6D0X01C21A2000000/
12/31/2021,コロナ禍の2年で教育の形は大きく変わった。オンライン対応を迫られたことで、多くの教育者がデジタルの利点を認識した。時間と空間の束縛がなくなり、世界各地のオピニオンリーダーが一堂に会し、学生や...,新型コロナ,社会と共に考える大学に　藤井輝夫・東大学長,https://www.nikkei.com/article/DGXZQOUE22DFK0S1A221C2000000/
12/31/2021,新型コロナウイルス禍で40、50代が他世代よりも孤独感を深めていることが、東京都の研究機関の分析で明らかになった。テレワークの浸透など激変した勤務形態が要因の一つと考えられるが、生活環境が変わったことに伴う家族関係の変化も無視できない。家族社会学が専門の山田昌弘・中央大教授に見方を聞いた。40、50代の孤独感が深まっているという調査結果に驚きはない。その年代では男性は収入が多く安定しているように...,Re:Connect,「愛情格差」コロナで拡大　40～50代、孤独感の背景,https://www.nikkei.com/article/DGXZQOUE157TH0V11C21A2000000/
