02/14/2022,東北大学とJFEスチールは、二酸化炭素（CO2）の排出量が少ない製鉄方法を共同研究する「グリーンスチール共創研究所」を設置した。温暖化ガス排出量を実質ゼロにする「カーボンニュートラル」に向けて、東北大の数理解析技術をJFEスチールの実験に活用。研究者の育成にも取り組む。東北大大学院工学研究科で素材開発を担う施設内に研究室を設置。製鉄プロセスの研究・新たな材料の開発・共同企画の推進の3チームを設けた。設置期間は2025年3月まで。両者は17年に連携協力協定を締結。20年には製鉄プロセスの解析に関する共同研究部門を立ち上げるなど提携関係を深めてきた。東北大が21年に始めた企業との共創研究所としては愛知製鋼、ブリヂストン、東北電力に続いて4カ所目となる。,環境エネ・素材,東北大学とJFEスチール、脱炭素へ共同研究所,https://www.nikkei.com/article/DGXZQOCC041BR0U2A200C2000000/
02/14/2022,北海道は14日、新たに2252人の新型コロナウイルス感染を確認したと発表した。20日連続で新規感染者数が2000人を超した。道全体で患者17人の死亡が確認された。13日時点の重症者数は引き続き9人。病床使用率は36.1%だった。北海道の感染者のうち、...,新型コロナ,北海道コロナ感染者2252人、死者17人,https://www.nikkei.com/article/DGXZQOFC147WU0U2A210C2000000/
02/14/2022,食用コオロギを養殖するグリラス（徳島県鳴門市）は世界の食料問題や昆虫食に関する意識調査の結果をまとめた。牛や豚など既存の畜産に依存したタンパク質供給では急増する世界人口を支えきれなくなる「タンパク質危機」について「知っており、内容も理解している」人は11.4%にとどまった。一方で昆虫食を知っている人は82%に達した。調査は1月中旬にネット経由で実施し、全国の15～60歳代の男女1000人が回答した。地球温暖化や食品ロス問題については50%以上が「知っている」と答えており、タンパク質危機の認知度の低さが目立つ。危機の解決策として、タンパク質が豊富な昆虫食が注目されつつあるが、今回の調査で食べた経験がある人は12.1%と少ない。昆虫食の印象（複数回答）も「気持ち悪い」（41.8%）、「おいしくなさそう」（29.9%）が1、2位を占めた。グリラスは清潔な環境で養殖した食用コオロギの粉末などを生産している。昆虫食の啓発に向け、今後も調査を実施するという。,サービス・食品,タンパク質危機「知っている」11%　昆虫食会社が調査,https://www.nikkei.com/article/DGXZQOCC094OZ0Z00C22A2000000/
02/14/2022,仙台市の泉区役所の建て替えを巡り、有識者で作る委員会（委員長・増田聡東北大学教授）は14日、三菱地所を代表者とする企業連合を優先交渉者とする答申書を郡和子仙台市長に提出した。3グループが応募するなかで、利便性向上や若者をターゲットとした開発計画が評価された。週内にも市長が正式に決定する。1月に行われた公開プレゼンテーションを経て、6人で組織する有識者委員会が250点満点で採点。優先交渉者となった三菱地所...,宮城,仙台市、泉区役所の建て替え　優先交渉先に三菱地所,https://www.nikkei.com/article/DGXZQOCC144NS0U2A210C2000000/
02/14/2022,荏原が14日発表した2021年12月期の連結決算（国際会計基準）は純利益が前の期比80%増の436億円だった。世界的な半導体不足を背景に、半導体製造装置向け製品の売り上げが好調だった。期末配当を従来予想より33円増やして113円とする。年間配当は163円（前の期は90円）となる。売上高にあたる売上収益は15%増の6032億円、営業利益は63%増の...,エレクトロニクス,荏原の21年12月期、純利益80%増　半導体製造向け好調,https://www.nikkei.com/article/DGXZQOUC1482W0U2A210C2000000/
02/14/2022,福岡県は14日、一般会計で2兆1529億円となる2022年度予算案を発表した。新型コロナウイルス対策費として21年度に続き4000億円台を計上。総額は21年度当初予算比0.8%増え、2年連続で2兆円台の大型予算となる。3年連続で過去最大。コロナ後を見据え、半導体や自動車の電動化などの産業振興にも重点配分する。服部誠太郎知事にとって初の予算編成になる。新規事業に関する予算を21年度当初比で約1.5...,税・予算,福岡県22年度予算案2兆円超、コロナ対策増　半導体も,https://www.nikkei.com/article/DGXZQOJC0869S0Y2A200C2000000/
02/14/2022,京都府の西脇隆俊知事は14日、20日に期限を迎える新型コロナウイルス対策の「まん延防止等重点措置」について「解除する状況にない」と述べ、政府に延長を要請する方向で調整する考えを表明した。専門家の意見を聞いたうえで、15日にも判断する。西脇氏によると、兵庫県の斎藤元彦知事と電話で協議し、感染者数や病床使用率の状況が似ており、歩調をあわせることを確認したという。斎藤氏は14日、重点措置について「延長の方向で調整したい」と述べた。西脇氏は重点措置が延長された場合、対象地域や飲食店への要請内容は基本的に継続する考えを示した。重点措置は飲食店でのクラスター（感染者集団）や人出の抑制などに一定の効果を発揮しているとの認識も示した。13日時点の府内の新規感染者数（7日間平均）は2336人。前週比0.93倍と減少に転じており、西脇氏は「緊急事態宣言は要請する段階にはない」と述べた。病床使用率は71.3%、重症者向けの病床に限れば63.7%と医療提供体制は逼迫しつつある。,関西,京都府、まん延防止延長要請へ　知事「解除状況にない」,https://www.nikkei.com/article/DGXZQOUF148I40U2A210C2000000/
02/14/2022,DOWAホールディングス（HD）が14日発表した2021年4～12月期の連結決算は純利益が前年同期比5.2倍の441億円だった。同じ期間では過去最高益だった。主力の製錬事業で銅や貴金属などの価格が上昇し、収益を押し上げた。自動車向けの金属加工品も好調だった。22年3月期の年間配当は前期比35円増の130円に増やす。売上高は前年同期比52%増の6119億円、営業利益は2.2倍の522億円だった。いずれも同期間で過去最高だった。鉱石や排ガス触媒などから取り出す銅や白金などの貴金属の価格が高騰したほか、円安が進み収益が改善した。ワイヤハーネス（組み電線）に使う伸銅品など自動車向け製品も伸びた。同日発表した22年3月期の純利益予想は前期比2.1倍の465億円と、過去最高を見込んでいた従来予想をさらに25億円上回る。持ち分法適用会社の藤田観光が施設売却に伴う特別利益を計上し、持ち分法投資利益が伸びる。DOWAは年間90円の安定配当を維持しながら、利益水準に応じて増配する方針を掲げている。,業績ニュース,DOWAの21年4~12月、純利益5.2倍　金属価格上昇で,https://www.nikkei.com/article/DGXZQOUC146B40U2A210C2000000/
02/14/2022,マツキヨココカラ&カンパニーが14日発表した2021年4～12月期の連結決算は、純利益が前年同期比76%増の287億円だった。21年10月に経営統合したココカラファインの株取得に伴う特別利益106億円を計上したことが寄与した。統合前のココカラファインの21年4～9月期の連結業績は反映していない。売上高は23%増の5078億円、営業利益は19%増の277億円だった。マツキヨ単体の売上高と営業利益は前年同期を上回ったが、10～12月の既存店売上高は前年割れが続くなど経営環境は厳しい。特にスーパーなどでも取り扱うようになったハンドソープなどの感染症対策商材が落ち込んでいる。今後はプライベートブランドの拡充で利益率の改善を目指す。22年3月期の連結業績予想は変えなかった。売上高は前期比37%増の7440億円、純利益は63%増の352億円を見込む。,業績ニュース,マツキヨココの4～12月、純利益76%増　統合で特別利益　,https://www.nikkei.com/article/DGXZQOUC143RU0U2A210C2000000/
02/14/2022,投資信託協会が14日発表した1月の投信概況によると、公募投信の純資産残高は前月末比5.5%減の155兆4615億円となった。2カ月ぶりに減少し、減少率は2020年3月（8・2%）以来の大きさだった。米国の利上げ観測を受けて、日米など世界の株価下落による運用減が影響した。純資産残高は前月末に比べて9兆385億円減少し、歴代3位の減少額となった。1月は日経平均株価が月間で6%安、米ダウ工業株30種平均も同3%安だった。主要株価の下落によって、国内外の株式で運用する投信を中心に運用額が減少した。設定額から解約・償還額を差し引いた純資金流入額は9111億円で、57カ月連続の流入超だった。都内で会見した投資信託協会の松谷博司会長は「株式市場は大きく崩れたが、投資家に大きな動揺は見られない。相場に左右されず長期の資産形成をしてほしい」と話した。上場投資信託（ETF）は1949億円の流入超だった。1月は日銀によるETF購入が2回あり、計1402億円だった。投資信託協会は同日、投資信託の購入時に投資家に配布する「交付目論見書」の作成に関する規則を一部改正すると発表した。運用手数料や監査報酬など運用にかかる費用を合計し、純資産残高に対する比率を示した「総経費率」を交付目論見書に記載するよう求める。総経費率はこれまで運用報告書に記載されていた。3月14日までパブリックコメントを募集し、4月に開催予定の理事会で改正を決める。24年から実施する予定だ。,アセットマネジメント,1月の投信残高、1年10カ月ぶり減少率　株安響く,https://www.nikkei.com/article/DGXZQOUB146IG0U2A210C2000000/
02/14/2022,岡山県新見市はJR西日本と連携、交通系ICカード「ICOCA（イコカ）」を活用した地域活性化プロジェクトを推進する。10日に包括連携協定を締結した。まず市内の商店などでICOCAの決済環境を拡充、市民に5000円分を付与した市独自デザインのICOCAを配布して市内での消費拡大を促す。ポイント還元事業なども組み合わせて市内の経済循環の活性化を進める。10月をメドに事業を開始する予定。さらに市営バスの利用料や住民票の交付手数料などもICOCA決済ができる環境を整備して利便性を向上させる計画。観光施設でもICOCAで決済できる環境を整備し、市外からの来訪者を呼び込む仕掛けづくりも進めるという。JR西日本は2023年春にスマートフォンでICOCAの機能が使える「モバイルICOCA（仮称）」サービスを始める予定で、市は24年以降にスマホ決済できる環境を構築する方針だ。新見市は10年に3万3000人を超えていた人口が20年には2万8000人余りに減少。過疎化克服が課題になっている。,サービス・食品,岡山県新見市、ICOCAで地域活性化 JR西日本と協定,https://www.nikkei.com/article/DGXZQOCC146290U2A210C2000000/
02/14/2022,【北京=羽田野主】中国外務省の汪文斌副報道局長は14日の記者会見で、在ウクライナ中国大使館が現地の中国人に「情勢の変化に細心の注意を払い、安全・防犯意識を強化するように指導している」と明かした。米欧日は現地の自国民に退避を呼びかけるが、ロシアと緊密な連携を維持する中国は注意喚起にとどめた。汪氏は「（ウクライナに進出する）中国企業の安全と正当な権益を確実に守る」とも強調したが、現時点で退避勧告の可能性には言及しなかった。中国の習近平（シー・ジンピン）国家主席は2月4日に北京冬季五輪の開会式に合わせて訪中したロシアのプーチン大統領と会談した。ウクライナ情勢を巡っても意見交換をしたとみられる。ロシアがウクライナへの侵攻機会をうかがっていると米国などが分析する中で、ロシアとパイプを持つ中国がウクライナの自国民を守るためにどのような判断を下すかに関心が集まっている。汪氏は「関係各方面は対話を通じてウクライナ危機にかかわる問題の全面解決を後押しすべきだ」と主張した。日本外務省はすでにウクライナ全土の危険情報を最高度の「レベル4」（退避勧告）に引き上げ、滞在する日本人に直ちに退避するよう呼び掛けた。米国やカナダ、ドイツなども自国民に退避を呼びかけている。,中国・台湾,中国、在ウクライナ中国人に「注意喚起」　退避は促さず,https://www.nikkei.com/article/DGXZQOGM1494N0U2A210C2000000/
02/14/2022,地域情報サイト運営のジモティーは14日、2022年12月期の単独税引き利益が前期比5%増の3億8200万円になりそうだと発表した。閲覧数に応じた広告収入の増加に加え、中古車の取引仲介や人材マッチングサービスといった新規事業が成長する見通しだ。売上高は14%増の19億4900万円、営業利益は18%増の4億4600万円を見込む。地方自治体と共同で不用品の回収拠点を開設する。回収した中古品をサイトに出品する取り組みを通じて出品数を増やし、サイトの閲覧数増加につなげる。中古車の個人間取引の仲介事業を運営する子会社を設立するなど、新規事業も拡大する。同日発表した21年12月期の単独決算は、売上高が前の期比24%増の17億1100万円、税引き利益が43%増の3億6300万円だった。新型コロナウイルス下で落ち込んでいた広告需要が回復し、広告収入が増えた。オンライン決済の手数料収入が好調だった。繰り延べ税金資産の計上によって税負担が減り、利益を押し上げた。,サービス・食品,ジモティーの22年12月期、5%増益　新事業がけん引,https://www.nikkei.com/article/DGXZQOUC1458S0U2A210C2000000/
02/14/2022,家電量販最大手のヤマダホールディングス（HD）は14日、家電販売を担うヤマダデンキと家具を手がける大塚家具の2社を5月に合併すると発表した。2社はともにヤマダHDの全額出資子会社。大塚家具はすでに商品開発や店づくりでヤマダデンキと連携しており、合併で意思決定のスピードをはやめ、事業間の相乗効果を引き出す。大塚家具のブランド名、既存の店舗網は維持する方針だ。ヤマダデンキが存続会社となり、5月1日付で大塚家具を吸収合併する。ヤマダHDは2019年12月に業績不振が続いていた大塚家具を子会社化し、21年9月には完全子会社としていた。ヤマダHDは家電を軸に家具や住宅まで扱う「暮らしまるごと戦略」を掲げ、ソファや寝具を独自開発したり、大塚家具の商品をそろえるヤマダの大型店を出店したりしてきた。今回の合併でこの戦略をさらに推し進める。,エレクトロニクス,大塚家具をヤマダデンキが吸収合併　ブランドは維持,https://www.nikkei.com/article/DGXZQOUC148300U2A210C2000000/
02/14/2022,資産運用サービスのウェルスナビが14日発表した2021年12月期の単独決算は、最終損益が4億円の赤字（前の期は10億円の赤字）だった。オンラインで投資信託などのポートフォリオを指南するロボットアドバイザーの預かり資産が増えたものの、広告宣伝費や人件費の先行投資がかさんだ。売上高にあたる営業収益は85%増の46億円だった。21年12月末時点の預かり資産は6345億円と1年前と比べ約2倍に拡大した。運用者数は31万人と3割程度増えた。22年12月期の営業収益は前期比44%増の66億円を見込む。営業利益の予想は非開示だが、四半期単位で同期中に黒字化を目指す方針を明らかにした。,フィンテック,ウェルスナビ、最終赤字縮小　21年12月期,https://www.nikkei.com/article/DGXZQOUB141QA0U2A210C2000000/
02/14/2022,【NQNロンドン=菊池亜矢】14日午前のロンドン外国為替市場で、ユーロは対ドルで一段安となっている。英国時間9時30分時点は、1ユーロ=1.1310～20ドルと、前週末の同16時時点に比べ0.0090ドルのユーロ安・ドル高で推移している。ロシアによるウクライナ侵攻が懸念されるなか、ウクライナ情勢を巡る緊張継続で、欧州経済への悪影響を警戒したユーロ売り・ドル買いが出ている。英ポンドも対ドルで下げ幅を広げ、同9時30分時点は1ポンド=1.3510～20ドルと、0.0090ドルのポンド安・ドル高で推移している。欧州主要株価指数が大幅に下落し、投資家のリスク回避姿勢が強まるなか、ポンド売り・ドル買いが優勢となっている。,為替概況,ロンドン外為9時半　ユーロ、対ドルで一段安　ウクライナ情勢の緊張続く,https://www.nikkei.com/article/DGXZASH2IILM1_U2A210C2000000/
02/14/2022,自民党の西田昌司参院議員（京都府連会長）は京都府連が国政選挙前に候補者から集めた現金を組織的に配ったとする月刊誌報道に反論した。動画投稿サイトの自身のチャンネルで「買収する動機も必要性もない。指摘は事実に反する」と主張した。西田氏は「政治資金の流れは収支報告書に記載されており、法にのっとっている」と強調した。二之湯智国家公安委員長（参院京都選挙区）は14日の衆院予算委員会で、府連への自身の寄付に関し「府連の指示ではない。私個人の考えだ」と語った。公職選挙法が禁じる選挙買収の意図はないとも話した。立憲民主党の階猛氏に答弁した。,政治,自民・西田氏、選挙買収報道「事実に反する」,https://www.nikkei.com/article/DGXZQOUA140VB0U2A210C2000000/
02/14/2022,【モスクワ=石川陽平】ロシアによるウクライナ侵攻への警戒が広がる中、親ロシア派武装勢力と政府軍によるウクライナ東部紛争の緊張が高まっている。紛争解決への協議が難航し、ロシア側が軍事的挑発に出る可能性がある。ロシアは親ロシア派地域で70万人超に増えた「自国民保護」を口実にした軍事侵攻もちらつかせ、ウクライナに譲歩を迫っている。「ロシアが軍事行動を正当化するための挑発や事件を引き起こしたとしても驚く...,ウクライナ情勢,ウクライナ東部緊迫　「自国民保護」ロシア侵攻の口実に,https://www.nikkei.com/article/DGXZQOGR10DJ30Q2A210C2000000/
02/14/2022,【ソウル=恩地洋介】3月9日投開票の韓国大統領選は候補者登録（告示）が14日に締め切られ、15日から正式な選挙戦が始まる。5年ぶりの政権交代を訴える保守系野党「国民の力」の尹錫悦（ユン・ソクヨル）前検察総長が、与党「共に民主党」の李在明（イ・ジェミョン）前京畿道知事を僅差でリードする。2人の政策で違いが際立つのは外交安全保障だ。尹氏は南北融和を優先して日本との関係悪化を放置した文在寅（ムン・ジェイン）政権の外交を「失敗」と位置づける。1月にミサイルを7回発射した北朝鮮に対抗するため、日米韓の安保連携を強化すべきだと唱える。北朝鮮を脅威と捉える姿勢は日本と同じだ。3日のテレビ討論では、就任後は米国と日本の順で首脳会談の実現を目指す考えを示した。首都圏防衛のため、中国が反対する地上配備型ミサイル迎撃システム（THAAD）の追加配備が必要だとも主張する。李氏は論戦で「実用外交」を唱えて軸を曖昧にするが、文政権の路線継承が基本とみられる。米国と中国が対立を深めるなか、米中双方と協調する「バランス外交」を志向する。中国の経済的な影響力を無視できないためで、李氏は「中国とはできるだけ友好関係を維持する」と明言する。日本観は複雑だ。2021年11月の記者会見では「個人的には日本国民の誠実さを尊重する」と語る一方、島根県竹島（韓国名・独島）を巡る対立に関して「日本は軍事大国化を夢見て領土挑発をし、過去についての心からの反省が見られない」などと話した。調査会社リアルメーターが13日に公表した世論調査によると、支持率は尹氏が41.6%、2位の李氏が39.1%。中道野党「国民の党」の安哲秀（アン・チョルス）代表は7.7%で続いた。選挙戦の最大の変数は、尹氏と安氏の候補一本化に向けた動きだ。2人は「反・文在寅」のスタンスで一致している。両者が協力して李氏との差を広げられれば、政権交代の可能性は高まる。今回の大統領選は政策論争よりもスキャンダル合戦が注目されている。最近は李氏の妻が京畿道の公務員を私的な雑用に従事させていた疑惑が明るみに出たばかり。21年3月まで検察トップだった尹氏は、大統領に就いたら現政権や李氏の疑惑を捜査すると発言して物議を醸した。,朝鮮半島,与野党候補、外交姿勢に違い　韓国大統領選が告示,https://www.nikkei.com/article/DGXZQOGM1430V0U2A210C2000000/
02/14/2022,リゾートトラストは14日、ビジネスホテル「ホテルトラスティ」6施設を不動産関連の投資や運用を手がけるスターアジアグループ（東京・港）に売却すると発表した。ホテルは2022年3月31日に営業を終了し、4月には物件を引き渡す。後継のホテルはスターアジア傘下のポラリス・ホールディングスが運営し事業を続ける。譲渡額は非開示で、23年3月期に特別利益を計上する見込み。ホテルトラスティは国内に9施設あり、3施設（東京、名古屋、大阪に1施設ずつ）は残す。新型コロナウイルスの影響でホテルトラスティの利用がふるわず、10～12月の稼働は50～60%で推移していた。リゾートトラは今後、主力である会員制ホテルやメディカル事業に注力する方針。14日に発表した21年4～12月期の連結決算は純利益が12%減の85億円だった。売上高は8%減の1194億円だった。会員制ホテルの新規開業に伴う不動産収益の計上があった前年同期と比べ、減収減益となった。リゾートトラは14日、ディー・エヌ・エー（DeNA）と、次世代型の健康診断サービスを企画する共同出資会社「ウェルコンパス」を3月に設立することも発表した。資本金は1億円で出資比率はリゾートトラが51%、DeNAが49%。,中部,リゾートトラ、一部ビジネスホテル売却へ　会員制に集中,https://www.nikkei.com/article/DGXZQOFD146N80U2A210C2000000/
02/14/2022,北海道北斗市が14日発表した2022年度予算案によると、一般会計の総額は前年度当初比3%増の約222億900万円だった。交流人口の拡大を目指し、仕事と休暇を両立するワーケーション拠点を北海道新幹線の新函館北斗駅に誘致する。...,税・予算,北海道北斗市、新函館北斗駅にワーケーション拠点誘致,https://www.nikkei.com/article/DGXZQOFC147010U2A210C2000000/
02/14/2022,初出場した女子500メートルで銀メダルに輝いた高木美帆（日体大職）と、男子500メートルで日本勢3大会ぶりの表彰台となる銅メダルを獲得した森重航（専大）は滑走技術の高さとカーブワークのうまさが際立っていた。この種目ではスタートから300メートル付近まで加速し、その後は徐々に減速していく。身長は高木美が164センチ、森重が175センチ。体格で一回り大きい海外勢は最初の100メートルこそ先行しても、...,透視線,メダル奪取の高木美と森重、500で光るカーブワーク,https://www.nikkei.com/article/DGXZQODH232CR0T20C22A1000000/
