03/12/2022,設置者や管理者が分からない橋が全国の河川で見つかっている。多くは1970年代前半までの高度経済成長期の宅地開発に伴い、地元企業や住民が自前で架けたとみられるが、補修や点検がされないまま放置されているものが多い。老朽化や災害で破損する危険があるものの、自治体は所有権との兼ね合いで容易に撤去できず、対応に頭を悩ませている。「この橋の所有者の方は下記にご連絡願います」。2月下旬、川崎市の閑静な住宅街を...,ドキュメント日本,全国に「管理者不明橋」　進む老朽化、転落事故の恐れ,https://www.nikkei.com/article/DGXZQOUE025ZO0S1A201C2000000/
03/12/2022,2011年3月の東日本大震災の翌日に震度6強の揺れに襲われた長野県栄村は12日、地震発生から11年となり、県外のボランティアらがキャンドルに火をともし、復興と村の発展を願った。会場となったJR森宮野原駅前の高さ約6メートルの雪山に1200個のキャンドルを並べて、闇夜に「3.12防災の日」という文字を浮かび上がらせた。奈良県五條市から通って支援を続けてきた辻康成さん（74）は「これからも未来に向けて明かりをともし続ける」と話した。11年3月12日の地震では、村内の住宅約200棟が全半壊し、避難生活のストレスや過労などで3人が亡くなり災害関連死と認定された。村議会は今月9日、地震を風化させないため、3月12日を「震災を忘れない栄村防災の日」とする条例案を全会一致で可決した。〔共同〕,災害・気象,キャンドルともし復興願う　長野栄村、地震から11年,https://www.nikkei.com/article/DGXZQOUE122YB0S2A310C2000000/
03/12/2022,世界ボクシング評議会（WBC）ライトフライ級タイトルマッチ（19日・京都市体育館）で初防衛を狙うチャンピオンの矢吹正道（緑）が12日、前王者の寺地拳四朗（BMB）との再戦に向けた練習を報道陣にオンラインで公開し「挑戦者の気持ちで臨む」と引き締まった表情で話した。昨年9月に9度目の防衛を狙った寺地を10回TKOで破り、王座についた。練習では縄跳びなどのメニューをこなし、シャドーボクシングで素早い動きを披露した。王者になってからは走り込みの時間を増やしてスタミナを強化してきたといい「前回より練習の量と質は上がった。一度戦っている相手。何をすればいいかは分かっている」と自信をのぞかせた。〔共同〕,スポーツ,矢吹正道、初防衛へ自信「挑戦者の気持ちで」　WBC,https://www.nikkei.com/article/DGXZQOKC123AW0S2A310C2000000/
03/12/2022,【ワルシャワ=久門武史】ロシア軍はウクライナの首都キエフを複数の方向から包囲する構えだ。これまで比較的落ち着いていた同国の西側でも攻撃を強める。一方、ウクライナの北の隣国ベラルーシの軍がロシア軍に加勢するとの観測も浮上してきた。実際にベラルーシが参戦すれば戦争の「国際化」が進み、構図が一段と複雑になる。ロシア軍は11日、ウクライナ西部のルツクなどの空軍基地を空爆した。ロシア国防省は長距離精密誘導兵器で基地を「無力化」したと表明した。ルツクからポーランドとの国境までは100キロメートル程度の距離だ。11日の米国防総省高官の分析によると、キエフ中心部まで、北東からのロシア軍の部隊は約20～30キロメートル、北西からの部隊は約15キロメートルに迫る。東部からも部隊がキエフを目指しているとの報道もある。キエフを取り囲み、総攻撃の態勢を整えるもようだ。ベラルーシが参戦する可能性も取り沙汰される。ウクライナ空軍は11日、同国上空からロシア軍機がベラルーシに旋回し、同国の村を攻撃したと明らかにした。ウクライナ側は「ベラルーシ軍を（戦争に）巻き込む狙いだ」と指摘した。村をウクライナ軍が攻撃したと「偽装」し、ベラルーシ参戦の口実にされる事態を警戒する。11日にはベラルーシのルカシェンコ大統領が訪問先のモスクワでロシアのプーチン大統領と会談し、ロシアから軍備品を受け取ることで合意した。ロシアのウクライナ侵攻前、ベラルーシは合同演習の名目でロシア軍を領内に招き、そのままウクライナを北方から攻めるルートを提供した。米紙ワシントン・ポスト（電子版）は2月下旬、米当局者の見方として、ルカシェンコ政権がウクライナへの派兵を準備していると報じていた。ロシア軍はウクライナ各地を攻撃。同国検察当局によると、12日までに子ども79人が死亡し、学校などの破壊で700万人の子どもが教育機会を奪われた。ロシア軍が制圧したウクライナの原子力発電所の情勢も不安定だ。国際原子力機関（IAEA）は11日、核物質を巡るデータ送信がザポロジエ原発からは復旧したと発表。だが、同日現在でチェルノブイリ原発からの送信は停止したままだ。,ウクライナ侵攻,ロシア軍、ウクライナ西部攻撃　ベラルーシ参戦の観測,https://www.nikkei.com/article/DGXZQOCB122EQ0S2A310C2000000/
03/12/2022,川崎市と羽田空港（東京・大田）をつなぐ「多摩川スカイブリッジ」が12日、開通した。橋の長さは約675メートルで、歩いても10分ほどで渡れる。多くの企業や研究機関が集まる川崎市と空の玄関口が結ばれ、ビジネス客の往来増や産業振興が期待される。開通を前に開かれた式典には川崎市の福田紀彦市長ら関係者が出席し、テープカットした。福田市長は式典後「これからの日本をリードする産業エリアで、この橋が果たす役割に期待したい」と記者団に語った。川崎市と東京都が事業費約300億円をかけて整備した。〔共同〕,神奈川,多摩川スカイブリッジ開通　川崎と羽田、徒歩10分で,https://www.nikkei.com/article/DGXZQOUE122LX0S2A310C2000000/
03/12/2022,明治安田生命レディース第2日（12日・高知県土佐CC=6228ヤード、パー72）ツアー初勝利を目指す植竹希望が6バーディー、1ボギーの67と伸ばし、通算10アンダー、134で初日の3位から単独首位に立った。1打差の2位は前週ツアー初優勝の西郷真央。ボギーなしの6バーディーで66をマークし、12位から浮上した。さらに1打差の3位は堀琴音。初日トップの西木裕紀子は通算6アンダーで5位に後退、昨年優勝の稲見萌寧は3アンダーで26位。通算1アンダーまでの53人が決勝ラウンドに進んだ。（出場108選手=アマ4、晴れ、18.2度、南の風2.9メートル、観衆1621人）〔共同〕,スポーツ,植竹希望が首位浮上　明治安田女子ゴルフ第2日,https://www.nikkei.com/article/DGXZQOKC123550S2A310C2000000/
