11/11/2021,【バンコク=村松洋兵】タイの憲法裁判所は10日、王室改革を主張した反体制デモ隊の学生や弁護士ら3人に対し憲法違反であるとの判決を下した。国王を元首とする立憲君主制の転覆を企てたと認定し、王室改革に関する活動の禁止を命じた。デモ隊が反発を強める可能性がある。3人はデモ隊のリーダー格で2020年8月以降に集会などで国王の権限縮小や、王室への侮辱を罰する不敬罪の廃止を主張していた。地元メディアによると今回の判決による刑罰はないが、今後、最高刑が死刑である国家反逆罪で訴追される可能性がある。3人は既に最高で禁錮15年の不敬罪でも起訴されている。タイでは絶対的な権威を持つ王室への批判は、長らくタブーとされたきた。20年に盛んになった反体制デモは当初、軍政の流れをくむプラユット政権の退陣を主に求めていたが、軍と密接な関係にある王室の改革に要求を広げた。プラユット政権は20年11月から不敬罪を用いて厳しい取り締まりを開始した。,東南アジア,タイ、王室改革要求は「違憲」　学生らに活動禁止命令,https://www.nikkei.com/article/DGXZQOGS10DR30Q1A111C2000000/
11/11/2021,第2次岸田内閣が10日、皇居での首相親任式と閣僚認証式を経て発足した。外相に林芳正元文部科学相を起用し、ほかの閣僚は第1次内閣から再任した。歳出規模30兆円超を見込む経済対策を19日に決める。衆院選で政権基盤を固めた岸田文雄首相が持続的な成長への道筋を示せるのか、政策の実効性が問われる。首相は10日召集の特別国会で第101代首相に選出された。同日夜に首相官邸で記者会見し、経済対策を裏付ける2021年度補正予算案を巡り「年内のできるだけ早期に成立させ、国民に一刻も早く届ける」と述べた。新型コロナウイルス対応、経済政策、外交・安全保障を列挙して「スピード感を政策実行に発揮すべく全力を挙げる」と強調した。「成長のための投資と改革を大胆に進める」とも宣言した。18歳以下の子どもを対象にした給付を表明した。非正規雇用など経済的な困窮世帯やコロナ禍で苦しむ学生には10万円を支給する方針を示した。事業者には持続化給付金並みの支援を11月から22年3月までの5カ月分まとめて給付する。「人への投資を抜本的に強化するための3年間の政策パッケージを設ける」と掲げた。働き手のデジタルなどのスキル習得を後押しする。賃上げした企業への優遇税制の拡充を打ち出した。月内に開く新しい資本主義実現会議で22年の春季労使交渉に向けた賃上げ議論を始める。「労使の代表と向き合い賃上げを促す」とも話した。21年度補正予算案は12月に開く臨時国会での成立を想定する。一般会計の追加歳出は30兆円を超える見通しだ。年内に22年度予算案も編成する。自民、公明両党は10日、18歳以下への10万円相当の給付に所得制限を設けると合意した。主に収入を得ている人が年収960万円未満の世帯に限る。先行して現金5万円、来春をめどに5万円を原則クーポンで配る。対象世帯の多くで申請手続きが要らない「プッシュ型」で給付する。児童手当の仕組みを使って所得を把握し、登録した口座に振り込む。マイナンバーカードの保有者に最大2万円分を付与するポイント制度も始める。カードの新規作成で5000円分を上限にキャッシュレス決済のうち一定割合を還元する。健康保険証としての利用、銀行口座とのひもづけで各7500円分を付ける。給付などの刺激策は効果が一時的だとの見方がある。単なるバラマキで終わらせないためにも、コロナ禍のあとを見据えた中長期的な成長への具体策が欠かせない。10月4日に誕生した第1次内閣は事実上の選挙管理内閣だった。衆院選で自民党は単独で絶対安定多数を確保した。外相の林氏は岸田派に所属する。第1次内閣で外相だった茂木敏充氏は衆院選後に自民党幹事長に転じ、首相が11月4日から兼務していた。首相補佐官は新設の国際人権問題担当を中谷元・元防衛相が担う。女性活躍担当は森雅子元法相が務める。自民、公明両党は1日に連立政権を継続する合意を結んだ。「選挙戦を通じて寄せられた民意を深く胸に刻み、コロナ禍から国民の命と健康、雇用と暮らしを守るとともに一日も早い日本の再生に向け全力で取り組む」と記した。首相が議長を務める「新しい資本主義実現会議」は8日にまとめた緊急提言で、成長と分配の両面で当面取り組む施策を掲げた。9日には公的価格評価検討委員会を立ち上げた。看護や介護、保育などの従事者の賃上げを優先課題に据える。新型コロナを巡っては12日に「第6波」に備える対策の全体像を公表する。無料でPCR検査を受けられる環境を整える。コロナ治療の飲み薬は年内の実用化をめざす。与党は10月の衆院選で勝ったものの、小選挙区での接戦が目立った。22年夏には参院選が控える。32の1人区が勝敗を左右する。新型コロナの感染が再拡大したり、経済の回復が鈍ければ、接戦区で野党に勢いが出る可能性もある。首相は経済対策やコロナへの対処で具体的な成果づくりを急ぐ。首相は12年の第2次安倍政権の発足から4年7カ月にわたって外相だった。外交・安保にも力点を置く。記者会見で早期の日米首脳会談の実現に触れた。「年内を含めできるだけ早く米国を訪問し、日米同盟のさらなる強化、『自由で開かれたインド太平洋』の実現に向け連携していく」と主張した。国家安全保障戦略の改定に向け、国家安保会議で「徹底的に議論する」と述べた。ミサイル防衛能力の向上や宇宙やサイバーといった戦闘の新領域に言及し「防衛力の強化に取り組む」と訴えた。【関連記事】閣僚の兼務・担当 財務相＝デフレ脱却▽文科相＝教育再生▽経産相＝産業競争力、ロシア経済分野協力、原子力経済被害、原子力損害賠償・廃炉等支援機構▽国交相＝水循環政策▽環境相＝原子力防災▽官房長官＝沖縄基地負担軽減▽復興相＝福島原発事故再生総括▽二之湯特命相＝国土強靱化、領土問題、国家公務員制度、海洋政策▽野田特命相＝男女共同参画、女性活躍、こども政策、孤独・孤立対策▽山際特命相＝新しい資本主義、新型コロナ対策・健康危機管理、全世代型社会保障改革▽小林特命相＝宇宙政策▽若宮特命相＝デジタル田園都市国家構想、共生社会、消費者・食品安全、クールジャパン戦略、知的財産戦略官房副長官 ・〈政務 衆〉 木原　誠二 （51）  ・〈政務 参〉 磯崎　仁彦 （64）  ・〈事務〉   栗生　俊一 （62）法制局長官 ・近藤　正春 （65）,岸田新政権,成長へ「早期に経済対策」　第2次岸田内閣が発足,https://www.nikkei.com/article/DGXZQOUA093GB0Z01C21A1000000/
11/11/2021,ロッテ・石川とのしびれるような投手戦を制し、オリックス・山本が1-0の完封勝利を飾った。お立ち台では「（初回の）1点を守り切ろうと思って投げていたが、途中、もう少し点がほしいと思った」と本音を明かしてファンの笑いを誘った。ポストシーズン初登板の緊張もあったのだろうか。四回まで毎回安打を浴びる苦しいマウンドだった。そこで見せたのは力技ではなく、巧みな投球術。「打者の目先を変えられる球」だという13...,スポーツ,オリックス・山本、圧巻　カーブ巧みに無四球完封,https://www.nikkei.com/article/DGXZQODH10CKT0Q1A111C2000000/
11/11/2021,プロ入り後、最長七回までしか投げたことがないヤクルト・奥川が九回のマウンドに上がった。「八回のマウンドに上がったとき、これは九回まで行くんだと。ここまで来たら完封してやるぞ」。2死二塁で巨人のウィーラーを中飛に打ち取ると、重圧から解放された20歳の笑顔がはじけた。「初戦を投げると言われたのはすごく前。その時からすごく緊張していた」と奥川。その言葉とは裏腹に、マウンド上では堂々とした投球を披露した...,スポーツ,ヤクルト奥川、大役果たす　98球でプロ初完封,https://www.nikkei.com/article/DGXZQODH10CRT0Q1A111C2000000/
11/11/2021,岸田文雄首相は10日の記者会見で、年内を含め早期に米国を訪問してバイデン米大統領との対面での会談に意欲を示した。「日米同盟のさらなる強化、『自由で開かれたインド太平洋』の実現に向け、連携していく」と主張した。東南アジア諸国連合（ASEAN）や欧州の首脳と電話協議などで「普遍的価値を共有するパートナーとの関係強化に取り組む」と語った。中国やロシアとの関係は「主張すべきは主張し、...,岸田新政権,首相「年内含め早期に訪米」,https://www.nikkei.com/article/DGXZQOUA10DB10Q1A111C2000000/
11/11/2021,【ワシントン=大越匡洋】米労働省が10日発表した10月の消費者物価指数（CPI、1982～84年=100）の上昇率は前年同月比6.2%と9月の5.4%から加速した。上昇幅は1990年11月以来約31年ぶりに6%台に達し、6カ月連続で5%以上の伸びが続いた。モノや人手の不足という供給制約に加え、ガソリンや食品など幅広い分野で値上がりが目立つ。賃金の上昇など物価を長く押し上げる要因も広がっている。...,経済,米消費者物価、31年ぶり6%台に　10月6.2%上昇　,https://www.nikkei.com/article/DGXZQOGN09D1K0Z01C21A1000000/
11/11/2021,外国人技能実習生の受け入れ窓口となる「監理団体」大手が10月、特定企業への5億9千万円に上る支出を巡って内閣府から2度目の勧告を受けた。国内外からの批判を受け、人権面などの是正を目指した技能実習法の施行から11月で4年。実習先企業の〝お目付け役〟で明らかになった規範意識の欠如は、制度への不信を一段と強めかねない。「公益認定の取り消しに至りうる重大な問題だ」内閣府は10月25日、技能実習生の就労...,外国人「共生」の実相,技能実習「監視役」自覚薄く　特定企業優遇し5億円支出,https://www.nikkei.com/article/DGXZQOUE090MO0Z00C21A9000000/
11/11/2021,政府は国内にある半導体工場の刷新などを支援する新たな補助金をつくる。多くの工場が老朽化してきたため、最新の製造装置の導入や防火対策の費用の一部を補助する。台湾積体電路製造（TSMC）が熊本県に建てる先端半導体の工場などへの補助金とは別に、汎用的な半導体の既存工場の改修も支援して国内の生産能力を確保する。2021年度補正予算案に計上する。政府・与党で金額を協議しており、経済産業省は数千億円を求めて...,税・予算,半導体補助金、既存工場にも　安定供給へ設備更新支援,https://www.nikkei.com/article/DGXZQOUA086QZ0Y1A101C2000000/
