02/09/2022,2022年の春季労使交渉がたけなわだ。関心はやはり、岸田文雄首相が「3%以上」を求める賃上げの行方だ。しかし議論を見るにつけ疑問に思うのは「人はコストである」ことが、どこか前提にある点だ。人は本当に単なるコストか。確かに企業会計上は販管費、売上原価など費用の部類に入る。貸借対照表には資産にも資本にも人の価値があまり表れることがない。とはいえ、労使の対話がコストの話だけで終わって良いわけではない...,中山 淳史,エーザイの「人財計算式」　人の価値を見える化する,https://www.nikkei.com/article/DGXZQOCD063VU0W2A200C2000000/
02/09/2022,9日朝方の国内商品先物市場で、原油は続落して取引を始めた。取引量が多い7月物は1キロリットル6万370円と前日の清算値に比べ880円安い水準で寄り付いた。8日のニューヨーク市場で原油先物が下落し、国内原油の売りにも波及した。イラン核合意の復活に向けた協議が8日に正式に再開し、同国産原油の供給が増えるとの思惑から売りが優勢となった。米国務省が4日に議会に対してイラン関連制裁の適用除外の一部復活を通...,商品概況,商品9時30分　原油が続落、イラン核合意の協議再開で　金は高い,https://www.nikkei.com/article/DGXZASQ7IAB01_Z00C22A2000000/
02/09/2022,9日前場寄り付きの東京株式市場で日経平均株価は続伸で始まり、前日に比べ200円ほど高い2万7400円台後半で推移している。一時250円ほど高い2万7500円台半ばまで上げた。前日の米国株式相場が上昇したのを受けて、東京市場でも運用リスクをとる動きが先行している。前日の米株式市場では主要株価指数がそろって上昇した。米長期金利の上昇を受けて利ざや拡大期待で金融株が買われたほか、ハイテク株の一角にも堅調な業績を材料視した買いが入った。米国株高が東京市場で投資家心理を上向かせている。国内で発表が本格化している決算を手掛かりにした個別銘柄の物色も相場の支えだ。8日に2022年3月期の純利益予想を引き上げたJFEや住友鉱、日産自などに買いが入っている。一方で日経平均が2万7500円を上回ると利益確定売りも出ている。国内では新型コロナウイルスの感染者数が依然として高水準で推移し、大阪府は8日に「医療非常事態宣言」を発出した。感染の急拡大に歯止めがかからなければ、経済活動への影響も再び意識されてくる。JPX日経インデックス400と東証株価指数（TOPIX）は続伸している。8日に決算と英アームの売却中止を発表したソフトバンクグループ（SBG）が上昇。オリンパスやシャープが高い。IHIやAGCも買われている。半面、出光興産やENEOS、INPEXが下落している。〔日経QUICKニュース（NQN）〕,マーケット,日経平均続伸、一時200円超上昇　ソフトバンクGが高い,https://www.nikkei.com/article/DGXZQOUB00003_Z00C22A2000000/
02/09/2022,9日前場寄り付きの東京株式市場で日経平均株価は続伸で始まり、前日に比べ200円ほど高い2万7400円台後半で推移している。一時250円ほど高い2万7500円台半ばまで上げた。前日の米国株式相場が上昇したのを受けて、東京市場でも運用リスクをとる動きが先行している。前日の米株式市場では主要株価指数がそろって上昇した。米長期金利の上昇を受けて利ざや拡大期待で金融株が買われたほか、ハイテク株の一角にも堅調な業績を材料視した買いが入った。米国株高が東京市場で投資家心理を上向かせている。国内で発表が本格化している決算を手掛かりにした個別銘柄の物色も相場の支えだ。8日に2022年3月期の純利益予想を引き上げたJFEや住友鉱、日産自などに買いが入っている。一方で日経平均が2万7500円を上回ると利益確定売りも出ている。国内では新型コロナウイルスの感染者数が依然として高水準で推移し、大阪府は8日に「医療非常事態宣言」を発出した。感染の急拡大に歯止めがかからなければ、経済活動への影響も再び意識されてくる。JPX日経インデックス400と東証株価指数（TOPIX）は続伸している。8日に決算と英アームの売却中止を発表したソフトバンクグループ（SBG）が上昇。オリンパスやシャープが高い。IHIやAGCも買われている。半面、出光興産やENEOS、INPEXが下落している。〔日経QUICKニュース（NQN）〕,国内株概況,東証寄り付き　続伸、一時200円超上昇　ソフトバンクGなど高い,https://www.nikkei.com/article/DGXZASS0ISS11_Z00C22A2000000/
02/09/2022,9日の東京株式市場で日経平均株価は続伸して始まった。始値は前日比204円13銭高の2万7488円65銭。前日の米株式市場で主要な株価指数がそろって上昇しており、東京市場でも運用リスクをとる動きが先行している。〔日経QUICKニュース（NQN）〕,国内株概況,日経平均、続伸で始まる　米国株高が支え,https://www.nikkei.com/article/DGXZASFL09HHU_Z00C22A2000000/
02/09/2022,文部科学省は9日までに、新型コロナウイルス感染者の濃厚接触者となった無症状の受験生について、行政検査を受けなくても抗原検査キットで陰性が確認できれば試験会場へのタクシー移動を認めると発表した。中高や大学の入試に適用し、全国の大学や都道府県教育委員会などに通知した。これまでは、マイカーが使えない場合にタクシー利用を認めていたが、行政検査での陰性が条件だった。各地で保健所業務が逼迫しているため、行政検査の条件を緩和する。受験生にはタクシー会社への予約を義務付け、検査を受けられない事情を説明し、他の客と乗り合わせないよう求める。また、高校の体育学科や美術学科などの入試に関し、1回の実技試験のみで合否を決めるケースがあるとして、感染者らの受験機会を確保するために追試や書類選考も設けるよう、教育委員会などに要請した。〔共同〕,新型コロナ,濃厚接触者の入試、行政検査なしのタクシー利用可能に,https://www.nikkei.com/article/DGXZQOUF090I20Z00C22A2000000/
02/09/2022,日銀が9日発表した1月のマネーストック（通貨供給量）速報によると、代表的な指数のひとつである「M3（現金、銀行などの預金）」の月中平均残高は前年同月比3.3%増の1534兆5000億...,,1月のマネーストック、「M3」は前年比3.3%増　「M2」は3.6%増,https://www.nikkei.com/article/DGXZASFL08HDP_Y2A200C2000000/
