12/04/2021,本格的な冬の到来を感じる11月下旬、夜は街の明かりにホッとするようになった。大阪のシンボルストリート、御堂筋では3日から毎年恒例の「御堂筋イルミネーション」が年末まで開催され、訪れた人々が写真撮影に興じている。この冬の電力需給は過去10年で最も厳しい見通しだが、光の饗宴（きょうえん）にかかる電気代はどのくらいになるのだろうか。同イルミネーションは2009年、淀屋橋―本町間の約1.2㌔㍍から始まっ...,関西タイムライン,ギネス記録を持つ御堂筋イルミネーション、電気代は？,https://www.nikkei.com/article/DGXZQOUF082UU0Y1A101C2000000/
12/04/2021,約1万年にわたって人類の胃袋を支えてきた家畜に感謝の言葉を述べる日が近づいているのかもしれない。イスラエルのスタートアップが牛の細胞を培養してつくった牛肉の販売を2022年に始める。日米企業も取り組む。家畜に頼る食文化は転換点を迎える。イスラエルのフューチャー・ミート・テクノロジーズは6月、食肉を出荷する工場を立ち上げた。家畜は見当たらない。創設者でヘブライ大学教授のヤコブ・ナーミアス最高科学責...,コラム,食文化に培養肉革命　家畜にこれまでを感謝する日,https://www.nikkei.com/article/DGXZQOUF069ZX0W1A800C2000000/
12/04/2021,「人生100年時代」の働き方をどう設計するかは、企業を支えているミドル・シニア社員にとってすでに目の前にある現実的な課題だ。20～30代の若手にとっては、この先70～80年もの長い時間を生き抜くという人類が経験したことのない未来が待っている。人生100年は単純に「長寿を享受できる」というものではない。重要になるのが100年にわたる人生やその礎となる仕事の戦略転換だ。厚生労働...,日経産業新聞,80歳まで働く極意　脱・会社任せへ「変身資産」蓄積,https://www.nikkei.com/article/DGXZQOUC3014L0Q1A830C2000000/
12/04/2021,「伝説のコンサルタント」と称された一倉定が舌鋒（ぜっぽう）鋭く教える原価管理は、低成長時代に入った21世紀の今、強い危機感をもって求められている。その一倉による最初の書籍「あなたの会社は原価計算で損をする」の復刻版から、内容の一部をお届けする。◇　　◇　　◇鶏は因果な動物である。やっと2、3歩しか歩けない囲いの中で、ただ人間に供給するためにのみ卵を生み続け、しかも、卵の生み方が少ないと、容赦...,スキルアップ塾,どの製品を残すべきか　原価計算で陥る経営の悪夢,https://www.nikkei.com/article/DGXZQOUC247EX0U1A121C2000000/
12/04/2021,工場などからの廃水処理を手がけるHALVOホールディングス（東京・中央）が、ペットボトルなどの容器に入れて振るだけで水を浄化できる錠剤を開発した。泥水でも10～30秒程度で簡単に飲める状態にでき、災害時の安全な水の確保や途上国での活用を視野に入れる。錠剤の売り上げに応じた浄水剤をインドの学校に送る活動も行う。不純物を固めて除去浄水剤の名前は「WATAB（ウォータブ）」。1錠で泥水は500ミリリ...,日経産業新聞,HALVO、錠剤1錠で泥水を飲料用に浄化　途上国支援,https://www.nikkei.com/article/DGXZQOUC221910S1A121C2000000/
12/04/2021,新潟県三条市に本社を置くアウトドア用品のスノーピークが急成長している。米アップルも頼る地場工場の燕三条と連携して製品力を高め、高価格帯の商品でも値引きなく売り切る。苦境の小売業界で大幅増益を続け、時価総額は1000億円を突破した。地場の力でキャンプ業界にゲームチェンジをしかけるスノーピークの強さに迫る。11月中旬、記者は燕三条地域のスノーピーク本社にある広大なキャンプ場を訪れた。平日にもかかわらずキャンパー...,日経産業新聞,スノーピーク値引きしない訳　ものづくり「燕三条」品質,https://www.nikkei.com/article/DGXZQOUC19AKY0Z11C21A1000000/
12/04/2021,いつ、どこに、どんな属性の人たちが集まっているのかを把握できる人流データ。コロナ禍で繁華街などの人出をコロナ前と比べるデータとして認知されたが、マーケティングに利用する動きも広がっている。消費者分析ができる上に、リアルとデジタルを連動させた取り組みも可能になるとして、幅広い企業がデータ活用の流れに乗ろうとしている。【関連記事】JR山手線の車内モニターでよく見かける広告が、スマート...,日経MJ,今・そこにいる情報をいかせ　人流データマーケティング,https://www.nikkei.com/article/DGXZQOUC178540X11C21A1000000/
12/04/2021,サツマイモに甘みを増した新顔が登場した。農業・食品産業技術総合研究機構（農研機構、茨城県つくば市）が新品種を開発した。収穫したそのままの状態で甘みが強く、糖分を高めるための長期の貯蔵をせずにすむのが特徴だ。新品種は同機構が約10年をかけて開発した。焼き芋や干し芋で人気の「べにはるか」や「ベニアズマ」よりも糖分を多くを含み、収穫時期も1カ月程度早い。長期貯蔵をしなくても甘い芋を8月（葉月）から出荷...,サービス・食品,サツマイモに甘い新顔　あまはづき、収穫時から糖分多く,https://www.nikkei.com/article/DGXZQOUC128OH0S1A111C2000000/
12/04/2021,情報科学の力で材料開発を加速する「マテリアルズ・インフォマティクス（MI）」という研究手法がある。物質・材料研究機構（茨城県つくば市）は化学会社と共同で作った材料データベースを活用し、MIを駆使して新材料を高精度で予測するプロジェクトを進めている。MIは材料の組成や加工プロセスの情報をもとに、機械学習を使い材料の物性を予測する。これまでにない新材料の開発などにつなげようと、世界の素材メーカーが研...,滝 順一,共有データもとに新材料開発　情報科学でライバル協力,https://www.nikkei.com/article/DGXZQOCD242DT0U1A121C2000000/
12/04/2021,【ワシントン=長沼亜紀】米商務省が3日発表した10月の製造業新規受注額（季節調整済み）は5221億ドル（約59兆円）で、前月比1.0%増加した。6カ月連続の増加で、ダウ・ジョーンズまとめの市場予測（0.4%増程度）を上回った。耐久財が0.4%減ったが、非耐久財が2.4%増え、全体はプラスとなった。全体から変動の激しい輸送関係を除いた場合と、同様の変動の激しい国防関連を除いた場合は、いずれも1.6%の増加だった。,北米,10月の米製造業受注、1.0%増　非耐久財が大幅伸び,https://www.nikkei.com/article/DGXZQOGN03E2V0T01C21A2000000/
12/04/2021,【NQNロンドン】3日の欧州国債市場で、指標銘柄である独連邦債10年物の利回りは英国時間16時時点で、前日の同時点に比べ0.011%高いマイナス0.367%で取引されている。,,欧州国債概況3日　独連邦債利回り　マイナス0.367%に上昇,https://www.nikkei.com/article/DGXZASH2IILB2_T01C21A2000000/
12/04/2021,【NQNロンドン】3日のロンドン外国為替市場で英ポンドは対ドルで続落した。英国時間16時時点では、前日の同時点と比べて0.0090ドルのポンド安・ドル高の1ポンド=1.3210～20ドルだった。11月の米雇用統計が午後に発表された後に一時ポンド高・ドル安に転じる場面もあったが、ポンド売りが徐々に強まった。その後発表された11月の米ISM非製造業景況感指数が市場予想を上回ると、ポンド売り・ドル買いが一段と強まった。ユーロも対ドルで続落した。前日の16時に比べ0.0040ドルのユーロ安・ドル高の1ユーロ=1.1270～80ドルだった。複数の米経済指標の発表後にユーロ売り・ドル買いが強まった。円は対ドルで下落した。前日の16時と比べて30銭円安・ドル高の1ドル=113円20～30銭だった。終日、円安水準で推移した。円の対ユーロ相場は小幅に続伸した。同10銭円高・ユーロ安の1ユーロ=127円70～80銭だった。,為替概況,ロンドン外為3日　ポンドとユーロ、ともに続落,https://www.nikkei.com/article/DGXZASH2IILM3_T01C21A2000000/
12/04/2021,【上海=土居倫之】巨額の債務を抱えて経営難に陥っている中国恒大集団は3日、外貨建て債務の再編案をつくるために債権者と協議に入ると発表した。債務の返済について「十分な資金があるかどうか不確定」なためだ。恒大が本社を置く広東省政府は同日夜、恒大に監督チームを派遣すると発表した。中国人民銀行（中央銀行）も同日、広東省政府や関係部門と協力し、問題解決に努めると発表した。今後は広東省政府と人民銀行が経営再建に向けて重要な役割を担うことになる。中国では多額の外貨建て債務を抱えていた海航集団が資金繰り難に陥り、海南省政府が経営に関与する形で企業破産法の手続きのもと、債務再編を進めた。広東省政府は恒大トップの許家印董事局主席と3日夜面談した。恒大の求めに応じる形で、恒大社内に経営監督・指導のためのワーキンググループを派遣することで合意。リスク処理や内部管理体制の強化につなげるという。銀行保険監督管理委員会も「国内外の監督管理部門が法に従って公平公正に処理すると信じる」とのスポークスマンのコメントを公表した。恒大は3日、債権者から2億6000万ドル（約300億円）の保証履行請求通知を受け取ったと発表。恒大は保証を履行できない場合「債権者から返済の繰り上げを要求される可能性がある」という。中国メディアによると対象は米ドル建ての私募債で、債権者からの要請に対応できないと実質的な債務不履行（デフォルト）とみなされる可能性がある。恒大は債務再編案の協議について「公平性と法の原則のもと、すべてのステークホルダー（利害関係者）の利益になる形で再編案を策定するため、積極的に海外債権者と話し合う」としている。詳細は明らかにしていないが、外貨建て債務の返済期限の延長や返済額の削減などを求める可能性がある。ただ海外債権者は国内債権者と同等の返済条件を求める可能性が高く、協議は難航が予想される。【関連記事】,中国・台湾,中国恒大、外貨建て債務再編案を債権者と協議へ,https://www.nikkei.com/article/DGXZQOGM03CRI0T01C21A2000000/
12/04/2021,【ワシントン=長沼亜紀】米サプライマネジメント協会（ISM）が3日発表した11月の非製造業（サービス業）景況感指数は、前月から2.4ポイント上昇の69.1で、過去最高を更新した。需要が極めて強く、サービス業の好調が続いた。ダウ・ジョーンズまとめの市場予測（65程度）を上回った。「企業活動・生産」が74.6で4.8ポイント上昇し過去最高を更新したほか、「新規受注」は、過去最高だった前月から横ばいの69.7だった。企業は「需要は記録的に強い」「供給網への不安から、顧客は『ジャスト・イン・タイム』ではなく念のために注文している」などとコメントした。強い需要に対し、供給面の制約も続いた。「入荷遅延」は75.7で前月と変わらず過去2番目の高さとなった。企業は在庫補充に苦戦しており、在庫量が適正と感じているかどうかを示す「在庫景況感」は36.4で0.9ポイント低下した。需要と供給の不均衡により物価上昇が続き、「価格」は82.3でわずかに低下したものの依然高かった。,北米,11月の米非製造業景況感、過去最高を更新,https://www.nikkei.com/article/DGXZQOGN03DVU0T01C21A2000000/
12/04/2021,【ワシントン=坂口幸裕】バイデン米大統領は3日、旧日本軍に奇襲を受けた真珠湾攻撃から80年を迎える7日を前に声明を出した。日本を念頭に「かつての敵国を同盟国に変えた国際システムの基礎を築いた偉大なる世代に感謝する」と記した。攻撃で死傷した米国人について「犠牲になった愛国者に敬意を表し、わが国を守ったすべての人々を追悼する」と強調した。「平和と和解を実現して世界によりよい未来をもたらすと再確認する。80年前に全力を尽くしたすべての人々に永遠の恩義を感じる」と訴えた。声明では「1941年12月7日、日本海軍はハワイの真珠湾などで米軍を攻撃し、2403人の兵士と民間人の命を奪い、米国は第2次世界大戦への参戦を宣言した」と振り返った。「この日は80年たった今でも悪名高い日になっている」と指摘した。真珠湾攻撃から75年となった2016年12月には当時の安倍晋三首相とオバマ米大統領が日米開戦の地となった米ハワイの真珠湾を訪れた。犠牲者を慰霊するアリゾナ記念館にともに足を運び、現在の強固な同盟関係を築いた日米の「和解」を演出した。16年5月にオバマ氏が現職米大統領として初めて広島を訪れたことが安倍氏の真珠湾訪問につながった。,北米,米大統領「かつての敵国、同盟国に」　真珠湾攻撃80年で,https://www.nikkei.com/article/DGXZQOGN03E0E0T01C21A2000000/
12/04/2021,【イスタンブール=木寺もも子】サウジアラビアへの批判が物議をかもしていたレバノンのコルダヒ情報相が3日、辞任した。同氏の発言に反発したサウジなど湾岸諸国は輸入を停止したり外交官を引き上げたりしていた。レバノンの旧宗主国フランスの働きかけがあったもようで、約1カ月続いた外交危機の正常化が期待される。コルダヒ氏は今夏、テレビのインタビューでサウジアラビアが主導するイエメン内戦への介入を「無益だ」などと批判した。情報相就任後の10月下旬、発言が問題視され、サウジやアラブ首長国連邦（UAE）、バーレーン、クウェートが相次いで対抗措置を発動した。レバノンのミカティ首相らはコルダヒ氏に事実上の辞任勧告をしたが、同氏はポストにとどまる考えを示していた。レバノンは経済危機のさなかで、サウジなどからの援助は命綱として期待されている。コルダヒ氏は3日の記者会見で自身の辞任について「（サウジなどとの）関係改善の扉を開くことを望む」と述べた。マクロン仏大統領が3日からサウジ、UAEなど湾岸諸国を歴訪することに触れ、フランスが仲介の条件として自身の辞任を求めていたとも明らかにした。マクロン氏は3日、訪問先のUAEで「今後数時間で事態を進展させられることを望む」と述べた。レバノンは複数の宗教・宗派が共存するモザイク国家で、外国勢力の綱引きの場となっている。コルダヒ氏自身はキリスト教徒だが、親イランのシーア派組織ヒズボラと近い関係にある。イエメンもイランとサウジの代理戦争の場となっており、ヒズボラはコルダヒ氏の発言を称賛していた。,ヨーロッパ,レバノン情報相が辞任　サウジ批判、外交危機の収束期待,https://www.nikkei.com/article/DGXZQOGR03DNM0T01C21A2000000/
12/04/2021,【リレハンメル=共同】ノルディックスキーのワールドカップ（W杯）複合女子は3日、リレハンメルで個人第1戦が行われ、昨季の世界選手権4位で21歳の中村安寿（東海大）は11位だった。前半飛躍（ヒルサイズ=HS98メートル）で75.5メートルの14位にとどまり、後半距離（5キロ）で順位を上げたが、上位争いには絡めなかった。17歳の葛西優奈（北海道・東海大札幌高）は13位。22歳でW杯初出場の沢谷亜海（サッポロノルディックク）は23位だった。19歳のイダ・ベスボルハンセン（ノルウェー）が優勝した。,スポーツ,中村11位、葛西優13位　スキーW杯複合女子,https://www.nikkei.com/article/DGXZQOKC03DQN0T01C21A2000000/
12/04/2021,【NQNニューヨーク=張間正義】3日の米株式市場でダウ工業株30種平均は続伸して始まった。午前9時35分時点は前日比97ドル28セント高の3万4737ドル07セントで推移している。取引開始前に発表された11月の米雇用統計では雇用者数の増加幅が市場予想を下回った。平均時給の伸び率が鈍化するなど、米連邦準備理事会（FRB）の早期の金融引き締めへの警戒がやや薄れたとの見方から買いが入っている。雇用統計で景気動向を映す非農業部門雇用者数は前月比21万人増と市場予想（57万3000人増）を下回った。労働参加率は小幅に上昇した一方、平均時給の伸び率は鈍化した。相対的に賃金水準の低い労働者の増加を示唆する内容で、賃金上昇率の鈍化が続けば「FRBに対する早期の引き締め圧力を和らげるだろう」（BMOキャピタル）との見方があった。一方、失業率は4.2%と10月（4.6%）から低下し、市場予想（4.5%）も下回った。強弱感が混在する結果で、市場の評価も分かれている。株式相場の上値は重い。米国でも新型コロナウイルスの変異型「オミクロン型」の感染者が相次ぎ確認されている。米IT大手が社員に出社の再開を求める時期を延期するなど、年末年始にかけ行動制限の動きが強まるとの懸念は投資家心理の重荷となっている。米原油先物相場が上昇し、シェブロンなど石油株が高い。半導体のインテルとソフトウエアのマイクロソフトも上昇している。一方、前日に大幅に上昇した航空機のボーイングは反落している。米国市場での上場を廃止すると3日に発表した中国の配車アプリ最大手の滴滴出行（ディディ）は急落して始まった。,北米,NYダウ続伸で始まる　11月雇用統計、強弱感が混在,https://www.nikkei.com/article/DGXZQOGN00033_T01C21A2000000/
