04/30/2022,【ワシントン=長沼亜紀】米労働省が29日発表した1～3月期の雇用コスト指数は、季節調整済みの前期比で1.4%上昇した。2021年10～12月の1.0%から0.4ポイント高まり、2001年の統計開始以来最高の伸びとなった。労働市場の逼迫で人件費の強い伸びが続いた。伸び率はダウ・ジョーンズまとめの市場予測（1.1%程度）を上回った。前年同期比では4.5%上昇した。雇用コストの約7割を占める賃金・給与が前期比1.2%上昇した。残る約3割を占める福利厚生は1.8%上昇し、前期（0.9%）から急激に伸びた。労働需要が強く、企業は人材確保のために賃上げや福利厚生の積み増しを迫られている。米連邦準備理事会（FRB）の地区連銀経済報告（ベージュブック）では、「需要の強い分野では極端な賃上げが起き、賃金を2割以上引き上げた企業もある」（ニューヨーク連銀）、「倉庫スタッフの初任時給が時給18ドル（約2300円）に達したほか、企業は勤続賞与や賃金以外の福利を増やしている」（ボストン連銀）との報告が相次いだ。企業は、雇用コストの上昇分を顧客・消費者に転嫁しており、一段の物価押し上げにつながっている。3月の消費者物価指数は8.5%上昇と約40年ぶりの高水準となった。アマースト・ピアポント証券のエコノミストは「新型コロナウイルスの流行が落ち着き足元で労働参加率が上がり始めているが、労働市場はかつてないほど逼迫しており、当面緩和は期待できない」との見方を示した。,北米,1~3月の米雇用コスト、1.4%上昇　過去最高の伸び,https://www.nikkei.com/article/DGXZQOGN2943C0Z20C22A4000000/
04/30/2022,【NQNロンドン=菊池亜矢】29日の欧州国債市場で、指標銘柄であるドイツ連邦債10年物の利回りは英国時間16時時点で、前日の同時点に比べ0.004%高い（価格は安い）0.910%で取引されている。同日発表の4月のユーロ圏消費者物価指数は前年同月比7.5%上昇と、前月から伸び率を拡大した。エネルギーや食料品など変動の大きい項目を除いたコア指数も3.5%上昇と前月から加速し、物価上昇の勢いが強まっている。欧州中央銀行（ECB）が景気よりインフレ対策を優先し金融政策の正常化を進めるとの見方から、ドイツ国債には売りが出た。英国の10年債利回りは低下し、英国時間16時時点は、前日の同時点より0.004%低い1.875%で推移している。,,欧州国債概況29日　独10年債利回りが上昇　消費者物価の上昇で,https://www.nikkei.com/article/DGXZASH2IILB2_Z20C22A4000000/
04/30/2022,遭難した観光船「KAZU　Ⅰ（カズワン）」が29日、水深約120メートルの海底で見つかった。家族らは、運航会社から出航に関する説明などを受けている際に一報を聞いた。報告を受けた家族らからは「一刻も早く（船体を）引き揚げてほしい」との声が多く上がった。29日午前、現地対策本部がある斜里町ウトロ支所で運航会社「知床遊覧船」（斜里町）の桂田精一社長が家族に説明をしている最中に海保担当者が割って入った。家族ら30人に、船名がカメラで読み取れたなど発見時の状況が伝えられた。桂田社長は3日連続で説明会を開いたが、詳細を知りたい家族側との隔たりは大きい。救助訓練の写真を添付した資料を作ってきたが、回数や実施した日付を答えられない場面もあった。夕方の説明会前には港を訪れ、所有する別の観光船に自ら乗り込んで何かを探すような姿も見られた。国土交通省の担当者は「まだまだ足りない部分がある」と指摘した。海保は28日に知床半島を挟んで東の羅臼側の海域で新たに成人3人を発見、死亡を確認したと発表。乗員乗客26人のうち、死者は29日までで計14人となった。〔共同〕,社会・調査,「早く引き揚げを」海底で発見の船体　遭難事故の家族ら,https://www.nikkei.com/article/DGXZQOUE292KY0Z20C22A4000000/
04/30/2022,【NQNロンドン=菊池亜矢】29日のロンドン外国為替市場でユーロは対ドルで上昇し、英国時間16時時点は1ユーロ=1.0550～60ドルと前日の同時点より0.0040ドルのユーロ高・ドル安で推移している。週末を前に持ち高調整のユーロ買い・ドル売りが入った。今週は中国の厳格な新型コロナウイルス対策による同国景気の減速が、世界経済の回復鈍化につながるとの懸念からユーロ売り・ドル買いが急ピッチで進んでいた。円は対ユーロで上昇し、英国時間16時時点は1ユーロ=136円70～80銭と、前日の同時点より1円の円高・ユーロ安で推移している。28日に日銀が大規模な金融緩和を継続する姿勢を明確に打ち出したことをきっかけに円が大きく売られた反動で、持ち高調整の円買い・ユーロ売りが入った。英ポンドは対ドルで上昇し、英国時間16時時点は1ポンド=1.2550～60ドルと前日の同時点に比べ0.0120ドルのポンド高・ドル安で推移している。,為替概況,ロンドン外為29日　ユーロ、対ドルで上昇　持ち高調整の買い,https://www.nikkei.com/article/DGXZASH2IILM3_Z20C22A4000000/
04/30/2022,岸田文雄首相とインドネシアのジョコ大統領の会談、共同記者発表の要旨は次の通り。【ウクライナ】両氏　ウクライナへの軍事侵攻は容認できない。国際人道法に反する民間人や施設への攻撃に反対を表明。武力行使の即時停止と対話による事態打開の重要性で一致。世界経済への影響に協力して対応する。人道支援実施で連携。アジアを含むどの地域でも武力行使や威嚇による一方的な現状変更、主権や領土一体性の侵害は認めない。国際法に基づいた平和的解決が必要だ。ジョコ氏　戦争はすぐにやめなければならない。人道危機や経済への影響に各国が協力して対処することを要請。岸田氏　日本の対ロシア制裁を説明。両氏　インドネシアが議長国を務め、プーチン・ロシア大統領が出席意向を示す11月の20カ国・地域首脳会議（G20サミット）への対応について、今後のウクライナ情勢などを見極めながら、緊密に連携する。【地域情勢】岸田氏　東・南シナ海での現状変更の試みや経済的威圧に強く反対する。両氏　北朝鮮の核・ミサイル開発や日本人拉致問題を巡り連携する。岸田氏　自由で開かれた海を守るため、インドネシアと協力する。【2国間関係】岸田氏　インドネシアの港湾整備で円借款約700億円の追加供与を決定。海上保安能力向上支援へ巡視船を提供する調査を始める。来年は、日本と東南アジア諸国連合（ASEAN）の交流開始50周年。日本で開く特別首脳会議の際にジョコ氏を日本に招きたい。ジョコ氏　東京電力福島第1原発事故を受けた日本産食品の輸入規制撤廃に関し、前向きな発言。両氏　エネルギー分野に関する協力で一致。（ジャカルタ共同）〔共同〕,北米,日本・インドネシア、首脳会談と共同記者発表の要旨,https://www.nikkei.com/article/DGXZQOUA294DL0Z20C22A4000000/
04/30/2022,【ジャカルタ=秋山裕之】岸田文雄首相は29日、インドネシアの大統領宮殿でジョコ大統領と90分間会談した。ロシアによるウクライナへの軍事攻撃は容認できないと一致した。首相は会談後に「明白な国際法違反であり、アジアを含む国際秩序の根幹を揺るがすものであって強く非難をする」と強調した。会談後の共同記者発表で首相は「力による一方的な現状変更は認められず、国際法に基づき紛争の平和的解決を求めることを確認した」と強調した。ロシアに武力行使の即時停止と対話による打開を求め、日・インドネシアで世界経済への影響に対処すると合意した。ジョコ氏は共同記者発表で、ロシアを名指しする批判は避けた一方で「戦争はすぐにやめなければならない」と言及した。首相は会談でウクライナや東・南シナ海、北朝鮮を例示し「法の支配に基づく自由で開かれた国際秩序の維持・強化が一層重要」と指摘した。首相は東・南シナ海について「力を背景とした一方的な現状変更の試み、経済的威圧に強く反対する」と説いた。ジョコ氏は「国連海洋法条約を含む法の支配に基づく地域の平和と安定の維持が重要」と語った。インドネシアは2022年の20カ国・地域（G20）の議長国だ。ロシアのプーチン大統領は11月のG20首脳会議に出席する意向がある半面、米欧には異論がある。首相はG20へのロシアの参加について「国際社会はロシアとの関係をこれまで通りにすることはできないと考えている」と指摘した。同時に「首脳会議まで時間がある。情勢を見極めて対応するべく日本とインドネシアで緊密に連携する」と記者団に語った。首相は会談でインドネシアの海上保安能力の向上を支援すると伝えた。会談後の共同記者発表で「巡視船供与に向けた調査を開始する予定だ」と語った。西ジャワ州のパティンバン港開発のための円借款を700億円ほど供与するとも表明した。すでに実施している1200億円程度に追加する。インドネシアの物流を改善して成長を後押しする。首相はインドネシアから日本への石炭などの資源の輸出に謝意を示した。アジアで石炭火力を使う国が多いことを念頭に「日本は各国の実情に応じた脱炭素化、エネルギー移行を支援する」と明言した。脱炭素社会に向けて提唱する「アジア・ゼロエミッション共同体」構想を進めると強調した。,政治,ロシアの軍事攻撃「容認せず」　日インドネシア首脳会談,https://www.nikkei.com/article/DGXZQOUA2946H0Z20C22A4000000/
04/30/2022,【ベルリン=南毅郎、フランクフルト=林英樹】ドイツの検察・金融当局は29日、金融大手ドイツ銀行を家宅捜索した。フランクフルト検察が明らかにした。独DPA通信によると、マネーロンダリング（資金洗浄）対策に関連した報告が遅れたとして本店での捜索に踏み切った。内部管理体制の不備を問題視しているもようだ。銀行監督を担う連邦金融監督庁（BaFin）などとの共同の捜索で、検察庁は「令状に基づき実施した」と...,金融機関,ドイツ銀行を家宅捜索、検察当局　資金洗浄対策に不備か,https://www.nikkei.com/article/DGXZQOGR293LE0Z20C22A4000000/
04/30/2022,【フランクフルト=林英樹】世界中のビール愛好家らが毎秋に集う、ドイツ南部ミュンヘンのビールの祭典「オクトーバーフェスト」が3年ぶりに開催されることが決まった。地元ミュンヘンのディーター・ライター市長が29日明らかにした。新型コロナウイルスの大流行は収束していないものの、重篤化リスクが下がったことなどから無制約での開催を決めた。今年は187回目のオクトーバーフェストとなり、9月17日から10月3...,ヨーロッパ,ドイツ南部のビール祭典、3年ぶりに開催決定　無制約で,https://www.nikkei.com/article/DGXZQOGR293MN0Z20C22A4000000/
04/30/2022,2022年のゴールデンウイーク(GW)が29日始まった。新型コロナウイルスの緊急事態宣言など行動制限が全国的にかからないのは3年ぶりで、街なかの人出や旅行の予約状況は前年を上回る。国内の新規感染者は高止まりしており、事業者も感染対策に神経をとがらせている。JR東京駅近くのはとバス乗り場では29日午前、利用客の列ができた。緊急事態宣言などを受け過去2年のGW期間中のツアーは全て運休だった。埼玉県...,新型コロナ,制限なき連休初日、街なかの人出増　大阪・難波は2.5倍,https://www.nikkei.com/article/DGXZQOCC232930T20C22A4000000/
