05/14/2022,岸田文雄首相は14日、沖縄の日本復帰50年に合わせ、首相就任後初めて沖縄県を訪れた。平和祈念公園（糸満市）で国立沖縄戦没者墓苑に献花する。沖縄戦で動員された全学徒隊の隊名などを刻んだ「全学徒隊の碑」にも足を運ぶ。14日は2019年に火災があった首里城（那覇市）の復元状況を確認し、観光関連の事業者と車座で懇談する。米軍普天間基地（宜野湾市）や沖縄科学技術大学院大学も視察する。15日は宜野湾市で政府と沖縄県が共同で開く「沖縄復帰50周年記念式典」に出席し、式辞を述べる。首相は10日、沖縄訪問に先立ち沖縄県の玉城デニー知事と会談した。普天間基地の名護市辺野古への移設断念や日米地位協定の見直しを求めた建議書を受け取った。首相は「米軍基地の負担軽減に引き続き努力していきたい」と述べた。,沖縄復帰50年,首相、復帰50年の沖縄を訪問　平和祈念公園で献花,https://www.nikkei.com/article/DGXZQOUA13CJT0T10C22A5000000/
05/14/2022,沖縄県が本土に復帰した1972年5月15日の目前、「沖縄人」が抱えていた様々な思いを、50年の節目に追体験してもらう現代劇が上演されている。主催者側は、太平洋戦争の激しい地上戦や米軍統治時代を生き抜いた人々を通じ、今の平和や沖縄の未来について考えるきっかけにしてほしいと願っている。「基地はいらないと胸を張って言いたい」「本当に基地がなくなってもいいのか」「善悪が分からなくなった」――13、1...,社会・調査,沖縄復帰50年　当時の県民の思い、現代劇で追体験,https://www.nikkei.com/article/DGXZQOUE133RF0T10C22A4000000/
05/14/2022,外食業界でサステナビリティー（持続可能性）に配慮したメニューの提供が相次いでいる。焼肉店やファストフードでは各社が代替肉商品の拡充を急ぎ、病院食や社員食堂を受託する給食大手も国際認証を得た食材を使うメニュー開発に動く。消費者の関心の高まりから、外食もESG（環境・社会・企業統治）対応を競う時代に入った。焼肉ライク（東京・渋谷）は今年から、チェーン店の「焼肉ライク」で従来よりたんぱく質の含有量を...,小売り・外食,外食にESGの波、「焼肉ライク」は大豆素材で焼き肉,https://www.nikkei.com/article/DGXZQOUC186DB0Y1A011C2000000/
05/14/2022,5月初めの連休が明けてすぐ、中国でまたタガがはずれた音がした気がした。新型コロナウイルスのゼロコロナ対策で混乱が続くなか、様々な省や市、区で相次ぎ緊急会議が開かれた。中国の習近平（シー・ジンピン）国家主席が5日に共産党最高指導部の会議で演説し「わが国の防疫政策を疑い、否定するあらゆる言動と断固戦う」と厳命したことを受けたものだ。事実上の都市封鎖（ロックダウン）下にある上海市でも急きょ市や区で...,風見鶏,「勝利」しかない専制主義　進む中国の現実離れ,https://www.nikkei.com/article/DGXZQOGM108X40Q2A510C2000000/
05/14/2022,新型コロナウイルスのオミクロン型から派生した新たな変異ウイルスの感染が南アフリカや米国などで広がっている。南アで増える「BA.4」「BA.5」は国内の検疫でも確認された。米国では「BA.2」からさらに派生した「BA.2.12.1」が広がる。感染やワクチンによる免疫をすり抜ける性質が強まっているとの研究報告が複数出てきた。流行が広がる可能性もあり、状況を把握するための検査の徹底が求められる。BA...,新型コロナ,BA.4などオミクロンの新派生型3種、免疫すり抜ける進化,https://www.nikkei.com/article/DGXZQOUC126ML0S2A510C2000000/
05/14/2022,沖縄県が戦後の米国統治下から復帰し、15日で50年を迎える。半世紀で国内有数のリゾート地に発展した半面、ほかの地域との経済格差や米軍基地問題など課題も多い。問題の背景にある復帰の経緯と現状について3つのポイントで解説する。(1)沖縄の「本土復帰」とは太平洋戦争末期に米軍が沖縄各地に上陸し、住民を巻き込...,沖縄復帰50年,沖縄復帰50年　基地問題・所得格差なぜ？,https://www.nikkei.com/article/DGXZQOJC10EJO0Q2A510C2000000/
05/14/2022,ロシアの政府系電力会社、インテルRAOは13日、フィンランドへの送電を14日から停止すると発表した。国際電力取引市場を通して販売した電力代金の支払いが確認できていないためという。フィンランドは12日、北大西洋条約機構（NATO）への加盟を申請する意向を表明しており、この報復の可能性もある。インテルRAOの子会社で、フィンランドに電力を供給するRAOノルディックが13日に発表した。同社は、国際電...,ウクライナ侵攻,ロシア政府系電力会社、フィンランドへの送電を停止,https://www.nikkei.com/article/DGXZQOCB140JY0U2A510C2000000/
05/14/2022,【マッキニー（米テキサス州）=共同】米男子ゴルフのAT&Tバイロン・ネルソンは13日、テキサス州マッキニーのTPCクレイグランチ（パー72）で第2ラウンドが行われ、12位で出た松山英樹は6バーディー、ボギーなしの66と伸ばして通算11アンダー、133で首位と4打差の9位に浮上した。小平智は69で回り、通算4アンダーで1打及ばず予選落ちとなった。セバスティアン・ムニョス（コロンビア）、ライアン・パーマー（米国）、デービッド・スキンズ（英国）の3人が通算15アンダーで首位。,スポーツ,松山英樹9位に浮上　米男子ゴルフ第2日,https://www.nikkei.com/article/DGXZQOKC140TA0U2A510C2000000/
05/14/2022,東京都は14日、同日から予定していた小池百合子知事の中東訪問を延期すると発表した。訪問先の一つであるアラブ首長国連邦（UAE）のハリファ大統領が死去し、現地が服喪期間に入るためだという。小池知事は14～18日にクウェートとUAEのアブダビ首長国を訪問し、新型コロナウイルスのワクチン開発や都立高校の国際交流について現地の関係者と意見交換する予定だった。,東京,小池都知事の中東訪問延期　UAE大統領死去で,https://www.nikkei.com/article/DGXZQOCC140TL0U2A510C2000000/
