05/16/2022,デジタル市場の競争環境を議論する政府の作業部会は16日、巨大IT（情報技術）企業が手がけるインターネット広告の取引状況について、情報開示の義務化を今秋ごろに始めると明らかにした。関連する政省令を改正し、対象企業を決める。通販サイトやアプリストアに続き、巨大ITの規制強化に動く。政府のデジタル市場競争会議（議長・松野博一官房長官）が作業部会を開いた。政府は2021年4月、ネット広告を「デジタルプラットフォーム取引透明化法」の対象に加えると決めていた。同法は一定規模以上の売上高がある企業などに、取引内容の開示と定期報告を求める。政府が評価して内容を公表し、取引の透明性を確保する。,経済,ネット広告の情報開示　今秋にも義務化、政府方針,https://www.nikkei.com/article/DGXZQOUA1648Y0W2A510C2000000/
05/16/2022,北海道大学大学院水産科学研究院（水産科学研究院）と北海道漁業協同組合連合会（北海道ぎょれん）は16日、養殖や水産加工の効率化や人材育成などの分野で連携協定を結んだ。水産科学研究院の都木靖彰研究院長と北海道ぎょれんの安田昌樹代表理事専務が北大の函館キャンパスで協定書に署名した。養殖の技術開発や漁業の効率化などの研究に着手する。都木研究院長は「漁業は水産加工や観光業、地元雇用にも影響を与える。優先順位を付け対処していきたい」と述べた。安田代表理事専務は「水産加工品の流通やカーボンニュートラル（脱炭素）問題でも連携を深める」とした。,北海道,養殖・漁の省人化、北大と道ぎょれんが連携協定締結,https://www.nikkei.com/article/DGXZQOFC166GI0W2A510C2000000/
05/16/2022,【NQN香港=エブリン・チャン】16日の香港株式相場は続伸した。ハンセン指数の終値は前週末比51.44ポイント（0.25%）高の1万9950.21だった。13日の米株高や中国の経済対策への期待が支えとなり、香港市場でもリスク選好姿勢が優勢になった。4月の中国の経済統計が低調な結果だったのは相場の重荷になり、指数は下げに転じる場面もあった。中国電子商取引（EC）最大手のアリババ集団や、ネット検索...,アジア株概況,香港株大引け　続伸、米株高や中国政策期待で　不動産高い,https://www.nikkei.com/article/DGXZASS0IHK03_W2A510C2000000/
05/16/2022,フリマアプリ大手のメルカリは16日、6月16日から配送料の値上げを実施すると発表した。匿名で配送ができるメルカリ独自の配送サービス「メルカリ便」が対象で、価格を改定するのは2020年10月以来3回目。物価上昇などでコストが上がっていることに対応した。6月16日の正午以降に取引された商品から対象となる。同日午前11時59分までに購入した商品は従来価格が適用される。新料金の価格は、ヤマト運輸と連携する「らくらくメルカリ便」の60サイズ（箱の縦・横・高さの合計が60センチメートル以内）であれば、50円増の750円に引き上げる。日本郵便と連携する「ゆうゆうメルカリ便」の同サイズであれば70円増の770円に改定する。21年10月に始めた中小事業者向けの電子商取引（EC）サービス「メルカリShops（ショップス）」の配送料も対象となる。冷凍や冷蔵サービスの60サイズも50円増の970円に改定する。日本の宅配取扱数の1割弱、コンビニ配送の約8割がメルカリの出品物に当たるという。宅配業者に委託している配送価格は明らかにしていないが、同社は「物価上昇などの社会情勢を総合的に鑑みた」と強調する。メルカリは2月に米国でも配送料の値上げを実施した。ただ、配送料の値上げや物価上昇による購入鈍化を背景に、22年1～3月の米国のフリマ事業の流通総額は、2億9900万㌦と前年同期から6%減っていた。【関連記事】,値上げラッシュ,メルカリ、6月から配送料を値上げ　コスト上昇受け,https://www.nikkei.com/article/DGXZQOUC165Y10W2A510C2000000/
05/16/2022,三菱重工業子会社の三菱造船と日本郵船は16日、開発中の液化二酸化炭素（CO2）輸送船について日本海事協会（東京・千代田）から設計に関する基本承認（AIP）を取得したと発表した。船体の構造や状態などを検査・証明する第三者機関から設計の安全性などが認められたことで、開発計画が完成に向け進展する可能性がある。大型と中型の液化CO2輸送船の2船型について、タンクや船体を中心に、技術要件や安...,自動車・機械,三菱造船と日本郵船、液化CO2輸送船で安全性承認を取得,https://www.nikkei.com/article/DGXZQOUC164F60W2A510C2000000/
05/16/2022,ソニーグループ傘下で電気製品を手掛けるソニーはワイヤレスヘッドホンの新製品を27日に発売すると発表した。周囲の雑音を吸音するセンサーを従来機種の2倍にし、搭載プロセッサーも2つにした。高精度にセンサーの信号を制御し、周囲の雑音を軽減する機能をより高めた。商品名は「WH-1000XM5」。雑音を減らして音質を高める役目のプロセッサーに加え、新たに「統合プロセッサーV1」を搭載する。さらにヘッドホンの左右に雑音を吸音するセンサーを4つずつ配置する。2020年8月に発売した従来機種は左右に2つずつだった。USBで電力を送る「USBパワーデリバリー（PD）」に対応し、3分充電するだけで約3時間の音楽再生が可能になる。商品の箱は竹やサトウキビ、市場で回収した古紙を由来に独自に開発した素材「オリジナルブレンドマテリアル」を使う。同素材を使うのはソニーの商品全体でも2つ目という。オーディオの商品は比較的小さいため、コストがかかる新素材も導入しやすいことを踏まえた。全2色を展開する。オープン価格だが、ソニーの想定は5万円前後。【関連記事】,エレクトロニクス,ソニーの新型ヘッドホン、センサー2倍で雑音を低減,https://www.nikkei.com/article/DGXZQOUC1667W0W2A510C2000000/
05/16/2022,政府は環境問題や貧困など、社会的な課題の解決を事業の目的とする新たな会社形態の設立に向けた検討に入る。定款などで社会貢献を担うと明示した企業を認定するといった形を想定する。6月をめどに決める「新しい資本主義」の実現に向けた計画の柱の一つとなる。短期の利益追求への偏りを修正し、公益を担いながら成長する企業を育てる。米国などで法整備が進む「パブリック・ベネフィット・コーポレーション」(PBC）を参...,経済,公益重視の新たな会社形態　政府検討、短期利益偏り修正,https://www.nikkei.com/article/DGXZQOUA162TR0W2A510C2000000/
05/16/2022,宮崎市は16日、市議会全員協議会を開き、新庁舎建設の候補地について現状地とJR宮崎駅周辺の宮崎中央公園内2カ所の計3候補地に絞り込んだことを明らかにした。2022年12月までに複数候補地の比較資料を作成、公表し22年度内に場所を決定する。市の選定理由の説明によると現状地の場合は市有地で敷地面積を確保できるうえ、県庁と距離が近く利便性が高いなどのメリットがある。一方、宮崎中央公園内の2候補地は国有地の取得が必要となるが、一定の市有地があり敷地面積を確保できる。また、解体建物がなく撤去費用を抑制でき、市民サービスへの影響が少ないなどのメリットがあるという。清山知憲市長は記者会見で「秋にはコストや防災などの判断材料を提供したい」と述べた。,宮崎,宮崎市の新庁舎、現状地含め3候補地に　22年度内に決定,https://www.nikkei.com/article/DGXZQOJC1672Q0W2A510C2000000/
05/16/2022,【NQNロンドン=菊池亜矢】16日午前のロンドン外国為替市場で、ユーロは対ドルで上げ幅を拡大し、英国時間9時30分時点は、1ユーロ=1.0420～30ドルと前週末の同16時時点と比べ0.0030ドルのユーロ高・ドル安で推移している。早朝から欧州債利回りが上昇基調となっており、欧米金利差の縮小を意識したユーロ買い・ドル売りが優勢となっている。英ポンドは対ドルで伸び悩み、英国時間9時30分時点は、1ポンド=1.2220～30ドルと、前週末の同16時時点と同じ水準で推移している。英景気の減速懸念は根強く、ポンド買い・ドル売りを進めにくい。,為替概況,ロンドン外為9時半　ユーロ、上げ幅拡大　1.04ドル台前半,https://www.nikkei.com/article/DGXZASH2IILM1_W2A510C2000000/
05/16/2022,日本工作機械工業会（日工会）が16日発表した4月の工作機械受注額（速報値）は前年同月比25%増の1549億円だった。前年比の増加は18カ月連続。世界的な設備投資需要の拡大を受けて、半導体製造装置や電気自動車（EV）関連を中心に部品加工の用途で機械の販売が増えた。外需は15.8%増の1017億円だった。オークマの担当者は「中国でEVや風力発電向けが伸びているほか、米国でも半導体や自動車関連の引き合いが強い」と語った。同社によると、内需を含む受注額全体は53%増の148億円となり、4月としては2018年に次ぐ過去2番目の高水準だった。中国での新型コロナウイルスによる都市封鎖の影響は限定的という。内需は47.5%増の532億円となった。逼迫している半導体関連を中心に増産投資が続いている。「中小事業者向けの補助金も依然として設備投資の支えになっている」（日工会の担当者）という。,エレクトロニクス,4月の工作機械受注、25%増　半導体向け好調続く,https://www.nikkei.com/article/DGXZQOUC166JA0W2A510C2000000/
05/16/2022,新潟県小千谷市の片貝まつり実行委員会などは16日、片貝まつりの花火大会を3年ぶりに実施すると発表した。新型コロナウイルスの感染拡大防止のため2年連続の中止となっていた。新潟県内では長岡市と柏崎市の花火大会の開催が決定済み。2022年は越後三大花火が3年ぶりにそろって開催される見通しになった。三尺玉発祥の地とされる片貝の花火は、世界最大級の四尺玉の打ち上げで知られる。例年は9月9～10日に開催し2日間で約1万5000発の花火が夜空を彩ってきた。有料観覧席を販売するという。片貝の花火のほか「長岡まつり大花火大会」と「ぎおん柏崎まつり　海の大花火大会」を合わせ、越後三大花火と呼ばれている。,新潟,越後三大花火、そろって開催へ　片貝も3年ぶり実施決定,https://www.nikkei.com/article/DGXZQOCC166BY0W2A510C2000000/
05/16/2022,綜合警備保障（ALSOK）は2022年度、給与水準を一律に改善するベースアップ（ベア）を実施する。ベアは9年連続で、平均1.23%引き上げる。定期昇給と合わせると月額平均で2.31%の賃上げとなる。ALSOKは個人や法人向けの機械警備サービスなどが好調で、23年3月期は11期連続...,賃上げ交渉,ALSOKが9年連続ベア　22年度は一律1.23%,https://www.nikkei.com/article/DGXZQOUC164KL0W2A510C2000000/
05/16/2022,札幌日経懇話会は16日、札幌市内のホテルで例会を開き、日本経済新聞社の田村正之編集委員が「年金・イデコ・NISA大改正でつくる安心老後」と題して講演した。年金の受給年齢を繰り下げた場合について解説した。個人型確定拠出年金（iDeCo、イデコ...,北海道,「年金・イデコ・NISA」テーマに講演　札幌日経懇話会,https://www.nikkei.com/article/DGXZQOFC163UD0W2A510C2000000/
05/16/2022,大阪府は16日、新型コロナウイルスの新たな感染者を944人確認したと発表した。感染者数は前週同曜日（1486人）と比べ、542人減った。新たに90代の男性1人の死亡も判明し、府内の累計死者数は4990人となった。16日時点の重症者は前日から1人増の21人で、重い持病などを抱える軽症・中等症患者らを含め重症病床（622床）の実質の使用率は5.9%だった。軽症・中等症病床には736人が入院しており、軽症・中等症病床（3376床）の使用率は21.8%となった。病床には、確保数を超えて実際に運用しているものも含んでいる。府が設置した臨時医療施設「大阪コロナ大規模医療・療養センター」の療養者は9日以降おらず、新規の受け入れを終了している。新規感染者のうち、感染者と同居して症状があり、PCR検査を受けずに医師の診断で陽性と判断された濃厚接触者は26人だった。自宅療養者は2万198人。公費によるPCR検査などを1万3362件実施した。,新型コロナ,大阪府、16日の新規感染944人　新型コロナ,https://www.nikkei.com/article/DGXZQOUF1678R0W2A510C2000000/
05/16/2022,ゆうちょ銀行の池田憲人社長は16日の記者会見で、ベンチャーや地方企業への出資事業を経営戦略の新たな柱にする方針を明らかにした。同行主導で複数のファンドをつくり、企業に対する出資から事業支援など一貫して手掛ける。出資先の商品・サービスを他の企業や自治体に仲介する仕組みも検討する。池田氏は国内企業に対する投資事業に本格参入し「地域産業の発展やベンチャー企業などのビジネス展開に焦点を当てたい」と表明した。全体の投資額は決めていないが、ファンド1つあたりの規模は200億～300億円を想定。地域金融機関とも連携して企業支援を進めるという。同行が過去に新規参入をめざした個人や企業への融資業務について「すでに過当競争にあり参入することに経営合理性が見いだせない」との考えも強調した。同行は2016年に地方銀行などのつくった地域支援ファンドに限定的に出資する業務を開始。これまで40件を対象に約206億円を投じた。18年にはかんぽ生命保険と投資子会社を設立し、自らファンドを運営する事業を始めた。出資先が成長すれば配当や売却による収益が見込める。,経済,ゆうちょ銀、ベンチャー育成へ　出資業務を強化,https://www.nikkei.com/article/DGXZQOUA1620J0W2A510C2000000/
05/16/2022,北海道美瑛町は5月24、25日の2日間に分けてうどん店チェーン「丸亀製麺」を展開するトリドールホールディングス（HD）と組んで町立小中学校全7校で「コラボ給食」を提供する。JAびえい（美瑛町農業協同組合）を含めた3者で2021年に結んだ包括連携協定の一環。主食のきつねうどんは美瑛産の小麦を使った特注めん、丸亀製麺のきつねあげ、だし、昆布とJAびえいのタマネギで作った。美瑛町は「地元食材の流通や企業との関わり、町の農業が社会とどのようにつながっているか食を通じて学んでほしい」（教育委員会管理課）と話す。,北海道,北海道美瑛町、「丸亀製麺」とうどん給食,https://www.nikkei.com/article/DGXZQOFC1652O0W2A510C2000000/
05/16/2022,日本プロ野球選手会は16日、加入選手を対象とした年俸調査の結果を発表し、球団別の支配下登録選手の今季平均年俸ではソフトバンクが7002万円で3年連続トップとなった。12球団の支配下登録721選手の平均は138万円増の4312万円で、現行の調査方法となった1988年以降の最高を更新した。巨人が6632万円で2位、楽天が6035万円で3位。昨季日本一に輝いたヤクルトは418万円増の4050万円で7位から5位、パ・リーグを制したオリックスは1282万円増の3922万円で12位から6位にそれぞれ上がった。リーグ別ではパ・リーグが4545万円、セ・リーグが4074万円で、3年続けてパが上回った。また、契約更改交渉での選手の満足度を測るアンケート結果を今年から公表し、数値が最も高かったのがソフトバンクで、低かったのは中日だった。調査対象は選手会に加入し、今季開幕時に支配下登録されていた選手。外国人選手など一部の選手は加入していない。選手会の森忠仁事務局長は「球団間、球団内の格差がかなりあると感じている。その辺を変えていければ」と語った。〔共同〕,スポーツ,ソフトバンク、年俸3年連続首位　プロ野球選手会が調査,https://www.nikkei.com/article/DGXZQOKC168790W2A510C2000000/
05/16/2022,サントリー食品インターナショナル(サントリーBF)は16日、「サントリー天然水」など清涼飲料を値上げすると発表した。10月1日出荷分からペットボトルを中心に主要商品を希望小売価格ベースで20円引き上げる。他社にも追随の動きが広がる見込みだ。一方、食品などの値上げが相次ぐ中で消費者の節約志向も強まっている。原材料高と消費者心理の板挟みをどう乗り切るかという課題を残す。値上げするのは「サントリー天...,値上げラッシュ,サントリー飲料値上げ、他社追随へ　消費者心理に負担も,https://www.nikkei.com/article/DGXZQOUC13EWF0T10C22A5000000/
05/16/2022,16日の東京外国為替市場で、円相場は5営業日ぶりに反落した。17時時点では前週末の同時点に比べ51銭円安・ドル高の1ドル=129円31～32銭だった。米金利の先高観が根強い中、日米金利差を意識した円売り・ドル買いが優勢だった。国内輸入企業など実需勢によるドル調達需要も円相場を下押しした。円は小幅な上昇に転じる場面もあった。午前中に一時128円70銭近辺まで買われた。16日発表の中国の経済指標が市場予想を下回る内容となったことで改めて世界景気の先行き不透明感が意識され、「低リスク通貨」とされる円に買いが向かったとの指摘があった。9～17時時点の円の安値は129円67銭近辺で、値幅は97銭程度だった。円は対ユーロでも5営業日ぶりに反落した。17時時点では同44銭円安・ユーロ高の1ユーロ=134円58～61銭だった。ユーロは対ドルで4日続落した。17時時点は同0.0007ドルユーロ安・ドル高の1ユーロ=1.0407～09ドルだった。〔日経QUICKニュース（NQN）〕,為替概況,外為17時　円、5日ぶり反落　129円台前半　米金利の先高観根強く,https://www.nikkei.com/article/DGXZASS0IMF06_W2A510C2000000/
05/16/2022,川崎市は16日、ライフサイエンス分野の企業や研究機関が集積する臨海部殿町地区の国際戦略拠点「キングスカイフロント」に、研究者同士の交流を促す懇談ラウンジを開設した。様々な団体で働く研究者たちの情報交換の場を設けることで、技術革新の創出につなげる。懇談ラウンジはキングスカイフロントのマネジメントセンター内に設け、広さは125平方メートル。立地する団体の研究者は平日の午前9時から午後8時まで利用可能で、無料でコーヒーやウオーターサーバー、Wi-Fiも利用できる。キングスカイフロントにはナノ医療イノベーションセンターなどの研究機関やジョンソン・エンド・ジョンソン、ペプチドリームなどのライフサイエンス系企業約50団体が立地し、約600人の研究者が働いている。,神奈川,川崎市、殿町の国際戦略拠点に研究者交流の場,https://www.nikkei.com/article/DGXZQOCC132QU0T10C22A5000000/
05/16/2022,16日朝のロンドン株式市場で、FTSE100種総合株価指数は反落している。英国時間8時時点では、前週末比41.64ポイント（0.56%）安の7376.51だった。16日に発表された中国の4月経済指標が軒並み市場予想を下回る結果となったことで、中国や世界経済の先行きを警戒した売りが優勢となっている。ドイツ株式指数（DAX）とフランスのCAC40はいずれも前週末終値に比べ軟調に推移している。〔日経QUICKニュース（NQN）〕,ロンドン株式相場,ロンドン株、反落　独や仏株は軟調,https://www.nikkei.com/article/DGXZASB2IILB2_W2A510C2000000/
05/16/2022,松野博一官房長官は16日の記者会見で、物価高に対応した緊急対策を「速やかに実行していく」と述べた。4月の国内企業物価指数が前年同月比で10.0%上昇したのに触れ「日本経済を一日も早く自律的な成長軌道に乗せる」と強調した。政府は6月までに新しい資本主義のグランドデザインや実行計画、経済財政運営と改革の基本方針（骨太の方針）を取りまとめる。松野氏は「中長期的な課題に対応し、成長と分配の好循環を実現する」と語った。,政治,官房長官「日本経済を自律的な成長軌道に」　物価高対策,https://www.nikkei.com/article/DGXZQOUA162P90W2A510C2000000/
05/16/2022,日清食品は16日、一日に必要な栄養素をバランスよく摂取できる即席米飯や即席麺などの販売を始めると発表した。食物繊維やカリウムなど33種類の栄養素が摂取できる点に加え、カロリーや塩分などを抑制するなど健康に配慮した。栄養とおいしさを両立する「完全メシ」ブランドとして展開し初年度に30億円、2023年度に100億円の売上高をめざす。第1弾として30日から即席ライスの主力商品「日清カレーメシ」や即席...,サービス・食品,日清食品、33種の栄養素の「完全メシ」ブランド開始,https://www.nikkei.com/article/DGXZQOUC161ZA0W2A510C2000000/
05/16/2022,東京都の新型コロナウイルス対応の改正特別措置法に基づく営業時間短縮命令が違法だとして、飲食チェーンのグローバルダイニングが都に損害賠償を求めた訴訟の判決で、東京地裁（松田典浩裁判長）は16日、命令を出す必要があったと認められないとして、都の命令を違法と認定した。知事の過失責任は否定し、同社側の賠償請求は棄却した。時短命令を巡る司法判断は初めて。命令の違憲性については、営業の自由の侵害に当たらな...,事件・司法,都のコロナ時短命令は違法、賠償請求は認めず　東京地裁,https://www.nikkei.com/article/DGXZQOUE13CEQ0T10C22A5000000/
05/16/2022,建売住宅大手の飯田グループホールディングス（GHD）は16日、ウクライナに侵攻したロシアでの事業を当面続ける方針を表明した。兼井雅史社長は「拙速な判断で株主の価値を毀損することがないよう、多面的な視点で検討する」と話した。同社は1月にロシア東部の木材調達・加工企業を買収しており、事業の先行きに注目が集まっていた。16日に公開した2022年3月期の決算説明動画で明らかにした。兼井社長は「正しい情報の収集と分析に努める」とも説明した。ロシアがウクライナに侵攻し一部の日本企業はロシアでの事業停止や撤退を表明している。飯田GHDは1月、住宅木材の安定調達のために600億円を投じてRFPグループを子会社化した。RFPはロシア東部のハバロフスクを拠点とし、九州地方とほぼ同等の広さの森林を保有する。買収に伴う「シナジー効果は見通しが立たない状況」（西野弘代表取締役専務）という。ロシア政府の木材の輸出制限は資材価格の高騰につながっている。家具や住宅などに使う合板の材料である単板は、日本全体の輸入量のうち6割をロシア産を占める。21年も米国産材の供給逼迫による「ウッドショック」が発生し、調達環境が悪化していた。兼井社長は「ウクライナ情勢や円安の影響で事業環境は混迷を極めている」としたうえで「グループ会社と連携を深めて影響を抑える」と語った。,住建・不動産,飯田GHD、ロシア事業を当面継続　社長「多面的に検討」,https://www.nikkei.com/article/DGXZQOUC164CU0W2A510C2000000/
