02/21/2022,自動車部品大手のマレリ（旧カルソニックカンセイ、さいたま市）が主要取引先である日産自動車や取引金融機関に経営支援を要請し、埼玉県内の行政や経済界に衝撃を与えている。県やさいたま市はマレリを「大型案件」として誘致し、官民挙げて活動をバックアップしてきただけに、今回明らかになった経営危機はショックが大きい。県内の中小部品メーカーへの影響を懸念する声も聞かれる。「埼玉県の企業誘致はマレリの誘致成功で勢いづいた。...,埼玉,マレリ経営危機､地元埼玉に衝撃　「残念な気持ち強い」,https://www.nikkei.com/article/DGXZQOCC187PB0Y2A210C2000000/
02/21/2022,新潟県は19日、新型コロナウイルスワクチンの大規模接種会場での3回目接種を始めた。新潟空港（新潟市）とホテルハイマート（上越市）に設置した。新潟空港で3回目接種を受けた花角英世知事は記者団の取材に答え「1日でも早い接種を考えていただきたい」と県民によびかけた。新潟空港ではモデルナ製、ハイマートではファイザー製を使う。花角知事は2021年7月3日と31日に1～2回目を県の大規模会場である朱鷺メッセ（新潟市）で接種している。3回ともモデルナ製を使い「同じ種類のワクチンで、どちらも効果が認められている。早い接種の機会をつかまえてほしい」と述べた。新潟県の3回目接種率は、19日時点で10.97%と全国平均（14.00%）を下回る。県は1～2回目接種では全国有数の規模で大規模接種を展開し市町村の接種を後押しした。3回目でも市町村と協力して大規模会場を展開し、前倒し接種を進める方針だ。【関連記事】,新型コロナ,新潟県、3回目大規模接種を開始　空港・ホテルで,https://www.nikkei.com/article/DGXZQOCC193WZ0Z10C22A2000000/
02/21/2022,ヒット曲「星のフラメンコ」や時代劇の「遠山の金さん」役で親しまれた歌手で俳優の西郷輝彦（さいごう・てるひこ、本名=今川盛揮=いまがわ・せいき）さんが20日午前9時41分、東京都の病院で死去した。75歳だった。告別式は近親者で行う。1964年、17歳の時に「君だけを」でデビュー。「十七才のこの胸に」「星娘」など青春歌謡が相次いでヒットした。橋幸夫さんや舟木一夫さんと共に「ご三家」と呼ばれ、NHK紅白歌合戦に10年連続で出場した。73～77年に主演したドラマ「どてらい男（ヤツ）」がヒットして俳優に転向。「江戸を斬る」の遠山金四郎役や、NHK大河ドラマ「独眼竜政宗」などの時代劇で活躍した。〔共同〕,,西郷輝彦さんが死去　ご三家「星のフラメンコ」,https://www.nikkei.com/article/DGXZQOUE213UK0R20C22A2000000/
02/21/2022,【台北=中村裕】台湾当局は21日、2011年の東京電力福島第1原発事故後から、福島県など5県産の食品輸入を禁止してきた措置を、同日付で解除したと発表した。一部の食品を除き、11年ぶりに輸入が再開される。台湾は環太平洋経済連携協定（TPP）加盟に向け、日本との長年の懸案を払拭し、加盟に弾みを付けたい狙いだ。輸入が解禁されたのは、福島、茨城、栃木、群馬、千葉の5県産の食品。台湾は放射能汚染のリスクがあるとして、5県産の食品の輸入を広く制限していた。今後は、放射性物質の検査報告書と、産地証明書の添付などを条件に輸入を認める。ただし野生鳥獣の肉やキノコ類などは、引き続き輸入を認めない。原発事故以来、5県産の食品をここまで厳しく規制してきたのは台湾と中国のみだった。台湾がTPP加盟を目指し今回、規制緩和に動いたことについて、同じくTPPへの加盟申請で争う中国は、厳しく批判した。中国外務省の趙立堅副報道局長は8日の記者会見で「中国は原発事故後から放射能に汚染された日本の食品の輸入規制を強化してきた。一方、民進党（民主進歩党）が行ったことは、台湾同胞の生命と健康に関わる問題で、多くの同胞たちの目はごまかすことはできないだろう」と指摘した。,中国・台湾,台湾、輸入禁止措置を解除　福島など5県産食品対象,https://www.nikkei.com/article/DGXZQOGM213K50R20C22A2000000/
02/21/2022,松野博一官房長官は21日の記者会見で、24日にテレビ会議形式で開かれる主要7カ国（G7）の首脳協議に岸田文雄首相が出席すると発表した。緊迫するウクライナ情勢を含む外交課題について話し合う。松野氏は「日本としても民主主義、法の支配といった普遍的価値を共有するG7が結束し国際社会を主導するのが極めて重要だ」と述べた。邦人保護に向け、近隣国でチャーター機の手配を既に済ませたと明かした。ウクライナにいる日本人およそ120人（19日時点）について「退避を希望する邦人が速やかに安全な場所に移動できるのが今、何よりも重要だ」と語った。,G7首脳会議,首相、24日のG7首脳協議に出席　ウクライナ情勢を議論,https://www.nikkei.com/article/DGXZQOUA212D50R20C22A2000000/
02/21/2022,21日後場寄り付きの東京株式市場で日経平均株価は午前に引き続き軟調で、前週末比210円程度安い2万6900円台前半で推移している。ウクライナ情勢を巡る警戒感は依然強く、海運株や陸運株など景気敏感株を中心に売り優勢の展開が続いている。午前には「米ホワイトハウスが、バイデン大統領がプーチン・ロシア大統領との首脳会談を原則として受け入れた」と伝わり、下げ幅を縮小した。前引け後の東証の立会外で、国内外の大口投資家が複数の銘柄をまとめて売買する「バスケット取引」は約546億円成立した。12時45分現在の東証1部の売買代金は概算で1兆4737億円、売買高は5億9264万株だった。エーザイやキーエンス、東海カ、ニコン、川崎汽、JR東日本が安い。一方、日本ペHDやベイカレント、ZOZOは高い。〔日経QUICKニュース（NQN）〕,国内株概況,東証後場寄り　軟調　海運や陸運に売り,https://www.nikkei.com/article/DGXZASS0ISS14_R20C22A2000000/
02/21/2022,JX金属は21日、銅の国内相対取引の目安となる建値を1万円引き下げ、1トン120万円とした。,商品ニュース,銅建値1万円引き下げ　JX金属,https://www.nikkei.com/article/DGXZQOUC212XO0R20C22A2000000/
02/21/2022,最高経営責任者（CEO）の高額報酬を正当化するのに苦労する企業もあるが、米アップルは違う。報酬は業績に連動すべきだと考えるなら、アップルの報酬体系に異を唱えるのは難しいだろう。ティム・クックCEOの報酬9870万ドル（約113億円）に反対票を投じるよう示唆している米議決権行使助言会社のインスティテューショナル・シェアホルダー・サービシズ（ISS）は間違っている。ISSは、クック氏の報酬が類似の企...,FT,[FT･Lex]米アップル・クックCEOの高額報酬は適切,https://www.nikkei.com/article/DGXZQOCB211PV0R20C22A2000000/
02/21/2022,21日午前の東京外国為替市場で円相場は上昇した。12時時点は1ドル=114円97～98銭と前週末17時時点と比べて14銭の円高・ドル安だった。ウクライナ情勢への警戒感から運用リスクを回避するための円買いが優勢になった。もっとも情報は入り乱れており、市場参加者は神経質になっている。21日午前にも円に売りが増える場面もあった。ロシアは20日、同日終了予定だったベラルーシとの合同軍事演習の延長を決めたと伝わった。リスク回避の買いが増えた円は、朝方に114円88銭近辺まで上昇した。その後、バイデン米大統領がロシアのプーチン大統領と協議することで原則合意したとの米政府の発表で、外交的な解決への期待が高まる場面もあった。円は一時115円11銭近辺と前週末17時時点から横ばいの水準まで戻した。9～12時の円の値幅は23銭程度だった。円は対ユーロでも上昇した。12時時点は1ユーロ=130円58～59銭と同30銭の円高・ユーロ安だった。ユーロは対ドルでも下落し、12時時点は1ユーロ=1.1357～58ドルと同0.0013ドルのユーロ安・ドル高だった。〔日経QUICKニュース（NQN）〕,為替概況,外為12時　円、上昇　114円台後半　リスク回避の買い優勢,https://www.nikkei.com/article/DGXZASS0IMF04_R20C22A2000000/
