04/29/2022,【ベルリン=南毅郎】欧州連合（EU）統計局が29日発表した2022年1～3月期のユーロ圏の実質域内総生産（GDP）は速報値が前期比0.2%増にとどまった。伸び率は前の期から小幅に鈍化し、年率換算でも0.8%だった。新型コロナウイルス対応の行動規制が段階的に緩和されたが、ロシアのウクライナ侵攻に伴う資源高や物流網の混乱で先行きは不透明感が強まっている。28日に発表された米国が前期比年率換算で1....,経済,1~3月のユーロ圏、年率0.8%成長　物価高・ロシア侵攻で,https://www.nikkei.com/article/DGXZQOGR28DVZ0Y2A420C2000000/
04/29/2022,【鹿島3-0 C大阪】鹿島が快勝した。前半6分、こぼれ球を鈴木が頭で押し込み先制。同14分には左クロスから松村の今季初ゴールで加点、後半ロスタイムにもアルトゥールカイキが決めた。C大阪はボールを保持して好機をつくったが、決定力を欠いた。【鳥栖4-1柏】鳥栖が効果的に点を重ねて快勝した。前半27分に本田が頭で先制し、同45分のFKに田代が詰めて加点。1点差とされた後半は福田、飯野の得点で突き放した。柏はミスが目立ち、細谷の1点止まり。鳥栖の組織的な守備に封じられた。【福岡1-0京都】福岡が接戦を制した。前半12分、クルークスの右クロスに山岸が頭で合わせて先制。球際で厳しい守備も崩れず、逃げ切った。京都は開始早々に武田のミドルシュートがポストに当たり、終盤の得点機も荒木のシュートが枠を外れた。【清水2-2広島】広島が2度追い付き、引き分けた。0-1の後半23分に森島の右足ボレーで同点。すぐに勝ち越しを許したが、同35分にゴール前のこぼれ球を柏が押し込んだ。清水は前半20分と後半25分にチアゴサンタナが決めたが守り切れなかった。【札幌1-0湘南】札幌は後半7分の右CKで、相手のクリアを拾った菅がペナルティーエリア外から左足で先制。その後は守勢に回りながらも無失点で逃げ切った。湘南は失点後に速攻から大橋が決めたかと思われたが、オフサイドの判定となった。〔共同〕,スポーツ,29日のJ1　結果と戦評,https://www.nikkei.com/article/DGXZQOKC291XK0Z20C22A4000000/
04/29/2022,山梨県道志村の山中で2019年9月に行方不明になった小倉美咲さん（9）が当時履いていた靴と類似した運動靴が見つかった。千葉県成田市の母、とも子さんは29日「鑑定が終わるまで娘のものと信じたくない。娘が見つかるまで捜し続けたい」と涙ながらに話した。行方不明になったキャンプ場を訪れ、報道陣に答えた。山梨県警は28日、美咲さんが行方不明になった当時に履いていた靴とメーカーが一致するなど特徴が類似した運動靴を右足側だけ発見した。29日にも同じメーカーで、色やサイズが一致している左足側と、靴下の片方も見つかった。発見場所は県警やボランティアによる捜索が繰り返された場所で、とも子さんは「なぜそこに靴があるのだろうと疑問にも思う」と話した。美咲さんは19年9月、母親と友人家族らで訪れたキャンプ場で行方不明となった。今月、子どもの頭部とみられる人骨の一部が見つかり、その後の捜索で靴を発見。いずれもキャンプ場から約600メートルの距離にある沢付近で見つかっており、県警は関連を慎重に調べている。〔共同〕【関連記事】,社会・調査,左足側の靴も発見、特徴一致　山梨・道志村の女児捜索,https://www.nikkei.com/article/DGXZQOUE291VY0Z20C22A4000000/
04/29/2022,中日クラウンズ第2日（29日・愛知県名古屋GC和合=6557ヤード、パー70）降雨によるコースコンディション不良や天候の回復が見込めないため、68人が第2ラウンドを完了できずに持ち越しとなった。プレーを終えた中では、前日5位の金子駆大が67で回り、通算8アンダー、132の好スコアをマークした。2週連続優勝を狙う桂川有人は69で通算6アンダー、石川遼は2日連続のパープレーで終えた。前日首位のアンソニー・クウェイル（オーストラリア）は4ホールを終えて通算10アンダー。昨年覇者の岩田寛は17ホールまでで6アンダーに伸ばした。30日に第2ラウンドの残りと第3ラウンドを行う。（出場95選手=アマ4、雨、気温16.5度、北北東の風0.8メートル、観衆1601人）〔共同〕,スポーツ,金子が8アンダー　中日クラウンズゴルフ第2日、雨天順延,https://www.nikkei.com/article/DGXZQOKC292RS0Z20C22A4000000/
04/29/2022,パナソニック・オープン第1日（29日・千葉県浜野GC=6660ヤード、パー72）申ジエ（韓国）が66で回り、首位に立った。前週初優勝の高橋彩華が6バーディー、1ボギーにまとめ1打差の2位。川岸史果、天本ハルカ、福山恵梨、テレサ・ルー（台湾）が68で3位に並び、小祝さくらが69で7位。前回覇者の上田桃子は、今季3勝の西郷真央とともに70で9位につけた。昨季賞金女王の稲見萌寧は71で16位。（賞金総額8千万円、優勝1440万円、出場108選手=アマ1、雨、気温15.1度、北東の風3.9メートル、観衆2257人）〔共同〕,スポーツ,申ジエ首位発進　パナソニックゴルフ、1打差で高橋彩華,https://www.nikkei.com/article/DGXZQOKC292QP0Z20C22A4000000/
04/29/2022,林芳正外相は29日、訪問先のカザフスタンでトレウベルディ副首相兼外相と1時間ほど会談した。林氏はロシアによるウクライナ侵攻について、国際社会が連携する必要があると指摘した。トレウベルディ氏はロシアに外交的努力をする用意があると述べた。カザフスタンは旧ソ連諸国の一つでロシアとのつながりが強い。ウクライナ侵攻後、ロシアを国連人権理事会から追放する決議案に反対した。林氏は「国際秩序の根幹を揺るがす深刻な事態だ」と強調した。トレウベルディ氏は国連憲章の基本原則に基づいて行動し、平和的解決をめざすと主張した。両氏は東アジア情勢に関しても協議した。北朝鮮の核・ミサイル開発や日本人の拉致問題で緊密に協力すると確かめた。林氏はトカエフ大統領も表敬した。,政治,カザフ外相「ロシアへ外交努力の用意ある」　林外相に,https://www.nikkei.com/article/DGXZQOUA2916D0Z20C22A4000000/
04/29/2022,【ベルリン=南毅郎】欧州連合（EU）統計局が29日発表した4月のユーロ圏の消費者物価指数（速報値）は前年同月比で7.5%上昇した。前月の7.4%を上回り、統計で遡れる1997年以降で最高を更新した。ロシアのウクライナ侵攻に伴う供給不安から資源価格が高騰しており、エネルギーや食品の値上がりが目立っている。域内景気の回復が遅れるなかでも、欧州中央銀行（ECB）の利上げ観測が強まりそうだ。物価上昇率が過去最高を更新するのは6カ月連続。原油や天然ガスなどの資源価格が高騰し、ドイツでは3月の生産者物価の伸び率が前年同月比で30.9%と統計で遡れる49年以降で最大になった。コストの増加を販売価格に転嫁する動きが広がっている。品目別でみた伸び率は、エネルギー価格が前年同月比で38.0%と高水準で推移した。食品は6.4%、エネルギー以外の工業製品は3.8%と物価上昇の裾野が広がっている。エネルギーや食品を除いたコア指数は3.5%で、ECBがめざす2%目標を大幅に上回った。国別ではドイツが7.8%、フランスが5.4%の上昇。最も高かったのはエストニアの19.0%で、最も低かったマルタでも4.9%に達している。今後はECBがインフレ抑制に動くかどうかが焦点になる。量的緩和策の段階的な縮小を進めており、市場では7月にも利上げに踏み切るとの観測が高まっている。ECB幹部からも初回の利上げは「現時点では7月が可能だ」（デギンドス副総裁）との発言が出ている。年内にはマイナス金利政策の解除も視野に入りつつあるが、ロシアのウクライナ侵攻が長引くなかで不透明感も強い。【関連記事】,ウクライナ侵攻,4月のユーロ圏消費者物価、7.5%上昇　資源高で最高更新,https://www.nikkei.com/article/DGXZQOGR28ELD0Y2A420C2000000/
04/29/2022,東京都は29日、都民や企業に夏季の節電を呼びかけるイベントを都庁内で開いた。夏場の需給安定が目的。小池百合子知事はロシアのウクライナ侵攻などを踏まえ「世界的なエネルギー情勢は厳しい。ぜひ節電に取り組んでいただきたい」と話し...,東京,小池都知事がクールビズ呼びかけ　夏場「ぜひ節電を」,https://www.nikkei.com/article/DGXZQOCC2917V0Z20C22A4000000/
04/29/2022,自民党の茂木敏充幹事長は29日「これから5年間、日本の国内総生産（GDP）比2%を念頭にきちんと防衛力を整備できるような予算水準を確保したい」と述べた。鹿児島市内の講演で語った。2023年度予算の防衛費は6兆円台半ばにするべきだとの考えも示した。ロシアのウクライナ侵攻に触れて「決して対岸の問題ではない」と説明した。夏の参院選に関して「内外の難しい課題にしっかりこたえるには政治の安定が不可欠であり、絶対に負けられない」と訴えた。「幹事長として陣頭指揮に立ち、選挙での勝利、安定政権の維持に取り組む」と話した。茂木氏は30日には岡山県、5月1～2日には沖縄県でそれぞれ講演や街頭演説をする。,政治,防衛費「5年でGDP比2%」、茂木敏充・自民党幹事長,https://www.nikkei.com/article/DGXZQOUA291KI0Z20C22A4000000/
