03/06/2022,ウクライナ侵攻を巡って米欧が発動した制裁の影響で、ロシアでは物流や決済の安定が揺らぎ始めた。市民生活は混乱。スーパーでは小麦や砂糖、塩などを買い急ぐ動きが目立ち、一部では1人が買える量を制限し始めた。家具や家電など輸入に頼る製品の不足も顕在化してきた。こうした動きはロシア経済全体の先行きに影を落とす。米カード最大手のビザと2位のマスターカードは5日、ロシアでのカード決済事業を停止すると発表した。...,ウクライナ侵攻,対ロシア制裁で市民生活の混乱拡大　物価上昇、買い急ぎ,https://www.nikkei.com/article/DGXZQOCB054WK0V00C22A3000000/
03/06/2022,東京マラソンが6日、2年ぶりに開催された。東京都の小池百合子知事はウクライナの国旗の色である青色と黄色の服装でスターターを務め、ロシアに侵攻される同国への連帯を示した。東京マラソンは15回目で、昨年は新型コロナウイルスの影響で延期していた。一般ランナーの参加は3年ぶりとなる。小池氏は「銃声を鳴らす時に『東京では銃声はスターターによるものしかない。世界の遠くにも思いをはせてください』と（参加者に）申し上げた」と語った。今回の大会は新型コロナ対策として、参加者全員へのPCR検査や出走時間の分散などの感染対策を講じた。,東京,東京マラソン2年ぶり開催　小池知事「銃声は号砲だけ」,https://www.nikkei.com/article/DGXZQOCC060QS0W2A300C2000000/
03/06/2022,発足から14年が過ぎ、ふるさと納税の形が変わってきています。滋賀県野洲市では市内に工場があることから、有名ブランド「SK―Ⅱ」の化粧水を返礼品にしたところ寄付額が急増。地元の特産物についても考え方が変わり、兵庫県加西市では第2次世界大戦の戦闘機「紫電改」の模型をいち早く見てもらう券や鉄道の運転など体験型の返礼品を増やしています。大阪府泉佐野市ではクラフトビールやサンドイッチなど地元の名産品をつくるビジネスを後押しをしようと、新たな仕組みを取り入れています。,関西,やさしいニュース解説　変わる関西のふるさと納税,https://www.nikkei.com/article/DGXZQOUF0314G0T00C22A3000000/
03/06/2022,【オーランド（米フロリダ州）=共同】米男子ゴルフのアーノルド・パーマー招待は5日、フロリダ州オーランドのベイヒル・クラブ（パー72）で第3ラウンドが行われ、39位で出た松山英樹は2バーディー、6ボギーの76と落とし、通算5オーバー、221で58位に後退した。71のビリー・ホーシェル、72のテーラー・グーチ（ともに米国）が通算7アンダー、209で首位。1打差の3位にビクトル・ホブラン（ノルウェー）がつけた。,スポーツ,松山英樹、58位に後退　米男子ゴルフ第3日,https://www.nikkei.com/article/DGXZQOKC060O50W2A300C2000000/
03/06/2022,米男子ゴルフのプエルトリコ・オープンは5日、米自治領プエルトリコ、リオグランデのグランドリザーブGC（パー72）で第3ラウンドが行われ、2位で出た小平智は2バーディー、5ボギー、1ダブルボギーの77で通算5アンダー、211の36位に後退した。68と伸ばしたライアン・ブレム（米国）が通算15アンダー、201で首位をキープ。3打差の2位にマイケル・キム（米国）がつけた。〔共同〕,スポーツ,小平智36位に後退　プエルトリコOPゴルフ第3日,https://www.nikkei.com/article/DGXZQOKC060OU0W2A300C2000000/
03/06/2022,【シュツットガルト（ドイツ）=共同】サッカーのドイツ1部リーグで5日、シュツットガルトの遠藤航は本拠地でのボルシアMG戦にフル出場し、0-2の前半38分に2試合連続となるゴールを決めた。今季3点目。チームは3-2で逆転勝ちし、10試合ぶりの勝利。シュツットガルトの伊藤洋輝もフル出場した。鎌田大地と長谷部誠のアイントラハト・フランクフルトは敵地でヘルタに4-1と快勝し、連敗を3で止めた。先発した鎌田はチームの4点目をアシストし、後半38分に退いた。長谷部は出場機会がなかった。ボーフムの浅野拓磨は本拠地でのフュルト戦で1-1の後半20分から出場。チームは2-1で勝った。原口元気と遠藤渓太のウニオン・ベルリンは敵地でウォルフスブルクに0-1で敗れた。原口は後半19分までプレーし、遠藤渓はベンチ外。,スポーツ,遠藤航が2戦連続ゴール　ドイツ1部、伊藤洋輝フル出場,https://www.nikkei.com/article/DGXZQOKC060IJ0W2A300C2000000/
