12/19/2021,アメリカンフットボールの全日本大学選手権決勝、第76回甲子園ボウルは19日、甲子園球場で行われ、関学大（関西1位）が法大（関東）を47-7で下して4連覇を果たし、史上最多を更新する32度目の優勝を飾った。関学大は最初の攻撃シリーズで斎藤が先制のTDラン。13-0で迎えた第3クオーターに6点差に迫られてから前島の68ヤードTDランや永田のFGで突き放した。9年ぶりの出場で第61回以来の頂点を狙った法大は星野のランなどで対抗したが、第3クオーターのFG失敗から流れを失った。甲子園ボウル最優秀選手には2TDと攻撃をけん引した斎藤が輝き、敢闘選手が星野。年間最優秀選手に贈られるミルズ杯は関学大のRB前田が獲得した。〔共同〕,スポーツ,関学大、法大下し4連覇　甲子園ボウル,https://www.nikkei.com/article/DGXZQOKC192C70Z11C21A2000000/
12/19/2021,バスケットボール女子の第88回皇后杯全日本選手権（日本バスケットボール協会主催、共同通信社共催）は19日、東京・代々木第二体育館でファイナルラウンド最終日が行われ、決勝でENEOSがデンソーを86-62で下し、史上初の9連覇を達成した。26度目の優勝。第31～38回大会を制したユニチカ山崎と並んでいたが、それを上回った。ENEOSは1点リードで迎えた第2クオーターに、エース渡嘉敷らの活躍で29点を奪い、14点差で後半へ。その後も堅守で反撃を封じ、着実に点差を広げて圧倒した。大会MVPはENEOSの林が初受賞した。〔共同〕,スポーツ,ENEOSが史上初の9連覇、デンソー下す　バスケ皇后杯,https://www.nikkei.com/article/DGXZQOKC1921A0Z11C21A2000000/
12/19/2021,松野博一官房長官は19日、新型コロナウイルスのクラスター（感染者集団）が発生した米海兵隊キャンプ・ハンセンを抱える沖縄県金武町長らと同県恩納村で面会し、地元自治体の不安解消に全力を挙げる考えを伝えた。面会後、記者団に明らかにした。基地内では日本人従業員のオミクロン型感染も判明している。面会には宜野座村、恩納村の村長も同席し、感染対策の徹底を要請。松野氏は「地元の不安が解消されるよう、米側に濃厚接触者の早期特定などを求めている」と説明した。松野氏の沖縄入りは11月に続いて2カ月連続。面会の前後に、米軍嘉手納基地（嘉手納町など）の騒音状況を確認したほか、渋滞緩和のため仮設橋の建設工事が進むキャンプ・ハンセン周辺の現場などを視察した。〔共同〕,政治,沖縄の不安解消に全力　松野氏、米軍基地内感染で,https://www.nikkei.com/article/DGXZQOUA192B70Z11C21A2000000/
12/19/2021,共同通信社が18、19両日実施した全国電話世論調査によると、新型コロナウイルス対策としての18歳以下への10万円相当給付について、全額現金が望ましいとの回答が79.2%となった。クーポンも活用するのが望ましいとの回答は16.8%だった。国土交通省の建設受注統計書き換えにより、政府の統計データへの信頼が揺らいだと思うとの回答は77.6%に上った。約3100万人を対象にワクチンの3回目接種を前倒しする政府方針については「適切だ」が53.5%を占める一方、32.0%は「対象を拡大するべきだ」と答えた。岸田内閣の支持率は60.0%で、11月の前回調査に比べ0.5ポイント低下した。不支持率は22.7%だった。国会議員に支給される「文書通信交通滞在費」の見直しを巡り今国会で取るべき対応では「日割り支給に加え、使い道の公開なども義務付ける」との意見が81.7%に上った。自民党が主張する「日割り支給への変更を優先する」は8.6%にとどまった。森友学園に関する決裁文書改ざんを苦に自殺した元財務省職員の遺族が損害賠償を求めた訴訟の終結に関連し、岸田文雄首相が森友学園問題を再調査するべきだとの回答は79.3%となった。政府のコロナ対応を「評価する」は60.9%で前回より2.6ポイント増加。「評価しない」は35.2%だった。10万円相当給付で自治体が独自に所得制限を撤廃することを政府が容認している対応に関しては賛成52.1%、反対45.1%となった。年末年始の帰省や旅行を予定している人は16.9%、予定していない人は75.5%。昨年12月の調査はそれぞれ7.2%、83.6%で、コロナの感染状況改善を受けて流動性がやや高まる傾向がうかがえる。政党支持率は自民43.8%、立憲民主党11.6%、日本維新の会12.5%、公明党3.4%、国民民主党2.0%、共産党4.3%、れいわ新選組1.6%、社民党0.8%、「NHKと裁判してる党弁護士法72条違反で」0.2%。「支持する政党はない」とした無党派層は17.9%だった。〔共同〕,政治,10万円、全額現金望む79%　共同通信世論調査　,https://www.nikkei.com/article/DGXZQOUA1926G0Z11C21A2000000/
12/19/2021,DeNAの牧秀悟内野手が19日、横浜市でトークショーに参加し、2年目の飛躍を誓った。1年目の今季は打率3割1分4厘、22本塁打、71打点と大活躍し、セ・リーグの新人特別賞を受賞。来季へ向け「1年目のように周りに頼るだけではなく、引っ張っていけるようにしたい。日本一を目指してやっていく」と言葉に力を込めた。今季日本一となり、セの最優秀選手に輝いたヤクルトの村上の姿勢に刺激を受け「自分より年下だけど、チームを鼓舞する姿が堂々としている。自分もそうやっていかないと」とチームリーダーに名乗りを上げた。トークショーに参加した三浦監督は「牧に2年目のジンクスは全く心配していない。今年より中身のいい牧を見せてくれるはず」と期待した。〔共同〕,スポーツ,DeNA牧「引っ張っていく」　2年目の飛躍誓う,https://www.nikkei.com/article/DGXZQOKC1922F0Z11C21A2000000/
12/19/2021,大阪府は19日、新型コロナウイルスの新たな感染者を13人確認したと発表した。新たな死者は確認されなかった。19日時点の重症者は前日と同じ1人で、確保している重症病床（612床）に対する使用率は0.2%だった。軽症・中等症病床の入院は前日から6人増の53人。確保している軽症・中等症病床（3062床）に対する使用率は1.7%だった。自宅療養者は43人となり、前日から5人増。公費によるPCR検査などを計5005件実施した。,社会・調査,大阪府、19日の新規感染13人　新型コロナ,https://www.nikkei.com/article/DGXZQOUF191Z70Z11C21A2000000/
