01/16/2022,第62回京成杯（16日・中山11R2000メートル芝16頭、G3）6番人気のオニャンコポン（菅原明良騎乗）が2分1秒3で優勝し、重賞初制覇を飾った。オニャンコポンは好スタートから中団に下げ、前の人気馬をマークしながら進めた。最後の直線では外へ持ち出され、追われると一気に末脚を伸ばし、5番人気のロジハービンに1馬身1/4差をつけた。8番人気のヴェローナシチーがさらに1馬身1/4差の3着に入った。1番人気のアライバルは4着に終わった。払戻金は単勝が1320円、枠連は⑤―⑧で6770円、馬連は⑩―⑮で7410円、馬単は⑩―⑮で1万6930円、3連複は⑧―⑩―⑮で5万6610円、3連単は⑩―⑮―⑧で32万3010円、ワイドは⑩―⑮が2150円、⑧―⑩が5840円、⑧―⑮が3750円。〔共同〕,スポーツ,オニャンコポンが重賞初V　競馬の京成杯,https://www.nikkei.com/article/DGXZQOKC162LU0W2A110C2000000/
01/16/2022,大阪府は16日、新型コロナウイルスの新たな感染者を3760人確認したと発表した。15日の3692人を上回り、1日あたりの新規感染者数として2日続けて過去最多を更新した。新たな死者は確認されなかった。府の吉村洋文知事は確保している全病床の使用率が35%に達した場合、政府に「まん延防止等重点措置」の適用を要請する考えを示している。16日時点の全病床（3722床）に対する使用率は27.1%だった。16日時点の重症者は前日と同じ9人で、確保している重症病床（612床）に対する使用率は1.5%だった。軽症・中等症病床の入院は前日から110人増の998人。確保している軽症・中等症病床（3110床）に対する使用率は32.1%となった。自宅療養者は9432人となり、前日から1832人増えた。公費によるPCR検査などを計1万7860件実施した。,新型コロナ,大阪府、16日の新規感染3760人　2日連続で最多更新,https://www.nikkei.com/article/DGXZQOUF161GJ0W2A110C2000000/
01/16/2022,ラグビーのNTTリーグワン1部第2節最終日は16日、東京・味の素スタジアムで1試合が行われ、東京SGがトヨタに50-8で圧勝し、開幕2連勝で勝ち点9とした。対戦相手に新型コロナウイルスの陽性者が出たため第1節が中止だったトヨタは、実質的な初戦で黒星スタートとなった。東京SGは前半3分にナンバー8マクマーンが先制トライ。ニュージーランド代表のFBマッケンジーを擁するバックス陣のスピードを生かして計7トライを奪った。新型コロナの影響で埼玉―東葛、BR東京―静岡は中止された。〔共同〕,スポーツ,東京SGが開幕2連勝、トヨタに圧勝　ラグビーリーグワン,https://www.nikkei.com/article/DGXZQOKC162G20W2A110C2000000/
01/16/2022,【ワシントン=共同】米プロバスケットボールNBAは15日、各地で行われ、ウィザーズの八村塁は本拠地ワシントンでのトレイルブレーザーズ戦に途中出場して14分34秒プレーし、5得点、2リバウンドだった。チームは110-115で敗れ、22勝21敗となった。ラプターズの渡辺雄太はバックス戦に先発出場して5分20秒プレーし、無得点だった。チームは103-96で勝ち、21勝目（19敗）を挙げた。,スポーツ,八村塁が5得点、渡辺雄太は無得点　NBA,https://www.nikkei.com/article/DGXZQOKC162GL0W2A110C2000000/
01/16/2022,【ドバイ=岐部秀光】国際再生可能エネルギー機関（IRENA）は15日にまとめた報告で、水素市場の発展がエネルギー安全保障の強化につながると指摘する一方、サプライチェーン(供給網）の構築にリスクが潜むと警告した。次世代のクリーン資源として注目を集める水素はエネルギー市場の構図を大きく変化させるとみられている。供給国と消費国の対立をまねき、世界の政治や経済を揺さぶるリスクはないのか。アラブ首長国連邦（UAE）アブダビに本部を置く国際機関であるIRENAは「エネルギー転換の地政学　水素ファクター」と題した報告で、世界のエネルギー消費に占める水素のシェアが2050年までに最大12%に達すると推計した。水素の製造に適している地域として、広大な国土や豊富な太陽光にめぐまれた中東、アフリカやオセアニアが有力であると指摘した。今後、エネルギー需要が膨張することが確実なアジアは、水素製造のための気象条件にめぐまれず、化石燃料と同じく買い手の側にまわらざるを得ない現実が浮き彫りになった。報告は「水素が消費国のエネルギー輸入依存を減らし、価格変動を抑制し、エネルギーシステムの柔軟性、耐久性を高める」と分析した。そのうえで、投資の失敗、関連資源へのアクセスなどにリスクがあると指摘した。輸出国が抱えるリスクは収益性だ。「水素に対する需要は広がり始めたばかりで、オーストラリアや中東・アフリカ、南米などで計画されている事業の将来には不確実性がある」と分析した。巨額の関連事業が発表されたが、多くは承認プロセスの遅れなどで実現が後にずれている。21年にオーストラリア政府は環境への影響の懸念を理由に世界最大級の水素製造事業について認可を出さなかった。かつての石油輸出国機構（OPEC）のように輸出国が水素資源を政治ツールとして利用するおそれもある。「水素取引の初期段階では貿易相手が限定され、売り手も買い手も二国間の長期契約で固定されやすい状況にある。市場に流動性はなく、突然の取引停止が売り手と買い手の双方に大きな打撃をおよぼしかねない」とした。水素は世界の多くの地域で製造される。石油や天然ガスのような採掘型のエネルギーではなく転換によって生み出されるのが特徴だ。「水素市場に石油のようなカルテルが登場する可能性は低い」と報告は分析している。水素は、産油国にとっても経済多角化の重要なカギをにぎる技術だ。既存のエネルギー・インフラや労働者の技能、貿易パートナーとの関係といった資産を最大限に利用できる利点がある。報告は水素や再エネ関連の資源をめぐるリスクについても指摘した。水素市場の急速な成長は、電解装置で使われるニッケルやジルコニウムの需要拡大につながる。プラチナやイリジウムなどの金属は不足しているだけでなく、生産地が南アフリカに偏っているという問題も抱えるという。IRENAは水素市場の発展のカギを握るのは一貫した透明性のあるルールや基準づくりであると訴える。標準化が遅れれば市場が分断され、国家対立のリスクが高まる。「標準づくりこそが地政学的な競争と国際協力の舞台であり、一貫した透明なグローバルシステムはすべてのプレーヤーの利益となる」と指摘した。,中東・アフリカ,水素市場発展に地政学のリスク　IRENAが報告書,https://www.nikkei.com/article/DGXZQOCB154KP0V10C22A1000000/
01/16/2022,ノルディックスキーのSTV杯ジャンプ大会は16日、札幌市の大倉山ジャンプ競技場（ヒルサイズ=HS137メートル）で行われ、男子は二階堂蓮（NSC札幌）が1回目に最長不倒の140メートル、2回目に136.5メートルを飛び、合計272.2点で優勝した。岩佐勇研が2位、渡部陸太（ともに東京美装）が3位。49歳の葛西紀明（土屋ホーム）は129.5メートル、133.5メートルの247.6点で4位だった。女子は小林諭果（CHINTAI）が120メートル、119メートルの195.7点で勝った。ワールドカップ（W杯）メンバーは出場していない。〔共同〕,スポーツ,二階堂蓮V、葛西紀明は4位　ジャンプSTV杯,https://www.nikkei.com/article/DGXZQOKC162EH0W2A110C2000000/
01/16/2022,防衛省は16日、北朝鮮が14日に発射したミサイルが、固体燃料を用いた短距離弾道ミサイル2発だったとする分析を発表した。当初、ミサイルの数は「少なくとも1発」と公表していた。最高高度は約50キロで、飛行距離は通常の軌道だとすれば約400キロとしている。防衛省によると、今回のミサイルは、2019年5月4日に北朝鮮が打ち上げた短距離弾道ミサイルと外見上の類似点があり、21年9月15日に鉄道車両から発射されたものと同型とみられる。防衛省は「北朝鮮の軍事動向について、米国等と緊密に連携しながら情報収集、警戒監視に全力を挙げる」としている。〔共同〕,政治,弾道ミサイル2発と分析　北朝鮮発射で防衛省,https://www.nikkei.com/article/DGXZQOUA162H40W2A110C2000000/
01/16/2022,東京都は16日、新型コロナウイルスの感染者が新たに4172人確認されたと発表した。直近1週間平均の新規感染者は約2848人で、前週（約664人）の4.3倍だった。累計の感染者は40万7834人となった。重症者は前日から1人増え5人だった。新たな死亡の確認はなく、累計の死者数は3178人となっている。新規感染者を年代別にみると、20代が1477人と最も多く、30代の661人、10代の565人が続いた。65歳以上の高齢者は234人だった。ワクチンの接種状況別では2回接種済みが1998人、接種なしが960人だった。,新型コロナ,東京都、新たに4172人感染　7日平均で前週の4.3倍,https://www.nikkei.com/article/DGXZQOCC161IF0W2A110C2000000/
