05/12/2022,西日本フィナンシャルホールディングスは12日、2022年3月期の連結純利益が前の期比34%増の242億円だったと発表した。有価証券の運用が好調で、利息配当金収入が増えた。個人の資産形成サービスなど手数料ビジネスも伸びた。本業のもうけを示す実質業務純益は16%増の435億円だった。有価証券の利息配当金収入が29%増えて128億円となったほか、個人向け投信販売の手数料や法人向けサービスなどからなる役務取引等利益は10%増の209億円まで伸びた。記者会見した村上英之社長は「有価証券運用の体制強化など、中期経営計画で掲げる施策が反映されたよい決算だった」と述べた。23年3月期の純利益は前期比3%増の250億円を見込むが、傘下の西日本シティ銀行で信用コストを前期比2倍の60億円に増やす。「現段階で何かが起こりそうだということではなく、保守的に見積もった」（村上社長）としている。九州リースサービスへの出資や、企業向けシステム開発などのシティアスコム（福岡市）の子会社化については、現段階では業績予想に織り込んでいない。,地域金融,西日本FH、前期純利益34%増　有価証券運用が好調　,https://www.nikkei.com/article/DGXZQOJC1223H0S2A510C2000000/
05/12/2022,ウクライナへの侵攻を続けるロシアは占領地域の実効支配を固める狙いだ。南部ヘルソン州の親ロシア派幹部は11日、ロシアのプーチン大統領に同州の併合を求める方針を表明した。米欧の兵器供給で勢いづくウクライナ軍が同国東部で集落を相次ぎ奪還しているとの情報もある。ロシアの侵攻計画が遅れているのは明らかで、長期化を見越し、補給などの足場を築いている可能性もある。タス通信によると、ロシアへの併合要請の方針は親ロ派幹部が11日の記者会見で明らかにした。ロシアは同州の制圧を宣言済みだ。住民投票は実施せず、年末までに併合のための法的な枠組みを整える考えを示した。5月末までにヘルソン州でロシア通貨ルーブルを取り扱う銀行が業務を始め、ウクライナの通貨フリブナを段階的に廃止する。将来はロシア中央銀行との統合も検討する。希望する住民には年内にもロシアのパスポートの発行を始める意向も示した。ヘルソン州はロシアが2014年に一方的に併合を宣言した南部クリミア半島に隣接する。ヘルソン州にはクリミアの水源があり、同州の併合はクリミアの支配強化にもつながる。州都ヘルソンでは9日、ロシアの対ドイツ戦勝記念日にあわせた催しも開き、親ロ派は約2000人が参加したと主張していた。ヘルソン州を巡ってはロシアが占領を正当化するため、ウクライナからの独立を問う住民投票を実施するとの観測があった。だが、住民の抵抗が激しいもようだ。ロシアのペスコフ大統領報道官は11日「（ロシアへの併合を求めるかどうかは）ヘルソンの住民が決めることだ」と述べた。ウクライナは反発する。同国のポドリャク大統領府長官顧問は「（ロシア側が）なにを言おうと、ウクライナ軍はヘルソンを解放する」とツイッターに投稿した。ロシア側がヘルソンの併合を急ぐ背景には、東部戦線でウクライナ軍が反転攻勢の姿勢をみせていることへの焦りがある。ウクライナ軍は10日、東部ハリコフ州で4つの集落を奪還したと発表した。国境付近のロシア西部ベルゴロド州までロシア軍部隊が撤退したとの情報があるとも説明した。ウクライナ軍は6日にもハリコフ州で5つの集落を奪還したと発表していた。ベルゴロド州知事は11日、ウクライナ側の砲撃によって国境から10キロメートル離れた同州の村で1人が死亡したとSNS（交流サイト）で主張した。米CNNによると、侵攻後にロシア領内で砲撃による民間人の死者が報告されたのは初めて。2月下旬に始まった侵攻は長引いている。米情報機関トップのヘインズ国家情報長官は10日、プーチン氏が長期戦に備えているとの分析を明かした。ロシアは当初、短期間で首都キーウ（キエフ）を占領できると想定していたもようだが、米欧の兵器供給を受けたウクライナ軍に押し返された。主戦場はウクライナ東部に移った。ロシアはウクライナ南部の沿海部を占領し、穀物輸出などを阻止して資金源を減らす狙いだ。米欧はウクライナへの兵器供給に力を入れる。同国のアレストビッチ大統領府長官顧問は5月半ば以降に米欧から戦車や長距離砲が前線に届き、攻勢を強める態勢が整うと説明。オースティン米国防長官は4月下旬の記者会見で、ロシアの「弱体化」が望ましいと明言した。侵攻当初、近代兵器を備えたロシア軍はウクライナ軍を圧倒するとの見方が多かった。だが、米国は足元の戦況をロシア優勢とはみていない。ウクライナへの兵器提供の狙いは同国の防衛を超え、米軍の直接参戦なしにロシア軍に対する優位を確保することに変わりつつある。（小川知世、フランクフルト=林英樹、デュッセルドルフ=南毅郎）,ウクライナ侵攻,ロシア、占領地で支配固め　南部ヘルソンは併合「要請」,https://www.nikkei.com/article/DGXZQOCB1229Q0S2A510C2000000/
05/12/2022,震度6強を観測した3月の地震で被災した東北新幹線が完全に復旧し、13日から通常ダイヤになる。脱線や設備の損傷で一部区間の運休が1カ月近く続き、4月の全線再開後も本数や最高速度を制限していた。東北新幹線は3月16日深夜の地震でやまびこ223号が脱線し、線路や架線などの損傷は約千カ所に及んだ。車両を撤去し、4月14日に全線で運転を再開したが、一部区間の最高速度を通常の320キロから160キロに落としていた。所要時間は東京から仙台まで約30分、盛岡まで約1時間それぞれ長くなり、運行本数も通常の8、9割ほどだった。〔共同〕,社会・調査,東北新幹線、13日から完全復旧　3月の地震で被災,https://www.nikkei.com/article/DGXZQOUE12A5F0S2A510C2000000/
05/12/2022,森永製菓は12日、ホットケーキミックスなど一部商品を7月1日出荷分から値上げすると発表した。値上げ幅は希望小売価格（税別）ベースで約5.4～7.9%。主力の「ホットケーキミックス」の値上げは2008年2月以来で、約14年ぶり。原材料や物流、包装資材のコストが上昇しているとして、製品価格に転嫁する。対象はホットケーキミックスやココアパウダーなど12品目。「ホットケーキミックス　600グラム」は希...,値上げラッシュ,森永製菓、ホットケーキミックスなど14年ぶり値上げへ,https://www.nikkei.com/article/DGXZQOUC129VA0S2A510C2000000/
05/12/2022,総合人材サービスのパソナグループは12日、ウクライナからの避難民を同社のグループ各社で雇用する支援プロジェクトを始めたと発表した。具体的な雇用人数は未定だが、英語などの語学を生かせる海外向けの就職支援などの業務を想定している。日本への避難に必要な渡航費用を負担するほか、同社のオフィスがある兵庫県淡路島での住居なども無償提供する。支援の対象は、ウクライナ各地で活動するバレエダンサーやIT（情報技術）エンジニアとその家族ら。避難に伴う航空券の手配もするほか、滞在先は淡路島にある同社の社員寮などを無償で提供する。避難民らへの日本語研修も実施し、地元企業の求人も紹介する。パソナグループの担当者は「高いスキルを持ちながら避難先での活躍がかなわない人も多い。日本で新たな未来を切り開くことを支援したい」としている。,ウクライナ侵攻,パソナ、ウクライナ難民を日本で雇用　ダンサーなど支援,https://www.nikkei.com/article/DGXZQOUC123PR0S2A510C2000000/
05/12/2022,東京電力ホールディングスと中部電力が折半出資するJERAは12日、脱炭素に向けた資金を調達するトランジションボンド（移行債）を発行すると発表した。従来は3月中の発行を予定していたが、金利環境などを考慮し延期していた。発行額は200億円。燃料アンモニアを使った発電技術の開発などに充てる。5年債と10年債をそれぞれ100億円程度発行する。5月18日に条件決定する。主幹事はみずほ証券や三菱UFJモル...,環境エネ・素材,JERAが脱炭素に向け移行債、200億円発行　,https://www.nikkei.com/article/DGXZQOUC12A110S2A510C2000000/
05/12/2022,食品卸のマルイチ産商が12日発表した2022年3月期の連結決算は、純利益が前の期比44%減の6億8800万円、売上高が5%増の2383億円だった。仕入れ価格や物流費などが上昇しているが、販売価格に転嫁し切れなかった。缶詰製造を手掛ける子会社の信田缶詰（千葉県銚子市）の業績が低迷していることなどから、減損損失を計上したことも響いた。23年3月期は連結純利益が前期比60%増の11億円、連結売上高は2%増の2420億円を見込む。,サービス・食品,マルイチ産商、純利益44%減　22年3月期,https://www.nikkei.com/article/DGXZQOCC126YT0S2A510C2000000/
05/12/2022,キリンホールディングス（HD）は12日、国内の酒類事業で今後値上げを実施すると発表した。時期や金額などは明らかにしていないがビールやチューハイなどが値上げになるとみられる。酒類各社では既にアサヒビールがビールなどの値上げを表明しており、今後サントリーホールディングスやサッポロホールディングス,値上げラッシュ,キリンHD、ビールなど値上げへ,https://www.nikkei.com/article/DGXZQOUC12AL00S2A510C2000000/
05/12/2022,【ソウル=甲原潤之介】北朝鮮の朝鮮中央テレビは12日、金正恩（キム・ジョンウン）総書記がマスクを着けて会議に登場する様子を放映した。北朝鮮内で新型コロナウイルス感染者を確認したと初めて公表し、感染対策の徹底を呼びかけた。公開された映像で金正恩氏はマスクで鼻と口を覆った姿で会議室に入った。会議中はマスクを外して幹部らの前で話し、会議が終わって立ち上がる際に再びマスクを着用した。朝鮮中央通信によると首都平壌で発熱者の検体を分析し感染が判明したという。金正恩氏は12日、朝鮮労働党の政治局会議で北朝鮮全域で都市を封鎖するよう指示した。新型コロナの世界的な流行開始以降も北朝鮮は域内で感染者が発生していないと主張してきた。感染対策でマスクをつける金正恩氏が放映されるのは今回が初めてとみられる。韓国の新政権で統一相候補の権寧世（クォン・ヨンセ）氏は12日、北朝鮮に対するワクチン提供などの支援に言及した。国会の人事聴聞会で「協力の方策を積極的に検討する」と話した。,北朝鮮,金正恩氏、マスク姿で会議に登場　コロナ感染者を初公表,https://www.nikkei.com/article/DGXZQOGM128HI0S2A510C2000000/
05/12/2022,パキスタンで4月、当時のイムラン・カーン首相が失脚し、シャバズ・シャリフ氏が新首相に就任した政権交代で、背後に陸軍トップの意思があったと批判する投稿がSNS（交流サイト）で相次いでいる。シャリフ政権はカーン氏の陣営による組織的な攻撃だと主張して取り締まりに乗り出し、複数のブロガーが身柄を拘束されている。パキスタン下院の不信任決議で野党勢力が過半数を得て、カーン氏は失職した。ツイッターには、国軍...,NIKKEI Asia,「4月のパキスタン政変の黒幕は陸軍」SNSで批判拡散　,https://www.nikkei.com/article/DGXZQOGV11B9N0R10C22A5000000/
05/12/2022,ロシアのウクライナ侵攻で関心が集まる穀物市場。生産だけでなく物流にも懸念材料が出てきた。米国が輸出する穀物の大半が通るミシシッピ川で今春、輸送に使うバージ（はしけ船）の運賃が7年半ぶりの高水準となった。今後も川の状況次第で高値が続く可能性があり、日本の輸入コストにも響きかねない。「米国全体の物流の2割弱を占め、鉄道輸送が機能しなくなった際の混乱を吸収する役割もある」。近畿大学の伊沢正興准教授は...,商品ニュース,穀物市場にミシシッピ川リスク　はしけ船運賃7割高,https://www.nikkei.com/article/DGXZQOUB097TX0Z00C22A5000000/
05/12/2022,◇日本農薬岩田　浩幸氏（いわた・ひろゆき）86年（昭61年）岐阜大農卒、日本農薬入社。16年執行役員、18年取締役。58歳（6月22日就任。友井洋介社長は会長に）,,日本農薬社長に岩田氏,https://www.nikkei.com/article/DGXZQODZ00026_S2A510C2000000/
05/12/2022,アジアパシフィックオープン・ダイヤモンドカップ（12日・茨城県大洗GC=7163ヤード、パー70）大洗GCでの開催は松山英樹が優勝した2013年大会以来、9年ぶり。ツアー初優勝をめざす23歳の大西魁斗と同3勝の岩田寛が65、5アンダーで首位に並んだ。1打差の3位に今平周吾、さらに1打差の6位に星野陸也、今季1勝の桂川有人、54歳の谷口...,スポーツ,23歳大西と41歳岩田が首位発進　ダイヤモンドカップ,https://www.nikkei.com/article/DGXZQODH125840S2A510C2000000/
05/12/2022,ミマキエンジニアリングが12日に発表した2022年3月期の連結決算は、最終損益が23億円の黒字（前の期は3億100万円の赤字）だった。輸送費や原材料費、研究開発費などが増加したものの、新型コロナウイルス禍からの経済回復を背景に欧米を中心として製品需要が回復した。円安も寄与し、3年ぶりの黒字となった。売上高は22%増の595億円だった。看板などのサイネージ向けや、工業製品向けを中心にプリンターの販売数量を伸ばした。顧客による製品の使用頻度も増加し、インクや保守部品の売り上げも伸びた。23年3月期の連結業績は、売上高が前期比10%増の656億円、純利益は39%減の14億円の見通し。製品需要の回復が続く一方で、原材料価格の上昇や新製品投入に伴う営業活動の強化により費用の増加を見込む。政情不安が続くロシアとウクライナでの売り上げは見込まない。,長野,ミマキエンジニアリング、3年ぶり最終黒字　22年3月期,https://www.nikkei.com/article/DGXZQOCC127070S2A510C2000000/
05/12/2022,サトウ食品はウクライナにパックご飯3万9000食を提供した。農林水産省の事業に協力したもので、ロシアから侵攻を受けるウクライナ国民を支援する。12日、武部新農林水産副大臣がドイツで開催される主要7カ国（G7）農相会合に出席する前にポーランドに寄り、パックご飯を含む日本の食料品を引き渡す。提供したのは、新潟県産コシヒカリを使った同社の主力商品「サトウのごはん」。梱包用の段ボールには、ウクライナ語で食べ方について記載した説明文を貼り付けた。電子レンジのほか、湯煎でも温かいご飯を食べることができる。おかゆなどにして食べてもらうことを想定する。食料支援はウクライナ政府からの要請に日本政府が応じたもの。パックご飯のほか、魚の缶詰などを提供し、被災したウクライナ国民の緊急食料支援に活用される。,サービス・食品,サトウ食品、ウクライナにパックご飯　3万9000食,https://www.nikkei.com/article/DGXZQOCC1229S0S2A510C2000000/
05/12/2022,◇日本パーカライジング里見　多一氏（さとみ・かずいち）74年（昭49年）早大院修了、新日本製鉄（現日本製鉄）入社。87年日本パーカライジング取締役、17年代表取締役会長。東京都出身。74歳（6月29日就任。松本満社長は退任）,,日本パーカライジング社長に里見氏,https://www.nikkei.com/article/DGXZQODZ00040_S2A510C2000000/
05/12/2022,ウシオ電機は半導体パッケージ基板の製造装置の一種である露光装置の増産に乗り出す。35億円を投じて生産能力を2024年度までに2倍に増強する。データセンター向けなど世界的な半導体需要の急増を受け、顧客メーカーから装置の引き合いが高まっていることに対応する。生産を増やすのは最先端のICパッケージ基板を作るための「分割投影露光装置」。高い解像性と重ね合わせ精度が特長で、最先端基板向けとしては世界シェ...,エレクトロニクス,ウシオ電機、半導体パッケージ基板装置の生産能力2倍に,https://www.nikkei.com/article/DGXZQOUC123IC0S2A510C2000000/
05/12/2022,【バンコク=村松洋兵】サウジアラビアの国営石油会社サウジアラムコは12日、タイ国営のタイ石油公社（PTT）とエネルギー協力を強化すると発表した。サウジアラビアからタイへの原油輸出などを拡大する。両国政府は約30年前に起きたタイ人によるサウジ王室の宝石窃盗事件で悪化した関係を1月に修復していた。両社が11日にタイの首都バンコクで覚書に署名した。サウジからタイへの原油や石油化学製品、液化天然ガス（LNG）の供給を増やす方針だ。脱炭素に向けクリーンエネルギーの分野でも協力する。水素エネルギーや二酸化炭素（CO2）貯留、電気自動車（EV）を例に挙げた。PTTのアタポン社長は「従来のエネルギーの枠を超えて協力を拡大する」と述べた。アラムコのイブラヒム副社長は「幅広い領域で関係を深める重要な一歩だ」と語った。サウジとタイは1989年に起きた「ブルーダイヤモンド事件」を巡って関係が悪化した。サウジ王室の宮殿で働いていたタイ人労働者が、約2000万ドル（約26億円）相当とされる宝石類を盗み出したことを受け、外交関係を格下げした。1月にタイのプラユット首相がサウジを訪れ、ムハンマド皇太子と関係修復と経済協力の強化を合意した。タイの貿易統計によると、同国の2021年の原油輸入は金額ベースでアラブ首長国連邦（UAE）が首位の約27%、サウジが2位の約18%だった。,アジアBiz,サウジアラムコ、タイへの原油輸出拡大　両国関係修復で,https://www.nikkei.com/article/DGXZQOGS1281R0S2A510C2000000/
05/12/2022,スズキは12日、二輪車レースの最高峰「MotoGP」からの撤退に向けて、レースを運営するスペインのドルナスポーツと協議していると発表した。2022年末での撤退を検討する。電気自動車（EV）など新技術の開発に投資を振り向ける狙い。MotoGPは世界各国の有力選手が参戦するレース。スズキは1974年にMotoGPの前身となる「ワールドグランプリ」のGP500クラスに参戦した。1984～87年と2012～14年に一時的に活動を停止していたが、15年にMotoGPに復帰した。20年には契約する選手が年間チャンピオンを獲得した。,自動車・機械,スズキ、22年末でMotoGP撤退へ　運営側と協議,https://www.nikkei.com/article/DGXZQOUC129PW0S2A510C2000000/
05/12/2022,内閣府が12日発表した4月の景気ウオッチャー調査（街角景気）で、近畿2府4県の現状判断指数（DI、季節調整値）は前月比2.2ポイント上昇の50.6だった。改善は2カ月連続。新型コロナウイルスの感染拡大が落ち着き、DIは好不況の分かれ目となる「50」を4カ月ぶりに上回った。タクシー運転手は「修学旅行生が多く来ているため、忙しくなっている」と回答。コロナ禍からの経済回復は着実に進んでおり、「売り上げが前年比で30%増え、安定して伸びている」（商店街）など消費も力強さを増している。2～3カ月先の見通しを聞いた先行き判断DIは、1.7ポイント上昇の49.2だった。「ロシアのウクライナ侵攻に伴い、商品価格の高騰が避けられない」（家電量販店）と、ウクライナ情勢の影響を危惧する声が目立った。,関西,近畿の街角景気、2カ月連続改善　4月DI「50」上回る,https://www.nikkei.com/article/DGXZQOUF125P80S2A510C2000000/
05/12/2022,世界ボクシング機構（WBO）3階級元王者の田中恒成（畑中）が12日、オンラインで取材に応じ、次戦6月29日にWBOアジア・パシフィック・スーパーフライ級王者の橋詰将義（角海老宝石）に挑むタイトルマッチ（東京・後楽園ホール）に向け「世界戦に向けて大切な試合になる。無敗の王者を倒すことで自分の力の証明にもなる」と意気込みを語った。昨年12月に約1年ぶりの復帰戦で勝利。ことし3月上旬から約1カ月、米国でレベルの高い選手とスパーリングをこなし、多くの収穫があったという。「KOしか狙わない。できるだけ早い段階で完璧な形を目指す」と気持ちを込めた。〔共同〕,スポーツ,田中恒成「KOしか狙わない」　6月にアジアタイトル挑戦　,https://www.nikkei.com/article/DGXZQOKC12AWY0S2A510C2000000/
05/12/2022,青木　はるみさん（あおき・はるみ、本名=春美=はるみ、詩人）5月10日、誤嚥による窒息のため死去、88歳。告別式は13日正午から奈良市あやめ池北1の32の26のベルコシティホールあやめ池。喪主は長男、達也氏。1982年に詩集「鯨のアタマが立っていた」でH氏賞。著書に詩集「大和路のまつり」など。〔共同〕,,青木はるみさんが死去　詩人,https://www.nikkei.com/article/DGXZQOUF1277E0S2A510C2000000/
05/12/2022,政府は12日、東南アジア諸国連合（ASEAN）との協力の深化について議論する有識者会議の初会合を首相官邸で開いた。2023年に予定する特別首脳会議に向けて安全保障や経済などについて議論し、同年1月をメドに政府に提言する。日ASEANに関する有識者会議の立ち上げは政府として初めて。大学や経済界から12人の有識者を招き、月に1回ほどのペースで開く。23年はASEANとの友好協力50周年にあたる。,政治,日ASEAN連携強化策、23年1月に提言　政府が有識者会議,https://www.nikkei.com/article/DGXZQOUA128RV0S2A510C2000000/
05/12/2022,Jリーグは12日、日本代表などが出場する東アジアE-1選手権が7月19日から日本国内で行われることを受け、J1第22節のうち、6試合の開催日を7月17日から同16日に変更すると発表した。鹿島―神戸、清水―浦和、柏―札幌、湘南―福岡、G大阪―C大阪、鳥栖―横浜Mが対象。東アジアE-1選手権は中国で予定されていたが、新型コロナウイルス防疫対策を理由に開催を断念し、日本が代替地となった。〔共同〕,スポーツ,7月のJ1・6試合、日程を変更　E-1選手権開催で,https://www.nikkei.com/article/DGXZQOKC12ASW0S2A510C2000000/
05/12/2022,三井住友トラスト・ホールディングスが12日発表した2022年3月期の連結決算は、純利益が前の期比19%増の1690億円だった。不動産や資産運用などの手数料ビジネスが好調だったほか、株式相場の上昇などを受けて運用収益も伸びた。本業のもうけを示す実質業務純益は17%増の3460億円と、統合後で最高となった。融資の焦げ付きに備える与信関係費用は415億円と、前の期の78億円から膨らんだ。一部の取引先の業況悪化や、ロシアによるウクライナ侵攻など不透明な経済環境を受けた。23年3月期の純利益は前期比12%増の1900億円を見込む。,金融機関,三井住友トラスト、純利益19%増　22年3月期,https://www.nikkei.com/article/DGXZQOUB129680S2A510C2000000/
