12/14/2021,原油でアジア市場の指標となる中東産ドバイ原油のスポット価格は14日午後、下落した。取引の中心...,商品概況,ドバイ原油・14日午後、下落　72.90ドル前後,https://www.nikkei.com/article/DGXZQOUB147KN0U1A211C2000000/
12/14/2021,来年1月2、3日の東京箱根間往復大学駅伝に出場する順大が14日、オンラインで取材対応し、3000メートル障害で今夏の東京五輪に出場して日本史上最高の7位に入った三浦龍司は「1年間を通して、成長できている手応えがある。駅伝でも自分の殻を破りたい思いがすごくある」と決意を語った。1年生で臨んだ前回大会は1区で区間10位。期待に応えられなかっただけに「個人の希望としては1区で再チャレンジしたい」と雪辱に燃える。大舞台で経験を積み「メンタル面でも余裕が持てるようになった。練習も順調。残りの期間もうまく調整できれば区間賞が狙える」と自信を漂わせた。〔共同〕,スポーツ,順大・三浦「駅伝で殻を破る」　箱根での雪辱誓う,https://www.nikkei.com/article/DGXZQOKC146XZ0U1A211C2000000/
12/14/2021,【NQN香港=桶本典子】14日の韓国株式市場で総合株価指数（KOSPI）は小幅に3日続落した。終値は前日比13.71ポイント（0.45%）安の2987.95と、心理的な節目の3000を割り込み、6日以来およそ1週間ぶりの安値を付けた。新型コロナウイルスの変異型「オミクロン型」の世界での感染拡大への懸念が重荷となった。14～15日開催の米連邦公開市場委員会（FOMC）を前に、米金融政策を...,アジア株概況,韓国株14日　3日続落、1週間ぶり安値　FOMC控え様子見,https://www.nikkei.com/article/DGXZASB2IDE22_U1A211C2000000/
12/14/2021,札幌市は2022年2月に開幕する北京冬季五輪に秋元克広市長と副市長を出席させない。新型コロナウイルス禍で自由に視察や招致活動できないうえ、帰国後の隔離期間による公務への影響も懸念した。パラリンピック出席も見送る公算が大きい。五輪・パラの本大会は、招致を目指す地域の首長が競技場の視察や招致に向けたアピールの場として活用してきた。18年の平昌（韓国）冬季大会には、26年大会招致を目指していた秋元市長...,新型コロナ,北京五輪に出席せず　30年招致目指す札幌市長,https://www.nikkei.com/article/DGXZQOFC1443X0U1A211C2000000/
12/14/2021,外国為替市場では、個人投資家に広がる円の先安観が円の上値を重くしている。円が1ドル=112円台に急上昇した11月下旬から12月初めを含む週では、外国為替証拠金取引（FX）を手掛ける個人から、2012年11月にアベノミクス相場が始まり、円安が本格化して以降最大の円売りが出たもようだ。米金利の先高観などが背景だ。市場では個人の円売りによりドルの下値が切り上がり、円安基調が続く可能性が意識されている。...,ポジション,112円台でドル爆買い、FX個人　アベノミクス相場後最大,https://www.nikkei.com/article/DGXZQOCD141500U1A211C2000000/
12/14/2021,パナソニックの黒物家電事業を担当する豊嶋明事業部長は14日、日本経済新聞社などの取材に応じ、テレビ事業について「規模やシェアを追わず、本質的な価値訴求を事業の軸にしたい」と話した。同社は開発機種数を減らすほか、2022年以降は中国テレビ大手のTCLに低価格機種の大半の生産を委託する方針。高付加価値の製品に投資を集中し、黒字定着をはかる。パナソニックのテレビ事業は20年3月期まで2期連続で赤字だった。固定費の...,関西,パナソニックのテレビ事業部長「規模やシェア追わない」,https://www.nikkei.com/article/DGXZQOUF144YO0U1A211C2000000/
12/14/2021,中国政府は外交承認する相手を台湾から中国へ切り替えるよう圧力をかけており、見返りとして新型コロナウイルスワクチンの供給を申し出た――。中米グアテマラのジャマテイ大統領は話す。だが、中国が自国の一部と見なしている台湾を国家として承認している国々のなかで最も経済規模が大きいグアテマラは、近隣諸国が態度を変えても台湾との友好関係は変えるつもりはない。ジャマテイ氏は、フィナンシャル・タイムズ（FT）のイ...,FT,[FT]グアテマラ大統領、台湾の国家承認は信義の問題,https://www.nikkei.com/article/DGXZQOCB1451W0U1A211C2000000/
12/14/2021,今季取得した国内フリーエージェント権を行使せずに残留した広島の大瀬良大地投手が14日、マツダスタジアムで契約交渉に臨み、年俸1億8千万円プラス出来高払いの3年契約、総額8億1千万円で更改した。30歳のエースは「すっきりした気持ちでまた新しくやっていけると思うし、年齢的にも一番脂が乗っているかなと思う。キャリアハイの数字を出せるようにしっかり頑張っていきたい」と抱負を語った。今季は右脚のけがで戦列を離れたが、2年ぶりの2桁となる10勝（5敗）を挙げ、防御率3.07。4年連続で狙う開幕投手には森下が意欲を見せており「いい刺激をもらいながら、僕もいろんな投手に刺激を与えていける存在でありたいと思っている」と力強く話した。（金額は推定）〔共同〕,スポーツ,広島・大瀬良は1億8000万円で更改　来季から3年契約,https://www.nikkei.com/article/DGXZQOKC146SH0U1A211C2000000/
12/14/2021,パイロットコーポレーションは同社の玩具「メルちゃん」とコラボした未就学児向けの文具セットを23日に数量限定で発売する。鉛筆や色鉛筆、塗り絵など5種類の知育文具をそろえる。2022年に発売30周年を迎えるメルちゃんは親世代からの認知度も高く、親子で一緒に楽しく学ぶ需要を取り込む。「いっしょにおけいこはじめてのえんぴつセット」は4本の鉛筆と鉛筆削りをセットにした。鉛筆は力の弱い未就学児でも握りやすいように、通常よりも太く短い三角形の軸を採用した。芯の濃さは6Bで、弱い筆圧で書いても文字がわかりやすいようにした。「いっしょにおえかきはじめてのいろえんぴつセット」は色鉛筆12色と鉛筆削りをセットにした。鉛筆や色鉛筆を使って遊べる知育塗り絵の「いっしょにおけいこノート」は、ひらがなやカタカナ、数字の練習を色塗りと同じページにし、楽しく学習できるようにした。塗り絵と自由帳は針を使わずに製本し、安全面にも配慮した。価格は「いっしょにおけいこはじめてのえんぴつセット」が715円、「いっしょにおえかきはじめてのいろえんぴつセット」が1430円。「いっしょにおけいこノート」はB5サイズで385円。全国の文具店や百貨店、量販店などで販売する。,サービス・食品,パイロット、未就学児向け「メルちゃん」の知育文具,https://www.nikkei.com/article/DGXZQOUC134TA0T11C21A2000000/
12/14/2021,岸田文雄首相は14日、18歳以下への10万円相当の給付について年内に現金での一括支給を認める政府の指針を一両日中に地方自治体に示すと表明した。衆院予算委員会で「一両日中に届けたい。きょう、あすを言っている」と述べた。山際大志郎経済財政・再生相は首相の答弁に先立ち、2021年度補正予算案の成立前の「今週中」に提示すると説明した。首相は「山際氏は『今週中』と申し上げたが私としては一両日中に届けたい。努力したいと思う」と発言した。判断が遅くて自治体に混乱を招いているとの批判に関し「時期が遅いという指摘は謙虚に受け止めたい」と語った。政府が11月の経済対策に盛り込んだ10万円相当の給付は年内にも5万円を現金で支給し22年春に残りの5万円相当をクーポンで配るのが原則だった。首相は13日の衆院予算委で自治体の負担を抑えるため現金一括も認めると方針転換した。,税・予算,首相「一両日中に」、年内一括現金の指針　10万円給付,https://www.nikkei.com/article/DGXZQOUA145C20U1A211C2000000/
12/14/2021,14日の東京株式市場で日経平均株価は反落し、前日比207円85銭（0.73%）安の2万8432円64銭で終えた。新型コロナウイルスの変異型「オミクロン型」への警戒が再び意識され、欧米の株式相場が下落した流れから東京市場も売りが先行した。下げ幅は300円を超える場面があった。半面、米連邦公開市場委員会（FOMC）通過後の上昇をにらんだ押し目買いが入って午前には小幅な上昇に転じる場面もあった。英国でオミクロン型の感染者が初めて死亡したことを受け、感染拡大への警戒感が強まった。東京市場でも空運や鉄道などリオープン銘柄への売りが目立った。岸田文雄首相が衆院予算委員会で自社株買いを巡ってガイドライン設定の可能性を示唆する発言をしたと伝わると、日経平均は午後に下げ幅を拡大した。市場では「日銀が上場投資信託（ETF）の買い入れ方針を修正した今、日本株買いの最大の主体は事業会社の自社株買いで、需給が悪化する懸念がある」（みずほ証券の中村克彦マーケットストラテジスト）との声が聞かれた。14日からFOMCが開催される。米国時間15日午後に公表される決定内容やパウエル米連邦準備理事会（FRB）議長の会見での発言によっては通過後の相場が大きく動く可能性もあり、様子見ムードも強かった。JPX日経インデックス400は反落した。東証株価指数（TOPIX）は反落し、4.32ポイント（0.22%）安の1973.81で終えた。東証1部の売買代金は概算で2兆3251億円。売買高は9億8594万株だった。東証1部の値下がり銘柄数は1317と、全体の約6割を占めた。値上がりは766、変わらずは100銘柄だった。ANAHDが売られた。ファストリ、エムスリー、東エレクが安かった。一方、トヨタが買われた。東京海上や村田製も上昇した。〔日経QUICKニュース（NQN）〕,国内株概況,東証大引け　反落　自社株買い巡る首相発言に警戒,https://www.nikkei.com/article/DGXZASS0ISS16_U1A211C2000000/
12/14/2021,トヨタ自動車の豊田章男社長は14日、都内で開いた電気自動車（EV）戦略に関する説明会で、EVの販売目標について「2030年に350万台を目指す」と発表した。従来計画（30年に200万台）から大幅に上積みする。EV需要が世界で強まるとみており、販売ペースを加速する。EVの車種は30年までに30車種とする。うち高級車の「レクサス」ブランドについては、30年に欧州、北米、中国で、35年に世界でEV比率を100%に...,環境エネ・素材,「レクサス、35年にEV比率100%に」トヨタ社長会見,https://www.nikkei.com/article/DGXZQOFD135BF0T11C21A2000000/
12/14/2021,家庭用品の企画・販売を手がけるウィナーズ（東京・渋谷）は家電ブランド「レコルト」から、折り畳んで収納できる「しまえるミニ洗濯機」を発売した。キッチンクロスやマスクなど、小容量の洗濯に対応する。洗濯機のバケツ部分を折り畳める構造にしたため、コンパクトに収納できる。共働き世帯など、ファミリー層を中心に需要を見込む。バケツに洗剤と水を入れ、フタをしてスイッチを押すだけで洗濯できる。洗濯可能な量の目安は最大200グラムで、靴下なら3～4足、フェースタオルなら2～3枚を一度に洗えるという。布の傷みを抑えたり、しつこい汚れを落としたりと、洗濯物によって3種類のモードを選べるようにした。バケツの側面に柔らかい素材を使い、使用時の半分の大きさに折り畳めるようにした。収納時の高さは約13センチになり、コンパクトなスペースでも収納しやすい。電源アダプターをコンセントに差し込めば、どこでも洗濯できる。洗濯機の重量は約2キログラム。希望小売価格は9900円で、同社の公式オンラインストアや家電量販店などで取り扱う。,サービス・食品,ウィナーズ、折り畳んで収納できるミニ洗濯機,https://www.nikkei.com/article/DGXZQOUC1018I0Q1A211C2000000/
12/14/2021,新型コロナウイルスの新たな変異型「オミクロン型」の国内での流行の可能性が注目されている。国際医療福祉大学の和田耕治教授は、オミクロン型の重症化リスクが重要だとみており、それが判明した場合にどのように感染対策などを修正するのか、政府は事前に決めておくべきだと指摘する。――英保健安全局がオミクロン型へのワクチン効果について調査結果を公表しました。データをどうみますか。「ワクチンを2回接種した人で、...,新型コロナ,オミクロンの重症度想定、事前に対策決定を　和田教授,https://www.nikkei.com/article/DGXZQOUC0756N0X01C21A2000000/
12/14/2021,14日のJPX日経インデックス400は反落した。終値は前日比38.90ポイント（0.22%）安の1万7838.24だった。新型コロナウイルスの変異型「オミクロン型」への警戒感が改めて意識され、相場の重荷となった。岸田文雄首相の自社株買いを巡る発言が伝わると、投資家心理が悪化して下げ幅を拡大した。東エレク、日立、リクルートが売られた。半面、トヨタや東京海上、NTTが買われた。〔日経QUICKニュース（NQN）〕,国内株概況,JPX日経400大引け　反落　38ポイント安の1万7838,https://www.nikkei.com/article/DGXZASFL14HRX_U1A211C2000000/
12/14/2021,14日の新興企業向け株式市場で、東証マザーズ指数は4日続落した。終値は前日比29.89ポイント（2.92%）安い993.77と、2020年7月31日以来の安値だった。新型コロナウイルスの変異型「オミクロン型」の感染拡大への懸念から前日の米株式相場が下落した流れを受け、幅広い銘柄に売りが出た。新規株式公開（IPO）ラッシュを控えた換金売りも重荷だった。年末を前に、個人投資家が損出しを目的とした売りを出しているとの見方もあった。メルカリやビジョナルなど時価総額の大きい銘柄の売りが目立った。半面、ステムリムは制限値幅の上限（ストップ高水準）で配分された。ヘリオスやJIGSAWも買われた。日経ジャスダック平均株価は反落した。終値は前日比28円52銭（0.73%）安い3881円71銭だった。ジャスダック市場の売買代金は概算で568億円、売買高は6693万株だった。ワークマンとフェローテクが下落した。一方でアンビスHDとフクダ電は上昇した。〔日経QUICKニュース（NQN）〕,国内株概況,新興株14日　マザーズが20年7月末以来の安値、ジャスダック反落,https://www.nikkei.com/article/DGXZASS0ISST2_U1A211C2000000/
12/14/2021,需要期を迎えた灯油市場に供給過剰感が出ている。在庫は過去5年間の平均を5%上回る。暖冬傾向で販売が振るわないほか、13年ぶりの高値まで上昇したことで需要が落ちている。在庫の増加が続くと、原油の値上がりに比べた灯油価格の上昇を抑える要因となる。石油連盟（東京・千代田）の統計によると、12月上旬時点の国内の灯油在庫量は277万キロリットル。新型コロナウイルス禍が直撃した20年の同時期と比べると5%減...,商品ニュース,灯油に過剰感　暖冬で販売停滞、原油高転嫁遅れも,https://www.nikkei.com/article/DGXZQOUB134A30T11C21A2000000/
12/14/2021,星野リゾート（長野県軽井沢町）は14日、北海道の11施設でセイコーマートのポイント会員向けに最大3割引の宿泊プランを発売すると発表した。札幌市で記者会見した星野佳路代表は「道内需要の取り込みに必要。北海道旅行の1番手（で選ばれるホテル）になりたい」と語った。「旅々貯まる北海道旅プロジェクト」は2022年2月以降が対象。14日から専用ホームページで予約を受け付ける。宿泊料金や飲食代の2%がセイコー...,インバウンド,星野リゾートが3割引プラン　北海道でセコマと組む,https://www.nikkei.com/article/DGXZQOFC141F10U1A211C2000000/
12/14/2021,東京都調布市の東京外郭環状道路（外環道）トンネル工事現場付近で起きた道路陥没事故で、東日本高速道路は14日、掘削部分の真上を除いた周辺地盤についての追加調査の結果をまとめ「トンネル工事に伴う振動で周辺地盤を弱めた事実は確認されなかった」と説明した。東日本高速は掘削部分の真上の地盤について補修を予定している。住民の要望を受けて地盤工学の専門家が実施した調査では、真上だけでなく周辺の地盤も緩んでいるという見方が出ており、同社が周辺地盤の状況を調べていた。東日本高速は今回の調査で、トンネルの真上以外の周辺3カ所で掘削調査や採取した土の振動実験を実施した。その結果、地盤に数ミリ以上の特異な空洞などは確認できず、トンネル工事の影響がないエリアと比較したところ地盤の強度に違いはなかったという。陥没は2020年10月に発生し、縦約5メートル、横約3メートル、深さ約5メートルに及んだ。これまでに陥没地点付近で複数の空洞が発見された。東日本高速は21年2月、特殊な地盤下で掘削機（シールドマシン）に支障が生じ、土砂を取り込みすぎる施工ミスが原因とする調査結果をまとめた。陥没を巡ってはこのほか、日本経済新聞が衛星解析技術を持つイタリアのTREアルタミラから入手したデータで、工事直後にトンネルの真上以外でも2～3センチメートル程度の沈下と隆起が起きたことが判明している。,事件・司法,調布陥没、「周辺地盤に緩みなく」　東日本高速,https://www.nikkei.com/article/DGXZQOUE145EM0U1A211C2000000/
