01/07/2022,総務省が7日発表した2021年12月の東京都区部・消費者物価指数（CPI、中旬速報値、2020年=100）は、生鮮食品を除く総合が100.0と前年同月比0.5%上昇した。上昇は4カ月連続。QUICKがまとめた市場予想の中央値は0.5%上昇だった。生鮮食品とエネルギーを除く総合は99.5と前年同月比0.3%の下落だった。生鮮食品を含む総合は0.8%の上昇だった。〔日経QUICKニュース（NQN）〕,,21年12月の都区部消費者物価、0.5%上昇　上昇は4カ月連続,https://www.nikkei.com/article/DGXZASFL05H7X_V00C22A1000000/
01/07/2022,総務省が7日発表した2021年11月の家計調査によると、2人以上世帯の消費支出は1世帯あたり27万7029円で、物価変動の影響を除いた実質で前年同月比1.3%減少した。減少は4カ月連続。QUICKがまとめた市場予想の中央値は1.6%増だった。勤労者（サラリーマン）世帯の1世帯あたりの消費支出は30万4207円と、実質で前年同月比1.1%減少した。減少は2カ月ぶり。〔日経QUICKニュース（NQN）〕,,21年11月の実質消費支出、前年比1.3%減　市場予想1.6%増,https://www.nikkei.com/article/DGXZASFL05HA2_V00C22A1000000/
01/07/2022,総務省が7日発表した2021年12月の東京都区部の消費者物価指数（CPI、2020年=100、中旬速報値）は、変動の大きい生鮮食品を除く総合...,経済,12月の都区部消費者物価、前年比0.5%上昇　原油高で,https://www.nikkei.com/article/DGXZQOUA070JC0X00C22A1000000/
01/07/2022,総務省が7日発表した2021年11月の家計調査によると、2人以上世帯の消費支出は27万7029円と、物価変動の影響を除いた実質で前年同月比1.3%減だった。前年同月を下回るのは4カ月連続。新型コロナウイルスの新規感染者数が落ち着き人出が回復したが、外食や食品関連の消費が振るわなかった。前月比（季節調整済み）でも実質1.2%減だった。前年同月比のマイナス幅は10月(0.6%減)に比べて拡大した。品目別にみると「食料」は前年同月比3.0%減だった。「交通・通信」は5.8%増だった。,経済,11月の消費支出1.3%減、4カ月連続マイナス,https://www.nikkei.com/article/DGXZQOUA069LZ0W2A100C2000000/
01/07/2022,厚生労働省が7日発表した2021年11月の毎月勤労統計調査（速報、従業員5人以上）によると、物価変動の影響を除いた実質賃金は前年同月比で1.6%減少した。減少は3カ月連続。消費者物価が上昇基調を強めており、実質賃金を押し下げた。名目賃金にあたる1人あたりの現金給与総額は、前年同月比横ばいの28万0398円だった。前月まで8カ月連続で増加していた。基本給にあたる所定内給与は0.3%増、ボーナスなど特別に支払われた給与は7.9%減、残業代などの所定外給与は2.7%増だった。残業時間が大幅に減少していた前年同月の反動が出た。パートタイム労働者比率は31.87%と、前年同月比0.35ポイント上昇した。上昇は8カ月連続。時間あたり給与は同1.4%増の1223円だった。〔日経QUICKニュース（NQN）〕,,21年11月の実質賃金、前年同月比1.6%減　消費者物価上昇が重く,https://www.nikkei.com/article/DGXZASFL06HYZ_W2A100C2000000/
01/07/2022,【NQNニューヨーク=古江敦子】6日のニューヨーク外国為替市場で円相場は上昇し、前日比25銭円高・ドル安の1ドル=115円80～90銭で取引を終えた。欧米株式相場の下落が投資家心理を冷やし、低リスク通貨とされる円は買いが優勢となった。取引終了にかけては7日の米雇用統計の発表を前にドルが買い直され、円は上げ幅を縮めた。5日発表の米連邦公開市場委員会（FOMC）議事要旨で示された米連邦準備理事会（FRB）のタカ派姿勢を受けたドル買いはアジア・欧州市場でひとまず一巡し、米国市場の早朝は欧州株式相場の下落を受けた円買い・ドル売りが先行した。米ダウ工業株30種平均が前日比170ドル安と続落し、投資家が運用リスクを取りにくくなるとみた円買いも入った。市場では「FRBが利上げや保有資産の縮小を進めるとの観測から市場参加者は対ドルで円の売り持ち高を増やしてきた。議事要旨で材料が一旦出つくしたとみて、利益確定の円買い・ドル売りが出た」（ジェフリーズのブラッド・ベクテル氏）との指摘があった。取引終了にかけて円は上値が重くなった。7日発表の昨年12月の米雇用統計では非農業部門の雇用者数の伸びが前月を上回るとの予想が多く、ドルを買い直す動きが見られたという。円の高値は115円63銭、安値は115円95銭だった。円は対ユーロで3営業日ぶりに反発し、前日比45銭円高・ユーロ安の1ユーロ=130円85～95銭で取引を終えた。欧米株式相場の下落で投資家心理が悪化し、低リスク通貨の円はユーロに対しても買われた。ユーロは対ドルで反落し、前日比0.0010ドル安い1ユーロ=1.1295～1305ドルで終えた。欧米株式相場の下落を受け、リスク回避目的でドルを買ってユーロを売る動きが優勢となった。この日の安値は1.1287ドル、高値は1.1332ドルだった。,為替概況,NY円、上昇　1ドル=115円80～90銭　株安でリスク回避の円買い,https://www.nikkei.com/article/DGXZASM7IAA05_X00C22A1000000/
01/07/2022,【ニューヨーク=吉田圭織】北朝鮮が「極超音速ミサイル」だったと主張する飛翔（ひしょう）体の発射実験を受け、国連の安全保障理事会が緊急会合を開く調整を進めていることが6日、分かった。複数の安保理外交筋が明らかにした。米国、英国、フランスなどを含む5カ国は同日、非公開の会合を要請し、10日の開催をめざしている。声明文の発表は現時点では予定されていない。フランスのドリビエール国連大使は同日、ツイッタ...,北朝鮮,国連安保理、緊急会合開催へ　北朝鮮ミサイル発射で,https://www.nikkei.com/article/DGXZQOGN070AR0X00C22A1000000/
01/07/2022,6日の米株式市場でダウ工業株30種平均は続落した。5日に公開された2021年12月の米連邦公開市場委員会（FOMC）議事要旨を受けて、米連邦準備理事会（FRB）が金融政策の正常化を急ぐとの警戒感が広がり、売りが続いた。ハイテク株比率が高いナスダック総合株価指数も続落。前日に大幅に下げた反動から一時プラス圏で推移する場面もあったが、引けにかけて売りに押された。ウォール街で取引が開始される午前9時半...,NY特急便,米国の分断、企業を翻弄　市場に政治リスク(NY特急便）,https://www.nikkei.com/article/DGXZQOGN06DK40W2A100C2000000/
01/07/2022,【シカゴ支局】6日の日経平均先物は続落した。3月物は前日比295円安の2万8705円で引け、6日の大取終値を205円上回った。米利上げ前倒しを警戒する売りが続いた。5日発表の米連邦公開市場委員会（FOMC）議事要旨などを手掛かりに金融当局は早ければ3月にも利上げを実施するとの見方が広がった。市場関係者は7日発表の12月の米雇用統計に注目している。,国内株概況,シカゴ日本株先物概況・6日,https://www.nikkei.com/article/DGXZASH2ICE01_X00C22A1000000/
