11/28/2021,大相撲の西十両13枚目、平戸海（21）=本名坂口雄貴、長崎県出身、境川部屋=が九州場所千秋楽の28日、日本相撲協会に「右足関節靱帯損傷にて約3週間の安静加療を要する見込み」との診断書を提出して休場した。7敗目を喫した14日目の王鵬戦で負傷し、千秋楽の取組から外れていた。新十両の今場所は負け越しとなった。休場は2016年名古屋場所以来2度目。今場所の十両以上の休場は途中出場者を含めて4人だった。〔共同〕,スポーツ,十両・平戸海、右足痛め休場　九州場所千秋楽,https://www.nikkei.com/article/DGXZQOKC281AT0Y1A121C2000000/
11/28/2021,ドイツの首相を16年間務めたメルケル氏が12月に退任する。欧州債務危機への対応などで指導力を発揮したが、現実主義の限界も露呈した。中国との近すぎる距離、欧州統合の停滞といった課題はショルツ次期首相に引き継がれる。台湾の国際機関への参加を支持し、新疆での人権侵害を取り上げる――。ショルツ氏のドイツ社会民主党、緑の党、自由民主党が24日公表した連立合意書には中国への厳しい言葉が並んだ。南シナ海問題...,ヨーロッパ,転機の独中蜜月、現実主義の限界　課題は次期政権へ　,https://www.nikkei.com/article/DGXZQOGR229B40S1A121C2000000/
11/28/2021,世界最大の発行規模を誇る米国債市場の意外なもろさに警戒感が高まっている。国債市場の担い手の変化に当局の対応が追いつかず、流動性が急減するリスクがあることが鮮明になってきた。金利が乱高下すれば、米連邦準備理事会（FRB）の出口戦略に影を落とす。「短期金利やスワップ取引のボラティリティー（変動率）が目に見えて大きくなった。多くのヘッジファンドが急変動で損失を抱えて取引を控え、流動性が細っている」。米...,Market Beat,米国債市場に流動性不安　進む機械化、ルール整備後手に,https://www.nikkei.com/article/DGXZQOGN242BA0U1A121C2000000/
11/28/2021,警視庁捜査1課は28日、東京都新宿区歌舞伎町1のビル屋上で男性に暴行を加え、死亡させたとして、住所、職業不詳の関口寿喜容疑者（26）と18歳の少年2人を傷害致死の疑いで逮捕した。捜査1課によると、死亡したのは住所、職業不詳の氏家彰さん（43）。逮捕された3人は容疑を否認する一方で「（氏家さんに）恨みがあった」と話しているという。関口容疑者らは若者の間で「トー横」と呼ばれる歌舞伎町の広場に集まる知人とみられる。同課はトラブルの有無や事件の具体的な経緯を調べている。現場近くの防犯カメラに、27日午前7時55分ごろから氏家さんとともに関口容疑者ら計7人がビルに入る映像が映っていたことから浮上した〔共同〕,事件・司法,東京・歌舞伎町ビルで男性死亡　傷害致死容疑で3人逮捕,https://www.nikkei.com/article/DGXZQOUE280UK0Y1A121C2000000/
11/28/2021,【ジェノバ（イタリア）=共同】サッカーの海外各リーグは27日、各地で行われ、スペイン1部でマジョルカの久保建英はヘタフェ戦の後半23分から右MFで出場し、膝を痛めた9月22日のレアル・マドリード戦以来、約2カ月ぶりに公式戦のピッチに立った。試合は0-0で引き分けた。イタリア1部（セリエA）で、左膝打撲の影響で前節を欠場したサンプドリアの吉田麻也はベローナ戦で0-0の前半35分から出場した。チームは3-1で逆転勝ち。イングランド・プレミアリーグでアーセナルの冨安健洋は2-0で勝ったニューカッスル戦にフル出場し、後半21分にチームの2点目をアシストした。リバプールの南野拓実は4-0で勝ったサウサンプトン戦で後半36分から出場した。ドイツ1部でボーフムの浅野拓磨はフライブルク戦で2-1の後半40分までプレーした。チームはそのまま逃げ切った。ビーレフェルトの奥川雅也は0-1で敗れたバイエルン・ミュンヘン戦にフル出場した。ベルギー1部でシントトロイデンの林大地はセラン戦にフル出場し、2試合連続ゴールはならなかった。チームは0-2の黒星。GKシュミット・ダニエル、橋岡大樹、鈴木優磨もフル出場し、原大智は後半開始から出場した。オランダ1部でズウォレの中山雄太は0-0で引き分けたRKCワールウェイク戦にフル出場した。,スポーツ,吉田が復帰、冨安アシスト　海外サッカー,https://www.nikkei.com/article/DGXZQOKC2817X0Y1A121C2000000/
11/28/2021,国の基金事業の運営状況を年度別に公開する「基金シート」で大量のルール違反が判明した。日本経済新聞が2018～21年度の開示分を調べたところ、少なくとも5割で作成要領に反した記載や必要な情報の記載漏れがあった。データはデジタル化されているが、書式や書くべき内容は統一されていない。国民の網羅的な分析を難しくし、政策検証を妨げている。国の基金事業は複数年度にわたる資金を確保し、独立行政法人や社団法人に...,国費解剖,基金の情報公開、5割ルール違反　政策データ検証阻む,https://www.nikkei.com/article/DGXZQOUE09E0R0Z00C21A9000000/
