11/21/2021,八回に主砲・村上の2ランで勝ち越したヤクルトだが、九回裏に悪夢が待っていた。マウンドに上がったのは今季途中に中継ぎから転向した守護神・マクガフ。31セーブをあげ、セットアッパーの清水とともに「勝利の方程式」を担ってきた右腕だが、オリックスの先頭・紅林にいきなり安打を許す。【関連記事】続く代打・ジョーンズに四球を与えると、相手の押せ押せムードに動揺したか、1番・福田のバント処理で無理に三塁へ送球。これが野選と...,スポーツ,ヤクルト悪夢の九回　マクガフ誤算で「方程式」崩れる,https://www.nikkei.com/article/DGXZQODH203T00Q1A121C2000000/
11/21/2021,▽9時46分　東京・赤坂の衆院議員宿舎発。57分　東京・市谷本村町の防衛省。自衛隊殉職隊員追悼式に参列し、追悼の辞、献花。▽10時59分　東京・赤坂の衆院議員宿舎。▽11時55分　羽田空港。▽13時29分　全日空589便で松山空港。▽14時3分　松山市の愛媛県立松山東高校。タブレット端末を使った模擬授業を体験。生徒らと車座で意見交換。中村時広県知事同席。▽15時9分　同市の温泉施設「道後温泉本館」前。野志克仁市長出迎え。15分　徒歩で温泉施設「道後温泉別館　飛鳥乃湯泉」。観光業関係者らと車座で意見交換。県知事同席。▽16時6分　報道各社のインタビュー。12分　徒歩で「道後商店街」。視察。土産物店「絣屋本店」でみかんジュースやかまぼこなどを購入。49分　同市の松山観光港。50分　塩崎恭久元厚労相。▽18時13分　瀬戸内海汽船の高速船「スーパージェット」で広島市南区の広島港。43分　同市中区のリーガロイヤルホテル広島。宴会場「ロイヤルホール」で麻生副総裁の後援会「中国素淮会」のセミナーに出席し、あいさつ。▽20時7分　広島空港。▽21時33分　全日空686便で羽田空港。▽22時11分　東京・赤坂の衆院議員宿舎。,政治,20日の岸田首相の動静,https://www.nikkei.com/article/DGXZQOUA200ZX0Q1A121C2000000/
11/21/2021,オリックスにとって25年ぶりとなる日本シリーズの舞台。四半世紀もため込んだエネルギーが一気に放出されたような劇的な最終回だった。【関連記事】1-3の九回、無死満塁の好機をつくると、宗が中前への2点打で追いついた。京セラドームにわれんばかりの大歓声がこだまする。「宗がこれまでにないくらい球場を盛り上げてくれたので、その勢いでいかせてもらった」と続く吉田正。なおも無死一、二塁。動揺するヤクルトの守護神マクガフ...,スポーツ,オリックス、逆転サヨナラ勝ち　吉田正が初球で決めた,https://www.nikkei.com/article/DGXZQODH203P70Q1A121C2000000/
11/21/2021,【グルノーブル=共同】フィギュアスケートのグランプリ（GP）シリーズ第5戦、フランス杯最終日は20日、グルノーブルで行われ、女子はショートプログラム（SP）6位の樋口新葉（明大）がフリー3位で自己ベストの141.04点をマークし、合計204.91点で3位に入った。横井ゆは菜（中京大）は176.93点で9位。昨季の世界選手権覇者のアンナ・シェルバコワ（ロシア）がSP、フリーともに1位の合計229.69点を出し、GPで今季2連勝、通算4勝目を挙げた。,スポーツ,樋口新葉が3位、横井ゆは菜は9位　フィギュア仏杯,https://www.nikkei.com/article/DGXZQOKC2042U0Q1A121C2000000/
11/21/2021,電気自動車（EV）トラックのスタートアップ、HWエレクトロ（東京・江東）は20日、軽トラックのEVを発売したと発表した。すでにナンバープレートを取得し、公道を走れる。現時点では国内で唯一、新車で購入できる軽EVトラックだという。希望小売価格は249万7000円。2022年に2000台の販売を目指す。発売したのは軽自動車の規格を満たす「エレモーK」で、同日から予約を受け付け始めた。用途として家庭までのラストワンマイルの配送や、調理設備を備えるキッチンカー、農漁業での運搬などを想定している。補助金の適用を申請しており、認められれば100万円台での購入が視野に入るという。1回の充電による航続距離は120キロメートルで充電時間は6～8時間。すでに中小の配送業者などが導入を決めたという。中国で生産された米国ブランドのEVをHWエレクトロが輸入し、国内のニーズに合うよう部品を付けかえるなど改良した。同社はすでに、積載量が400～500キログラムのEVトラックを国内で販売している。EVはガソリン車に比べて車体価格が高く、普及の課題の1つとなっている。同日、都内で開かれたイベントに登壇した蕭偉城（ショウ・ウェイチェン）社長は「将来的には航続距離1キロメートルに対し1万円の車体価格にすることが目標だ」と話した。製造コストの低減のほか、電池や物流コストの削減で実現できるという。軽商用車の電動化を巡っては、大手メーカーも動いている。スズキとダイハツ工業は7月、トヨタ自動車やいすゞ自動車などの共同出資会社「コマーシャル・ジャパン・パートナーシップ・テクノロジーズ（CJPT）」に参画すると発表。軽商用EVの技術開発などで連携している。,自動車・機械,EV新興、国内唯一の軽EVトラック発売　249万円で,https://www.nikkei.com/article/DGXZQOUC201KZ0Q1A121C2000000/
11/21/2021,今季限りの引退を19日に発表したC大阪のFW大久保は、後半開始からの登場だった。対戦相手は2013年から延べ5シーズンにわたって在籍し、3年連続得点王というキャリアのピークを過ごした王者・川崎だ。投入時点で0-2。試合はその後も川崎ペースで進み、J1通算192点目はならなかったが...,スポーツ,引退表明のC大阪・大久保　古巣川崎から胴上げも,https://www.nikkei.com/article/DGXZQODH202DW0Q1A121C2000000/
11/21/2021,大関には甚だ失礼ながら、貴景勝が予想外の強さで白星を重ねている。かど番を辛くも脱した先場所とは別人の充実ぶりだ。この日はベテラン隠岐の海戦。突き上げるようなぶちかましからハズ押しで一気に走り、勝負をつけた。まさに電車道。この日だけではない。今場所の貴景勝はひと味もふた味も違う。持ち前の強く、重い当たりが連日さく裂。難敵を次々と退け、優勝した昨年11月以来となる無傷での勝ち越しに王手をかけた。...,スポーツ,貴景勝、当たり強烈7連勝　頭下げすぎず安定感,https://www.nikkei.com/article/DGXZQODH203340Q1A121C2000000/
