11/12/2021,【NQNシンガポール=今　晶】12日の日経アジア300指数は反発している。16時時点は前日比0.45%高の1713.38だった。前日の米ナスダック総合株価指数やフィラデルフィア半導体株指数（SOX）の上昇を受けてアジアでもハイテク株の一角が買われ、指数を押し上げた。外国為替市場ではアジア通貨の対米ドルでの下落が一服。買い戻しが強まる場面もあった。アジア金融資産の魅力低下や資金流出への懸念が薄れ、...,アジア株概況,アジア300指数・16時　反発、ハイテク株がけん引　米ドル高一服も支え,https://www.nikkei.com/article/DGXZASFL12HUB_S1A111C2000000/
11/12/2021,海外投資家の中国の株式と債券の保有残高が今年に入り9カ月間で約1200億ドル（約13兆7000億円）増加した。市場の乱高下や中国政府による規制強化にもかかわらず、海外投資家は高収益を狙って中国市場に熱い視線を注いでいる。本紙フィナンシャル・タイムズ（FT）の集計によると、海外投資家が保有する人民元建ての株式と債券は9月末時点で7兆5000億元（約134兆円）に上り、2020年末から約7600億元...,FT,[FT]海外投資家が中国市場に熱視線　高収益狙いで,https://www.nikkei.com/article/DGXZQOCB080OJ0Y1A101C2000000/
11/12/2021,東芝は12日、主要事業ごとに会社全体を3社に分割することを柱とした中期経営計画を発表した。インフラとデバイスの2事業会社と、半導体メモリー大手のキオクシアホールディングス株などを管理する会社に分かれる。中計は4月に社長兼最高経営責任者（CEO）へ復帰した綱川智氏が企業価値の最大化に向けて策定を表明していた。日経電子版では、午後4時からの説明会の様子をタイムライン形式でまとめる。【16時02分】説明会始まる東芝のオンライン説明会が始まった。東芝の出席者は綱川智最高経営責任者（CEO）、畠沢守副社長、ポール・ブロフ戦略委員会委員長ら。綱川氏は冒頭、12日に公表された20年7月の株主総会に関するガバナンス強化委員会の報告について、「『市場が求める企業倫理に反する』と評価されたのは恥ずべきことだ。再発防止に向け、しっかりガバナンスについての議論をする」と決意を示した。,エレクトロニクス,東芝綱川社長「3社分割はベストな結論」,https://www.nikkei.com/article/DGXZQOUC11DBK0R11C21A1000000/
11/12/2021,がん免疫薬「オプジーボ」を巡り、ノーベル生理学・医学賞を受賞した京都大学の本庶佑特別教授が小野薬品工業に特許使用料の分配金約262億円の支払いを求めた訴訟で、本庶氏と小野薬品の間で12日、和解が成立した。小野薬品が本庶氏に一連の争いの解決金として50億円を支払う。これとは別に京都大学に設立する「小野薬品・本庶記念研究基金」に対して230億円を寄付する。本庶氏はこれまで、小野薬品が米製薬会社メルクとの特許侵害訴訟の和解で受け取った金額に対し、本庶氏側への分配金が不当に少ないと主張してきた。大阪地裁は9月に和解案を提示し、両者が対応を検討していた。,関西,オプジーボ訴訟、280億円で和解　小野薬品が本庶氏側と,https://www.nikkei.com/article/DGXZQOHC17CFN0X10C21A9000000/
11/12/2021,【北京=川手伊織】2022年秋からの3期目入りが固まった中国の習近平（シー・ジンピン）指導部は、スローガンに掲げる「共同富裕」（共に豊かになる）の実現に向けた具体策を実行する。日本の固定資産税にあたる不動産税を導入し、配当やぜいたく品への課税も強化して分配機能を高める。22年に始まる中国版「団塊世代」の大量退職を受け、公的年金制度の見直しも重要な課題となる。「所得再分配の機能は、税制度の整備や税徴収の強化などを通じてより高めなければならない」。共産党中央財経委員会弁公室の韓文秀副主任は12日の記者会見で、税制改革の重要性を強調した。11日に閉幕した党の第19期中央委員会第6回全体会議（6中全会）で、22年秋の党大会で習総書記（国家主席）の3期目入りが決まるのは確実になった。経済政策は社会主義の色彩を強める。軸は、国内の所得格差を縮める共同富裕の推進だ。中国の格差はなお縮まらない。所得格差を示すジニ係数は16年以降ほぼ横ばいだ。特に都市内の開きが目立つ。世帯ごとの1人当たり可処分所得の上位20%は20年、下位20%の6.2倍に達した。習指導部が発足した12年の5.0倍から高まった。習氏は8月の党中央財経委員会で、税制改革による分配の拡充に言及した。配当や資産譲渡益など資本所得への徴税を強化し、ぜいたく品や嗜好品に課す消費税の対象を広げる。同会議の後にIT（情報技術）企業の創業者らがこぞって寄付を申し出た。寄付は今後も税制優遇で促す。不動産税の試験導入にも踏み切る。国有である土地の使用権と建物にかかる所有税だ。2軒目以降が課税対象になりそうだ。試験期間は5年。習指導部はモデル都市での実験を踏まえ、全国展開を視野に入れる。価格が高騰したマンションが都市内の格差の象徴になっている。中国の家計資産の6割は不動産だ。不動産税を導入する狙いは、投機を防ぎ、中古市場に売り出す物件を増やして価格を抑えることだ。障害はなお多い。試験都市の候補には広東省深圳市などがあがるが、首都の北京市は外れる公算が大きい。党高官やその親族が所有する物件が多く、政治的な反発が強いためだとされる。最近の不動産相場の冷え込みも逆風だ。「1年超延期すべきだ」。当局が8日深圳市で開いた会議では、不動産会社や金融機関から新税導入の先送りを求める声が上がった。政府の規制強化で、9月の新築マンション価格が6年5カ月ぶりに下落に転じた。新税が購買意欲を一段とそぐとの懸念が関係者の頭をよぎる。習指導部が分配を重視する背景には、成長率の鈍化もある。中国人民銀行（中央銀行）の試算では、21年に5.7%の潜在成長率は25年、5.1%に下がる。長年の産児制限による働き手の減少や急速な高齢化が成長の足かせになる。中国経済が成熟すれば低成長へ移行するのは当然だが、労働人口の減少が要因ならば、好ましくはない。高齢化は大きな問題だ。サラリーマンや自営業者が加入する公的年金は14年から年金支給が保険料収入を上回っている。中国社会科学院は19年、積立金が35年に枯渇すると試算した。22年には大量退職時代を迎える。社会保障制度の見直しは急務だ。中国政府は、25年までの5カ年計画の主要課題に法定退職年齢の引き上げを盛り込んだ。定年延長で働き手を増やし、年金の支給開始年齢も先に延ばす方針だ。出生数の減少に歯止めをかけるため、1組の夫婦に3人目の出産を認めた。子ども手当の支給や育児休暇の延長といった支援策のほか、教育コストを下げるため学習塾への規制を強化した。一方、長年の産児制限で世帯には「子は1人で十分」という考えが浸透した。19年に生まれた第1子は600万人超とみられ、12年から半減した。この状況では第2子以降の出産増も期待できない。少子化対策の効果は未知数だ。,習政権,3期目確実の習政権、分配強化へ税制改革　高齢化対策も,https://www.nikkei.com/article/DGXZQOGM106KM0Q1A111C2000000/
11/12/2021,日米中や台湾など21カ国・地域でつくるアジア太平洋経済協力会議（APEC）の首脳会議が12日、オンライン形式で開かれる。台湾を巡り、米中対立の緊張感が高まる中、中国と台湾双方が加盟を申請した環太平洋経済連携協定（TPP）を巡る、首脳らの議論が焦点となる。「TPPは議論の中心ではなかったが・・・」。10日にあったAPEC閣僚会議後の記者会見で、議長国ニュージーランド（NZ）のオコナー貿易・輸出振興...,中国・台湾,TPP加盟巡り、中台の攻防必至　APEC首脳会議で,https://www.nikkei.com/article/DGXZQOGM10AEQ0Q1A111C2000000/
11/12/2021,東芝は12日、会社全体を3社に分割し、それぞれ2023年度下期をめどに上場させる計画を発表した。同日発表した中期経営計画に盛り込んだ。インフラとデバイスの2事業会社と、半導体メモリー大手のキオクシアホールディングス株などを管理する会社に分かれる。キオクシアHD株を売却して得る資金はすべて株主還元に充てる新方針も示した。従来は「過半」を還元に充てるとしていた。日本の大企業が会社を完全に分割し、上場する初...,エレクトロニクス,東芝、23年度に上場3社へ分割　新中計発表,https://www.nikkei.com/article/DGXZQOUC11DMU0R11C21A1000000/
11/12/2021,投資信託協会が12日発表した10月の投信概況によると、設定額から解約・償還額を差し引いた公募投信の資金動向は6851億円の流入超だった。54カ月連続の流入超で、過去最長を更新した。海外株式で運用する投信のほか、上場投資信託（ETF）に資金が流入した。純資産残高は162兆8194億円で、3カ月連続で過去最高を更新した。10月の日経平均株価は月間で2%下落したが、米ダウ工業株30種平均など海外株の相場上昇が運用益の増加に寄与した。ETFは3874億円の流入超だった。10月は日銀によるETF購入が700億円程度あったほか、そのほかの機関投資家も購入した。,投資信託,10月の投信、54カ月連続の流入超　過去最長更新,https://www.nikkei.com/article/DGXZQOUB126KJ0S1A111C2000000/
11/12/2021,【NQN香港=須永太一朗】12日の韓国株式市場で総合株価指数（KOSPI）は3日ぶりに反発した。終値は前日比43.88ポイント（1.50%）高の2968.80と1週間ぶりの高値だった。前日の米ハイテク株高を受けて、韓国市場でも朝方から主力ハイテク株の一角に買いが入った。国内で新型コロナウイルスの新規感染者数が高止まりしているものの、政府は外国人観光客の隔離免除措置の拡大...,アジア株概況,韓国株12日　3日ぶり反発、米ハイテク株高や景気回復期待で,https://www.nikkei.com/article/DGXZASB2IDE22_S1A111C2000000/
11/12/2021,米プロフットボールNFL第10週第1日は11日、フロリダ州マイアミで行われ、ドルフィンズが22-10でレーベンズを破って3勝7敗とした。途中出場のQBタンゴバイロアが1TDランを挙げるなど活躍した。レーベンズは6勝3敗。〔共同〕,スポーツ,ドルフィンズが3勝目　NFL,https://www.nikkei.com/article/DGXZQOKC126W60S1A111C2000000/
11/12/2021,宇都宮市や市の観光事業者などで構成する宇都宮観光推進委員会は12日、対話アプリ「LINE（ライン）」で購入や決済ができるプレミアム付きのクーポン券を発売した。対象の飲食店や宿泊施設などで利用でき、市内周遊のきっかけにしてもらう。県外からも観光客を呼び込み、新型コロナウイルス禍で落ち込む観光需要の回復につなげる。名称は「プレミアム観光クーポン宇都宮」。利用できるのは宇都宮動物園や大谷資料館といった5つの観光施設のほか、15の宿泊施設、13のタクシー事業者やレンタサイクルなど。宇都宮は本格的なカクテルやジャズを楽しめるバーが多いことも売りの一つで、計31店舗が登録している。クーポン券は3千円分の周遊券（販売価格2千円）と1万5千円分の宿泊割引付き周遊券（同1万円）の2種類。ともに購入制限を設け、1人2口までとした。販売期間は2022年2月末までで、3月27日まで利用できる。市の予算3050万円を充てる。LINEのアプリで宇都宮観光推進委員会の「お友だち登録」をするとクーポン券の案内が示され、アプリ内で購入できる。クーポンの利用時は各店舗にあるQRコードをスマートフォンで読み取り、アプリ上で決済する。LINE上で対象店舗の一覧や所在地の地図も見られるので、初めて宇都宮を訪れる観光客が観光スポットを探す手がかりにもなる。同委員会の田野実栄一事務局長は「宇都宮市のさまざまな観光スポットを知って、周遊してほしい」と話す。,新型コロナ,宇都宮で遊んで、泊まって！　市などLINEクーポン券発売,https://www.nikkei.com/article/DGXZQOCC125260S1A111C2000000/
11/12/2021,スウェーデンの大手石油・ガス会社ルンディン・エナジーの筆頭オーナーと元最高経営責任者（CEO）が、スーダンでの重大な戦争犯罪に加担したとして起訴された。企業トップが重大な国際人権法違反で告発されるのは、第2次世界大戦後のニュルンベルク裁判以来となる。同社会長で創業家出身のイアン・ルンディン氏と、2015〜20年まで同社CEOを務めたアレックス・シュナイター氏が11日、スーダンのバシル政権（当時）...,FT,[FT]スウェーデン検察、石油大手トップを戦争犯罪で起訴,https://www.nikkei.com/article/DGXZQOCB1230P0S1A111C2000000/
11/12/2021,立憲民主党は12日、枝野幸男代表の辞任に伴う代表選の日程を19日告示―30日投開票に決めた。結党以来初めて党員らが参加する「フルスペック」型で代表選を実施する。オンラインによる党員などの投票は29日に締め切る。,政治,立民代表選　19日告示、30日投開票,https://www.nikkei.com/article/DGXZQOUA121300S1A111C2000000/
11/12/2021,12日の新興企業向け株式市場で東証マザーズ指数は反発した。終値は前日比24.48ポイント（2.20%）高い1137.65だった。前日の米ハイテク株高を受けて投資家心理が強気に傾いた。好決算銘柄を物色する動きも目立った。今期の連結売上高の見通しが市場予想を上回ったGMO-FGは上場来高値を付けた。ベイシスは制限値幅の上限（ストップ高水準）で配分された。フロンテオやJTOWERが下落した。日経ジャスダック平均株価は続伸した。終値は前日比6円04銭（0.15%）高い3990円31銭だった。ジャスダック市場の売買代金は概算で657億円と約2カ月ぶりの高水準だった。売買高は6043万株だった。フェローテクやアンビスHDが上昇した。半面、ハーモニックやウエストHDは下落した。〔日経QUICKニュース（NQN）〕,国内株概況,新興株12日　マザーズ2.2%高、ジャスダック続伸　好決算銘柄に買い,https://www.nikkei.com/article/DGXZASS0ISST2_S1A111C2000000/
11/12/2021,第一生命ホールディングスは12日、2022年3月期の連結純利益が前期比4%減の3490億円になりそうだと発表した。従来予想から700億円上振れする。国内外で株式市場が堅調に推移して資産運用収益が増える。グループ通算制度の導入による繰り延べ税金資産の計上も約380億円の押し上げ要因になる。 年間配当は80円（前期は62円）と従来予想から3円増やす。同日発表した21年4～9月期の連結決算は、純利益が前年同期の2.1倍にあたる1784億円だった。株安や円高に備える金融派生商品の取引で、前年同期に計上した約1000億円の損失がなくなった。売上高にあたる保険料等収入は15%増の2兆4228億円。新型コロナウイルスの流行で控えていた営業活動を再開し、傘下の第一生命保険などで新規の契約が伸びた。,金融機関,第一生命HDの22年3月期、純利益4%減に　700億円上振れ,https://www.nikkei.com/article/DGXZQOUB124110S1A111C2000000/
11/12/2021,よみうりランドは12日、運営する「よみうりランド」（東京都稲城市、川崎市）の敷地内に宇宙をイメージした新アトラクション施設を開業した。大正製薬がパートナーとなり、ジェットコースターや薬づくりが体験できるワークショップなどを併設する。新型コロナウイルスの感染拡大で一部工事が滞り、予定より8カ月遅れの開業となった。新施設「SPACE factory（スペースファクトリー）」は敷地面積が約4千平方メートル、総工費は約50億円。ものづくりが体験できる「グッジョバ！！」エリア内に開業した。つり下げ型のジェットコースター「リポビタンロケット☆ルナ」や回転型の乗り物「ファイト　イッパーツ！」、薬づくりが体験できる「リポビタンラボ」の3アトラクションをそろえる。同施設はもともと3月に開業予定だったが、新型コロナ禍で海外からアトラクション関連の技術者が入国できず、延期していた。よみうりランドの溝口烈社長は「最新技術に基づく安全性のチェックをしてもらった。アトラクションのスリルを大勢の人に味わってもらいたい」と話す。「SPACE factory」は大正製薬がパートナー企業を務める。同社は「リポD SPACE PROJECT」として、宇宙航空研究開発機構（JAXA）の小惑星探査機「はやぶさ」など宇宙開発の支援に力を入れている。上原茂社長は「子どもたちにこの場で新しいことに挑戦することの楽しさを感じてもらいたい」と述べた。,ヘルスケア,よみうりランド、宇宙テーマの新施設　大正製薬と,https://www.nikkei.com/article/DGXZQOUC122YL0S1A111C2000000/
11/12/2021,12日のJPX日経インデックス400は続伸した。終値は前日比239.43ポイント（1.32%）高の1万8388.12だった。政府の経済対策への期待から、幅広い銘柄に買いが入った。主要企業の決算発表がほぼ一巡し、好業績が確認された銘柄にも根強い買いが入った。リクルートや日立、NTTが上げ、三井住友トラやスズキ、SMCが下げた。〔日経QUICKニュース（NQN）〕,国内株概況,JPX日経400大引け　続伸　239.43ポイント高の1万8388.12,https://www.nikkei.com/article/DGXZASFL12HS8_S1A111C2000000/
11/12/2021,12日の東京株式市場で日経平均株価は続伸し、前日比332円11銭（1.13%）高の2万9609円97銭で終えた。政府の経済対策の具体案が次々と伝わる中、政策への期待感から幅広い銘柄に買いが入った。米国株に比べた出遅れ感を意識した買いが引き続き入ったとの見方もあった。政府が19日に決める経済対策をめぐって介護・保育分野の処遇改善や中小企業支援策などが盛り込まれると伝わった。新型コロナウイルスの感染対策では、イベント参加人数の上限撤廃の検討なども伝わる。米国株に対する出遅れの修正が進むなかで、日本の政策期待が重なって幅広い銘柄に断続的な買いが入った。業種別日経平均では、通信や不動産の上昇が目立った。米中両国は来週にもオンライン形式での首脳会談を予定する。両国の関係改善に向けた前向きな動きが出るなかで、足元では中国の不動産業界の債務問題への警戒感がいったん和らいでいる。外部環境の好転からも買い安心感が広がり、売り方の買い戻しにつながったとの見方があった。米株価指数先物が日本時間12日の取引で堅調に推移したことも、日本株の支援材料となった。JPX日経インデックス400は続伸した。東証株価指数（TOPIX）も続伸し、終値は前日比26.30ポイント（1.31%）高の2040.60で終えた。東証1部の売買代金は概算で2兆9426億円。売買高は13億2145万株だった。東証1部の値上がり銘柄数は1697と、全体の8割弱を占めた。値下がりは421、変わらずは64だった。NTTは後場に一段高となり、年初来高値を更新した。ソフトバンクグループや東エレク、リクルート、キッコマンが上昇した。一方、スズキや大塚HD、オリンパスが下落した。〔日経QUICKニュース（NQN）〕,国内株概況,東証大引け　続伸し332円高　政策期待が支え、NTTは年初来高値,https://www.nikkei.com/article/DGXZASS0ISS16_S1A111C2000000/
11/12/2021,堀内詔子ワクチン相は12日の記者会見で、新型コロナウイルスワクチンの3回目接種について説明した。「高齢者以外の接種が本格化する2022年3月以降は1日あたり90万回を超えると想定される」と話した。2回目からちょうど8カ月が経過した時に3回目を打つと仮定して計算した。政府は12日にまとめた「第6波」対策の全体像で、21年12月から3回目接種を開始する方針を示した。3回目は2回目から「おおむね8カ月以降」と記した。3回目接種は医療従事者などから始め、徐々に高齢者、高齢者以外へと広がる。堀内氏は22年2月ごろは1日あたり60万回超が見込まれると言及した。3月をめどに企業や大学などでの職場接種も実施する。堀内氏は「見通しを踏まえて必要な情報をできるだけ速やかに示し、自治体などの混乱を招かずに円滑に接種が行えるよう対応する」と語った。,岸田新政権,ワクチン相「22年3月以降は1日90万回超」　3回目接種で,https://www.nikkei.com/article/DGXZQOUA121SR0S1A111C2000000/
11/12/2021,日本相撲協会は12日、大相撲九州場所（14日初日・福岡国際センター）の取組編成会議を開き、2日目までの取組を決めた。2場所連続6度目の優勝を目指す一人横綱の照ノ富士は初日に新小結霧馬山の挑戦を受け、2日目は先場所に金星を配給した平幕大栄翔と顔を合わせる。大関陣は正代が大栄翔、貴景勝が若隆景とそれぞれ初日に対戦する。2日目は正代が小結逸ノ城戦、貴景勝は阿武咲戦が組まれた。十両以上で初日から休場するのは、日本相撲協会が定める新型コロナウイルス対策のガイドラインに違反し、6場所出場停止処分の3場所目の平幕朝乃山だけだった。〔共同〕,スポーツ,照ノ富士は新小結・霧馬山と初日　九州場所取組,https://www.nikkei.com/article/DGXZQOKC125TP0S1A111C2000000/
11/12/2021,12日の東京株式市場で日経平均株価は続伸し、前日比332円11銭（1.13%）高の2万9609円97銭で終えた。政府の経済対策の具体案が次々と伝わる中、政策への期待感から幅広い銘柄に買いが入った。米株価指数先物が日本時間12日の取引で堅調に推移したことも、日本株の支援材料となった。〔日経QUICKニュース（NQN）〕,国内株概況,日経平均大引け　続伸　332円高の2万9609円,https://www.nikkei.com/article/DGXZAS3LTSEC1_S1A111C2000000/
11/12/2021,フランスが2022年4月の大統領選後まで2カ国との新たな貿易協定の調印を先送りするよう欧州連合（EU）に働きかけ、協定締結を望んでいる他のEU加盟国の怒りを買っている。EUは21年にチリおよびニュージーランドとの貿易協定をまとめることを期待していたが、フランス政府がEU加盟27カ国を代表して協定の交渉に当たる欧州委員会を説得し、合意を遅らせた。EUの外交筋は、...,FT,[FT]仏　大統領選にらみ、EUの貿易協定交渉に横やり,https://www.nikkei.com/article/DGXZQOCB124IS0S1A111C2000000/
