05/01/2022,ラグビーのNTTリーグワン1部第15節最終日は1日、東京・味の素スタジアムなどで行われ、上位4チームによるプレーオフ（PO）進出を目指すBL東京が首位の東京SGに27-3で快勝し、10勝目（5敗）をマークして勝ち点49の4位につけた。東京SGは13勝2敗。神戸は横浜を42-33で破り、6勝9敗。横浜は6敗目（9勝）を喫し、同41の6位でPOの可能性がなくなった。東京SGの他にPO進出を決めている2チームは2位東京ベイが浦安を40-13で下して12勝目を挙げ、3位埼玉は東葛を39-10で退けて連勝を13に伸ばした。7、8日に最終第16節が行われる。〔共同〕,スポーツ,BL東京10勝目、横浜はPO逃す　ラグビーリーグワン,https://www.nikkei.com/article/DGXZQOKC012J40R00C22A5000000/
05/01/2022,自民党の茂木敏充幹事長は1日、沖縄県北谷町で街頭演説し、岸田政権が推進する米軍普天間基地（宜野湾市）の名護市辺野古移設に反対する勢力「オール沖縄」をけん制した。日本の安全保障環境は厳しいとし、夏の参院選で必勝を期すと強調。9月が任期満了の同県知事選も念頭に「野党やオール沖縄に、国と沖縄の将来を任せるわけにいかない」と述べた。参院選沖縄選挙区（改選数1）を巡っては、野党系無所属の現職伊波洋一氏が立候補を表明。知事選には、政権と対峙する玉城デニー知事が再選を目指して出馬する意向を固めており、いずれもオール沖縄が支援する見通しだ。自民党は、同選挙区に元総務省職員の新人古謝玄太氏の擁立を決定した。知事選の候補選定も急いでいる。〔共同〕,政治,茂木氏、オール沖縄けん制　知事選念頭「任せられず」,https://www.nikkei.com/article/DGXZQODE012ID0R00C22A5000000/
05/01/2022,競泳の日本選手権最終日は1日、9月の杭州アジア大会（中国）代表の追加選考会を兼ねて横浜国際プールで行われ、女子200メートル背泳ぎは15歳の成田実生（金町SC）が2分10秒45で初優勝した。男子200メートル平泳ぎは花車優（キッコーマン）が2分9秒37で1位。女子の池江璃花子（ルネサンス）は50メートル自由形を24秒78で制し、100メートルバタフライは58秒82で4位だった。男子100メートルバタフライは日本記録保持者の水沼尚輝（新潟医療福祉大職）が51秒23で勝ち、女子200メートル平泳ぎは今井月（東京ドーム）が2分25秒18で優勝。入江陵介（イトマン東進）が欠場した男子200メートル背泳ぎは18歳の竹原秀一（はるおか赤間）が1分58秒72で勝った。〔共同〕,スポーツ,15歳成田実生、200背泳ぎで初V　競泳日本選手権,https://www.nikkei.com/article/DGXZQOKC012E80R00C22A5000000/
05/01/2022,アーティスティックスイミング（AS）の日本選手権は1日、東京辰巳国際水泳場で開幕し、ソロ・テクニカルルーティン（TR）にオープン参加した世界選手権（6月開幕・ブダペスト）代表の乾友紀子（井村ク）が92.7089点とまずまずの得点をマークした。フリーコンビネーションには、世界選手権に出場する日本（乾、吉田萌、京極、木島、柳沢、藤井、吉田理、鈴木、細川、川瀬）がオープン参加して92.3000点だった。ソロTRは広田樹（井村ク）が83.4907点で勝ち、井村クAがフリーコンビネーションを84.9667点、ハイライトルーティンを85.5667点で制した。〔共同〕,スポーツ,乾友紀子、ソロTRで92点台後半　AS日本選手権が開幕,https://www.nikkei.com/article/DGXZQOKC012CK0R00C22A5000000/
05/01/2022,「資本家たちの祭典」が3年ぶりに戻ってきた。著名投資家ウォーレン・バフェット氏率いるバークシャー・ハザウェイは4月30日、対面形式の年次株主総会を開いた。参加者が驚いたのはバークシャーの積極投資だ。株式運用は2022年1～3月期に400億ドル（約5兆円）を超える買い越しだった。攻めの姿勢を鮮明にしつつ、インフレ対応という「守り」の要素も兼ね備えている。「何十年も続いている事業の14%をわずか2...,グローバルマーケット,バフェット氏、危機に攻める　インフレ見据え積極投資　,https://www.nikkei.com/article/DGXZQOGN264N80W2A420C2000000/
05/01/2022,【イスタンブール=木寺もも子】ロシアが侵攻を続けるウクライナの南部で戦闘が激化している。ウクライナ当局は4月30日、黒海に面する港湾都市オデッサの空港滑走路がミサイル攻撃で破壊されたとし、市内で起きた複数の爆発も報じられた。一方、ロシア軍が包囲する南東部マリウポリの製鉄所からは、一部の市民が脱出した。オデッサ州の知事によると、空港に着弾したミサイルはロシアが一方的に併合した南部クリミア半島から発射された。負傷者はいなかった。滑走路は観光拡大のため2021年7月に開業したばかりで、ゼレンスキー大統領は30日深夜のビデオ演説で「必ず再建する」と述べた。オデッサ州では26~27日、貨物鉄道が港に向かう際に通る橋も攻撃を受け損傷しており、ロシアはオデッサ港からの輸出を妨害する狙いとみられる。ロイター通信はウクライナ政府筋の話として、金属や穀物のコンテナ輸送が1日に150個以上減るとの見方を報じた。南東部の都市マリウポリでは30日、ウクライナ内務省系軍事組織「アゾフ連隊」が立て籠もる巨大製鉄所アゾフスターリから民間人の女性と子供計20人が脱出した。同連隊副司令官がSNS（交流サイト）のテレグラムで明らかにした。プーチン大統領が21日に製鉄所の完全封鎖を命じて以降、脱出は初めてとみられる。残る民間人は約1千人とされる。20人は約束から5時間遅れの現地時間30日午前11時に始まった局地的な停戦で脱出した。砲撃で崩れたがれきの下から救出された人々で、副司令官はウクライナが実効支配する近隣都市ザポリジエに移されると期待し、負傷兵の脱出も求めた。ロシアメディアは、25人が脱出したと報じた。英国のウォレス国防相は28日の英LBCラジオで、ロシアが5月9日の対独戦勝記念日に「世界のナチ勢力と戦っているとして戦争状態を宣言するのではないか」との見方を述べた。根拠となる情報はないという。ロシアは現在「特別軍事作戦」と位置づけている。,ウクライナ侵攻,ロシア、オデッサ空港を攻撃　マリウポリ製鉄所20人脱出,https://www.nikkei.com/article/DGXZQOGR011W40R00C22A5000000/
05/01/2022,岸野　猛氏（きしの・たけし、本名=伊東正弘=いとう・まさひろ、コメディアン）4月30日までに死去、86歳。東京都内の自宅で亡くなっていたと警察から連絡を受け、漫才協会が公表した。1964年、お笑いトリオ「ナンセンストリオ」を結成。「親亀の背中に子亀を乗せて」のギャグや、「赤上げて、白上げて」のかけ声で手旗を上げ下げさせるネタなどで人気に。79年からコンビ「ナンセンス」となり、テレビや寄席で活躍した。〔共同〕,,岸野猛氏が死去　コメディアン,https://www.nikkei.com/article/DGXZQOUF011RD0R00C22A5000000/
05/01/2022,【広州=川上尚志】トヨタ自動車は1日、中国東北部の吉林省長春市にある乗用車工場での生産を同日から再開したと明らかにした。新型コロナウイルスの感染拡大に伴う都市封鎖（ロックダウン）の影響で、3月14日から操業を止めていたが、約1カ月半ぶりの再開となる。トヨタは長春市で中国国有自動車大手の中国第一汽車集団と合弁で工場を運営し、多目的スポーツ車（SUV）の「RAV4」などを生産している。同工場について「1日から生産調整をしながらも徐々に稼働を再開し、4日から通常稼働を予定している」（トヨタ）という。新型コロナの感染拡大を受け、長春市は3月11日から事実上のロックダウンを実施し、市民の外出を制限したほか、企業活動も停止した。吉林省政府によると4月18日には長春市の主要企業が全て稼働を再開したが、トヨタは「生産再開の準備を進めている」としていた。トヨタは広東省広州市や天津市にも合弁の乗用車工場があり、これらの工場は生産を続けている。ただ中国では上海市などの都市封鎖が続き、自動車のサプライチェーン（供給網）が混乱している。部品不足が深刻化しており、広州市の合弁工場では生産ラインの一部を止めているとされる。,アジアBiz,トヨタ、中国・長春工場の生産再開　約1カ月半ぶり,https://www.nikkei.com/article/DGXZQOGM011W30R00C22A5000000/
05/01/2022,大相撲の元大関で夏場所（8日初日・両国国技館）に東前頭筆頭で臨む高安が1日、報道陣の電話取材に応じ「大関時代より今は強い。まだまだ伸びしろもあると思っている」と意欲を示した。32歳のベテランは春場所の優勝決定戦で関脇若隆景に敗れた。4月下旬の合同稽古には4日間全て参加。田子ノ浦部屋は自分以外に関取がいない環境ながら、1日は東京都江戸川区の同部屋で約50番をこなし「力量的には差があるが、数を取っていけば下半身にも効いてくる」と手応えを口にした。春場所で12勝をマークして自信を深め、初優勝、大関返り咲きを目指す。「先場所の調子をしっかりキープして、もう一つ、二つエンジンをかけていきたい」と気合を入れた。〔共同〕,スポーツ,高安「大関時代より強い」　夏場所に向け意欲,https://www.nikkei.com/article/DGXZQOKC012AS0R00C22A5000000/
