04/07/2022,「日本資本主義の父」として近年注目を浴びる渋沢栄一。邸宅を構え、数々の功績を残す拠点となったのが東京都北区だ。2021年にはNHK大河ドラマの主人公となり、観光目的の来訪者が増えた。地元では渋沢に関連する土産が続々と誕生。遺訓を学べる仕掛けを施すなど工夫が光り、偉業の顕彰に一役買っている。渋沢関連の商品を、区は21年度からふるさと納税の返礼品として取り扱い始めた。現在は菓子や工芸品、カルタなど1...,地域総合,渋沢栄一の土産品、遺訓学べる仕掛け好評　東京都北区,https://www.nikkei.com/article/DGXZQOCC18BOF0Y2A310C2000000/
04/07/2022,ボトリング機械大手の渋谷工業は役員に年齢上限を設けた。前社長が在任中に90歳で突然死去したことなどを踏まえ、社長は78歳まで、専務は75歳までなどとした。人事制度も見直し、管理職への昇格試験が受けられる年齢を引き下げた。海外市場の開拓を狙い、外国人など即戦力になり得る人材の中途採用にも取り組む。渋谷英利社長(56)が日本経済新聞社のインタビューで明らかにした。役員の規定や人事制度は社長に就任した202...,北陸,渋谷工業、役員に年齢上限　人事制度見直しで若返りへ,https://www.nikkei.com/article/DGXZQOCC054110V00C22A4000000/
04/07/2022,【ワシントン=高見浩輔】米連邦準備理事会（FRB）は6日、3月15～16日に開いた米連邦公開市場委員会（FOMC）の議事要旨を公開した。量的引き締め（QT）と呼ばれる資産圧縮については、すべての参加者が「早ければ5月の次回会合でプロセスを開始するのが適切だろう」と指摘した。月に950億ドル（約11.7兆円）を上限として縮小することをおおむね合意した。多くの参加者が今後の会合で通常の倍となる0.5%の利上げを1回か、それ以上実施する可能性に言及していたことも分かった。3月の会合では約3年ぶりとなる利上げを決めた。多くの参加者がこの会合で政策金利を0.5%引き上げたほうが好ましいかもしれないと見ていたが、そのうち多数の参加者がロシアによるウクライナ侵攻によって不確実性が高まっていることを理由に0.25%が適切だと判断した。,金融政策,月950億ドル圧縮も　FRB3月会合、量的引き締め議論,https://www.nikkei.com/article/DGXZQOGN06DKE0W2A400C2000000/
04/07/2022,【ロンドン=篠崎健太】ロシア財務省は6日、4日が期日だったドル建て国債の元利金の支払いについて、ルーブル建てで実施したと発表した。米政府が承認しなかったことで中継銀行がドル建ての決済を拒否したため、ルーブル払いに切り替えた。ロシア側は「義務は完全に果たされた」と主張したが、最終的に債務不履行（デフォルト）となる公算が大きくなった。ロシア財務省によると対象は4日が償還日だった国債の元利金と、2042年4月償還の国債の利息であわせて6億4920万ドル（約800億円）。米銀の口座にあるドル資金で支払おうとしたが、これまで認めていた米政府が「財源の枯渇」（サキ米大統領報道官）を目的に不承認へ転じ、銀行の手続きを許さなかった。このためロシア財務省はドル建てでの支払いを諦め、ロシア連邦証券保管振替機関（NSD）を通じたルーブルでの支払いに切り替えた。ロシア中央銀行の4日時点の為替レートで、NSDに設ける非居住者（外国人）向けの特別口座に支払う。将来、制裁緩和などで外貨を扱えるようになった際には、当初の元利金期日のレートでドルに戻せるようにするという。当該国債にはドル以外の通貨で元利金を支払う取り決めはない。30日間の猶予期間を過ぎても保有者の手元にドルが渡らなければ事実上デフォルトとなる。制裁解除の見通しが立たずロシア政府がルーブル払いに転換したことで、その可能性は高まった。ロシアの外貨建て債務がデフォルトすれば1918年以来となる。ロシアのペスコフ大統領報道官は6日、元利払いがルーブルで実行されたことについて「理論的にはデフォルトの状況になるかもしれないが、純粋に人為的なものだ。真にデフォルトになる根拠はない」と述べた。「債務履行に必要は原資は豊富にある」と説明し、外貨準備の凍結が解除されるまでルーブルで支払い続ける考えを示した。猶予期間を過ぎた場合、通常であれば格付け会社が支払い能力はあるが滞ったことを示す「テクニカルデフォルト」と認定するはずだった。だが今回は主要格付け会社が欧州連合（EU）の制裁に従って取り下げに動いたため認定がされない見通しだ。このため当該国債を参照するクレジット・デフォルト・スワップ（CDS）の取引当事者によって清算事由のデフォルトと認定されるかが今後焦点となる。【関連記事】,ウクライナ侵攻,ロシア「債務履行」と主張　ルーブルで国債元利払い,https://www.nikkei.com/article/DGXZQOGR06EQM0W2A400C2000000/
04/07/2022,【カイロ=久門武史】イスラエルで6日、ベネット首相が率いる連立政権から与党議員1人が抜けると表明し、国会で連立与党が過半数を失う事態になった。これまで定数120の国会でかろうじて61議席を保っていたにすぎず、過半数割れでベネット氏の政権運営が厳しさを増す可能性がある。離反したのはベネット氏が党首を務める右派与党「ヤミナ」のイディット・シルマン議員で「イスラエルのユダヤ人国家のアイデンティティー」のためとした。2021年に退陣したネタニヤフ前首相は歓迎し「まだこの連立政権に残っている友人たちよ。戻ってこい」と追随を呼び掛けた。ネタニヤフ氏は右派の野党リクードを率いている。野党側も過半数に届いていないうえ、国会は休会中で、直ちに政権が崩壊するわけではない。ただシルマン氏に同調する動きが続けば、野党が不信任決議でベネット政権を退陣に追い込むこともでき、イスラエルがまた総選挙に向かう可能性が出てくる。21年6月に発足したベネット政権は左右両派にアラブ系の政党まで加わった8党連立で、当初から寄り合い所帯の危うさが指摘されていた。シルマン氏は次期総選挙でネタニヤフ氏のリクードから出馬すると報じられた。政権交代後の保健相のポストを約束されたとの観測も伝えられている。,中東・アフリカ,イスラエル連立政権、過半数失う　議員1人離反で,https://www.nikkei.com/article/DGXZQOGR06EJQ0W2A400C2000000/
04/07/2022,【ワシントン=高見浩輔】イエレン米財務長官は6日、20カ国・地域（G20）が開く複数の会議について、ロシアが参加する場合は「欠席する」と表明した。すでに議長国のインドネシアに伝達した。バイデン米政権はウクライナ侵攻を続けるロシアをG20から排除するよう求めている。米下院の金融サービス委員会で証言した。G20は直近では20日に財務相...,北米,G20会議、ロシア参加なら「欠席」　米財務長官,https://www.nikkei.com/article/DGXZQOGN06EE90W2A400C2000000/
04/07/2022,【ワシントン=芦塚智子】米司法省は6日、米政府による制裁に違反したとしてロシアのオリガルヒ（新興財閥）の1人であるコンスタンチン・マロフェーエフ被告を訴追したと発表した。同省によると、ロシアによるウクライナ侵攻後のオルガルヒ訴追は初めて。ガーランド司法長官は記者会見で「米国の制裁逃れを試みるロシアのオリガルヒらに責任を取らせるため、引き続き全ての権限を行使する」と強調した。ニューヨーク州南部地区の連邦地検が公表した訴状によると、マロフェーエフ被告は2014年にロシアのクリミア編入を支援したとして制裁対象となった後、ギリシャなどで親ロシアのテレビ局を開設するために米国民を雇ったり、米南部テキサス州の銀行に投資した資金をギリシャに送金しようとしたりした。米国内の資産を凍結し、米国民との取引を禁じた制裁に違反した疑い。同省はさらに、ロシア軍参謀本部情報総局（GRU）による「ボットネット」と呼ばれる自動増殖型のウイルスの拡散を阻止したことも明らかにした。世界各国の中小企業が使用していた数千台の端末からウイルスを発見し、被害が出る前に除去に成功したという。ガーランド氏は記者会見で、ウクライナでのロシアによる民間人殺害に言及。証拠収集を中心にウクライナや欧州諸国の戦争犯罪捜査を支援していると説明した。,ウクライナ侵攻,米、ロシアのオリガルヒを訴追　制裁違反で、侵攻後初,https://www.nikkei.com/article/DGXZQOGN06E9R0W2A400C2000000/
04/07/2022,【ワシントン=中村亮】米国防総省高官は6日、記者団に対してロシア軍がウクライナ首都のキーウ（キエフ）周辺から完全撤退したとの分析を示した。少数のウクライナ兵に対し、自爆攻撃機能を持つ無人機「スイッチブレード」に関する訓練を米国で実施しているとも明らかにした。国防総省高官は、ロシア軍がキーウから北に位置するチェルニヒウからも完全撤退したと明らかにした。キーウ周辺から引きあげた部隊とともにベラルーシやロシアに移って補給活動をしているという。ロシアが優先地域に掲げているウクライナ東部のドンバスでの戦闘に加わる可能性がある。2月下旬に始まったロシアによるウクライナ侵攻は、キーウを含む北部での地上戦が終結し、東部と南部の一部での戦闘に絞られた。ロシア国防省は3月29日、キーウやチェルニヒウ周辺での軍事活動を縮小すると発表していた。高官はスイッチブレードをめぐりウクライナ軍になじみが薄い兵器だと指摘し、「初歩的訓練」を実施していると説明した。訓練を受けたウクライナ兵は本国に近く戻る予定だとも言及した。ウクライナ侵攻後に米軍がウクライナ軍に訓練を実施していることが明らかになるのは初めてとみられる。スイッチブレードは持ち運びが簡単な小型無人機でカメラなどを搭載し、標的に対して正確に体当たりして攻撃する能力を持つ。戦車などに対する攻撃で有効とみられている。米軍はアフガニスタン戦争でイスラム主義組織タリバンに対する掃討作戦でスイッチブレードを使ったとされる。,ウクライナ侵攻,ロシア軍、キーウ周辺から完全撤退　米分析,https://www.nikkei.com/article/DGXZQOGN06EAN0W2A400C2000000/
