01/23/2022,塩田　和人氏（しおた・かずと=塩田康一鹿児島県知事の父）1月20日死去、88歳。告別式は近親者で行った。喪主は長男、康一氏。,,塩田和人氏が死去　塩田康一鹿児島県知事の父,https://www.nikkei.com/article/DGXZQOUF232H90T20C22A1000000/
01/23/2022,米国の新しい駐日大使、ラーム・エマニュエル氏が23日午後、民間機で羽田空港に到着した。隔離期間後に、本格的に大使としての活動を始める。前大使のハガティ氏が2019年7月に退任して以降、駐日大使ポストは空席が続いてき...,北米,エマニュエル新駐日米大使が来日　同盟深化へ連携,https://www.nikkei.com/article/DGXZQOCB1472D0U2A110C2000000/
01/23/2022,与野党は24日、衆院予算委員会で論戦を始める。新型コロナウイルスの変異型「オミクロン型」への対応や国土交通省の統計不正問題などが論点になる。野党第1党の立憲民主党は初日に泉健太代表が質問に立つ。岸田文雄首相と泉氏が一問一答形式で論戦するのは初めてとなる。立民は政府のオミクロン型の備えが十分だったかを問う。政府は2021年11月にまとめたコロナ対策の「全体像」でワクチンの2回接種者向けの行動制限緩和を打ち出した。3回目のワクチン接種や飲み薬配布も遅れたと指摘する。首相が掲げる「新しい資本主義」について具体策を問う。立民は賃上げ政策や金融所得課税の強化を提案する。国交省が建設工事受注動態統計を書き換えていた問題を巡り、首相の答弁の妥当性もただす。日本維新の会は藤田文武幹事長らが25日に質問する。コロナ対策やマイナンバーを活用した税や社会保障改革を提起する。感染症法上の分類でコロナを季節性インフルエンザと同じ5類や5類相当に引き下げるべきだと訴える。,政治,コロナ・統計不正で論戦　24日から衆院予算委,https://www.nikkei.com/article/DGXZQOUA2185E0R20C22A1000000/
01/23/2022,【ロンドン=今出川リアノン】欧州連合（EU）や英国、インド、オーストラリアの対中強硬派の議員が共同で出身国の政府や組織に、中国の新疆ウイグル自治区での強制労働や人権抑圧に関与する企業への投資を明確に禁止できる制度を設けるよう要請したことがわかった。議員には各国で影響力がある重鎮たちが含まれており、企業への規制を求める国際的な圧力がさらに強まる可能性が出てきた。日本経済新聞が入手した議員からの欧州...,北米,英豪印EUの議員、中国の抑圧関与企業への投資禁止要請,https://www.nikkei.com/article/DGXZQOGR20EH10Q2A120C2000000/
01/23/2022,政府は電子商取引（EC）サイトの出品者が販売事業者か個人かの線引きを明確にする指針を初めてまとめる。規制が少ない個人間取引の形をとるために個人出品者を装う例が相次ぐ。継続的に販売している出品者などは販売事業者と扱い、消費者保護の体制づくりの義務の対象にする。2022年春までをメドに策定する。5月までに予定するインターネット通販に関する消費者保護法の施行にあわせて適用する。個人を称していても明ら...,政治,ネット通販、個人取引装う事業者に網　消費者保護へ指針,https://www.nikkei.com/article/DGXZQOUA141X70U1A111C2000000/
01/23/2022,日本サッカー協会は23日、ワールドカップ（W杯）アジア最終予選の中国戦（27日）とサウジアラビア戦（2月1日）に臨む日本代表からDF冨安（アーセナル）がけがのため外れ、代わりにDF中谷（名古屋）を招集すると発表した。右ふくらはぎを痛めている冨安は20日のイングランド・リーグカップには強行出場していた。今回の日本代表は吉田（サンプドリア）も負傷のためメンバーを外れ、主力のセンターバック2人を欠く編成となった。〔共同〕,スポーツ,サッカー日本代表、中谷を招集　けがで冨安外れる,https://www.nikkei.com/article/DGXZQOKC232GN0T20C22A1000000/
01/23/2022,大阪府は23日、新型コロナウイルスの新たな感染者を6219人確認したと発表した。府内では新たに40代男性の死亡が確認され、累計死者数は3078人となった。23日時点で確保している全病床（3734床）の使用率は47.8%だった。重症者は前日から1人減の23人で、確保している重症病床...,新型コロナ,大阪府、23日の新規感染は6219人　新型コロナ,https://www.nikkei.com/article/DGXZQOUF2324M0T20C22A1000000/
01/23/2022,自民党の菅義偉前首相は22日のインターネット番組で、皇位継承を巡る政府の有識者会議の報告書は「男系継承を明確に打ち出した」と評価した。「方向性を示していただいた。国会で（議論を）進めていく」と話した。報告書は天皇陛下から秋篠宮さま、悠仁さまという「皇位継承の流れをゆるがせにしてはならない」と明記した。悠仁さま以降の皇位に関し「具体的に議論するには現状は機が熟しておらず、かえって皇位継承を不安定化させる」などと記した。同会議は菅政権だった2021年3月に初会合を開いた。岸田文雄首相が22年1月12日に報告書を衆参両院議長に提出した。,参院選2022,菅氏「皇位の男系継承打ち出した」　有識者会議の報告書,https://www.nikkei.com/article/DGXZQOUA2324G0T20C22A1000000/
01/23/2022,【シドニー=松本史】ニュージーランド（NZ）のアーダーン首相は23日、新型コロナウイルスの変異型「オミクロン型」の感染拡大を防ぐため、規制を強化すると発表した。予定していた自身の結婚式についても「行わない」と述べた。23日深夜から交通機関や小売店などでマスクの着用を義務付ける。飲食店の営業は可能だが、制限が設けられる。アーダーン氏は声明で「（最大都市）オークランドなどでオミクロン型の感染が広がっている」と指摘。国民にワクチンの追加接種を呼びかけた。同日行われた記者会見では、2月ごろまでに行うとみられていた自身とパートナーであるゲイフォード氏の結婚式を中止することも明らかにした。アーダーン氏は首相就任後の2018年6月、産休を取得して長女を出産した。,南西ア・オセアニア,NZ、オミクロン型で規制強化　首相は結婚式中止,https://www.nikkei.com/article/DGXZQOGM230YT0T20C22A1000000/
