05/15/2022,長期化の様相を強めるウクライナ危機は、経済制裁への協力を通じた政治的行動の損得を、企業が改めて意識するきっかけにもなった。具体的な行動をとるよう迫る株主の声も無視できなくなっている。米エール大学のジェフリー・ソネンフェルド教授らは、ロシアのウクライナ侵攻直後から、企業別にロシア事業の撤退・縮小リストを作成している。5月12日時点で、ロシア事業を何らかの形で見直すと表明した企業は全世界で約900...,ウクライナ侵攻,株主が迫る「インパクト」　ウクライナ危機が変えた市場,https://www.nikkei.com/article/DGXZQODK114RR0R10C22A5000000/
05/15/2022,沖縄県を訪問中の岸田文雄首相は15日、米軍キャンプ瑞慶覧の一部区域「ロウワー・プラザ住宅地区」（沖縄市、北中城村）について、返還に先立ち米側と共同使用する方針を表明した。県民が利用できる公園を整備する。首相は同地区を視察し、桑江朝千夫沖縄市長らに米側と近く合意すると伝えた。「沖縄全体の発展のために跡地がどう活用されるかが課題だ。しっかりと支援したい」と強調した。ロウワー・プラザ住宅地区は2013年に日米両政府が「24年度またはその後」の返還で合意した。返還前に日米間で共同使用する方向で調整していた。首相は15日、就任後初めて米軍普天間基地（宜野湾市）を視察した。宜野湾市役所の屋上から、同基地や健康医療拠点として整備が進む西普天間住宅地区跡地の状況を確認した。恩納村の沖縄科学技術大学院大学では研究者や大学院生との車座対話を実施した。午後には宜野湾市で開かれる沖縄復帰50周年の記念式典に出席する。式典は政府と県が共催し、沖縄、東京の2会場で開かれる。天皇、皇后両陛下が皇居からオンラインで参加され、沖縄会場には玉城デニー知事らも出席する。首相は式辞で全国最低水準の1人当たり県民所得を向上するため、沖縄の経済成長に向けた取り組みを表明する見通しだ。引き続き基地負担軽減に向け支援する考えも示す。,沖縄復帰50年,米軍区域の一部、返還前に共同使用　首相が表明,https://www.nikkei.com/article/DGXZQOUA13CK00T10C22A5000000/
05/15/2022,自動車のNTTインディカー・シリーズ第5戦は14日、米インディアナ州インディアナポリスで決勝が行われ、佐藤琢磨（ホンダ）は7位だった。コルトン・ハータ（米国、ホンダ）が今季初勝利、通算7勝目を挙げた。〔共同〕,スポーツ,ホンダの佐藤琢磨7位　インディカー,https://www.nikkei.com/article/DGXZQOKC150PP0V10C22A5000000/
05/15/2022,【ジュネーブ=共同】テニスの男子シングルスで四大大会20度の優勝を誇る世界ランキング1位のノバク・ジョコビッチ（34）=セルビア=が14日、イタリア国際（ローマ）準決勝でカスパー・ルード（ノルウェー）を6-4、6-3で下し、1968年のオープン化以降、同種目5人目のツアー通算千勝を達成した。男子ツアーを統括するATPによると、歴代最多1274勝のジミー・コナーズ（米国）のほか、ロジャー・フェデラー（スイス）、イワン・レンドル（米国）、ラファエル・ナダル（スペイン）が千勝以上を記録していた。,スポーツ,ジョコビッチ、ツアー1000勝　男子テニスで5人目,https://www.nikkei.com/article/DGXZQOKC150KW0V10C22A5000000/
05/15/2022,【クリフトン（米ニュージャージー州）=共同】米女子ゴルフのコグニザント・ファウンダーズ・カップは14日、ニュージャージー州クリフトンのアッパーモントクレアCC（パー72）で第3ラウンドが行われ、13位から出た畑岡奈紗は4バーディー、2ボギーの70で回り、通算8アンダー、208の8位に順位を上げた。笹生優花も70で、通算5アンダー、211の25位。古江彩佳は4アンダーの32位。ミンジ・リー（オーストラリア）が69をマークし、通算17アンダーで首位を守った。,スポーツ,畑岡奈紗が8位浮上　米女子ゴルフ第3日、笹生優花は25位,https://www.nikkei.com/article/DGXZQOKC150KK0V10C22A5000000/
05/15/2022,【ニューヨーク共同】米東部ニューヨーク州北部バファローのスーパーで14日、銃撃事件があり、10人が死亡、3人が負傷した。米メディアが伝えた。警察は18歳の白人男性を容疑者として拘束し、人種差別に基づく憎悪犯罪（ヘイトクライム）とみられると明らかにした。警察と米連邦捜査局（FBI）が詳しい動機などを捜査している。事件は14日午後2時半（日本時間15日午前3時半）ごろ発生。容疑者はスーパーの駐車場で、ライフルで4人を撃って3人を殺害した後、店内に入って乱射を続けた。襲撃の様子を交流サイト（SNS）で動画配信していたという。ライフルは2丁使用され、軍服やヘルメットのようなものを着用していた。銃撃を受けた13人のうち、11人が黒人で、2人が白人だった。〔共同〕,北米,NY州で乱射、10人死亡　18歳男性を拘束,https://www.nikkei.com/article/DGXZQODL150HP0V10C22A5000000/
05/15/2022,【北京=共同】北朝鮮の最高人民会議（国会）常任副委員長を務めた楊亨燮氏が13日、脳梗塞で死去した。96歳だった。同国メディアが15日、朝鮮労働党中央委員会などの訃告を報じた。金正恩党総書記が14日に弔問し、党中枢の政治局常務委員会メンバー全員が同行した。朝鮮通信（東京）などによると、楊氏は1925年10月、東部咸興市で生まれた。社会科学院長などを経て、98～2019年に最高人民会議常任副委員長を務めた。01年、在日本朝鮮人総連合会（朝鮮総連）の韓徳銖議長の告別式に参加した弔問代表団団長として日本を訪問。10年10月には平壌でAP通信系の映像配信会社APTNの幹部と会見し、北朝鮮の要人として初めて、金正日総書記の後継者として三男の金正恩氏が次の指導者になると言明した。訃告は「巧みな外交活動で国の権威を高めることに貢献した」と指摘した。,朝鮮半島,北朝鮮の楊亨燮氏が死去　金正恩氏弔問,https://www.nikkei.com/article/DGXZQOCB150M20V10C22A5000000/
