12/17/2021,【NQNロンドン】16日の欧州国債市場で、指標銘柄である独連邦債10年物の利回りは英国時間16時時点で、前日の同時点に比べ0.014%高いマイナス0.349%で取引されている。,,欧州国債概況16日　独連邦債利回り　マイナス0.349%に上昇,https://www.nikkei.com/article/DGXZASH2IILB2_W1A211C2000000/
12/17/2021,【シリコンバレー=奥平和行】新型コロナウイルス感染の影響が続くなか、米IT（情報技術）大手が米国で相次いでオフィスを拡張している。メタ（旧フェイスブック）がシリコンバレーでビル4棟の借りる大型契約を結んだ。アップルなどもオフィスの確保を急いでおり、在宅勤務の広がりを受けてオフィスを縮小した企業との間で格差が広がる可能性もある。メタはカリフォルニア州サニーベール市でビル4棟を賃借する契約を結んだ。...,北米,米オフィス市場、IT大手がけん引　旧Facebook大型契約,https://www.nikkei.com/article/DGXZQOGN16F3Q0W1A211C2000000/
12/17/2021,【フランクフルト=深尾幸生】欧州連合（EU）で新薬承認を判断する欧州医薬品庁（EMA）は16日、米製薬大手ファイザーが新型コロナウイルスの経口治療薬として開発している「パクスロビド」について、「未承認だが、重症化するリスクが高い成人の治療に使用可能」との助言を発表した。欧州で新型コロナによる感染と死亡が増えていることを踏まえ、EUの各加盟国が緊急使用の可能性などを判断するための材料として助言を出した。並行して、通常の審査より早く承認をしやすい「ローリング審査」と呼ぶ審査手続きも始めた。EMAによると、パクスロビドは新型コロナの診断後なるべく早く、症状が出始めて5日以内に投与する必要がある。特定の医薬品と併用できないほか、腎臓や肝臓の機能が著しく低下している患者は使えない。妊娠中や妊娠の可能性がある人にも推奨しない。EMAが分析した試験の中間結果では、初期症状から5日以内に薬剤を投与した607人のうち入院した患者は6人にとどまり、死亡例はゼロだった。これに対して、プラセボ（偽薬）を投与した患者612人のうち41人が入院し10人が死亡した。,新型コロナ,EU、米ファイザーのコロナ飲み薬「未承認だが使用可」,https://www.nikkei.com/article/DGXZQOGR16ET90W1A211C2000000/
12/17/2021,大阪府八尾市は製造業だけで3000社以上が集積するものづくりの町だ。この地の中小企業経営者の間で、インテリア商材メーカーの友安製作所（同市）の松尾泰貴（37）の名はよく知られている。市職員として産業振興で実績を上げ、民間に転じた後も地域に新風を吹き込む。「（ものづくり現場を一般開放する）オープンファクトリーによる人づくりの効果について話していきましょう」。10月下旬、八尾市内で開かれたフォーラ...,日経産業新聞,民間でも中小振興、友安製作所の元「スーパー公務員」,https://www.nikkei.com/article/DGXZQOUF15A9U0V11C21A1000000/
12/17/2021,デザインや写真編集ソフトを手がける米アドビは12月14日より新製品「Adobe Creative Cloud Express」の提供を開始した。基本的な機能は無料で利用できる。これまでデザイナーやカメラマンなどのプロ向け製品が多かったアドビだが、最近はスマートフォンやタブレット端末向けアプリにも注力するなど、ユーザー層の拡大を図っている。アドビが狙う新たなユーザー層の例がSNS（交流サイト）の利...,モバイルの達人,誰でも使えるデザインアプリ登場　Adobeが狙う商機,https://www.nikkei.com/article/DGXZQOUC169O80W1A211C2000000/
12/17/2021,国内の旅行需要が足元で回復している。国内航空2社の12月の国内線旅客数は前年同月比4～6割増となる見通しだ。JR旅客6社の年末年始の新幹線などの予約席数も8割増える。感染リスクのある海外を避け、近場での旅行や帰省を楽しみたいと考える消費者が多い。ただ新型コロナウイルスの変異型「オミクロン型」の感染拡大が懸念され、先行きには不透明感も残る。全日本空輸（ANA）と日本航空（JAL）の国内線旅客数は緊急事態宣...,新型コロナ,国内の旅行需要、足元で回復　JRの年末年始予約8割増,https://www.nikkei.com/article/DGXZQOUC164QL0W1A211C2000000/
