04/13/2022,【ワシントン=長沼亜紀】米財務省は12日、3月の財政収支が1927億ドル（約24兆1400億円）の赤字だったと発表した。赤字額は前年同月から71%縮小した。歳入が3152億ドルで前年同月比18%増えた。雇用増や賃金増などで税収が増えた。一方、歳出は5079億ドルで45%減った。失業者の減少で失業保険給付が減ったほか、現金給付、中小企業支援などの新型コロナ対策の大半がなくなっため、支出が減った。2022会計年度（21年10月～22年9月）の3月までの6カ月の累積では、6683億ドルの赤字で、前年度の同時期と比べ61%赤字が縮小した。歳入が2兆1220億ドルで25%増えた一方、歳出は2兆7903億ドルで18%減った。コロナ危機からの景気回復で税収が伸びる一方、景気下支えのために実施していた財政出動が終了し、収支は改善してきている。,北米,3月の米財政赤字、7割減1927億ドル　コロナ対策終了で,https://www.nikkei.com/article/DGXZQOGN12E8A0S2A410C2000000/
04/13/2022,ロシアによるウクライナ侵攻で世界的にインフレが進むなか、原材料などの仕入れ価格の上昇が企業収益をむしばみつつある。デフレ傾向が根強い日本では小売価格を思い切って引き上げることができず、企業物価と消費者物価の上昇率の「ギャップ」が広がっているためだ。ギャップの規模は米国の4倍を超え、製造業にとって最大14兆円の減益要因になるとの試算もある。日銀が12日発表した3月の企業物価指数は前年同月比9.5...,経済,物価ギャップ、米の4倍超　価格転嫁進まず企業収益圧迫,https://www.nikkei.com/article/DGXZQOUB11CPC0R10C22A4000000/
04/13/2022,【ニューヨーク=野村優子】新型コロナウイルスワクチンの需要が世界で急減速している。重症化しにくいオミクロン型の派生型「BA.2」が各国で主流となり、追加接種に対する意欲が低下。1日あたりのワクチン接種回数は、1年ぶりの低水準で推移している。世界では4回目接種（2回目の追加接種）の動きが広がるが、人々は複数回の接種に消極的になっている。世界のワクチン接種は年初から急減している。英オックスフォード...,新型コロナ,ワクチン需要、世界で急減速　接種1年ぶり低水準,https://www.nikkei.com/article/DGXZQOGN12DB10S2A410C2000000/
04/13/2022,ローソンは完全子会社の高級スーパー、成城石井（横浜市）を2023年度までに東京証券取引所に新規上場する方針を固めた。上場時の時価総額は2000億円を上回る可能性もある。セブン&アイ・ホールディングス（HD）が百貨店子会社の売却を進めるなど、人口減による国内市場の縮小を見据えた流通業の再編が進みつつある。プライム市場への上場を目指し、早ければ年内に東証に上場を申請する。成城石井の持ち株比,小売り・外食,ローソン、成城石井上場へ　時価総額2000億円超,https://www.nikkei.com/article/DGXZQOUC1212J0S2A410C2000000/
04/13/2022,岩谷産業が世界的な脱炭素の潮流で注目されている水素事業に力を入れている。全社の売り上げに占める割合は1割に満たないものの、国内の水素販売ではシェア7割を握る。資本力のある海外企業や国内の石油企業も参入を検討するなか、水素社会の実現に向けて主導権を握れるか。間島寛社長に聞いた。――水素市場が成長するまでには時間がかかります。どう収益につなげますか。「2023年度までに日米で水素ステーションを2...,関西,岩谷産業・間島社長「三大都市圏に水素の輸入基地を」,https://www.nikkei.com/article/DGXZQOUF24BYD0U2A220C2000000/
04/13/2022,未来社会を描く2025年国際博覧会（大阪・関西万博）の開幕まで3年となった。舞台となる大阪市の松井一郎市長は政府が掲げる150の国・地域の参加目標について22年度中に達成できるとの見通しを示した。一方、大阪以外でさらに興味を持ってもらえるよう全国に情報を発信する考えを明らかにした。市長に市政の取り組みを聞いた。――参加表明した国・地域は100に到達しました。目標はいつ達成できそうですか。「（...,新型コロナ,大阪万博、参加150カ国・地域に手応え　松井市長,https://www.nikkei.com/article/DGXZQOUF117JX0R10C22A4000000/
04/13/2022,デジタルトランスフォーメーション（DX）関連のニーズを背景に2021年は新興企業への投資が旺盛でした。しかし、22年は情勢が変わってきています。新興株式市場の株価が低調で、新規株式公開（IPO）が減少しています。成長に暗雲がただようなか、政府はスタートアップの育成を重点方針に掲げ、投資を呼び込む環境づくりに乗り出します。22年の新興企業への投資はどうなるのか。参考になる記事をまとめました。（結城立浩、内容や肩書などは掲載当時のものです）東京株式市場のマザーズ指数は21年末に比べ低調に推移しています。米国の利上げへの警戒や新型コロナウイルスの変異型「オミクロン型」の感染拡大、ロシア・ウクライナ情勢の悪化が背景にあります。このため22年1～3月期のIPOは15社で、1～3月期として8年ぶりの低水準でした。上場を見直す企業も出ており、スタートアップ企業にとって先行きの不透明さが増しています。調査会社のCBインサイツによると、企業価値が10億ドル（約1250億円）以上の未上場企業である「ユニコーン」は2月初め、世界で1000社を突破しました。クラウド経由でソフトを提供するSaaSやフィンテックなどのIT（情報技術）分野で、新興企業が投資を集めています。21年末の世界のユニコーンのうち、米国企業は488社、中国企業が170社と存在感を示す一方、日本のユニコーンは6社にとどまりました。日本は年金基金などの機関投資家が未上場企業への投資に慎重です。日本でユニコーンが増えるには、スタートアップ企業に投資を呼び込む施策が求められています。政府はスタートアップ企業の新たな支援策に乗り出します。株式市場の成長や雇用創出につながるとみるからです。岸田文雄首相は自ら掲げる「新しい資本主義」の実現に向けて、22年を「スタートアップ創出元年とする」と語り、スタートアップ企業を創出するための5カ年計画をまとめます。経団連も法人設立手続きの簡素化や、関連政策の司令塔となる「スタートアップ庁」の創設を提言しました。スタートアップへ投資を呼び込み、日本のユニコーンを増やすことができるかが焦点です。【2022年度、ビジネスここがポイント】,スタートアップ,ユニコーン、アメリカ488社・中国170社　日本は6社,https://www.nikkei.com/article/DGXZQOUC017BW0R00C22A4000000/
04/13/2022,自動運転の普及に伴い自動車保険が大きく変わる。これまでは運転者の過失を前提にしてきたが、自動運転ではシステムの設計ミスや誤作動による損害を補償することになるためだ。損害保険ジャパンは車メーカーやシステム会社が契約相手の新たな保険を開発した。メーカー自身も保険事業に参入しており、従来の保険会社間のシェア競争の構図は一変しそうだ。現在の車保険は個人や企業など車の所有者が事故に備え加入している。シス...,金融機関,自動運転で保険激変　損保ジャパン、契約者は車メーカー,https://www.nikkei.com/article/DGXZQOUB315YG0R30C22A3000000/
04/13/2022,アーティストや業界からの要望を受け、ライブ・エンタテインメント議員連盟の事務局長としてチケットの不正転売禁止法を議員立法で起草した。「国民の総意として取り組む」との意思を示すため超党派の枠組みで実現させた。国は...,政治,「日本のコンテンツ力を成長戦略に」　自民・山下貴司氏,https://www.nikkei.com/article/DGXZQOUA119U50R10C22A3000000/
04/13/2022,台風は海面水温が高く上昇気流が活...,安藤 淳,台風1号北上、直撃なくても雨に注意,https://www.nikkei.com/article/DGXZQODK111B50R10C22A4000000/
04/13/2022,サッカーのアジア・チャンピオンズリーグ（ACL）の1次リーグ東地区が15日からスタートする。日本からは川崎フロンターレ、浦和レッズ、横浜F・マリノス、そしてヴィッセル神戸のJリーグ（J1）勢4クラブが出場する。3月15日に行われたプレーオフで、神戸がメルボルン・ビクトリー（オーストラリア）を延長の末4-3で下し、昨年に続き4クラブの枠を得た日本。昨年は4クラブ中3クラブが決勝トーナメント（16...,日本サッカー世界への挑戦,J1勢出陣、15日からACL1次リーグ　過密日程を越えろ,https://www.nikkei.com/article/DGXZQODH123OK0S2A410C2000000/
04/13/2022,10日午後に千葉・ZOZOマリンスタジアムにいたスポーツファンが羨ましい。大リーグでも例がない13連続奪三振と、プロ野球28年ぶりの完全試合を達成したロッテの佐々木朗希（20）の投球は、野球というジャンルを超え、日本のスポーツ史上最高のパフォーマンスの一つといえるだろう。前回3日の登板を伝えた本紙朝刊で「手がつけられなくなりつつある」とあって次を楽しみにしていたのに、ライブ中継を見逃してしまっ...,スポーツの力,規格外の若者によるスポーツの進化,https://www.nikkei.com/article/DGXZQODH120LD0S2A410C2000000/
04/13/2022,石川遼が男子ツアーのマンシングウェアKSBでアマチュア優勝を飾り、華々しく世に出たのは2007年、15歳のときだった。かつての「はにかみ王子」も昨年9月に30歳になった。論語なら「三十にして立つ」、自己の立場を確立する「而立（じりつ）」の年。昨年秋、米下部のコーンフェリーツアー予選会から帰国後の新型コロナウイルス自主隔離義務違反により、日本ゴルフツアー機構（JGTO）から1カ月の謹慎処分を受けた...,オン・ザ・グリーン,石川遼、新規まき直しのシーズン　国内ツアーに専念,https://www.nikkei.com/article/DGXZQODH1144M0R10C22A4000000/
04/13/2022,「いつでもご相談を」。ロンドンで不動産取引に関わる金融機関、法律事務所、会計事務所が海外顧客の対応に動きだした。海外から匿名で英不動産を購入できる制度が変わり、まもなく所有者が情報開示を迫られるようになるためだ。開示の回避策や代替投資先の助言を求める顧客にも応える。引き金は英議会で3月15日に成立した「経済犯罪法」。海外のペーパーカンパニーを隠れみのにしたマネーロンダリング（資金洗浄）や経済制...,吉田 ありさ,対ロ制裁が暴くグローバル金融の闇　独裁政権と深い縁,https://www.nikkei.com/article/DGXZQOCD315WN0R30C22A3000000/
04/13/2022,ロシアがウクライナに侵攻して攻撃を続けています。第2次世界大戦後に欧州で起きた最大規模の戦争で、多くの民間人が犠牲になっています。米欧日による対ロシア経済制裁でも侵攻は止まらず、世界秩序は再構築を迫られています。侵攻はなぜ起きたのでしょうか。ポイントを解説します。ロシアのプーチン大統領が2月24日に「軍事作戦」の開始を宣言し、隣国ウクライナに攻撃を始めま...,ウクライナ侵攻,ウクライナ侵攻なぜ起きた？　やさしく解説,https://www.nikkei.com/article/DGXZQOCB2885V0Y2A320C2000000/
04/13/2022,【ヒューストン=花房良祐】米エネルギー情報局（EIA）は12日、2022年夏の燃料見通しを公表し、2022年に米国の家計が支払うガソリン代は前年に比べて1世帯あたり平均455ドル（約5万7000円）多い2945ドルになるとの見通しを示した。車社会の米国ではガソリン価格への関心が高く、バイデン政権への風当たりが一段と強まりそうだ。4～9月のレギュラーガソリンの平均小売価格は前年同期比約25%高い1ガロン（3・8リットル）あたり3・84ドルとなり、インフレ率で調整すると14年夏以来の高水準になるという。米国では公立学校が5月下旬～6月初めから長い夏休みに入り、ドライブで旅行する家庭が多いため、夏はガソリン消費が特に増える時期だ。ロシアのウクライナ侵攻に伴う地政学リスクの高まりや、新型コロナ禍からの景気回復で需要が戻ったことで原油相場は21年よりも高い水準で推移している。野党・共和党や石油業界は、環境重視のバイデン政権のエネルギー政策が米国内の原油生産を阻害していると批判を強めている。一方、バイデン政権と与党・民主党は石油会社が巨額の利益を上げながら生産量を十分に増やしていないなどとして、業界への圧力を強めている。石油会社は原油の高騰で稼ぐ力が増しているにもかかわらず、株主への配当を優先しており、設備投資の伸びが鈍い。石油開発は先行投資が大きく、脱炭素を見据えると先行きの需要に慎重な見方が依然として残っていることも背景にある。バイデン政権はトウモロコシなどから製造するバイオエタノールのガソリンへの含有率を高める方針で、燃料の高騰を抑制したい考えだ。米政府高官はバイオエタノールの比率を一定程度高めれば1ガロンあたり10セント安くなるとの見方を示している。,ウクライナ侵攻,米国のガソリン代、今年は1世帯あたり5万7000円増加,https://www.nikkei.com/article/DGXZQOGN12E860S2A410C2000000/
04/13/2022,TDKが自社の電子部品の利用で発生する二酸化炭素（CO2）排出量の算出に取り組んでいる。最終製品に組み込まれる部品に関する環境への貢献度を見えるようにする試みで、これまで「数十億個」の製品の数値化を進めた。環境面でも黒子として埋没することに悩む日本の素材・部品メーカーは多く、TDKの挑戦は参考になりそうだ。世界的な脱炭素の潮流を受けて、自動車の世界では電...,みんなのESG,TDK、数字で見せる小さな部品の環境貢献,https://www.nikkei.com/article/DGXZQOUC258E40V20C22A3000000/
04/13/2022,日産自動車がロシア危機に直面している。ロシアが2月末にウクライナに侵攻後、日産株は侵攻前に比べて一時急落し、足元でも回復しきっていない。2022年3月期の最終損益は3期ぶりに黒字転換したもようだが、市場の評価は逆行した。ロシア問題に端を発した原材料価格高騰が回復途上だった日産の弱みを露見させ、頼みとなる電気自動車（EV）戦略にも悪影響を及ぼしかねない。日産の株価は、3月9日までに侵攻前に比べて...,記者の目,日産、ウクライナ侵攻で露見する「原料高」耐性の弱さ　,https://www.nikkei.com/article/DGXZQOUC067AY0W2A400C2000000/
04/13/2022,欧州連合（EU）の一般データ保護規則（GDPR）施行以降、ブラウザのクッキーデータを利用し勝手に生活者の行動データを推測して表示する広告サービスの提供が厳しく制限される動きが広がっている。これまでの広告はネット以前のマスメディアの時から、「恐らくこういう人が見ているからこの広告に興味を持つだろう」という考え方で長らく運用されてきた。しかし、現実は生活者からすると的はずれなノイズを大量に受け取らなければいけなくなっている。せっかくワンツーワンでコミュニケーションがとれるネットにおいてもクッキーの活用は所詮推測でしかないため、すでに買っている商品の広告が何度も出てくるなど嫌な思いを経験した人も多いだろう。そうした中でむしろ顧客が自ら個人情報を提供し、適切な広告やマーケティングサービスを受け取る仕組みを実現しているサービスがある。それがWarrantee（ワランティ、大阪市）が提供する「フリー保証・保険サービス」だ。サービス概要はまずワランティがビッグデータ分析をもとに適切な料率で損保や保証会社と契約する。サービスの顧客はワランティと契約し、個人情報をデータ提供する代わりに無料で保証や保険サービスを受けられる。その個人情報を活用したいスポンサー企業はスポンサーフィーを支払い、顧客の中から適切な人を選びプロモーションサービスを提案する。データ提供を認めた顧客がそのプロモーションサービスを利用できるという仕組みだ。すでにダイキンなどがエアコンの保証を無料で提供し、買い替えタイミングなどで自社製の新型エアコンへの切り替えを促すプロモーションなどに利用されている。ワランティはさらにこのモデルをヘルスケアサービスまでにまで拡張し、オムロンなどがヘルスケア機器や再生医療サービスを無料で提供し、個人情報から効率的な提案販促を行うサービスも提供している。実はこのサービスモデルの構造は「情報銀行」そのものだ。これまでも情報銀行の模索は進められていたが、顧客が積極的に個人情報を預けるモチベーション設計のところが大きなハードルとなっていた。ワランティは保証や保険、ヘルスケアサービスというモチベーションをベースに個人情報を預ける仕組みを構築している。信頼と安心感とメリットを感じる顧客は自ら情報を提供するだろう。これまでの広告と異なり、自分にとって望ましい提案がされるのだ。例えば膝が痛い人が旅行したいと考えた時、その情報を提供すれば膝の具合を改善する機器やサプリの提案や膝に負担の少ない旅行プランの提案などがどんどんやってくる。顧客からしたら自分のことを理解した上での提案はうれしいと感じられるのではないか。ワランティはグローバル展開も視野に入れている。代表の庄野裕介氏は「現在国民皆保険が提供されずに医療サービスが高額になって、サービスを受けられない人が多いような国に展開することができれば新しい社会システムになる」と語る。保険サービスは世界中にあるため、世界展開の可能性も十分にあると言えるだろう。彼らの今後の飛躍に期待したい。［日経MJ2022年4月8日掲載］,日経MJ,個人情報の提供、家電の無料保証や保険で促す,https://www.nikkei.com/article/DGXZQOUC043J80U2A400C2000000/
