04/25/2022,日本経済新聞社の世論調査で防衛費の増額について聞いた。国内総生産（GDP）比で1%程度だった目安を2%以上へ引き上げるべきだとの自民党内の意見に関し、賛成が55%で反対の33%を上回った。支持政党別に分析すると与野党それぞれで濃淡が見られた。自民党支持層の賛成が64%だった一方、公明党は6割弱だった。立憲民主党は3割強、日本維新の会は7割弱だった。特定の支持政党がない「無党派層」は43%だった...,政治,防衛費増額「GDP比2%以上」　賛成55%、反対33%,https://www.nikkei.com/article/DGXZQOUA22CRA0S2A420C2000000/
04/25/2022,ロシアのウクライナ侵攻は自分の国が突然、戦場になる現実を国際社会に突きつけた。中国や北朝鮮の脅威に直面する日本も例外ではない。最悪の事態を想定する危機意識を欠いてきた日本は安全保障の備えに穴がある。ウクライナの首都キーウ（キエフ）の地下鉄はロシアの侵攻が始まって間もなく運行を停止した。列車の代わりに駅構内に広がったのは毛布やテント。深いところで地下105メートルになる駅が臨時シェルターとなった...,ニッポンの統治,法も備えも穴だらけ　安全保障「最悪の事態」想定せず,https://www.nikkei.com/article/DGXZQOUA07COV0X00C22A4000000/
04/25/2022,自動車のF1シリーズ第4戦、エミリアロマーニャ・グランプリ（GP）は24日、イタリアのイモラで決勝が行われ、アルファタウリの角田裕毅が12番手発進から追い上げ、今季最高の7位でゴールした。ポールポジションから出たマックス・フェルスタッペン（オランダ）が今季2勝目、通算22勝目。セルヒオ・ペレス（メキシコ）が2位に入り、レッドブルのワンツーフィニッシュとなった。〔共同〕,スポーツ,F1、角田裕毅が今季最高7位　エミリアロマーニャGP,https://www.nikkei.com/article/DGXZQOKC244GW0U2A420C2000000/
04/25/2022,▽0時39分　官邸で松野、栗生正副官房長官、村田内閣危機管理監、藤井官房副長官補、奥島海上保安庁長官。▽1時20分　報道各社のインタビュー。25分　公邸。▽14時　木原、磯崎、栗生各官房副長官、内閣危機管理監、藤井、高橋両官房副長官補、藤井国交審議官、海上保安庁長官。48分　東京・築地の築地本願寺。母親の澄子さんの三回忌法要。▽16時14分　東京・日本橋室町のホテル「マンダリンオリエンタル東京」。宴会場「リンデンルーム」で裕子夫人ら親族と食事。▽18時41分　東京・鍛冶町の「ヘア　モード　キクチ神田日銀通り店」。散髪。▽20時43分　公邸。,首相動静,24日の岸田首相の動静,https://www.nikkei.com/article/DGXZQOUA2411P0U2A420C2000000/
04/25/2022,松野博一官房長官は24日、沖縄県を訪れ、玉城デニー知事と県庁で会談した。沖縄は新型コロナウイルスの新規感染者数が増加傾向で、兼務するワクチン接種推進担当相として3回目接種の促進へ協力を要請した。「現在の感染状況に懸念を持っている。接種の加速が鍵だ。拡大防止へ連携を取りたい」と伝えた。22日時点の3回目接種率は全国が49.8%で、沖縄は都道府県で最低の37.1%にとどまる。会談で松野氏は「若い人でも重症化するケースはあり、後遺症の心配もある。3回目接種は重要だ」と強調。玉城氏は「商業施設など身近な場所で接種できる環境整備を進めたい」と応じ、交流サイト（SNS）などで若年層への呼びかけを強める考えを示した。松野氏の沖縄入りは、沖縄基地負担軽減担当相として訪れた2～3日に続いて今月2回目。25日まで滞在し、大学や経済団体などに接種推進を働きかける予定だ。〔共同〕,沖縄,沖縄の接種促進に協力要請　松野氏、玉城知事と会談,https://www.nikkei.com/article/DGXZQOUA243FB0U2A420C2000000/
04/25/2022,カゴメとNECは、野菜にカビなどの病害が発生するリスクを人工知能（AI）で予測するシステムを開発した。圃場ごとの気温や湿度をAIが分析し、3日先までの病害発生リスクを農家に警告する。両社で提供中のサービスに5月にも組み込む。世界各地で気象変化が大きくなる中、農家の栽培を支援する仕組みとして広げる。両社がトマト農家向けに提供している営農支援サービス「クロップスコープ」に新機能として加える。圃場に...,サービス・食品,カゴメとNEC、畑の病害予測　農家の栽培リスクを軽減,https://www.nikkei.com/article/DGXZQOUC249VO0U2A320C2000000/
04/25/2022,金融庁は気候変動対応で金融機関との対話のたたき台となるディスカッションペーパーをまとめた。気候変動対応を支援することが顧客企業の成長や事業基盤の強化に寄与し、金融機関にとっても信用リスク低下につながると指摘。投融資先の脱炭素を金融面から後押しするよう促す。同庁が気候変動対応で金融機関向けの考えを示すのは初めて。主な対象は銀行や保険会社で、対話するうえでの着眼点のほか、顧客支援の具体的な進め方、...,金融政策,金融庁、気候変動対応で対話のたたき台　銀行・保険向け,https://www.nikkei.com/article/DGXZQOUB229N40S2A420C2000000/
04/25/2022,ロシアによるウクライナ侵攻は北大西洋条約機構（NATO）の東方拡大を巡る対立が一つのきっかけになった。ベルリンの壁崩壊から30年あまりを経て、冷戦期にもなかった激しい戦闘が欧州で続く。NATO拡大は冷戦後の米国の政策で最も致命的な誤り――。米外交官ジョージ・ケナン氏による四半世紀前の警鐘がいま重く響く。「メルケル氏とサルコジ氏は（多数の民間人殺害が判明した）首都キーフ（キエフ）近郊ブチャを訪れ...,グローバルViews,NATO拡大が招いた不安定化　米高官、四半世紀前に警鐘,https://www.nikkei.com/article/DGXZQOGN183JX0Y2A410C2000000/
04/25/2022,フィオナ・フォックス氏は2002年、様々な科学の問題に関して記者に正確な情報を提供し、専門家を紹介するために自ら設立したばかりの英サイエンス・メディア・センター（SMC）のトップとして、医学研究を助成する団体を訪れた。用件を告げると、受付の女性はおびえた様子で人さし指を唇に当て「Aで始まる言葉はお話しできません」とささやいた。Aで始まる言葉とは「アニマル（動物）」を指す。当時、科学者が取材で動...,FT,[FT]情報を公開し始めた科学者,https://www.nikkei.com/article/DGXZQOCB188JT0Y2A410C2000000/
