05/14/2022,トライアスロンの世界シリーズ横浜大会は14日、横浜市山下公園周辺特設コースで行われ、エリート（51.5キロ=スイム1.5キロ、バイク40キロ、ラン10キロ）の男子は昨年の東京五輪に出場した小田倉真（三井住友海上）が1時間45分2秒で日本勢最高の9位に入った。北條巧（NTT東日本・NTT西日本）は17位だった。女子は東京五輪代表の高橋侑子（相互物産）が1時間57分35秒で20位、中山彩理香（日大・アリーディ）が22位だった。優勝はともに英国勢で男子がアレックス・イー、女子はジョージア・テーラーブラウンだった。東京パラリンピック銀メダルの宇田秀生（NTT東日本・NTT西日本）はパラトライアスロンの男子運動機能障害PTS4で3位だった。〔共同〕,スポーツ,小田倉真、日本勢最高の9位に　トライアスロン横浜大会,https://www.nikkei.com/article/DGXZQOKC142N30U2A510C2000000/
05/14/2022,東京都は14日、新型コロナウイルスの感染者が新たに3799人確認されたと発表した。直近1週間平均の新規感染者は約4151人で、前週（約2961人）の140.2%だった。累計の感染者数は148万8435人となった。都内の重症者数は前日と同じ4人だった。新たに10人の死亡を確認し、累計の死者数は4393人となった。新規感染者を年代別に見ると、20代が956人と最も多く、30代が636人、40代が516人と続いた。65歳以上の高齢者は240人だった。ワクチンの接種状況別では2回接種済みが1947人、未接種は964人だった。,新型コロナ,東京都、新たに3799人感染　7日平均で前週の140.2%,https://www.nikkei.com/article/DGXZQOCC141OX0U2A510C2000000/
05/14/2022,岸田文雄首相は14日、2019年の火災で主要な建物が焼失した首里城（那覇市）に関し、11月に正殿の復元に着工する方針を明らかにした。首里城を視察後、那覇市内で記者団に語った。首里城について「沖縄県民にとってアイデンティティーの拠点であり、誇りであり、国民的な歴史文化資産でもある」と述べ、復元の意義を強調した。首相はこれに先立ち、首里城の展示室や正殿の遺構を視察し、復元に向けた作業の進捗などを確認した。政府は26年までに正殿の復元を終える方針だ。19年10月の火災では正殿と北殿、南殿など6棟が全焼した。,沖縄,首里城の正殿復元へ、11月に着工　首相表明,https://www.nikkei.com/article/DGXZQOUA13DBU0T10C22A5000000/
05/14/2022,体操の個人総合で争うNHK杯は14日、東京体育館で女子が行われ、4月の全日本選手権2位で17歳の宮田笙子（鯖江スクール）が初優勝し、世界選手権（10～11月・英リバプール）代表に決まった。2位に入った全日本女王の笠原有彩（レジックスポーツ）、3位の山田千遥（朝日生命ク）を含む3人が2024年パリ五輪予選を兼ねる世界選手権の切符を得た。全日本の得点を持ち点に4種目を演技。宮田は得意の跳馬や床運動で高得点を出し、全日本との合計160.029点で笠原を逆転した。残り2枠の代表は6月の全日本種目別選手権（東京）の結果も踏まえて決定する。〔共同〕,スポーツ,体操NHK杯、17歳宮田笙子が初V　世界選手権代表入り,https://www.nikkei.com/article/DGXZQOKC142G80U2A510C2000000/
05/14/2022,オンキヨーホームエンターテイメント（大阪府東大阪市）が大阪地裁に自己破産を申請した。高級オーディオメーカーとして一時代を築いた名門企業の歴史に幕が下りる。経営陣は会社存続へ「あらゆる可能性を模索した」ものの、いくつもの誤算が重なった。ここ数年は資金調達の誤算が続いた。2019年5月、虎の子の家庭向けAV（音響・映像）事業を米音響機器大手サウンド・ユナイテッドに約80億円で売却すると発表したも...,関西,オンキヨー破産申請、続いた誤算　資金や半導体不足,https://www.nikkei.com/article/DGXZQOUF13DXV0T10C22A5000000/
05/14/2022,オリックスは14日、竹安大知投手が新型コロナウイルスの陽性判定を受けたと発表した。13日のスクリーニングPCR検査で判明し、無症状で隔離療養しているという。竹安は8日の楽天戦に今季初登板で先発し、9日に出場選手登録を外れていた。〔共同〕,新型コロナ,オリックス竹安大知がコロナ陽性　無症状で隔離,https://www.nikkei.com/article/DGXZQOKC141OF0U2A510C2000000/
