04/06/2022,ソニーグループが事業の壁を越えたデータ活用を進めている。ゲーム、音楽、映画、エレキなど多くの子会社や部門間でデータの共有・分析ができるクラウド基盤を整えた。最高デジタル責任者（CDO）の小寺剛常務はデジタルトランスフォーメーション（DX）を活用し、個社の独立を維持しつつ横の連携を深める「連邦制」による付加価値創出をめざす。――データ戦略の動きを教えてください。「グループ内の企業間でデータの加工や交換、分析が...,エレクトロニクス,ソニーG「連邦制でデータ連携」　共有・分析の基盤整備,https://www.nikkei.com/article/DGXZQOUC030F80T00C22A4000000/
04/06/2022,6日早朝の東京外国為替市場で、円相場は下落している。8時30分時点は1ドル=123円59～61銭と前日17時時点と比べて70銭の円安・ドル高だった。米連邦準備理事会（FRB）理事らの発言を受け、米国の金融引き締め観測が一段と強まっている。5日の米債券市場で米長期金利が上昇したことを受け、日米金利差を意識した円売り・ドル買いの動きが優勢だ。FRBのブレイナード理事は5日の講演で、国債など保有資産の圧縮について「5月にも始め、削減ペースは前回より著しく速くなるだろう」と述べた。金融引き締めに慎重なハト派として知られる同氏が改めてインフレ抑制に積極的な姿勢を示したことを受け、5日に米長期金利は一時2.56%と約3年ぶりの高水準まで上昇した。引き締めが加速するとの観測が円相場の重荷となっている。円は対ユーロでは上昇している。8時30分時点は1ユーロ=134円78～81銭と、同16銭の円高・ユーロ安だった。欧州連合（EU）の欧州委員会が5日にロシアへの追加制裁案を提案したことなどを受け、欧州景気の悪化懸念からユーロ売りが優勢となっている。ユーロは対ドルでも下落している。8時30分時点は1ユーロ=1.0905～06ドルと同0.0075ドルのユーロ安・ドル高だった。〔日経QUICKニュース（NQN）〕,為替概況,外為8時30分　円、下落し123円台後半　対ユーロでは上昇,https://www.nikkei.com/article/DGXZASS0IMF01_W2A400C2000000/
04/06/2022,【フォートマイヤーズ（米フロリダ州）=共同】米大リーグ、レッズは5日、開幕ベンチ入りメンバーから外れた秋山翔吾外野手（33）を自由契約にしたと発表した。秋山はフリーエージェント（FA）となり、今後は日本のプロ野球を含む他球団と交渉が可能となる。2020年にプロ野球西武から海外FA権を行使してレッズ入り。昨季までの2年で142試合に出場し、打率2割2分4厘、本塁打なし、21打点だった。今季が3年契約の最終年だったが、オープン戦で打率1割8分2厘と不振で3日に開幕ベンチ外が発表された。秋山はレッズの日本語公式ツイッターを通じ「またどこかでプレーする姿を見せられる時まで準備をしたい」とコメントした。,スポーツ,秋山翔吾、レッズが自由契約に　「またどこかでプレー」,https://www.nikkei.com/article/DGXZQOKC060DQ0W2A400C2000000/
04/06/2022,【リスボン=共同】サッカーの欧州チャンピオンズリーグ（CL）は5日、リスボンなどで準々決勝第1戦の2試合が行われ、南野拓実の所属するリバプール（イングランド）がアウェーでベンフィカ（ポルトガル）を3-1で下した。マネらがゴールを奪った。南野は出場機会がなかった。昨季準優勝のマンチェスター・シティー（イングランド）はホームでアトレチコ・マドリード（スペイン）と対戦し、後半25分にデブルイネが得点して1-0で勝った。両カードの第2戦は13日に行われる。,スポーツ,リバプールが敵地で勝つ　欧州CL、南野は出場機会なし,https://www.nikkei.com/article/DGXZQOKC060FP0W2A400C2000000/
04/06/2022,【オーガスタ（米ジョージア州）=共同】7日に開幕する男子ゴルフのメジャー、マスターズ・トーナメントの予選ラウンドの組み合わせが5日発表され、前回覇者の松山英樹は世界ランキング7位のジャスティン・トーマス、昨年の全米アマチュア選手権を制したジェームズ・ピオット（ともに米国）と同組となり、第1日は午前10時45分（日本時間7日午後11時45分）にスタートする。出場の意向を示したタイガー・ウッズ（米国）はホアキン・ニーマン（チリ）らと松山の直前の組に入った。金谷拓実は元世界1位のジャスティン・ローズ（英国）らと回り、アマチュアの中島啓太（日体大）は2012、14年大会覇者のバッバ・ワトソン（米国）らと同組となった。,スポーツ,松山英樹、J・トーマスらと同組　マスターズ7日開幕,https://www.nikkei.com/article/DGXZQOKC060I70W2A400C2000000/
04/06/2022,【ワシントン=中村亮】米国と英国、オーストラリアは5日、極超音速兵器や自律型無人潜水機の開発など8分野での協力を発表した。協力分野を先端技術に広げて、中国に対抗する姿勢を鮮明にした。ロシアによるウクライナ侵攻が続くなかでもインド太平洋地域を重視する意向を示す狙いもある。バイデン米大統領と英国のジョンソン首相、豪州のモリソン首相は5日の共同声明で「自由で開かれたインド太平洋に向けた関与を再確認した」と言明した。ウクライナ侵攻を非難したうえで「人権や法の統治、威圧のない紛争の平和的解決を尊重する国際システムへの揺るぎない関与を重ねて申し合わせた」とも強調した。米英豪は2021年9月、インド太平洋地域での安全保障の枠組み「AUKUS（オーカス）」を創設した。米英による豪州向けの原子力潜水艦の技術供与に合意していたが、5日には新たに8分野での協力をまとめた。具体的には音速の5倍以上（マッハ5）で変則飛行する極超音速兵器の開発で協力を打ち出した。米豪は20年末に共同開発を発表しており、英国を加えて開発加速を目指す。米国防総省は中国が20年に極超音速滑空体を搭載可能な中距離ミサイル「DF17」を実戦配備したと分析しており、米国の開発の遅れが鮮明になっている。ロシアはウクライナで、「極超音速兵器」と主張する空中発射型ミサイル「キンジャル」を初めて実戦使用した。米国防高等研究計画局（DARPA）は5日、極超音速巡航ミサイルの実験に最近成功していたと発表した。米軍は核態勢を強化するロシアとの緊張拡大を避けるために大陸間弾道ミサイル（ICBM）の発射実験を中止しており、極超音速兵器の開発を優先する姿勢が際立つ。米陸軍は23年中の配備を目指している。米英豪は自律型無人潜水機の開発に向けた実験を23年に実行すると明らかにした。インド太平洋では広大な海が戦闘の舞台になる公算が大きく、海底から無人機による情報収集や対潜水艦作戦の重要度が増す。ホワイトハウスは声明で、自律型無人潜水機について「我々の海軍力を大幅に増幅させる」と訴えた。オースティン米国防長官は5日、下院軍事委員会の公聴会で「中国は強力な海中能力を持っている」と警戒感を示した。米国防総省の報告書によると中国は20年に約70隻の潜水艦を保有し、米国がインド太平洋地域に展開しているとされる10隻程度を大きく上回る。米国の同盟国も潜水艦を保有して単純な戦力比較は難しいが、中国の戦力が増しているのは明白だ。3カ国は人工知能（AI）でも協力する。米軍はAIなどを駆使して、敵の位置把握から最適な攻撃手法の選定、攻撃実行にかかる時間を大幅に短くする目標を掲げる。実現には同盟国やパートーナー国から情報提供を受ける必要があり、3カ国の協力も将来的な軍事作戦を視野に入れたものとみられる。新アメリカ安全保障センターのリサ・カーティス上級研究員はオーカスの協力拡大について「ロシアがウクライナで引き起こした戦争中でも米国はインド太平洋で実行すべき課題から目を背けないというシグナルを中国や（インド太平洋）地域に送った」と指摘する。欧州に展開する米軍の規模は10万人規模と2月上旬から1割以上増えた。アジア各国がバイデン政権によるインド太平洋への関与が揺らいでいるとみなせば、中国に融和的な外交政策をとらざるを得なくなる。米政権は国際協調を通じて中国に圧力を強める構えで、オーカスを通じてアジア各国のつなぎ留めを図る思惑も透ける。,ウクライナ侵攻,米英豪、先端技術に協力拡大　極超音速兵器で中ロに遅れ,https://www.nikkei.com/article/DGXZQOGN0605W0W2A400C2000000/
04/06/2022,【シカゴ支局】5日の日経平均先物は反落。6月物は前日比480円安の2万7520円で引け、大取終値を280円下回った。米長期金利の上昇を受けた米株式相場の下落につれ安となった。,国内株概況,シカゴ日本株先物概況・5日,https://www.nikkei.com/article/DGXZASH2ICE01_W2A400C2000000/
04/06/2022,【オーガスタ（ジョージア州）=串田孝義】7日に開幕するゴルフのメジャー、マスターズ・トーナメントへの出場が注目されているタイガー・ウッズ（米国）が5日午前、オーガスタ・ナショナルGCの公式記者会見に登場した。「あなたは今週のマスターズに勝てると思うか」と問われ、「思います」と即答した。明確な出場表明より先に飛び出した勝利宣言。それに合わせるように発表された予選ラウンドの組み合わせでは、ウッズは初...,スポーツ,ウッズ、マスターズ挑戦は「マラソン」　会見ではV宣言,https://www.nikkei.com/article/DGXZQODH05DZH0V00C22A4000000/
