05/17/2022,女性の起業家や役員は、忙しく働き重責を担う。子育てとの両立のコツをひもとくと、パートナーとの協力関係の構築が共通項として浮かび上がってきた。このほど改正育児・介護休業法が施行され、10月には「産後パパ育休」の導入が控える。子育て中でも性差なく働ける社会の実現へ、カギを握るパートナーとの協力関係からヒントを探った。個人向け遺伝子解析サービスを展開するジーンクエスト（東京・港）の高橋祥子社長は多忙...,日経産業新聞,女性起業家に学ぶ育児との両立　パートナーとどう協力？,https://www.nikkei.com/article/DGXZQOUC285P10Y2A420C2000000/
05/17/2022,昭和電工が2020年に約9600億円で買収した昭和電工マテリアルズ（旧・日立化成）との統合作業が最終局面を迎えている。昭和電工は23年1月から持ち株会社制に移行し、新たに「レゾナック・ホールディングス」として始動する方針だ。高橋秀仁社長に今後の戦略を聞いた。――統合後のシナジー（相乗効果）をどう引きだしますか。「シナジーは色々な面で出せる。例えば、（プリント基板に使う）銅張積層板や（半導体材...,日経産業新聞,昭和電工社長「半導体2500億円投資」 23年持ち株会社に,https://www.nikkei.com/article/DGXZQOUC2488E0U2A320C2000000/
05/17/2022,イスラエルのスタートアップ、ネクサーは自動運転車向けのHDマップ（高精度3D地図）に事故や工事などの一時的な道路の変化を即時に反映するシステムの販売を日本で始める。検知から1秒以内にマップを更新し、自動車が安全に走行できる環境を提供する。本格的な自動運転時代を迎える前に日本での経営地盤を固める考えだ。ネクサーはドライブレコーダーの販売と画像解析を手掛ける企業だ。5月中に日本法人を立ち上げ、自動...,日経産業新聞,ネクサー、自動運転地図に道の異常即反映　事故や工事,https://www.nikkei.com/article/DGXZQOUC243SW0U2A420C2000000/
05/17/2022,茶道や剣道のように経営にも「道」があることを教えてくれた人がいる。日本経営道協会代表の市川覚峯さんだ。非常にパワフルで、独創性を生かして柔軟に状況の変化に対応する力がある。初めて会ったのは40年ほど前だ。凸版印刷のパッケージ部門で「職場活性化活動」のアドバイザーとして招いた。通常、研修は内容が決まっているが、市川さんはメンバーの個性にあわせて内容や場の空気を変幻自在に操り、社員を巻き込みながら...,交遊抄,40年前の研修　大久保伸一,https://www.nikkei.com/article/DGXZQOUC225IH0S2A320C2000000/
05/17/2022,ウクライナ侵攻で対ロシア批判が強まるなか、国内のSNS（交流サイト）上ではプーチン政権擁護の投稿も目立つ。東京大学と日本経済新聞が調べたところ、「ウクライナはネオナチ」などロシアの言い分に沿ったツイッター投稿を拡散させている人の約9割は、新型コロナウイルスワクチンに関する誤情報などを発信していた。ネット世論にゆがみが生じている恐れがある。鳥海不二夫教授と共同で「ウクライナ」「ロシア」「プーチン...,ウクライナ侵攻,ウクライナ批判のSNS投稿者、ワクチンでも誤情報発信,https://www.nikkei.com/article/DGXZQOUC174630X10C22A3000000/
05/17/2022,3月に岸田文雄首相がインドを訪問し、官民で5兆円の対印投資目標を表明したが、これは決して無理な金額ではない。インドには最先端のスタートアップがひしめき、自動車部品や消費財メーカーに出資し買収するといったM&A（合併・買収）も有望だ。日本の産業界にとって大きなチャンスとなるだろう。かつては自動車や家電などが中心だった日系企業は今、消費財やサービス産業などに業種が広がり、進出先もデリー首都,私見卓見,インドビジネス、カギは人材育成　佐藤隆広氏,https://www.nikkei.com/article/DGXZQOCD147YI0U2A410C2000000/
