02/25/2022,日本最大級のバレンタイン催事として知られるJR名古屋高島屋（名古屋市）の「アムール・デュ・ショコラ」で、初出品の「SNOW SAND（スノーサンド）」が快進撃を見せた。1日の売上高では約150ブランドで最高4位に躍進。北海道日高町産の生乳で作る濃厚な甘さが光る。生チョコレート、ホワイトチョコレートを北海道産のバターや砂糖で作ったラングドシャクッキーでサンドした。JR名古屋高島屋の広報担当者は「初...,サービス・食品,日高の放牧牛でスノーサンド　バレンタインの定番へ快走,https://www.nikkei.com/article/DGXZQOFC1339H0T10C22A2000000/
02/25/2022,【NQN香港=桶本典子】25日の中国・上海株式相場は反発している。上海総合指数の始値は前日比15.3797ポイント（0.44%）高の3445.3361だった。その後も堅調に推移している。前日の米株高を受け、中国市場でも投資家心理が改善した。今年に入り売り込まれていた半導体などのハイテク株に見直し買いが入っている。ウクライナ情勢をめぐる警戒は続いているが、前日の下げ...,上海株式相場,上海株寄り付き　反発、海外株高で心理改善　ハイテク株に買い,https://www.nikkei.com/article/DGXZASFL25HHU_V20C22A2000000/
02/25/2022,25日午前の東京外国為替市場で円相場は下げ幅を縮小した。10時時点は前日17時時点に比べ81銭の円安・ドル高の1ドル=115円42～43銭だった。10時前の中値決済に向けては「ドル需給に目立った偏りはなかった」（国内銀行の為替担当者）との声があった。きょうは事業会社の決済が集中しやすい「5・10日（ごとおび）」にあたり、実需の取引は活発だったようでドル売りも出ていたとみられる。25日の日経平均株価が反発し、歩調を合わせた円売りも出た。米連邦準備理事会（FRB）のウォラー理事は24日の講演で、3月の米連邦公開市場委員会（FOMC）では雇用や物価のデータが強い場合には0.5%の利上げが有力な選択肢との認識を示した。これも円売り・ドル買い材料となり、10時25分ごろには一時115円62銭近辺まで下落した。円は対ユーロで下げ幅を縮小し、10時時点では同35銭の円安・ユーロ高の1ユーロ=129円23～24銭だった。ユーロは対ドルでは下落しており、10時時点は同0.0050ドルのユーロ安・ドル高の1ユーロ=1.1195～96ドルだった。〔日経QUICKニュース（NQN）〕,為替概況,外為10時　円、下げ幅縮小　115円台半ば　中値「偏りなし」,https://www.nikkei.com/article/DGXZASS0IMF03_V20C22A2000000/
02/25/2022,鈴木俊一財務・金融相は25日の閣議後の記者会見で、ロシアによるウクライナへの軍事侵攻に対する制裁措置として、ロシアの3銀行が日本国内に持つ資産を凍結すると明らかにした。金融制裁や輸出管理について「欧米と足並みをそろえて速やかに強い措置をとる」と強調し...,ウクライナ侵攻,ロシア3銀行の資産凍結　金融相「速やかに強い措置」,https://www.nikkei.com/article/DGXZQOUA2512U0V20C22A2000000/
02/25/2022,トランプ前米大統領が立ち上げたSNS（交流サイト）は直後に発生したトラブルでぎこちないスタートを切った。「トゥルース・ソーシャル」は、プレジデントデー（2月の第3月曜日）に立ち上げる目標を達成し、米国の無料アプリランキングでトップに躍り出た。ところが利用者になるはずだった多くの人は、エラーメッセージを受け取った。不用意な言動に制裁を加える「キャンセル・カルチャー」に反対する「キャンセルできない」コ...,米大統領選,[FT･Lex]トランプ氏のSNS、波乱の始動　コストが課題,https://www.nikkei.com/article/DGXZQOCB250MR0V20C22A2000000/
02/25/2022,英政府は新型コロナウイルスの感染拡大を防ぐための法的規制をイングランドで24日から全面的に撤廃する方針を打ち出した。しかし、職場で安全を確保するための指針を発表しておらず、今後の安全対策について暗中模索を強いられる企業の間で不安が高まっている。4月1日からは、職場で使用する簡易検査キットの無料配布も終了し、法律によって定められた疾病手当を支給した中小企業への補助金も打ち切られる。このことが多くの...,新型コロナ,[FT]英のコロナ規制撤廃、企業は「指針なし」を不安視,https://www.nikkei.com/article/DGXZQOCB2509O0V20C22A2000000/
02/25/2022,日本たばこ産業（JT）は25日までに、ロシア軍のウクライナ侵攻による情勢の緊迫を受け、同国中部クレメンチュークのたばこ製造工場の操業を一時休止した。ウクライナ国内の約900人の従業員は在宅勤務や自宅待機をさせており、安全は確認できているという。現地に日本人の従業員はいない。日本時間の24日から操業を休止した。ウクライナ人以外の従業員も、2月上旬までに国外退避させている。寺畠正道社長は...,ウクライナ侵攻,JT、ウクライナのたばこ工場を一時休止　ロシア侵攻で,https://www.nikkei.com/article/DGXZQOUC24B7B0U2A220C2000000/
02/25/2022,【NQN香港=川上宗馬】25日午前の日経アジア300指数は反発している。前日の米ハイテク株高の流れがアジア市場にも波及している。半導体関連株などを中心に値ごろ感を意識した買いが入っている。台湾半導体開発・設計の聯発科技（メディアテック）や韓国IT（情報技...,,アジア300指数・10時30分　反発、米ハイテク株高で　半導体関連が上昇,https://www.nikkei.com/article/DGXZASFL25HGD_V20C22A2000000/
02/25/2022,原油でアジア市場の指標となる中東産ドバイ原油のスポット価格は25日午前、下落した。取引の中心となる4月渡しは1バレル96.00ドル前後と前日に比べ3.00ドル安い水準で推移している。,商品概況,ドバイ原油・25日午前、下落　96.00ドル前後,https://www.nikkei.com/article/DGXZQOUB251U20V20C22A2000000/
02/25/2022,【ワシントン=大越匡洋】米連邦準備理事会（FRB）のウォラー理事は24日の講演で、3月中旬の次回米連邦公開市場委員会（FOMC）で利上げに踏み切り、「今年半ばまでに100ベーシスポイント（1%）引き上げたい」と明言した。FRBの保有資産の縮小の開始時期は「7月までに始めることを支持する」と強調した。ロシアのウクライナ侵攻で地政学リスクが高まり、金融市場に不安が広がっている。ウォラー氏はウクライナ...,金融政策,FRB理事「年半ばまでに1%利上げ」　見送り論を否定,https://www.nikkei.com/article/DGXZQOGN250KL0V20C22A2000000/
02/25/2022,岸田文雄首相は25日の記者会見で、ロシアによるウクライナ侵攻を受けた追加経済制裁を表明した。ロシアの個人・団体や金融機関を対象とする資産凍結や半導体の輸出規制を挙げた。「国際秩序の根幹を揺るがす行為として断じて許容できず厳しく非難する」と言及した。ロシアに向け「主要7カ国（G7）をはじめとする国際社会と緊密に連携しロシアに軍の即時撤収、国際法の順守を強く求める」と話した。制裁は3本柱とした。ロシアの個人・団体などへの資産凍結と査証（ビザ）発給停止に加え、ロシアの金融機関が対象の資産凍結をあげた。ロシアの軍事関連団体への輸出、国際的合意に基づく規制リスト品目や半導体など汎用品のロシア向け輸出規制を掲げた。各国の制裁でエネルギー分野は対象から外れており「エネルギーの安定供給に直ちに大きな支障をきたすことはない」と指摘した。国際協調による石油備蓄の放出や産油国への増産の働きかけなど「必要な対策を機動的に講じる」と説いた。ウクライナに残留を希望する邦人120人程度には「できる限りの手段を講じ邦人保護に取り組む」と訴えた。隣国のポーランド政府に受け入れの協力を得ていると明かし、同国から他国に移るチャーター機も手配したと説明した。今回の事態は「欧州のみならずアジアを含む国際社会の秩序に影響する大変深刻な事態だ」と提起した。「日本の安全保障の観点から決して看過できない」と強調した。北方領土問題の日本の立場は変わらないと言明した。領土交渉への影響については「現時点で予断することは控えたい」と語った。,ウクライナ侵攻,首相、ロシアに追加制裁　資産凍結や半導体輸出規制,https://www.nikkei.com/article/DGXZQOUA24CK30U2A220C2000000/
02/25/2022,25日前場中ごろの東京株式市場で日経平均株価は高値圏にある。前日比380円ほど高い2万6300円台半ばで推移している。グロース（成長）株を中心に見直し買いが入り、上げ幅を400円超に広げる場面があった。東証株価指数（TOPIX）のグロース指数は1%超高い水準で推移。一方、PBR（株価純資産倍率）が低い銘柄で構成するバリュー（割安）指数は一進一退の展開となっている。業種別では海運や空運、機械といった景気敏感業種の一部が上昇している。大和証券の林健太郎シニアストラテジストは「ウクライナ情勢をめぐる緊張は続いているものの、現時点では欧米や日本によるロシアへの経済制裁が世界の景気不安につながると見られていないことが株価の支えとなっている」とみていた。10時現在の東証1部の売買代金は概算で1兆800億円、売買高は4億6439万株だった。ソフトバンクグループやエムスリーが上げ幅を広げている。商船三井やANAHDも高い。キーエンスや太陽誘電、クボタも買われている。一方、明治HDやサッポロHDなどディフェンシブ株の一角が安い。セブン&アイや王子HD、JFEも下げている。〔日経QUICKニュース（NQN）〕,国内株概況,東証10時　上げ幅広げ一時400円超高　成長株中心に買い直し,https://www.nikkei.com/article/DGXZASS0ISS12_V20C22A2000000/
02/25/2022,政府は25日午前、世界レベルの研究支援にあてる10兆円の大学ファンド（基金）の関連法案を閣議決定した。年度内に基金の運用を始め、2023年度に「国際卓越研究大学」を数校選ぶ。大学独自の基金を積み上げて日本の研究開発の底上げに役立てる。関連法案も22年通常国会に提出し早期成立をめざす。年内にも国公立・私立大学から公募する。1校あたりの支援規模は数百億円ほどを想定する。支援要件は①事業収入の年3%...,AI,大学10兆円ファンド、23年度に支援先選定　法案閣議決定,https://www.nikkei.com/article/DGXZQOUA22D350S2A220C2000000/
02/25/2022,国立極地研究所の近藤豊特任教授らの研究チームは地球温暖化に関わる物質「ブラックカーボン（すす）」を高精度で測れる装置を開発した。北極圏でのすすの影響を調べるのに用いる。欧米の研究機関はそれぞれ観測に使う装置が異なっており、数値の直接比較が難しかった。新装置を基準に、データを補正することで、統一的な分析が可能だと確かめた。火力発電所や工場の排ガス、森林火災などによって大気中に放出されるすすは、二酸...,日経産業新聞,北極のすす観測高精度に　極地研、各国データ比較も容易,https://www.nikkei.com/article/DGXZQOUC1764C0X10C22A2000000/
02/25/2022,米男子ゴルフのホンダ・クラシックは24日、フロリダ州パームビーチガーデンズのPGAナショナル（パー70）で第1ラウンドが行われ、小平智は3バーディー、5ボギー、3ダブルボギーの78で暫定139位と出遅れた。日没までに3人が競技を終えられなかった。カート・キタヤマ（米国）が64で暫定首位。1打差にダニエル・バーガー（米国）ら3選手がつけた。〔共同〕,スポーツ,小平智、出遅れ暫定139位　米男子ゴルフ,https://www.nikkei.com/article/DGXZQOKC2519T0V20C22A2000000/
02/25/2022,25日朝方の国内商品先物市場で、原油が反落して取引を始めた。取引量の多い7月物は1キロリットル6万3230円と前日の清算値に比べ1090円安い水準で寄り付いた。前日まで買われた反動で利益確定売りが優勢になった。夜間取引では6万6200円と2014年10月以来の高水準をつけていた。ロシアは24日、ウクライナへの軍事侵攻を始めた。ウクライナ各地の軍事施設が空爆で破壊され、首都キエフの北に位置するチェ...,商品概況,商品9時30分　原油が反落、利益確定売り　金も安い,https://www.nikkei.com/article/DGXZASQ7IAB01_V20C22A2000000/
02/25/2022,政府は25日、自動車事故の被害者支援を拡充するための自動車損害賠償保障法などの改正案を閣議決定した。自動車損害賠償責任保険（自賠責保険）の保険料を上乗せし、被害者向け療養施設の整備や介護支援などに恒久的に充てる。法案が成立すれば2023年度の実施をめざす。自賠責保険料は自家用車1台あたり1年換算で約1万円を徴収している。保険料にはひき逃げなどによる事故被害者の救済対策に使う賦課金16円分が含まれる。この用途を施設運営費や介護費用の支給のほか、自動車の安全技術向上といった事故防止対策に広げる。上げ幅は今後検討するが、年100～150円程度となる見込みだ。自賠責保険料は長引く低金利で運用益の減少が続き、毎年約140億円の事故対策費の半分程度を積立金から取り崩している。現状のままでは35年ごろに資金が不足する可能性が出ており、保険料を上乗せして財源を確保する。,経済,自賠責で被害者支援拡充、法案閣議決定　保険料上乗せへ,https://www.nikkei.com/article/DGXZQOUA2458L0U2A220C2000000/
