02/14/2022,岡山市は14日、一般会計で総額3529億円の2022年度予算案を発表した。21年度当初予算比3%増となり、6年連続で過去最高を更新した。23年開館の岡山芸術創造劇場の整備に前年度比60億円増の136億円を計上。商店街でのイベント実施も支援し開館機運を高める。新型コロナウイルス関連では、価格下落の影響を受ける米農家やノリ養殖業者の経営継続のための補助金に4億円を盛り込んだ。政府が指定する「脱炭素先行地域」の申請に向けた調査などの地球温暖化対策事業には5億円を盛った。7200万円をあてる「中小企業デジタル化推進事業」では、中小ものづくり企業とIT・ロボット企業をマッチングする商談会を新たに設ける。11月3日にリニューアルオープンする岡山城の改修工事やPRには11億円を計上した。記者会見した大森雅夫市長は新型コロナウイルスへの対応に関して「オミクロン型の猛威のなか、第7波があるのかないのかで世の中は大きく変わってくる」として、状況に応じた具体的施策については「補正（予算）で対応したい」と、二段構えの施策で臨む姿勢を示した。,SDGs,岡山市の22年度予算案、3%増の3529億円　劇場整備など,https://www.nikkei.com/article/DGXZQOCC10B9U0Q2A210C2000000/
02/14/2022,14日朝のロンドン株式市場で、FTSE100種総合株価指数は続落している。英国時間8時時点では、前週末に比べて88.04ポイント（1.15%）安の7572.98だった。ウクライナ情勢を巡る地政学リスクの高まりが相場の重荷となっている。その後は下げ幅を拡大している。ドイツ株式指数（DAX）とフランスのCAC40はいずれも軟調に推移している。〔日経QUICKニュース（NQN）〕,ロンドン株式相場,ロンドン株、続落　ウクライナ情勢を警戒,https://www.nikkei.com/article/DGXZASB2IILB2_U2A210C2000000/
02/14/2022,◇ダントーホールディングス加藤　友彦氏（かとう・ともひこ）82年（昭57年）慶大商卒、淡路交通入社。05年社長、15年ダントーホールディングス会長兼社長、21年取締役相談役。兵庫県出身。63歳（3月29日就任。売間正人社長は退任）,,ダントーホールディングス社長に加藤氏,https://www.nikkei.com/article/DGXZQODZ00024_U2A210C2000000/
02/14/2022,建築資材卸の福間商事（島根県出雲市）は環境問題への意識の高まりから需要が拡大している断熱・防犯性の高い複層ガラスの生産体制を強化する。約1億7800万円を投じて最新鋭のガラス切断機などを導入する。14日、島根県と出雲市と立地に関する覚書を締結し、県と市は計約3100万円を助成する。1950年設立の同社はサッシなどの建築資材卸のほか住宅用窓ガラスの製造も手掛けている。ガラス切断機の導入のほか製造ラインも更新し、2層ガラスだけでなく、より高機能な3層の複層ガラスなどの生産も可能にする。大きさも対応の幅が広がり、350センチ×250センチまでとなる。設備増強で現在の約1.8倍の年産約4万8000平方メートルを目指し、山陰地方だけでなく山陽・北九州地方への売り込みも図る。同社の2021年6月期の売上高は約45億円。,島根,島根の福間商事、複層ガラスの生産体制を強化,https://www.nikkei.com/article/DGXZQOCC104IE0Q2A210C2000000/
02/14/2022,◇三菱製紙木坂　隆一氏（きさか・りゅういち）82年（昭57年）東大院修了、神崎製紙（現王子ホールディングス）入社。15年王子ホールディングス取締役常務、21年顧問。大阪府出身。65歳（4月1日就任。立藤幸博社長は取締役相談役に）,,三菱製紙社長に木坂氏,https://www.nikkei.com/article/DGXZQODZ00040_U2A210C2000000/
02/14/2022,日本政府はロシアがウクライナに侵攻した場合に備え制裁措置を巡る協議を本格的に始めた。岸田文雄首相は14日、国家安全保障会議（NSC）を開いて議論した。13日には首相公邸に関係省庁の幹部を集め制裁案の検討状況などを共有した。首相は14日の自民党役員会で「仮にロシア制裁となった場合の具体的内容も米国や欧州主要国と調整している」と語った。米欧はロシアが侵攻すれば経済制裁を科すと繰り返し警告している。政...,政治,政府、対ロシア制裁巡り協議　首相「米欧とも調整中」,https://www.nikkei.com/article/DGXZQOUA143UZ0U2A210C2000000/
02/14/2022,【エルサレム=共同】イスラエルが占領する東エルサレムのシェイク・ジャラ地区で13日、パレスチナ人と右派系ユダヤ人が投石するなど断続的に衝突、警察が計12人を拘束した。警察はパレスチナ人側に対し放水車や閃光（せんこう）弾を使用、地元メディアはパレスチナ赤新月社の集計としてパレスチナ人31人が負傷したと伝えた。同地区では、ユダヤ人入植団体がイスラエル建国以前にユダヤ人が住んでいたなどとして、複数のパレスチナ人に立ち退きを要求、パレスチナ人側が反発している。小競り合いが日常化する中、右派系ユダヤ人が支持する極右政党の国会議員ベングビール氏は12日、パレスチナ人住宅の前に自身の仮設事務所を設置。ユダヤ人側がパレスチナ人側を刺激する行為を続けている。シェイク・ジャラの立ち退き問題を巡っては昨年5月、パレスチナ自治区ガザを実効支配するイスラム組織ハマスが反発し、ロケット弾を発射。イスラエル軍が報復空爆を開始し、約250人が死亡する大規模戦闘につながった。,中東・アフリカ,東エルサレムで衝突　パレスチナ人31人負傷,https://www.nikkei.com/article/DGXZQOCB149EN0U2A210C2000000/
02/14/2022,高知県室戸市のキンメダイ漁師が新型コロナウイルスの影響による収入の大幅減少を補うため、副業として制作・販売を始めたビー玉のストラップが地域の新たな工芸品に育ちつつある。ストラップは漁業の道具である浮玉をイメージ。漁師がSNS(交流サイト)を通じて販売したところ、思わぬ手応えがあった。同市もさっそく応援を始めた。2017年に移住して漁師になった村崎剛さんが考えた逸品は「ビン玉ストラップ」（1個15...,高知,室戸の漁師が「ビン玉ストラップ」苦境で副業、市も応援,https://www.nikkei.com/article/DGXZQOCC141JW0U2A210C2000000/
02/14/2022,◇アマダマシナリー川下　康宏氏（かわした・やすひろ）82年（昭57年）東海大工卒、アマダソノイケ（現アマダ）入社。15年アマダホールディングス（現アマダ）取締役、21年アマダマシナリー取締役副社長執行役員。63歳（4月1日就任。田所雅彦社長は取締役に）,,アマダマシナリー社長に川下氏,https://www.nikkei.com/article/DGXZQODZ00029_U2A210C2000000/
02/14/2022,キオクシアホールディングス（HD）が14日に発表した2021年10~12月期の連結決算（国際会計基準）は、最終損益が382億円の黒字（20年同期は132億円の赤字）だった。データセンター向けなどで好調さが続き、出荷量や販売単価が押し上げられている。売上高は20年同期比40%増の4027億円で、四半期として過去最高を更新した。データセンター向けやスマートフォン向けなどで、記憶装置「ソリッド・ステート・ドライブ（SSD）」の出荷が好調だった。パソコン向けは製品メーカーの生産調整などで減速感が出たが、吸収して大幅な増収を維持した。21年7~9月から比べると出荷量は数%台前半の減少、販売単価は円安影響もあり横ばいだった。単価の上昇ペースが鈍ったことで、売上高営業利益率は7~9月期の19%から10~12月期は18%とやや鈍化している。今後の市場動向について、データセンター向けSSDの需要はクラウド事業者などの投資が続き堅調と見通す。パソコン向けも出荷先の生産制約が緩和しつつあるとして、同製品向けの需要も「底堅く推移する」とした。ただ、キオクシアの業績に関する先行きは不透明だ。22年1月下旬からメモリーを生産する工場が一部稼働を停止している。生産工程で不純物を含む部材が混入したとみられている。当面は在庫による出荷を継続できるものの、全面復旧まで長い時間を要すれば機会損失や市場シェアに対する影響が大きくなりかねない。,エレクトロニクス,キオクシアHD、10~12月純利益382億円　売上高は最高に　,https://www.nikkei.com/article/DGXZQOUC147N70U2A210C2000000/
02/14/2022,バス事業のマルイ観光バス（高松市）が2月12～28日、屋根部分が大きく開いた「オープントップバス」の実証運行を香川県内で実施している。瀬戸大橋などを走行してルートや運行時間、料金などを調査する。2階建てで眺望に優れており、四国では初めてとなる。2022年度にサービスを始めたい考えで、4月開会の「瀬戸内国際芸術祭2022」などに向けた観光コンテンツとして注目されそうだ。「瀬戸内そらバス」と名付けたオープントップバスの実証試験では、瀬戸大橋の日中ツアー、イブニングツアー、景勝地で夜景が美しいことで知られる屋島（高松市）のナイトツアー、日本の「ウユニ塩湖」ともいわれる景勝地の父母ケ浜（香川県三豊市）ツアーを予定している。観光業界の関係者に乗車してもらい、定期観光路線化に向けた課題を洗い出す。今回の事業は観光庁の補助事業として実施している。同社はこれまでインバウンド（訪日外国人客）向けに景勝地を巡るツアーを実施してきたが、バスといった交通を観光資源の一つにしたいとしている。,香川,眺望売りのオープントップバス、香川の会社が実証運行,https://www.nikkei.com/article/DGXZQOCC1429K0U2A210C2000000/
02/14/2022,防衛省・自衛隊は14日、大阪市内で2カ所目となる新型コロナウイルスワクチンの大規模接種会場での接種を始めた。大阪での1日当たりの接種人数は960人から2500人に拡大された。新たな会場は「日経今橋ビル」（中央区）に置かれた。7日に開所した「堺筋八木ビル」（同区）に続き、米モデルナ製のワクチンを使用。2回目の接種から6カ月以上がたった18歳以上が対象で、居住地は問わない。自治体が配る接種券が必要だ。予約は毎週月曜日の午後6時から、電話や専用サイトで翌週月曜日から1週間分を受け付ける。両会場とも7月末まで開く予定だ。接種に訪れた大阪府東大阪市の女性（69）は「いつどこで感染してしまうか分からず、無事に接種できて安心した」と話した。,新型コロナ,自衛隊大規模接種、大阪で2カ所目開設　1日2500人分に,https://www.nikkei.com/article/DGXZQOUF144EJ0U2A210C2000000/
02/14/2022,グリーンズが14日発表した2021年7～12月期の連結決算は最終損益が20億円の赤字（前年同期は35億円の赤字）だった。新型コロナウイルス禍が続き、宿泊者数は19年の同時期に比べると少ないが、20年より客単価が上向いて赤字幅が縮小した。売上高は41%増の116億円。あわせて、これまで未定としていた22年6月期の連結業績見通しを公表した。売上高は前期比65%増の260億円、最終損益は19億円の赤字（前年同期は88億円の赤字）を見込んでいる。,業績ニュース,ホテル運営のグリーンズ、最終赤字20億円　7～12月期,https://www.nikkei.com/article/DGXZQOFD147F50U2A210C2000000/
02/14/2022,ニップンは14日、関東財務局に2021年10～12月期の四半期報告書の提出期限の延長を申請し、承認されたと発表した。同社グループへのサイバー攻撃の影響で決算資料の作成に時間がかかっているため。従来の期限は今月14日までだった。新たな提出期限は22年3月18日となる。同社では昨年...,サービス・食品,ニップン、四半期報告書の提出期限延長,https://www.nikkei.com/article/DGXZQOUC145XL0U2A210C2000000/
02/14/2022,【香港=木原雄士】香港で新型コロナウイルス流行を抑え込む「ゼロコロナ」政策が行き詰まりつつある。新規感染は連日1000人を超え、中国国内では突出して多い。中国政府は「コロナとの共生は誤り」として、香港に検査要員を送り込むなど関与を強める。香港で感染が急増したのは春節（旧正月）明け。厳格な入境規制によって2021年末まで市中感染はほぼゼロが続いていたが、輸入したハムスターや隔離ホテル内での感染を通じてウイルスが持ち込まれたとみられている。香港は人口密度が高く、1つの団地で400人超が感染するなど、急速に広がった。政府は夜間の外食禁止に加え、理容店の閉鎖や自宅など私的な場所での集まりを家族2組までとする規制に踏み切った。感染者が出たマンションの住民など1日に20万人ほどを検査しているが、感染拡大に歯止めがかからない。従業員が感染したスーパーが突然休業するなど、日常生活にも影響が出ている。中国政府は懸念を深める。中国政府の関係者は12日、香港に隣接する広東省深圳市で香港政府の李家超・政務官らと対応を協議し、検査能力を高めるための人員派遣や隔離施設の建設を表明した。都市封鎖（ロックダウン）など本土並みの厳しい措置を取らない香港政府に不満を強めたとの見方が出ている。中国共産党の機関紙、人民日報は7日付の論評でコロナとの共生をめざす「ウィズコロナ」は「寝そべり」だと批判。「一部がウィズコロナを無責任に吹聴している。誤った理論が広まると社会の自信が揺らぐ」と、香港でゼロコロナの堅持を訴えた。一方、調査機関の香港民意研究所が2月に実施した世論調査によると、香港にもっとも適した政策として「ウィズコロナ」との回答が57%に上り、「ゼロコロナ」は32%にとどまった。親中派の曽鈺成・元立法会（議会）議長も「科学的に考えるべきだ。ウィズコロナは寝そべりではない」と述べた。経済界ではゼロコロナ政策のマイナス面を指摘する声が相次ぐ。英米から旅客機の乗り入れを禁止するなど、主要国に比べて極端に厳しい渡航規制を続けるためだ。格付け会社フィッチ・レーティングスは9日、22年の香港の成長率見通しを3%から1.5%に引き下げた。英調査会社オックスフォード・エコノミクスも「香港は少なくとも22年後半までゼロコロナ政策を続ける。景気回復を妨げ、グローバルな金融ハブとしての魅力を損なう」と指摘した。英フィナンシャル・タイムズによると、コロナ規制が厳しすぎるため、香港を拠点とする高級ホテルのマンダリンオリエンタルはグループの幹部を香港外に移した。,新型コロナ,香港「ゼロコロナ」政策が行き詰まり　中国が関与強める,https://www.nikkei.com/article/DGXZQOGM142FI0U2A210C2000000/
02/14/2022,すかいらーくホールディングスが14日発表した2021年12月期の連結決算（国際会計基準）は、最終損益が87億円の黒字（前の期は172億円の赤字）だった。店内飲食の落ち込みで売り上げは減少したものの、400億円超の時短協力金の計上が利益を押し上げた。21年末の期末配当は従来予想から2円減の12円とした。売上高にあたる売上収益は前の期比8%減の2645億円、営業損益は182億円の黒字（前の期は230億円の赤字）だった。既存店売上高は前の期から6%減った。21年9月末まで東京都などで緊急事態宣言が続き、時短営業や酒類提供の制限が響いた。一方、持ち帰りや宅配の売上高は前の期から約2割増え、売り上げを下支えした。同日発表した22年12月期の業績予想は、売上収益が前期比27%増の3360億円の見通し。前期に計上した多額の時短協力金の反動減で、純利益は54%減の40億円を見込む。22年末の期末配当予想は前期比6円減の6円とする。22年春以降に既存店売上高が徐々に回復し、10～12月期にはコロナ前の水準まで戻ると想定する。,業績ニュース,すかいらーく21年12月期、87億円の最終黒字　協力金で,https://www.nikkei.com/article/DGXZQOUC141Q00U2A210C2000000/
02/14/2022,オタフクソース（広島市）はデーツ（ナツメヤシの実）の業務用商品を3月に発売すると発表した。乾燥させたデーツを豆粒ほどの大きさにカットして袋詰めした。砂糖の代わりにパンやお菓子に練り込み、甘みやコクが出せるとしてパン屋やカフェなどに売り込む。内容量は250グラムで、標準小売価格は682円。デーツはソースの原料として使われており、黒糖に似たコクがあり栄養価が高いという。オタフクは2020年に家庭向けにデーツを商品化しており、業務用として売り出すのは今回が初めてとなる。,サービス・食品,オタフクソース、初の業務用デーツを3月に発売,https://www.nikkei.com/article/DGXZQOCC1458G0U2A210C2000000/
02/14/2022,鳥取県は県産品が割引価格で購入できる「ふるさととっとり産品応援キャンペーン」を開催する。鳥取県物産協会と連携し、特設サイトで15日から3月15日までの期間限定で実施する。県産品の消費拡大と知名度向上を図り、新型コロナウイルス禍で経営が厳しい事業者を支援する。特設サイトでは「浜茹で松葉がにタグ付...,鳥取,鳥取県、県産品応援サイト　15日から割引販売,https://www.nikkei.com/article/DGXZQOCC147LQ0U2A210C2000000/
02/14/2022,山口市が14日発表した2022年度予算案は、一般会計が前年度当初比3.1%増の904億円となった。建て替えを支援している総合病院の建設工事進捗などで投資的経費が8.4%減少する一方、新型コロナウイルスワクチン接種の委託料や給食の公会計化に伴う材料費などで物件費が18.5%増加する。主な事業として、建設に着手する新本庁舎の整備事業、湯田温泉の複合施設の実施設計、中心商店街・市街地の整備・活性化などを盛り込んだ。また農林水産部を新設し、スマート農機導入や農山村地域への移住・就農・起業を促進する。歳入は景気回復や新築家屋増加により市民税や固定資産税など市税が1.9%増の271億円。市債は臨時財政対策債の大幅な減少に加え、事業進捗に伴う過疎対策事業債の減少で30.4%減の93億円。市債の22年度末残高は0.3%減の1158億円を見込む。,税・予算,山口市、22年度予算案3.1%増　スマート農業促進など,https://www.nikkei.com/article/DGXZQOCC145M80U2A210C2000000/
02/14/2022,ロケット開発のインターステラテクノロジズ（IST、北海道大樹町）は福島県南相馬市の中小・零細企業と部品製作などで連携する。同市はISTと連携協定を締結。ニーズに応じた地元企業の紹介や人材確保などで協力する。ISTは2019年、民間企業が単独で開発したロケットとして国内初の宇宙空間到達に成功した。現在、先端部分に小型の人工衛星を搭載できるロケットを開発中で、23年度の打ち上げを目指している。福島では21年、南相馬市に支社を設立。開発には震災・原発事故の復興補助金を活用するほか、地場企業との商談会に参加し協業先を広げている。稲川貴大社長は「市内の企業は航空宇宙関連で豊富な受注実績がある」と進出理由を話した。金属加工の小浜製作所（同市）はISTからアルミ部品の切削加工を受注した。川岸邦彦社長は「宇宙産業に関わり自社の技術力を上げたい。開発段階から参画すれば、量産化後の受注も見込める」と話す。,スタートアップ,インターステラと福島・南相馬市、ロケット開発で連携,https://www.nikkei.com/article/DGXZQOCC09E670Z00C22A2000000/
02/14/2022,松野博一官房長官は14日の記者会見で、ウクライナでの在留邦人保護を巡り同国西部リビウ市で臨時の連絡事務所の開設を準備していると発表した。一部を除く職員が退避し始める首都キエフの日本大使館の機能を補完する。政府は在留邦人に国外退避を呼びかけている。松野氏は在留邦人の保護に向け「海外緊急展開チームを3週間程度にわたって派遣した。出国の働きかけなど大使館の領事業務を支援してきた」と説明した。この書籍を購入する（ヘルプ）：      Amazon楽天ブックス,政治,ウクライナ西部に臨時の連絡事務所　政府、邦人保護巡り,https://www.nikkei.com/article/DGXZQOUA148BE0U2A210C2000000/
02/14/2022,【ベルリン=石川潤】主要7カ国（G7）財務相は14日、緊迫するウクライナ情勢を受けて、ロシアによる侵攻があれば「迅速かつ協調された強力な対応」に踏み切るとする声明文を発表した。声明文では、G7はロシア経済に「甚大かつ即時の結果をもたらす経済・金融制裁」を科す用意ができていると強調した。声明文によると、G7財務相はロシアがウクライナ国境に兵力を結集していることに対して「重大な懸念」を表明。緊張緩和に向けた外交的な解決を探る動きを支持するとともに、ウクライナ経済を支援するために「迅速かつ果断に行動する用意がある」と強調した。G7は国際金融機関とともに、これまでもウクライナを支援してきた。2014年からの経済支援の総額は480億ドルを上回るという。声明文では、G7が「引き続き状況を注意深く監視する」と指摘。ウクライナへの「さらなる経済金融支援で行動する用意がある」とした。【関連記事】,ウクライナ情勢,G7財務相、ロシアに経済・金融制裁の用意　侵攻なら,https://www.nikkei.com/article/DGXZQOGR148L30U2A210C2000000/
02/14/2022,アイバン・ライトマンさん（カナダの映画監督）米メディアによると2月12日、カリフォルニア州モンテシートの自宅で死去、75歳。死因は明らかにされていない。「ゴーストバスターズ」「ツインズ」など数々のヒット作を手掛けた。（ロサンゼルス=共同）,,アイバン・ライトマンさんが死去　ゴーストバスターズ監督,https://www.nikkei.com/article/DGXZQOUE148NS0U2A210C2000000/
