04/27/2022,京都府は27日、新型コロナウイルスの対策本部会議を開き、ゴールデンウイーク（GW）期間中の感染対策をまとめた。「まん延防止等重点措置」が解除された3月下旬以降、府独自で取り組んできた飲食店への人数制限の要請などを継続する。大阪府と兵庫県も独自の対策を継続することを決めており、経済圏が重なる関西3府県で足並みをそろえた形だ。飲食店への要請では、認証店や非認証店にかかわらず「1テーブル4人以内」や「2時間以内」を求める。大勢が集まる場所に行く際には正しくマスクを着用するなど感染防止対策を徹底することを改めて訴えた。西脇隆俊知事は「3年ぶりに緊急事態宣言がないGWだ。旅行や帰省、イベントなど普段会わない人との接触の機会が増える」と警戒を呼びかけた。府内の26日時点の新規感染者数（7日間平均）は843.7人だった。1週間前の19日時点（847.7人）からほぼ横ばいで推移しているが、西脇氏は「依然として一定の感染者が毎日出ている」と危機感を示した。,新型コロナ,GW中、京都も警戒継続　コロナ対応関西3府県で足並み,https://www.nikkei.com/article/DGXZQOUF273AA0X20C22A4000000/
04/27/2022,東京都は27日、新型コロナウイルスの感染者が新たに6052人確認されたと発表した。直近1週間平均の新規感染者は5239人で、前週（約6166人）の85.0%だった。累計感染者数は142万6497人となった。都内の重症者は前日と同じ15人だった。新たに6人の死亡が確認され、累計の死者数は4319人となった。新規感染者を年代別に見ると、30代が1123人と最も多く、10歳未満が1075人、20代が1054人と続いた。65歳以上の高齢者は343人だった。ワクチンの接種状況別では2回接種済みが2978人、未接種は1636人だった。,新型コロナ,東京都、新たに6052人感染　7日平均で前週の85.0%,https://www.nikkei.com/article/DGXZQOCC270DD0X20C22A4000000/
04/27/2022,鳥貴族ホールディングス（HD）は、28日から居酒屋「鳥貴族」で2017年10月以来、約4年半ぶりに値上げする。価格改定の狙いについて、大倉忠司社長は「社員が働きたいと思ってもらえる会社でないと将来はない」としており、値上げで得た資金をもとに従業員の待遇を改善して今後の成長につなげる考えを示した。前回の値上げでは2年近くにわたって客足に響いたが、今回については「影響は短期的」と予想した。28日か...,関西,鳥貴族、4年半ぶり値上げ　大倉社長「社員の待遇改善」,https://www.nikkei.com/article/DGXZQOUF2714J0X20C22A4000000/
04/27/2022,原油でアジア市場の指標となる中東産ドバイ原油のスポット価格は27日午後、上昇した。取引の中心となる6月渡しは1バレル103.80ドル前後と前日に比べ2.80ドル高い水準で推移している。,商品概況,ドバイ原油・27日午後、上昇　103.80ドル前後,https://www.nikkei.com/article/DGXZQOUB2793G0X20C22A4000000/
04/27/2022,陸上男子短距離で交通事故に巻き込まれたケンブリッジ飛鳥（ナイキ）のマネジメント会社は27日、軽度の頸椎捻挫と診断されたと発表した。ケンブリッジは公式サイトで「応援してくださっている皆さまにはご心配をおかけしておりますが、一日も早い回復に努めてまいります」などとコメントした。関係者によると、ケンブリッジは26日午前9時過ぎに東京都内の首都高速道路で乗用車を運転中、トラックに追突された。入院はせず安静にしているという。今後の大会出場は未定だが、6月の日本選手権に向けて復帰を目指していく。〔共同〕,スポーツ,陸上ケンブリッジ飛鳥、交通事故で頸椎捻挫　入院はせず,https://www.nikkei.com/article/DGXZQOKC278X40X20C22A4000000/
04/27/2022,鹿児島市は27日、公式観光アプリ「わくわく」の配信を始めた。CRM（カスタマー・リレーションシップ・マネジメント）と呼ばれる顧客情報管理システムを活用し、旅行客個人に応じたサービスや観光の情報を提供する。鹿児島市の下鶴隆央市長は「観光アプリなどの施策で、アフターコロナの鹿児島市の観光業の浮揚につなげていきたい」と述べた。わくわくは加盟店や観光地のおすすめ情報を旅行客に提供するほか、スタンプラリーなど買い回りを促す機能などがある。27日時点の加盟店は桜島・錦江湾周辺の23店だが、今後天文館など市街地を中心に鹿児島市全域へ広げたい考え。アプリの利用者はスマートフォンにダウンロードし、年齢や居住地などの属性情報を入力すると、旅行中に観光・飲食案内やイベント情報などを受け取ることができる。本人の了解を得た上で位置情報を取得し、購買情報なども入力してもらう。会員登録を促すため、先着15000人に加盟店で使える500円分のポイントを付与するほか、サッカーJ3の鹿児島ユナイテッドFCのホームゲームに抽選で500人を無料招待する。,鹿児島,鹿児島市、観光アプリの配信開始　顧客データを活用,https://www.nikkei.com/article/DGXZQOJC275W90X20C22A4000000/
04/27/2022,参院は27日、石川選挙区補欠選挙で当選した宮本周司氏が自民党会派に入会したと発表した。参院の新たな会派別勢力分野は以下の通り。自民党・国民の声110▽立憲民主・社民45▽公明党28▽国民民主党・新緑風会16▽日本維新の会15▽共産党13▽沖縄の風2▽れいわ新選組2▽碧水会2▽みんなの党2▽無所属8▽欠員2,政治,宮本氏が自民会派入り　参院,https://www.nikkei.com/article/DGXZQOUA276G60X20C22A4000000/
04/27/2022,27日朝のロンドン株式市場で、FTSE100種総合株価指数は小幅に続伸している。英国時間8時時点では、前日に比べて7.22ポイント（0.10%）高の7393.41だった。HSBCホールディングスやグレンコアの上昇が目立つ。ドイツ株式指数（DAX）とフランスのCAC40はいずれも軟調に推移している。〔日経QUICKニュース（NQN）〕,ロンドン株式相場,ロンドン株、小幅続伸で始まる　独株は小動き,https://www.nikkei.com/article/DGXZASB2IILB2_X20C22A4000000/
04/27/2022,九州財務局と福岡財務支局は27日、4月の管内経済情勢報告を発表した。景気判断は北部（福岡・佐賀・長崎県）、南部（熊本・大分・宮崎・鹿児島県）とも「持ち直しつつある」との表現を据え置いたが、自動車生産の落ち込みを背景に「一部に弱さがある」と付け加えた。ウクライナ情勢の深刻化や、資源価格の高騰など、先行き不透明感も強まっている。個別項目では、北部で生産活動の判断を「一進一退の状況」に引き下げた。部品の供給不足や企業へのサイバー攻撃、3月に東北で発生した地震の影響などで、自動車の生産が急減した。南部は雇用の判断を引き上げた一方、生産については一部に弱さがみられるとした。九州財務局の石川浩局長は生産の状況を巡り「（コロナ感染者が急増した）中国・上海のロックダウン（都市封鎖）で工場が稼働停止している影響が出ている」と指摘した。ウクライナ情勢についても「輸送や部材調達のコストが上昇し、製造業に先々影響が出ないか注視する。企業からも、足元より今後が心配だとの声がある」と話した。,九州・沖縄,九州の景況判断、据え置きも「一部に弱さ」　4月財務局,https://www.nikkei.com/article/DGXZQOJC264CK0W2A420C2000000/
04/27/2022,長野県の松本市内から上高地に向かう県道で27日、前日からの大雨の影響で道路脇の斜面が崩れ、通行止めとなった。上高地で旅行客や宿泊施設従業員ら計700人以上が足止めされた。県の建設事務所によると、崩落したのは「太兵衛平」のバス停に近い地域。幅が約10メートル、高さは約15メートルの範囲で斜面が崩れた。27日午前4時半ごろ、現場の視察に来た業者が発見した。通常、夜間は通行止めとなっており、けが人はいなかった。29日朝の全面復旧を目指している。松本市によると、27日に開催予定だった上高地の開山祭は中止になった。〔共同〕,社会・調査,大雨で斜面崩れ700人足止め　長野・上高地の県道,https://www.nikkei.com/article/DGXZQOUE277RJ0X20C22A4000000/
04/27/2022,新潟県が魚沼地域（十日町市、津南町、魚沼市、南魚沼市、湯沢町）の魅力を発信するデジタルパンフレット「Yukiguni Trip」を公開している。29日から越後妻有地域（十日町市・津南町）で開く世界最大級の国際芸術祭「越後妻有　大地の芸術祭2022」を交流人口拡大の好機ととらえ、芸術祭隣接エリアへの誘客を促進する狙い。パンフレットは、雪国観光圏と大地の芸術祭実行委員会の協力のもと作成した。県のウェブサイトからダウンロードできる。「大地の芸術祭の開催にあわせ、アートや里山をめぐる来訪者の旅カタログとして活用してほしい」（十日町地域振興局）という。大地の芸術祭の拠点施設である越後妻有里山現代美術館MonET（モネ）やまつだい農舞台のリニューアル情報、魚沼地域の雲海、棚田などの自然、魚沼の食やローカル線など魚沼地域のめぐり方、土産物などを紹介している。大地の芸術祭2022の会期は、11月13日までの145日間。,グルメ＆トラベル,新潟県、魚沼地域の魅力をデジタルパンフレットで発信,https://www.nikkei.com/article/DGXZQOCC270OK0X20C22A4000000/
04/27/2022,鹿児島銀行は27日、南日本銀行と共同でATMコーナーを設置すると発表した。鹿児島県屋久島町にある南日本銀行の店舗外ATMコーナーに鹿児島銀のATMを併設する。両行がATMを並べて設置するのは初めてという。地域の利用客の利便性を高めるとともに、設置場所の確保や運営面の効率化につなげる。南日本銀の屋久島支店安房出張所に、鹿児島銀の屋久島安房出張所を移設する。ATMは各1台ずつ設置、鹿児島銀のATMは5月13日午前8時から稼働する予定だ。鹿児島銀の松山澄寛頭取は「効率化の面から両行にメリットがある。競争しなくてよいところは競争せず、必要なところで競争すべきだ。今後、鹿児島銀の敷地に南日本銀がATMをおきたいという提案があればウエルカムだ」と述べた。,金融機関,鹿児島銀行と南日本銀行、屋久島に共同ATMコーナー,https://www.nikkei.com/article/DGXZQOJC275370X20C22A4000000/
04/27/2022,◇日本瓦斯柏谷　邦彦氏（かしわや・くにひこ）97年（平9年）一橋大院修了。99年アーンスト・アンド・ヤング入社。13年日本瓦斯取締役、18年代表取締役専務。兵庫県出身。51歳（5月2日就任。和田真治社長は会長に）,,日本瓦斯社長に柏谷氏,https://www.nikkei.com/article/DGXZQODZ00016_X20C22A4000000/
04/27/2022,東京都の小池百合子知事は27日、都内で講演し、都が検討を進めている住宅などへの太陽光発電の設置義務化について「できるだけ早く進めていくのが必要」と述べた。ウクライナ情勢などでエネルギー問題が深刻化しているとして、都は電力を「減らす、つくる、ためる」活動を進めており、「今つくる建物が将来を決める。数十年使う建物は環境・防災面でサステナブルなものにしなければならない」と述べた。小池都知事はグリーン関連や女性活躍や子育て環境の改善、デジタル化などの都の取り組みを説明。人口問題や経済力、危機管理などの諸課題に戦略と意志を持って取り組み「1400万人の都市を安全、活気あふれる都市にさらにブラッシュアップしていきたい」と述べた。,東京,太陽光の設置義務化「できるだけ早く」東京都・小池知事,https://www.nikkei.com/article/DGXZQOCC276VF0X20C22A4000000/
04/27/2022,【NQN香港=須永太一朗】27日の中国・上海株式相場は3営業日ぶりに反発した。上海総合指数の終値は前日比71.8563ポイント（2.48%）高の2958.2820だった。前日に付けた年初来安値を下回って始まったが、その後上昇に転じた。中国の習近平（シー・ジンピン）国家主席主宰の経済会議でインフラ建設推進などの方針が伝わり、中国当局の景気対策への期待が高まった。好業績銘柄を物色する動きも活発で、...,上海株式相場,上海株大引け　3日ぶり反発　景気対策に期待、好業績銘柄の物色も,https://www.nikkei.com/article/DGXZASFL27HM4_X20C22A4000000/
04/27/2022,キーエンスが27日発表した2022年3月期の連結決算は、純利益が前の期比54%増の3033億円だった。4日時点の市場予想平均（QUICKコンセンサス）の2954億円を上回り、過去最高を更新した。欧米やアジアで工場の設備投資が上向き、工場の自動化に使うセンサーや制御機器、研究開発に使う検査装置などの販売が国内外で伸びた。売上高は40%増の7551億円、営業利益は51%増の4180億円だった。いずれも過去最高を更新した。,業績ニュース,キーエンス純利益最高　22年3月期、FA機器けん引,https://www.nikkei.com/article/DGXZQOUF195WF0Z10C22A4000000/
04/27/2022,【NQNシンガポール=今　晶】27日の日経アジア300指数は反落している。16時時点は前日比0.86%安の1522.00だった。前日の米株安を受けて投資家はリスクを避ける姿勢を強め、ハイテク株などに売りが先行した。中国での厳しい行動規制が域内の景気に悪影響を及ぼすとの懸念も引き続き投資家心理の重荷となった。半面、中国本土では当局による経済対策への期待が改めて広がっている。時価総額の大きな酒造の...,アジア株概況,アジア300指数・16時　反落、米株安で心理悪化　中国の政策期待は支え,https://www.nikkei.com/article/DGXZASFL27HLY_X20C22A4000000/
04/27/2022,東芝は27日、英通信大手BTグループと共同で、次世代の暗号技術「量子暗号通信」の実証実験をロンドンで始めたと発表した。一般企業が利用できる通信網を用意し、参加を募って実用性や安全性を確認してもらう。最長で3年間続けて効果を検証し、量子暗号通信の社会実装につなげる。量子暗号通信は通信する際のセキュリティーを高める暗号化や、その暗号を元に戻す「鍵」の情報を光の粒子にのせてやり取りするため、盗聴などが理論上不可能とされる。今回の実証試験ではBT子会社の光ファイバー網を使い、東芝が量子暗号通信のシステムを提供する。まず大手国際会計事務所アーンスト・アンド・ヤング（EY）が利用を予定している。東芝子会社の東芝デジタルソリューションズの岡田俊輔社長は、日本経済新聞の取材に「ハードウエアを売るのではなく、たくさんの鍵を配信するサービスをしたい。EYとの協業の中で価格など詳細を決め、2～3年後には実用化したい」と述べた。東芝は量子暗号通信の国内外での展開を進めており、米国では米大手銀行JPモルガン・チェースなどと実証実験をした。韓国でも韓国通信大手KTと共同での実証実験を予定しており、2022年夏から通信網を企業に開放してサービスの開発に役立ててもらう。東芝は、金融機関やデータセンター、電力や通信など高いセキュリティーを求める企業を顧客にする考えだ。量子暗号通信の市場規模は30年に1兆2000億円程度に成長するとみており、その4分の1のビジネスに関与するとしている。,量子技術,東芝、英BTと量子暗号の実証開始　一般企業に通信網提供,https://www.nikkei.com/article/DGXZQOUC2733J0X20C22A4000000/
04/27/2022,千葉県八街市で飲酒運転のトラックに小学生5人がはねられ、死傷した事故から6月で1年となる。事故は歩道やガードレールがないうえに車が頻繁に行き来する危険な通学路が多いことを改めて浮き彫りにした。安全対策のなかでデータ活用の試みも進む。千葉県船橋市の古作（こさく）地区は中山競馬場を取り囲むように住宅街が広がる。地区に出入りする道路の18カ所に3月、「ゾーン30プラス」という表示が緑と白でくっきりと...,千葉,通学路の安全、データで見守る　千葉・船橋市,https://www.nikkei.com/article/DGXZQOCC22BDD0S2A420C2000000/
04/27/2022,東京ベイ東急ホテル（千葉県浦安市）は日本航空（JAL）と共同で、航空機「ボーイング」の使い終わった部品を活用したコンセプトルームの販売を28日から始める。室内には国内線の3列シートや窓枠パネル、キャビンアテンダントが食べ物を運ぶ「ミールカート」などを設置。航空機の中にいるような内装に仕上げた。ファーストクラスのシートカバーの素材を活用したクッションや、実際に搭乗者に渡す耳栓も用意するなど、小物...,サービス・食品,東京ベイ東急、JALとコラボルーム　航空機部品活用,https://www.nikkei.com/article/DGXZQOCC273NU0X20C22A4000000/
04/27/2022,【NQN香港=エブリン・チャン】27日の韓国株式市場で総合株価指数（KOSPI）は反落した。終値は前日比29.25ポイント（1.09%）安の2639.06と、約1カ月半ぶりの安値となった。前日の米株安を受け、韓国市場でも海外勢を中心にリスク回避の売りが優勢となった。北朝鮮が軍事パレードを実施したと26日の朝鮮中央テレビが...,アジア株概況,韓国株27日　反落、1カ月半ぶり安値　海外勢が売り　ハイテク安い,https://www.nikkei.com/article/DGXZASB2IDE22_X20C22A4000000/
04/27/2022,名古屋市はスタートアップの企業誘致を強化する。2023年度から市内に拠点を開設する創業10年以内の企業の年間賃料の半額を、70万円を上限に補助する。これまではオフィスの広さが支給の要件になっていたが、従業員1人がシェアオフィスなどに常駐していれば支給対象とする。創業したての小さな企業でも市内に進出しやすくする。「スタートアップ集積促進補助金」を新設し、5月にも企業の募集を始める。23年度の予算...,スタートアップ,来たれ新興、シェアオフィスでも賃料半額に　名古屋市,https://www.nikkei.com/article/DGXZQOFD244MT0U2A420C2000000/
