02/28/2022,北海道は28日、新たに1605人の新型コロナウイルス感染を確認したと発表した。新型コロナ患者11人の死亡も公表した。27日時点の病床使用率は39.6%で20日時点から2.3ポイント上昇した。重症病床使用率は3.7%で同日時点から2.3ポイ...,新型コロナ,北海道の新型コロナ感染新たに1605人、11人死亡,https://www.nikkei.com/article/DGXZQOFC286XA0Y2A220C2000000/
02/28/2022,宮城県とアース製薬は28日、地域社会の活性化と県民サービスの向上を目的に包括連携協定を結んだ。教育や災害時の支援に関することなど5項目で連携して取り組みを進める。具体的な内容については今後検討する。教育分野ではアース製薬が県内高校の生徒の研究に対する技術指導...,宮城,宮城県とアース製薬、教育分野などで包括連携協定,https://www.nikkei.com/article/DGXZQOCC288920Y2A220C2000000/
02/28/2022,日本生産性本部は28日、企業経営者や学識者などが日本の諸課題を議論する「令和国民会議（令和臨調）」を発足させると発表した。6月をめどに第1回大会を開く。具体的には「統治構造改革」「財政・社会保障」「国土構想」の3つを柱に議論し、政府や与野党に提言する。共同代表を務める茂木友三郎・キッコーマン名誉会長は「平成時代から先送りされてきた構造改革課題に取り組む...,経済,生産性本部、「令和臨調」発足へ　統治改革など議論,https://www.nikkei.com/article/DGXZQOUA287RC0Y2A220C2000000/
02/28/2022,エースコック（大阪府吹田市）は28日、即席麺「わかめラーメン」など約80品目を6月1日出荷分から値上げすると発表した。希望小売価格（税抜）で約5～11%、オープン価格の商品は出荷価格で5%以上引き上げる。値上げは2019年6月以来、3年ぶり。小麦粉や油脂などの原材料価格に加え、原油高騰に伴い包装費や物流費が上昇している。同社は「自助努力により対処してきたが、現状の価格では品質の維持が困難な状況となっている」と説明した。主力商品の「わかめラーメン」シリーズの場合、希望小売価格（税抜）は21円の値上げとなる。,関西,エースコック、カップ麺などを値上げ　6月から,https://www.nikkei.com/article/DGXZQOUF289AS0Y2A220C2000000/
02/28/2022,岡山県内の経済6団体は28日、伊原木隆太知事に感染症対策と社会経済活動の回復に向けた緊急要望をした。新型コロナウイルスによる経済への下押しが続く中、地域経済の支援や医療提供体制を見極めたうえでの早期のまん延防止等重点措置の解除を求めた。要望書では、「対面型サービス業は回復困難な壊滅的状況にあり、公共交通基盤の存続自体も危うくなる」と厳しい現状を指摘。県経済団体連絡協議会の中島基善座長は「どうコロナと付き合っていくかを考えざるを得ない」などと話した。伊原木知事は「切実な声をきちんと受け止めてこれからの方針を決めたい」とした。3月6日が期限の重点措置については「病床のひっ迫を防ぎ、できるだけ早く解除したいと思っている」と述べた。,新型コロナ,岡山の経済6団体、地域経済支援を県に要望,https://www.nikkei.com/article/DGXZQOCC285TD0Y2A220C2000000/
02/28/2022,千葉大学医学部付属病院で28日、基礎疾患のある5〜11歳の小児への新型コロナウイルスワクチンの接種が始まった。同病院内のコロナワクチンセンターで、通院している小児を対象に実施した。28日に接種したのは5～11歳の10人。千葉市が分配した米ファイザー社製の5～11歳用ワクチンを使用した。5〜11歳の小児へのワクチン接種は県内では初めてという。同病院では、対象となる小児の家庭に主治医が電話で連絡し、希望者を募った。浜田洋通小児科長は「想定より早く予約枠が埋まった。接種後の副作用による発熱、脱水症状などに備えてベッドなどの手配もしている」と説明した。この日接種を受けた千葉市内の小学5年の女児は「それほど痛くなくて全然平気だった。周りの子も大勢打ってくれたら制限が緩くなるかと思う」。基礎疾患があるため、学校内で感染者が増えると自主的に登校を控え、自宅でオンライン学習することも多かったという。別の子どもの母親は「新しいワクチンなので数十年後の身体への影響が心配だったが、主治医から安全性を説明してもらい納得して接種を決めた」と話した。千葉市内では他にも3つの病院で基礎疾患のある小児への接種を進める。それ以外の小児は3月14日の週から小児科を中心とする医療機関で接種する。,新型コロナ,小児のコロナワクチン接種開始、千葉大病院,https://www.nikkei.com/article/DGXZQOCC287SC0Y2A220C2000000/
02/28/2022,トヨタ自動車が3月1日に国内全工場の稼働を停止することが28日、わかった。トヨタ車の部品をつくるサプライヤーがサイバー攻撃を受け、部品供給を管理するトヨタのシステムが停止したため。2日以降に通常稼働に戻せるかどうかは精査中とみられる。トヨタは日本経済新聞社の取材に対してコメントを控えた。国内全工場を1日に止める影響は、トヨタの国内の月間生産台数の約5%に...,愛知,トヨタ、国内全工場を停止へ　部品会社にサイバー攻撃,https://www.nikkei.com/article/DGXZQOFD289MK0Y2A220C2000000/
02/28/2022,東京ディズニーランド（TDL）と東京ディズニーシー（TDS）の入園者が26日、累計で8億人を突破した。運営するオリエンタルランドが発表した。7億人から4年211日での達成で、新型コロナウイルス禍により増加ペースはやや鈍った。通常は開催する式典も見送った。オリエンタルランドの吉田謙次社長は「新たな夢に向かってこれからも進化し続ける」とのコメントを発表。新型コロナで従来と異なる運営をしていることも説明した。TDLは1983年4月、TDSは2001年9月に開園した。TDS開園後は、おおむね4年未満で累計入園者を1億人ずつ増やしてきた。23年度中には新エリアのオープンを予定。人気映画「アナと雪の女王」や「ピーター・パン」をテーマにした区画をつくり、さらなる集客を目指す。〔共同〕,サービス・食品,東京ディズニーランド・シー、入園者8億人　式典見送り,https://www.nikkei.com/article/DGXZQOCC282CJ0Y2A220C2000000/
02/28/2022,埼玉県川島町の老舗しょうゆメーカー「笛木醤油（しょうゆ）」が2019年11月から実施している工場見学ツアー「金笛しょうゆ楽校」の来場者が、2月16日に3万人を超えた。新型コロナウイルスの影響で20年4月から2カ月ほどツアーを中止した時期もあったが、再開後は今も遠出がしにくい状況の中、近場で楽しめるスポットとして人気を集めている。しょうゆ楽校は学校の授業のようにしょうゆの醸造過程を分かりやすく解説...,新型コロナ,埼玉・笛木醤油の工場見学、来場者3万人に　近場で人気,https://www.nikkei.com/article/DGXZQOCC282340Y2A220C2000000/
02/28/2022,百貨店の藤崎（仙台市）は3月、新たな自社スマホアプリを公開する。新型コロナウイルス禍で実店舗から客足が遠のく中、アプリ上で広告や電子商取引（EC）などの機能を集約し顧客との接点を増やす。顧客の嗜好が多様化する中、クレジットカードとの連携で顧客ごとに商品を提案する販売スタイルへ転換を図る。アプリ開発のヤプリと製作した。2月から社員による内部運用を始めており、3月から顧客に利用してもらう。これまでホームペ...,宮城,百貨店の藤崎、自社アプリ　クレカ連携で40万人囲い込み,https://www.nikkei.com/article/DGXZQOCC16CN80W2A210C2000000/
02/28/2022,サンリオは28日、学習塾大手のやる気スイッチグループホールディングス（東京・中央）と資本提携を結んだと発表した。筆頭株主のアドバンテッジパートナーズ（東京・港）のファンドから発行済み株式の10%分を引き受け、30億円を出資した。サンリオが開発する学習教材をやる気スイッチの学習塾で導入するなどし、教育事業の確立につなげる。サンリオは現在、中国など東南アジア地域でのキャラクターライセンス供与が収益の柱。2021年5月に発表した22年3月期～24年3月期の中期経営計画では事業多角化の一環として、幼児や保護者に向けた教育サービスを新規事業として確立する目標を掲げている。やる気スイッチグループHDとの資本提携により、学習教材や知育玩具の開発を進める。やる気スイッチグループHDは、個別指導塾の「スクール IE」や英語による学童保育「Kids Duo」など7ブランドの教育サービスを展開しており、日本と台湾で計2千カ所以上の教室を運営している。従来は自社開発した知育パズルなどを運営する教室内だけで使っていたが、今回の連携を機に、知育玩具をサンリオのグッズ販売で取り扱うなど一般向けの販売にも乗り出す。,サービス・食品,サンリオ、やる気スイッチと資本提携　教育事業を強化,https://www.nikkei.com/article/DGXZQOUC2883W0Y2A220C2000000/
02/28/2022,秩父山麓に広がる埼玉県横瀬町の「寺坂棚田」が、農林水産省の「つなぐ棚田遺産」に県内で唯一選定された。美しい景観を維持しながら、伝統行事や地域振興を棚田に結びつけて活動していることが高く評価された。町によると、寺坂棚田は周囲に自然豊かな秩父の山々が広がる約5.2ヘクタールの棚田。農家の高齢化や後継者不足によって一時は耕作放棄地が増えるなど荒廃していたが、県の支援を受けるようになった2001年以降はお米の農業体験や体験農園の開設、「ホタルかがり火まつり」「彼岸花まつり」の開催など、徐々に活気を取り戻した。12年には「寺坂棚田保存会」が発足し、棚田のオーナーと住民、観光客が一体となって棚田の保全や景観維持に努めている。同町は「こうした取り組みが地域と経済の活性化につながっている」と話す。つなぐ棚田遺産は農水省が地域の振興に積極的に取り組む棚田を選定する取り組みで、全国で271カ所が選定された。,埼玉,埼玉・横瀬の「寺坂棚田」、農水省の遺産に選定,https://www.nikkei.com/article/DGXZQOCC223RI0S2A220C2000000/
02/28/2022,JR四国は28日、1月の鉄道事業の運輸取扱収入が11億8700万円と、前年同月比で50%増加したと発表した。運輸収入のうち、本州方面が同72%増と大幅に伸びた。ただ2月の速報値は新型コロナウイルスの感染再拡大に伴って落ち込んでいる。記者会見した西牧世博社長は「四国内など近距離の移動が少なくなっている」と述べた。,高知,JR四国の運輸収入、1月50%増,https://www.nikkei.com/article/DGXZQOCC285J80Y2A220C2000000/
02/28/2022,阿佐海岸鉄道（徳島県海陽町）は線路と道路の両方を走る車両「DMV（デュアル・モード・ビークル）」について、3月の土日祝日の臨時便を運休する。新型コロナウイルスの影響で予約が少ないため。同社は2021年12月にD...,徳島,阿佐鉄、バス兼列車のDMV 3月は臨時便を運休,https://www.nikkei.com/article/DGXZQOCC284OY0Y2A220C2000000/
02/28/2022,徳島県は東京・渋谷で運営する情報発信拠点「ターンテーブル」の事業を継続する。このほど入居するビルの賃借契約を2027年3月まで5年延長すると発表した。賃料は年間4620万円で、従来より約470万円の減額となる。同施設は物販や飲食、宿泊機能を備えた徳島県のアンテナショップとして、18年2月に開業した。施設では県産食材を販売するほか、地元にちなんだ料理を提供。阿波踊りなどの観光情報も発信している。利用者は22年度に5万人、26年度に7万3000人程度を予測する。県によると、新型コロナウイルス禍の影響もあり、経常損益は当面、年120万～200万円の赤字が続く。黒字転換は25年度以降になる見通しという。,徳島,徳島県、東京・渋谷の情報発信拠点　ビル賃借5年延長,https://www.nikkei.com/article/DGXZQOCC259OL0V20C22A2000000/
02/28/2022,◇サンテレホン鈴木　健一氏（すずき・けんいち）89年（平元年）名城大商卒、90年日東工業入社。19年執行役員、21年サンテレホン専務。愛知県出身。55歳（6月下旬就任。榎本雅之社長は相談役に）,,サンテレホン社長に鈴木氏,https://www.nikkei.com/article/DGXZQOFD287ZX0Y2A220C2000000/
02/28/2022,山口フィナンシャルグループ（FG）と地銀4行は28日、地域企業の事業承継を支援するファンドを設立したと発表した。山口FG傘下の3行、十六銀行、南都銀行、百十四銀行、愛媛銀行の計7行が出資する。経営者を目指す人材（サーチャー）が事業承継する企業を自ら探して株を買い取る「サーチファンド」の仕組みを活用し、取引先など地域企業の存続・発展につなげる。設立した「地域未来共創Searchファンド」は約35億円。今後も賛同する地方銀行を募り、最終的に50億円以上の資金規模を目指す。運用は山口FG関連会社の山口キャピタル（山口市）が担当する。投資期間は2027年まで、運用期間は32年までの計画だ。経営者を目指す人材が銀行の支援を受けながら、自ら承継する地域企業を探し、株式を買い取る資金を山口キャピタルが投資する。山口FGは19年2月以降、サーチファンドを活用して福岡県内の企業など5社の事業承継を実現。現在も3人のサーチャーが活動中だ。山口FGは「地域企業の承継問題を解決する手段としてニーズを確認できた」と判断した。他行と連携して新ファンドを設立し、事業対象地域を広げることで、より優秀なサーチャーを集めたい考えだ。,金融機関,地銀7行、事業承継促進へ投資ファンド設立,https://www.nikkei.com/article/DGXZQOCC253960V20C22A2000000/
02/28/2022,◇ジューテックホールディングス植木　啓之氏（うえき・ひろし）82年（昭57年）京大法卒、三井物産入社。13年三井住商建材（現SMB建材）社長。19年ジューテックホールディングス代表取締役副社長。奈良県出身。62歳（6月28日就任。足立建一郎社長は代表権のある会長に）,,ジューテックホールディングス社長に植木氏,https://www.nikkei.com/article/DGXZQOUC288EC0Y2A220C2000000/
02/28/2022,宮城県の村井嘉浩知事は28日の定例記者会見で、ロシアのウクライナ侵攻について「信じられない出来事。一方的に他の国に侵攻するというのは許されないこと」と述べた。同県はロシアのニジェゴロド州と経済分野で協力協定を結んでいるが、現在は県と...,宮城,宮城県知事「影響、注意深く見守る」　ロシアの侵攻で,https://www.nikkei.com/article/DGXZQOCC287Q90Y2A220C2000000/
02/28/2022,◇ザ・パック山下　英昭氏（やました・ひであき）82年（昭57年）日大法卒、日本ケース（現ザ・パック）入社。13年ザ・パック取締役、19年専務。香川県出身。64歳（3月30日就任。稲田光男社長は相談役に）,,ザ・パック社長に山下氏,https://www.nikkei.com/article/DGXZQOUC286UP0Y2A220C2000000/
02/28/2022,【NQNロンドン=菊池亜矢】28日午前のロンドン外国為替市場で、ユーロは対ドルで底堅く推移している。英国時間9時30分時点は、1ユーロ=1.1160～70ドルと、前週末の同16時時点より0.0080ドルのユーロ安・ドル高だった。ウクライナに軍事侵攻したロシアに対して、米欧日などはロシア大手銀を国際決済網の国際銀行間通信協会（SWIFT）から締め出す金融制裁措置を打ち出した。ロシア経済が大幅に悪化するとの見方に加え、制裁によりロシアからのエネルギー輸出が停滞するとの見方から、ロシアにエネルギー資源を依存するユーロ圏経済への悪影響を懸念したユーロ売り・ドル買いが出た。一方、ウクライナとロシアとの停戦協議に向けた進展への期待がユーロを下支えしている。英BBCは28日午前、「ウクライナ当局がロシア代表団との和平協議のために、ウクライナとベラルーシの国境に到着したと発表した」などと伝えた。英ポンドは対ドルで安値圏で小動きし、英国時間9時30分時点は1ポンド=1.3360～70ドルと、前週末の同16時時点より0.0050ドルのポンド安・ドル高で推移している。,為替概況,ロンドン外為9時半　ユーロ、底堅く推移　ウクライナ情勢を注視,https://www.nikkei.com/article/DGXZASH2IILM1_Y2A220C2000000/
02/28/2022,阪急電鉄は28日、人工知能（AI）で車両の混雑度を測定する実証実験の様子を公開した。中津駅に設置した機械で携帯電話の電波を通じて乗車人員を推定し、隣の十三駅に設置した電光掲示板に混み具合を表示する。新型コロナウイルス禍で車両の「密」を避けたいという利用者の声に応える。東京工業大学が開発した機械により、スマートフォンが発信する近距離無線通信「ブルートゥース」の電波を車両ごとに集め、AIが電波の情報から混雑度を推定する。実験は3月末まで続け、実際に車両の混雑回避につながったかなどを検証する。混雑度の測定には鉄道車両に搭載される重さセンサーなどを使う方法もあるが、センサー付きの車両は限られる。東工大の機械を使えば、他社から乗り入れる列車でも測定できる。阪急電鉄の担当者は「ダイヤ改正などにもデータを生かせる」と話した。,関西,阪急電鉄、AIで車両の混雑推定　十三駅に電光掲示板,https://www.nikkei.com/article/DGXZQOUF281S40Y2A220C2000000/
02/28/2022,竹中工務店は2月28日、2021年12月期の連結決算を発表し、純利益が前の期比29%増の393億円だった。本業の建築事業では利益率が低下したものの増収効果で補い、土木子会社で利益率が改善し海外子会社も赤字幅が縮小した。連結売上高は前の期比2%増の1兆2604億円。ホテルやオフィスビルなどを中心に受注量は増加しており、期末の次期繰越高も1兆5858億円にのぼる。東京五輪・パラリンピック後の受注競争...,住建・不動産,竹中工務店、21年12月期29%増益　,https://www.nikkei.com/article/DGXZQOUC25A7J0V20C22A2000000/
02/28/2022,4月に経営統合する小樽商科大学、帯広畜産大学、北見工業大学の北海道国立3大学は、デジタルトランスフォーメーション（DX）人材の育成でオンライン講座を開設する。3大学は経営統合を機に教育コンテンツでも連携を深める方針。地域課題解決につながるDX人材の育成はその一環だ。3月11日から計3回のスタートアップ講座「地域型DX活用ビジネスの構想と社会実装のための基礎講座」と、7月以降の計15回の本講座から構成する。3大学で社会人のリカレント教育（学び直し）を担当する教授らがビジネスパーソンや公務員に講義する。3月8日まで受講生を募集しており無料。1回だけの参加も可能で、一部の回は対面でも講義する。初回の講師を務める北見工大の藤井享教授は「講座は札幌圏への人口集中など北海道の特性を踏まえた内容だ。DXを活用して農工商を連携する6次産業化を後押しするイメージで構成する。デジタル技術の全体設計ができる人材を育てたい」と意気込む。3大学統合法人「北海道国立大学機構」の初代理事長には慶応義塾大学前塾長の長谷山彰氏が就く。帯畜大構内に本部棟を建設中の北海道国立大学機構は、主専攻を大学間で自由に履修したり、文理を融合した副専攻も課程に組み込んだり、異分野の知識や技術が習得できるようにする。,教育,北海道の4月統合国立3大学、DX人材育成で講座,https://www.nikkei.com/article/DGXZQOFC257ZY0V20C22A2000000/
02/28/2022,食品スーパーのヨークベニマルは3月1日に総菜製造子会社のライフフーズと経営統合するのを機に本社の組織を刷新する。総菜の製販一体を進めるため「デリカ事業本部」を新設し、その下に総菜部、寿司部、ベーカリー部などを置く。また新事業の宅配事業を強化するため「ラストワンマイル推進部」をニューフォーマット推進室内に置く。2021年に発足したサプライチェーン改革プロジェクトは常設の部署にする。ヨークベニマルは経営統合によって事業展開の機動性を高めると同時に経営の効率化を目指す。,福島,ヨークベニマル「デリカ本部」新設　子会社の統合機に,https://www.nikkei.com/article/DGXZQOCC286M20Y2A220C2000000/
02/28/2022,【北京=川手伊織】中国国家統計局が2月28日に発表した2021年の国民経済・社会発展統計によると、1人あたり名目国民総所得（GNI）はドルベースで、1万2438ドル（約143万円）だった。世界銀行が定める高所得国の基準（1万2695ドル超）に迫った。新型コロナウイルスの打撃から経済が急回復したうえ、人民元高も進み、前年比20%の大幅増となった。GNIは1年間に個人や企業が国内外で得た所得の総額を指す。国内で生み出した付加価値の総額を表す国内総生産（GDP）に、海外とやり取りした利子や配当の純受取額を加えて算出する。21年の名目GNIは人民元建てで12.4%増えた。20年初めに新型コロナの感染拡大で経済活動がほぼ止まった反動増で、11年以来の高い伸びを記録した。人民元高もドル換算のGNIを押し上げた。21年平均でみた人民元の対ドル相場は1ドル=6.4515元で、前年の平均より7%上がった。中国の貿易黒字が過去最高を記録したほか、海外から中国債券への投資が拡大したためだ。ドル建ての名目GDPは前年比21%増の17兆7200億ドルとなった。米GDPに対する比率は77%となり、前年の70%から高まった。高所得国入り目前となっても国内格差は残る。世帯ごとの1人あたり可処分所得をみると、上位20%の世帯の平均は21年、下位20%の平均の10.3倍だった。都市と農村の格差は縮まったものの、マンション価格の高騰などを受けて都市内格差が広がっている。クレディ・スイスによると、中国富裕層の上位1%による富の占有率は20年時点で30.6%だった。過去20年間の上昇幅は9.7ポイントで、日米欧やインド、ロシア、ブラジルより大きい。習近平（シー・ジンピン）指導部は「共同富裕（ともに豊かになる）」というスローガンを掲げる。5年に1度の共産党大会を秋に控え、安定成長と格差是正の両立をめざす。,中国・台湾,中国「高所得国」入り目前　21年1人あたり1万2438ドル,https://www.nikkei.com/article/DGXZQOGM286J20Y2A220C2000000/
02/28/2022,◇スタンレー電気貝住　泰昭氏（かいずみ・やすあき）87年（昭62年）中央大理工卒、スタンレー電気入社。17年取締役、21年常務。愛知県出身。58歳（4月1日就任。平塚豊社長は取締役に）,,スタンレー電気社長に貝住氏,https://www.nikkei.com/article/DGXZQODZ00048_Y2A220C2000000/
