05/13/2022,13日前場寄り付きの東京株式市場で日経平均株価は反発して始まり、前日に比べ360円ほど高い2万6100円近辺で推移している。急ピッチの株価下落が続いてきたことから、自律反発狙いの買いが先行している。前日に決算発表した値がさ株への買いも支えだ。日経平均は今週に入り前日までに1200円超下げていた。米国の金融引き締めの加速や中国景気の減速への懸念は依然として根強いが、売られすぎた銘柄などには売り方...,株式,日経平均反発、上げ幅一時360円　自律反発狙う買い先行,https://www.nikkei.com/article/DGXZQOUB00003_T10C22A5000000/
05/13/2022,【ワシントン=中村亮】バイデン米政権は12日、ホワイトハウスで東南アジア諸国連合（ASEAN）と首脳会議を開いた。インフラ整備に加え、南シナ海での違法な漁業や資源採掘の取り締まりに向けてASEAN向けの支援を強める。中国を念頭に協調を目指す。バイデン大統領は12日、ホワイトハウスでASEAN首脳と夕食会を開く。日米豪印の「Quad（クアッド）」や米英豪の「AUKUS（オーカス）」を通じてアジアでの協力が進んだことを踏まえ、中国が影響力を増す東南アジア諸国との関係強化を狙う。ウクライナに侵攻したロシアへの対応でも協調を探る。トランプ前大統領は東南アジアに関連した国際会議を相次いで欠席し、ASEANを軽視したとの見方が広がった。バイデン氏はワシントンにASEAN各国の指導者を招く首脳会議を初開催することで、関与強化をアピールする。米政権は首脳会議に合わせ、新しいイニシアチブを相次いで発表した。風力発電などを念頭にクリーンエネルギー分野に4000万ドル（約50億円）を使い、民間資金の呼び込みを狙う。米運輸省がASEANと交通分野で持続可能なインフラ整備を議論する対話の場を創設する。安全保障分野では米沿岸警備隊などが6000万ドルを投じ、東南アジアで海洋の法執行機関向け訓練を加速する。南シナ海で実効支配を強める中国を念頭に置いた支援だ。古くなった巡視船を外国に供与する場合には東南アジアを最優先する。新型コロナウイルス対策では、検査体制の強化やワクチン接種の普及に向けた取り組みを支援する。,バイデン政権,米、ASEAN首脳会議を開催　対中国で協調探る,https://www.nikkei.com/article/DGXZQOGN130PS0T10C22A5000000/
05/13/2022,米女子プロバスケットボールWNBA、ミスティックスに今季加入した町田瑠唯が12日、オンライン取材に応じ、開幕3戦を終えて「WNBAがどういう世界かつかめてきて、その中で自分がどういうふうにプレーするかというのは見えてきている。後はそれをコートで表現するだけ」と手応えを口にした。チームは3連勝と好スタートを切り、町田も初先発した10日のエースズ戦で9得点、4アシストと貢献。「自分が積極的にボールを進め、アップテンポな展開に持っていけるようにやっていきたい」と意気込み、「シュートの仕方というのは、これから挑戦していきたい」と課題も挙げた。〔共同〕,スポーツ,町田瑠唯、開幕3戦終え手応え　米女子プロバスケ,https://www.nikkei.com/article/DGXZQOKC130VJ0T10C22A5000000/
05/13/2022,第17回ヴィクトリアマイル（15日・東京11R1600メートル芝18頭、G1）枠順が13日に決まり、一昨年に無敗で牝馬3冠を制し、今回が故障からの復帰初戦となるデアリングタクトは①枠1番に入った。昨年の桜花賞馬ソダシは③枠5番、現役牝馬屈指の実力を誇るレイパパレは⑦枠13番、前哨戦の阪神牝馬ステークスを勝ったメイショウミモザは②枠3番からのスタートとなった。▽第11RヴィクトリアマイルオープンG1・1600メートル（芝左・18頭）発走15:40、前日場外17:00(1)1デアリングタクト　　55　松　山(1)2ソングライン　　　　55　池　添(2)3メイショウミモザ　　55　鮫島駿(2)4マジックキャッスル　55　戸　崎(3)5ソダシ　　　　　　　55　吉田隼(3)6ディヴィーナ　　　　55　武　豊(4)7レシステンシア　　　55　横山武(4)8クリノプレミアム　　55　松　岡(5)9アブレイズ　　　　　55　菅原明(5)10ローザノワール　　　55　田中勝(6)11ファインルージュ　　55　ルメール(6)12ミスニューヨーク　　55 M・デムーロ(7)13レイパパレ　　　　　55　川　田(7)14アカイイト　　　　　55　　幸(7)15アンドヴァラナウト　55　福　永(8)16デゼル　　　　　　　55　藤岡康(8)17シャドウディーヴァ　55　坂　井(8)18テルツェット　　　　55　レーン※3番、10番はブリンカー装着馬〔共同〕,スポーツ,デアリングタクトは1枠1番　競馬のヴィクトリアM枠順,https://www.nikkei.com/article/DGXZMSK3IHR01_T10C22A5000000/
05/13/2022,気象庁によると、14日にかけて、西日本から東日本の太平洋側と南西諸島では雷を伴った非常に激しい雨が降る恐れがある。集中豪雨による河川の氾濫や土砂崩れなどから身を守るには、自宅周辺の災害リスクの把握や備えの強化が欠かせない。知っておきたい防災情報をまとめた。自宅の被災リスクを把握するのに役立つのが、市区町村がホームページなどで公表する「洪水ハザードマップ」だ。洪水浸水想定区域や土砂災害警戒区域、最寄りの避難場所などが一目で分かり、想定される浸水の深さも色分けして表示される。国土交通省のハザードマップポータルサイト（https://disaportal.gsi.go.jp/）にある「重ねるハザードマップ」は、自宅住所を入力すれば「洪水」「土砂災害」「高潮」「津波」の4種類のハザードマップを地図上に重ね合わせて表示できる。自宅住所を入力すると自宅周辺の地図が現れ、画面上の「洪水」「土砂災害」などをクリックすると、被害が想定される地域に赤や黄の色が重なっていく。各市区町村が提供するハザードマップともリンクしていて便利だ。ハザードマップで自宅周辺の被災リスクが確認できたら、自治体が指定する緊急避難場所（学校や公民館など）や身を寄せられる知人・親戚宅などを事前に調べておきたい。大雨や台風が迫っている場合はインターネットやテレビを通じて自治体が発表する避難情報をこまめにチェックすることが大切だ。国は災害の危険性を警戒レベル1～5に分類しており、災害時には各自治体が警戒レベルに応じた避難情報を発表している。災害対策基本法の改正に伴い、2021年5月からは避難情報の表現が見直された。たとえば、「災害のおそれ」を示す警戒レベル3になると、自治体は「高齢者等避難」を出す。お年寄りや障害者ら避難に時間がかかる人やその家族は、早めに指定緊急避難場所に退避することが望ましい。さらに大雨が降り続き、河川の氾濫や土砂災害の危険が高まると、警戒レベルは4に上がり、自治体は「避難指示」を発令する。避難指示が出た地域の住民はこの時点で自宅を離れ、最寄りの避難所などに全員避難する必要がある。国はより明確に避難を促す狙いから、同じ警戒レベル4で併用していた「避難勧告」を21年5月に廃止し、避難指示に一本化した。ハザードマップで自宅が安全な場所にあることが確認できた場合は、自宅にとどまることも可能だが、1階部分が浸水すれば水や食料、トイレの確保などが困難になる場合もあり、注意が必要だ。警戒レベルが5に達し、自治体が「緊急安全確保」を発令した地域では、すでに災害が発生しているか切迫しており、ただちに安全の確保が必要だ。近所にある河川が氾濫しているか、今にもあふれそうな状況にある可能性もある。避難所への移動にも危険が伴うため、自宅の上層階や崖から離れた部屋、近くの頑丈な建物への移動が求められる。気象庁は21年6月から線状降水帯の形成を確認した際に「顕著な大雨に関する情報」を速報する運用を始めており、今年6月1日からは線状降水帯の発生を半日前に予測して情報提供する取り組みも始める。内閣府は、台風や豪雨の際に取るべき行動の流れを「避難行動判定フロー」にまとめている。内閣府のサイト「防災情報のページ」のほか、LINE公式アカウント「内閣府防災」からチェックできる。ハザードマップと同様に平時に確認しておきたい。以下は簡略版だが、参考にしてほしい。災害対策基本法改正に伴い、21年5月から、災害弱者一人ひとりの状況に応じた「個別避難計画」の作成が自治体の努力義務となった。体の不自由な高齢者や障害者らの逃げ遅れを防ぐのが狙いで、自治体が作成する「避難行動要支援者名簿」に掲載されている住民が対象となる。要支援者は要介護度や障害の程度に応じて自治体が判断している。対象住民には登録票が届いたり、民生委員を通じて連絡が来たりする。本人や家族が登録の有無などを自治体に問い合わせすることも可能だ。名簿から漏れていた場合でも、要支援者の要件を満たせば掲載を希望することができる。過疎化や高齢化に伴い、地域によっては高台避難などを手助けする支援者の確保が難しい場合も少なくない。総務省消防庁によると、2020年10月時点で個別避難計画の作成を終えた自治体は1割未満だ。災害弱者の命を守るには、家族や自治会が積極的に作成に関わり、避難を手伝ってくれる支援者をあらかじめ見つけておくことが大切だ。計画に基づく避難訓練を定期的に行い、移動ルートや避難にかかる時間などを確認しておくことも欠かせない。,災害・気象,大雨に伴う土砂災害や増水に警戒　防災情報知って備えを,https://www.nikkei.com/article/DGXZQOUE022IT0S1A500C2000000/
05/13/2022,13日の東京株式市場で日経平均株価は反発して始まった。始値は前日比170円08銭高の2万5918円80銭。最近、急ピッチの株価下落が続いてきたことから、自律反発狙いの買いが先行している。前日に決算発表したソフトバンクグループ（SBG）も高い。日経平均の上げ幅は一時200円を超えた。〔日経QUICKニュース（NQN）〕,国内株概況,日経平均、反発で始まる　自律反発狙いの買い,https://www.nikkei.com/article/DGXZASFL13HLL_T10C22A5000000/
05/13/2022,12日の米株式市場でダウ工業株30種平均は6日続落し、連日で年初来安値を更新した。スマートフォンのアップルが一時、前日比5%あまり下げるなどハイテク株への売りが続いた。市場予想を上回った11日発表の4月の米消費者物価指数（CPI）に続き、12日発表の4月の米卸売物価指数（PPI）も前年同月比では11%上昇と高水準となった。米連邦準備理事会（FRB）による金融引き締め観測が広がり、相場の重荷とな...,NY特急便,旅行各社、インフレ下でも自信　消費に変化(NY特急便),https://www.nikkei.com/article/DGXZQOGN12FK50S2A510C2000000/
