01/12/2022,11日の米株式相場は小反発。ダウ工業株30種平均は前日比183ドル高で終えた。朝方は米連邦準備理事会（FRB）のパウエル議長による議会公聴会での発言を懸念して株式相場は下落したが、午後にかけてハイテク株に買い戻しが入った。ハイテク株比率の高いナスダック総合株指数が急反発し、相場の反転を先導した。ナスダック指数は年初から軟調な展開になっていただけに、この日の値動きは市場で好感された。年初からボラテ...,NY特急便,バリュー株シフト進む米株式市場（NY特急便）,https://www.nikkei.com/article/DGXZQOGN11CUQ0R10C22A1000000/
01/12/2022,【NQNニューヨーク=戸部実華】11日のニューヨーク外国為替市場で円相場は横ばいを挟んで5営業日ぶりに反落し、前日比10銭円安・ドル高の1ドル=115円25～35銭で取引を終えた。米株高を受けて投資家のリスク回避姿勢が和らぎ、低リスク通貨とされる円に売りが優勢だった。ただ、円と同様にリスク回避時に上昇しやすいドルも幅広い通貨に対して売られたため、円の下値は限られた。米連邦準備理事会（FRB）のパウエル議長は11日の議会証言で資産圧縮は「年内に始める可能性がある」と述べた。市場では金融引き締めの前倒し観測が高まっていたため、議会証言は「市場が織り込んでいた内容を確かめただけ」（TD証券）といい、警戒感は強まらなかった。米株式市場では主要3株価指数がそろって上昇した。ただ、円の下値は堅かった。ドルはユーロや英ポンドなどの主要通貨に対して下げ、対円でのドル売りに波及した面があった。パウエル議長の議会証言を受け、米長期金利は前日比0.03%低い1.73%で終えた。日米金利差の拡大観測が後退したことも円相場を下支えした。円の安値は115円68銭、高値は115円28銭だった。円は対ユーロで反落し、前日比50銭円安・ユーロ高の1ユーロ=131円00～10銭で取引を終えた。ユーロは対ドルで反発し、前日比0.0040ドルユーロ高・ドル安の1ユーロ=1.1365～75ドルで取引を終えた。米株高を受け、リスク選好時に上昇しやすいユーロに買いが優勢だった。米長期金利が低下したことも、欧米金利差の縮小観測からユーロ買い・ドル売りにつながった。ユーロの高値は1.1375ドル、安値は1.1313ドルだった。,為替概況,NY円、反落　1ドル=115円25～35銭　米株高で円売り,https://www.nikkei.com/article/DGXZASM7IAA05_S2A110C2000000/
01/12/2022,【シカゴ支局】11日の日経平均先物は反発した。3月物は前日比270円高の2万8455円で引け、11日の大取終値を305円上回った。パウエル米連邦準備理事会（FRB）議長の議会証言を手掛かりに、当局は金融政策の正常化に時間をかけるとの見方が広がり、投資家心理が改善した。,国内株概況,シカゴ日本株先物概況・11日,https://www.nikkei.com/article/DGXZASH2ICE01_S2A110C2000000/
01/12/2022,【ソウル=恩地洋介】北朝鮮の朝鮮中央通信は12日、兵器開発機関の国防科学院が、音速の5倍以上の速さで飛ぶ「極超音速ミサイル」の発射実験を11日に実施し、金正恩（キム・ジョンウン）総書記が視察したと報じた。切り離された弾頭部が上昇、旋回しながら1000キロメートル先の標的に命中し、実験は成功したと伝えた。北朝鮮が「極超音速型」と主張するミサイルを発射したのは、2021年9月と今月5日に続き3回目。金正恩氏の視察は初めてで「国の戦争抑止力を強化する歴史的偉業だ」と開発の責任者らを激励した。同通信は発射実験について「極超音速兵器システムの技術的特性を最終的に確証する目的」と伝えた。発射後に切り離された弾頭部は600キロメートル先で再上昇した後、目標方位に向かって240キロメートル旋回機動。「弾頭部の優れた機動能力がはっきりと確証された」と報じた。北朝鮮は11日午前7時27分ごろ、5日と同じ北部の慈江道（チャガンド）付近から日本海に向けてミサイル1発を発射した。日米韓の当局は弾道ミサイルとの見解を示していた。韓国軍は飛距離は700キロメートル以上、最大高度は60キロメートルだったと分析。最大速度は音速の10倍前後に達し「5日の弾道ミサイルより進展した」と指摘した。,北朝鮮,金正恩氏が「極超音速ミサイル」視察　朝鮮中央通信,https://www.nikkei.com/article/DGXZQOGM11BZZ0R10C22A1000000/
01/12/2022,【ニューヨーク=宮本岳則】米シタデル・セキュリティーズは11日、有力ベンチャーキャピタル（VC）の米セコイア・キャピタルと暗号資産（仮想通貨）分野に特化した米投資会社パラダイムから出資を受け入れると発表した。創業者ケン・グリフィン氏は仮想通貨取引に懐疑的な立場をとってきた。米最大専業マーケットメーカー（値付け業者）の動向に注目が集まる。シタデル・セキュリティーズは2つのVCから計11億5000万ドル（約1320億円）を調達した。同社が外部から資本を受け入れるのは初めてだ。調達時の1株あたり価格を基に計算すると企業評価額は220億ドルになる。同業の米上場会社、バーチュ・フィナンシャルの時価総額（55億ドル）の約4倍にあたる。シタデル・セキュリティーズは2002年に創業した。同じくグリフィン氏が創業した大手ヘッジファンドのシタデルとは別法人だ。電子トレーディング技術に強みを持ち、マーケット・メーカーとして日本を含む世界の金融市場で事業を展開している。同社によると主戦場の米株式市場では27%の取引を執行している。米個人の売買執行に絞ると、半分近くのシェアを握っている。個人投資家が投機的な売買を繰り返した2021年1月の「ゲームストップ騒動」では、シタデル・セキュリティーズ創業者のグリフィン氏が関係者の一人として米議会の公聴会に呼ばれた。米証券取引委員会（SEC）のゲーリー・ゲンスラー委員長は同社のような少数のマーケット・メーカーが高い取引シェアを握ることに懸念を表明し、調査に乗り出している。グリフィン氏はかねて仮想通貨「懐疑派」として知られている。21年10月に米シカゴで開かれた会合では「国として、若く才能のある人々を多数動員して、基軸通貨の代わりとなるものを考え出すというのは、何ともクレイジーなコンセプトだ」と話していた。さらに仮想通貨関連の規制が明確になっていないため、取引に参加していないと明かした。シタデル・セキュリティーズは11日の声明で、新しい市場での事業拡大に意欲を示したが、具体的な進出先には言及しなかった。一方、パラダイムの共同創業者マット・ファン氏は同日の声明で「シタデル・セキュリティーズのチームが、その技術や専門知識を、暗号資産を含む多くの市場や資産クラスに拡大する際に協力できることを楽しみにしている」と述べた。,金融機関,米シタデル・セキュリティーズ、仮想通貨VCが株主に,https://www.nikkei.com/article/DGXZQOGN11D000R10C22A1000000/
01/12/2022,【サンパウロ=宮本英威、メキシコシティ=清水孝輔】中南米でインフレが加速している。2021年の消費者物価指数はメキシコでは21年ぶり、チリが14年ぶりの高い上昇率となった。物流制約など国際的な要因に加えて、干ばつや通貨安で影響が広がっている。可処分所得の減少で市民は不満を高めており、政情不安のリスクにつながりかねない。メキシコの21年の消費者物価指数の上昇率は7.36%と、2000年以来の高い水...,中南米,中南米でインフレ加速、政情不安のリスクに,https://www.nikkei.com/article/DGXZQOGN11D0W0R10C22A1000000/
