04/05/2022,秋田県湯沢市の若手事業者らで組織する「秋田・湯沢雪中貯蔵協会」は5日、雪室で貯蔵してきた日本酒などを蔵出しした。湯沢は県内屈指の豪雪地帯。マイナスのイメージが強い雪を逆手にとり、特産品づくりや街のブランドづくりに役立てる狙いだ。今後、電子商取引（EC）サイトなどで販売する。雪室は野菜などを保存するため、雪国で暮らす人々が使った「天然の冷蔵庫」。同協会は貨物輸送に使う20フィートコンテナを郊外のキャンプ場に設置。周囲を雪で固めて覆い、コンテナ内にも雪を入れて1月下旬から貯蔵してきた。今回、蔵出ししたのは日本酒やビール、味噌、コーヒー豆など。コンテナ内は温度が零度ほど、湿度も90%以上に保たれ、凍らずに長期保存できる。野菜や果物などはゆっくり熟成し甘みが増す。お酒もまろやかな味わいになるという。首都圏など雪が珍しい地域の消費者向けにネットで販売する。日本酒や茶葉などの卸・小売りを手掛ける富谷商店（湯沢市）が日本酒を販売するほか、秋田銀行系の地域商社、詩の国秋田（秋田市）がECサイトで取り扱う。,サービス・食品,秋田・湯沢の雪中貯蔵協会、雪室から日本酒蔵出し,https://www.nikkei.com/article/DGXZQOCC054G30V00C22A4000000/
04/05/2022,秋田県と秋田市は5日、県内で新型コロナウイルス感染者が新たに389人確認されたと発表した。3月29日の325人を上回り、過去最多となった。秋田市の感染者も184人と最多だった。県内では新規感染者が200人前後で推移している。県は独自の感染警戒レベルについて深刻度が上から3番目の「レベル3」を維持。年度替わりによる首都圏などとの往来が増える時期でもあり、感染状況を注視している。,新型コロナ,秋田県の新型コロナ感染者389人　過去最多を更新,https://www.nikkei.com/article/DGXZQOCC054S50V00C22A4000000/
04/05/2022,東京都議会の公明党は5日、ウクライナ危機に伴う避難民の受け入れ体制や中小企業に対する経済支援の強化などを小池百合子知事に要望した。新型コロナウイルスの影響が続くうえ、ウクライナ危機で物価が高騰し、都内の事業者や都民の生活への影響が深刻化するおそれがあるとして中小企業支援を訴えた。経済支援では企業の資金繰り対策や都が発注する公共工事で物価スライド条項を適用することなどを要望。ウクライナ避難民の受け入れでは現在100戸を確保している都営住宅の拡充の準備や東京都立大学による希望者受け入れ、避難生活の長期化への対応などを求めた。一方、同党は新型コロナの感染再拡大が懸念されるなかで、4回目のワクチン接種の前倒しや若い世代向けの接種機会の拡充なども要望に盛り込んだ。,東京,ウクライナ危機で小池知事に要望　都議会公明党,https://www.nikkei.com/article/DGXZQOCC056LP0V00C22A4000000/
04/05/2022,ふるさと納税サイト「ふるさとチョイス」を運営するトラストバンク（東京都渋谷区）などは、各地の地域経済の自立や文化の継承を目指す持ち株会社「AINUS（アイナス）ホールディングス」を設立した。食、旅、伝統技術の各分野の振興に向けた事業を展開する。設立は4月1日付。トラストバンク会長の須永珠代氏が代表取締役に就いた。傘下に新会社を立ち上げ、宿泊施設事業や伝統工芸の技術を活用した商品開発を行う。2023年には鹿児島県徳之島町に、富裕層をターゲットにした宿泊用のビラを建設する。自然栽培にこだわる農家の支援にも取り組む。須永氏は5日に都内で開いた記者会見で「ふるさと納税に限らず、食、旅、技をもっと盛り上げ、守っていくことができないかと考えた」と設立の経緯を語った。,サービス・食品,地域の文化継承へ新会社　トラストバンクなどが設立,https://www.nikkei.com/article/DGXZQOCC054BC0V00C22A4000000/
04/05/2022,泉　誠二氏（いずみ・せいじ=元北海道電力社長）2月15日死去、89歳。連絡先は同社秘書室。葬儀は近親者で行った。,,泉誠二氏が死去　元北海道電力社長,https://www.nikkei.com/article/DGXZQOUE057WK0V00C22A4000000/
04/05/2022,薮　和也氏（やぶ・かずや=元三菱電機副社長）2月19日、心不全のため死去、88歳。連絡先は同社総務部。告別式は近親者で行った。喪主は妻、和子さん。,,薮和也氏が死去　元三菱電機副社長,https://www.nikkei.com/article/DGXZQOUE057DS0V00C22A4000000/
04/05/2022,住宅系スタートアップのセレンディクス（兵庫県西宮市）は慶応義塾大の研究機関と連携し、3Dプリンターで平屋住宅「フジツボ」（延べ床面積49平方メートル、高さ4メートル）を建設する。2022年秋に実験用建物を設け、2人暮らし用の一般住宅として23年春をメドに販売に乗り出す考えだ。3Dプリンターを使ったものづくりを研究する「慶応義塾大学KGRI環デザイン&デジタルマニュファクチ...,スタートアップ,3Dプリンターで平屋　セレンディクスが23年一般販売,https://www.nikkei.com/article/DGXZQOUF01A690R00C22A4000000/
04/05/2022,契約書の管理システムを提供するHubble（ハブル、東京・港）はベンチャーキャピタル（VC）のDNXベンチャーズ（東京・港）などを引受先とする第三者割当増資で6億5000万円を調達した。人...,スタートアップ,クラウド上で取引先と契約書作成　ハブルが6.5億円調達,https://www.nikkei.com/article/DGXZQOUC31BQS0R30C22A3000000/
04/05/2022,事業承継の仲介サイトを運営するライトライト（宮崎市）はM&A（合併・買収）仲介のストライクと提携する。ストライクが収集した案件をライトライトのサイト「relay（リレイ）」に掲載し、共同で後継者探しを支援する。小規模事業者の望まない廃業を防ぐ狙いで、2023年末までに累計180件の成約を目指す。ライトライトはシステム開発などに充てるため、ストライクを主な引受先とする第三者割当増資で1億3000万円を調達す...,スタートアップ,ライトライト、事業承継支援でストライクと提携,https://www.nikkei.com/article/DGXZQOUC30D010Q2A330C2000000/
04/05/2022,テレワークに使う備品をサブスクリプション（定額課金）形式で企業に貸し出すHQ（東京・新宿）は、ベンチャーキャピタル（VC）のコーラル・キャピタルなどから2億円を...,スタートアップ,テレワーク備品サブスク　HQ、システム改良へ2億円調達,https://www.nikkei.com/article/DGXZQOUC30BW50Q2A330C2000000/
04/05/2022,介護事業者と介護士のマッチングを手掛けるカイテク（東京・港）は、はたらくFUNDや三菱UFJキャピタルなどを引受先とする第三者割当増資で3億7000万円を調達した。営業職社員の採用や広告宣伝に充てる。仲介先の介護事業所を2023年末までに1万施設と、現状の約14倍に増やした...,スタートアップ,介護人材仲介を1万事業所に拡大　カイテク、3.7億円調達,https://www.nikkei.com/article/DGXZQOUC301ZY0Q2A330C2000000/
04/05/2022,SNS（交流サイト）の「Yay!（イェイ）」を運営するナナメウエ（東京・港）は2023年をメドに、暗号資産（仮想通貨）事業に参入する。イェイの利用者同士の交流に使ってもらうほか、他の仮想通貨とも取引できるようにする。事業化に向けた資金として第三者割当増資で15億2000万円を調達した。金融庁などの審査を経て、独自の仮想通貨を発行する計画だ。イェイ内で取引される非代替性トークン（NFT）を使った作...,スタートアップ,仮想通貨に参入へ　SNS運営ナナメウエ、15.2億円調達,https://www.nikkei.com/article/DGXZQOUC25CUX0V20C22A3000000/
04/05/2022,日本生命保険は企業から預かる年金保険の予定利率を2023年4月に年1.25%から0.50%へと引き下げる。日本生命の契約企業は約5200社で、運用額は5.6兆円に及ぶ。利率の引き下げは21年ぶりで、企業年金は掛け金の積み増しや運用実績に応じた仕組みへの変更などを迫られそうだ。背景には超低金利の長期化があり、他社も追随する可能性がある。日本の年金制度は3階建ての構造になっている。1階部分は20～5...,金融機関,日本生命が企業年金利率下げ　1.25→0.5%、5200社影響,https://www.nikkei.com/article/DGXZQOUB04ADF0U2A400C2000000/
04/05/2022,北洋銀行が5日発表した2022年1～3月期の北海道内の企業の経営動向調査によると、全産業の利益判断指数（DI）はマイナス21だった。21年10～12月期から6ポイント下がった。悪化は2期ぶり。新型コロナウイルスの緊急事態宣言に準じるまん延防止等重点措置や、原材料価格の高騰が影響した。DIは増加企業の割合から減少の割合を引いた値で算出する。非製造業の利益DIは4ポイント悪化しマイナス19になった。うち「建設業」は民間工事が振るわず、マイナス35まで低迷した。製造業の利益DIは8ポイント低下のマイナス23だった。うち「鉄鋼・金属製品・機械」では16ポイント落ち込み、マイナス33だった。22年4~6月期の先行きでは利益DIは6ポイント上昇のマイナス15を見込む。2月中旬～3月中旬に調査し、370社が回答した。,地域金融,北海道内企業の企業利益DI、2期ぶり悪化　北洋銀行調べ,https://www.nikkei.com/article/DGXZQOFC056TV0V00C22A4000000/
04/05/2022,デロイトトーマツグループ傘下のデロイトトーマツファイナンシャルアドバイザリー合同会社（東京・千代田）は、日本レースプロモーション（JRP）が主導するプロジェクトのトップパートナーに就任した。脱炭素やデジタル化の観点からモータースポーツの促進に貢献する。デロイトトーマツグループがトップパートナーに就任したのは「SUPER FORMULA NEXT...,SDGs,デロイトトーマツ、モータースポーツのパートナーに,https://www.nikkei.com/article/DGXZQOUC053KF0V00C22A4000000/
04/05/2022,【上海=土居倫之、大連=渡辺伸】中国・上海市は4日、西部地区での都市封鎖（ロックダウン）の事実上の延長を決めた。市内の大半の地域で外出の原則禁止を続ける。地下鉄も20路線のうち2路線のみの運行を継続する。新規感染者数が4日連続で最多更新と感染を抑え込めておらず、都市封鎖の解除時期は見通せない。中国本土の新規感染者数（含む無症状）は1万6412人とデータを比較できる2020年4月以降で最多となった。...,中国・台湾,中国・上海市、都市封鎖を延長,https://www.nikkei.com/article/DGXZQOGM057KP0V00C22A4000000/
04/05/2022,北京冬季五輪のフィギュアスケート男子で銀メダルを獲得した鍵山優真選手が5日、中京大学の入学式に出席した。スポーツ科学部に進学、「スケートをやるうえで充実した環境で大学を選んだ。4年後の五輪ではさらにいい色のメダルを取りたい」と抱負を述べた。中京大は愛知県豊田市のキャンパスにスケートリンクを備え、「授業後にもすぐに練習ができる環境」（同大）にある。浅田真央さんが卒業生で、北京五輪銅メダルの宇野...,中部,フィギュア銀・鍵山選手、中京大に入学,https://www.nikkei.com/article/DGXZQOFD054600V00C22A4000000/
04/05/2022,【NQNロンドン=菊池亜矢】5日午前のロンドン外国為替市場で、ユーロは対ドルで安値圏で推移し、英国時間9時30分時点は1ユーロ=1.0970～80ドルと、前日の同16時時点より0.0020ドルのユーロ安・ドル高で取引されている。ロシア軍によるウクライナの民間人への残虐行為の疑いが浮上し、欧州連合（EU）が対ロシア制裁の強化を検討し始めた。ウクライナとロシアとの停戦がさらに遠のくとの見方のほか、対ロ制裁強化がユーロ圏景気へ及ぼす影響も懸念され、ユーロ売り・ドル買いが優勢となっている。英ポンドは対ドルで伸び悩み、英国時間9時30分時点は1ポンド=1.3110～20ドルと、前日の同16時時点と同じ水準で推移している。,為替概況,ロンドン外為9時半　ユーロ、安値圏　英ポンドは伸び悩み,https://www.nikkei.com/article/DGXZASH2IILM1_V00C22A4000000/
04/05/2022,財務省は5日、タイ税関当局との間で、互いに輸入貨物の通関手続きを素早くできるようにすることで合意したと発表した。法令順守などで基準を満たす企業の手続きを簡素化する「AEO制度」と呼ぶ両国の仕組みを相互に承認した。AEO制度は法令順守の取り組みや安全管理の高さが評価された事業者を対象に、輸出入貨物の通関手続きを簡略化する仕組み。両国が認定した事業者は互いに輸出入の審査にかかる時間が短くなり、日・タイ間の貿易拡大が見込める。財務省関税局とタイ税関局が5日にオンラインで相互承認取り決めに署名した。両国で必要な国内手続きを終えた後に実施する。日本はこれまでに米国や欧州連合（EU）、オーストラリアなどと相互承認を実施している。タイとの相互承認で13例目となる。,経済,通関手続き簡素化　日・タイ税関当局が合意,https://www.nikkei.com/article/DGXZQOUA056FB0V00C22A4000000/
04/05/2022,アウトドア用品のキャプテンスタッグ（新潟県三条市）は、セレクトショップのユナイテッドアローズ(UA)とコラボレーションしたアウトドア用品を発売する。商品はチェアやテーブルなどで、UAのオンラインストアや店頭で販売する。発売するアウトドア用品は、ライトチェア（9900円）やアルミテーブル(3850円)など13種類。商品はUAの服飾ブランド「グリーンレーベルリラクシング」とスウェーデン出身のイラストレーターのジョナス・クレアッソン氏による3者のコラボ。各商品には同氏によるイラストで、キャプテンスタッグのブランドロゴのシカなどが描かれている。UAのオンラインストアでは既に予約を受け付けている。店頭では4月初旬から販売する。3者によるコラボ商品の取り組みは4回目。,新潟,キャプテンスタッグ、Uアローズとアウトドア用品,https://www.nikkei.com/article/DGXZQOCC305QW0Q2A330C2000000/
04/05/2022,段ボール製品の藤屋段ボール（新潟県聖籠町）はロシアに侵攻されているウクライナを支援するため、段ボール製の消毒液スタンド（1万1000円）の販売を始めた。30日まで100台の限定販売で、売り上げはすべて日本赤十字社に寄付し、ウクライナ支援に役立ててもらう。寄付の目標金額は100万円。...,サービス・食品,消毒液スタンドでウクライナ支援　新潟の藤屋段ボール,https://www.nikkei.com/article/DGXZQOCC286GW0Y2A320C2000000/
04/05/2022,スピードスケート女子のエースとして、日本選手団主将を務めた2月の北京冬季五輪で金を含むメダル4個を獲得した高木美帆（27）=日体大職=が5日、東京都内の日本記者クラブで記者会見し、現役続行の意向を示した。明言していなかった今後に関し「滑りたいと思っている自分がいることに気付いた」と述べた。具体的な方向性は検討中で、4年後の五輪を目指すかについては「まだ分からない」とした。本場のオランダで活動することや勉学に注力する可能性も含め「いろいろな選択肢がある。よく考えたい」と引き続き検討し「いつ終わりが来ても悔いが残らないように、やれることをやりたい」と語った。北海道出身の高木美は15歳で2010年バンクーバー五輪に初出場。この日、引退を表明した姉の高木菜那（29）とともに出場した18年平昌五輪では一緒に滑った団体追い抜きでの金を含むメダル3個を手にした。北京五輪でのメダル4個は冬季五輪の日本勢で1大会最多、通算でメダル7個は夏冬を通じて女子の日本勢で最多となった。〔共同〕,スポーツ,スケート高木美帆は現役続行　4年後五輪「分からない」,https://www.nikkei.com/article/DGXZQOKC059460V00C22A4000000/
04/05/2022,ロシア軍がウクライナの首都キーウ（キエフ）周辺から離れ、現場の惨状が明らかになってきた。ウクライナのゼレンスキー大統領は4日、キーウ近郊のブチャを訪れ、同地だけで300人以上が殺害されたり拷問を受けたりしたと指摘した。4日の米紙ニューヨーク・タイムズ（NYT、電子版）は衛星写真などから、ブチャでは多数の住民がロシア軍の撤退前に殺害されたと分析した。米国防総省の高官によると、ロシア軍は4日までにキ...,ウクライナ侵攻,米紙「住民殺害はロシア軍撤退前」　ウクライナ首都近郊,https://www.nikkei.com/article/DGXZQOCB051I10V00C22A4000000/
04/05/2022,自動車部品大手のティラドは5日、ロシアのウクライナ侵攻に伴う経済制裁の影響により、ロシア事業から撤退すると発表した。自動車向け熱交換器を中心に製造と販売を担っていたが、部材調達の決済などが難しく、今後の業績の悪化が見込まれることから撤退を決めた。今後はロシアの現地企業へ経営権を譲渡する見込み。このほどロシア現地法人の全株式を保有するオランダ子会社の株式79%について、無議決権化する契約をロシア自動車大手GAZと合意した。経営権を譲渡し、経営責任についても免除される。これら一連の手続きに伴い、2023年3月期中に約5億円の特別損失を計上する見込み。2月から始まったロシアのウクライナ侵攻に伴い、各国政府は経済制裁を実施。部材調達のための決済などで困難が生じる恐れが出ていた。「日本からの支援も難しい状況が続いている」（同社）ティラドは熱交換器大手。ロシアには09年に進出し、ロシア現地の完成車メーカーに対して熱交換器を供給していた。21年12月期のロシア事業の売上高は約10億円。取引先に日系企業は含まれていないという。,自動車・機械,部品大手のティラド、ロシア事業撤退　ウクライナ危機で,https://www.nikkei.com/article/DGXZQOUC058LD0V00C22A4000000/
04/05/2022,5日の東京外国為替市場で、円相場は3日続落した。17時時点では前日の同時点に比べ22銭の円安・ドル高の1ドル=122円87～89銭で推移している。米金融引き締めが加速するとの観測から日本時間5日の取引で米長期金利が上昇（債券価格が下落）しており、日米金利差の拡大を意識した円売り・ドル買いが優勢だった。円は朝方に122円38銭近辺まで買われる場面もあった。日銀の黒田東彦総裁が同日の衆院財務金融委員会で円相場について「今回の為替相場の変動はやや急」との認識を示した。この発言を「円安けん制」とみた市場参加者による円買い・ドル売りが入った。ただ、日米の金融政策の違いを背景とした円安・ドル高基調に変わりはないとの見方は根強く、円は午後には下落に転じた。9～17時時点の円の安値は122円99銭近辺で、値幅は61銭程度だった。円は対ユーロで3日続伸した。17時時点では同38銭の円高・ユーロ安の1ユーロ=134円92～94銭で推移している。ユーロは対ドルで3日続落した。17時時点は1ユーロ=1.0979～80ドルと同0.0052ドルのユーロ安・ドル高だった。〔日経QUICKニュース（NQN）〕,為替概況,外為17時　円、続落　122円台後半　日米金利差拡大で,https://www.nikkei.com/article/DGXZASFL05HK4_V00C22A4000000/
04/05/2022,JR東日本は5日、2023年3月から、山手線各駅など首都圏の一部区間の鉄道運賃を一律10円値上げすると発表した。国土交通省がホームドア設置など駅のバリアフリー化を促すために鉄道料金制度を見直したことを受けた措置。36年ごろまでに駅のホームドアの整備費などで約5900億円の費用が見込まれ、今回の値上げでその約半分をまかなう方針だ。5日の定例記者会見で深沢祐二社長が明らかにした。国土交通省は21年12月、駅の段差解消やホームドア設置などの整備費用をまかなう目的で現行料金に一定額を上乗せすることを認めるよう制度を改正。22年から事業者の届け出を受け付けており、5日にJR東が初めて申請した。運賃値上げの対象となる区間は、山手線各駅や埼京線の大宮―大崎など16路線278駅。これまで利用者数が多いことや私鉄との競争力維持の観点から、他の区間に比べて乗車料金を安く設定していた。定期券では6カ月分で1420円値上げし、小児料金は値上げ後の大人料金の半額とする。一連の運賃改正により年間約230億円の増収を見込む。国交省は、追加料金で得た収入はホームドアやエレベーターのほか、車両の車椅子スペースなどの整備費に充てることを求めている。JR東は同日、31年度末までに在来線の主要路線330駅の計758番線においてホームドアを設置する計画を示した。当初計画より1年前倒しし、対象番線も拡大する。ホームドアの整備はその後も継続し、36年3月までに約5900億円の費用を見込む。「そのうちの半分を利用者からいただきたい」（深沢社長）としている。,サービス・食品,JR東日本、山手線など運賃10円値上げ　23年3月から,https://www.nikkei.com/article/DGXZQOUC056NA0V00C22A4000000/
04/05/2022,電子部品製造のトーキン（宮城県白石市）は、磁性材料を製造している仙台事業所（仙台市）の操業を2024年2月に停止すると発表した。従業員約220人は白石事業所（白石市）で雇用を継続する。仙台事業所の跡地は大和ハウス工業に売却する。仙台事業所ではニッケル・チタン合金や磁石を生産しているが、設備の老朽化が進んでいた。同社は白石事業所に工場を増設し、生産の大半を移管する方針だ。,宮城,電子部品製造のトーキン、仙台事業所を操業停止,https://www.nikkei.com/article/DGXZQOCC051140V00C22A4000000/
04/05/2022,【ブリュッセル=竹内康雄】北大西洋条約機構（NATO）は6～7日にブリュッセルの本部で外相理事会を開く。ウクライナに侵攻したロシアへの対応が焦点だ。日本、韓国、オーストラリア、ニュージーランドというアジア大洋州の4カ国を招き、西側の結束を確認する。対中国で連携する狙いもある。「この数十年でみなかった蛮行だ。決して受け入れられない」。3日、米CNNに出演したNATOのストルテンベルグ事務総長は、ウ...,ウクライナ侵攻,NATO、中ロ対抗へアジア大洋州と連携　6日外相理事会,https://www.nikkei.com/article/DGXZQOGR04C5N0U2A400C2000000/
