04/23/2022,【ニューヨーク=斉藤雄太】日銀の黒田東彦総裁は22日、ニューヨーク市内のコロンビア大主催のイベントで講演し、「いまの金融緩和を継続する必要がある」との考えを改めて示した。米国と比べて個人消費や労働市場の回復が鈍いと指摘。日米金利差の拡大を背景に進む急速な円安・ドル高に警戒感が高まる中でも、新型コロナウイルス禍からの経済の持ち直しを支えるため、大規模緩和を続ける意義を強調した。ロシアのウクライナ...,北米,日銀総裁「金融緩和の継続が必要」　経済回復の鈍さ強調,https://www.nikkei.com/article/DGXZQOGN22DXZ0S2A420C2000000/
04/23/2022,半導体製造装置大手の2023年3月期は、旺盛な需要を背景に市場予想ベースで前期に続き最高益となる見通しだ。足元で中国のスマホ需要などが減る中、特定分野の需要変動の影響を受けにくい前工程の装置メーカーで業績の安定性が高い。一方で金利上昇や需要減速の懸念から株価は軟調で、市場では来期以降も好況が続くかどうかにも注目が集まる。「幅広い用途で顧客の強い投資意欲は続きそうだ」。21日に決算発表したディスコ,エレクトロニクス,半導体装置、好調続く　スマホ減速も「前工程」に安定感,https://www.nikkei.com/article/DGXZQOUC20CDX0Q2A420C2000000/
04/23/2022,【ロンドン=佐竹実】欧米の航空会社が相次いでマスク着用義務を撤廃している。新型コロナウイルスの重症化率が下がり、各国政府が行動規制を緩和するのに合わせた措置だ。各国は入国規制も緩めて観光客誘致に動いており、外国人を締め出す日本の規制の厳しさが際立っている。フィンランドの航空大手フィンエアーは25日から、機内でのマスク着用義務を解除する。「ワクチン接種が進んだほか、最近の変異型が軽症であることから多くの国で規制が撤廃されている」ためだ。日本などマスクが必要な国への便では引き続き着用を求めるが、同社は「機内は効率的な空調などによりコロナ感染リスクが低いとみなされている」と指摘した。英航空大手ブリティッシュ・エアウェイズ（BA）やヴァージン・アトランティック航空もすでにマスク着用義務を無くしている。BAのマホニー最高執行責任者（COO）は3月、「着用が義務付けられていない目的地については、乗客の個人の判断を尊重するよう求める」とコメントした。アメリカン航空など米航空各社は18日、乗客や従業員に求めていたマスク着用義務を撤廃すると発表した。米航空業界団体「エアラインズ・フォー・アメリカ」は3月、「混雑した飲食店や学校、スポーツイベントはマスクなしで集まることが許されているのに、飛行機だけ義務化される理由がない」と政府に働きかけていた。欧米各国は、重症化率が下がったことを受けてコロナ規制を相次ぎ緩和・撤廃している。英国では3月に感染者でも隔離する義務がなくなり、通常の風邪と同じように扱うことを目指している。英調査会社ユーガブの3月下旬の調べでは、公共の場所でマスクをつけると答えたのは42%で、パンデミック（世界的大流行）初期の2020年7月以来の低さになった。水際対策も撤廃され、英イングランドへの入国に際して規制は一切ない。地元メディアによるとスイスは4月から公共交通機関でのマスクを含め全てのコロナ対策をなくしたほか、5月2日からは全ての国からの入国規制を解除する。シンガポールも26日から屋内のマスク着用義務以外の規制をなくし、ワクチンを2回接種済みであれば事前検査なしでも入国できるようにする。手探りながらも経済・社会の正常化を目指す欧米などとは対照的に、重症者よりも感染者の動向を重視する日本は厳しい水際対策を続ける。10日からは1日当たりの入国者の制限を1万人に引き上げたが、1万人はコロナ前の7%にすぎない。異例の鎖国状態を長期にわたって続ければ、ビジネスや観光、留学などでの日本の魅力が下がることになる。,新型コロナ,欧米で進む、脱マスク　航空会社など義務撤廃,https://www.nikkei.com/article/DGXZQOGR22E310S2A420C2000000/
04/23/2022,名古屋市は22日、1万円の額面で1万3千円分の買い物ができるプレミアム付き商品券の抽選申し込みを、専用ウェブサイトやはがきで27日から受け付けると発表した。6月23日～2023年1月31日の7カ月間、市内のコンビニや飲食店など約8600店舗で使える。申し込みは5月27日ま...,愛知,名古屋市、プレミアム付き商品券　27日から申し込み,https://www.nikkei.com/article/DGXZQOFD221TH0S2A420C2000000/
04/23/2022,【ニューヨーク=共同】米東部ペンシルベニア州フィラデルフィア市当局は22日、新型コロナウイルス感染が再拡大しているとして18日に導入した屋内の公共空間でのマスク着用義務を解除した。米メディアが伝えた。市衛生部門は、入院者数が過去数日間に約25%減少するなど予想に反して感染が沈静化してきたことを理由に挙げた。同市はオミクロン株の派生型「BA・2」の感染急拡大を警戒。3月上旬に大部分を解除していたマスク着用義務を米大都市として初めて復活し、一部住民は違法だとして訴訟を起こしていた。,新型コロナ,マスク義務を再び解除　米東部フィラデルフィア,https://www.nikkei.com/article/DGXZQOGN22E050S2A420C2000000/
04/23/2022,▽8時19分　公邸から官邸。27分　閣議。49分　磯崎官房副長官。▽9時52分　国会。▽10時1分　参院本会議。▽11時57分　官邸。▽13時3分　「グローバルヘルスを応援するビジネスリーダー有志一同」の渋沢健シブサワ・アンド・カンパニーCEOらから要望書受け取り。36分　上川幹事長代理。▽14時3分　岩屋毅党治安・テロ対策調査会長らから提言書受け取り。23分　衆院第2議員会館。25分　菅義偉前首相。55分　官邸。56分　報道各社のインタビュー。▽15時15分　大河原昭夫日本国際交流センター理事長、武見敬三日英21世紀委員会日本側座長。36分　秋葉国家安全保障局長、島田防衛次官、鈴木防衛装備庁長官。50分　財務省の矢野次官、茶谷主計局長。▽16時9分　中川俊男日本医師会会長。30分　磯崎副長官、藤井官房副長官補、森昌文補佐官、迫井新型コロナウイルス等感染症対策推進室長、安藤外務省領事局長、吉田厚労次官。▽17時15分　東京・北の丸公園の国立公文書館。特別展「公文書でたどる沖縄の日本復帰」を内覧。福田康夫元首相、西銘沖縄・北方相、若宮万博相ら同行。34分　同特別展の開会式に出席し、あいさつ。テープカット。57分　官邸。▽18時4分　松野、木原、磯崎、栗生正副官房長官、村田内閣危機管理監、国家安全保障局長、外務省の森次官、宇山欧州局長、増田防衛省防衛政策局長。27分　保坂資源エネルギー庁長官加わる。▽19時7分　東京・銀座の日本料理店「加賀屋銀座店」。森山総務会長代行と会食。▽20時57分　公邸。,首相動静,22日の岸田首相の動静,https://www.nikkei.com/article/DGXZQOUA2220O0S2A420C2000000/
04/23/2022,ハウス食品グループ本社は22日、タイに子会社「ハウス食品グループアジアパシフィック」（バンコク）を4月1日に設立したと発表した。資本金は7000万タイバーツ（約2.6億円）で、ハウスが全額出資する。タイでビタミン飲料市場が広がっており、現地での製品開発や品質保証をする。東南アジアで機能性飲料の販売も増やす。ハウスは5月下旬にも、タイ食品メーカーと2011年に設立した合弁企業「ハウスオソサファフーズ」の持ち分を現物で譲渡し、アジアパシフィックの増資を引き受ける。アジアパシフィックがハウスオソサファフーズの親会社となる資本関係を明確にし、現地での事業戦略を進めやすくする。増資後のアジアパシフィックの資本金は約11億バーツになる。アジアパシフィックはハウスの資本金の10%以上にあたる特定子会社となる。ハウスは現物出資による業績への影響は「軽微」としている。,サービス・食品,ハウス食品、タイに子会社　東南アジアでビタミン飲料,https://www.nikkei.com/article/DGXZQOUC228MP0S2A420C2000000/
