11/15/2021,観音寺市長（香川県）当　17726佐伯　明浩　無新13995城本　　宏　無新〔共同〕,政治,観音寺市長に佐伯氏初当選,https://www.nikkei.com/article/DGXZQODE1431Y0U1A111C2000000/
11/15/2021,【トマショフマゾウィエツキ（ポーランド）=共同】スピードスケートのワールドカップ（W杯）第1戦最終日は14日、ポーランドのトマショフマゾウィエツキで行われ、女子1500メートルは平昌冬季五輪銀メダリストの高木美帆（日体大職）が1分56秒00で優勝した。この種目で通算10勝目、個人種目合計で12勝目。佐藤綾乃（ANA）は6位だった。男子500メートルは日本記録保持者の新浜立也（高崎健康福祉大職）が34秒69で優勝し通算7勝とした。森重航（専大）が34秒74で3位に入った。,スポーツ,高木美帆が1500優勝、新浜立也は500でV　スピードW杯,https://www.nikkei.com/article/DGXZQOKC143260U1A111C2000000/
11/15/2021,奄美市長（鹿児島県）当　18100安田　壮平　無新7055永井　章義　無新〔共同〕,政治,奄美市長に安田氏初当選,https://www.nikkei.com/article/DGXZQODE143310U1A111C2000000/
11/15/2021,都留市長（山梨県）当　　8891堀内　富久　無現7919奥脇　隆夫　無新〔共同〕,政治,都留市長に堀内氏3選,https://www.nikkei.com/article/DGXZQODE1432O0U1A111C2000000/
11/15/2021,1977年に中学1年の横田めぐみさん（失踪当時13）が新潟市内から北朝鮮に拉致され、15日で44年となった。母、早紀江さん（85）が9日に川崎市の自宅マンションで報道陣の取材に応じ「連れて行かれたまま何も分からない。言葉に表せないほどの焦燥感だ」と声を絞り出すように語った。めぐみさんには「病気をしないで元気で、希望を持って待っていてほしい」と呼び掛けた。取材の場には、めぐみさんが小学6年の時の書き初め「元朝の志」が飾られた。何度も書き直し、やっと納得した作品といい、早紀江さんは「一生懸命書いていた。年末が近くなるといつも思い出す」と懐かしんだ。早紀江さんは、陶器製のペンダントと小さな焼き物を公開。ペンダントは山口県萩市への家族旅行で、めぐみさんが作ったものだった。焼き物は別の機会に「お母さんが好きそうな色でしょ」とお土産に買ってきたという。早紀江さんは「いつも朗らかで、にぎやかな子だった」と表情を和らげた。拉致被害者家族の高齢化が進み、昨年6月、父滋さんが87歳で亡くなった。拉致と判明後も首相が何人も代わり、早紀江さんは「岸田文雄首相が最後だと思っている。日朝会談をぜひ実現してほしい」と力を込める。めぐみさんには「家族はみんなめぐみちゃんを愛している。病気にならないように気を付けて。待っているから」と語り掛けた。めぐみさんは77年11月15日、下校中に自宅近くで消息を絶った。北朝鮮は2002年の日朝首脳会談で拉致を認め、死亡したと説明したが、日本側は受け入れていない。〔共同〕,社会・調査,娘思い44年、母「焦燥感」　横田めぐみさん拉致,https://www.nikkei.com/article/DGXZQOUE1420O0U1A111C2000000/
11/15/2021,世界最大の権力者といわれる米大統領が暴走したらどう止めるのか――。トランプ前大統領が退いて「平時」を取り戻したいま、大統領権限のあり方を巡る議論が進んでいる。議会が監視を強める法案が候補だが、口を出しすぎれば政府の動きは鈍る。三権分立の均衡点を見いだそうと、与野党とも頭をひねっている。「将来の大統領が権力を乱用するのを阻止しなければいけない」。与党・民主党のワーナー上院議員と野党・共和党のトゥー...,グローバルViews,米大統領の「暴走」防げ　議会があの手この手,https://www.nikkei.com/article/DGXZQOGN0503G0V01C21A1000000/
