05/17/2022,政府は環境問題や貧困など、社会的な課題の解決を事業の目的とする新たな会社形態の設立に向けた検討に入る。定款などで社会貢献を担うと明示した企業を認定するといった形を想定する。6月をめどに決める「新しい資本主義」の実現に向けた計画の柱の一つとなる。短期の利益追求への偏りを修正し、公益を担いながら成長する企業を育てる。米国などで法整備が進む「パブリック・ベネフィット・コーポレーション」(PBC）を参...,経済,公益重視の新たな会社形態　政府検討、短期利益偏り修正,https://www.nikkei.com/article/DGXZQOUA162TR0W2A510C2000000/
05/17/2022,企業物価が歴史的な水準で上昇し、値上げに踏み切る企業と価格に転嫁できない企業との差が目立ち始めた。日銀が16日に発表した4月の国内企業物価指数（速報値）は前年同月比10.0%上昇した。資源高や円安を背景に素材が6割超上がったのに対し、消費者が使う最終製品は5%弱の上昇にとどまる。ウクライナ危機や円相場の先行きが不透明のなか、価格転嫁を巡り大手と中小の格差が広まる懸念もある。企業物価指数は企業間...,経済,企業物価上昇、転嫁に格差　素材6割高・最終製品5%弱,https://www.nikkei.com/article/DGXZQOUB13BZS0T10C22A5000000/
05/17/2022,4月28日午前、中西部オハイオ州コロンバス。市中心部の州最高裁に隣接する広場は200人近い有権者の熱気に包まれていた。「政治家が選挙区を不正に操作し、不当に権力を維持しようとしている」。集会を主催したミア・ルイスさんがスピーカーを片手に訴えると、参加者が呼応した。「政治家は仕事をしろ」「公平な選挙区割りを」――。11月8日の中間選挙まで半年を切ったいまなお、民...,バイデン政権,米、ゲリマンダーの爪痕深く　恣意的区割りで綱引き,https://www.nikkei.com/article/DGXZQOGN02AYI0S2A500C2000000/
05/17/2022,リコーが米国の先端医療スタートアップを買収し、「メッセンジャーRNA（mRNA）」医薬品の開発製造受託事業に参入する。主力の事務機で培った生産管理技術などを生かし、新型コロナウイルス禍で注目を集めたmRNA医薬品を収益の柱に育てる。米エリクサジェン・サイエンティフィック（メリーランド州）を7月にも買収する。買収額は数十億円規模とみられる。2019年に数十億円を出資し34･5%の株式を取得したが...,ヘルスケア,リコー、mRNA医薬品の製造受託に参入　米新興を買収,https://www.nikkei.com/article/DGXZQOUC169JV0W2A510C2000000/
05/17/2022,サントリー食品インターナショナル(サントリーBF)は16日、「サントリー天然水」など清涼飲料を値上げすると発表した。10月1日出荷分からペットボトルを中心に主要商品を希望小売価格ベースで20円引き上げる。他社にも追随の動きが広がる見込みだ。一方、食品などの値上げが相次ぐ中で消費者の節約志向も強まっている。原材料高と消費者心理の板挟みをどう乗り切るかという課題を残す。値上げするのは「サントリー天...,値上げラッシュ,サントリー飲料値上げ、他社追随へ　消費者心理に重荷も,https://www.nikkei.com/article/DGXZQOUC13EWF0T10C22A5000000/
05/17/2022,【NQNニューヨーク=張間正義】16日のニューヨーク・マーカンタイル取引所（NYMEX）で原油先物相場は4日続伸した。WTI（ウエスト・テキサス・インターミディエート）で期近の6月物は前週末比3.71ドル（3.4%）高の1バレル114.20ドルで取引を終えた。中国の原油需要の回復観測が相場を押し上げた。一時は1バレル114.90ドルと、ほぼ2カ月ぶりの水準を付けた。中国・上海市は新型コロナウイルスの感染拡大で実施していた都市封鎖を6月に解除する方針を明らかにした。経済再開で中国の原油需要の回復観測が強まり「改めて需給バランスの悪化を意識した買いが入った」（プライス・フューチャーズ・グループのフィル・フリン氏）という。5月末のメモリアルデーから米国ではドライブシーズンが本格化するとあって、米ガソリン先物が過去最高値水準に上昇している。一段の原油先物の需要増を見込んだ買いも入った。ニューヨーク金先物相場は3営業日ぶりに反発した。ニューヨーク商品取引所（COMEX）で取引の中心である6月物は前週末比5.8ドル（0.3%）高の1トロイオンス1814.0ドルで取引を終えた。米長期金利の低下で金利の付かない金に投資妙味が増したとみる買いが入った。,商品概況,NY商品、原油が続伸　中国需要の回復観測で　金は反発,https://www.nikkei.com/article/DGXZASQ2INYPC_X10C22A5000000/
05/17/2022,仏ルノーのルカ・デメオ最高経営責任者（CEO）は16日、新たに設立する電気自動車（EV）事業の新会社に関し、「（企業連合を組む）日産自動車と三菱自動車に参画を要請している」と明らかにした。デメオCEOは日産と三菱自が新会社に出資する可能性があるとし、EV開発で先行する両社に技術供与を含めて協力を求める。デメオCEOは16日、横浜市内で日本経済新聞などの取材に応じて明らかにした。デメオCEOはE...,自動車・機械,ルノー、日産にEV新会社への出資要請　デメオCEO,https://www.nikkei.com/article/DGXZQOUC151330V10C22A5000000/
05/17/2022,日本の5大銀行グループの2022年3月期決算が16日、出そろった。新型コロナウイルス下で企業活動の再開に伴う資金需要が寄与し、連結純利益の合計は前の期比31%増の2兆6470億円となり4社が増益だった。ただ金利上昇で3月末時点の外債含み損は1兆7500億円以上に膨らんだ。金利の先高観は強く、外債含み損が業績を下押しするリスクもある。「久しぶりの金利上昇。相場の動きは始まったばかりで手綱さばきが...,金融機関,大手銀5行、外債含み損1.7兆円　好決算も金利上昇響く,https://www.nikkei.com/article/DGXZQOUB165UC0W2A510C2000000/
05/17/2022,2022年3月期の関西主要地銀の決算が出そろった。新型コロナウイルス禍が本格化する前の20年3月期との比較を通じ、資金繰り支援が一巡してポストコロナを見据える各行の現在地を探る。「コロナやウクライナなど環境変化の激しい1年だったが、成長トレンドを示すことができた」。12日の決算会見で開口一番、関西みらいフィナンシャルグループ（FG）の菅哲哉社長は強調した。22年3月期の連結純利益は前の期比52...,地域金融,関西みらいFG2行、最終利益で明暗　統合シナジーは前進,https://www.nikkei.com/article/DGXZQOUF12DYA0S2A510C2000000/
05/17/2022,子どもの「運動神経」を発達させるにはどうしたら――と思い悩む保護者は少なくない。子どもの運動に詳しいスポーツトレーナーの遠山健太さんが勧めるのは公園遊び。遊具や広場での遊びを通じて、運動能力を伸ばすために必要な基本動作を自然に経験できるという。ポイントを助言してもらった。「夫婦ともに文化部で運動の経験が少ないですが、子どもの運動能力も伸びにくいでしょうか？」子どもの運動について保護者向けの講...,教育,スポーツ苦手？公園で遊ぼう　基本動作を自然に経験,https://www.nikkei.com/article/DGXZQOUE232C60T20C22A4000000/
05/17/2022,新型コロナウイルス禍で家計に貯蓄が積み上がっている。日銀の試算では消費されずに貯蓄に回った額は2021年末時点で約50兆円と、わずか1年で2.5倍に膨らんだ。貯蓄が物価高の痛みを和らげ、個人消費を押し上げるという日銀が描くシナリオ通りにはいかず、将来不安からさらに貯蓄が積み上がる可能性がある。日銀はコロナによる移動制限などを受け、可処分所得のうち半ば強制的に貯蓄に向かった金額を推計している。2...,金融政策,「コロナ貯蓄」日本50兆円　米300兆円、インフレ要因に,https://www.nikkei.com/article/DGXZQOUB146940U2A410C2000000/
05/17/2022,新型コロナウイルスのパンデミックやロシアのウクライナへの軍事侵攻など、世界は大きな転換期を迎えているようです。疫病と戦争という2つの地球規模の課題が同時に進行しています。そんな中、僕自身の人生も転機を迎えることになりました。26年前に創業した会社の代表を退くことにしました。現在52歳ですので、人生のちょうど半分を費やしてきた会社の経営に一つの区切りをつけることになります。この決断の背景に、現在の世界を取り巻く社会環境があることは否定しません。コロナ禍から消費は戻らず、ウクライナ情勢などによる原材料価格の高騰、底が見えない円安、国の借金の膨張など、世界規模の情勢不安の中、すぐにコロナ前の状況に戻るとは言い難いです。僕自身、大いに悩み苦しみましたが、ベンチャー的な企業カルチャーから、経営基盤の整った大きな資本のもとで次の成長を目指すべきだ、という思いに至りました。経営者の責任として社員の将来、安心と安全、安定の確保は絶対です。会社の事情とは別に、個人的に僕自身が変わりたい、と考えるようになったのも大きな理由です。そんな心境の変化が芽生えたきっかけは、やはりコロナ禍と東京五輪・パラリンピックでした。大変せんえつながら、東京大会の僕の評価は、莫大な資金を投じながら具体的な成果が残せなかった、失敗したイベントというものです。でも、多くの日本国民による評価はそうでもないようです。かといって成功でもない、なんとも曖昧な雰囲気のまま、もはや記憶からもなくなっているかのようです。僕がこのコラムをはじめ、執筆や取材対応などを通じて「スポーツの産業化」を提唱させていただいたのは、東京が2020年五輪招致に乗り出した11年ごろからです。アメリカのスポーツ市場の急成長を間近で見てきたこともあり、20年の東京大会によって、日本にもすごい変化が生まれると大いなる期待をしていました。スポーツ関連企業として、大会の成功とその変化のために少しでも協力できればとも考えていました。しかしながら、実際の五輪への準備は、これまでの日本での大きなスポーツイベントと同様に、特定の業界にお金を分配するだけの旧態依然としたものとなってしまいました。大会が終われば赤字を増やすばかりの無駄な施設が次々と建設される事態となり、「五輪ムーブメント」により定義されていたはずの「都市のサステナビリティー」というものも、国際オリンピック委員会（IOC）の「お題目」であったことが浮き彫りになりました。このコラムでも繰り返し提言してきましたが、五輪はやり方次第で都市を大きく発展させることも、破滅に導くこともある巨大な「魔物」です。東京大会においてその象徴ともいえるのが、意匠にばかりこだわったザハ・ハディド氏の案に端を発する新国立競技場のプロジェクトでした。僕もこれではいけないと考えて、成功事例である1984年のロス五輪や、96年のアトランタ五輪をつぶさに検証することを多くの関係者、有力者の方々に提言しました。特に、新国立競技場については野球場に改築してプロ野球チームの本拠地にすることを提案したり、そもそも40年の幻の東京五輪の開催予定地で、すでに多くの施設を有する駒沢公園での開催を提案したりするなど、五輪ムーブメントと過去の成功事例に基づいた具体的な戦略を提言し続けました。近年の欧米の五輪の成功事例が目の前に存在するわけですから、必ず合理的な方向に変えられると思っていました。誰もが税金を効果的に使いたいはずだ、とも思っていましたが、現実はまったくそうではありませんでした。その後、大学スポーツの改革を目指す日本版NCAA、大学スポーツ協会（UNIVAS）の設立でも、当初はスポーツ庁に求められて助言などしました。残念ながら、途中から学生のための改革とはまるで違い、政治的な方向に引っ張られていくのを強く感じて、この動きからも距離を置きました。こうした経験から学んだのは、自分の知識、ネットワーク、僕のそんな意見などは、「今の日本ではお呼びでない」ということでした。現在の日本のあり方をつくっているのはわれわれ国民です。自分の声が届かない、響かないというのは民主主義のルールの下では、そのやり方、考え方が正解ではないということです。僕の考えるやり方ではこの国は良くならない、すなわち自分自身に思い上がりがあったということに気づきました。現在の日本の社会全体は確かに変革よりも安心と安全、そして安定を求めています。東京五輪をはさんだこの3年間くらいで、それを痛感しました。ならば、それに応えていくことこそが民主的なのではないか。故に、会社の経営もその方向に舵（かじ）を切り、自分自身も新しい考え方をしなければと思ったわけです。ただし、僕の考えに変化をもたらしたのは、「安心安全を望む日本人」だけではありません。大リーグで二刀流に挑戦する大谷翔平選手（エンゼルス）も違う意味で僕に大きな変化のきっかけを与えてくれました。また、最近ではプロ野球で28年ぶりの完全試合を達成した佐々木朗希投手（ロッテ）の存在も、僕の過去の価値観を壊して、自分の変化をポジティブなものにしてくれています。この2人は本当にすごい。過去にこの国には存在しなかったタイプであり、世界のスポーツシーンの新たなカリスマになり得るアスリートです。日本で生まれ、日本の社会で育った若者が、彼らなりのやり方で解決策を見いだし、「二刀流」のように過去の物差しを使い物にならなくするような結果を出している。2人ほど突出した存在ではなくても、日本は五輪競技でもサッカーでも優秀なアスリートを継続的に輩出し続けています。このコラムでは日本のスポーツ界の後進性や非合理性を何度も批判してきました。実際に問題ばかりなのは間違いないです。ところが、そんな後進的と思われる現場から、競技を再定義するような若者が現れている。それは一体なぜなのか。正直言って、今の僕にはわかりません。むしろそういった若者のポテンシャルが、どうやって引き出されるのかを僕自身が学び直してみたいと思っています。少なくとも、過去の日本をつくってきた偉人たち、織田信長や西郷隆盛や松下幸之助や本田宗一郎といった突出した「世界的な偉才」を生み出してきた我が国の「懐の深さ」をもっともっとリスペクトすべき、と今ではそう考えるようになりました。実際、僕が知らないだけで、政治やビジネス、学問や芸術の世界でも日本から世界と渡り合う人材が、徐々に育っているのかもしれません。日本の社会全体が大谷翔平選手と同じように、大きな可能性を秘めているのかもしれません。そもそも「二刀流」の元祖といえば剣豪、宮本武蔵です。伝えられている史実によれば、彼の剣術は恐ろしく独創的で創造的。保守的で同調圧力の強い日本の社会では異質な存在といえるでしょう。ただそんな武蔵は、伝記や小説、映画やアニメなど、あらゆるメディアを通じて最も日本人に愛されている偉人の一人です。数百年前、この若者が生み出した「二刀流」という言葉が、慣用句として現代の日本人に根づいているわけです。日本人アスリートたちの大活躍と関連があるのでは、と考えたくなります。むしろ、日本の真のポテンシャルのヒントすら感じてしまいます。「パンデミックの次は戦争か……」この3年間、何度、大きなため息をついたことでしょう。何度、頭を抱えて苦しみ、天に向かって咆哮（ほうこう）したことでしょう。天から学べたことは、個人の存在など小さなモノということでした。地球規模のうねりの中、思い上がっていた自分を省みて、命があるだけでも感謝、健康であればなおさら感謝すべき、そんなことを今まさに学ばせてもらっているような気がしています。思い起こせば、11年前の震災の際にも、同じような思いを胸に抱きました。過去においても、幾度となくあったであろう地球規模の災い、そんな状況を克服し、我が国を支えてきた偉大な先輩たちが日本にはあまた存在しています。大谷翔平選手、佐々木朗希投手も少年時代に大震災を経験し、乗り越えてきている若者です。なぜ、彼らはキラキラと輝き、すがすがしく、逞（たくま）しいのでしょうか。僕はスポーツ界の人間として、そんな存在が誕生し続けるその秘密をなんとか解明して、広く社会に伝えていきたいと思うようになりました。今後は経営者の立場を離れ、これまで以上に自由な視点で物事を考え、さまざまな形で発信できればと思っております。,Tokyoオリパラ,保守的な社会で育つ、独創的で創造的なアスリートたち,https://www.nikkei.com/article/DGXZQODH0922J0Z00C22A5000000/
05/17/2022,東北3県の大学などが連携して日本語教育人材の養成講座を始めた。定住外国人が少ない「散在地域」の教育体制の充実を目指す。山形大学の内海由美子教授に寄稿してもらった。◇山形県は「外国人散在地域」である。1980年代後半以降、主な外国人は結婚で移住してきたアジア女性だった。同国人コミュニティーもなく、ひとりで日本人の家庭に入り地域社会の一員となっていった。その過程で重要な役割を果たしたのがボラン...,大学,地方の日本語教育充実へ　東北3大学連携し教師養成,https://www.nikkei.com/article/DGXZQOCD29AB80Z20C22A3000000/
05/17/2022,「先生、下の名前、漢字で教えて下さい!」突然、受験コースの小学生から声をかけられた。私のフルネームを漢字で教えろ、というのだ。なぜ聞くのか？　先生が何者なのか、ググりたい（検索したい）からである。先生の個人情報を知りたいという、やじ馬的な欲求が子どもたちにある。塾では講師の出身大学や年齢、既婚かどうかなどプライベートなことは生徒に伝えていない。だからこそ余計に知りたくなるのかもしれない。...,教育,講師の個人情報　検索容易、流出に悩む,https://www.nikkei.com/article/DGXZQOCD15DDR0V10C22A4000000/
05/17/2022,2022年版中小企業白書を読み解き、新型コロナウイルス禍や人口減少など地域再生に向けた課題を探る。白書では政府の観光需要喚起策「Go To トラベル」の効果を検証している。中小企業景況調査を再集計し、ブロック別に宿泊業の業況判断指数（DI）を比べた。需要が強い東京発着分が対象に加わってキャンペーンが本格化した2020年10～12月期は東北だけがコロナ禍前の水準を超えていた。一方、訪日客の人気...,地域総合,「Go To」で需要増、東北が最大　感染拡大緩やかで,https://www.nikkei.com/article/DGXZQOCC28AAS0Y2A420C2000000/
05/17/2022,世界的な金融引き締めの動きは欧州にも広がる。先行する英イングランド銀行（中央銀行）は5日、政策金利を1%とおよそ13年ぶりの水準に引き上げると決めた。欧州中央銀行（ECB）も量的緩和策の縮小に動き、早ければ7月の利上げが視野に入る。ロシアのウクライナ侵攻が長引くなか、資源高による想定外のインフレにどう対処すべきか。景気と物価の安定へ難しい判断を迫られる。「低所得者ほど生活必需品の値上がりで最も...,日経ヴェリタス,インフレとの闘い、世界規模　ECBも英国追随で利上げへ,https://www.nikkei.com/article/DGXZQOGR033BM0T00C22A5000000/
05/17/2022,ソニーグループの自動車事業が動き出した。経営不振から復活を遂げたソニーにとって久々の大型新規事業となるだけに、その成否には注目が集まる。一方で同社の自動車参入が問うのは、「未来のクルマの価値はどこにあるのか」という根源的なテーマだ。ソニーの決断が巨大産業を揺るがそうとしている。2022年3月期の連結営業利益（国際会計基準）が初めて1兆円を突破したソニーグルー...,日経ヴェリタスセレクト,クルマに「ソニー入ってる」　生産より頭脳の深謀,https://www.nikkei.com/article/DGXZQODK0833U0Y2A500C2000000/
05/17/2022,海運業の菅原汽船グループ（広島県呉市）は洋上風力発電の建設支援事業に参入する。3月、建設場所まで大型作業船をけん引する「オフショア支援船」1隻を子会社を通じて取得した。国内の洋上風力発電の市場規模は今後10年以内に9000億円を超えるとの予測もあり、脱炭素投資の拡大に応じて追加の支援船購入も検討する。グループ中核の菅原汽船が2021年11月にオフショア支援船事業専門の子会社、SNマリンを設立し...,環境エネ・素材,菅原汽船、洋上風力の建設支援に参入　18億円で取得,https://www.nikkei.com/article/DGXZQOCC15A3Q0V10C22A4000000/
05/17/2022,飲料自動販売機の運営を手掛けるGRN（富山県高岡市）が海外事業を育成している。オーストラリアに進出したほか、中国では利用者が取り出した商品をAI（人工知能）カメラで判断し、決済する「開門機」と呼ぶ自販機を増やす。現地に向く機器や品ぞろえと、日本で培った低コストのオペレーションを組み合わせて顧客を獲得する。GRNは2015年、北陸コカ・コーラボトリング（同）から北陸3県と長野県のコカ・コーラ関連...,サービス・食品,富山のGRN、豪・アジアで自販機運営　AIカメラ活用機も,https://www.nikkei.com/article/DGXZQOCC12CWO0S2A510C2000000/
05/17/2022,【パリ=白石透冴】スウェーデンとフィンランドの北大西洋条約機構（NATO）加盟にトルコが難色を示している問題で、両国の政府高官が近くトルコの首都アンカラを訪れ、加盟に反対しないよう説得することが分かった。スウェーデン政府が明らかにした。スウェーデンとフィンランドは中立を守る方針を取ってきたが、ロシアのウクライナ侵攻を受けて相次いで加盟申請する意向を発表した。安全保障を巡る状況が激変し、加盟が必...,ウクライナ侵攻,北欧2カ国高官、トルコ訪問へ　NATO加盟を説得,https://www.nikkei.com/article/DGXZQOGR16DGV0W2A510C2000000/
05/17/2022,三井住友トラスト・アセットマネジメントは投資先の温暖化ガス排出量を2030年に19年比で半減する目標を掲げる。運用会社としての目標を明示し、株式や債券の形で投資する企業と対話して排出削減を促す。気候変動の情報開示や排出削減目標の設定が不十分な場合、取締役の選任議案に反対することも視野に入れる。議決権行使を使いながら削減を迫る。同社では指数への連動を目指すパッシブ投資が多い。脱炭素に後ろ向きな企...,ESG,投資先の排出量半減　三井住友トラスト・アセットが目標,https://www.nikkei.com/article/DGXZQOUB153JX0V10C22A5000000/
