12/02/2021,不動産関連スタートアップのリブ・サーチ（福岡市）は神戸市に拠点を開設する。不動産物件の撮影代行や間取り図の作製といったサービスを、神戸市内の不動産管理会社や仲介会社に提供する。新型コロナウイルス禍による「非接触」の浸透で、サイト上で詳細な物件情報を知りたいとの需要が高まっている。1年で100社への導入を目指す。2022年1月に、神戸市のJR三ノ宮駅から徒歩10分程度の場所にオフィスを設ける。現地...,新型コロナ,不動産物件撮影のリブ・サーチ、神戸に拠点　関西進出,https://www.nikkei.com/article/DGXZQOJC1799W0X11C21A1000000/
12/02/2021,【NQNロンドン】2日午前のロンドン株式市場で、FTSE100種総合株価指数は下落している。英国時間10時時点では、前日の終値に比べ38.15ポイント（0.53%）安の7130.53で推移している。構成銘柄の約8割が下落している。新型コロナウイルスの変異型「オミクロン型」の感染拡大への警戒感が強く、売りが優勢となっている。鉱業株と医薬品株の下げが株価指数を押し下げている。郵便大手のロイヤル・メールは約5%安。スポーツ関連小売りのJDスポーツ・ファッションの下げも目立つ。航空のインターナショナル・エアラインズ・グループ（IAG）は買われている。,ロンドン株式相場,ロンドン株10時　下落　鉱業株と医薬品株安い,https://www.nikkei.com/article/DGXZASB2IILB1_S1A201C2000000/
12/02/2021,【NQNシンガポール=秋山文人】2日の日経アジア300指数は続伸した。終値は前日比1.23%高の1703.86だった。新型コロナウイルスの変異型「オミクロン型」への警戒感が和らぎ、買いが優勢となった。変異型の米国での感染者発生を受け、前日の米国株が大幅に売られたことが警戒され、朝方は前日終値近辺で推移した。その後、アジアの取引時間帯の米ダウ工業株30種平均の先物相場が上げたことで投資家心理が改善...,アジア株概況,2日のアジア300指数　続伸、投資家心理が改善　変異型ショック和らぐ,https://www.nikkei.com/article/DGXZASFL02HLZ_S1A201C2000000/
12/02/2021,バローホールディングス（HD）傘下の食品スーパー、タチヤは2日、初の青果専門店をJR中央本線の高蔵寺駅（愛知県春日井市）構内に開業した。みかんやりんご、にんじんなど約50種を扱い売り場は約110平方メートル。精肉や鮮魚の保管設備を持たず運営コストを抑えて、青果の価格を抑える。高蔵寺駅の商業施設「アスティ高蔵寺」に出店した。仕入れた商品はその日に売り切り、保管用の冷蔵庫や電気代をなくす。「開業費用はレジと...,愛知,バローグループの食品スーパー、タチヤが初の青果専門店,https://www.nikkei.com/article/DGXZQOFD021OY0S1A201C2000000/
12/02/2021,中部経済連合会が2日発表した2021年10～12月期の中部の景況判断は景気の良しあしを示す指数（DI）がプラス0.5で、前四半期の7～9月期と比べて2.4ポイント悪化した。悪化は1年6カ月ぶり。原材料価格の上昇や半導体不足で製造業の景況感が悪化した。愛知、岐阜、三重、静岡、長野県にある中経連の会員企業661社を対象に調査し、227社から回答を得た。調査期間は10月26日～11月18日。中経連の聞き取りでは「一部の電子部品の調達難が続いており生産にも影響が出始めている」（工作機械）「原材料価格などが上昇しているが、販売価格が低下しており利益が圧迫されている」（食品）といった声があった。景気の先行きを示すDIは2022年1～3月期がプラス10.8、4～6月期はプラス20.5に改善する見通し。原材料高や部品の調達難といった懸念があるが、新型コロナウイルスの感染の落ち着きによる景気回復への期待で景況感が改善する。,中部,中部の景況感1年6カ月ぶり悪化　中経連10～12月調査,https://www.nikkei.com/article/DGXZQOFD023HB0S1A201C2000000/
12/02/2021,免税品大手のラオックスは2日、外資系投資ファンドがラオックス株の34%を取得して筆頭株主になったと発表した。親会社だった中国小売り大手の蘇寧グループの出資比率は65%から30%に下がる。同グループ傘下で訪日客需要を取り込み成長してきたが、新型コロナウイルス禍により業績は悪化している。今後は新たな株主のもとで免税品以外でも稼ぐ体制が求められる。1日に関東財務局に提出された大量保有報告書によると、蘇寧グループからラオックス株を取得したのはシンガポールの「グレニッチ・インベストメント・ホールディングズ」。目的は「質権実行に伴う保有」という。2020年末時点の出資比率は蘇寧電器集団の関連会社と、蘇寧易購集団の関連会社を合わせて約65%だった。投資ファンドは蘇寧電器集団の関連会社の持ち分を取得した。取得株式の時価総額は約50億円。残り30%について「現時点で質権の設定や譲渡に関する情報はない」（ラオックス）という。ラオックスは09年に蘇寧グループ傘下に入り、訪日客向けの免税品販売事業で成長してきた。新型コロナにより20年12月期の連結最終損益は166億円の赤字、21年1～9月期も32億円の赤字だった。訪日客需要の回復は見込めず、足元では国内消費者向けの食品・化粧品専門店を相次ぎ開いている。新たな変異型の出現など経済情勢が再び不透明となるなか、免税品に頼らない改革が必要となりそうだ。,小売り・外食,ラオックス、筆頭株主に投資ファンド　蘇寧が株一部譲渡,https://www.nikkei.com/article/DGXZQOUC025NN0S1A201C2000000/
12/02/2021,立命館アジア太平洋大学（APU、大分県別府市）とオリックス不動産、杉乃井ホテル&リゾート（別府市）は2日、「友好交流に関する協定」を結んだ。オリックス不動産などがAPUの学生の体験学習や課題解決型学習（PBL）に協力し、将来の観光産業や地域の新たな価値創造を担う人材を育てる。こうした取り組みを通じ、地域の観光や経済を活気づける。オリックスグループが運営する「別府温泉　杉乃井ホテル」で学生を受け入れ、有給型インターンシップでマーケティングやブランディングを学べるようにする。音楽やダンス、屋台イベントなどで世界の伝統芸能や文化を紹介する「マルチカルチュラル・アクティビティ」といった新たな観光コンテンツもつくり、宿泊客らに披露する。同日の協定締結式でAPUの米山裕副学長は「今回の産学連携で学生の学びが広がることを大いに期待している。3者の相互作用で社会に貢献していきたい」とあいさつ。オリックス不動産の深谷敏成社長は「基礎学習からビジネス実務まで一気通貫で体験できるなど、特長のあるカリキュラムづくりをサポートしたい」と話した。APUでは11月1日時点で、95カ国・地域からの留学生を含む5516人が学んでいる。2023年4月を目指す新学部の開設を機に、持続可能な社会の実現に向けた人材育成を強化する方針だ。杉乃井ホテルでは現在、総額400億円以上を投じる大規模リニューアルが進んでいる。,大学,学生の体験学習で連携　APUとオリックス不動産など,https://www.nikkei.com/article/DGXZQOJC014V50R01C21A2000000/
12/02/2021,幕田　圭一氏（まくた・けいいち=元東北電力社長）11月28日、心不全のため死去、86歳。連絡先は同社秘書室。お別れの会を行うが日取りなどは未定。喪主は妻、千鶴子さん。社長在任中の2004年に発生した新潟県中越地震では被災地の復旧・復興の陣頭指揮にあたった。15年に旭日大綬章を受章した。,,幕田圭一氏が死去　元東北電力社長,https://www.nikkei.com/article/DGXZQOUE02A4Z0S1A201C2000000/
12/02/2021,割安な料金で中部と各地を結ぶ高速バスの運行再開や、減便の解消が広がっている。新型コロナウイルスの新たな変異型「オミクロン型」が懸念されるが、今のところ流行が一服しており乗客は徐々に増えている。年末年始の帰省や行楽への利用を呼び込む狙いだ。岐阜乗合自動車（岐阜バス、岐阜市）は2日から、岐阜―新宿間の運行を毎日に増やした。一時運休していたが11月4日から木～日曜日に再開していた。東濃鉄道（岐阜県多治見市）も12月17日から、可児車庫（同県可児市）―東京駅間を全面再開し、昼行と夜行の毎日2往復に戻す。三重交通も12月下旬から22年1月前半の年末年始に三重県志摩市と、さいたま市大宮を結ぶ路線をはじめ三重県各地と首都圏を結ぶ一部路線を運行する。中部運輸局によると、中部の高速バス17社の乗客数は新型コロナの感染が広まって以降、19年に比べ毎月8割減の水準が続いた。だが名古屋―首都圏の路線は本来、行楽客に加えサラリーマンの出張需要も呼び込める高速バスのドル箱だ。三重県各地や名古屋と、首都圏各地などを結ぶ高速バス「あおぞらライナー」を運行する青木バス（三重県多気町）では、11月に名古屋―横浜といった区間で金曜夜や日曜夜に出発する便が満員の日もあった。「コロナが再び流行しなければ2022年春に山梨県河口湖への新路線も始めたい」（青木茂社長）と意欲を示す。大手のWILLER（ウィラー、大阪市）では11月13日からの一週間、名古屋―首都圏路線の利用者が、愛知県に厳重警戒措置が出されていた7月28日からの一週間に比べ倍増した。土日には利用者が3倍の日もある。名古屋―大阪間も同5割増だ。名鉄バス（名古屋市）でも名古屋―東京の11月の利用者は9月の2倍。同社は乗客を呼び込むため11月6日から予約券などを名鉄バスセンターで買うと、ワクチン接種証明かPCR検査の陰性証明書を提示すれば次回使える千円引券を配っている。ただ新型コロナオミクロン型の感染者が空港検疫で確認され、旅行の警戒ムードが広がる可能性もある。「大都市での有名タレントのコンサートなどがまだ本格的に再開しておらず人の行き来が限られている」（青木バス）との声もある。高速バス運行の全面再開には、まだ時間がかかりそうだ。,中部,中部～首都圏の高速バス、年末向け増便・再開,https://www.nikkei.com/article/DGXZQOFD174YU0X11C21A1000000/
12/02/2021,西日本鉄道は2日、ホテルの「西鉄イン蒲田」（東京・大田）と「西鉄イン名古屋錦」（名古屋市）をいずれも2022年1月31日で閉館し、同年3月ごろに売却すると発表した。新型コロナウイルスの影響で利用が低迷していることが理由。周辺の宿泊施設との競合で、将来的な収支改善の見通しも立たないことから売却を決めたという。売却先や金額は非公表としている。両ホテルに先立ち、21年4月に「西鉄イン心斎橋」（大阪市）をアパグループ（東京・港）に売却している。西鉄の国内宿泊主体型ホテルの稼働率（4～9月）は29.5%で、コロナ前の19年同期より47.3ポイント低くなっている。蒲田のホテルは09年に開業して客室数は130室、名古屋錦は10年の開業で、客室数は229室ある。,福岡,西鉄、東京・蒲田と名古屋錦の2ホテル売却へ,https://www.nikkei.com/article/DGXZQOJC027720S1A201C2000000/
12/02/2021,琴参バス（香川県丸亀市）は香川県の有名な観光地やうどん店を巡る期間限定の観光バスの運行を始めた。ウユニ塩湖と似ていると話題となった海水浴場「父母ケ浜」などを簡単に巡れる2種類の観光バスで、いずれも12月下旬まで運行する。観光地を巡るバスは父母ケ浜のほか、瀬戸内海が一望できる雲辺寺を訪れる。いずれもインスタ映えする写真が撮れると四国で有力な観光地で、父母ケ浜では水面に大空が映り込む合わせ鏡のような幻想的な風景で有名だ。運行期間は火曜日を除く12月26日までで、1人あたりの料金は大人が6000円、子供は3000円。料金には雲辺寺でのロープウエー代も含まれる。うどん店を巡るバスは12月25日までの期間中、火曜と土曜に運行する。高松駅を発着するバスなどで、有力うどん店「山越うどん」や「うどん本陣　山田家本店」を巡る。半日プランや終日プランなどをそろえ、大人1人あたりの料金はそれぞれ2000円、3000円。子供は大人料金の半額で、料金にはうどん店での支払いは含まれていない。,香川,うどん店や有力観光地、香川巡る期間限定バス　琴参バス,https://www.nikkei.com/article/DGXZQOCC0240F0S1A201C2000000/
12/02/2021,熊本県は2日、南関町の養鶏場で高病原性鳥インフルエンザの陽性を確認したと発表した。簡易検査で判明した。確定すれば養鶏場での発生は秋田、鹿児島、兵庫に次いで今季4県目となる。熊本県によると、今回の養鶏場では肉用鶏約6万7千羽を飼育している。遺伝子検査で陽性なら、殺処分を始める。〔共同〕,熊本,熊本・南関町で鳥インフルの疑い　確定なら今季4県目,https://www.nikkei.com/article/DGXZQOJC02A8Z0S1A201C2000000/
12/02/2021,徳島県は新型コロナウイルスの「第6波」に備え、保健・医療体制を強化する。最大確保病床を従来の234床から260床に増やすほか、無症状や軽症患者を受け入れる宿泊療養施設も400室から450室に拡充する。自宅療養者の電話診断などに対応する協力医療機関も、現状の211から上積みを目指す。県はこのほどまとめた「保健・医療提供体制確保計画」の中で、今後の感染拡大時の療養者数を最大で605人、必要病床数を256床と想定した。これに対応するため、入院が必要な患者を受け入れる臨時医療施設を12月上旬にも徳島市内に整備し、全体で260床を確保する。徳島市を中心に5カ所ある宿泊療養施設も、運営効率を高めるなどして、使える部屋を増やす。このほか県は新型コロナウイルスの新たな変異型「オミクロン型」の検査体制を強化するため、県立保健製薬環境センター（徳島市）に導入した最新装置を使い、検体の全遺伝情報（ゲノム）の解析も始める。,徳島,徳島県、医療確保計画を策定　コロナ病床260に増床,https://www.nikkei.com/article/DGXZQOCC0157D0R01C21A2000000/
12/02/2021,四国電力は2日、伊方原子力発電所3号機（愛媛県伊方町）の原子炉を起動し運転を再開させたと発表した。伊方3号機の再稼働を巡っては、保安規定違反などで日程が延期となっていたが、地元自治体の了承を得て約2年ぶりの再稼働となる。6日から送電を始め、2022年1月4日には通常運転を始める。四国電は「引き続き安全確保を最優先に作業を進める」とコメントした。伊方3号機は19年末に定期検査に入った。20年1月に広島高裁が運転差し止めを決めたが21年3月の異議審で再稼働が認められた。四国電は同年10月の運転再開を目指していたが、宿直中の社員の無断外出による違反などがあって延期となっていた。四国電の長井啓介社長は「冬場に向けて伊方3号機が戦列に加わるのは非常に力強い」と話しており、基幹電源と位置付ける伊方3号機の再稼働で冬場の電力需要の高まりに備える。,環境エネ・素材,四国電力、伊方原発3号機の運転再開　,https://www.nikkei.com/article/DGXZQOCC025EE0S1A201C2000000/
12/02/2021,伊予銀行といよぎん地域経済研究センターが調査した「企業のSDGs（持続可能な開発目標）への取り組み状況」によると、2020年、21年に取り組みの検討を始めた企業が回答企業の各34%強と、合わせて7割弱を占めた。今後、取引先などからSDGsへの取り組みを求められる機会が増えるとの回答は約67%。他社との取引関係などもSDGsへの取り組みの動機づけになっていると見ている。調査は愛媛県内の128社からの回答をまとめた。このうち約95%が従業員300人以下の中堅・中小企業で、調査時期は21年9～10月。取り組みを始めた目的を複数回答で聞いたところ、約78%が「企業のイメージ向上」、59%が「従業員の意識改革、モチベーション向上」と答えた。社内のSDGsに関する浸透度を尋ねると、管理職以上に比べ一般社員への浸透が遅れており、約27%の企業が一般社員はSDGsの「存在を知らない、言葉を聞いた程度」と回答。20年以降に取り組みを始めた企業に限ると32%強に達した。,SDGs,SDGsの取り組み、7割の企業20年以降開始　伊予銀調べ,https://www.nikkei.com/article/DGXZQOJB0231E0S1A201C2000000/
12/02/2021,愛知県を地盤とする地方銀行（第二地銀）の愛知銀行と中京銀行が経営統合する方向で最終調整していることが2日、分かった。2022年にも持ち株会社をつくる考えで、数年後の合併も検討している。経営基...,地域金融,愛知銀と中京銀、22年にも経営統合へ,https://www.nikkei.com/article/DGXZQOFD02BWG0S1A201C2000000/
12/02/2021,自民党は2日、党本部で子ども政策の司令塔となる「子ども庁」に関する基本方針の原案について議論した。基本方針を議論する党の「こども・若者」輝く未来実現会議の橋本岳事務局長は会合後、記者団に「総じて反対の人はいなかった」と述べた。政府は党の意見を踏まえ年末までに基本方針を策定する。原案には子ども庁を内閣府の外局に設置し他省庁への勧告権をもつ専任閣僚を置くことを盛り込む。「外国人の子どもも支援すべきだ」「勧告権は機能しない例もある」といった意見が挙がったという。,政治,子ども庁基本方針案、自民党で議論　反対少なく,https://www.nikkei.com/article/DGXZQOUA02AN20S1A201C2000000/
12/02/2021,政府は新型コロナウイルスワクチンの3回目接種について、米モデルナ社製の在庫を活用して時期を前倒しする方針だ。1、2回目用の同社製ワクチンは1000万回分超の在庫がある。まず2022年1月に予定する高齢者らの追加接種に使えるようにし、2回目接種後「原則8カ月」を待たずに3回目を接種できる体制をめざす。岸田文雄首相が6日に予定する所信表明演説の原案に、追加接種の時期の前倒しを盛り込んだ。2回目から「...,新型コロナ,首相、3回目接種前倒し表明へ　モデルナ在庫を活用,https://www.nikkei.com/article/DGXZQOUA027O00S1A201C2000000/
12/02/2021,【カイロ=久門武史】反政府勢力との戦闘が続くエチオピアで非常事態宣言から2日で1カ月となった。アビー首相が軍を前線で指揮して対決姿勢を強めるなど、さらなる戦闘激化の懸念が高まっている。国連によると940万人が食糧危機に陥っており、日米欧などは相次いで自国民に退避を求める事態になっている。エチオピア首相府は1日、北部ティグレ州を支配する反政府勢力のティグレ人民解放戦線（TPLF）から、世界遺産の岩窟教会群で知られるアムハラ州のラリベラを政府軍側が奪還したと発表した。TPLFが8月に支配下に置いていた。TPLFは10月にティグレ州に隣接するアムハラ州の交通の要衝コンボルチャなどを制圧し、首都アディスアベバ方面に向け南下してきた。11月下旬には首都の北東約220キロメートルにある町シェワ・ロビットを制圧したと主張した。首相府は12月1日、この町も奪還したと表明しており、連邦政府軍が反転攻勢を強めているもようだ。エチオピア北部では長引く戦闘で人道危機が深まっている。国連の世界食糧計画（WFP）は11月26日、ティグレ州とアムハラ州を中心に推計940万人が深刻な食糧難に陥っていると発表した。「進行中の戦闘のためエチオピア北部で人道食糧支援を必要とする人の数が急増した」と警鐘を鳴らした。ティグレ州へ物資を届けるための輸送路が戦闘で閉ざされているという。国連や米国などが停戦を重ねて求めているが、功を奏する気配はない。連邦政府が11月2日に非常事態を宣言したのを受け、在エチオピア米大使館は「治安情勢が極めて流動的だ」として自国民に退避を呼び掛けた。英国外務省も11月24日の声明で「近日中に戦闘が首都アディスアベバに接近する恐れがある」として自国民に直ちに出国するよう求めた。ドイツやフランス、トルコも11月下旬に相次いで自国民に出国を勧告した。日本政府も民間定期便が運航している間に国外に退避するよう在留邦人に求めている。岸田文雄首相は11月27日、外務・防衛両省の調査チームを隣国ジブチに派遣したと表明した。自衛隊機で現地に住む邦人を退避させる場合に備える。連邦政府とTPLFとの戦闘は2020年11月に始まった。TPLFは今年11月、南西部が拠点のオロモ解放戦線など反政府勢力8派と同盟を結んだと発表し、アビー首相の退陣を求めている。アビー氏は11月26日、迷彩服姿で山岳地帯を訪れる自身の動画をツイッターで公開した。反政府勢力から一部地域を奪還したと主張し「我々は勝利する」と強調した。アビー氏は地元テレビに「敵を葬るまで方針を変えることはない」とも述べ、対決を訴えている。エチオピアは04年から19年までは年10%前後とアフリカ随一の経済成長が続き、労働集約型の縫製業などで外資企業の進出が相次いだ。人口も1.1億人とアフリカで2番目に多く有望市場とみなされてきたが、1年以上に及ぶ反政府勢力との戦闘が見通しに暗い影を落としている。,中東・アフリカ,エチオピア、940万人が食糧難　日米欧など退避勧告　,https://www.nikkei.com/article/DGXZQOGR30DU70Q1A131C2000000/
12/02/2021,群馬県は2日、新型コロナウイルスの新たな変異型「オミクロン型」の国内2例目の感染者と同じ航空機に搭乗していた濃厚接触者114人のうち、3人が県内在住者だと発表した。また1日に5人が県内滞在者だと発表した茨城県は2日、全員が県内の宿泊療養施設に入所したことを明らかにした。群馬県によると3人は11月27日に成田空港に到着後、県内で自宅待機していた。1日夜に厚生労働省から濃厚接触者について連絡があり、3人は群馬県の宿泊療養施設に移った。3人は入国時の検査では陰性で、症状は出ていないという。宿泊療養施設ではフロアをわけて既存の入所者と接触しないようにしている。入国後2週間（11日まで）の健康観察と、2日に1回のPCR検査を実施する。茨城で濃厚接触が確認された5人も成田空港の検疫時点では陰性で、体調不良などを訴えている人は2日時点でいないという。3日以降に通常のPCR検査をする。政府は1日、国内2例目にあたるオミクロン型の感染者について公表。11月27日に成田空港から入国し、ペルーに滞在歴のある20代の男性だと明らかにした。この男性と同じ航空機に搭乗していた114人を濃厚接触者として扱うことを決め、各自治体に通知した。,新型コロナ,群馬県、3人が「オミクロン型」の濃厚接触者,https://www.nikkei.com/article/DGXZQOCC029QH0S1A201C2000000/
