11/26/2021,第26回国連気候変動枠組み条約締約国会議（COP26）が終了した。工業化前からの世界の気温上昇を1.5度に抑える目標達成には洋上風力発電がカギとなる。現状では世界の設備容量は35ギガ（ギガは10億）ワットで原発35基に相当し英国とドイツで約半分を占める。主要機器も発電事業者もデンマーク、ドイツ等の欧州勢が中心である。アジアでは中国が猛追するが、新たに台湾と日本が注目されている。台湾は2019年に...,マーケットニュース,日の丸風車を主力産業に,https://www.nikkei.com/article/DGXZQOUB224MB0S1A121C2000000/
11/26/2021,愛知県弥富市の市立中学校で3年の男子生徒（14）が刺されて死亡した事件で、逮捕された同学年の男子生徒（14）が事件2日前の今月22日に凶器の包丁を入手していたことが26日、捜査関係者への取材で分かった。事件があった24日は入手後最初の登校日で、県警は綿密に計画を練っていたとみて詳しい経緯を調べている。捜査関係者によると、男子生徒はインターネット通販で購入したと供述。周囲に知られないようかばんに隠して校内に持ち込んだとみられる。「（被害生徒に）嫌なことをされ、恨みを募らせていた」などとも話しており、県警は他の生徒にも話を聴くなどして供述内容の裏付けを慎重に進める。県警によると、被害生徒は逮捕された男子生徒と同じ小学校に通い、中2の時も同じクラスだった。中3では違うクラスに在籍していた。男子生徒は24日午前8時ごろ、校内の廊下で刃渡り約20センチの包丁で被害生徒を刺したとして、殺人未遂容疑で現行犯逮捕され、25日に殺人容疑で送検された。この中学では他の教室に入ってはいけない決まりがあり、男子生徒は教室にいた被害生徒を廊下に呼び出した可能性がある。2人が通う中学では、生徒の多くがリュックサックで通学。男子生徒もリュックを背負って登校していたとみられる。〔共同〕,事件・司法,事件2日前に包丁入手　愛知の中3刺殺、容疑の生徒,https://www.nikkei.com/article/DGXZQOUF260B10W1A121C2000000/
11/26/2021,厚生労働省は新型コロナウイルス感染による労働災害について、企業の労災保険料の負担を軽減する特例措置を講じる方針だ。原則として労災が多く発生する企業の保険料は増額されるが、コロナで労災と認定されたケースは除外する。26日午後の労働政策審議会（厚労相の諮問機関）の部会に制度改正案を示し、正式決定する。労災保険は従業員が仕事でケガをしたり、病気になったりした場合に治療費や休業補償などが給付される仕組み...,新型コロナ,コロナ労災、保険料増額せず　厚労省が軽減措置,https://www.nikkei.com/article/DGXZQOUA2619C0W1A121C2000000/
11/26/2021,欧州で新型コロナウイルスの感染が再び急拡大している一方、秋に西欧諸国の中で最悪の感染状況に見舞われていた英国では、ワクチンの追加接種（ブースター接種）の効果で事態が好転の兆しが見えている。欧州大陸では新規感染者数や入院患者数が最近急増しているが、ブースター接種をいち早く開始した英国は、欧州で最悪という状況を脱しつつある。政府発表のデータをフィナンシャル・タイムズ（FT）が分析したところ、日別...,新型コロナ,[FT]3回目接種で明暗　加速した英、出遅れた欧州大陸,https://www.nikkei.com/article/DGXZQOCB260Q60W1A121C2000000/
11/26/2021,【NQN香港=須永太一朗】26日の香港株式相場は反落して始まった。ハンセン指数の始値は前日比237.48ポイント（0.95%）安の2万4502.68で、その後は2%近く下げる場面があった。アジア時間26日の米株価指数先物の下落を受け、香港市場でも幅広い銘柄に売りが出ている。南アフリカで感染が拡大している新型コロナウイルスの新たな変異ウイルスが、同国からの渡航者により香港域内で確認されたことも投資家...,アジア株概況,香港株寄り付き　反落　米株先物安、域内のコロナ変異ウイルス確認で,https://www.nikkei.com/article/DGXZASS0IHK01_W1A121C2000000/
11/26/2021,26日の東京株式市場で日経平均株価は下げ幅を一時、前日終値に比べて700円超に拡大した。日経平均は下値の目安とされていた75日移動平均（2万8953円、25日終値時点）や200日移動平均（2万8945円、同）を下回った。日本時間早朝に南アフリカで新型コロナウイルスの変異ウイルスが検出されたと伝わった。世界でコロナの感染状況が悪化して経済活動の制限が強まるとの懸念から投資家がリスク回避に動いている。〔日経QUICKニュース（NQN）〕,国内株概況,日経平均　一時700円超安　75日線、200日線を下回る,https://www.nikkei.com/article/DGXZASFL26HQX_W1A121C2000000/
11/26/2021,フランスのベラン保健相は25日、新型コロナウイルスワクチンの追加接種について、3回目の対象を18歳以上のすべての成人に拡大する方針を表明した。これまでは原則65歳以上が対象だった。飲食店の利用時などに必要な接種証明の有効期限も接種完了から7カ月とする。欧州で感染が再拡大するなか、対策を強化する。3回目の接種は2回目から5カ月が経過したすべての成人に実施する。ベラン氏は現時点ではロックダウン（都市封鎖）などの移動制限の導入は想定していないと説明し、接種の促進によって経済活動を維持したい考えを示した。ワクチンの接種証明は2022年1月中旬以降、2回目接種から7カ月以上たった成人は3回目を接種しなければ無効になると定めた。接種証明の代わりとなる陰性証明についても、有効期間を72時間から24時間に短縮する。接種証明の提示が義務付けられた飲食店や長距離列車などを未接種者が利用するハードルはさらにあがる。ベラン氏は記者会見で「感染拡大の第5波に見舞われている。夏（の第4波）より長く強くなることは明らかだ」と警鐘を鳴らした。ワクチンを接種した人の重症化率は未接種者の10分の1にとどまると効果を強調し、接種を促した。5～11歳の子どもに接種対象を広げることを検討しているとも明らかにした。欧州では新型コロナの感染が再拡大している。オーストリアは都市封鎖措置の再導入に踏み切り、22年2月から接種を義務化する方針も示した。欧州連合（EU）の公衆衛生専門機関も24日の報告書で、18歳以上の追加接種を推奨した。ドイツも18歳以上の国民全員に追加接種を呼びかけている。,新型コロナ,フランス、18歳以上に3回目接種　都市封鎖回避へ,https://www.nikkei.com/article/DGXZQOCB261F50W1A121C2000000/
