03/19/2022,女子ゴルフの国内ツアー第3戦、Tポイント×ENEOSトーナメントは19日、鹿児島高牧CC（6419ヤード、パー72）で前日サスペンデッドとなった第1ラウンドの残りが行われ、上田桃子が16番から上がり3ホール連続バーディーを決めて67、5アンダーとして単独首位に立った。上田は2週前のHSBC女子世界選手権（シンガポール）に出場、今大会が今季国内初戦。1打差の2位に西村優菜と吉田優利が並び、さらに1打差の4位に堀琴音がつけた。2アンダーの横峯さくらは6人の5位グループ。前年優勝の小祝さくらはイーブンパーの16位、開幕戦のダイキン・オーキッド女子優勝の西郷真央は1オーバーで29位発進。稲見萌寧はこの日の再開前に体調不良で棄権した。第1Rを完了後、そのまま第2Rを行っている。,スポーツ,上田が単独首位発進　Tポイント女子ゴルフ第1R,https://www.nikkei.com/article/DGXZQODH190OU0Z10C22A3000000/
03/19/2022,岸田文雄首相は19日朝、インド・カンボジア訪問のため政府専用機で羽田空港を出発した。インドの首都ニューデリーで同日午後、モディ首相との首脳会談に臨む。ロシアのウクライナ侵攻について協議する。出発に先立ち、首相は羽田空港で記者団に「ウクライナ侵略は国際法違反の暴挙だ」と指摘した。「力による一方的な現状変更をインド太平洋で許してはならない。国際社会との結束をしっかり確認したい」と話した。21日に帰国する。インドはロシアと軍事、経済で協力関係にあり、国連安全保障理事会でロシアへの非難決議の採決を棄権した。首相は首脳会談を通じロシアへの経済制裁の必要性などを訴える。インドは日本、米国、オーストラリアと4カ国の枠組み「Quad（クアッド）」に参加する。中国を念頭に「自由で開かれたインド太平洋」実現に向けた協力を確かめる。日本で5月にも開く予定の首脳会議に向け調整を進める。首相は19日に官民の経済フォーラムに出席し、官民で5兆円の投資目標を表明する。直接投資の金額や進出企業数を増やすと説く。交通インフラの整備などを進め日本企業の工場誘致を後押しする。安全保障分野では2020年に署名した自衛隊とインド軍が食料や燃料を融通し合う「日印物品役務相互提供協定（ACSA）」の推進を確認する。外務・防衛の担当閣僚協議（2プラス2）の早期開催も申し合わせる。脱炭素に取り組むエネルギー協力の文書にも署名する。デジタルやヘルスケア部門でも協力を示し合わせる。首相は20日にはカンボジアの首都プノンペンに移動しフン・セン首相と面会する。カンボジアは今年、東南アジア諸国連合（ASEAN）の議長国を務める。ASEANはベトナムなどロシアと関係が深い加盟国を含む。ロシアに制裁措置をとる日本や米欧への協調を呼びかける。カンボジアとの2国間関係も強化する。港湾といった重要インフラへの政府開発援助（ODA）の支援拡大を打ち出す。,岸田政権,首相「力による変更許さず」　インドへ出発、首脳会談へ,https://www.nikkei.com/article/DGXZQOUA18AJO0Y2A310C2000000/
03/19/2022,【ウィーン=共同】新型コロナウイルス感染拡大の影響で延期された核兵器禁止条約第1回締約国会議が6月21～23日にオーストリアの首都ウィーンで開催されることが18日、分かった。締約国会議の議長を務めるオーストリア外務省のクメント軍縮局長がツイッターで発表した。ウクライナ情勢が深刻化し、ロシアによる核兵器使用の懸念も指摘される中、非人道的被害の回避を訴え、廃絶を目指す国際社会の意思を確認する方針だ。クメント氏は「核軍縮と多国間協調の責任が、これまでになく重要だ」と呼び掛けた。核禁止条約は、核兵器を非人道兵器とし、全面的に違法化した初の国際条約。唯一の戦争被爆国である日本は条約に参加していない。第1回締約国会議へのオブザーバー参加を求める声は強いが、日本政府は消極的な姿勢を変えていない。軍縮筋によると、条約不参加の国の議員らからも会議参加の希望が相次いでいるという。会議前日の6月20日には、核禁止条約制定の原動力となり、日本も過去3回参加した「核兵器の非人道性に関する国際会議」を開催することが調整されているという。第1回締約国会議は当初1月に開催予定だったが、核拡散防止条約（NPT）再検討会議を1月に延期する調整が進み、3月に変更。新型コロナの影響で参加できなくなる締約国が出る恐れがあることなどを踏まえて、再延期されていた。,ヨーロッパ,核禁止条約の第1回会議、6月にウィーンで開催,https://www.nikkei.com/article/DGXZQOCB190S50Z10C22A3000000/
03/19/2022,岩手県沖の陸側プレート内部で18日夜に地震が発生し、同県野田村で震度5強の揺れを観測した。16日夜に宮城県と福島県で最大震度6強を観測した地震は海側プレート内部で起き、震源は約260キロ離れている。気象庁は「2つの地震を結びつける原因は考えにくい」としている。18日夜の地震は午後11時25分ごろに発生した。同庁によると震源地は岩手県沖で深さは約18キロ。地震の規模はマグニチュード（M）5.6と推...,災害・気象,岩手で震度5強、16日の地震との関連「考えにくい」,https://www.nikkei.com/article/DGXZQOUE18ECY0Y2A310C2000000/
03/19/2022,【メサ（米アリゾナ州）=共同】米大リーグ、カブスは18日、プロ野球広島からポスティングシステムを利用した鈴木誠也外野手（27）を5年契約で獲得したと発表した。背番号は27。AP通信によると総額8500万ドル（約101億2千万円）で、日本から移籍時の野手で最高額の契約となった。広島への譲渡金は1462万5千ドル（約17億4千万円）。鈴木はキャンプ地のアリゾナ州メサで入団記者会見に臨み「すごくうれしい気持ち。不安はあるが、初めての環境で興奮している。楽しみの方が強いかもしれない」と話した。会見後は早速チームに合流し、打撃練習では何度も柵越えを披露した。AP通信によると、契約金は500万ドルで年俸は今季が700万ドル、来季が1700万ドル、2024年が2千万ドル、25、26年がともに1800万ドルで、全球団へのトレード拒否権がある。鈴木は東京・二松学舎大付高から13年にドラフト2位で広島入り。昨年は東京五輪で4番打者を務めて金メダルを獲得し、シーズンでは首位打者と最高出塁率のタイトルに輝いた。プロ通算は902試合出場で打率3割1分5厘、182本塁打、562打点。,スポーツ,鈴木誠也「すごくうれしい」　カブス入団会見で語る,https://www.nikkei.com/article/DGXZQOKC190BB0Z10C22A3000000/
03/19/2022,【ロサンゼルス=共同】男子ゴルフの世界選手権シリーズ、デルテクノロジーズ・マッチプレー（23～27日）は18日にエントリーが締め切られ、世界ランキング11位の松山英樹が欠場することになった。同60位の金谷拓実は出場する。松山は今月上旬、フロリダ州で開催されたアーノルド・パーマー招待の大会中に首から肩甲骨辺りに痛みを発症、10日に開幕したプレーヤーズ選手権では「（症状は）良くはなっていない。フルスイングはまだできない」と話し、第1ラウンド開始前に棄権した。松山が2連覇を目指す今季メジャー初戦、マスターズ・トーナメント（米ジョージア州オーガスタ）は4月7日に開幕する。,スポーツ,松山英樹、世界選手権マッチプレーを欠場　金谷は出場,https://www.nikkei.com/article/DGXZQOKC190N40Z10C22A3000000/
