03/15/2022,女子ゴルフの14日付世界ランキングが発表され、畑岡奈紗は8位、笹生優花は9位で両者が入れ替わった。古江彩佳は一つ上げて15位、稲見萌寧は二つ下げて20位。1位高真栄（韓国）、2位ネリー・コルダ（米国）、3位リディア・コ（ニュージーランド）は変わらなかった。〔共同〕,スポーツ,畑岡奈紗8位、笹生優花9位　女子ゴルフ世界ランキング,https://www.nikkei.com/article/DGXZQOKC1510L0V10C22A3000000/
03/15/2022,【テンピ（米アリゾナ州）=共同】米大リーグで昨季のア・リーグ最優秀選手に輝いたエンゼルスの大谷翔平が14日、アリゾナ州テンピでキャンプ初日を迎え、投打の「二刀流」で5年目へ向けて始動した。青空の下でキャッチボールをこなし、打者として臨んだフリー打撃では左中間へ大きな打球を飛ばすなど、昨季リーグ3位の46本塁打をマークした持ち前のパワーを初日から発揮した。練習の合間には笑顔も見られた。キャンプは労使が対立した影響で約1カ月遅れて始まり、メジャーを代表する選手となった大谷の一挙手一投足をファンが熱心に見守った。今季は5年目で初となる開幕投手への期待も高く、オープン戦で使用するメイン球場の正面入り口には昨年に引き続いて大谷の顔写真が掲げられるなど、注目の高さは相変わらずだった。オープン戦は17日から始まり、エンゼルスは18日（日本時間19日）にアスレチックスと初戦を行う。シーズンは4月7日（同8日）に開幕する。,スポーツ,二刀流大谷、5年目へ始動　打撃練習でパワー発揮,https://www.nikkei.com/article/DGXZQOKC150YR0V10C22A3000000/
03/15/2022,15日前場寄り付きの東京株式市場で日経平均株価は反落で始まった後に上げに転じるなど、前日終値（2万5307円）を挟んで一進一退の展開になっている。前日の米市場では長期金利の上昇を受けてハイテク株が大幅に下落しており、東京市場でも値がさハイテク株の一角に売りが先行。一方で原油安や円安進行は相場の支えになっている。米連邦公開市場委員会（FOMC）を控えて米長期金利が上昇しており、前日の米株式市場ではハイテク株比率の高いナスダック総合株価指数が2%を超える下落となった。東京市場でも値がさの東エレクやエムスリーなどに売りが出て相場の重荷になっている。ロシアとウクライナは14日に4回目の停戦協議をオンライン形式で実施したが、両国の主張の溝が埋まらず中断された。15日にも再開する見込みだが、ウクライナ情勢をめぐる不透明感は続いている。売り一巡後は買いも入った。前日の米市場ではWTI（ウエスト・テキサス・インターミディエート）で期近の4月物が一時1バレル100ドルを割り込むなど、大幅な下落となった。最近は原油高が企業のコスト上昇や個人の消費意欲の減退につながるとの見方が強まっていただけに、過度な不安が後退した。外国為替市場では円相場が5年2カ月ぶりに1ドル=118円台まで下落。輸出採算の改善につながるとの見方からトヨタやホンダなど輸出関連株の一角には物色が向かった。JPX日経インデックス400と東証株価指数（TOPIX）は堅調に推移している。ファストリやソフトバンクグループ（SBG）が売られている。INPEXやJFEも下落している。半面、MS&ADや千葉銀が高い。資生堂や板硝子、ミネベアも上昇している。〔日経QUICKニュース（NQN）〕,国内株概況,東証寄り付き　一進一退　米金利の上昇重荷、原油安は支え,https://www.nikkei.com/article/DGXZASS0ISS11_V10C22A3000000/
03/15/2022,15日前場寄り付きの東京株式市場で日経平均株価は反落で始まった後に上げに転じるなど、前日終値（2万5307円）を挟んで一進一退の展開になっている。前日の米市場では長期金利の上昇を受けてハイテク株が大幅に下落しており、東京市場でも値がさハイテク株の一角に売りが先行。一方で原油安や円安進行は相場の支えになっている。米連邦公開市場委員会（FOMC）を控えて米長期金利が上昇しており、前日の米株式市場ではハイテク株比率の高いナスダック総合株価指数が2%を超える下落となった。東京市場でも値がさの東エレクやエムスリーなどに売りが出て相場の重荷になっている。ロシアとウクライナは14日に4回目の停戦協議をオンライン形式で実施したが、両国の主張の溝が埋まらず中断された。15日にも再開する見込みだが、ウクライナ情勢をめぐる不透明感は続いている。売り一巡後は買いも入った。前日の米市場ではWTI（ウエスト・テキサス・インターミディエート）で期近の4月物が一時1バレル100ドルを割り込むなど、大幅な下落となった。最近は原油高が企業のコスト上昇や個人の消費意欲の減退につながるとの見方が強まっていただけに、過度な不安が後退した。外国為替市場では円相場が5年2カ月ぶりに1ドル=118円台まで下落。輸出採算の改善につながるとの見方からトヨタやホンダなど輸出関連株の一角には物色が向かった。JPX日経インデックス400と東証株価指数（TOPIX）は堅調に推移している。ファストリやソフトバンクグループ（SBG）が売られている。INPEXやJFEも下落している。半面、MS&ADや千葉銀が高い。資生堂や板硝子、ミネベアも上昇している。〔日経QUICKニュース（NQN）〕,マーケット,日経平均、前日終値を挟み一進一退,https://www.nikkei.com/article/DGXZQOUB00004_V10C22A3000000/
03/15/2022,ボーガンとも呼ばれるクロスボウ（洋弓銃）の所持を原則禁止し、都道府県公安委員会の許可制とする改正銃刀法が15日、施行された。所持は射撃競技や動物麻酔などの使用目的に限られ、現所有者は施行日から半年以内に許可を申請するか、廃棄しなければならない。許可を受けないと持っているだけで違法となり、不法所持や目的外使用には3年以下の懲役または50万円以下の罰金が科せられる。兵庫県宝塚市で2020年6月、クロスボウで4人が殺傷された事件などを背景として規制が検討され、21年6月に改正法が成立した。警察庁によると、全国の警察は21年からウェブサイトなどで改正内容の周知を始め、廃棄希望者から無償で回収を進めており、今年2月15日時点で計2391丁を引き取った。購入時の許可は必要なく、インターネット上でも入手が可能で、実際の所有者数や流通量は分かっていない。クロスボウは、弓を取り付けたライフル銃のような形態で、弦を固定し、引き金を引いて矢を発射する。改正法は、人の命に危険を及ぼす威力があるものを規制対象としており、警察庁の調査で市販品のほとんどが該当した。18歳未満は所持できず、許可は3年ごとに更新し、講習を義務付ける。販売業者も、購入者の許可証を確認しなければ販売できない。クロスボウを使った事件の摘発は10～20年に37件。このうち殺人が4件、殺人未遂が6件あった。〔共同〕,社会・調査,クロスボウ原則所持禁止　改正銃刀法施行、許可制に,https://www.nikkei.com/article/DGXZQOUF150G00V10C22A3000000/
03/15/2022,タス通信などによると、ロシアの主要テレビ「第1チャンネル」で14日夜、ニュース番組「ブレーミャ」の生放送中に女性がキャスターの背後で「戦争をやめて」などと大書された紙を掲げるハプニングがあった。ロシアのウクライナ侵攻に反対する抗議行動とみられる。通信アプリに投稿された映像によると、女性はテレビカメラに向かい、英語で「NO WAR」（戦争反対）、ロシア語で「プロパガンダを信じるな」などと書かれた紙を広げた。タスは警察筋の話として、女性が同テレビ局の社員で、身柄を拘束されて警察で取り調べを受けたと伝えた。ロシア軍の活動を侮辱する行為として処罰される可能性があるという。ロシアでは規制当局がウクライナでの軍事作戦を「侵攻」や「戦争」と表現しないようメディアに求め、ウェブサイトからの削除を指示している。（共同）,ウクライナ侵攻,生放送で「戦争やめて」　ロシアのTVで女性が紙掲げる,https://www.nikkei.com/article/DGXZQOGN150F10V10C22A3000000/
03/15/2022,15日の東京株式市場で日経平均株価は反落して始まった。始値は前日比79円32銭安の2万5228円53銭。前日の米市場では長期金利の上昇を受けてハイテク株が大幅に下落しており、東京市場でも値がさハイテク株の一角に売りが出ている。〔日経QUICKニュース（NQN）〕,国内株概況,日経平均、反落で始まる　値がさハイテク株に売り,https://www.nikkei.com/article/DGXZASFL15HF3_V10C22A3000000/
