03/12/2022,【ロサンゼルス=共同】米南部テキサス州で昨年9月に施行された人工妊娠中絶をほぼ禁じる州法を巡り、州最高裁は11日、中絶手術を行う医療機関が求めていた効力差し止めを事実上認めない判断を示した。同法は継続する見通しとなった。米メディアが伝えた。州法が禁じるのは、妊娠6週前後とされる胎児の心拍確認後の中絶で、多くの女性が妊娠に気付かない時期と言われる。近親相姦や性的暴行による妊娠も例外としておらず「全米で最も厳しい」内容とされる。州法の施行後、周辺州の医療機関ではテキサス州から訪れる患者が増加。インターネットなどによる中絶薬の注文も増えているという。同法には中絶に関わった医療従事者らを一般市民が訴えて勝訴すれば報奨金を受け取れるとの規定があり、医療機関側は州当局者に中絶禁止法の執行を巡る責任があるとしたが、州最高裁はこの主張を退けた。妊娠中絶は米世論を大きく二分するテーマ。連邦最高裁は、妊娠15週より後の中絶を原則禁じた南部ミシシッピ州法の合憲性について夏ごろまでに判断を示す見通しで、中絶を合憲とした1973年の歴史的な判決が覆る可能性がある。,北米,米中絶禁止法継続へ　南部州最高裁、停止認めず,https://www.nikkei.com/article/DGXZQOGN1233M0S2A310C2000000/
03/12/2022,2年ぶりの大阪開催となる大相撲春場所が13日にエディオンアリーナ大阪で始まる。先場所で3度目の優勝を果たし、新大関で臨む御嶽海が最大の注目。2場所ぶりの賜杯を狙う横綱照ノ富士や新関脇阿炎らを中心とした白熱の優勝争いが期待される。12日は会場で土俵祭りが営まれ、日本相撲協会の八角理事長（元横綱北勝海）や審判部の親方衆らが出席。15日間の安全を祈願した。2年前は新型コロナウイルスの感染拡大により史上初の無観客開催だったため、観客を入れての浪速の土俵は3年ぶりとなる。春場所の高島担当部長（元関脇高望山）は「しっかりとしたいい相撲内容を見せて、お客さんに感動していただけたら大変ありがたい」と力士の奮闘を願った。昨年の春場所は新型コロナ禍で開催地が東京に変更された。今場所の観客上限は定員の約75%に当たる約5600人となる。〔共同〕,新型コロナ,新大関・御嶽海に注目　春場所、13日開幕,https://www.nikkei.com/article/DGXZQOKC123480S2A310C2000000/
03/12/2022,バスケットボールの第97回天皇杯全日本選手権（日本バスケットボール協会主催、共同通信社共催）は12日、さいたまスーパーアリーナでBリーグ1部（B1）勢同士の決勝が行われ、川崎が82-72で千葉Jに勝ち、2大会連続5度目の優勝を果たした。川崎は序盤から3点シュートを高確率で決め、藤井が前半だけで17得点するなど52-33と19点差をつけて折り返し。後半は千葉の追い上げを受けたが、逃げ切った。〔共同〕,スポーツ,全日本バスケ、川崎が2連覇　5度目の優勝,https://www.nikkei.com/article/DGXZQOKC1232N0S2A310C2000000/
03/12/2022,北朝鮮による拉致被害者家族会の前代表、飯塚繁雄さんのお別れ会が12日、都内で開かれた。出席した岸田文雄首相は拉致問題解決に向けて「自ら先頭に立ち、全力で取り組む」と決意を示した。首相は飯塚氏の活動について「多くの人の心を動かし、拉致問題の早期解決を求める国際社会の声の高まりを生み出した」と語った。飯塚氏は2021年12月、83歳で死去した。,政治,首相、拉致問題解決へ「先頭に立つ」飯塚さんお別れの会,https://www.nikkei.com/article/DGXZQOUA1228R0S2A310C2000000/
03/12/2022,（東）　（西）輝　1-0一山錦木0-0荒篤天空1-0栃心豊山3-5千国千丸0-1琴勝琴恵4-5千大妙義2-3照強志摩4-2碧山翔猿0-1若元千翔5-4佐海高安15-5隠岐北富1-0琴若宝富3-1石浦霧馬1-3遠藤隆勝4-3明生阿武3-2阿炎若景4-0玉鷲逸城6-13御嶽宇良2-3貴景正代7-10大栄照富3-0豊昇,スポーツ,大相撲春場所中入り後取組・初日,https://www.nikkei.com/article/DGXZMSX000S01_R10C22A3000000/
03/12/2022,第40回中山牝馬ステークス（12日・中山11R1800メートル芝16頭、G3）15番人気の伏兵クリノプレミアム（松岡正海騎乗）が1分46秒8で優勝し、重賞初制覇を飾った。中団の外を折り合いよく進んだクリノプレミアムが、最後の直線で力強く抜け出した。12番人気のアブレイズが1/2馬身差の2着に食い込み、人気薄同士の決着となる波乱。1番人気のミスニューヨークは狭いスペースを割って伸びたが、さらに首差の3着だった。払戻金は単勝が9740円、枠連は⑦―⑧で5500円、馬連は⑭―⑯で10万6850円、馬単は⑯―⑭で25万4050円、3連複は③―⑭―⑯で14万5880円、3連単は⑯―⑭―③で173万7720円、ワイドは⑭―⑯が1万9970円、③―⑯が6580円、③―⑭が1900円。〔共同〕,スポーツ,15番人気のクリノプレミアム、重賞初制覇　中山牝馬S,https://www.nikkei.com/article/DGXZQOKC122XT0S2A310C2000000/
03/12/2022,日本相撲協会の芝田山広報部長（元横綱大乃国）は12日、尾上部屋の力士2人が新型コロナウイルスに感染したため、同部屋の幕下以下の力士13人全員が大相撲春場所（13日初日・エディオンアリーナ大阪）を休場すると発表した。十両以上はいない。師匠の尾上親方（元小結浜ノ嶋）や部屋付き親方2人の対応は今後協議するという。これに伴い、審判部は初日と2日目の幕下以下取組を再編成する「割り返し」を実施した。芝田山部長によると11日夜、今回陽性となった2力士が発熱したため検査を受けた。尾上部屋は昨年春場所でも、部屋付きの音羽山親方（元幕内天鎧鵬）が新型コロナに感染。所属力士全員に全休措置が取られた。〔共同〕,スポーツ,尾上部屋の力士2人が感染　春場所、13人全員休場,https://www.nikkei.com/article/DGXZQOKC122X10S2A310C2000000/
03/12/2022,大阪府は12日、新型コロナウイルスの新たな感染者を5579人確認したと発表した。新たに50～90代の男女13人の死亡が判明し、府内の累計死者数は4284人になった。12日時点の重症者は前日から5人減の175人で、重い持病などを抱える軽症・中等症患者らを含め重症病床（631床）の実質の使用率は36.6%となった。軽症・中等症病床には2189人が入院しており、軽症・中等症病床（3438床）の使用率は63.7%となった。それぞれの病床数は、確保数を超えて実際に運用しているものも含んでいる。府が設置した臨時医療施設「大阪コロナ大規模医療・療養センター」での療養者は65人で、そのうち6人が中等症患者だった。新規感染者のうち、感染者と同居して症状があり、PCR検査を受けずに医師の診断で陽性と判断された濃厚接触者は396人だった。自宅療養者は4万1057人となり、公費によるPCR検査などを2万3505件実施した。,新型コロナ,大阪府、12日の新規感染5579人　13人死亡,https://www.nikkei.com/article/DGXZQOUF122OJ0S2A310C2000000/
