11/20/2021,大阪府大阪狭山市のスーパーの店先で、暴走した車が通行人の男女3人をはね死傷させた事故で、自動車運転処罰法違反（過失傷害）容疑で逮捕され、過失致死傷容疑に切り替えて送検された無職の男性（89）が19日、釈放された。大阪地検堺支部は勾留請求をしていたが大阪地裁堺支部に却下され、準抗告も退けられた。〔共同〕,関西,暴走事故の89歳男性を釈放　大阪、勾留認められず,https://www.nikkei.com/article/DGXZQOUF19DX60Z11C21A1000000/
11/20/2021,19日のダウ工業株30種平均は3日続落した。欧州で新型コロナウイルスの感染が再び広がり、世界景気を冷やしかねないとの見方が売りを招いた。今週の米株市場でにぎわったのは新興の電気自動車（EV）株だ。10日に上場したばかりのリヴィアン・オートモーティブは、16日に一時179.46ドルと公開価格（78ドル）の2.3倍に上昇。ルーシッド・グループは17日に一時57.75ドルを付け、直近1カ月で株価は2....,北米,米国株「新興EVブーム」の虚と実（NY特急便）,https://www.nikkei.com/article/DGXZQOGN00003_Q1A121C2000000/
11/20/2021,スピードスケート・ショートトラックの北京冬季五輪予選を兼ねたワールドカップ（W杯）第3戦第2日は19日、ハンガリーのデブレツェンで行われ、男子5000メートルリレー予選で菊池耕太（恵仁会）菊池哲平（帝産ク）渡辺啓太（阪南大職）吉永一貴（トヨタ・中京大）の日本は1組2着となり、20日の準決勝に進んだ。女子3000メートルリレー予選で神長汐音（全日空商事）菊池萌水（KHネオケム）菊池純礼（富士急）菊池悠希（ANA）の日本は2組3着で敗退した。1000メートルは男子の吉永が21日の準々決勝に勝ち上がった。〔共同〕,スポーツ,男子5000リレー、日本が準決勝へ　ショートトラックW杯,https://www.nikkei.com/article/DGXZQOKC200C50Q1A121C2000000/
11/20/2021,【スタバンゲル（ノルウェー）=共同】スピードスケートのワールドカップ（W杯）第2戦第1日はノルウェーのスタバンゲルで行われ、女子1000メートルは第1戦に続き高木美帆（日体大職）が1分15秒01で2位、小平奈緒（相沢病院）が3位に入った。ブリタニー・ボウ（米国）が2連勝。男子1000メートルは山田将矢（日本電産サンキョー）が1分8秒87で5位、小島良太（エムウェーブ）が6位。トマス・クロル（オランダ）が優勝した。女子5000メートルは押切美沙紀（富士急）が7分8秒05で9位、佐藤綾乃（ANA）が12位。高木美は格下のBクラスで7分7秒80の4位だった。,スポーツ,高木美が女子1000で2位　スピードW杯、小平3位,https://www.nikkei.com/article/DGXZQOKC200CN0Q1A121C2000000/
11/20/2021,ノルディックスキーのワールドカップ（W杯）ジャンプ男子は19日、ロシアのニジニタギルで個人第1戦（ヒルサイズ=HS134メートル）の予選が行われ、日本勢は小林陵侑（土屋ホーム）が129メートルを飛んで115.3点の4位となるなど、6人全員が20日の本戦に進んだ。佐藤幸椰は6位、伊東大貴（ともに雪印メグミルク）は22位、中村直幹（フライングラボラトリー）は28位、佐藤慧一は30位、小林潤志郎（ともに雪印メグミルク）は42位で通過した。〔共同〕,スポーツ,小林陵侑は4位で本戦へ　ジャンプ男子W杯予選,https://www.nikkei.com/article/DGXZQOKC200CZ0Q1A121C2000000/
11/20/2021,トランポリンの世界選手権第2日は19日、バクーで行われ、非五輪種目の団体決勝で女子は佐竹玲奈（東栄工業）森ひかる、高木裕美（以上金沢学院大ク）で臨んだ日本が合計164.245点をマークし、初優勝した前回2019年大会に続いて2連覇した。3人が安定した跳躍をそろえ、2位の中国を0.995点差で振り切った。男子は堺亮介（バンダイナムコアミューズメント）海野大透（静岡産大ク）西岡隆成（キタイスポーツク）の日本が合計178.335点で2位に入り、3位だった17年大会以来のメダル獲得。ベラルーシが180.690点で2連覇した。〔共同〕,スポーツ,世界トランポリン、女子団体で日本が2連覇,https://www.nikkei.com/article/DGXZQOKC200BL0Q1A121C2000000/
