02/28/2022,IHIは28日、横浜市の建設機械工場の跡地の一部を野村不動産に売却すると発表した。約7万2000平方メートルで、譲渡益約99億円を2022年3月期と23年3月期にその他収益（国際会計基準）として計上する。両社が共同で物流施設を開発し、賃貸事業を展開する。旺盛な物流需要を取り込みたい考えだ。野村不動産への売却額は明らかにしていない。譲渡益は、22年3月期と23年3月期にそれぞれ約49億円ずつ計上する予定としている。共同運営の物流施設は4階建てで延べ床面積18万5100平方メートル程度の規模を想定。25年3月に完成予定とする。IHIは神奈川県綾瀬市で三井不動産と「MFLP東名綾瀬」の開発に取り組むほか、東京都江東区の工場跡地ではSGホールディングスと日本最大級の物流施設「Xフロンティア」を共同運営するなど、遊休不動産の活用を進めている。,住建・不動産,IHI、横浜の旧建機工場跡地、野村不動産と物流施設に,https://www.nikkei.com/article/DGXZQOUC288OK0Y2A220C2000000/
02/28/2022,森永製菓は2月28日、保有する森永乳業株を一部売却すると発表した。430万株を売却し、保有比率は12.70%から4.01%に低下する。森永乳業は森永製菓が売却した森永乳業株を自社株買いで吸収する。コーポレートガバナンス・コード（企業統治指針）の改訂などを踏まえ政策保有株式を減らし、資本効率を高める。森永製菓は今回の売却で森永乳業株の保有比率を5%以下に下げる狙いがある。森永乳業は同日、3月1日に東京証券取引所の...,サービス・食品,森永製菓、森永乳業株を一部売却　保有比率4%に低下,https://www.nikkei.com/article/DGXZQOUC287SE0Y2A220C2000000/
02/28/2022,臨床検査受託大手のビー・エム・エル（BML）は28日、埼玉県川越市にある同社最大の検査拠点に約134億円を投資し、新棟2棟を建てると発表した。水害対策など事業継続計画（BCP）対応を強化し、検査能力も増える。同日、2022年3月期の年間配当金を従来予想から50円高い120円に修正すると発表した。新型コロナウイルス感染の検査受託事業好調を受け、株主還元を強化する。検査拠点「BML総合研究所」で2棟を新設し、既存の建物も増築する。浸水や震災対策として免震構造や非常用発電設備などを備える。23年5月に着工し、24年9月に稼働を予定。同社は医療機関から血液や尿などの検査を受託しており、検査能力も高まる見込みだ。同日発表した22年3月期末配当予想は、普通配当35円に特別配当50円を上乗せして85円とした。年間配当金は従来の70円の予想から50円増えて過去最高の120円になる。従来予想では22年3月期にコロナが収束すると見込んでいたが、変異型「オミクロン型」などの感染拡大が続き検査需要が継続したことを踏まえた。自己株式50万株を消却することも併せて発表した。,新型コロナ,BML、検査拠点拡張に134億円投資　能力を拡大,https://www.nikkei.com/article/DGXZQOUC287R50Y2A220C2000000/
02/28/2022,東京都は葛西海浜公園（江戸川区）に設置を予定している「ビジターセンター」のデザイン案を公募している。環境学習や保全活動などをする拠点施設で、公園の景観になじむことや自然環境を配慮していることなどを要件に3月25日まで募集する。集まったデザイン案はパース化して都民による投票を実施するほか、地元区の意見などを踏まえて6月下旬に採用案を決める。都が2020年度に策定したデザイン案に対して、景観や建物の高さについて多くの意見が寄せられたため公募することにした。同公園は18年10月に水鳥の生息地としてラムサール条約に登録された。21年3月には保全計画が策定されている。,関東,東京都、葛西海浜公園ビジターセンターのデザイン案公募,https://www.nikkei.com/article/DGXZQOCC285GT0Y2A220C2000000/
02/28/2022,東京都は28日、ロシアの侵攻を受けているウクライナに連携を示すため、都庁舎をウクライナの国旗の色である青色と黄色にライトアップした。同日から3月6日まで午後6時～同11時に点灯する。【関連記事】小池百合子知事は28日、都庁で記者団に対して「ウクライナとの連携を示す。いまメッセージを出すことは重要だ」と述べた。ロシアの侵攻については「ウクライナの主権と領土の一体性を著しく損なう明確な国際法違反だ。国際社会や民主主義への挑戦にほかならない」と批判した。小池氏は24日にもロシアのウクライナ侵攻について「人ごとと思ってはいけない。世界はいつも『隙あらば』といった情勢だ」と指摘し、日本周辺を含む有事への懸念も示していた。,ウクライナ侵攻,都庁舎、ウクライナ国旗の色にライトアップ　連携示す,https://www.nikkei.com/article/DGXZQOCC287VX0Y2A220C2000000/
02/28/2022,28日朝のロンドン株式市場で、FTSE100種総合株価指数は反落して始まった。英国時間8時時点は、前週末比81.26ポイント（1.08%）安の7408.20だった。欧米諸国が国際銀行間通信協会（SWIFT）の決済網からロシアの一部銀行を排除することを決定した。世界経済への悪影響を懸念し、投資家が運用リスクを回避する姿勢を強めた。ドイツ株式指数（DAX）とフランスのCAC40はいずれも下落している。〔日経QUICKニュース（NQN）〕,ロンドン株式相場,ロンドン株、反落で始まる　独や仏も下落,https://www.nikkei.com/article/DGXZASFL28I4X_Y2A220C2000000/
02/28/2022,新型コロナウイルスの新規感染者は28日、全国で5万人超が確認された。累計の感染者数は500万人を超えた。2月15日に400万人を超えた後、2週間で100万人増えた。「第6波」のピークは過ぎつつあるが、感染拡大時の急激さに比べて減少ペースは鈍い。【関連記事】年明け以降の累計は320万人を超えている。2021年と20年は年間でそれぞれ約150万人、約23万人だった。東京都では新たに9632人確認された。前週の月曜日をおよそ800人上回っている。都内の累計感染者は99万4028人と100万人に迫っている。,新型コロナ,国内のコロナ感染、累計500万人超　2週間で100万人増,https://www.nikkei.com/article/DGXZQOCC289QB0Y2A220C2000000/
02/28/2022,東芝子会社の東芝デバイス&ストレージは2月28日、1月に発生した地震で被災した大分市内の半導体生産・開発拠点の生産能力が被災前の水準に復旧したと発表した。「ジャパンセミコンダクター大分事業所」は1月22日に発生した地震により製造装置の一部が破損し、操業を停止した後、段階的に復旧を進めていた。業績への影響については「精査中」としている。同拠点は、車載や産業用機器向けのシステムLSI（大規模集積回路）などを製造している。部品の調達・交換が済み、復旧したという。3月上旬をめどとする復旧作業を進めていた。,エレクトロニクス,東芝、大分の半導体拠点が復旧　地震前の水準に,https://www.nikkei.com/article/DGXZQOUC289000Y2A220C2000000/
02/28/2022,ウクライナ国立銀行（中銀）のシェフチェンコ総裁は27日、日本経済新聞の取材に対し、アジア諸国が強力な対ロシア制裁に踏み込むことに期待感を示した。ロシア軍が首都キエフに迫るなか、国際的なロシア包囲網の強化で難局を打開したい考えだ。国内では信用秩序の維持へ、流動性の供給など手を尽くして対策に万全を期す。「ウクライナ国民への連帯、財政的・軍事的な支援のひとつひとつが私たちの勝利に大きく貢献する」。総裁...,ウクライナ侵攻,ウクライナ中銀総裁に聞く　アジアも欧米の制裁に同調を,https://www.nikkei.com/article/DGXZQOGR2831Q0Y2A220C2000000/
02/28/2022,【ロンドン=赤川省吾】ウクライナ国立銀行（中銀）のシェフチェンコ総裁は27日、対ロシア制裁として米クレジットカード大手のビザやマスターカードなどに決済網からロシアを排除するよう要請したことを明らかにした。アジア諸国に欧米並みの踏み込んだ制裁を取ることも求めた。日本経済新聞の書面インタビューに答えた。シェフチェンコ氏は日米欧が国際決済網の国際銀行間通信協会（SWIFT）からのロシア排除で合意したこ...,ウクライナ侵攻,「カード決済からロシア排除を」　ウクライナ中銀が要請,https://www.nikkei.com/article/DGXZQOGR282VR0Y2A220C2000000/
02/28/2022,東京ディズニーリゾート（TDR）を運営するオリエンタルランドは2月28日、3月1日から入場者数制限を緩和すると発表した。まん延防止等重点措置に伴い各パーク1日2万人としていたが、最大収容人数の50%を超えない範囲内で入場者数を段階的に引き上げる。同社は1月21日から各パークの入場者数を1日最大2万人に制限していた。現在もまん延防止等重点措置の適用は続いているが、同社が千葉県に相談した結...,サービス・食品,東京ディズニー、入場制限緩和　収容人数の5割未満まで,https://www.nikkei.com/article/DGXZQOUC2892U0Y2A220C2000000/
02/28/2022,日本経済新聞社がまとめた大阪市内の主要13ホテルの2022年1月の平均客室稼働率は40.3%で、前月から20.4ポイント悪化した。新型コロナウイルス感染拡大を受け、大阪府が宿泊割引の新規予約分の受け付けを1月12日に停止したことが響いた。リーガロイヤルホテルは34%、帝国ホテル大阪は16....,新型コロナ,大阪市内のホテル、1月の稼働率40.3%　コロナで悪化,https://www.nikkei.com/article/DGXZQOUF1775M0X10C22A2000000/
02/28/2022,関　宏成氏（せき・ひろしげ=元セキ社長）2月22日、老衰のため死去、100歳。連絡先は同社経営管理本部。お別れの会を行うが日取りなどは未定。喪主は娘婿で同社会長、啓三氏。,,関宏成氏が死去　元セキ社長,https://www.nikkei.com/article/DGXZQOUE2832P0Y2A220C2000000/
02/28/2022,野澤　太一郎氏（のざわ・たいちろう=元ノザワ社長）2月23日、老衰のため死去、89歳。連絡先は同社秘書室。告別式は近親者で行った。喪主は妻、敦子さん。,,野澤太一郎氏が死去　元ノザワ社長,https://www.nikkei.com/article/DGXZQOUE284QN0Y2A220C2000000/
02/28/2022,朱牟田　恒雄氏（しゅむた・つねお=元毎日新聞社取締役）2月21日死去、79歳。告別式は近親者で行う。喪主は長男、久雄氏。,,朱牟田恒雄氏が死去　元毎日新聞社取締役,https://www.nikkei.com/article/DGXZQOUE281EU0Y2A220C2000000/
02/28/2022,◇SCREENグラフィックソリューションズ田中　志佳氏（たなか・ゆきよし）84年（昭59年）オレゴン州立大経卒、85年大日本スクリーン製造（現SCREENホールディングス）入社。19年SCREENグラフィックソリューションズ執行役員。和歌山県出身。61歳（4月1日就任。柿田高徳社長は会長に）,,SCREENグラフィックソリューションズ社長に田中氏,https://www.nikkei.com/article/DGXZQOUF287700Y2A220C2000000/
02/28/2022,楽天グループは28日、ロシアによるウクライナ侵攻を受けて緊急支援募金の受け付けを始めた。集まった募金はウクライナ政府や日本ユニセフ協会を通じ、支援物資や保健サービスの提供など、ウクライナの人々の支援に充てる。「楽天ポイント」の場合、1ポイント1円として寄付できる。クレジットカードは100円から。近く楽天銀行の指定口座での現金振り込みも受け付けを始める。期間は3月末までを予定している。楽天グループの三木谷浩史会長兼社長は27日、ウクライナ大使館を通じて個人で10億円を寄付した。ウクライナのゼレンスキー大統領に宛てた書簡では、今後も支援を続けていく姿勢を示していた。楽天グループは南部オデッサに事務所を構え、無料通話アプリや動画配信サービスなどインターネット関連のサービスを提供している。,ウクライナ侵攻,楽天、ウクライナ緊急支援募金　ポイントでも受け付け,https://www.nikkei.com/article/DGXZQOUC287400Y2A220C2000000/
02/28/2022,【ロンドン=篠崎健太】28日の欧州天然ガス相場は大幅に反発している。金融情報会社リフィニティブによると、指標価格となるオランダTTFは翌月渡しの取引で一時、前週末比32.5ユーロ（35%）高い1メガワット時あたり125ユーロまで急騰した。欧米諸国がウクライナを侵攻したロシアへの経済・金融制裁を大幅に強化し、ロシア産ガスの供給不安から買いが先行した。高く始まった後は上げ幅を縮め、110ユーロ台と前週末比2割台の上昇率で推移している。欧州株式相場は反落し、ドイツの株式指数DAXや仏CAC40は前週末終値より2%程度安い水準で始まった。ロシアでの事業規模が大きい企業の値下がりが目立ち、オーストリア大手銀のライファイゼンは2割近く下げる場面があった。仏自動車ルノーは一時9%安、ロシア石油大手ロスネフチ株の売却を発表した英BPは7%安となった。,ウクライナ侵攻,欧州天然ガス急騰、一時35%高　欧州株は反落で始まる,https://www.nikkei.com/article/DGXZQOGR288X90Y2A220C2000000/
