04/09/2022,東京都は9日、新型コロナウイルスの感染者が新たに8102人確認されたと発表した。直近1週間平均の新規感染者は約7552人で、前週（約7622人）の99.1%だった。累計の感染者は131万8898人となった。都内の重症者は前日から1人減り29人だった。新たに6人の死亡が確認され、累計の死者数は4234人となった。新規感染者を年代別にみると、20代が1691人と最も多く、30代が1482人、10歳未満が1320人で続いた。65歳以上の高齢者は442人だった。ワクチンの接種状況別では2回接種済みが3940人、未接種は2234人だった。,新型コロナ,東京都、新たに8102人感染　7日平均で前週の99.1%,https://www.nikkei.com/article/DGXZQOCC091ME0Z00C22A4000000/
04/09/2022,スケートボードの強化指定選手の選考対象大会、マイナビ日本オープン第1日は9日、神奈川県藤沢市の鵠沼海浜公園スケートパークでパークの男子予選が行われ、16歳の永原悠路が68.57点でトップ通過した。67.50点をマークした23歳の笹岡建介（MKグループ）が2位で突破。上位15人が10日の準決勝に進出した。東京五輪銀メダルの開心那（WHYDAH GROUP）らがエントリーしている女子は予選を実施しない。10日は男女の準決勝と、8人で争う決勝が行われる。〔共同〕,スポーツ,永原悠路・笹岡建介ら準決勝へ　スケボー日本オープン,https://www.nikkei.com/article/DGXZQOKC092A20Z00C22A4000000/
04/09/2022,【上海=土居倫之】中国・上海市政府は9日、外出禁止解除の目安となる条件として「地区内の感染が14日間ゼロ」との基準を公表した。感染リスクに応じて地区を3段階に分けて管理する。ただ新型コロナウイルスの感染拡大に歯止めが掛かっておらず、全面解除の時期はなお不透明だ。上海市政府が9日の記者会見で明らかにした。近く全市民を対象にしたPCR検査を再び実施し、感染リスクに応じて3段階に分けて地...,新型コロナ,都市封鎖の上海市、「感染14日ゼロ」で外出可能に,https://www.nikkei.com/article/DGXZQOGM0921N0Z00C22A4000000/
04/09/2022,【パリ=白石透冴】フランス大統領選は10日、1回目の投開票を実施する。極右国民連合ルペン党首が中道のマクロン大統領を猛烈に追い上げ、支持率はほぼ拮抗した。ルペン氏は移民政策などで柔軟な姿勢を示し、支持層を広げている。仏調査会社Ifopが8日発表した世論調査によると、得票率予想はマクロン氏が26%、ルペン氏が24%と競る。マクロン氏が1カ月で4.5ポイント下げ、ルペン氏は5.5ポイント伸ばした。...,ヨーロッパ,仏大統領選、極右候補がマクロン氏猛追　10日投開票,https://www.nikkei.com/article/DGXZQOGR08ED20Y2A400C2000000/
04/09/2022,【北京=羽田野主、マニラ=志賀優一】中国の習近平（シー・ジンピン）指導部がフィリピンのつなぎ留めに躍起になっている。最近の米日との接近を警戒する習国家主席は、フィリピンのドゥテルテ大統領に同国製品の輸入拡大を提案し、経済的利益で取り込もうとしている。「フィリピンからより多くの優良製品を輸入しよう」。習氏は8日、ドゥテルテ氏に電話協議で提案した。フィリピンにとって中国（香港含む）は世界最大の輸出...,中国・台湾,中国、フィリピンと関係改善図る　米日との接近を警戒,https://www.nikkei.com/article/DGXZQOGM08DGI0Y2A400C2000000/
04/09/2022,【ジャカルタ=地曳航也、ムンバイ=花田亮輔】ウクライナ危機に伴う生活必需品の価格上昇がアジア各国の財政運営を直撃している。各国政府は抗議デモの発生を警戒して支援策を打ち出すが、新型コロナウイルス対策で悪化していた財政にはさらなる打撃となりそうだ。「ガソリンや砂糖、粉ミルクなどの価格が上がり、状況は悪くなる一方だ。政府は適切なプランを持っていない」。スリランカ最大都市コロンボに住む30代の男性は...,ウクライナ侵攻,アジアで生活必需品の価格上昇　現金支給など対応相次ぐ,https://www.nikkei.com/article/DGXZQOGM05B3S0V00C22A4000000/
04/09/2022,【アナハイム=共同】米大リーグは8日、各地で行われ、エンゼルスの大谷は本拠地アナハイムでのアストロズ戦に「1番・指名打者」でフル出場し、5打数1安打だった。一回に今季初安打となる中前打を放った。チームは6-13で大敗し、開幕2連敗となった。鈴木のカブスは本拠地のブルワーズ戦が悪天候で中止。5月30日がダブルヘッダーとなる。沢村のレッドソックスは、ヤンキースとの今季初戦に延長十一回タイブレークの末、5-6でサヨナラ負け。沢村は登板しなかった。初のメジャー昇格を果たした加藤の所属するブルージェイズはレンジャーズとの初戦に10-8で勝った。加藤の出番はなかった。,スポーツ,大谷が今季初安打、エンゼルス開幕2連敗　大リーグ,https://www.nikkei.com/article/DGXZQOKC091T20Z00C22A4000000/
04/09/2022,国民民主党北海道連は9日、夏の参院選北海道選挙区（改選数3）に、元衆院議員秘書の臼木秀剛氏（41）の擁立を決めた。立憲民主党は元衆院議員の石川知裕氏（48）を国民と共同で無所属の推薦候補にしたい意向だったが、比例票を掘り起こしたい国民側が応じなかった。臼木氏は近く党本部から公認される見通し。立民は現職の徳永エリ氏（60）をすでに公認しており、今後石川氏も公認に切り替える。同選挙区では2016年参院選で旧民進党が2人当選し、自民党の1人を上回った。民進分裂後の19年は、国民と立民がそれぞれ1人ずつ候補を擁立。立民は当選したが、自民が残り2議席を獲得した。〔共同〕,政治,国民、参院選北海道に擁立　立民と一本化せず,https://www.nikkei.com/article/DGXZQODE091OQ0Z00C22A4000000/
