03/05/2022,ソニーグループとホンダは4日、電気自動車（EV）事業での提携について記者会見を開いた。ソニーの吉田憲一郎会長兼社長は「モビリティーの進化をリードしていく」と語り、ホンダの三部敏宏社長は「車の範囲を超えた新たな価値を世に問う」と述べた。主なやり取りは次の通り。――新会社設立に至った背景は。三部社長　「2021年夏頃、ホンダ側からモビリティーの将来を検討しようと声をかけ、新たな価値を生み出すために両社の若手で構成され...,エレクトロニクス,ホンダの三部社長「車超えた価値を」　ソニーとEV提携,https://www.nikkei.com/article/DGXZQOUC049W30U2A300C2000000/
03/05/2022,日野自動車の小木曽聡社長と下義生会長は4日記者会見し、排出ガス不正について陳謝するとともに、不正が起きた理由などについて説明した。主なやりとりは以下の通り。――不正発覚のきっかけはなんだったのか。下会長「米国法規に照らして正しいかと、従業員が気づいたのは2018年11月。総点検の形で国内認証についても調査を始めた。排ガス認証の耐久試験の再調査は21年4月に始めた。燃費（数値）に初期的な問題がありそうだと認識したのは21年11月で、不正を認定したのは今年2月だ。米国についてはまだ調査中でコメントは控える」――社員はどういう意図で不正をしたのか。小木曽社長「排ガス性能の耐久試験では、このままでは規制値に入らないと認識して部品を交換してしまった。性能を満たさないことを知りつつ交換しており、（不正の）意図があったと理解している。燃費も目標燃費に届かないなかで流量の校正値を変えて実力より良くした。背景に目標必達とか、リードタイムがなかったということがある」――今後の影響は。小木曽社長「優遇税制を受けていた部分が、実力値では届かないのであれば弊社が追加納付する形になる。出荷再開は正しい燃費値に変えて進めていくことが先で、まだ決まっていない」――使われている車への対応策は。小木曽社長「排ガス不正があった車両の部品を変えるかについて調査中だ。触媒関連の制御を変更するなどで改善できる可能性がある。燃費の車両については、車はそのままお使いいただくことになると思う」――対象となっている16年より前の不正が分かる可能性は。小木曽社長「過去の車両についても継続調査する。手間や時間がかかるが、丁寧にやっていく」――経営陣の責任は。下会長「経営としての責任は重いと受け止めている。特別調査委員会の外部有識者の力も借りながら、目の前のことをしっかりやっていく」,自動車・機械,日野自動車「性能未達、認識していた」　会見一問一答,https://www.nikkei.com/article/DGXZQOFD04AOH0U2A300C2000000/
03/05/2022,バスケットボール男子のBリーグ1部（B1）は4日、川崎市とどろきアリーナで1試合が行われ、東地区3位の川崎は信州に77-84で敗れ、25勝10敗となった。西地区6位の信州は18勝18敗。〔共同〕,スポーツ,川崎、信州に敗れる　バスケBリーグ,https://www.nikkei.com/article/DGXZQOKC04DG70U2A300C2000000/
03/05/2022,ロシアのウクライナ侵攻で世界のビジネスに影響が広がっています。ウクライナに進出する日本企業は生産や販売の停止を余儀なくされました。ロシアの航空便は欠航が相次いでいます。自動車などのサプライチェーン（供給網）にも影響が出始めました。直近のビジネスへの影響についてまとめました。ウクライナに進出する日本企業は57社あり、約半数が自動車などの製造業です。ロシアの侵攻で生産・販売活動に影響が波及しています。金融では米欧日がロシアへの金融制裁を発動したことで、3メガ銀行など邦銀が対ロ取引の見直しに動いています。ロシアとの結びつきの強い欧州企業では製造業のサプライチェーン（供給網）に影響が出始めました。日本企業でウクライナを支援する動きが出始めています。地方企業にも波及しており、地理的に近い北海道の産業界では動揺が広がっています。,ウクライナ侵攻,ウクライナ侵攻　ビジネスへの影響は,https://www.nikkei.com/article/DGXZQOUC261YV0W2A220C2000000/
03/05/2022,長崎県は4日、新型コロナウイルス対策の「まん延防止等重点措置」が6日までで解除されることを受け、飲食店に対する営業時間の短縮と酒類提供制限の要請を合わせて終了する。大石賢吾知事は4日の記者会見で「再拡大を招かないよう感染防止対策を継続しつつ、経済活動を再開させる」と述べた。県は今後、県内での観光キャンペーン再開や事業者に対する新たな支援策、小児へのワクチン接種の推進策などを検討する。ただ、重点措置が解除された後に新規感染者が増加した県もあることから、県民に対して感染リスクが高い地域との往来を極力控えるよう呼びかける。併せて、会食はコロナ対策をしている認証店を利用し、できるだけ少人数にすることなどを訴えていく。,新型コロナ,長崎県、飲食店の時短要請など終了　まん延防止解除で,https://www.nikkei.com/article/DGXZQOJC045JM0U2A300C2000000/
03/05/2022,【北京=渡辺岳史】北京冬季パラリンピックは4日、北京市の国家体育場で開会式を行い、ウクライナ問題の影響でロシアとベラルーシの選手団が除外されるという異例の事態の中で10日間の祭典が開幕した。国際パラリンピック委員会（IPC）は両国の選手・役員の「中立的」な立場での大会参加を2日に容認したが、ほかの参加チームや選手の反発を受けて、翌日に両国の除外を決定。タス通信によるとロシア・パラリンピック委員会（RPC）は4日、除外についてスポーツ仲裁裁判所（CAS）などへの早急な提訴を見合わせることを明らかにした。IPCによると、個人資格でエントリーしていたロシアとベラルーシの不参加によって出場は46カ国・地域となり、49カ国・地域が参加した前回の2018年平昌大会を下回る見通しとなった。競技は5日に始まり、13日の閉幕までに6競技78種目を実施する。日本勢は4競技に29選手が出場予定。アルペンスキー女子座位の村岡桃佳（トヨタ自動車）らにメダルの期待がかかる。◇各国・地域の選手団による開会式の入場行進で2番目に登場した日本選手団は、旗手を務めたノルディックスキー距離の川除大輝（日立ソリューションズJSC）を先頭に笑顔の行進となった。主将の村岡桃佳（トヨタ自動車）を含むアルペンスキー勢の多くは5日から競技が始まるため参加しなかったが、河合純一団長ら本部スタッフをはじめ、スノーボードや一部のノルディック選手ら計35人が出席。歓迎するスタンドの人々に、小旗を振って応えるなどして祭典の雰囲気を味わった。日の丸を掲げて堂々と大役を果たした川除は2大会連続出場。強豪のロシア勢が大会から去り、立位男子の種目で表彰台のチャンスが出てきた。個人種目で入賞できなかった平昌を踏まえ「前回大会の結果を超えられるように楽しく全力で頑張る」とコメント。河合団長は「選手たちの可能性を信じ、チーム力と対応力で最高のパフォーマンスを発揮できる環境を整えていきます」と誓った。【関連記事】,北京2022,北京パラリンピック開幕　ロシアなど除外で異例の祭典に,https://www.nikkei.com/article/DGXZQODH047810U2A300C2000000/
03/05/2022,鹿児島県は4日、新型コロナウイルス対策の「まん延防止等重点措置」が6日までで解除されることを受け、県内全域の飲食店に要請していた営業時間の短縮を合わせて終了すると発表した。酒類の提供制限の要請も終える。4日の県の対策本部会議で決めた。同日記者会見した塩田康一知事は「例えば鹿児島市内に約4000店舗ある中で、2000店舗を超える店で第三者認証を受けるなど対策が進んでいる。リスクと負担を考え、時短解除を決めた」と述べた。飲食店の時短営業はこれまで、感染対策の認証店は酒類を提供して午後9時までの営業か、酒類を提供せず午後8時までの営業かを選べ、非認証店は酒類を提供せず午後8時までの営業とすることを要請していた。,新型コロナ,鹿児島県、飲食店時短6日までで終了　まん延防止解除で,https://www.nikkei.com/article/DGXZQOJC042ZD0U2A300C2000000/
03/05/2022,ウクライナ当局は4日、南部にある欧州最大級の原子力発電所がロシア軍に制圧されたと発表した。北部のチェルノブイリに続き、厳格な管理が求められる原発周辺で繰り返される戦闘。一歩間違えれば深刻な被害を招きかねず、東京電力福島第1原発事故で長期避難を余儀なくされた福島県の住民や広島・長崎の被爆者から憤りの声が相次いだ。「原発を狙って攻撃したとすれば、そこに住む人を人とも思っていない行為。信じられない」。...,ウクライナ侵攻,被爆者ら怒りと悲しみ「信じられぬ」　ロシアの原発制圧,https://www.nikkei.com/article/DGXZQOUE041XL0U2A300C2000000/
03/05/2022,コマツは4日、ロシアでの建設機械の出荷や同国向けの輸出を停止すると発表した。「サプライチェーン（供給網）の混乱および金融・経済の不透明な状況を考慮した」と説明している。同社はロシア西部のヤロスラブリの工場で油圧ショベルやダンプトラックを生産するほか、日本からも建機を輸出している。ロシアは鉱山採掘が盛んで、同国を中心とする独立国家共同体（CIS）地域はコマツの2021年4～12月期の建機売上高の8%を占めた。同社はウクライナ情勢の悪化を受けて2月末に社長直轄の緊急対策本部を立ち上げていた。4日には日立建機もロシアでの建設機械の生産と同国向けの輸出を順次停止することを決めたと発表した。ウクライナ侵攻の影響による物流網の混乱で製品や部品が届かないリスクを考慮した。現地工場が保有している部品在庫で当面は生産を続けるが、現時点で4月中旬には稼働停止となる見込み。同社はロシアでモスクワ近郊のトベリに中型油圧ショベルの工場を持ち、モスクワにも販売拠点を置く。油圧制御などの基幹部品は日本から輸出して現地製品に組み込んでいたが、海上輸送などの遅れで生産計画に影響が及ぶと判断した。約10人の駐在員については「現地の情勢をみながら一時帰国も検討していく」という。ロシアCIS地域は21年4～12月期の売り上げ収益の4%を占めた。現地生産に加えて、鉱山で使う超大型油圧ショベルなどは日本からロシアに輸出してきた。,ウクライナ侵攻,コマツ、ロシア出荷を停止　日立建機も生産・輸出停止,https://www.nikkei.com/article/DGXZQOUC04ANG0U2A300C2000000/
03/05/2022,大阪府は4日、新型コロナウイルスの発熱外来のある全ての医療機関を3月中旬から府のホームページで公開すると発表した。これまでは2077施設（2月28日時点）のうち、同意を得た半数超を公開していた。一部の医療機関に発熱患者が集中する事態が生じており、診療や検査の混雑緩和につなげるのが狙い。国の方針に基づいた対応で、府は近く各医療機関に公開の可否について意向調査を実施する。府医師会の協力を得た上で、医療機関の所在地や対応時間などを公表する。,関西,大阪府、発熱外来の全医療機関を公表へ,https://www.nikkei.com/article/DGXZQOUF04BIZ0U2A300C2000000/
03/05/2022,【ウィーン=細川倫太郎、ドロフスク（ポーランド東部）=木寺もも子】欧州連合（EU）は3日開催した内相理事会で、ウクライナ難民の一時保護で合意した。国連難民高等弁務官事務所（UNHCR）によると、周辺国などに逃れた難民の規模は4日までに120万人を超えた。EU加盟国は難民申請なしに滞在許可証を発行し、就労や住居も支援する。ロシアによるウクライナへの軍事侵攻が始まった2月24日以降、ウクライナと隣国の国境地帯には危険を逃れる市民が列を成す。受け入れ国は西隣のポーランドが約65万人と最も多く、ハンガリー（約14万人）、モルドバ（約10万人）と続く。「今世紀最大の欧州難民危機になり得る」。グランディ国連難民高等弁務官は1日、緊急で受け入れ体制を整える必要性を強調した。「子供たちを守るためには逃げるしかないと思った」。ウクライナ中部ルブヌイ出身のレシアさん（30）は3日、娘3人を連れて国境を越え、隣国のポーランドに入国した。生後2カ月の三女に授乳しながらバスなどで一昼夜かかったが、ロシア軍の脅威が迫る中で脱出を決意した。UNHCRは、事態が収束しなければ難民が今後数週間で計400万人以上に膨れ上がると予測する。2015年の難民危機ではシリアなどから100万人以上が欧州に押し寄せたが、それを大きく上回る規模になりかねない。EUは煩雑な難民保護申請の手続きなしに一定期間の滞在を許可し、社会生活を送れるよう支援する「一時保護措置」で合意した。近く初めて発動する。支援を迅速にするほか、難民が最初に到着する特定の加盟国に受け入れが偏らないようにする狙いもある。ヨハンソン欧州委員（内務担当）は3日、「歴史的な決定がなされた。EUは命を救うために団結している」と強調した。現在、ウクライナ人は原則、査証（ビザ）なしで90日まではEUに滞在できる。ただ、停戦の見通しはたたず、滞在が長期化する可能性がある。一時保護措置ではまず1年の滞在許可を得られ、延長も可能だ。雇用や住居、医療、福祉サービスも受けられるほか、未成年者には教育の機会も提供する。現場で支援に当たるポーランドの非政府組織（NGO）職員、ヤン・ブジェルクさんは「より困難な状況の難民が来るようになった」と話す。ポーランドだけでも推計約200万人のウクライナ人が侵攻前から暮らしており、当初逃れてきた難民の多くは親戚や友人などを頼って身を寄せていた。だが、戦況の悪化で頼るあてのない人や移動に困難を伴う人も難民となるケースが増えているもようだ。,ウクライナ侵攻,EU、ウクライナ難民へ就労・居住支援　一時保護で合意,https://www.nikkei.com/article/DGXZQOGR03ECZ0T00C22A3000000/
03/05/2022,建設用クレーン大手のタダノは4日、ロシアとベラルーシへの製品・部品の出荷を同日から停止したと発表した。日米欧によるロシアへの金融制裁を受け、同国からの入金などができなくなる恐れがあるため。同社のクレーンはロシアで原油や天然ガスなどのエネルギー産業の採掘現場で使われている。タダノが2020年にロシアとベラルーシに出荷したクレーンは約40台で、同年に日本を除く海外全体で販売した台数の5%ほどにあたる。出荷停止の期間は「ロシア・ウクライナ間の軍事衝突が終結するまで」と説明している。,自動車・機械,タダノ、ロシアへのクレーン出荷停止,https://www.nikkei.com/article/DGXZQOCC04CJ80U2A300C2000000/
03/05/2022,【ワシントン=中村亮、ブリュッセル=竹内康雄】ロシア軍がウクライナ南部の港湾都市へ攻勢を強めている。海上輸送を遮断し経済に大きな打撃を与えて譲歩を迫る。ロシア軍はウクライナ周辺に集めた兵士の9割をすでに投入したとみられ、首都キエフにも攻勢をかける構えだ。「ロシアが無差別にミサイルを発射している」。バイデン米大統領は3日の閣議でロシア軍が民間施設にも激しく攻撃していると批判した。経済制裁をテコにロシアのプーチン大統領に撤退を要求する方針を示した。国防総省高官は3日、記者団にウクライナ周辺に集結したロシア軍の9割がウクライナでの軍事作戦に参加したとの分析を明らかにした。米政権は2月中旬、集結したロシア軍は少なくとも16万9千人と推計しており、15万人以上がウクライナに入ったとみられる。軍事作戦は南部で進展が目立つ。複数の米メディアは、地元当局者の話としてロシア軍が黒海に近い港湾都市ヘルソンを制圧したと報じた。国防総省高官はヘルソン制圧について明言を避けているが、ロシア軍がヘルソンを押さえれば別の港湾都市オデッサへ進軍するシナリオに言及した。上陸作戦部隊がウクライナ領クリミア半島の海軍基地からオデッサに向かっており、陸と海から挟み撃ちを狙っている可能性がある。ロシア軍はアゾフ海に面する港湾都市マリウポリにも迫る。米シンクタンクの戦争研究所は3日のリポートで、ロシア軍はマリウポリを包囲し砲撃していると分析した。いずれの港湾都市も経済を支える輸出の拠点だ。穀物などの輸出が経済の柱であり、元米軍高官のベン・ホッジス氏は「民間船が港湾にアクセスできなければ経済は崩壊する」と懸念を示す。国防総省高官は南部で作戦が進展する理由についてロシアが2014年に併合したクリミア半島を拠点にしていることを挙げる。駐留部隊が参加し、高官は「後方支援態勢は完璧ではないが洗練されている」という。一方、キエフへの進軍は進展に乏しい。高官はロシア軍が3日時点でキエフ中心部から北方に25キロメートルに位置し2月28日から前進していないとみる。進軍部隊は主にベラルーシを拠点とした。後方支援を含めた連携が円滑に進まなかったもようだ。ロシア軍はキエフ周辺への爆撃を増やした。国防総省はベラルーシから累計70発以上のミサイル発射があったと推計する。ウクライナでは市民も戦闘に加わる。米ブルッキングス研究所のマイケル・オハンロン上級研究員は「ロシアが最終的に勝利するとみているが、多大な犠牲を払う。長期間にわたり泥沼にはまるかもしれない」と語った。北大西洋条約機構（NATO）は4日の外相理事会で、ウクライナの領空や領土にNATOの航空機や軍隊を展開すべきでないとの考えで一致した。ウクライナなどは飛行禁止区域を求めるようNATOなどに求めていた。ストルテンベルグ事務総長が会合後の記者会見で明らかにした。同氏は「今後数日でより悪くなる可能性が高い」と死者や被害が一段と増えそうだとの見解を表明。プーチン大統領に無条件ですべて軍隊を撤退するよう求めた。ロシアからも批判の声があがる。同国石油大手ルクオイルは3日、ロシアによるウクライナ侵攻を非難する声明を発表。武力行使の停止を求めた。同国の主要企業で今回の軍事侵攻を公に批判したのは初めてとみられる。声明発表後、同社のウェブサイトは閲覧が制限されているが、SNS（交流サイト）で発表内容が拡散されている。,ウクライナ侵攻,ロシア軍、国境配置の9割投入　ウクライナ港湾へ攻勢　,https://www.nikkei.com/article/DGXZQOGN03F970T00C22A3000000/
03/05/2022,経済産業省は4日、燃料価格の高騰対策の一環として電気自動車（EV）など電動車の購入者への補助金を5万円積み増すと明らかにした。春以降に申請受け付けを始める補助金について、予定していた最大80万円を同85万円に引き上げる。プラグインハイブリッド車（PHV）、軽自動車タイ...,カーボンゼロ,EV補助金5万円積み増しへ　燃料費高騰対策で経産省,https://www.nikkei.com/article/DGXZQOUA04BK40U2A300C2000000/
03/05/2022,千葉県の熊谷俊人知事は4日の新型コロナウイルス対策本部会議後の記者会見で、感染状況の改善が続けば、まん延防止等重点措置の新たな期限である21日での解除は「十分可能だ」と述べた。その上で、神奈川、埼玉を含む1都3県で足並みをそろえることは「前提ではない」とし、今後措置への方針に違いが出た場合、県独自に対応する可能性も示した。熊谷知事はこのほか、卒業式をはじめとする年度替わりの節目の行事について、「...,新型コロナ,21日解除「十分可能」　千葉県知事、まん延防止巡り,https://www.nikkei.com/article/DGXZQOCC04CW10U2A300C2000000/
03/05/2022,好調が続く半導体業界の経営環境に不透明感が出ている。3日発表した米ブロードコムなど大手10社の2021年10～12月期（一部直近）は、純利益合計が前年同期比3割増えた。2年連続の最高益だが、米インテルなど製造を手がけるメーカーでは投資増や人材不足が顕著だ。ウクライナ情勢の悪化による半導体製造向けの希少資源の調達問題も含め、3つの懸念が業績の重荷になる恐れがある。ブロードコムが発表した21年11月...,エレクトロニクス,世界半導体、最高益でも投資増など3つの懸念　10～12月,https://www.nikkei.com/article/DGXZQOUC030ZK0T00C22A3000000/
03/05/2022,自民党の遠藤利明選挙対策委員長は4日収録のBSテレ東「NIKKEI　日曜サロン」で、夏の参院選に向けた公明党との選挙協力に言及した。両党の本部が「相互推薦」に文書で合意しなかった場合も「各都道府県連が協力しあっていく」と述べた。相互推薦は公明党が改選定数1の選挙区などで自民党を推薦...,政治,参院選「自公、相互推薦なくても協力」　自民・遠藤氏,https://www.nikkei.com/article/DGXZQOUA04C5Y0U2A300C2000000/
03/05/2022,岸田文雄首相は4日、新型コロナウイルスのワクチンに関して自衛隊が運営する都内の大規模接種センターを訪れ、自ら3回目接種を受けた。1、2回目の米ファイザー製ではなく、米モデルナ製を使った「交互接種」となった。首相は終了後、記者団に「1、2回目と特段変わったところもなく、違和感も、不便を感じることもなかった」と述べた。首相は1月31日以来1カ月ぶりに同会場を視察した。「前回視察したときと比べて規模も大きくなった。関係者の皆さんが様々な工夫を凝らして、より機能的に接種を進めている」と語った。,新型コロナ,首相がワクチン3回目接種　モデルナ製「違和感ない」,https://www.nikkei.com/article/DGXZQOUA04C6Z0U2A300C2000000/
03/05/2022,内田洋行が4日発表した2021年8月～22年1月期の連結決算は、純利益が前年同期比3%減の14億円だった。小中学生に学習端末を配布する「GIGAスクール構想」向けの端末販売で、大型受注があった前年からの反動減が出た。グループ会社の完全子会社化に向けた買収関連費用を営業外で計上したことも響いた。民間企業向けのソフトウエアのライセンス販売などは堅調だ。売上高は12%減の864億円。新型コロナウイルスの感染症...,ビジネス,内田洋行の純利益3%減、学習端末で反動減　8～1月,https://www.nikkei.com/article/DGXZQOUC049AA0U2A300C2000000/
