05/16/2022,野田聖子女性活躍相は16日、日本経済新聞のインタビューで女性の政治参加を巡り「地方議会では女性枠の固定化も一案だ」と語った。議員の担い手不足に関連し「議席を埋められない自治体もある。議会を維持するための賢い選択として一つの考え方だ」と述べた。女性の潜在力の重要性を指摘した上で「違う視点が入ってくれ...,政治,野田女性活躍相「地方議会、女性枠も一案」,https://www.nikkei.com/article/DGXZQOUA1668Y0W2A510C2000000/
05/16/2022,東映は16日、2023年3月期の連結純利益は前期比23%増の110億円になる見通しだと発表した。3割出資する東映アニメーションの「ドラゴンボール」シリーズなどの海外向け版権販売が伸びる。売上高は22%増の1434億円になる見込みだ。東映アニメが手がける「ドラゴンボール超　スーパーヒーロー」（6月公開）や「ONE PIECE FILM RED（ワンピース　フィルム　レッド）」（8月公開）、「SLAM DUNK（スラムダンク）」（今秋公開）が貢献する。新型コロナウイルスの影響が和らぎ、興行関連事業も回復する。22年3月期の連結決算は、売上高が前の期比9%増の1175億円、純利益が23%増の89億円だった。映画「老後の資金がありません！」などがヒットした。,業績ニュース,東映23年3月期、純利益23%増　ドラゴンボールなど好調,https://www.nikkei.com/article/DGXZQOUC160PS0W2A510C2000000/
05/16/2022,トヨタ自動車が6月、環境や社会の課題解決につながる事業に使途を限定する社債「サステナビリティー債」を発行予定であることがわかった。16日、関東財務局に書類を提出した。2021年4月に最大で3千億円の社債を発行できる枠を確保しており、起債できる中身をトヨタのサステナ債の愛称「ウーブン・プラネット債」に改めた。具体的な金額や発行日、利回りは今後詰める。5年債と10年債を用意し、先進安全技術や電気自...,中部,トヨタ、6月に2回目のサステナ債　発行枠3000億円,https://www.nikkei.com/article/DGXZQOFD162JG0W2A510C2000000/
05/16/2022,◇三井ホームコンポーネント植竹　孝広氏（うえたけ・たかひろ）83年（昭58年）琉球大農卒、三井ホームコンポーネント入社。13年取締役、20年専務。宮崎県出身。61歳（5月16日就任。高田伸社長は退任）,,三井ホームコンポーネント社長に植竹氏,https://www.nikkei.com/article/DGXZQODZ00034_W2A510C2000000/
05/16/2022,システム開発のマッチボックステクノロジーズ（新潟市）は、ビル清掃のザイマックスサラ（東京・中央）に外国人技能実習生向けのシフト管理システムを導入した。複雑なシフト調整や業務のマッチングなどを一括管理できる。ザイマックスサラは現在60人の技能実習生を年内に100人まで増やす計画で、システムを活用し労務管理を効率化する。16日から試験運用を始めた。専用のアプリケーションを通じて清掃の求人情報を登録すると技能実習生側は自ら閲覧、応募しシフトに入ることができる。ビル清掃は早朝、短時間の業務が多くシフトが複雑になってしまうが企業側はアプリから簡単にシフトの調整や確認ができる。日本語が堪能でない技能実習生も、自身のシフトや作業スケジュールなどを確認しやすいという。マッチボックスの導入事業所数は2022年4月末時点で2626事業所。,新潟,マッチボックス、シフトを効率管理　技能実習生向け,https://www.nikkei.com/article/DGXZQOCC161CO0W2A510C2000000/
05/16/2022,東京都が新型コロナウイルス対策で実施している「リバウンド警戒期間」の期限である22日まで1週間を切った。都は4月下旬、新規感染者数の下げ渋りなどを踏まえて期間を1カ月延長した。その後、重症者数などの状況は徐々に改善したが、大型連休後には新規感染者が一時、前週を上回る傾向もみられるなど神経質な展開が続いている。都内の新規感染者数はゴールデンウイーク（GW）を挟んで一進一退の状況が続いた。GW後に...,東京,東京都の「リバウンド警戒」残り1週間　状況改善に濃淡,https://www.nikkei.com/article/DGXZQOCC12AR20S2A510C2000000/
05/16/2022,川崎市は16日、新型コロナウイルスワクチンの4回目の接種券を27日から順次発送すると発表した。3回目接種から5カ月以上が経過した60歳以上の市民が対象となる。オンラインとコールセンター、各医療機関への電話で予約を受け付け、早ければ5月下旬から接種できるという。3回目の接種を受けた18～59歳で基礎疾患のある人や重症化リスクが高いと医師が判断した人については、接種券発行申請手続きの案内を順次発送する。接種券の発行申請手続きが必要となる。,神奈川,川崎市、4回目ワクチン接種券27日から順次発送,https://www.nikkei.com/article/DGXZQOCC165R50W2A510C2000000/
05/16/2022,長野市や事業者らで組織する「長野市の観光と物産展実行委員会」は、ながの東急百貨店（長野市）正面玄関広場で、市内の若手事業者らを応援するイベント「ナガノ　ミライ　マルシェ」を21日と22日に開催する。パン店や総菜店など8店舗が参加。仮設店舗で商品を販売するほか、21日午後3時15分からは荻原健司市長と事業者が語り合うトークショーも開く。,長野,長野市内の若手応援するマルシェ　ながの東急百貨店で,https://www.nikkei.com/article/DGXZQOCC162YU0W2A510C2000000/
05/16/2022,ブルボンはグミ入りのモナカアイスを発売した。凍っていても柔らかいグミを独自開発し、バニラアイスの間に挟んだ。ぶどう味の甘酸っぱいグミと甘いバニラを組み合わせ、お菓子感覚で食べることができるという。量販店やドラッグストアなどで販売する。新商品の「グミーツイタリアングレープ味」は、四つ割りタイプのモナカアイスのひと山ずつにグミを加えた。グミはカベルネ・ソーヴィニヨンの果汁を使用したぶどう味。内容量は150ミリリットルで、店頭想定価格は200円前後。,新潟,ブルボン、アイスにグミをサンド　凍っても柔らか,https://www.nikkei.com/article/DGXZQOCC160T40W2A510C2000000/
05/16/2022,エイチ・ツー・オーリテイリング（H2O）は総額約100億円をかけて神戸阪急（神戸市）と高槻阪急（大阪府高槻市）を全館改装すると発表した。全館リニューアルは前身のそごう神戸店・西武高槻店時代も含め約20年ぶり。2023年秋ごろの改装終了を目指す。神戸阪急は三宮地区で進む再開発に合わせ、約80億円を投じて、売り場面積（4万2000平方メートル）の9割を改装する。都市型百貨店としてファッションや化粧...,関西,H2O、神戸阪急・高槻阪急の改装に100億円　20年ぶり,https://www.nikkei.com/article/DGXZQOUF13AGT0T10C22A5000000/
05/16/2022,経営再建を目指すマレリホールディングス（旧カルソニックカンセイ）は16日、東京都内で債権者会議を開いた。当初は5月末に開く予定だった再建計画などへの承認を得る最終の会議を6月末まで延期することについて、同日、取引先金融機関からの了承を得た。支援企業の選定に時間がかかっており、再建へのメドがまだ立っていない状況だ。マレリは3月1日に私的整理のひとつである事業再生ADR（裁判以外の紛争解決）の制度...,自動車・機械,マレリの再建計画成立、6月末に　支援企業選びに遅れ,https://www.nikkei.com/article/DGXZQOUC162IV0W2A510C2000000/
05/16/2022,セイコーエプソンの社員食堂で16日、ジビエ（野生鳥獣の食肉）を使った料理の提供が始まった。グループの国内全ての社員食堂で順次展開する。捕獲された動物の肉を有効活用することで、循環型社会の達成への寄与を目指す。長野県松本市の松本南事業所では「鹿肉と4種の野菜のガリバタパスタ」を販売する。食べた際に違和感の無い味を目指し、しょうゆを使ったシンプルな和風の味付けにした。肉が柔らかくなるように塩こうじを入れ、火加減を調整するなど工夫した。社員からは「サンショウがきいており、獣臭さが無くておいしい」との感想が聞かれた。16日には務台俊介環境副大臣が視察に訪れ、ジビエの普及に向けて「このような取り組みが積み重なることで、大きな流れにつながるだろう」と期待を寄せた。,長野,セイコーエプソン、社員食堂でジビエ料理　鹿肉を使用,https://www.nikkei.com/article/DGXZQOCC162OL0W2A510C2000000/
05/16/2022,バレーボール男子日本代表が16日、シーズン開幕を控えて東京都内で記者会見し、昨季イタリア1部リーグに初挑戦した東京五輪代表の西田有志（ビーボバレンティア）は「五輪に対する思いが一層強くなった。全員で貪欲に進みたい」と表情を引き締めた。2024年パリ五輪の出場国・地域は23年の五輪予選で6チーム、24年6月時点の世界ランキングで5チームが決まる。世界11位の日本を指揮するフィリップ・ブラン監督は「団結してパリの出場権を勝ち取っていく。そのために、できるだけ多く（ランキング）ポイントを取りたい」と、6月から始まるネーションズリーグでの活躍を期した。チームは東京都北区の味の素ナショナルトレーニングセンターで合宿中。主将の石川祐希（ミラノ）は18日に合流する。〔共同〕,スポーツ,西田有志「パリ五輪へ思い一層強く」　バレー男子代表,https://www.nikkei.com/article/DGXZQOKC168N40W2A510C2000000/
05/16/2022,スズキは16日、インド子会社のスズキ・モーターサイクル・インディアが、インド北部ハリヤナ州に二輪車工場建設のための土地を取得することで同州と合意したと発表した。足元では新型コロナウイルスの感染拡大で生産や販売に制約が出ているものの、インド市場の経済成長は続くと見て生産能力を増強する。同州で40万平方メートルの土地を購入する。工場の生産能力や稼働時期、投資額は今後詰める。スズキは同州で1工場を展開しており、生産能力は100万台。インドは世界最大級の二輪車市場。インド自動車工業会（SIAM）によると、同国の21年度の二輪車販売台数は前年比約1割減の1346万台だった。現地メーカーのヒーロー・モトコープやホンダが強く、スズキのシェアは21年度で4.5%だった。スズキは13日、インド子会社のマルチ・スズキがハリヤナ州に四輪車の新工場を建設すると発表していた。1100億ルピー（約1800億円）を投じて、2025年に生産能力25万台の工場として稼働する。【関連記事】,サービス・食品,スズキ、インドで二輪新工場の土地取得　生産能力を増強,https://www.nikkei.com/article/DGXZQOUC167FD0W2A510C2000000/
05/16/2022,札幌市は16日、総額82億円の2022年度補正予算案をまとめた。新型コロナウイルスに感染した自宅療養者への食料提供で63億円を計上するほか、予備費も10億円を盛り込むなど大半が新型コロナ関連だ。23日に開会する定例市議会に提出する。定例市議会の会期は6月6日まで。札幌市は新型コロナで自宅療養する患者に対し、食品や日用品などを10日分配っている。自宅療養者が1日あたり約1000人ずつ6カ月増え続けた場合でも対応できるという。スマートシティ推進費として、1億5500万円を充てる。対話アプリ「LINE（ライン）」の札幌市公式アカウントについて、利便性向上を図るとしている。,新型コロナ,札幌市補正予算案82億円、自宅療養の食料提供63億円,https://www.nikkei.com/article/DGXZQOFC164W00W2A510C2000000/
05/16/2022,日本ミシュランタイヤ（東京・新宿）は16日、レストランなどの格付け本「ミシュランガイド奈良2022特別版」を5月19日に発売すると発表した。同ガイドの奈良県版は2016年にウェブで発表して以来6年ぶりになる。2022年特別版には日本料理店を中心に県内の101店が掲...,関西,奈良県版「ミシュラン」、19日発売　二つ星は4店,https://www.nikkei.com/article/DGXZQOUF166510W2A510C2000000/
05/16/2022,北海道は16日、新たに2021人の新型コロナウイルス感染者を確認したと発表した。前の週の同じ曜日（9日、2556人）を下回った。15日時点の病床使用率は19.5%、重症者向けは4.3%。また北海道は患者6人の死亡を公表した。新規感染者数の内訳は北海道集計分が943人、札幌市が873人、旭川市が95人、函館市が93人、小樽市が17人だった。15日時点の患者数は前の日から33人少ない2万6167人。重症者数は引き続き6人だった。入院患者数は17人少ない418人。確保病床数は1675床で、このうち106床が重症者向けだ。,新型コロナ,北海道の新型コロナ感染新たに2021人,https://www.nikkei.com/article/DGXZQOFC166VN0W2A510C2000000/
05/16/2022,茨城県を中心とする鉄道・バス会社などが一堂に会し、鉄道開業150年記念のグッズ販売会がJR水戸駅のイベントスペースで開かれた。JR東日本水戸支社（水戸市）が水戸ステーション開発（同市）、ジェイアールバス関東（東京・江東）と共催。千葉県や福島県の鉄道会社や模型メーカーも「相乗り」し、多くの鉄道ファンを集めた。販売会は14、15日の土日に開いた。JR常磐線などのバスタオルやクリアファイルに加え、鹿島臨海鉄道（茨城県大洗町）やひたちなか海浜鉄道（同県ひたちなか市）など地方鉄道各社のグッズを販売。高速バスで事前に運んだ銚子電鉄（千葉県銚子市）の人気商品「ぬれ煎餅」「まずい棒」も人気を集めていた。販売会ではJR水郡線で当日に常陸大子駅（茨城県大子町）から輸送した、しゃも弁当やアップルパイも販売。鉄道模型の販売と運転体験を楽しむ家族客も目立った。しゃも弁当を購入した同県笠間市の37歳男性は「鉄道好きの子供と来た。新型コロナウイルス禍で中止が続いたイベントが再開されてうれしい」と笑顔。JR東日本水戸支社の担当者は「地域の方に鉄道の魅力にふれていただくとともに、我々が元気にやっている姿を発信するきっかけになれば」と話した。,サービス・食品,茨城などの鉄道・バスグッズ大集合　JR水戸駅で販売会,https://www.nikkei.com/article/DGXZQOCC1646X0W2A510C2000000/
05/16/2022,教職員の働き方改革などを目的に中学校と高等学校の部活動改革に向け、茨城県教育委員会の有識者会議が16日に提言をまとめた。指導などを学校から地域のスポーツ団体などに委ねる「地域移行」が柱。活動時間や休養日の規定順守や、休日に部活動指導の教員をゼロにする県の目標時期を2028年度から前倒しすることも盛り込んだ。学校長やPTA関係者、スポーツ団体による有識者会議で2月から議論してきた。16日に5回目の会合を開き、柴田一浩委員長が森作宜民教育長に提言書を手渡した。教員の負担軽減に加え、少子化が進む中でも生徒が好む部活動をできるよう、地域移行の推進を盛り込んだ。休日に大会などで活動した際に休養日を設け、年間に参加できる大会数に適切な上限を設けるなど、体制の見直しも提言した。森作教育長は「今の部活動は様々な課題がある。ここからがスタートラインとして改革に取り組む」と強調。柴田委員長は「委員から貴重な提言をいただき充実した内容になった」とし、地域移行については「持続可能になるよう、将来は一般社団法人などへの移行をお願いしたい」と述べた。県内の中学校では時期により時間外在校時間が月80時間を超す教職員もおり、原因で最も多いのが部活動という。改革を巡ってはスポーツ庁など国も地域移行を打ち出している。,茨城,部活動改革へ茨城の審議会が提言　学校から地域主体へ　,https://www.nikkei.com/article/DGXZQOCC165RR0W2A510C2000000/
05/16/2022,（西）　（東）剣翔X-X東龍荒篤1-0妙義翠富1-1碧山千翔7-7輝一山0-1琴勝栃心5-4佐海豊山2-2志摩照強2-1明生王鵬0-0宝富琴恵4-6千大錦木1-0宇良若元1-0隠岐隆勝2-4遠藤琴若2-3玉鷲大栄4-10高安阿炎1-0霧馬貴景11-9北富正代5-3若景翔猿0-2御嶽豊昇0-4照富,スポーツ,大相撲夏場所中入り後取組・10日目,https://www.nikkei.com/article/DGXZMSX000S01_W2A510C2000000/
05/16/2022,（勝）　　　　　　　（負）翠富士　すくい投げ　千代国王　鵬　突き出し　　荒篤山明　生　寄り倒し　　千代大佐田海　押し出し　　　輝一山本　突き出し　　千代翔東　龍　はたき込み　琴勝峰豊　山　送り出し　　照　強志摩海　突き落とし　妙義龍碧　山　小手投げ　　琴恵光宝富士　寄り切り　　錦　木栃ノ心　浴びせ倒し　若元春宇　良　押し出し　　隠岐海遠　藤　押し出し　　玉　鷲琴ノ若　突き落とし　北勝富霧馬山　押し出し　　大栄翔豊昇龍　とったり　　高　安正　代　押し出し　　阿　炎隆の勝　寄り切り　　御嶽海若隆景　はたき込み　貴景勝照富士　きめ出し　　翔　猿,スポーツ,大相撲夏場所中入り後勝負・9日目,https://www.nikkei.com/article/DGXZMSK3ISU01_W2A510C2000000/
05/16/2022,富士フイルムビジネスイノベーション（BI、旧富士ゼロックス）は16日、「Zoom（ズーム）」や「Teams（チームズ）」などのクラウドサービスと同社の複合機を接続するサービスを始めたと発表した。クラウドサービスで受信した文書ファイルなどをパソコンを使わずに複合機から直接印刷できる。複合機の利便性を高め、業務効率を高める新サービスとして売り込む。新サービス「アペオス・クラウド・コネクター」を16日に始めた。対象になるのは富士フイルムBIの複合機「Apeos（アペオス）」シリーズ。パソコンを使わずに複合機でスキャンしたデータを直接クラウドサービスで共有したり、受信した文書ファイルなどを複合機から直接印刷したりできる。複合機が受信したFAXをクラウドサービスで自動で共有する機能も使える。対応するクラウドサービスはズームやチームズのほか、サイボウズの「キントーン」や米セールスフォース・ドットコムの「Salesforce」など5つ。複合機1台あたりの利用料金は月額2000円もしくは3000円。利用するクラウドサービスによって金額が異なる。,エレクトロニクス,富士フイルムBI、複合機をズームなどクラウドと接続,https://www.nikkei.com/article/DGXZQOUC167FO0W2A510C2000000/
05/16/2022,自民党は16日、参院選で公認する予定候補1人を発表した。比例代表に新人の吉岡伸太郎氏を立てる。,政治,自民、参院で1人公認,https://www.nikkei.com/article/DGXZQOUA166Z00W2A510C2000000/
05/16/2022,【広州=川上尚志】中国の国家市場監督管理総局は16日、米テスラが電気自動車（EV）のリコール（回収・無償修理）を届け出たと発表した。対象は2021年10月～22年4月に中国で生産した小型車「モデル3」と多目的スポーツ車（SUV）「モデルY」の計10万7293台。急速充電中などに運転席のディスプレーの表示が遅くなったり表示できなくなったりする恐れがあるという。不具合の原因は、急速充電中に一部のCPU（中央演算処理装置）が十分に冷却されない場合があるためという。国家市場監督管理総局によると、テスラが「OTA（オーバー・ジ・エア）」と呼ぶ無線を介したソフトの更新によって不具合を基本的に解消するという。テスラの中国でのリコールは相次いでいる。22年には今回以外にも2月に1件、4月に2件のリコールを届け出た。計4回で延べ27万5809台が対象になった。,アジアBiz,テスラ、中国で約11万台リコール　今年4度目,https://www.nikkei.com/article/DGXZQOGM168EV0W2A510C2000000/
05/16/2022,パナソニックホールディングス傘下のパナソニックは16日、デスク設置型の発光ダイオード（LED）照明の2品番計3万8570台をリコールすると発表した。電子基板周辺の構造の問題で底面が発熱し、樹脂が溶ける恐れがあるため。製品本体からの発火や人的被害は出ていないという。対象製品の本体部分は、設計変更した新品に無償交換する。リコール対象は2021年6月から22年5月までに発売されたLEDデスクスタンド2品番。22年1月から3月に樹脂が融解する事故が4件確認されたという。,関西,パナソニック、デスク型LED照明　約4万台リコール,https://www.nikkei.com/article/DGXZQOUF167SB0W2A510C2000000/
