04/18/2022,姶良市長（鹿児島県）当17764湯元　敏浩　無現15880笹山　義弘　無元〔共同〕,政治,姶良市長に湯元氏再選,https://www.nikkei.com/article/DGXZQOUA173WC0X10C22A4000000/
04/18/2022,坂井市長（福井県）当31399池田　禎孝　無新7086東　外喜夫　無新〔共同〕,政治,坂井市長に池田氏初当選,https://www.nikkei.com/article/DGXZQOUA173WP0X10C22A4000000/
04/18/2022,加須市長（埼玉県）当23078角田　守良　無新8736山内　正明　無新〔共同〕,政治,加須市長に角田氏初当選,https://www.nikkei.com/article/DGXZQOUA173S10X10C22A4000000/
04/18/2022,黒部市長（富山県）当11132武隈　義一　無新10396小柳　勇人　無新〔共同〕,政治,黒部市長に武隈氏初当選,https://www.nikkei.com/article/DGXZQOUA173U10X10C22A4000000/
04/18/2022,栃木市長（栃木県）当41221大川　秀子　無現25559高際　澄雄　無新〔共同〕,政治,栃木市長に大川氏再選,https://www.nikkei.com/article/DGXZQOUA173RD0X10C22A4000000/
04/18/2022,【ロサンゼルス=共同】米南部サウスカロライナ州コロンビアのショッピングモールで16日、銃撃事件があり、少なくとも9人が撃たれて負傷、他に5人が逃げようとした際にけがをした。東部ペンシルベニア州ピッツバーグでも17日未明、銃撃事件があり、2人が死亡、複数人が負傷した。米メディアが伝えた。コロンビアの事件で、警察は銃の不法所持の疑いで22歳の男を逮捕した。買い物客を無差別に狙った犯行ではなく、特定の人物とのトラブルがあったとみて捜査を進めている。ショッピングモールは土曜日で多くの買い物客が訪れており、逃げ惑う人々や駆け付けた警察車両で一時騒然となった。ピッツバーグの銃撃は、200人規模のパーティー会場で発生。参加者の多くが未成年だったという。当局が捜査を進めている。米国では銃撃が後を絶たず、3日には西部カリフォルニア州サクラメントの繁華街で6人が死亡。12日にはニューヨークの地下鉄車内と駅ホームでも発砲事件があり、撃たれた10人を含む多数が負傷した。,北米,米で銃撃事件相次ぐ　南部と東部、2人死亡,https://www.nikkei.com/article/DGXZQOGN173O80X10C22A4000000/
04/18/2022,浅口市長（岡山県）当9594栗山　康彦　無現7803福田　　玄　無新〔共同〕,政治,浅口市長に栗山氏4選,https://www.nikkei.com/article/DGXZQOUA173QX0X10C22A4000000/
04/18/2022,出水市長（鹿児島県）当19264椎木　伸一　無現4729筑紫みずえ　無新〔共同〕,政治,出水市長に椎木氏再選,https://www.nikkei.com/article/DGXZQOUA173QB0X10C22A4000000/
04/18/2022,▽8時20分　公邸発。44分　羽田空港。▽9時46分　全日空747便で能登空港。▽10時3分　石川県輪島市の「里山まるごとホテル」。レストラン「茅葺庵三井の里」で地元企業関係者らと車座で意見交換。記念撮影。▽11時23分　七尾市ののと里山海道別所岳サービスエリア。休憩。56分　同市の公園「湯っ足りパーク」前。街頭演説。▽12時49分　同市の道の駅「能登食祭市場」。観光市場を視察。▽13時7分　同市の印鑰神社。巨大な山車「でか山」制作を視察。あいさつ。18分　同市のすし店「松乃鮨」。西田昭二衆院議員らと昼食。47分　報道各社のインタビュー。▽14時32分　かほく市ののと里山海道高松サービスエリア。休憩。▽15時12分　金沢市の「いしかわ四高記念公園」。街頭演説。▽16時31分　能美市の根上総合文化会館前。街頭演説。▽17時16分　小松市のうどん店「中佐中店城南店」。佐々木紀衆院議員と食事。53分　小松空港。55分　貴賓室で佐々木衆院議員、宮橋勝栄小松市長ら。▽19時14分　日本航空190便で羽田空港。45分　公邸。,首相動静,17日の岸田首相の動静,https://www.nikkei.com/article/DGXZQOUA171460X10C22A4000000/
