12/27/2021,政府は地方創生関連の交付金の支給について、自治体によるデジタル技術の活用を要件とする。観光振興や人材育成、情報インフラ整備などに関する4つの交付金が対象となる。2022年度から実施し、地方のデジタル化を後押しする。政府が近く開くデジタル田園都市国家構想実現会議で示す「施策の全体像」の原案に盛り込んだ。対象は①地方創生推進交付金②地方大学・地域産業創生交付金③地方創生拠点整備交付金④デジタル田園都...,政治,地方創生交付金にデジタル要件　政府、観光支援など対象,https://www.nikkei.com/article/DGXZQOUA22DNL0S1A221C2000000/
12/27/2021,【ブリュッセル、モスクワ=共同】DPA通信は26日までに、北大西洋条約機構（NATO）当局者の話として、NATOが来年1月12日に「NATOロシア理事会」の会合を招集することを検討していると伝えた。緊迫するウクライナ情勢を協議するためだとみられる。タス通信は26日、ロシア外務省筋が、既に1月12日の開催提案を正式に受け取り「これを検討している」と確認したと伝えた。同理事会はNATOとロシアがテロ対策や大量破壊兵器の拡散防止で協力するために2002年に設立した共同意思決定機関。実際に開かれれば約2年半ぶり。ロシアのグルシコ外務次官（NATO担当）は26日、タス通信に対し、開催の場合には軍の幹部が同席するべきだとの考えを示した。NATOのストルテンベルグ事務総長は21日、ブリュッセルでの記者会見で、来年初めに同理事会を招集することに前向きな姿勢を示していた。,北米,1月12日にロと協議開催も　NATO、ウクライナ情勢,https://www.nikkei.com/article/DGXZQOGN263RE0W1A221C2000000/
12/27/2021,【ロンドン=共同】サッカーのイングランド・プレミアリーグのアーセナルは26日、日本代表DF冨安健洋が新型コロナウイルスの検査に陽性反応を示したと発表した。他にも陽性だった2選手とともに、同日のノリッジ戦でベンチ外となった。冨安は加入後のリーグ戦で、ここまで全15試合に先発出場していた。,スポーツ,アーセナル冨安、コロナ陽性　リーグ戦初のベンチ外に,https://www.nikkei.com/article/DGXZQOKC263PZ0W1A221C2000000/
12/27/2021,午前中は来客なく、公邸で過ごす。▽17時27分　東京・虎ノ門のホテル「The Okura Tokyo」。フランス料理店「ヌーヴェル・エポック」で山際経財相、小林経済安保相、木原官房副長官、甘利明前幹事長と会食。▽20時30分　公邸。,政治,26日の岸田首相の動静,https://www.nikkei.com/article/DGXZQOUA2616M0W1A221C2000000/
12/27/2021,世界的な超低金利で日本の不動産に流入した海外投資マネー。米国の金融緩和縮小で流れは変わるのか。新型コロナウイルス禍を経たグローバル不動産市況の見通しを不動産サービス大手のジョーンズラングラサール（JLL）の河西利信社長に聞いた。――コロナ禍で不動産マネーは変わりましたか。「感染拡大で景気が落ち込んだ局面でも不動産への投資意欲は底堅かった。信用収縮で投資が急減した2008年のリーマン・ショック時...,経済,不動産市場、海外マネー流入底堅く　JLL河西社長,https://www.nikkei.com/article/DGXZQOFE269840W1A121C2000000/
12/27/2021,ビジネス会議で激論が交わされなくなって久しい。ところが先日のオンライン討論会では珍しく意見が真っ向から対立した。在宅勤務と出社を組み合わせる「ハイブリッド型」が実際に機能するかが議論され、働き方の自由をどこまで認めるかで意見が分かれた。討論者4人のうち3人は、新型コロナウイルスの感染拡大前はオフィスでの勤務形態が柔軟性を欠き、非人間的で非生産的だったという意見だった。コロナでようやく働き方改革...,FT,[FT]働き方はどこまで自由に,https://www.nikkei.com/article/DGXZQOCB158KB0V11C21A2000000/
12/27/2021,サッカーのスコットランド・プレミアリーグで26日、古橋亨梧の所属するセルティックはアウェーでセントジョンストンに3-1で勝った。先発出場した古橋は、1-0の前半15分に負傷交代した。味方のパスに走り込んだ際に右太もも裏を押さえて座り込み、プレーを続行できなかった。〔共同〕,スポーツ,古橋、序盤に負傷交代　スコットランド・プレミアL,https://www.nikkei.com/article/DGXZQOKC263I10W1A221C2000000/
12/27/2021,ほぼノーミスといっていい演技にガッツポーズが出たものの、すぐに鍵山の目から涙があふれ出した。「ホッとした。すごく緊張していて。五輪選考会で僕も（代表）候補の一人として期待があったので……、ホッとした」【関連記事】初めての五輪選考会挑戦とは思えぬような堂々とした演技ながら、そこは18歳。何度も「ホッとした」と繰り返した。今季はグランプリシリーズで2連勝したが、満足のいく演技はできていなかった。「苦しい演技が...,スポーツ,18歳・鍵山、堂々演技も安堵の涙　全日本フィギュア3位,https://www.nikkei.com/article/DGXZQODH262YI0W1A221C2000000/
