02/10/2022,▽9時42分　公邸から官邸。▽10時35分　村井補佐官。▽11時　カナダのトルドー首相と電話。29分　中谷補佐官。50分　日・EUビジネス・ラウンドテーブルの柵山正樹共同議長、ムロチェク共同議長代理らの表敬。提言書受け取り。▽13時35分　四方内閣広報官、森昌文補佐官、総務省の黒田次官、大村新型コロナウイルス感染症対策地方連携総括官。▽14時4分　萩生田経産相、滝崎官房副長官補、中谷補佐官、岡野外務省総合外交政策局長、経産省の多田次官、松尾通商政策局長。22分　経産相、経産省の次官、平井経済産業政策局長。59分　小池百合子東京都知事。▽15時26分　吉村洋文大阪府知事とオンラインで面会。52分　古賀篤衆院議員。▽16時29分　安倍晋三元首相。▽17時6分　後藤厚労相、斉藤国交相、松野、木原、栗生正副官房長官、山際経財相、堀内ワクチン相、藤井官房副長官補、迫井新型コロナウイルス等感染症対策推進室長、吉田厚労次官。19分　森昌文補佐官加わる。▽18時51分　報道各社のインタビュー。▽19時30分　イランのライシ大統領と電話。▽20時17分　公邸。,政治,9日の岸田首相の動静,https://www.nikkei.com/article/DGXZQOUA094JB0Z00C22A2000000/
02/10/2022,今回の診療報酬改定は平時の議論の延長線上にとどまり、新型コロナウイルスが突き付けた医療体制の弱点を早急に克服しようという危機感が感じられなかった。危機時に強い医療体制をつくるには、報酬増額によって医療機関の誘導を図る仕組みでは限界がある。医療機関にとって診療報酬単価の引き上げはその医療行為の収益性が上がり、自院で実施するインセンティブが高まることを意味する。このため厚生労働省は重要だと考える医療...,柳瀬 和央,報酬加算での誘導に限界　医療立て直しの危機感薄く,https://www.nikkei.com/article/DGXZQOCD085FH0Y2A200C2000000/
02/10/2022,【北京=共同】北京冬季五輪で8日夜に開催予定だったフィギュアスケート団体のメダル授与式が「法的な問題」を理由に急きょ中止されていたことが9日、分かった。国際オリンピック委員会（IOC）のアダムス広報部長は定例会見で「法的な協議が国際スケート連盟と必要になった。新たに出てきた問題であり、明確になった時点で情報提供する」と述べた。英紙ガーディアンは金メダルだったロシア・オリンピック委員会（ROC）に、ドーピング検査で競技力向上の効果がない物質で陽性反応を示した選手がいたと報じた。一方、ロシア紙スポーツ・エクスプレス（電子版）は、8日の男子ショートプログラム（SP）で羽生結弦（ANA）が氷の穴にはまってミスしたジャンプを巡り、直前に演技したROC選手が「羽生ファンから殺害の脅迫を受け、授与式が中止された」との記事を掲載した。7日まで実施されたフィギュア団体で日本は初の表彰台となる銅メダルを獲得。日本オリンピック委員会（JOC）によると、全8選手が8日のメダル授与式に出席予定だったが、具体的な理由の説明もなく直前で取りやめとなった。新たな日程も決まっていない。,北京五輪,フィギュア団体、授与式中止　ロシアにドーピング報道も,https://www.nikkei.com/article/DGXZQODH09F0Q0Z00C22A2000000/
02/10/2022,【ベルリン=共同】ドイツのベーアボック外相は9日、外務省の国際気候政策担当職に環境保護団体グリーンピースのモーガン事務局長が就任すると発表した。モーガン氏は米国籍の環境活動家で、2003年からドイツ在住。今後、ドイツ国籍を取った上で外務省高官となり、気候変動対策を担当する。報道によると、モーガン氏は環境保護政党「緑の党」のベーアボック氏と以前から交流があった。気候関連の国際会議でドイツ政府代表を務める見通し。9日の記者会見で、これまで特定の国を代表するのではなく、国際組織の一員として活動してきた経歴について問われ「私の心はドイツにある。ドイツ政府のために働く」と語った。,ヨーロッパ,環境団体幹部、独外務省に　グリーンピース事務局長,https://www.nikkei.com/article/DGXZQOGN09EWE0Z00C22A2000000/
02/10/2022,新型コロナウイルスの影響で学校や保育施設の休業が相次ぎ、育児のために仕事を休まざるを得ない保護者の苦悩が深まっている。有給休暇を使い切って欠勤となった家庭の収入が減るなか、公的助成制度は使い勝手が悪いとの声が根強い。国は手続きの見直しを急いでいるが、コロナ下での仕事と育児の両立支援は道半ばだ。「また休校となれば仕事を休むしかなく、収入が減ってしまう」。東北地方の40代女性会社員は不安な日々を過ご...,新型コロナ,コロナ育児で休業、収入減に苦悩　両立支援道半ば,https://www.nikkei.com/article/DGXZQOUE134EK0T10C22A1000000/
02/10/2022,【ベルリン=石川潤】ドイツ連邦銀行のナーゲル総裁は9日、独紙ツァイトとのインタビューで、欧州中央銀行（ECB）の利上げが「年内にもあり得る」との考えを明らかにした。ECBはラガルド総裁が3日の記者会見で、年内利上げを排除しない姿勢を示したばかり。物価上昇が想定以上に長引くなか、緩和縮小の加速を求める声が高まってきた。ナーゲル氏は3月の次回理事会までにインフレの状況が変わらなかった場合には「金融政策の正常化を（理事会で）提唱する」と指摘。まず2022年中に量的緩和政策を終了したうえで、年内の利上げもあり得るとの認識を明らかにした。ECBではオランダ中銀のクノット総裁も、22年10～12月に利上げがあるとの見通しを示している。金融緩和の継続に否定的なタカ派の理事を中心に、年内の利上げは避けられないとの見方が広がっている。ECBは当初、物価上昇は一時的だとして、早期の利上げに慎重な姿勢を示していた。ところが、ユーロ圏の1月の物価上昇率が市場予想を大幅に上回る過去最高の前年比5.1%となると、行内の雰囲気が一変した。物価上昇に早めに対処しなければ、インフレの勢いを抑えにくくなるとの警戒が強まっている。ECBはコロナ危機対応で導入した緊急買い取り制度を3月末で打ち切り、資産購入量を段階的に減らしていく方針を明らかにしている。新しい物価見通しをまとめる3月10日の次回理事会で、緩和縮小の前倒しが必要かどうかを判断する。,金融政策,ドイツ連銀総裁「年内利上げも」　欧州中銀に圧力,https://www.nikkei.com/article/DGXZQOGR09EDE0Z00C22A2000000/
02/10/2022,【NQNニューヨーク=戸部実華】9日の米株式市場でダウ工業株30種平均は3日続伸して始まり、午前10時現在は前日比266ドル39セント高の3万5729ドル17セントで推移している。インフレや金融引き締めへの警戒はくすぶっているものの、最近の金利上昇である程度織り込んだと判断した買いが入っている。発表が一巡しつつある米主要企業の決算がおおむね市場予想を上回った点も買いを支えている。長期金利上昇が売り材料になっていたハイテク株が買われ、ソフトウエアのマイクロソフトやスマートフォンのアップル、顧客情報管理のセールスフォース・ドットコムが高い。ダウ平均の構成銘柄以外では検索サイトのアルファベットやネット通販のアマゾン・ドット・コムも買われている。消費関連株にも幅広く買いが入っている。クレジットカードのビザやスポーツ用品のナイキ、娯楽・映画のウォルト・ディズニーが高い。米国の新型コロナウイルスの感染者数の減少傾向が明らかになり、経済活動が正常化に向かうとの見方も消費関連株の買いにつながっている。投資調査会社の米ファクトセットの前週末時点のまとめでは、米主要500社で決算発表（主に10～12月期）を終えた企業のうち、76%の企業で1株利益が市場予想を上回った。,,NYダウ続伸で始まる　幅広い銘柄に買い、好決算も支え,https://www.nikkei.com/article/DGXZQOGN00053_Q2A210C2000000/
02/10/2022,アース製薬の2022年12月期は、連結営業利益が110億円前後になる見通しであることが分かった。前期推定比で微増になる可能性が高い。新型コロナウイルス下で消費者の在宅時間が増えるなか、主力の家庭用殺虫剤が底堅く、入浴剤も伸びる。今期は連結純利益が70億円を超え、連結売上高は2000億円前後になりそうだ。22年12月期から新たな収益認識基準を適用し、21年12月期と比べ実質増収となる。コロナ下で殺虫剤、入浴剤の使用機会が増えている。殺虫剤はゴキブリのほか、ダニ、コバエ向けの需要が好調だ。アース製薬はペット用で商品数を減らし、ノミ予防などの分野に集中して収益性を高める。入浴剤は21年12月期は売り上げが前の期比10%以上伸びたもようで、22年12月期も2桁増収が続くとみる。21年秋ごろから原材料高が収益を圧迫しており、22年12月期は10億円弱の減益要因になると見込む。コスト増を増収効果で補う。2月14日に21年12月期決算の発表を予定する。21年12月期は連結売上高で前の期比4%増の2037億円、営業利益は7%減の106億円、純利益は2倍の71億円を見込んでいる。,業績ニュース,アース製薬の今期、営業益110億円　入浴剤伸びる,https://www.nikkei.com/article/DGXZQOUC08BNH0Y2A200C2000000/
02/10/2022,【ソウル=細川幸太郎】韓国サムスン電子は9日、スマートフォンの2022年の旗艦モデル「ギャラクシーS22」シリーズを発表した。人工知能（AI）が自動でズームや明暗を調整するカメラ機能を搭載した。11年に登場した大画面モデル「ギャラクシーノート」ブランドは廃止し、Sシリーズに統合する。新モデルは、画面サイズが6.1インチの「S22」（799.99ドル）と6.6インチの「S22プラス」（999.99ドル）、6.8インチの「S22ウルトラ」（1199.99ドル）の3機種を用意した。販売価格は前年モデルの水準に据え置いた。25日から世界で順次、発売する。大画面モデルのウルトラには、ノートシリーズの特徴だった内蔵タッチペンを備えた。サムスンは21年にノートシリーズの発売を見送っている。今後はSシリーズと折り畳み型の2種類を最上位モデルと位置付ける。ウルトラは1億800万画素の高画素カメラのほか、超広角カメラ、望遠カメラ2種の「4眼」とした。人の動きを認識して自動で焦点やズームを調整する機能も備え、カメラ性能にこだわる消費者に訴求する。ディスプレーは自社製の有機ELパネルを採用した。スマホの頭脳となるCPU（中央演算処理装置）は処理性能を左右する回路線幅が4ナノ（ナノは10億分の1）メートルの自社の最先端品を搭載した。,アジアBiz,サムスン、スマホ旗艦モデル発表　大画面「ノート」廃止,https://www.nikkei.com/article/DGXZQOGM099500Z00C22A2000000/
