12/20/2021,阪神の青柳晃洋投手が20日、兵庫県西宮市の球団事務所で契約交渉し、7千万円増の年俸1億2千万円で更改した。今季はセ・リーグ最多勝と勝率第1位の2冠に輝く大躍進。「これが最高点にならないように。開幕投手を経験してみたい」と意気盛んに話した。金メダルを獲得した東京五輪にも出場した今季は25試合に登板し、自身初の2桁勝利となる13勝6敗、防御率2.48と抜群の安定感を誇った。嶌村聡球団本部長から「次は阪神の代表として（2023年に開催予定の）WBC（ワールド・ベースボール・クラシック）だな」と声を掛けられたそうで「また呼んでもらえるように」と気持ちを高めた。（金額は推定）〔共同〕,スポーツ,阪神・青柳、1.2億円で更改　最多勝と勝率1位の2冠,https://www.nikkei.com/article/DGXZQOKC207RG0Q1A221C2000000/
12/20/2021,東京都は20日、新型コロナウイルスの感染者が新たに11人確認されたと発表した。直近1週間平均の新規感染者は25人で、前週（約17人）比で143.7%だった。都内の感染者は累計38万2564人となった。重症者は前日と変わらず3人。新たな死亡の確認はなく、累計の死者数は3172人となっている。新規感染者を年代別にみると、30代、40代がいずれも3人と最も多かった。65歳以上の高齢者は2人だった。,新型コロナ,東京都、新たに11人感染　7日平均で前週の143.7%,https://www.nikkei.com/article/DGXZQOCC200CP0Q1A221C2000000/
12/20/2021,【北京=羽田野主】中国共産党の元高官と不倫関係にあったと告白したとされるテニス選手、彭帥さんが19日に海外メディアの取材を受けた。中国当局が早期の幕引きを狙った面がありそうだが、本人の自由な意思による発言かどうかは微妙で、欧米諸国の不信を払拭できるかは不透明だ。彭さんは11月に中国版ツイッター「微博（ウェイボ）」で、元副首相の張高麗氏に性行為を迫られ泣いたなどと告白した。投稿はいまは閲覧できない。不倫告白後に海外メディアの取材を受けるのは初めてとみられる。彭さんは上海で、シンガポール紙・聯合早報の取材に答えた。聯合早報が公開した動画で、彭さんは「誰かが性的暴行を加えたと言ったり書いたりしたことは一度もない」と話した。「プライバシーの問題」について誤解があるとし、自身は当局の監視下に置かれていないと語った。張氏との不倫が事実かどうかは触れていない。「北京で普段は何をしていますか？毎日外に出ていますか、あるいは友達に会いにいけますか？」との質問には「時間があれば改めてみなさんにお伝えしたい」と述べた。女子テニス協会（WTA）のスティーブ・サイモン最高経営責任者（CEO）に宛てて「無事」と説明したメールは自身の意思で送ったとした。ロイター通信によると、WTAは「重大な懸念の解消にはつながっていない」と指摘した。性的暴行の疑いについて検閲のない、透明性のある調査を求める声明を出した。WTAは問題を受け中国での大会開催見送りを発表している。2022年2月開幕の北京冬季五輪では米英豪が政府代表を派遣しない外交ボイコットを表明した。米欧でテニス選手の安否への関心は高く、情報公開に消極的な中国の姿勢に批判がでていた。,中国・台湾,中国テニス選手、海外紙で暴行否定　当局が幕引き模索か,https://www.nikkei.com/article/DGXZQOGM205BV0Q1A221C2000000/
12/20/2021,JR東日本は20日、台湾旅行者向けのウェブサイトを21日に開設すると発表した。新型コロナウイルスの感染拡大が収まった後のインバウンド（訪日外国人）需要の回復を見据える。台湾はJR東の展開する鉄道パスの利用が多く、日本や鉄道に関心が高い。同サイトからは訪日・在留外国人旅行者向けの新幹線eチケットなどが購入できるサイトに移動できる。情報サイト「JR TIMES」では、新幹線やイベント列車など鉄道に焦...,インバウンド,JR東、台湾旅行者向けサイト　インバウンド回復見据え,https://www.nikkei.com/article/DGXZQOUC204OY0Q1A221C2000000/
12/20/2021,日本ハムから自由契約となりDeNAに入団した大田泰示外野手が20日、横浜市の球団事務所で記者会見に臨み「まず安心した。一生懸命プレーする姿を子どもたちやファンの方々に見てもらって、何か印象に残ってもらえるようにしたい」と意気込みを語った。背番号は0に決まった。東海大相模高時代に過ごした神奈川県を本拠地とするDeNAからのオファーに「すごく縁があると思った。ここでプレーできるならこれ以上の喜びはない」と言う。横浜スタジアムでは高校時代、3年続けて夏の地方大会決勝で敗れており「今度は必ず、優勝の瞬間にグラウンドに立っていたい」と話した。今季打率3割台をマークした佐野、桑原らと外野の一角を争う。「選手としてより高みを目指して、レギュラーを取りにいく」と言葉に力を込めた。〔共同〕,スポーツ,DeNA入団の大田「一生懸命プレー」　意気込み語る,https://www.nikkei.com/article/DGXZQOKC206VN0Q1A221C2000000/
12/20/2021,世界ボクシング機構（WBO）スーパーフライ級王者の井岡一翔（志成）が20日、オンラインで記者会見に臨み、同級6位の福永亮次（角海老宝石）と闘う31日のタイトルマッチへ「やると決めたからには負けられない。それに尽きる。結果を出さないといけない」と意気込みを語った。当初予定された国際ボクシング連盟（IBF）王者のジェルウィン・アンカハス（フィリピン）との王座統一戦が、新型コロナウイルスの新変異株拡大の影響で来日できず中止に。「目標がなくなり、心に穴があいた感じだった」と当時の心境を明かした。福永はアンカハスと同じサウスポー。高いKO率を誇り、井岡は「向こうも巡ってきたチャンスで、気持ちも相当上がっていると思う。気を引き締めていきたい」と警戒した。志成ジムによると、アンカハス陣営とは福永戦後に対戦することで合意しているという。〔共同〕,スポーツ,ボクシング井岡「結果出さないと」　31日世界戦,https://www.nikkei.com/article/DGXZQOKC206YC0Q1A221C2000000/
12/20/2021,愛知県は20日、高齢者施設などの利用者や従事者への接種を6カ月に前倒しするよう求める通知を市町村に出した。対象は最大56万人。大村秀章知事は記者会見で、ファイザー製ワクチンの県内在庫58万回分（11月末時点）でまかなえるとの認識を示した。大村氏は「医療機関が運営する介護施設では年内に接種を始められる」とも述べた。,新型コロナ,在庫活用で前倒し　愛知県、3回目ワクチン接種で,https://www.nikkei.com/article/DGXZQOFD2076H0Q1A221C2000000/
12/20/2021,マーケティング支援のunerry（ウネリー、東京・千代田）は東京地下鉄（東京メトロ）の子会社で広告事業を手掛けるメトロアドエージェンシー（東京・港）と共同で、地下鉄利用者の属性や行動を分析するシステムを開発した。駅利用者の興味を把握することで、企業のより効果的な広告配信を支援する。ウネリーは各地に設置されたビーコンとスマホの電波を送受信してスマホ所有者の位置情報や行動を分析する技術をもつ。スマホ...,スタートアップ,ウネリー、地下鉄利用者の行動分析ツール開発,https://www.nikkei.com/article/DGXZQOUC1917K0Z11C21A2000000/
12/20/2021,ヤクルトは20日、米国出身のアンドリュー・スアレス投手（29）=185センチ、88キロ、左投げ左打ち=を獲得したと発表した。年俸80万ドル（約9000万円）プラス出来高払いの1年契約で、背番号は50。奥村政之編成部国際担当部長は「先発要員。外国人の先発候補が3人になったが、左投げが不足しているのでぜひローテーションに入ってほしい」と期待した。今季は韓国のLGで10勝2敗、防御率2.18の好成績を挙げた。昨季までは米大リーグ、ジャイアンツに所属し、通算56試合で7勝15敗、防御率4.66。（金額は推定）〔共同〕,スポーツ,ヤクルト、スアレスを獲得　先発要員の左投手,https://www.nikkei.com/article/DGXZQOKC2070W0Q1A221C2000000/
12/20/2021,原油でアジア市場の指標となる中東産ドバイ原油のスポット価格は20日午後、下落した。取引の中心となる...,商品概況,ドバイ原油・20日午後、下落　70.20ドル前後,https://www.nikkei.com/article/DGXZQOUB207BY0Q1A221C2000000/
12/20/2021,◇グレイステクノロジー大池　信之氏（おおいけ・のぶゆき）98年（平10年）関西大経卒、新日本証券（現みずほ証券）入社。19年グレイステクノロジー取締役。大阪府出身。47歳（12月17日就任。飯田智也社長は退任）,,グレイステクノロジー社長に大池氏,https://www.nikkei.com/article/DGXZQODZ00008_Q1A221C2000000/
12/20/2021,大阪市は20日、医療従事者や高齢者を対象に新型コロナウイルスワクチンの3回目接種を前倒しすると発表した。市は現在、2回目接種から原則8カ月以上経過した18歳以上の市民に3回目接種を実施しているが、国の方針に基づき早める。まず、2回目から6カ月以上経過した医療従事者と高齢者施設の入所者や職員ら約11万7000人を対象に始まる。5月中に2回目接種が完了した人には12月21日、6月19日までに完了した人には2022年1月5日に接種券を発送する。接種券が届き次第、予約・接種が可能となる。高齢者施設など接種者の情報が管理できる場合は、接種券が届く前の接種も認めるとしている。医療機関や高齢者施設での個別接種のほか、市が設置する集団接種会場「城見ホール」（大阪市中央区）と「やすらぎ天空館」（同市阿倍野区）でも接種できる。使用するワクチンは主に米ファイザー製で、22年1月11日からやすらぎ天空館で米モデルナ製も接種できる。65歳以上の高齢者は、2回目接種から原則7カ月以上を対象とする。接種券の発送日は未定だ。松井一郎市長は「国から示されるワクチンの配分計画等を踏まえて対応していく」と説明した。,関西,大阪市、3回目接種前倒し　医療従事者・高齢者施設から,https://www.nikkei.com/article/DGXZQOUF204TL0Q1A221C2000000/
12/20/2021,【NQN香港=川上宗馬】20日の中国・上海株式相場は続落した。上海総合指数の終値は前週末比38.7619ポイント（1.06%）安の3593.6019だった。6日以来2週間ぶりの安値を付け、心理的節目の3600を下回った。中国景気の減速懸念がくすぶるなか、投資家が運用リスクを回避する姿勢を強めた。中国人民銀行（中央銀行）は20日に実質的な政策金利に相当し、優良企業向け融資の指標となる最優遇貸出金利...,上海株式相場,上海株大引け　続落、2週間ぶり安値で3600割れ　利下げも反応限定,https://www.nikkei.com/article/DGXZASFL20HVC_Q1A221C2000000/
12/20/2021,大阪府と大阪市が誘致を進めるカジノを含む統合型リゾート（IR）で、建設予定地の人工島・夢洲（ゆめしま）の土壌対策費として市が約800億円を負担すると算出したことが20日、分かった。国に提出する「区域整備計画」の策定にあわせて、市が汚染残土の処分などを費用を見積もった。夢洲の予定地周辺ではヒ素やフッ素による土壌汚染が確認されているほか、掘削調査で地中に液状化の恐れがあ...,税・予算,夢洲の土壌対策　大阪市が800億円負担の方針,https://www.nikkei.com/article/DGXZQOUF200IG0Q1A221C2000000/
12/20/2021,【NQNシンガポール=今　晶】20日の日経アジア300指数は続落している。16時時点は前週末比1.60%安の1666.73だった。新型コロナウイルスの変異型「オミクロン型」の感染拡大を不安視する空気が根強く、リスク回避の売りが続いた。前週末の米市場ではオミクロン懸念に加え、金融政策の正常化ペースが速まるとの思惑もあって株安が進行。投資家は一段とリスク回避の姿勢に傾いた。中国人民銀行（中央銀行）が...,アジア株概況,アジア300指数・16時　続落、消えぬオミクロン懸念　中国利下げも響く,https://www.nikkei.com/article/DGXZASFL20HV8_Q1A221C2000000/
12/20/2021,【NQN香港=エブリン・チャン】20日の韓国株式市場で総合株価指数（KOSPI）は4営業日ぶりに反落した。終値は前週末比54.73ポイント（1.81%）安の2963.00と、心理的な節目の3000を割り込み、約3週間ぶりの安値を付けた。前週末の米株安や新型コロナウイルスの変異型「オミクロン型」への警戒感を受け、投資家が運用リスクを回避する姿勢を強め...,アジア株概況,韓国株20日　4日ぶり反落、米株安などで　サムスン電子安い,https://www.nikkei.com/article/DGXZASB2IDE22_Q1A221C2000000/
12/20/2021,プリマハムは20日、家庭用のハム・ソーセージや業務用商品など200品目を2022年2月1日納品分から値上げすると発表した。主力ソーセージ「香薫（こうくん）あらびきポーク」は約5%値上げする。原料である畜肉価格の高騰に加え、加工に使う小麦粉や食用油などのコスト上昇を反映する。値上げは14年8月以来約7年半ぶりになる。対象は家庭用ハム・ソーセージ74品目、家庭用加工食品90品目、業務用商品36品目。5～12%値上げするほか、一部は内容量の変更で対応する。ローストビーフや一部フランクソーセージを9月以降に先行して値上げしていたが、今回計200品目を追加する。同業では日本ハムが22年2月から、伊藤ハム米久ホールディングス（HD）傘下の伊藤ハムと米久がそれぞれ3月から、家庭用ハム・ソーセージなどを値上げすると発表している。,,プリマハム、200品目5～12%値上げ　22年2月から,https://www.nikkei.com/article/DGXZQOUC204QD0Q1A221C2000000/
12/20/2021,来季J2降格となり、今季限りで退任する大分の片野坂知宏監督（50）が20日、昭和電工ドーム大分で記者会見に臨み「今年は悔しい思いばかりで非常に悔いが残るが、本当に幸せだった」と涙を流しながら話した。就任6年目の今季はJ1で18位に終わり、J2降格が決定。最後の試合となった19日の天皇杯全日本選手権決勝では優勝を逃したものの、九州のJリーグクラブとして初の決勝進出を果たした。選手らに向けて「必ず来季につながる財産になると思う。厳しい戦いを勝ち抜いてほしい」とエールを送った。J3だった2016年に就任。緻密な戦術と選手起用で組織力を高め、18年にJ2で2位に入ってJ1昇格に導いた。来季はJ1のG大阪の監督就任が有力となっている。〔共同〕,スポーツ,J2降格の大分、片野坂監督が退任　「悔い残るが幸せ」,https://www.nikkei.com/article/DGXZQOKC206BA0Q1A221C2000000/
12/20/2021,小林　泰宏氏（こばやし・やすひろ=元朝日新聞社常務）12月8日、心不全のため死去、75歳。連絡先は同社秘書部。告別式は近親者で行った。喪主は妻、明子さん。,,小林泰宏氏が死去　元朝日新聞社常務,https://www.nikkei.com/article/DGXZQOUE206990Q1A221C2000000/
