12/22/2021,経団連は22日、大企業が支給する冬の賞与（ボーナス）の集計結果を公表した。加重平均の妥結額は前年比5.16%減の82万955円となった。前年比マイナスは2年連続。金額は2013年（80万6007円）以来の低い水準となった。新型コロナウイルス禍の影響が続き、非製造業がデータを遡れる1997年以降で過去最大の下落率となったことが響いた。東証1部上場で従業員500人以上の164社分を集計した。製造業は1.32%減の85万3475円、非製造業は18.01%減の71万2019円だった。業種別にみると、非製造業ではコロナ禍による運行状況への影響が続く私鉄が22.26%減、建設が17.18%減と大きく落ち込んだ。一方、売り上げが復調傾向にある商業（百貨店）は23.15%増となった。製造業は自動車が4.57%減、鉄鋼が4.74%減となる一方、繊維や化学、非鉄・金属は増加に転じた。経団連の担当者は「業種間だけでなく、同業種内での格差も広がっている」と分析している。,経済,冬のボーナス5%減、経団連集計　非製造業は下げ幅最大,https://www.nikkei.com/article/DGXZQOUA225SG0S1A221C2000000/
12/22/2021,首相の岸田文雄（64）が女房役に選んだのは、安倍晋三（67）が推した萩生田光一（58）でも岸田派の小野寺五典（61）でもなかった。「私の才覚を見込んでではないと思う」。政権発足の10月4日。官房長官として記者会見場に立った松野博一（59）は起用の理由を問われて語った。閣僚は安倍政権で文部科学相を経験しただけだった。「首相に迷惑をかけたくない」。謙遜する松野の姿勢はおよそ辣腕で鳴らした官房長官時代...,政治,敵つくらぬ内閣の番頭、首相・安倍氏が重用　松野博一,https://www.nikkei.com/article/DGXZQOUA060YL0W1A201C2000000/
12/22/2021,日本経済新聞社がまとめた2021年度の設備投資動向調査（21年10月末時点の修正計画）で、主な中部企業の設備投資は20年度実績と比べて16.2%増える見通しだ。4月末の当初計画に比べて0.3ポイント上昇した。供給不足が長期化する半導体向け投資や鋼材価格の高騰を受けて電気炉の更新費用を積み増す企業が目立った。集計対象の中部企業91社の10月30日時点の計画をまとめた。製造業は前年度比11.7%増、...,中部,中部の21年度設備投資、半導体や電炉で16%増　本社調べ,https://www.nikkei.com/article/DGXZQOFD07B7B0X01C21A2000000/
12/22/2021,東京都は22日、新型コロナウイルスの感染者が新たに40人確認されたと発表した。直近1週間平均の新規感染者は約28人で、前週（約19人）比で148.2%だった。都内の感染者は累計38万2642人となった。重症者は前日と変わらず3人。新たに1人の死亡が確認され、累計の死者数は3173人になった。新規感染者を年代別にみると、30代が11人と最も多く、20代が7人、40代が6人で続いた。65歳以上の高齢者は6人だった。,新型コロナ,東京都、新たに40人感染　7日平均で前週の148.2%,https://www.nikkei.com/article/DGXZQOCC220GL0S1A221C2000000/
12/22/2021,日本維新の会は22日、国会内で党改革PTの初会合を開き、来年夏の参院選の獲得議席目標を最低12議席とすると確認した。改選の6議席から倍増をかかげる。次期衆院選は「野党第1党」をめざす。2023年4月の統一地方選挙では地方議員600人とした。大阪以外の地方議員の数を倍増し、全国政党への脱皮をはかる。藤田文武幹事長は会合後の記者会見で「高い目標を掲げてやりたい。野党から自公政権の過半数割れを目指していきたい」と強調した。「本当に戦える組織、中長期的に戦える組織を作っていく」とも述べた。,政治,維新、参院選で目標「12議席」,https://www.nikkei.com/article/DGXZQOUA2272C0S1A221C2000000/
12/22/2021,森永乳業はイチゴミルクの大福のような味わいのバーアイス「いちごみるく大福バー」を2022年1月4日に数量限定で発売する。もっちりとした食感のミルクアイスの中に、粒状にした餅とイチゴソースを取り入れた。SNS（交流サイト）で写真映えするスイーツとして、フルーツ大福が注目されており、20～30代の需要を取り込む。クリーム仕立てのミルクアイスに、粒状の餅と甘酸っぱいイチゴソースを合わせ、イチゴミルクの大福のような味わいを実現した。パッケージのデザインは市松模様を基調とし、正月らしさを演出した。内容量は80ミリリットルで、希望小売価格は171円。全国のコンビニエンスストアで販売する。,サービス・食品,森永乳業、イチゴミルク大福のバーアイス,https://www.nikkei.com/article/DGXZQOUC223600S1A221C2000000/
12/22/2021,【大連=渡辺伸、北京=川手伊織】中国政府が2022年の正月や春節（旧正月）休暇の帰省や旅行を控えるよう呼びかけるなど、新型コロナウイルスの感染動向に神経をとがらせている。まん延を防ぐ具体策は地方政府が策定しており、北京市は1人でも感染が確認された地域からの入域を厳格に制限する。人の移動や消費が鈍り、経済の重荷となるのは避けられない。中国の正月休暇は22年1月1日～3日、2月1日の春節を挟んだ休暇は1月31日～2月6日となる。国務院（政府）は20日に発表した2つの休暇を巡る新型コロナ対策で、感染動向に応じて地域ごとのリスクを「低中高」に分類。市中感染者が多い「中・高リスク地域」の住民は他の地域へ不要不急の移動をしないよう求めた。やむを得ず移動する時は、48時間以内に検査したPCRの陰性証明書の持参を義務付けた。縁日や芸術系のイベント、販売・展覧会などの開催も厳しく制限する。会議もなるべくオンラインで開くよう要求した。家族や親族の宴会などの集まりは10人以下にとどまるよう推奨した。さらに詳細な具体策は、地方政府が地域の実情に応じて策定する。「休暇時の帰省や旅行の自粛要請は全国一律ではできない」（国家衛生健康委員会）ためだ。最も厳しい措置をとるのが首都・北京市だ。直近14日以内に感染者が1人でも発生した地域からの北京入りが厳しく制限される。天津市や河南省鄭州市、江西省南昌市は「中・高リスク地域」からの来訪者に対して、海外からの入国者と同じように2～3週間の隔離を義務付ける。東北部の大連市も、感染者が1人でも出た地域からの訪問者に対し2週間の隔離を必須としている。地方政府が厳しい措置をとる背景には、国家の威信がかかる2月の北京冬季五輪を目前にして感染が広がると責任を問われる恐れがあるためだ。今夏の感染拡大時には江蘇省南京市や湖南省張家界市の幹部が対応の遅れを理由に処罰を受けた。大連市でも11月の感染拡大で幹部らが処分された。中国は感染者を徹底的に抑え込む「ゼロコロナ」政策をとるが、局地的な感染拡大が止まらない。7月以降にはデルタ型が広がった。共産党系メディアの健康時報によると、新たな変異型「オミクロン型」の感染者も18日時点で、中国本土で7人が確認された。各地方政府とも隔離などで対応するとしているが、実際には地域をまたぐ移動はしづらくなる。春節は中国人にとって家族などと過ごす大切な休暇で、例年、大規模な人の移動がみられてきた。コロナ禍前は春節前後40日間の旅客数が延べ30億人程度だった。政府の呼びかけで帰省の自粛が広がった今年は8億7000万人と20年比で4割減で、コロナ禍前の水準と比べて7割減だった。経済活動が鈍り、春節がかき入れ時の飲食業や小売業、旅行業は打撃を受けた。春節期間中の旅行収入も新型コロナ前の19年の6割弱にとどまった。,中国・台湾,中国、国内移動でも隔離　年始・春節のコロナ規制強化,https://www.nikkei.com/article/DGXZQOGM219JT0R21C21A2000000/
12/22/2021,日本郵政は22日、傘下の日本郵便の郵便局長らが顧客向けカレンダーを政治活動に流用していた問題を巡り、弁護士らで構成する外部調査チームの調査結果を公表した。日本郵便がカレンダーを購入したことは、企業に政治活動に関する寄付を禁じる政治資金規正法に抵触しないと結論付けた。カレンダーが政治活動に流用されることを日本郵便幹部が認識していなかったことなどを理由とした。日本郵便は、顧客への年末年始の贈答品として郵便局長らにカレンダーの購入を認めている。旧特定郵便局長らでつくる任意団体で、自民党の有力な支援団体として知られる「全国郵便局長会」は、このカレンダーを特定の国会議員の支援者に配布するよう指示。一部の郵便局長は2018年度から20年度にかけて、会社業務と政治活動を区別することなく戸別配布した。〔共同〕,社会・調査,日本郵便、規正法抵触せず　カレンダー流用で調査報告,https://www.nikkei.com/article/DGXZQOUE228ND0S1A221C2000000/
12/22/2021,ノルディックスキーの吉田杯ジャンプ大会は22日、北海道の名寄市ピヤシリシャンツェ（ヒルサイズ=HS100メートル）で行われ、女子は17歳の葛西春香（北海道・東海大札幌高）が93.5メートル、94.5メートルと好ジャンプを2本そろえて計234.0点で優勝した。中山和（北海道・下川商高）が2位、小林諭果（CHINTAI）が3位。男子は岩佐勇研（東京美装）が96メートル、97.5メートルの計256.0点で2連覇し、渡部弘晃（東京美装）が2位、内藤智文（古河市協会）が3位。49歳の葛西紀明（土屋ホーム）は26位だった。男女ともワールドカップ（W杯）メンバーは出場していない。〔共同〕,スポーツ,女子で葛西春V　吉田杯ジャンプ、男子は岩佐連覇,https://www.nikkei.com/article/DGXZQOKC227PY0S1A221C2000000/
12/22/2021,オリックスの吉田正尚外野手が22日、大阪市内の球団施設で契約交渉し、1億2千万円増の年俸4億円プラス出来高払いで更改した。来季からは背番号が「34」から「7」になる。プロ6年目の今季は、終盤に右手首を骨折して110試合の出場にとどまったが、打率3割3分9厘、21本塁打、72打点。2年連続の首位打者に加えて、最高出塁率のタイトルを獲得し、2年連続最下位だったチームを25年ぶりのリーグ制覇に導いた。日本が金メダルに輝いた東京五輪の野球では主力として活躍した。「タフな1年だった。自分自身を見つめ直して、パ・リーグ連覇に貢献できたら」と意気込んだ。また、今月8日に両足関節鏡視下三角骨摘出手術を受けたことを明らかにし「来年はけがなく1年を戦い抜きたい」と語った。（金額は推定）〔共同〕,スポーツ,オリックス吉田正、4億円で更改　来季は背番号「7」に,https://www.nikkei.com/article/DGXZQOKC227T60S1A221C2000000/
12/22/2021,パナソニックは22日、掃除機などを生産するマレーシアの工場の稼働を一時停止したと明らかにした。豪雨により首都クアラルンプール近郊の工場が浸水した。復旧には最短でも1週間程度かかる見通し。ダイハツ工業も同国にある合弁会社の2工場が操業を停止しており、再開日は未定としている。浸水したパナソニックの工場は掃除機や建物の天井扇、換気扇を生産し、東南アジアの周辺国にも出荷している。現在、工場内の設備を点検中だ。ダイハ...,関西,パナソニックとダイハツ、洪水でマレーシア工場一時停止　,https://www.nikkei.com/article/DGXZQOUF226AE0S1A221C2000000/
12/22/2021,中谷元首相補佐官は22日、国会内での会合で香港立法会（議会）の選挙結果に関し「重大な懸念を表したい」と述べた。「香港における大切な自治を大きく後退させ国際社会からも大変強い懸念が出ている」と語った。中国が選挙制度を変更し民主派を事実上排除する仕組みにしていた。中谷氏は公正な選挙の重要性に言及し「国際社会と連携して中国に具体的な改善を求めていきたい」と主張した。,政治,中谷首相補佐官、香港議会選「重大な懸念」,https://www.nikkei.com/article/DGXZQOUA224N90S1A221C2000000/
12/22/2021,楽天は22日、日本ハムから自由契約となった西川遥輝外野手と入団に基本合意したと発表した。西川は今季打率2割3分3厘だったが、24盗塁で4度目の盗塁王を獲得。楽天は盗塁数が4年連続リーグワーストで、29歳で通算311盗塁の走力が補強ポイントに合致した。西川は球団を通じ「心機一転また一からやる。東北を熱く盛り上げたい」とコメントした。西川は昨オフにポスティングシステムを利用して米大リーグ移籍を目指したが、契約に至らず日本ハムに残留し、今季、海外フリーエージェント（FA）権を取得した。日本ハムは来季の契約を提示せず、西川は海外を含めた他球団との交渉が可能となる自由契約選手として公示された。智弁和歌山高から2011年にドラフト2位で日本ハム入団。14年からレギュラーに定着し、16、17年にベストナイン、昨季まで4年連続でゴールデングラブ賞を受賞した。　〔共同〕,スポーツ,楽天、盗塁王の西川獲得　日本ハムを自由契約,https://www.nikkei.com/article/DGXZQOKC2271P0S1A221C2000000/
12/22/2021,楽天の炭谷銀仁朗捕手が22日、仙台市内の球団事務所で契約交渉し、5500万円減の年俸9500万円でサインした。今季は巨人で44試合に出場し7月に楽天に金銭トレードで加入して51試合に出場。「シーズン途中のトレードは評価の仕方や査定が難しいと思うが、巨人と楽天の数字を両方含めてとか、しっかり出してもらえた。十分納得している」と語った。チームの今後の方針も聞き、交渉は約1時間半に及んだ。7月に35歳となる来季へ「年は関係なく常にレベルアップ。もともとスローイングに自信はあったが、ここ数年は数字が悪すぎるので、もう一回見つめ直したい」と話した。（金額は推定）〔共同〕,スポーツ,楽天・炭谷、5500万円ダウン　年俸9500万円,https://www.nikkei.com/article/DGXZQOKC227RC0S1A221C2000000/
12/22/2021,DeNAは22日、オースティン外野手の来季の残留が決まったと発表した。年俸は2億円で、新たに3年契約を結んだ。来日2年目の今季は新型コロナウイルス感染拡大の影響で来日が開幕に間に合わなかったが、107試合に出場し打率3割3厘、28本塁打、74打点。東京五輪にも米国代表で出場し、銀メダル獲得に貢献した。オースティンは球団を通じ「来季も横浜スタジアムで皆さんと会えることをとても楽しみにしている」とコメントした。（金額は推定）〔共同〕,スポーツ,オースティンがDeNA残留　年俸2億円3年契約,https://www.nikkei.com/article/DGXZQOKC226YR0S1A221C2000000/
12/22/2021,【ソウル=細川幸太郎】経営再建中の韓国双竜自動車は22日、中国電気自動車（EV）大手の比亜迪（BYD）と提携すると発表した。BYDから車載電池の供給を受けるほか、EV用車台の共同開発も始める。双竜自は韓国の新興EVメーカーに身売りすることが決まっており、BYDの技術を取り込むEVシフトで生き残りを目指す。EV分野で韓中の自動車メーカーが提携するのは初めてとみられる。双竜自は技術者10人程度をBYDの研究所に派遣して共同研究を進めてきた。今後は提携の幅を広げて、BYDと共同開発した新型EVを2023年に量産する計画だ。双竜自は「EVの開発期間を短縮でき、エコカーへの転換に弾みがつく」としている。経営危機が続いた双竜自は21年10月にエジソン・モーターズに約300億円で買収されることが決まり、現在は買収完了に向けて最終手続きを進めている。エジソン傘下でEVを主軸とする方針を示しており、BYDとの提携で新車開発の道筋をつけたい思惑もある。双竜自は9月に初のEVとなる小型多目的スポーツ車（SUV）「コランドeモーション」を発表し、ドイツや英国など欧州に出荷を始めた。同モデルはLGエネルギーソリューションの電池を搭載していたが、23年の新モデルからはBYD製に切り替えるという。,カーボンゼロ,韓国双竜自動車、中国BYDと提携　EVを共同開発,https://www.nikkei.com/article/DGXZQOGM223E90S1A221C2000000/
12/22/2021,陸上女子長距離で五輪に4大会連続出場した福士加代子（39）が22日、来年1月で現役を引退する意向を明らかにした。1月16日の全国都道府県対抗女子駅伝を走った後、30日の大阪ハーフマラソンを最後に第一線を退く。所属するワコールのホームページで発表した。福士は青森県出身。長く日本の女子長距離界の第一人者として活躍し、五輪は2004年アテネから北京、ロンドンと3大会連続でトラック種目に出場。16年リオデジャネイロ五輪ではマラソンを走り、14位だった。13年世界選手権のマラソンでは3位に入った。福士は「あと2つのレースを今までと変わらず、全力で楽しんで走りたい」と記した。〔共同〕,スポーツ,福士加代子が現役引退へ　1月の大阪ハーフマラソンで,https://www.nikkei.com/article/DGXZQOKC227EH0S1A221C2000000/
12/22/2021,来季の所属先が注目されているサッカーの元日本代表FWで、54歳の三浦知良（横浜FC）が22日、年内には所属チームを決める方針を明らかにし「やはり一番、試合に出られると感じられるチームを選びたい。10年、20年後ではなく近い将来の目標があるところに行かせていただきたいなと思う」と語った。三浦は横浜FCから契約延長の打診を受けているが、出場機会を求めて移籍も視野に入れている。J2琉球、J3のYS横浜、日本フットボールリーグ（JFL）の鈴鹿ポイントゲッターズ、FC大阪、高知ユナイテッドなど8チームが獲得に乗り出している。22日は大阪府内で行っていた自主トレーニングを打ち上げ「いい環境で、天気にも恵まれた。とてもいいキャンプになった」と語った。〔共同〕,スポーツ,カズ、年内に所属チーム決定へ　出場機会求め移籍も,https://www.nikkei.com/article/DGXZQOKC227IH0S1A221C2000000/
12/22/2021,【ニューヨーク=共同】米プロフットボールNFL第15週最終日は21日、各地で行われ、ラムズが20-10でシーホークスを下し、10勝4敗とした。シーホークスは5勝9敗。イーグルスは27-17でワシントンに勝って7勝7敗で、ワシントンは6勝8敗となった。,スポーツ,ラムズ、シーホークス下し10勝目　NFL,https://www.nikkei.com/article/DGXZQOKC226OX0S1A221C2000000/
12/22/2021,サッポロビールは22日、36億円を投じてチューハイの生産能力を倍増させると発表した。仙台工場（宮城県名取市）に製造ラインを新設し、2023年10月に稼働する予定だ。チューハイの国内市場は2桁増が続き、同社の21年の販売数量も過去最多となる見通しで、さらなる成長に向けた投資に踏み切る。仙台工場のビール類の製造ラインを22年8月から順次停止し、チューハイの製造設備に切り替える。ビール類は足元では業務用の回復で需要が高まっているが、長期的には需要は大きく伸びないとみて、成長が続くチューハイに投資を集中する。サントリーホールディングスによると、缶チューハイなど蓋を開けてすぐに飲めるレディー・トゥー・ドリンク（RTD）の市場は、20年に2億5659万ケース（250ミリリットル24本換算）と19年比で12%増え、過去最高となった。サッポロも主力の「サッポロ　濃いめのレモンサワー」が10月時点で年間販売計画の380万ケースを突破するなど好調に推移している。,サービス・食品,サッポロ、チューハイ生産能力倍増　36億円で新ライン,https://www.nikkei.com/article/DGXZQOUC226K70S1A221C2000000/
12/22/2021,【NQN香港=須永太一朗】22日の中国・上海株式相場は小幅に反落した。上海総合指数の終値は前日比2.5073ポイント（0.06%）安の3622.6178だった。国内で新型コロナウイルスの感染が拡大。行動規制も実施されており、リスク回避目的の売りが出た。指数は前日終値を上回る場面も目立った。減速する中国景気の下支えのため、中国当局が追加の政策を打ち出すとの期待が続いた。短期金融市場で企業の資金調達...,上海株式相場,上海株大引け　小反落、リスク回避の売り　政策期待は支え,https://www.nikkei.com/article/DGXZASFL22HL5_S1A221C2000000/
12/22/2021,後藤茂之厚生労働相は22日、大阪府で確認された新型コロナウイルスの新たな変異型「オミクロン型」の感染者3人について「市中感染に該当する事例として受け止...,新型コロナ,大阪の感染者3人「市中感染に該当」　厚労相が見解,https://www.nikkei.com/article/DGXZQOUA227SO0S1A221C2000000/
12/22/2021,【NQNシンガポール=今　晶】22日の日経アジア300指数は続伸している。16時時点は前日比0.27%高の1686.91だった。新型コロナウイルスの変異型「オミクロン型」の重症化への懸念がいったん後退し、前日の米株式相場が上昇。リスクをとる余裕のできた投資家からの買いがアジア市場にも波及した。指数の上値は重かった。中国本土でコロナ感染者数の拡大を不安視する見方があるほか、タイとシンガポールが隔離...,アジア株概況,アジア300指数・16時　続伸、米株高が波及　コロナ規制強化への懸念が重荷,https://www.nikkei.com/article/DGXZASFL22HKW_S1A221C2000000/
12/22/2021,欧州各地でガス価格が過去最高値に急騰するなか、液化天然ガス（LNG）を積んでアジアへ向かっていた船が、大幅なプレミアム（上乗せ）を払う用意のある欧州の消費者に供給するために航海の途中で進路を変えている。今年はおおむね、電力を生産するために発電所で使われるLNGの出荷を巡り、中国や日本、韓国のバイヤーが欧州勢より高い値段をつけて供給を確保してきた。だが、アジア各地で貯蔵タンクが満杯になった今、大...,FT,[FT]LNG船、航海途中で欧州へ進路変更　上乗せ金高額に,https://www.nikkei.com/article/DGXZQOCB224N50S1A221C2000000/
12/22/2021,政府は22日、2022年度から公立小学校の高学年で本格導入される「教科担任制」の推進に向け、教員を950人増やす方針を決めた。末松信介文部科学相と鈴木俊一財務相が、同日の閣僚折衝で合意した。末松氏は折衝後の記者会見で「教育のさらなる質の向上や学校の働き方改革を実現するため、小学校の教科担任制を推進することが重要だ」と強調した。教科担任制は、教科ごとに決まった教員が教える仕組み。クラス担任がほぼ全ての教科を教える「学級担任制」と比べ、教員1人当たりの受け持ち授業数を軽減できるとして、働き方改革につながると期待されている。文科省は22年度から小学5、6年生の「英語」「算数」「理科」「体育」を対象に本格導入を計画し、4年間で8800人程度の教員増を目指していた。財務省は中学校教員が小学校でも教えるなどの工夫を求め、4年間で3800人程度増やす計画にすることで折り合った。今回の合意により教員の授業数は週3.6コマ減る見通しだ。,教育,「教科担任制」で教員950人増　22年度公立小、政府決定,https://www.nikkei.com/article/DGXZQOUE223Y60S1A221C2000000/
