11/19/2021,来年夏に開催を予定しているパラ陸上の世界選手権神戸大会が2024年春に再延期の方向で調整されていることが19日、関係者への取材で分かった。新型コロナウイルスの影響や、日本の夏の暑さなどを理由に、世界パラ陸連から打診があったという。当初は21年夏開催の予定だったが、東京パラリンピックの1年延期に伴い、22年8月26日に開幕する日程に延期となっていた。神戸大会の組織委員会は12月1日に総会を開き、延期を受け入れるかどうかを決議する。パラ陸上の世界選手権は約100カ国・地域から参加予定で、障害者スポーツの国際大会ではパラリンピックに次ぐ規模となる。東京パラリンピックの翌年に国内で初開催することで、レガシー（遺産）につながるとして注目されていた。〔共同〕,スポーツ,世界パラ陸上・神戸大会、再延期か　24年春に,https://www.nikkei.com/article/DGXZQOKC194IM0Z11C21A1000000/
11/19/2021,生体画像解析のLiquid（リキッド、東京・千代田）は2022年1月から顔認証システム「eKYC」のクラウドデータを活用した顔認証サービスの提供を始める。身元確認が済んだデータと照合することで当人認証のセキュリティーを強固にする。「LIQUID Auth（リキッドオース）」の提供を始める。リキッドは、オンラインで契約をしたり口座を開設したりする際に顔写真と運転免許証など本人確認書類を照合するサー...,スタートアップ,リキッド、顔認証をeKYCのデータと照合,https://www.nikkei.com/article/DGXZQOUC188SV0Y1A111C2000000/
11/19/2021,三井金属は19日、亜鉛の国内相対取引の目安となる建値を3...,商品ニュース,亜鉛建値3000円下げ、三井金属,https://www.nikkei.com/article/DGXZQOUC191MT0Z11C21A1000000/
11/19/2021,【上海=土居倫之】中国人民銀行（中央銀行）が短期金融市場の公開市場操作（オペ）で市中銀行への資金供給を増額している。売却条件付き債券購入（リバースレポ）による1日の供給額を500億～1000億元（9000億～1兆8000億円）に増やした。中国政府は中国恒大集団問題の直撃で下振れする景気を支援するためインフラ投資を活発化したい考え。米欧や他の新興国が利上げに向かうのとは逆に、実質、緩和的な金融政策に...,金融政策,中国市場、緩和マネーが支え　短期資金1日3兆円規模も,https://www.nikkei.com/article/DGXZQOGM176400X11C21A1000000/
11/19/2021,萩生田光一経済産業相は19日の閣議後の記者会見で、ガソリンの値上げを抑える補助金について「関係団体と連携し、価格が抑制されているか監視する」と述べ、給油所での小売価格の動向を注視する考えを示した。補助金を受け取る石油元売り会社が卸値を下げても、小売価格は給油所が自由に決められ、価格抑制効果を疑問視する声が出ているためだ。ガソリンにかかる税金を一時的に引き下げる「トリガー条項」の凍結解除に関しては「（小売価格が）3カ月連続で1リットルあたり160円以上にならないと解除できない。仮に臨時国会で（法改正して）解除しようとなっても、効果が出るのは来年2～3月だ」と指摘し、移動の多い年末年始に間に合わないとの認識を示した。脱炭素をめざす政策と逆行するとの指摘には「国民が生活に苦労しているので、目の前のこととして解決していく。これからガソリンにどんどん補助金を入れていくというものではない」と時限的な措置であることを強調した。ガソリン価格の上昇幅を抑える補助金は19日決定する経済対策に盛り込み、年末年始から2022年3月までの実施を念頭に置く。経産省は小売価格（全国平均）が基準を超えた場合に元売りに補助金を支給し、その分を値引きして給油所に卸してもらい、小売価格の伸びを抑えたい考えだ。検討中の案では1リットルあたり170円を超えた場合に5円を上限に抑制する。【関連記事】,経済,給油所の小売価格を監視　経産相、ガソリン補助金巡り,https://www.nikkei.com/article/DGXZQOUA192700Z11C21A1000000/
11/19/2021,【ワシントン=清水孝輔】北米3カ国首脳会談（北米サミット）が18日、米首都ワシントンで開かれた。バイデン米大統領とカナダのトルドー首相、メキシコのロペスオブラドール大統領が会談した。新型コロナウイルス対策などで連携を強化することで合意した一方、メキシコが進める電力市場の改革や米国の電気自動車（EV）の優遇策など対立する政策も浮き彫りとなった。会談では新型コロナやサプライチェーン、移民問題などが議題に挙がった。新型コロナのワクチン普及や気候変動への対策では連携を深める。米ホワイトハウスは18日、3カ国が連携して中南米・カリブ海諸国にワクチンを提供するほか、メタンガスや二酸化炭素（CO2）の排出量を削減する方針で一致したという声明を発表した。一方で米国とカナダ・メキシコが対立する点も多い。米国はメキシコ政府による電力業界への管理を強める憲法改正案に反発している。メキシコのエブラルド外相は会談後の記者会見で「ロペスオブラドール大統領が言及したが、主要な議題ではなかった」と述べており、今回の会談では溝は埋まらなかったようだ。米国による国産EVの優遇案に対してはメキシコ・カナダが反発している。バイデン政権と民主党はEV購入に補助金を出すほか、従業員が労組に加盟する工場で生産したEVの購入者の所得税を控除するEV普及案を掲げた。カナダは米国・メキシコ・カナダ協定（USMCA）に違反すると主張しているが、サキ大統領報道官は18日に「そうは見ていない」と述べた。北米サミットの開催は5年ぶり。前回は2016年にカナダの首都オタワで開かれた。バイデン氏とロペスオブラドール氏にとっては今回が初めての北米サミットだった。北米3カ国の首脳会談に合わせてそれぞれ2カ国同士の首脳会談も実施した。次回の北米サミットは22年にメキシコで開かれる見通しだ。,北米,北米サミット、一部の政策巡り対立　コロナ対策では連携,https://www.nikkei.com/article/DGXZQOGN18DY30Y1A111C2000000/
11/19/2021,19日後場寄り付きの東京株式市場で、日経平均株価は前日比150円超高い2万9700円台半ばと、きょうの高値を付ける場面があった。半導体関連株を中心とした物色が続いているほか、日本時間19日午後の米株価指数先物が上げ幅を広げたのが支援材料だ。前引け後の東証の立会外で、国内外の大口投資家が複数の銘柄をまとめて売買する「バスケット取引」は約75億円成立した。12時45分現在の東証1部の売買代金は概算で1兆5788億円、売買高は6億6373万株だった。太陽誘電やDOWA、三井物が上昇。半面、コマツやNEC、大平金が売られている。〔日経QUICKニュース（NQN）〕,国内株概況,東証後場寄り　高値圏　米株価指数先物が上昇,https://www.nikkei.com/article/DGXZASS0ISS14_Z11C21A1000000/
