3/19/2022,"Berkshire Hathaway (BRK-A, BRK-B) CEO Warren Buffett, the 91-year-old Oracle of Investing, has seen just about every type of market. In 1999, at the height of the internet bubble, Buffett warned that investors expected unrealistic returns. In October 2008, the immediate aftermath of the worst financial crisis since the Great Depression, Buffett dismissed concerns about ""the long-term prosperity of the nation’s many sound companies."" In turn, Buffett has a phrase that captures exactly what the market is experiencing right now, says venture capitalist Adam Dell, the founder and CEO of a new investing platform called Domain Money. Despite ups and downs in the market, its prospects remain bullish in the long run, especially for tech and cryptocurrencies, Dell said. ""Market volatility is one of the things that is inherent in our market,"" says Dell, who spoke to Yahoo Finance on Jan. 25, well before the Federal Reserve raised its benchmark interest rate on Wednesday. ""Whenever you have such a large inflow of capital into a discrete number of assets, you're going to have significant swings."" ""As Warren Buffett likes to say, 'The market is a voting machine in the short term and a weighing machine in the long term,"" adds Dell, the brother of Dell (DELL) CEO Michael Dell. The three major indexes have climbed in recent days since the Federal Reserve announced a 0.25% hike of its benchmark interest rate. But each has fallen at least 5% since the outset of this year, a rocky start to 2020 that has seen volatility befall markets amid persistent inflation and lingering COVID-19 disruptions. In early trading on Friday morning, the Dow Jones Industrial Average (^DJI) and S&P 500 (^GSPC) fell slightly while the Nasdaq (^IXIC) ticked up. Since 1965, Buffett has built textile company Berkshire Hathaway into a giant holding company, along the way popularizing the strategy of “value investing,” which identifies stocks trading at a price lower than their book value, and patiently waits for them to rise. Late last month, Berkshire Hathaway reported almost $90 billion in profit over the course of 2021. In his annual letter to shareholders, Buffett pointed to ""four giants"" that have driven the company's success: its insurance operations, BNSF, Berkshire Hathaway Energy and its stake in Apple. Dell, who departed Goldman Sachs last year after leading its online-only bank Marcus, echoed Buffett's signature long-term focus as he highlighted promising trends in tech and cryptocurrency. ""As I look at the long term trends, some of the free cash flow sources that are being spit out of some of the larger tech names, I'm quite bullish on their prospects going forward,"" he says. ""As it relates to cryptocurrencies, where we're focused, I look at the fundamental underlying components of blockchain technologies and their contribution to our financial markets,"" he adds. Read more: Russian energy has West in ‘stranglehold’: Bill Browder AOC: Corporate 'price gouging' is fueling inflation Whistleblower Frances Haugen: Meta’s stock plummeted because it lied about ‘value of the company’ Read the latest financial and business news from Yahoo Finance Follow Yahoo Finance on Twitter, Facebook, Instagram, Flipboard, LinkedIn, and YouTube",Business/Yahoo Finance•10 hours ago,The Warren Buffett phrase that defines the market right now: Adam Dell,https://finance.yahoo.com/news/the-warren-buffett-phrase-that-defines-the-market-right-now-adam-dell-144826420.html
3/19/2022,"A Thursday tweet from Tesla CEO Elon Musk seems to be helping the stock. All it says is “working on Master Plan Part 3,” but people who follow the electric-vehicle company know exactly what Musk is talking about. Part 3 of the master plan would follow Part Deux, published in 2016, and Part 1, written by Musk in 2006.",Business/Barrons.com•7 hours ago,Tesla CEO Elon Musk Is Working On Master Plan 3. The Stock Is Jumping.,https://finance.yahoo.com/m/6790dca8-413e-308b-b9e0-1ce0b72add96/tesla-ceo-elon-musk-is.html
3/19/2022,"Warren Buffett is right to be devouring shares of oil giant Occidental Petroleum (OXY), says one long-time oil markets strategist. The billionaire investor's Berkshire Hathaway (BRK-A, BRK-B) scooped up another 18.1 million shares of Occidental for close to $1 billion this week. The latest purchases come hot on the heels of Berkshire spending $6 billion or so in the prior two weeks to buy up Occidental shares. Berkshire now owns nearly 14.6% of Occidental Petroleum through his roughly 140 million shares. Energy expert and portfolio manager Rob Thummel of Tortoise Capital says there is more behind Buffett's buying binge than a play on elevated oil prices. ""Occidental is benefiting from the higher oil prices. The other factor a lot of energy companies are doing that is changing the game for energy companies and how investors perceive them, is that Occidental has actually embraced the energy transition and participating in it,"" Thummel said on Yahoo Finance Live. ""You'll hear them talk a lot of about carbon capture. When you combine the energy security that Occidental can provide, plus the energy transition that they are participating in, that has become a more compelling story for energy investors going forward."" Thummel says he doesn't own any shares of Occidental. Occidental's stock price has responded as one would expect when a whale like Buffett gets involved. Shares have skyrocketed 43% in the past month compared to the relatively unchanged S&P 500, per Yahoo Finance Plus data. During that same span, shares of oil majors ExxonMobil and Chevron are up 1% and 19%, respectively. Occidental will hold a key investor day on March 22. To be sure, Buffett will likely be listening very closely. Brian Sozzi is an editor-at-large and anchor at Yahoo Finance. Follow Sozzi on Twitter @BrianSozzi and on LinkedIn. Read the latest financial and business news from Yahoo Finance Follow Yahoo Finance on Twitter, Facebook, Instagram, Flipboard, LinkedIn, YouTube, and reddit",Business/Yahoo Finance•7 hours ago,Why billionaire Warren Buffett is buying this oil stock,https://finance.yahoo.com/news/why-billionaire-warren-buffett-is-buying-this-oil-stock-182708221.html
3/19/2022,"(Bloomberg) -- It took one of the biggest stock-market routs in Chinese history, but President Xi Jinping may finally be heeding the concerns of international investors. Most Read from Bloomberg Putin Likely to Make Nuclear Threats If War Drags, U.S. Says Biden Team Hardens View of China Tilting to Putin on Ukraine Shock Waves From War in Ukraine Threaten to Swamp Sri Lanka Ukraine Update: Russia Again Shells Western Areas Around Lviv Putin Vows to Rid Russia of ‘Traitors’ While Waging Ukraine War A sweeping set of promises this week from Xi’s government to make regulation more transparent and predictable -- as well as a commitment to overseas markets including Hong Kong -- suggests authorities are appealing to investors abroad. The ruling Communist Party is seeking to regain the trust of international funds and the global business community after the country was lumped in with Russia as an “uninvestable” destination. China has more overtly distanced itself from Russia over the past week, saying it wants to avoid being impacted by U.S. sanctions and promising to “never attack” Ukraine. Xi is set to speak with U.S. President Joe Biden on Friday morning in Washington for the first time since Russia’s invasion. Xi’s shift contrasts with the unbending strategy of his friend President Vladimir Putin, despite global sanctions decimating Russia’s economy. While China still needs to follow through with this week’s pledges, the rhetoric has helped reduce turmoil in the nation’s financial markets. A gauge of Chinese stocks in Hong Kong rebounded at the fastest pace since the 1998 Asian financial crisis. “The market was in freefall -- a clear signal was needed from a senior level to clear the air,” said Victor Shih, an associate professor at the University of California San Diego who researches elite Chinese politics. “I think unclear and even deleterious policy conditions were beginning to create an all-out panic.” In the latest potential shift, Xi pledged at a Politburo meeting to limit the economic impact of the country’s Covid-Zero policy, the first time he has done so during the pandemic. Hong Kong’s leader Carrie Lam on Thursday promised a review of Covid-fighting measures that have spurred a growing exodus from the business community. That came a month after Xi told local officials bringing the omicron outbreak under control was “a mission that overrides everything.” Among other notable developments this week, China’s securities watchdog is considering giving U.S. regulators access to company audits as soon as this year, people familiar with the matter said. This would be Beijing’s biggest concession since Chinese firms first listed in the U.S. more than two decades ago, and may help ease concern about forced delistings. The State Council said a crackdown on internet platform companies would be completed “as soon as possible.” Increased regulation helped wipe as much as $661 billion off Alibaba Group Holding Ltd.’s shares alone since their 2020 peak. The Finance Ministry said it won’t expand a property tax trial this year -- a plan that had been floated in October. China’s cabinet said it would resolve risks around property developers. A liquidity crisis for builders such as China Evergrande Group has weighed on the nation’s property, stock and credit markets for months. Previously, officials described the collapsing value of such firms as a market event which wouldn’t necessitate government intervention. Xi’s government had until now displayed little concern for the rout in Chinese markets. State-directed campaigns like “common prosperity” limited private sector-growth and dragged the MSCI China Index of stocks down 22% last year -- the biggest underperformance versus global shares since 1998. Investors in Chinese junk dollar bonds suffered their worst relative returns in more than a decade. But with Xi set to seek a third term as president in a twice-decade leadership reshuffle later this year, the Communist Party is prioritizing stability above all else. The need for the government to act had been growing more urgent. Global confidence in Chinese financial markets was by some metrics the weakest since the financial crisis in 2008, with stocks cratering, credit plunging and record outflows from government bonds undermining the currency’s strength. Hong Kong’s reputation as an international finance hub has been called into question, after two years of closed borders spurred at least tens of thousands of residents to abandon the city. China’s worst Covid outbreak since Wuhan and Putin’s invasion of Ukraine pose new and unpredictable threats to China’s already slowing economy. Authorities risk a downward spiral in their bursting of a property-market bubble, with the largest developers suffering a 43% year-on-year decline in home sales in the first two months. There’s still plenty that can go wrong for investors. China’s closeness with Russia puts it at the center of increasingly fraught geopolitical tensions. A potential overhaul of Tencent Holdings Ltd.’s payments business and Didi Global Inc.’s delayed Hong Kong listing shows regulators are unlikely to go soft on Big Tech. The central bank’s decision this week to refrain from cutting interest rates served as a reminder that monetary policy will remain prudent. Bulls got burned so many times in the past year that few are convinced the worst is finally over. Markets remain volatile, with the Hang Seng China gauge falling as much as 3.6% on Friday before recovering. Xi’s government has faced collapsing investor confidence before. Heavy-handed intervention in the domestic stock market in 2015 after a bubble burst drew criticism from global funds, who said officials were turning their backs on free-market reforms. A messy devaluation of the yuan the same year spurred capital outflows and raised questions over the competence of China’s oversight of financial markets. In 2018, the CSI 300 Index lost about a quarter of its value in a rout triggered by the Sino-U.S. trade war. Yet each time Xi’s government pushed ahead with plans to further open up China’s capital markets and attract foreign funds. The country’s domestic shares were added to MSCI indexes in 2018, and bonds included in global benchmarks from the following year. Soon, foreign investors couldn’t get enough. Between the start of 2019 and the end of 2021, overseas holdings of local stocks increased by more than 242% to 3.9 trillion yuan ($614 billion). Inflows into the nation’s bond market rose by 129% to 4.1 trillion yuan. Western capital and technology are essential to China, despite recent efforts to make the country more self-sufficient. Foreign direct investment topped 1 trillion yuan last year, with about a third going into high-tech sectors, Chinese Commerce Minister Wang Wentao said this month. The need to ensure global investors are on China’s side is unlikely to end any time soon. “China can not develop in isolation of the world and nor can the world develop without China,” Vice President Wang Qishan said in a speech at the Bloomberg New Economy Forum in November. “China will keep its arms wide open, provide more market investment and growth opportunities to the world.” Most Read from Bloomberg Businessweek Broke Oligarch Says Sanctioned Billionaires Have No Sway Over Putin A Once Radical Idea to Close the Wealth Gap Is Actually Happening Russia’s Brain Drain Becomes a Stampede for the Exits U.S. Work-Permit Backlog Is Costing Immigrants Their Jobs The 18 Minutes of Trading Chaos That Broke the Nickel Market ©2022 Bloomberg L.P.",Business/Bloomberg•17 hours ago,Global Exodus From Chinese Markets Prompts Xi to Change Tack,https://finance.yahoo.com/news/global-exodus-chinese-markets-prompts-074623911.html
3/19/2022,"Gas prices in the U.S. keep going up and up, and Washington's Democrats have found a convenient scapegoat for the pain inflicted on American drivers — Big Oil. President Joe Biden says oil companies “shouldn’t pad their profits” while crude oil prices fall. Meanwhile, Democrats are pushing for a windfall tax on oil profits, and industry CEOs may face a grilling in Congress next month. But halfway around the U.S., the Democratic governor of an important oil-producing state has a different message: Oil companies might have good reason to be wary of amping up production. “I have had several informal discussions and many of them tell me they're not planning on changing their plans. What they need for that is a couple of things,” Colorado Governor Jared Polis said in a new Yahoo Finance Presents interview. First, oil companies need long-term price stability. If a company moves now, it could lose out if prices drop before new oil actually starts flowing. It “could be in six months, it could be in a year,” Polis says of the lag each company has to factor in. The price of oil has indeed been highly volatile in recent years. When many Americans briefly drove less at the onset of the pandemic in 2020, the over-supply briefly turned oil prices negative. That shook up the industry and led to pullbacks on production we still feel today. Even this week, the price of crude oil collapsed and entered bear market territory days after record highs. Aside from price volatility, capital markets could be stopping oil companies from changing course. “There was a bubble of debt that drove oil and gas production a couple years ago and they’re still on the other side of the pendulum,” Polis says. Right now, he added, “They're not interested in debt finance and expansion.” A company like Exxon (XOM) surely remembers investing over the last decade and then posting a net annual loss of $22.4 billion for 2020, the largest in its history. The oil giant survived but many smaller companies failed. In a recent oil bankruptcy report, the Texas law firm Haynes and Boone documented more than 600 industry bankruptcies from 2015 through 2021. Oil companies have plenty of opportunity to drill — including in Colorado, Polis says. “It's not about permitting; it's about deployment of capital,” he says. Some Republican lawmakers, he warned, are “almost echoing Socialist Party lines saying we should order them to do it or make them do it, sort of a centralized command economy.” As of Friday, Americans pay $4.27 for a gallon of gas, near recent highs even as the price of crude oil fell. Colorado — the fifth highest producer of crude oil in the U.S. as of last November — is a bit below average with prices at $3.96 a gallon. Politicians across Washington are focusing on the high prices, blaming both “Putin’s price hike” and supposed oil company profiteering. One liberal group proclaimed the companies ""Price Gouge Consumers After Record-Smashing Year"" in a release on Friday. Oil prices are decreasing, gas prices should too. Last time oil was $96 a barrel, gas was $3.62 a gallon. Now it’s $4.31.  Oil and gas companies shouldn’t pad their profits at the expense of hardworking Americans. pic.twitter.com/uLNGleWBly — President Biden (@POTUS) March 16, 2022 For his part, in lieu of trying to pressure oil companies, Polis has handled inflation differently and focused on measures to alleviate prices for his constituents such as cutting government taxes and fees. He favors suspending the federal gas tax, which would knock off 18.4 cents a gallon on gas prices; he aims to provide his constituents with additional relief by cutting state gas taxes. Beyond that, it might be a waiting game. “Look, if prices stay where they are now, there's no question domestic production will step up. But I think what a lot of producers want to see is, 'Is this just a spike in the market?' or 'Is this something that we can count on by the time we get rigs in the ground?'” Polis says. Ben Werschkul is a writer and producer for Yahoo Finance in Washington, DC. Rick Newman contributed reporting. Read the latest financial and business news from Yahoo Finance Follow Yahoo Finance on Twitter, Facebook, Instagram, Flipboard, LinkedIn, YouTube, and reddit.",Business/Yahoo Finance•12 hours ago,Democratic governor warns against 'echoing Socialist Party lines' and forcing Big Oil to drill,https://finance.yahoo.com/news/democratic-governor-warns-against-echoing-socialist-party-lines-and-forcing-big-oil-to-drill-130622783.html
3/19/2022,"Given all that’s happened recently, some people are talking about a recession. What’s that? It’s technically when there are two consecutive quarters (or more) of negative gross domestic product growth. Basically, it’s when the economic engine slows down. Since 1980, we’ve had six recessions. We aren’t there yet. But if we do get there, don’t fret too much. In five of the last six recessions, the S&P 500 was up a year later. Plus, it’s possible to succeed in almost all market conditions. I don’t mean there are ways where it’s impossible to lose. Rather, there are some stocks that seem to do quite well in recessions. These kinds of stocks are “durable” – they’re well-established names and tend to pay dividends. Let me show you what I mean. Focusing on quality is paramount when markets are under pressure. Using my firm MAPsignals’ database, I’ve filtered for various quality metrics and a history of Big Money investment to identify five stocks that tend to do well in harder economic times: WMT, ABT, JNJ, GIS, & HSY. Up first is Walmart Inc. (WMT), the discount retail giant. Even though great stocks can be choppy, like WMT over the past year, these companies are worthy of attention, especially when they have a tech-oriented growth strategy and huge hiring plans. Check out WMT: 1-month performance (+8.5%) Historical Big Money signals Just to show you what our Big Money signal looks like, have a look at the top buy signals WMT has made over the years in the chart below. Blue bars are showing it was likely being bought by a Big Money player according to MAPsignals. When you see a lot of them, I call it the stairway to heaven: Source: www.MAPsignals.com But, what about fundamentals? As you can see, WMT’s sales and earnings growth rates have held strong, and its earnings growth estimate is appealing: 3-year sales growth rate (+3.7%) 3-year EPS growth rate (+41.0%) 2-year vs. 1-year EPS growth rate estimate (+7.6%) What about WMT in a downturn? Over the last six recessions, its average return is an astounding (+34.4%). Next up is Abbott Laboratories (ABT), the enormous health care company. Check out these technicals for ABT: 1-month performance (-3.4%) Historical Big Money signals Let’s look long-term. These are the top buy signals Abbott has made since 1990. The Big Money love is clear: Source: www.MAPsignals.com Now let’s dive deeper. As you can see, Abbott has had rock-solid sales and earnings growth: 1-year sales growth rate (+24.5%) 3-year EPS growth rate (+44.6%) In the past six recessions, Abbott averaged a (+9.8%) gain. Even better, a year later, its average return was (+13.6%). This stock has handled downturns well in the past. The third growth stock idea is Johnson & Johnson (JNJ), another enormous health care company. Strong stocks usually have Big Money buying the shares. J&J has that. While JNJ has been choppy, it hasn’t fluctuated a lot over the past year. And it’s nice to see the stock has risen recently: 1-month performance (+4.4%) Historical Big Money signals Below are the Big Money signals J&J has made since 1990. That’s the JUICE! Source: www.MAPsignals.com Now let’s look under the hood. J&J’s sales and earnings growth is impressive. Its profitability is strong too and so is its current 2.4% dividend, which help in a recession: 1-year sales growth rate (+13.5%) 3-year EPS growth rate (+13.3%) Profit margin (+22.3%) In the last six recessions, J&J stock rose fives times. Its average return over those recessions is (+12.3%), so it’s a downturn winner for sure. Number four on the list is General Mills, Inc. (GIS), which is a huge food and beverage company with several well-known brand names. Here are the technicals important to me: 1-month performance (-6.2%) Historical Big Money signals Below are the Big Money signals for GIS since 1990. While it’s waned a bit recently, the Big Money has liked General Mills for a long time: Source: www.MAPsignals.com Let’s examine a bit more. General Mills has been growing sales well, is poised to grow earnings, and owns a nice profit margin: 3-year sales growth rate (+4.8%) 2-year vs. 1-year EPS growth estimate (+4.3%) Profit margin (+12.9%) Regardless of the economy, people need food. That has certainly helped GIS in the past six recessions, when it gained in five of them. Its average return over that span is (+15.3%), and it grew more one year and two years later (+14.5% and +28.7%, respectively). Our last recession stock is an easy one to understand, it’s The Hershey Company (HSY), which makes candy and snacks seemingly everybody loves. Check out these technicals: 1-month performance (+1.5%) Historical Big Money signals Hershey has made the MAPsignals Top 20 report many times since 1990: Source: www.MAPsignals.com Now let’s look under the hood. Hershey has been growing sales and earnings, and its profit margin is strong: 1-year sales growth rate (+10.1%) 3-year EPS growth rate (+8.7%) Profit margin (+16.5%) Does candy melt in a recession? No. In the last six recessions, Hershey has gained four times, with an overall average return of (+8.7%). WMT, ABT, JNJ, GIS, & HSY represent top stocks to buy in a recession. Strong fundamentals and historical Big Money buy signals make these stocks worthy of extra attention in tough economic times. To learn more about MAPsignals’ Big Money process please visit: www.mapsignals.com Disclosure: the author holds long positions in WMT in personal accounts.  Contact https://mapsignals.com/contact/ This article was originally posted on FX Empire Binance Backed Blockchain Game Collaborates With Tribe Gaming Gold Prices Move Higher as Yields Consolidate British Pound Gives Up Gains Against Yen Crude Oil Markets Bounce Bitcoin and ETH Print Bullish Pattern, Why AVAX Aims $100 BAYC Floor Prices Touch 90 ETH As ApeCoin Token Lists Today",Business/FX Empire•2 days ago,Best Stocks to Buy in a Recession,https://finance.yahoo.com/news/best-stocks-buy-recession-170856573.html
